ActivityName_lang,Description_lang,ID,CriteriaTreeID,ThresholdContributionAmount,Field_10_1_0_48480_005,Field_10_1_0_48776_006
Derrota a Kokia Pezuña de Fuego en dificultad mítica tras calentar los Estanques de Vida,Derrota a Kokia Pezuña de Fuego tras calentar 4 Estanques de Vida con roca fundida en los Estanques de Vida Rubí en dificultad mítica.,207,145290,100,0,0
Completa circuitos de jinete de dragones en la Caverna Zaralek,"En las Islas Dragón, habla con un vigilante del tiempo bronce en la Caverna Zaralek.",209,145403,100,0,0
Mata jugadores en la Caverna Zaralek,,210,145405,100,0,0
Completa misiones del mundo de duelos de mascotas en la Caverna Zaralek,Completa las misiones del mundo de duelos de mascotas en la Caverna Zaralek con un equipo completo de mascotas de nivel 25.,211,145407,150,0,0
Completa misiones del mundo de escalada en la Caverna Zaralek,,212,145414,100,0,0
Paseo en el tiempo: completa 1 mazmorra de Paseo en el tiempo de Warlords of Draenor,From {EventStartDate} - {EventEndDate} complete Warlords of Draenor Timewalking dungeons.,213,145430,25,0,0
Paseo en el tiempo: completa 1 mazmorra de Paseo en el tiempo de Legion,From {EventStartDate} - {EventEndDate} complete Legion Timewalking dungeons.,214,145441,25,0,0
Paseo en el tiempo: completa 5 mazmorras de Paseo en el tiempo de Legion,From {EventStartDate} - {EventEndDate} complete Legion Timewalking dungeons.,215,145457,100,214,0
Completa una misión de desafío de duelo de mascotas,"Visita la tienda de mascotas de Dalaran, a Tizzy Sacudejuntas en Boralus o a Radek Cierraplomo en Dazar'alor para comenzar un desafío.",216,145477,100,0,0
Espectáculo de fuegos artificiales: utiliza /bailar con los juerguistas,"On {EventStartDate} emote /dance at a reveler in Stormwind, Orgrimmar, and Booty Bay.",217,145546,100,0,-4
Utiliza el juguete medallón de defensor ardiente y mata criaturas,Mata criaturas que otorgan experiencia bajo los efectos del juguete medallón de defensor ardiente en las Islas Dragón.,218,145550,100,0,0
Mata criaturas en el Castillo Quiebrascama o en la Ciudadela Obsidiana,"Mata a criaturas en el Castillo Quiebrascama o en la Ciudadela Obsidiana, que está en las Orillas del Despertar",219,145554,100,0,0
Lumbreras luminosas: compra mermelada,On {EventStartDate} purchase Jelly Jam from Max Megablast in Vashj'ir.,220,145559,120,0,-13
Lumbreras luminosas: compra un dispositivo de propulsión sumergible,On {EventStartDate} purchase a Submersible Propulsion Device from Max Megablast in Vashj'ir.,221,145563,130,0,-13
Lumbreras luminosas: compra una escafandra dañada,On {EventStartDate} purchase a Damaged Diving Helmet from Max Megablast in Vashj'ir.,222,145565,150,0,-13
Utiliza la emoción /frío en un jugador al que haya prendido fuego el juguete paquete de cerillas,Utiliza la emoción /frío en un jugador bajo el efecto del juguete paquete de cerillas.,223,145567,50,0,0
Baile de la Casa de Subastas: utiliza /discrepar con una comerciante enfadada,On {EventStartDate} emote /disagree at an Angry Trader outside of a Stormwind or Orgrimmar Auction House.,224,145569,100,0,-22
Utiliza el juguete paquete de cerillas,"Utiliza el juguete paquete de cerillas en Valdrakken, Iskaara, el Campamento Base Dragontina y Maruukai.",225,145571,100,0,0
Baile de la Casa de Subastas: obtén Ritmo en el cuerpo,On {EventStartDate} gain Happy Feet by being summoned on stage at the Stormwind or Orgrimmar Auction House.,226,145586,100,0,-22
Festival del Fuego del Solsticio de Verano: roba una llama,From {EventStartDate} - {EventEndDate} complete the Stealing Orgrimmar's Flame or Stealing Stormwind's Flame quest.,227,145588,150,0,-2
Utiliza /animar en el puesto comercial,Usa la emoción /animar con los mercaderes del puesto comercial y sus mercancías.,228,145597,20,0,0
Utiliza /animar con la superpandilla de Shellkhan,Utiliza el juguete superpandilla de Shellkhan y usa la emoción /animar con ellos.,230,145600,20,0,0
Utiliza /animar con los dragones Aspecto,Usa la emoción /animar con los dragones Aspecto en Valdrakken.,231,145602,20,0,0
Usa el juguete plantillas de baile aislantes,Utiliza el juguete plantillas de baile aislantes en Valdrakken y en Loamm.,232,145606,50,0,-30
Utiliza /hurra con las plantillas de baile aislantes,Utiliza /hurra con un jugador de la facción opuesta bajo el efecto Pies de llamas del juguete plantillas de baile aislantes.,233,145613,100,0,-30
Completa misiones diarias del Asalto de Fyrakk en los Campamentos de Carga,Completa misiones diarias del Asalto de Fyrakk en los Campamentos de Carga de las Islas Dragón.,234,145702,100,0,0
Utiliza /animar con los caracoles de carreras de Destellorogg,Usa la emoción /animar con los caracoles de carreras en Destellorogg.,235,145736,50,0,0
Utiliza el juguete feliz megafiesta colmillarr,Utiliza el juguete feliz megafiesta colmillarr en Valdrakken y en Loamm.,236,145723,50,0,0
Utiliza el juguete arenas cambiantes,"Utiliza el juguete arenas cambiantes en Valdrakken, en Morqut y en Loamm.",237,145741,50,0,-40
Utiliza /bailar con las arenas cambiantes,Utiliza /bailar con un jugador de la facción opuesta bajo el efecto Arenas cambiantes del juguete arenas cambiantes.,238,145745,100,0,-40
Lanza petardos en las capitales,Utiliza petardos de ingeniería en Valdrakken y Orgrimmar o Ventormenta.,239,145765,50,0,-50
Despoja arquetas en las cavernas de los niffen,Despoja arquetas mientras exploras cuevas junto a un compañero niffen en la Caverna Zaralek.,240,145770,200,0,0
Lanza petardos en mazmorras de Dragonflight,Utiliza petardos de ingeniería en mazmorras de Dragonflight.,241,145788,50,0,-50
Lanza petardos en bandas de Dragonflight,Utiliza petardos de ingeniería en bandas de Dragonflight.,242,145790,50,0,-50
Utiliza el juguete del baile de la Luna Negra,Utiliza el juguete del baile de la Luna Negra en Loamm.,243,145792,50,0,0
Utiliza el juguete juego de té de dragón,"Utiliza el juguete juego de té de dragón en Valdrakken, Iskaara, Morqut y en el Trono Obsidiana.",244,145794,50,0,0
Utiliza el juguete D.I.S.C.O.,Escucha música con el juguete D.I.S.C.O. en Valdrakken y en Orgrimmar o Ventormenta.,245,145801,50,0,0
Feria de la Luna Negra: utiliza /animar con las bandas,From {EventStartDate} - {EventEndDate} emote /cheer at the bands on Darkmoon Faire Island.,246,145810,50,0,0
Consigue desbordamiento elemental,Obtén desbordamiento elemental de criaturas afectadas por las tormentas primalistas.,247,145813,100,0,0
Despoja crisoles de carga del Asalto de Fyrakk en los Campamentos de Carga,Despoja crisoles de carga del Asalto de Fyrakk en los Campamentos de Carga de las Islas Dragón.,248,145855,100,0,0
Descubre las piedras antiguas en la Caverna Zaralek,,249,145857,100,0,0
Recoge piezas de los titanes de Investigadores bajo el fuego,Recoge piezas de los titanes de Investigadores bajo el fuego durante Desastre en el cierre.,250,145862,100,0,0
Usa /olfatear con Myrrit,Usa la emoción /olfatear con Myrrit mientras buscas tesoros en las cuevas de la Caverna Zaralek.,251,145976,50,0,0
Pelea contra los fans entusiasmados en la carrera de caracoles,Pelea contra los fans entusiasmados que interfieren en la carrera de caracoles de Destellorogg.,252,145980,50,0,0
Mata criaturas de Investigadores bajo el fuego,Mata criaturas de Investigadores bajo el fuego en las Ruinas de Drekazera de la Caverna Zaralek.,253,145988,150,0,0
Un Emisario Codicioso: mata goblins del tesoro,"From {EventStartDate} - {EventEndDate} kill treasure goblins in Stormwind, Orgrimmar, or on the Dragon Isles.",254,146252,250,0,0
Consigue reputación con los Niffen de Loamm,,255,146080,100,0,0
Festival del Fuego del Solsticio de Verano: /reverenciar ante un agostizo,From {EventStartDate} - {EventEndDate} emote /bow at a Summer Scorchling or a Festival Scorchling.,256,146088,50,0,0
Gana 1 duelo de mascotas de JcJ,,258,146502,50,0,0
Gana 5 duelos de mascotas de JcJ,,259,146504,100,258,0
Captura una mascota de duelo de rareza inusual,Captura una mascota de duelo de rareza inusual en la Caverna Zaralek.,260,146506,100,0,0
Gana duelos en las Islas Dragón,"Gana un duelo contra otro jugador en Valdrakken, Maruukai y Loamm.",261,146508,100,0,0
Ayuda a Marrullero a ganar la carrera de caracoles,"Los miembros de la Horda ayudan a Marrullero el caracol en las carreras de Destellorogg, en la Caverna Zaralek.",262,146515,100,0,0
Ayuda a Vergoncín a ganar la carrera de caracoles,"Los miembros de la Alianza ayudan a Vergoncín el caracol en las carreras de Destellorogg, en la Caverna Zaralek.",263,146539,100,0,0
Ayuda a Brulee a ganar la carrera de caracoles,"Ayuda a Brulee el caracol en las carreras de Destellorogg, en la Caverna Zaralek.",264,146541,100,0,0
Completa 1 carrera de jinete de dragones en las Islas Dragón,Habla con un vigilante del tiempo bronce en un punto de reunión activo de las Islas Dragón.,265,146543,100,0,0
Prueba de Estilo: consigue 20 fichas de la Prueba de Estilo,From {EventStartDate} - {EventEndDate} earn Trial of Style Tokens by participating in the Trial of Style.,266,146545,20,0,0
Prueba de Estilo: consigue 300 fichas de la Prueba de Estilo,From {EventStartDate} - {EventEndDate} earn Trial of Style Tokens by participating in the Trial of Style.,267,146547,200,61,0
"Prueba de Estilo: completa 2 misiones de ""Cúrratelo""","From {EventStartDate} - {EventEndDate} complete ""Work It"" quests on the Dragon Isles.",268,146549,20,0,0
"Prueba de Estilo: completa 10 misiones de ""Cúrratelo""","From {EventStartDate} - {EventEndDate} complete ""Work It"" quests on the Dragon Isles.",269,146551,180,268,0
Prueba de Estilo: primer puesto,From {EventStartDate} - {EventEndDate} take first place in a Trial of Style competition.,270,146553,150,0,0
Prueba de Estilo: utiliza /sobrecoger con un conjunto ganador,From {EventStartDate} - {EventEndDate} emote /awe at a Winning Outfit display at the Trading Post in Stormwind or Orgrimmar.,271,146559,20,0,0
"Día de las Camisetas Gratis: despoja 1 ""camiseta"" gratis","On {EventStartDate} loot free ""T-Shirts"" in Stormwind or Orgrimmar.",272,146561,50,0,0
"Día de las Camisetas Gratis: despoja 7 ""camisetas"" gratis","On {EventStartDate} loot free ""T-Shirts"" in Stormwind or Orgrimmar.",273,146563,70,272,0
"Día de las Camisetas Gratis: utiliza /cachas con un jugador de la facción opuesta mientras llevas una ""camiseta"" gratis","On {EventStartDate} emote /flex at an opposite faction player while wearing a free ""T-Shirt"".",274,146565,80,0,0
Feria de la Luna Negra: despoja un abalorio de luchador de fosa,From {EventStartDate} - {EventEndDate} loot a Pit Fighter trinket during the Darkmoon Deathmatch on Darkmoon Faire Island.,275,146567,200,0,0
Feria de la Luna Negra: participa en el concierto de los Jabalí de Añublo,From {EventStartDate} - {EventEndDate} participate in the Blight Boar concert on Darkmoon Faire Island.,276,146767,150,0,0
Feria de la Luna Negra: completa 1 carrera de la Luna Negra,From {EventStartDate} - {EventEndDate} complete races at the Darkmoon Boardwalk on Darkmoon Faire Island.,277,146769,50,0,0
Feria de la Luna Negra: completa 4 carreras de la Luna Negra,From {EventStartDate} - {EventEndDate} complete races at the Darkmoon Boardwalk on Darkmoon Faire Island.,278,146774,100,277,0
Paseo en el tiempo: completa 1 mazmorra de Paseo en el tiempo de Burning Crusade,From {EventStartDate} - {EventEndDate} complete a Burning Crusade Timewalking dungeon.,279,146779,25,0,0
Paseo en el tiempo: completa 5 mazmorras de Paseo en el tiempo de Burning Crusade,From {EventStartDate} - {EventEndDate} complete Burning Crusade Timewalking dungeons.,280,146787,100,279,0
Timewalking: Defeat Outland Pet Tamers,From {EventStartDate} - {EventEndDate} defeat Outland Master Tamers.,281,146797,150,0,0
Timewalking: Go Fishing in Outland,From {EventStartDate} - {EventEndDate} fish up items in Outland,282,146803,100,0,0
Completa las tramas de la Guardería Escamitas,Habla con Jyhanna en la Guardería Escamitas de Valdrakken.,283,146806,250,0,0
Brujo: Completa Un tono más claro de vil,Completa las siguientes misiones como brujo:,284,146821,150,0,0
Alcanza la reputación Exaltado con los Arúspices o los Aldor,Alcanza la reputación Exaltado con la facción de los Arúspices o de los Aldor en Shattrath.,285,146834,100,0,0
Completa 1 misión diaria de la Guardería Escamitas,Completa misiones diarias en la Guardería Escamitas de Valdrakken.,286,146921,100,0,0
Completa 5 misiones diarias de la Guardería Escamitas,Completa misiones diarias en la Guardería Escamitas de Valdrakken.,287,146937,100,286,0
Consigue piedras de vuelo,,288,147005,100,0,0
Crea blasones de llama de las Sombras,Consigue fragmentos de blasones de llama de las Sombras y crea cualquier tipo de blasón de llama de las Sombras.,289,147009,150,0,0
Prueba del puesto comercial,Prueba del puesto comercial,290,147073,1000,0,0
Copa de Kalimdor: completa 5 circuitos de jinete de dragones,From {EventStartDate} - {EventEndDate} speak to a Bronze Timekeeper on Kalimdor.,291,147096,100,0,0
Copa de Kalimdor: completa 10 circuitos de jinete de dragones,From {EventStartDate} - {EventEndDate} speak to a Bronze Timekeeper on Kalimdor.,292,147098,150,291,0
Copa de Kalimdor: completa 20 circuitos de jinete de dragones,From {EventStartDate} - {EventEndDate} speak to a Bronze Timekeeper on Kalimdor.,293,147100,200,292,0
Copa de Kalimdor: consigue la apariencia del casco de corredor de draco,From {EventStartDate} - {EventEndDate} purchase the Drake Racer's Helmet from Maztha in Valdrakken.,294,147102,50,0,0
Copa de Kalimdor: utiliza /saludo con lord Andestrasz mientras llevas el equipo de corredor de draco,From {EventStartDate} - {EventEndDate} emote /salute at Lord Andestrasz in Valdrakken while wearing Drake Racer's gear.,295,147104,20,0,0
Copa de Kalimdor: recibe indicaciones de un ayudante de vigilante del tiempo bronce,From {EventStartDate} - {EventEndDate} speak to a Bronze Timekeeper Assistant on Kalimdor for directions to a course location.,296,147106,20,0,0
"Evocador: completa ""Cómo aumentar a un dragón""",Completa las siguientes misiones como evocador Aumento:,297,147108,100,0,0
Completa 2 misiones diarias en el Margen del Eón,"Completa misiones diarias en el Margen del Eón, que está en Thaldraszus.",298,147197,100,0,0
Completa 5 misiones diarias en el Margen del Eón,"Completa misiones diarias en el Margen del Eón, que está en Thaldraszus.",299,147204,100,298,0
Completa 1 falla temporal,"Completa una falla temporal en la Reserva de Tyrhold, que está en Thaldraszus, en las Islas Dragón.",300,147575,50,0,0
Completa 5 fallas temporales,"Completa una falla temporal en la Reserva de Tyrhold, que está en Thaldraszus, en las Islas Dragón.",301,147577,150,300,0
Derrota a Azmerloth,"Derrota a Azmerloth durante una falla temporal en la Reserva de Tyrhold, que está en Thaldraszus, en las Islas Dragón.",302,147579,100,0,0
/alucina con Soridormi,"Utiliza la emoción /alucina con Soridormi en la Reserva de Tyrhold, que está en Thaldraszus, en las Islas Dragón.",303,147581,50,0,0
Consigue la caja de realidad colapsada,"Consigue la caja de realidad colapsada en una falla temporal de la Reserva de Tyrhold, que está en Thaldraszus, en las Islas Dragón.",304,147583,50,0,0
Fiesta de la Cerveza: consigue 100 fichas de la Fiesta de la Cerveza,From {EventStartDate} - {EventEndDate} earn Brewfest Prize Tokens by participating in Brewfest.,305,147728,100,0,0
Fiesta de la Cerveza: consigue 300 fichas de la Fiesta de la Cerveza,From {EventStartDate} - {EventEndDate} earn Brewfest Prize Tokens by participating in Brewfest.,306,147730,100,305,0
Fiesta de la Cerveza: consigue 600 fichas de la Fiesta de la Cerveza,From {EventStartDate} - {EventEndDate} earn Brewfest Prize Tokens by participating in Brewfest.,307,147732,200,306,0
Derrota a Arthas,"Derrota a Arthas durante una falla temporal en la Reserva de Tyrhold, que está en Thaldraszus, en las Islas Dragón.",308,147734,100,0,0
Derrota a Illidan,"Derrota a Illidan durante una falla temporal en la Reserva de Tyrhold, que está en Thaldraszus, en las Islas Dragón.",309,147736,100,0,0
Paseo en el tiempo: completa 1 mazmorra de Paseo en el tiempo de Wrath of the Lich King,From {EventStartDate} - {EventEndDate} complete a Wrath of the Lich King Timewalking dungeon.,310,147759,25,0,0
Paseo en el tiempo: completa 5 mazmorras de Paseo en el tiempo de Wrath of the Lich King,From {EventStartDate} - {EventEndDate} complete Wrath of the Lich King Timewalking dungeons.,311,147770,100,310,0
Paseo en el tiempo: completa 1 mazmorra de Paseo en el tiempo de Cataclysm,From {EventStartDate} - {EventEndDate} complete a Cataclysm Timewalking dungeon.,312,147780,25,0,0
Paseo en el tiempo: completa 5 mazmorras de Paseo en el tiempo de Cataclysm,From {EventStartDate} - {EventEndDate} complete Cataclysm Timewalking dungeons.,313,147788,100,312,0
Fiesta de la Cerveza: mata a Coren Cerveza Temible,From {EventStartDate} - {EventEndDate} kill Coren Direbrew.,314,147798,150,0,0
Día de los Piratas: conviértete en pirata por un día,From {EventStartDate} - {EventEndDate} speak to Dread Captain DeMeza in Booty Bay and become a member of her crew.,315,147800,80,0,0
Día de los Piratas: ¡Vas a necesitar un barco más grande!,"From {EventStartDate} - {EventEndDate} speak to Dread Captain DeMeza in Booty Bay and complete the quest ""You're Gonna Need A Bigger Boat.""",316,147802,80,0,-40
Día de los Piratas: derrota a Harlan Sweete con Pedrín,"From {EventStartDate} - {EventEndDate} speak to Dread Captain DeMeza in Booty Bay to gain Petey, then defeat Harlan Sweete with Petey on your shoulder.",317,147804,80,0,0
Festival de la Cosecha: En honor a un héroe,"From {EventStartDate} - {EventEndDate} speak to Javnir Nashak, outside Orgrimmar, or Wagner Hammerstrike, outside Ironforge, and complete the quest ""Honoring a Hero.""",318,147806,200,0,0
Festival de la Cosecha: usa /reverenciar con un antecesor honrado o un héroe honrado,From {EventStartDate} - {EventEndDate} emote /bow at an Honored Ancestor outside or Orgrimmar or an Honored Hero outside of Ironforge.,319,147809,100,0,0
Secretos de Azeroth: 1 secreto encontrado,From {EventStartDate} - {EventEndDate} complete a Secrets of Azeroth quest or discover a related secret.,320,147811,50,0,0
Renegado: completa la trama de armadura dinástica,"As a Forsaken, complete the following heritage armor quests:",321,147832,100,0,0
Timewalking: Defeat Northrend Pet Tamers,From {EventStartDate} - {EventEndDate} defeat Northrend Master Tamers.,322,147839,100,0,0
Timewalking: Defeat Cataclysm Pet Tamers,From {EventStartDate} - {EventEndDate} defeat Master Tamers in Kalimdor and the Eastern Kingdoms.,323,147845,100,0,0
Secretos de Azeroth: 3 secretos encontrados,From {EventStartDate} - {EventEndDate} complete Secrets of Azeroth quests or discover related secrets.,324,147853,100,320,0
Secretos de Azeroth: 7 secretos encontrados,From {EventStartDate} - {EventEndDate} complete Secrets of Azeroth quests or discover related secrets.,325,147856,150,324,0
Completa un circuito de desafío para jinetes de dragones en las Islas Dragón,Habla con un vigilante del tiempo bronce en las Islas Dragón.,326,147859,25,0,0
Completa 5 circuitos de desafío para jinetes de dragones en las Islas Dragón,Habla con un vigilante del tiempo bronce en las Islas Dragón.,327,147861,50,326,0
Completa 10 circuitos de desafío para jinetes de dragones en las Islas Dragón,Habla con un vigilante del tiempo bronce en las Islas Dragón.,328,147863,50,327,0
Completa 20 circuitos de desafío para jinetes de dragones en las Islas Dragón,Habla con un vigilante del tiempo bronce en las Islas Dragón.,329,147865,100,328,0
Completa 3 sueños lúcidos,Completa eventos de sueño lúcido en las zonas afectadas por el Pico Onírico en las Islas Dragón.,330,147867,50,0,0
Completa 15 sueños lúcidos,Completa eventos de sueño lúcido en las zonas afectadas por el Pico Onírico en las Islas Dragón.,331,147869,100,330,0
Derrota a 3 élites poco comunes potenciados por el Pico Onírico,Derrota a élites poco comunes en la zona actualmente afectada por el Pico Onírico en las Islas Dragón.,332,147871,50,0,0
Derrota a 15 élites poco comunes potenciados por el Pico Onírico,Derrota a élites poco comunes en la zona actualmente afectada por el Pico Onírico en las Islas Dragón.,333,147873,100,332,0
Reúne 100 de coalescencia del Pico Onírico,Reúne coalescencia del Pico Onírico en las actividades de zonas afectadas por el Pico Onírico en las Islas Dragón.,334,147875,100,0,0
Completa la trama de la reconciliación,"Habla con la escamandante Pavethal en Valdrakken para comenzar la misión ""Una única ala"".",335,147877,100,0,0
Paseo en el tiempo: completa una mazmorra de Paseo en el tiempo de Mists of Pandaria,From {EventStartDate} - {EventEndDate} complete Mists of Pandaria Timewalking dungeons.,336,147879,25,0,-40
Paseo en el tiempo: completa 5 mazmorras de Paseo en el tiempo de Mists of Pandaria,From {EventStartDate} - {EventEndDate} complete Mists of Pandaria Timewalking dungeons.,337,145198,100,336,-40
Reúne 250 de coalescencia del Pico Onírico,Reúne coalescencia del Pico Onírico en las actividades de zonas afectadas por el Pico Onírico por las Islas Dragón.,339,149014,150,334,0
Derrota a élites poco comunes potenciados por el Pico Onírico,Derrota a élites poco comunes en la zona actualmente afectada por el Pico Onírico en las Islas Dragón.,340,147886,100,0,0
"Feria de la Luna Negra: completa ""La hora de los martillazos""",From {EventStartDate} - {EventEndDate} complete the quest It's Hammer Time on Darkmoon Faire Island.,341,147895,50,0,0
Feria de la Luna Negra: date una vuelta,From {EventStartDate} - {EventEndDate} ride the Darkmoon Faire carousel or rollercoaster on Darkmoon Faire Island.,342,147897,50,0,0
/baila con un cliente del Tesoro Oculto del Dragón,Utiliza la emoción /bailar con un parroquiano de la fiesta de baile en El Tesoro Oculto del Dragón en Valdrakken.,343,147900,50,0,0
Buscador de bandas: completa una banda con tu sombrero de fiesta rosa,Completa una gesta del buscador de bandas mientras llevas un sombrero de fiesta rosa.,344,147905,50,0,0
Fiesta de la Cerveza: completa 2 misiones de la Fiesta de la cerveza,From {EventStartDate} - {EventEndDate} complete Brewfest quests in the world.,345,147937,50,0,-50
Fiesta de la Cerveza: completa 5 misiones de la Fiesta de la cerveza,From {EventStartDate} - {EventEndDate} complete Brewfest quests in the world.,346,147939,150,345,-50
Gana 1 duelo de mascotas JcJ con mascotas de la familia No-muertos,Gana un duelo de mascotas JcJ utilizando al menos 2 mascotas de la familia No-muerto.,347,148003,50,0,0
Halloween: visita cubos de caramelos con el modo guerra activado,From {EventStartDate} - {EventEndDate} collect Handful of Treats from Candy Buckets around the world while in War Mode.,348,148005,50,0,-60
Cuida tu granja en el Rancho Cantosol,"Labra las tierras del Rancho Cantosol de El Alcor, que está en el Valle de los Cuatro Vientos.",350,148009,50,0,-40
Consigue el oro en 4 carreras de jinetes de dragones en las Islas Dragón,Habla con un vigilante del tiempo bronce en las Islas Dragón.,351,148012,50,0,0
Halloween: visita cubos de caramelos en las Islas Dragón,From {EventStartDate} - {EventEndDate} collect Handful of Treats from Candy Buckets in the Dragon Isles.,353,148016,50,0,-50
Halloween: visita cubos de caramelos en Pandaria,From {EventStartDate} - {EventEndDate} collect Handful of Treats from Candy Buckets in Pandaria.,354,148018,50,0,-50
Halloween: completa 5 misiones diarias de Halloween,From {EventStartDate} - {EventEndDate} visit Stormwind or Undercity to complete Hallow's End daily quests.,355,148020,100,0,-60
Halloween: completa 15 misiones diarias de Halloween,From {EventStartDate} - {EventEndDate} visit Stormwind or Undercity to complete Hallow's End daily quests.,356,148022,150,355,-60
Halloween: derrota repetidamente al Jinete decapitado,From {EventStartDate} - {EventEndDate} defeat The Headless Horseman again and again.,357,148026,100,0,-60
Halloween: derrota al Jinete decapitado con las 4 maldiciones de los hombres de mimbre,From {EventStartDate} - {EventEndDate} defeat The Headless Horseman after accepting all 4 curses from the Wicker Men.,358,148028,100,0,-60
Halloween: muerde manzanas con una máscara de Halloween,From {EventStartDate} - {EventEndDate} bob for apples while wearing a Hallow's End mask.,359,148042,50,0,-60
Feria de la Luna Negra: habla con un espíritu inquieto,From {EventStartDate} - {EventEndDate} talk to a ghost on the Darkmoon Faire island.,360,148056,50,0,-10
Gran Carrera de Gnomeregan: participa en la Gran Carrera de Gnomeregan,On {EventStartDate} join the footrace at New Tinkertown in Dun Morogh.,361,148058,100,0,-30
Fiesta de la Cerveza: participa en una comilona,From {EventStartDate} - {EventEndDate} participate in the Brewfest Chowdown competition near Ironforge or Orgrimmar.,362,148060,50,0,-20
Utiliza /cackle con un jugador renegado,Utiliza la emoción /cackle con un jugador renegado.,363,148065,50,0,0
Completa misiones del mundo de jinetes de dragones en el Confín Olvidado,Habla con un vigilante del tiempo bronce en las Islas Dragón.,364,148098,100,0,0
Completa carreras avanzadas de jinetes de dragones en las Islas Dragón,"Completa carreras avanzadas de jinete de dragones en las Orillas del Despertar, las Llanuras de Ohn'ahra, las Tierras Azures y Thaldraszus.",365,148100,100,0,0
Feria de la Luna Negra: lleva puesta una cabeza de pez a las mazmorras,From {EventStartDate} - {EventEndDate} use the Dungeon Finder tool to complete a dungeon while wearing a Severed Crimsonscale Head or Severed Azurefin Head fished up on the Darkmoon Faire island.,366,148102,100,0,-30
