ActivityName_lang,Description_lang,ID,CriteriaTreeID,ThresholdContributionAmount,Field_10_1_0_48480_005,Field_10_1_0_48776_006
Gran Carrera de Gnomeregan: completa la Gran Carrera de Gnomeregan con un gnomo de nivel 10 o menos que lleve una camisa rosa,On {EventStartDate} join the footrace at New Tinkertown in Dun Morogh as a level 1-10 gnome or mechagnome while wearing a Pink Mageweave Shirt.,367,148104,150,0,-30
"Recoleta 50 hierbas, menas o pieles en las Islas Dragón",,368,148528,50,0,0
"Recoleta 250 hierbas, menas o pieles en las Islas Dragón",,369,148743,100,368,0
Completa 2 de las siguientes misiones del mundo de jinetes de dragones,,370,148532,100,0,0
Gasta 100 p. de vigor volando sobre tu dragón,,371,148542,50,0,0
Gasta 1000 p. de vigor volando sobre tu dragón,,372,148546,100,371,0
"Feria de la Luna Negra: completa ""¡Dispara y marca!""","From 11/5 - 11/11 complete the quest He Shoots, He Scores! on Darkmoon Faire Island.",373,148550,50,0,-30
"Completa una misión de ""Chispas de vida""","Completa una misión de ""Chispas de vida"" en las Islas Dragón.",375,148554,100,0,0
Gana un campo de batalla con un nivel inferior a 70,,376,148556,100,0,0
Gana un duelo de mascotas JcJ con un pavo,Gana un duelo de mascotas JcJ con un pavo en tu equipo.,377,148558,100,0,0
Da de comer a tu mascota una golosina o chuchería,"Da de comer a una mascota de duelo una golosina de mascota feliz, una chuchería para mascotas o una chuchería inferior para mascotas.",378,148560,50,0,0
World Quest Bonus Week: Complete World Quests while in a Party,From {EventStartDate} - {EventEndDate} complete world quests while in a party.,379,148564,100,0,-20
Battleground Bonus Week: Win an Epic Battleground,From {EventStartDate} - {EventEndDate} Win an Epic Battleground.,380,148566,100,0,-50
Dragonflight Dungeon Bonus Week: Complete Heroic Dungeons with Random Players,From {EventStartDate} - {EventEndDate} use the Dungeon Finder tool to complete heroic dungeons with random players.,381,148568,150,0,-80
Llévate a tu hermandad a las mazmorras.,Usa el buscador de mazmorras para completar mazmorras estando en un grupo de tu hermandad.,383,148572,150,0,0
Completa misiones estando en un grupo,,384,148574,100,0,0
Obtén los siguientes beneficios al mismo tiempo,,385,148576,50,0,0
Monta en la montura de otro jugador,,386,148582,50,0,0
Festividad de los Muertos: derrota a un contendiente,From {EventStartDate} - {EventEndDate} purchase a contender's outfit from Chapman and defeat another player who is also in a contender's outfit.,387,148584,100,0,-10
"Festividad de los Muertos: completa la misión ""Los muertos agradecidos""",From {EventStartDate} - {EventEndDate} complete the quest The Grateful Dead which can be found in your race's home city.,388,148586,100,0,-10
"Festival Lechúcico: completa ""Vigilancia de lechúcico lunar""",On {EventStartDate} complete the quest Moonkin Monitoring at Moonglade in Kalimdor,389,148588,150,0,-40
Aniversario de WoW: participa en la Venganza de Korrak,From {EventStartDate} - {EventEndDate} participate in the Korrak's Revenge battleground.,390,148590,100,0,-60
Aniversario de WoW: asesina al Caminante del Destino,From {EventStartDate} - {EventEndDate} kill Doomwalker in Tanaris.,391,148592,100,0,-60
Aniversario de WoW: usa /animar con Leeroy Jenkins,From {EventStartDate} - {EventEndDate} emote /cheer at Leeroy Jenkins in the Caverns of Time.,392,148594,50,0,-60
Aniversario de WoW: completa misiones en un grupo y con un nivel inferior a 20,From {EventStartDate} - {EventEndDate} complete 5 quests while in a party and under level 20.,393,148596,100,0,-60
Festival Lechúcico: asesina enemigos con tu prole del lechúcico lunar,"On {EventStartDate} befriend a Moonkin Hatchling at Moonglade in Kalimdor, then kill 25 XP-granting enemies with your moonkin companion.",394,148609,150,0,-40
Aniversario de WoW: lanza fuegos artificiales en capitales,From {EventStartDate} - {EventEndDate} launch 10 Celebration Fireworks or Fireflights in Stormwind or Orgrimmar.,395,148611,50,0,-60
Generosidad del Peregrino: obtén El espíritu de compartir,From {EventStartDate} - {EventEndDate} eat all of the foods at a Bountiful Table to gain the Spirit of Sharing.,396,148617,50,0,-70
Generosidad del Peregrino: obtén El espíritu de compartir en todas las zonas de las Islas Dragón,From {EventStartDate} - {EventEndDate} eat all of the foods at a Bountiful Table to gain the Spirit of Sharing in each of the following zones.,397,148619,100,396,-70
Generosidad del Peregrino: cocina todas las recetas de Generosidad del Peregrino,From {EventStartDate} - {EventEndDate} cook all of the following Pilgrim's Bounty foods.,398,148638,100,0,-70
Generosidad del Peregrino: completa misiones,From {EventStartDate} - {EventEndDate} complete 5 Pilgrim's Bounty quests.,399,148656,100,0,-70
Generosidad del Peregrino: prueba los sabores de Azeroth,From {EventStartDate} - {EventEndDate} eat one of each of the foods listed below.,400,148660,150,0,-70
Generosidad del Peregrino: cubre a todo el mundo con plumas de pavo,From {EventStartDate} - {EventEndDate} shoot each of the following player races with Turkey Shooters.,401,148674,100,0,-70
Generosidad del Peregrino: ve a cazar pavos con un sombrero de peregrino,"From {EventStartDate} - {EventEndDate}, quickly kill Wild Turkeys in Elwynn Forest, Tirisfal Glades, or Ohn'ahran Plains to gain Turkey Domination while wearing a Pilgrim's Hat.",402,148717,150,0,-70
Aniversario de WoW: gana un duelo de mascotas JcJ con tu nueva mascota,"Del {EventStartDate} al {EventEndDate}, gana un duelo de mascotas JcJ con Mini Alaescarcha en tu equipo.",403,148719,100,0,-60
Mejora objetos usando piedras de vuelo,,404,148721,100,0,0
Completa una mazmorra o campo de batalla aleatorios con tu amigo reclutado o reclutador,Usa el buscador de mazmorras para completar una mazmorra o campo de batalla aleatorio estando en grupo con un amigo reclutado o reclutador.,405,148739,150,0,0
Sube de nivel de cocina clásica,,406,149016,100,0,0
Come en un festín comunitario épico o legendario,"Participa en el festín comunitario de los Colmillarr de Iskaara para aumentar su rareza y, después, ¡cómete una sopa épica!",407,149018,100,0,0
Participa en Fragor de la batalla,,409,149478,50,0,0
Gana 1 camorra de Fragor de la batalla,,410,149481,50,0,0
Gana 5 camorras de Fragor de la batalla,,411,149571,50,410,0
Alcanza el nivel 20,Sube a cualquier personaje hasta el nivel 20.,412,149577,25,0,0
Consigue reputación por las Islas Dragón,,414,149607,70,0,0
Derrota a 5 jefes de banda,,415,149619,50,0,10
Derrota a 20 jefes de banda,,416,149621,100,415,10
Completa 10 misiones,Completa misiones que otorguen experiencia.,417,149633,100,0,0
Completa 25 misiones,Completa misiones que otorguen experiencia.,418,149635,100,417,0
Completa 50 misiones,Completa misiones que otorguen experiencia.,419,149637,100,418,0
Completa 5 misiones del mundo,,420,149639,50,0,0
Completa 10 misiones del mundo,,421,149641,50,420,0
Completa 25 misiones del mundo,,422,149643,100,421,0
Derrota a 25 jefes de mazmorra,Derrota a jefes de mazmorra que otorguen experiencia.,423,149645,100,0,0
Crea un blasón de llama de las Sombras,Consigue fragmentos de blasones de llama de las Sombras y crea cualquier tipo de blasón de llama de las Sombras.,424,149647,30,0,0
Alcanza el nivel 30,Sube a cualquier personaje hasta el nivel 30.,426,149713,25,0,0
Alcanza el nivel 40,Sube a cualquier personaje hasta el nivel 40.,427,149715,25,0,0
Alcanza el nivel 50,Sube a cualquier personaje hasta el nivel 50.,428,149717,25,0,0
Alcanza el nivel 60,Sube a cualquier personaje hasta el nivel 60.,429,149719,25,0,0
Alcanza el nivel 70,Sube a cualquier personaje hasta el nivel 70.,430,149721,25,0,0
Gain Class Levels,Level up on any character.,431,149723,50,0,0
Timewalking: Defeat Broken Isles Pet Tamers,From {EventStartDate} - {EventEndDate} defeat Broken Isles Master Tamers.,432,149987,100,0,0
Timewalking: defeat Burning Crusade Raid Bosses,From {EventStartDate} - {EventEndDate} defeat bosses in Burning Crusade raids.,433,149937,100,0,0
Timewalking: defeat Wrath of the Lich King Raid Bosses,From {EventStartDate} - {EventEndDate} defeat bosses in Wrath of the Lich King raids.,434,149935,100,0,0
Timewalking: defeat Cataclysm Raid Bosses,From {EventStartDate} - {EventEndDate} defeat bosses in Cataclysm raids.,435,149945,100,0,0
Timewalking: defeat Mists of Pandaria Raid Bosses,From {EventStartDate} - {EventEndDate} defeat bosses in Mists of Pandaria raids.,436,149941,100,0,0
Timewalking: defeat Warlords of Draenor Raid Bosses,From {EventStartDate} - {EventEndDate} defeat bosses in Warlords of Draenor raids.,437,149939,100,0,0
Timewalking: defeat Legion Raid Bosses,From {EventStartDate} - {EventEndDate} defeat bosses in Legion raids.,438,149943,100,0,0
Timewalking: Complete Quests in Outland,From {EventStartDate} - {EventEndDate} complete quests in Outland.,439,149951,100,0,0
Timewalking: Complete Quests in Northrend,From {EventStartDate} - {EventEndDate} complete quests in Northrend.,440,149947,100,0,0
Timewalking: Complete Quests in Kalimdor and the Eastern Kingdoms,From {EventStartDate} - {EventEndDate} complete quests in Kalimdor and the Eastern Kingdoms.,441,149957,100,0,0
Timewalking: Complete Quests in Pandaria,From {EventStartDate} - {EventEndDate} complete quests in Pandaria.,442,149953,100,0,0
Timewalking: Complete Quests in the Broken Isles,From {EventStartDate} - {EventEndDate} complete quests in the Broken Isles.,443,149955,100,0,0
"Timewalking: Gather Herbs, Ores, and Skins in Outland","From {EventStartDate} - {EventEndDate} gather herbs, ores, and skins in Outland.",444,149965,100,0,0
"Timewalking: Gather Herbs, Ores, and Skins in Northrend","From {EventStartDate} - {EventEndDate} gather herbs, ores, and skins in Northrend.",445,149959,100,0,0
"Timewalking: Gather Herbs, Ores, and Skins in Kalimdor and the Eastern Kingdoms","From {EventStartDate} - {EventEndDate} gather herbs, ores, and skins in Kalimdor and the Eastern Kingdoms.",446,149974,100,0,0
"Timewalking: Gather Herbs, Ores, and Skins in Pandaria","From {EventStartDate} - {EventEndDate} gather herbs, ores, and skins in Pandaria.",447,149968,100,0,0
"Timewalking: Gather Herbs, Ores, and Skins in Draenor","From {EventStartDate} - {EventEndDate} gather herbs, ores, and skins in Draenor.",448,149962,100,0,0
"Timewalking: Gather Herbs, Ores, and Skins in the Broken Isles","From {EventStartDate} - {EventEndDate} gather herbs, ores, and skins in the Broken Isles.",449,149971,100,0,0
Timewalking: Go Fishing in Kalimdor and the Eastern Kingdoms,From {EventStartDate} - {EventEndDate} fish up items in Kalimdor and the Eastern Kingdoms.,450,149985,100,0,0
Timewalking: Go Fishing in Pandaria,From {EventStartDate} - {EventEndDate} fish up items in Pandaria.,451,149981,100,0,0
Earn Reputation with the Dream Wardens,,452,149756,100,0,0
Pick Dreamfruits in the Superbloom,Gain 10 Dreamfruit powers during Superbloom events in the Emerald Dream.,453,149763,25,0,0
Participate in an Epic Superbloom,Participate in a Superbloom event in the Emerald Dream that earns Epic quality.,454,149765,25,0,0
Plant 15 Dreamseeds in the Emerald Dream,,455,149767,25,456,0
Plant 5 Dreamseeds in the Emerald Dream,,456,149771,25,0,0
Recraft Equipment,Use a crafting profession to recraft equipment at a crafting bench.,457,149775,50,0,0
Complete Dragonriding Courses in the Emerald Dream,Speak to a Bronze Timekeeper in the Emerald Dream.,458,149784,50,0,0
Complete Dragonriding Challenge Courses in the Emerald Dream.,Speak to a Bronze Timekeeper in the Emerald Dream.,459,149786,50,0,0
Complete Reverse Dragonriding Courses in the Emerald Dream,Speak to a Bronze Timekeeper in the Emerald Dream.,460,149788,50,0,0
Slay Players in The Emerald Dream,,461,149795,100,0,0
Loot Rousing Ire,,462,149797,100,0,0
Defeat Dream Pets,Defeat 5 of the following pets found in the Emerald Dream.,463,149799,50,0,0
Catch a Winter Pet,Catch one of the following wintery pets.,464,149801,50,0,0
Be Resurrected,,465,149808,25,0,0
Kill Enemies in the Cold,Slay 30 enemies in one of the following zones.,466,149823,50,0,0
Deal Frost Damage,"Deal a total of 500K Frost damage. Frost damage is commonly dealt by mages, shamans, and death knights.",467,149830,50,0,0
Participate in Superblooms,Participate in 3 Superbloom events in the Emerald Dream.,468,149832,25,0,0
Plant Dreamseeds in the Emerald Dream,,469,149834,25,0,0
Arena Skirmish Bonus Week: Win Daily Arena Matches,From {EventStartDate} - {EventEndDate} win an arena match on four different days.,470,150004,100,0,-65
World Quest Bonus Week: Complete World Quests,From {EventStartDate} - {EventEndDate} complete world quests.,471,149857,50,0,-80
New Year's Eve: Launch Red and Blue Fireworks in Capital Cities,On {EventStartDate} launch 10 Red or Blue Fireworks in Stormwind or Orgrimmar while the fireworks celebrations are happening.,473,149871,100,0,-500
Feast of Winter Veil: Kill 6 Festive Bosses,From {EventStartDate} - {EventEndDate} kill six of the following bosses.,474,149883,50,27,-100
Feast of Winter Veil: Kill 9 Festive Bosses,From {EventStartDate} - {EventEndDate} kill nine of the following bosses.,475,149897,50,474,-100
"Feast of Winter Veil: Slay The Abominable Greench (Twice, To Be Sure)",From {EventStartDate} - {EventEndDate} kill The Abominable Greench the Hillsbrad Foothills. Twice.,476,149911,50,0,-100
[DNT] Complete World Quests during World Quest Bonus Week,[DNT] From {EventStartDate} - {EventEndDate} complete world quests.,477,149857,50,0,-50
Oleada final: completa misiones,"Del {EventStartDate} al {EventEndDate}, completa misiones que otorguen experiencia.",478,149923,150,0,0
Oleada final: completa misiones del mundo,"Del {EventStartDate} al {EventEndDate}, completa misiones del mundo.",479,149925,150,0,0
Complete the Misfit Dragons Storyline,Speak to Wrathion in the Emerald Dream to begin this storyline.,483,150035,50,0,0
Elfo de la noche: completa la trama de armadura dinástica,"As a night elf, complete the following heritage armor quests:",484,150069,100,0,0
Gain Class Levels,Level up on any character.,486,150278,50,0,0
Gain Class Levels,Level up on any character.,487,149723,50,0,0
Feast of Winter Veil: Play with your Winter Veil Gift,"From {EventStartDate} - {EventEndDate}, gain 100 stacks total playing with your new toy or someone else's.",489,151021,200,0,-100
Battleground Bonus Week: Win an Epic Battleground,From {EventStartDate} - {EventEndDate} Win an Epic Battleground.,490,148566,100,0,-150
Have a Snowball Fight,"Hit other players with snowballs, or get hit by theirs! Snowballs can be purchased from Smokeywood Pastures vendors in capital cities.",491,151329,25,0,0
Use the Bronze Dragon Banner Toy,Use the Bronze Dragon Banner toy on the Dragon Isles.,492,151369,50,0,0
/wave at Nozdormu,Use the Bronze Racer's Pennant toy and emote /wave at Nozdormu in Valdrakken.,493,151372,50,0,0
Use the Hourglass of Eternity Toy,Use the Hourglass of Eternity toy at the Temporal Conflux on the Dragon Isles.,494,151374,50,0,0
/flex at a Bronze Timekeerp Assistant,Emote /flex at a Bronze Timekeeper Assistant.,495,151392,25,0,0
Win 5 Pet Battles in Silithus,,496,151396,100,0,0
Use the Bronze Timepiece During a Dragonriding Race.,,497,151400,25,0,0
Call of the Scarab: Kill a Colossus,From {EventStartDate} - {EventEndDate} kill a Colossus in Silithus.,498,151404,50,0,-10
Call of the Scarab: Kill a Colossus at Each Hive,From {EventStartDate} - {EventEndDate} kill a Colossus at each of the Silithid Hives in Silithus.,499,151408,100,0,-11
Call of the Scarab: /taunt at an Opposite Faction Player,From {EventStartDate} - {EventEndDate} emote /taunt at an opposite faction player in Silithus.,500,151412,25,0,-9
Outland Cup: Complete 5 Dragonriding Courses,From {EventStartDate} - {EventEndDate} speak to a Bronze Timekeeper on Outland.,501,151414,100,0,0
Outland Cup: Complete 10 Dragonriding Courses,From {EventStartDate} - {EventEndDate} speak to a Bronze Timekeeper on Outland.,502,151416,150,501,0
Outland Cup: Complete 20 Dragonriding Courses,From {EventStartDate} - {EventEndDate} speak to a Bronze Timekeeper on Outland.,503,151418,200,502,0
