Description_lang,Title_lang,ID,ScenarioID,CriteriatreeID,RewardQuestID,RelatedStep,Supersedes,OrderIndex,Flags,VisibilityPlayerConditionID,WidgetSetID
Has llegado a las ruinas de Falanaar en busca de Verstok y los Colmillos de Crinceniza. Busca pistas sobre el paradero de Verstok.,Al acecho,2506,1108,48239,0,0,0,0,0,0,0
Infórmate sobre Patada del sol naciente.,Una patada en la cara,2511,1095,48409,0,0,0,2,0,0,0
Infórmate sobre Patada oscura.,Patea con saña,2512,1095,48410,0,0,0,3,0,0,0
Infórmate sobre Puños de furia.,Miles de golpes,2513,1095,48411,0,0,0,4,0,0,0
Usa todas tus nuevas facultades contra el muñeco-diana.,Juntar las piezas,2514,1095,48412,0,0,0,5,0,0,0
Infórmate sobre Rodar.,Rodar y rodar,2515,1095,48413,0,0,0,6,0,0,0
Infórmate sobre Vivificar.,¡Revivificado!,2516,1095,67046,0,0,0,7,0,0,0
Usa lo que has aprendido para derrotar a un solo oponente.,Una prueba rápida,2517,1095,49698,0,0,0,8,0,0,0
Usa lo que has aprendido para derrotar a dos oponentes al mismo tiempo.,Desafío por partida doble,2518,1095,49696,0,0,0,9,0,0,0
"El rastro de Verstok conduce a las ruinas, pero la puerta está cerrada. Averigua el modo de abrirla.",Las ruinas no te detienen,2525,1108,48436,0,0,0,1,0,0,0
Meryl está aquí preparándose para el ataque. Habla con él y con Alodi para que comiencen los preparativos.,Preparativos,2526,1122,48439,0,0,0,0,0,0,0
Dale a Nat tus peces furia del Ocaso.,Entrega,2527,1025,48445,0,0,0,2,0,0,0
"Los resguardos de atenuación vil deben colocarse en lugares muy visibles. Lucha hasta llegar a los enclaves elegidos, coloca los resguardos y defiéndelos.",Colocación de resguardos,2528,1122,48461,0,0,0,1,0,0,0
Los resguardos están activados. Es hora de comenzar el ritual. Ve al Altar del Fin de los Tiempos y habla con Meryl Tormenta Vil.,El Altar del Fin de los Tiempos,2529,1122,48463,0,0,0,2,0,0,0
Usa el foco de ritual cuando sea posible para completar el ritual.,El gran ritual,2530,1122,48466,0,0,0,3,0,0,0
Balaadur te ha arrastrado a su reino. Mata al señor eredar.,Enfrentamiento en el reino de la locura,2531,1122,48469,0,0,0,4,0,0,0
Ébano Glacial está cerca del demonio caído. Reclámalo.,Ébano Glacial,2532,1122,48471,0,0,0,5,0,0,0
Sigue el rastro de Verstok a las profundidades del templo.,"Arriba, abajo y para dentro",2533,1108,48476,0,0,0,2,0,0,0
El poder de los Colmillos ha hecho perder el juicio a Verstok. Domínalo.,Bola de pelo,2534,1108,48478,0,0,0,3,0,0,0
Infórmate sobre Acechar.,Merodeando,2535,1096,48481,0,0,0,2,0,0,0
Infórmate sobre Triturar.,Hazlos pedacitos,2536,1096,48482,0,0,0,4,0,0,0
Infórmate sobre Arañazo.,Saca las garras,2537,1096,48483,0,0,0,3,0,0,0
Infórmate sobre Mordedura feroz.,A mordisco limpio,2538,1096,48484,0,0,0,5,0,0,0
Infórmate sobre Destripar.,En canal,2539,1096,48485,0,0,0,6,0,0,0
Usa todas tus nuevas facultades contra el muñeco-diana.,Juntar las piezas,2540,1096,48486,0,0,0,7,0,0,0
Infórmate sobre Carrerilla.,A toda velocidad,2541,1096,48489,0,0,0,8,0,0,0
Infórmate sobre Recrecimiento.,Sanar tus heridas,2542,1096,48490,0,0,0,9,0,0,0
Usa lo que has aprendido para derrotar a un solo oponente.,Una prueba rápida,2543,1096,49653,0,0,0,10,0,0,0
Deja la nave y únete al ataque.,Órdenes de arriba,2544,1096,49642,0,0,0,13,0,0,0
Verstok ha huido a una serie de cuevas que hay bajo las ruinas. Localízalo.,En la oscuridad,2545,1108,48487,0,0,0,4,0,0,0
Has encontrado a Verstok atrapado en la red de una criatura horrenda. Mátala.,Enredo en la red,2546,1108,48505,0,0,0,5,0,0,0
Los Colmillos de Crinceniza son tuyos. Cógelos.,Los Colmillos de Crinceniza,2547,1108,48507,0,0,0,6,0,0,0
El maestro Mathias Shaw te aguarda en las puertas de Ventormenta.,En máxima alerta,2548,1123,48525,0,0,0,0,0,0,0
Reúnete con Elling Trias y consigue una bomba de humo.,Un regalito,2549,1123,48530,0,0,0,1,0,0,0
Usa la bomba de humo para crear una distracción en la Sala de mercaderes.,Secretos del oficio,2550,1123,48532,0,0,0,2,0,0,0
Pesca lo que está molestando a los peces furia.,¿Qué hay ahí abajo?,2551,1025,48562,0,0,0,3,0,0,0
Monta en Colmillo de Ébano para volver a la Arboleda de los Sueños.,A la Arboleda,2552,1108,48564,0,0,0,7,0,0,0
Has conseguido penetrar las barreras benditas que protegen el Templo Oscuro. Consulta con Altruis el Sufridor y prepárate para enfrentarte a Akama.,PUEDES irte a casa,2553,1124,48570,0,0,0,0,0,0,0
Sigue al custodio G33-WH12 a través de la Antecámara.,Sigue al custodio,2554,1125,48568,0,0,0,0,0,0,0
Huye del caos y reúnete con Garona en la taberna El Cerdo Borracho en el Casco Antiguo.,Punto de encuentro,2558,1123,48576,0,0,0,4,0,0,0
Derrota a los invasores.,Elimina la infestación,2559,1125,48578,0,0,0,1,0,0,0
Entra en la taberna y haz que Althea Cerranegro te diga dónde está su maestro.,Necesitamos respuestas,2560,1123,48584,0,0,0,5,0,0,0
¡Tienes que localizar al Heraldo en el Castillo de Ventormenta antes de que invoque a la Legión en la ciudad!,Siguiendo la pista,2561,1123,48586,0,0,0,6,0,0,0
Debes asesinar a Melris y poner fin a esto de una vez por todas.,Marcado para morir,2562,1123,48588,0,0,0,7,0,0,0
Aprópiate de las Matarreyes.,Un oscuro regalo,2563,1123,48590,0,0,0,8,0,0,0
Mathias Shaw ha tenido la amabilidad de brindarte transporte a Dalaran.,Despedida,2564,1123,48592,0,0,0,9,0,0,0
Las puertas de la Cima del Templo propiamente dicha están cerradas. Akama está al otro lado. Haz que tus Illidari encuentren el modo de entrar.,Nada se interpondrá en nuestro camino,2565,1124,48598,0,0,0,1,0,0,0
Entra en la Cima del Templo y enfréntate a Akama. Convéncelo de que se una a tu lucha en los mundos de la Legión Ardiente.,Ante un viejo enemigo,2566,1124,48604,0,0,0,2,0,0,0
Akama no se deja persuadir con palabras. Quizás la fuerza funcione. Pero ¿cómo ganar y no perder al mismo tiempo?,Si no atiende a razones...,2567,1124,48606,0,0,0,3,0,0,0
Akama ha sido derrotado. Habla con él y convéncelo de que se te una.,Un último intento diplomático,2568,1124,48608,0,0,0,4,0,0,0
Infórmate sobre Penitencia.,Descargas Sagradas,2569,1090,48724,0,0,0,2,0,0,0
Infórmate sobre Punición.,Punición infinita,2570,1090,48725,0,0,0,3,0,0,0
Usa todas tus nuevas facultades contra el muñeco-diana.,Juntar las piezas,2571,1090,48726,0,0,0,4,0,0,0
Infórmate sobre Palabra de poder: escudo.,Un escudo contra tus enemigos,2572,1090,48727,0,0,0,6,0,0,0
Infórmate sobre Alarido psíquico.,Jugar a juegos mentales,2573,1090,48728,0,0,0,5,0,0,0
Infórmate sobre Expiación.,Sanación a través del sufrimiento ajeno,2574,1090,66220,0,0,0,7,0,0,0
Usa lo que has aprendido para derrotar a un solo oponente.,Una prueba rápida,2575,1090,49762,0,0,0,8,0,0,0
Usa lo que has aprendido para derrotar a dos oponentes al mismo tiempo.,Desafío por partida doble,2576,1090,49760,0,0,0,9,0,0,0
Has conseguido penetrar las barreras benditas que protegen el Templo Oscuro. Consulta con Kayn Furia del Sol y prepárate para enfrentarte a Akama.,PUEDES irte a casa,2582,1131,48812,0,0,0,0,0,0,0
Las puertas de la Cima del Templo propiamente dicha están cerradas. Akama está al otro lado. Haz que tus Illidari encuentren el modo de entrar.,Nada se interpondrá en nuestro camino,2583,1131,48814,0,0,0,1,0,0,0
Entra en la Cima del Templo y enfréntate a Akama. Convéncelo de que se una a tu lucha en los mundos de la Legión Ardiente.,Ante un viejo enemigo,2584,1131,48816,0,0,0,2,0,0,0
Akama no se deja persuadir con palabras. Quizás la fuerza funcione. Pero ¿cómo ganar y no perder al mismo tiempo?,Si no atiende a razones...,2585,1131,48818,0,0,0,3,0,0,0
Akama ha sido derrotado. Habla con él y convéncelo de que se te una.,Un último intento diplomático,2586,1131,48820,0,0,0,4,0,0,0
Infórmate sobre Invocar elemental de agua.,Un amigo gélido,2587,1132,48833,0,0,0,1,0,0,0
Infórmate sobre Veneno mortal.,Cubrir tus dagas,2588,1133,48991,0,0,0,1,0,0,0
Infórmate sobre Descarga de Escarcha.,La escarcha se sirve fría,2589,1132,48834,0,0,0,2,0,0,0
Infórmate sobre Lanza de hielo.,Muerte gélida,2590,1132,48835,0,0,0,3,0,0,0
Infórmate sobre Lanza de hielo y Dedos de Escarcha.,Dedos congelados,2591,1132,48836,0,0,0,4,0,0,0
Usa todas tus nuevas facultades contra el muñeco-diana.,Juntar las piezas,2593,1132,48838,0,0,0,6,0,0,0
Infórmate sobre Traslación.,"¡Eh, ahora estoy aquí!",2594,1132,48839,0,0,0,7,0,0,0
Infórmate sobre Nova de Escarcha.,Raíces congelantes,2595,1132,48840,0,0,0,8,0,0,0
Infórmate sobre Ventisca.,Cae hielo del cielo,2596,1132,48841,0,0,0,9,0,0,0
Usa lo que has aprendido para derrotar a un solo oponente.,Una prueba rápida,2597,1132,49683,0,0,0,10,0,0,0
Deja la nave y únete al ataque.,Órdenes de arriba,2598,1132,49672,0,0,0,13,0,0,0
Habla con Thassarian.,Un favor personal,2599,1134,48927,0,0,0,0,0,0,0
Repele la invasión de la Legión cerrando sus portales y mandando a sus fuerzas de vuelta a El Vacío Abisal.,El cielo cae sobre nuestras cabezas,2600,1135,48911,0,0,0,0,0,0,0
Derrota a los tres magos de la Legión encerrando al archimago Vargoth.,Retorciéndose al viento,2601,1135,48919,0,0,0,2,0,0,0
Encuentra una forma de entrar en el edificio de El Nexo,Filosofía sigilosa,2602,1135,49016,0,0,0,5,0,0,0
Derrota a Kathra'natir encerrándolo en la piedra de alma Nocheterna.,El poder de la piedra de alma,2603,1135,49031,0,0,0,6,0,0,0
Habla con el archimago Vargoth.,Archimago Vargoth,2604,1135,48966,0,0,0,3,0,0,0
Habla con Khadgar cuando quieras que empiece a canalizar su esencia en el recipiente Arcano.,Esencia Arcana,2605,1136,48943,0,0,0,0,0,0,0
Rescata a Koltira de El Apothecarium.,Fin del cautiverio,2606,1134,48941,0,0,0,2,0,0,0
Vigila al archimago Khadgar mientras canaliza su esencia en el recipiente Arcano.,El arte de ser cebo,2608,1136,49361,0,0,0,1,0,0,0
Usa tu bengala para ver si Hakkar ha mordido el anzuelo.,Descubrir demonios,2609,1136,49365,0,0,0,2,0,0,0
Usa un portal Arcano para viajar al Anillo de Transmutación central.,Centro de gravedad,2610,1135,48936,0,0,0,1,0,0,0
Has accedido a las tierras del templo. Reúnete con el Rey Mono y prepárate para adentrarte más en el complejo.,Crisis en el templo,2613,1137,49114,0,0,0,0,0,0,0
Infórmate sobre Sigilo.,Sin levantar sospechas,2617,1133,48992,0,0,0,2,0,0,0
Infórmate sobre Garrote.,Rebanar pescuezos,2618,1133,48993,0,0,0,3,0,0,0
Infórmate sobre Mutilar.,Cuando una daga no basta,2619,1133,48994,0,0,0,4,0,0,0
Infórmate sobre Ruptura.,La ofrenda que sigue dando,2620,1133,48995,0,0,0,5,0,0,0
Infórmate sobre Envenenar.,"¡Más veneno, por favor!",2621,1133,48996,0,0,0,6,0,0,0
Usa todas tus nuevas facultades contra el muñeco-diana.,Juntar las piezas,2622,1133,48997,0,0,0,7,0,0,0
Infórmate sobre Esfumarse.,Deslizarse a las sombras,2623,1133,48998,0,0,0,8,0,0,0
Usa lo que has aprendido para derrotar a un solo oponente.,Una prueba rápida,2624,1133,49791,0,0,0,9,0,0,0
Usa lo que has aprendido para derrotar a dos oponentes al mismo tiempo.,Desafío por partida doble,2625,1133,49789,0,0,0,10,0,0,0
Habla con el archimago Vargoth para teletransportarte al nivel del suelo.,En tierra,2626,1135,49014,0,0,0,4,0,0,0
Busca al profeta Velen en el Arca de las Luces.,El profeta y el carnicero,2628,1138,49020,0,0,0,0,0,0,0
Rescata a ciudadanos aterrados por todo El Exodar y destruye los portales viles de la Legión.,En defensa de El Exodar,2629,1138,49022,0,0,0,1,0,0,0
"Vuelve con el profeta Velen, en El Arca de las Luces.",Vuelve con el profeta,2630,1138,49455,0,0,0,2,0,0,0
Deja que el profeta Velen examine el objeto misterioso vinculado a la Luz.,El Corazón de la Luz,2631,1138,50121,0,0,0,3,0,0,0
Invoca el poder de la Crematoria para liberarte del control de Balnazzar.,Una última bendición,2632,775,49026,0,0,0,4,0,0,0
Controla la consola de artillería y usa las baterías del Martillo Vil para devastar a las fuerzas de la Legión que hay abajo.,¡Que comience el bombardeo!,2633,1144,49045,0,0,0,0,0,0,0
Infórmate sobre Brote.,Contagio masivo,2634,1094,49047,0,0,0,2,0,0,0
Infórmate sobre Golpe purulento.,Pus a espuertas,2635,1094,49048,0,0,0,3,0,0,0
Infórmate sobre Golpe de la Plaga.,Dominar la Plaga,2636,1094,49049,0,0,0,4,0,0,0
Infórmate sobre Espiral de la muerte.,Espiral de ataque,2637,1094,49050,0,0,0,5,0,0,0
Usa todas tus nuevas facultades contra el muñeco-diana.,Juntar las piezas,2638,1094,49051,0,0,0,6,0,0,0
Infórmate sobre Atracción letal.,¡Ven aquí!,2639,1094,49052,0,0,0,8,0,0,0
¡Defiende la nave!,Defiéndete del ataque,2640,1094,66926,0,0,0,12,0,0,0
Deja la nave y únete al ataque.,Órdenes de arriba,2641,1094,49621,0,0,0,13,0,0,0
Infórmate sobre Ejército de muertos.,Despertar a unos amigos,2642,1094,49053,0,0,0,9,0,0,0
Derrota al comandante de la Legión que amenaza Kharanos.,Derrota al comandante demoníaco,2643,959,49071,43283,0,0,1,0,0,0
Rechaza a los ejércitos de la Legión de Dun Morogh.,Rechaza a los ejércitos de la Legión,2644,959,49074,43292,0,0,2,0,0,0
Derrota al señor demoníaco que lidera la invasión en Kharanos.,Derrota al señor demoníaco,2645,959,49078,43284,0,0,3,0,0,0
Controla la consola de artillería y usa las baterías del Martillo Vil para devastar a las fuerzas de la Legión que hay abajo.,¡Que comience el bombardeo!,2646,1145,49085,0,0,0,0,0,0,0
Habla con Altruis el Sufridor para desplegar tus fuerzas y luego usa tu facultad Planear para ir al punto de encuentro de más abajo.,Planea hasta el punto de encuentro,2647,1144,49098,0,0,0,1,0,0,0
Habla con Kayn Furia del Sol para desplegar tus fuerzas y luego usa tu facultad Planear para ir al punto de encuentro de más abajo.,Planea hasta el punto de encuentro,2648,1145,49100,0,0,0,1,0,0,0
Los escribas están atrapados en El Sagrario del Escribiente. ¡Entra y rescátalos!,Echar un ojo,2649,1137,49137,0,0,0,1,0,0,0
¡Un poderoso demonio ha asesinado al eremita Senda Pétrea! Venga su muerte y busca posibles supervivientes.,Con ganas de venganza,2650,1137,49139,0,0,0,2,0,0,0
Mata a los tenientes de Caria y Varedis y destruye todos los portales que están usando para invocar refuerzos.,Destruye a la Legión,2651,1144,49142,0,0,0,2,0,0,0
Mata a los tenientes de Caria y Varedis y destruye todos los portales que están usando para invocar refuerzos.,Destruye a la Legión,2652,1145,49147,0,0,0,2,0,0,0
"Habla con Altruis delante del centro de mando, donde Caria y Varedis están protegidos por una barrera vil.",Reagrupamiento frente al centro de mando,2653,1144,49152,0,0,0,3,0,0,0
"Habla con Kayn delante del centro de mando, donde Caria y Varedis están protegidos por una barrera vil.",Reagrupamiento frente al centro de mando,2654,1145,49154,0,0,0,3,0,0,0
Ordena al Martillo Vil colocarse en posición y disparar al otro centro de mando. Eso eliminará la barrera vil y permitirá el paso.,"¡Martillo Vil, fuego!",2655,1144,49156,0,0,0,4,0,0,0
Ordena al Martillo Vil colocarse en posición y disparar al otro centro de mando. Eso eliminará la barrera vil y permitirá el paso.,"¡Martillo Vil, fuego!",2656,1145,49158,0,0,0,4,0,0,0
Mata a Caria y Varedis Alma Vil.,Caria y Varedis al fin,2657,1144,49160,0,0,0,5,0,0,0
Mata a Caria y Varedis Alma Vil.,Caria y Varedis al fin,2658,1145,49163,0,0,0,5,0,0,0
Caria y Varedis están muertos. Habla con Altruis y haz que la madre matriarca Malevolencia os teletransporte a todos de vuelta al Martillo Vil.,"Malevolencia, sácanos de aquí",2659,1144,49166,0,0,0,6,0,0,0
Caria y Varedis están muertos. Habla con Kayn y haz que la madre matriarca Malevolencia os teletransporte a todos de vuelta al Martillo Vil.,"Malevolencia, sácanos de aquí",2660,1145,49168,0,0,0,6,0,0,0
Sigue al Rey Mono al interior del templo.,La muerte cae desde el cielo,2661,1137,49170,0,0,0,4,0,0,0
Salta sobre los murciélagos viles y derrota a sus jinetes.,Derrota a los jinetes de murciélago vil,2662,1146,49172,0,0,0,1,0,0,0
"¡Han herido a Yu'lon, el Dragón de Jade! ¡No dejes que sufra ataques de los demonios!",La batalla del dragón,2663,1137,49171,0,0,0,5,0,0,0
Aniquila a los corruptores odiosos y rescata a Hodir.,Salva a Hodir,2664,1146,49174,0,0,0,4,0,0,0
¡El eredar lord Korithis está atacando el templo! ¡Detenlo!,Sobre alas viles,2665,1137,49178,0,0,0,6,0,0,0
¡Korithis ha caído derrotado! ¡Aprópiate de Fu Zan!,"Fu Zan, el Compañero del Errante",2666,1137,49180,0,0,0,7,0,0,0
Busca a Magni Barbabronce. El custodio dijo que estaría en El Planetario Celestial.,Localiza a Magni,2667,1125,53724,0,0,0,2,0,0,0
Ábrete camino hasta El Círculo de Observación,"Demonios, demonios por todas partes...",2671,1148,49352,0,0,0,0,0,0,0
Sigue al enano férreo.,"Pequeño, pero matón",2672,1148,49375,0,0,0,1,0,0,0
Abre la puerta.,Una proeza de fuerza,2673,1148,49403,0,0,0,2,0,0,0
Desciende cerca de Thorim.,Aterrizaje forzoso,2675,1146,49314,0,0,0,2,0,0,0
Derrota al inquisidor Ha'zaduum y a sus esbirros para salvar a Magni.,Derrota a los demonios,2676,1125,49324,0,0,0,4,0,0,0
Acompaña a Magni Barbabronce hasta El Planetario Celestial.,Escolta a Magni,2677,1125,49328,0,0,0,5,0,0,0
Escucha la información que Magni Barbabronce quiere compartir contigo.,El mensaje del rey de diamantes,2678,1125,49326,0,0,0,7,0,0,0
Habla con Thalyssra para reunir a tu ejército de Marchitos.,Equipamiento,2680,1150,49336,0,0,0,0,0,0,0
"Entra en El Derrumbamiento y avanza todo lo posible. Si mueres, pierdes a todos tus Marchitos o vuelves a hablar con Thalyssra, se acabará la gesta.",En las profundidades,2681,1150,49338,0,0,0,1,0,0,0
Vuelve a la entrada de El Derrumbamiento y recoge las recompensas que encuentres.,Botín de guerra,2682,1150,49340,0,0,0,2,0,0,0
,Ayudar a Thorim,2683,1146,49346,0,0,0,3,0,0,0
Busca más supervivientes en el Sagrario.,"Derribado, pero no acabado",2684,1137,49355,0,0,0,3,0,0,0
Mata al comandante aterrador Arganoth.,Derrota al comandante,2685,786,43554,0,0,0,2,0,0,0
"Derrota a los canes manáfagos de Hakkar, a Kreenam y Czaadym.",Derrota a Kreenam y Czaadym,2686,1136,48947,0,0,0,3,0,0,0
"Derrota a Hakkar, el maestro de canes, en El Bastión Violeta.","Derrota a Hakkar, el maestro de canes",2687,1136,48925,0,0,0,4,0,0,0
Hodir está poseído por energías viles y hay que detenerlo.,Derrota a Hodir,2688,1146,49367,0,0,0,5,0,0,0
Informa al archimago Khadgar de que Dalaran estará a salvo gracias a tus actos heroicos.,Habla con el archimago Khadgar,2689,1136,49371,0,0,0,5,0,0,0
¡Rescata a Hodir!,"¡Hodir, Hodir, Hodir!",2691,1148,49465,0,0,0,3,0,0,0
Sigue a Hodir a El Fragor del Trueno,El Fragor del Trueno,2692,1148,49616,0,0,0,4,0,0,0
Supera la prueba de la Legión.,Una proeza de combate,2693,1148,49614,0,0,0,5,0,0,0
Escolta a Thassarian por Entrañas.,Un rescate atrevido,2696,1134,49396,0,0,0,1,0,0,0
El Consejo de la Sombra andará buscando un prisionero. Los módulos de celdas son un buen sitio donde empezar.,¿Dónde están?,2700,1155,49405,0,0,0,0,0,0,0
"Con Fu Zan en tu poder, sube a lomos de Yu'lon para volver a La Isla Errante.",El errante despierta,2701,1137,49412,0,0,0,8,0,0,0
Usa lo que has aprendido para derrotar a un solo oponente.,Una prueba rápida,2702,1084,49426,0,0,0,9,0,0,0
Usa lo que has aprendido para derrotar a dos oponentes al mismo tiempo.,Desafío aceptado,2703,1084,49431,0,0,0,10,0,0,0
Habla con Darion Mograine.,El regreso a Esperanza de la Luz,2707,1157,49459,0,0,0,0,0,0,0
Prepárate para la invasión de la Capilla de la Esperanza de la Luz.,Preparativos,2708,1157,49461,0,0,0,1,0,0,0
Habla con el alto señor Darion Mograine para iniciar la invasión.,En la colina sin retorno,2709,1157,49478,0,0,0,2,0,0,0
Consigue información sobre dónde se reúnen los cultores en Ventormenta.,Atrapar a un cultor,2711,1123,49470,0,0,0,3,0,0,0
Blande las Hojas Gemelas del Impostor.,Las Hojas Gemelas del Impostor,2712,900,49475,0,0,0,4,0,0,0
Resucita a los muertos en la tumba de detrás de la Capilla de la Esperanza de la Luz.,Los muertos se alzarán,2714,1157,49500,0,0,0,3,0,0,0
Los aspirantes al Consejo restantes están muy diezmados. Reúnete con los supervivientes y averigua sus planes.,Los otros jugadores,2715,1155,49483,0,0,0,1,0,0,0
"Tyranis Malem recibió órdenes de adentrarse en el Bloque D. Dirígete a las celdas, localízalo y averigua lo que sabe.",El tercero,2716,1155,49485,0,0,0,2,0,0,0
Es más fácil recibir más crédito con menos ayuda. Tyranis debería sufrir un desgraciado accidente. Rompe la cadena que sostiene o abandónalo a su suerte.,Un desafortunado accidente,2717,1155,49487,0,0,0,3,0,0,0
El manifiesto no está aquí. Es hora de continuar la búsqueda en otra parte.,Reanudar la búsqueda,2718,1155,49491,0,0,0,4,0,0,0
"Nagaz necesita ""ayuda con algo"". Probablemente sea una trampa. Espera a que la active y luego cambia las tornas de la situación.",Una reunión secreta,2719,1155,49493,0,0,0,5,0,0,0
Sigue buscando el manifiesto de prisión en el módulo de celdas.,De vuelta al manifiesto,2720,1155,49514,0,0,0,6,0,0,0
Asciende a las puertas de Niskara.,La batalla final,2721,1146,49369,0,0,0,0,0,0,0
Derrota al comandante de la Legión que amenaza Molino Tarren.,Derrota al comandante demoníaco,2722,916,49511,43286,0,0,1,0,0,0
Rechaza a los ejércitos de la Legión en las Laderas de Trabalomas.,Rechaza a los ejércitos de la Legión,2723,916,49536,43297,0,0,2,0,0,0
Allaris cree que el manifiesto está aquí. Acompáñalo y encuéntralo.,La última ala,2724,1155,49516,0,0,0,7,0,0,0
El manifiesto indica que el objetivo está en el Bastión de Baradin. Ve allí con Allaris y encuentra a la criatura.,Bastión de Baradin,2725,1155,49518,0,0,0,8,0,0,0
El inmenso terror del Vacío ha consumido el Ojo. Mátalo para recuperarlo.,El ojo de la bestia,2726,1155,49520,0,0,0,9,0,0,0
Reúnete con el alto señor Darion Mograine en la Capilla.,El Alto Señor aguarda,2727,1157,49527,0,0,0,4,0,0,0
,Rescata a Thorim,2728,1148,49618,0,0,0,6,0,0,0
Infórmate sobre ser un paladín.,Instrucción de combate,2729,1073,49557,0,0,0,0,0,0,0
Infórmate sobre ser un guerrero.,Instrucción de combate,2730,1093,49576,0,0,0,0,0,0,0
Infórmate sobre ser un cazador.,Instrucción de combate,2731,1083,49570,0,0,0,0,0,0,0
Infórmate sobre ser un pícaro.,Instrucción de combate,2732,1133,49573,0,0,0,0,0,0,0
Infórmate sobre ser un sacerdote.,Instrucción de combate,2733,1090,49579,0,0,0,0,0,0,0
Infórmate sobre ser un caballero de la Muerte.,Instrucción de combate,2734,1094,49582,0,0,0,0,0,0,0
Infórmate sobre ser un chamán.,Instrucción de combate,2735,1091,49585,0,0,0,0,0,0,0
Infórmate sobre ser un mago.,Instrucción de combate,2736,1132,49588,0,0,0,0,0,0,0
Infórmate sobre ser un brujo.,Instrucción de combate,2737,1084,49591,0,0,0,0,0,0,0
Infórmate sobre ser un monje.,Instrucción de combate,2738,1095,49594,0,0,0,0,0,0,0
Infórmate sobre ser un druida.,Instrucción de combate,2739,1096,49597,0,0,0,0,0,0,0
Derrota al señor demoníaco que lidera la invasión en Molino Tarren.,Derrota al señor demoníaco,2740,916,49602,43285,0,0,3,0,0,0
Usa lo que has aprendido para derrotar a un solo oponente.,Una prueba rápida,2741,1094,49608,0,0,0,10,0,0,0
Usa lo que has aprendido para derrotar a dos oponentes al mismo tiempo.,Desafío por partida doble,2743,1094,49606,0,0,0,11,0,0,0
Usa lo que has aprendido para derrotar a dos oponentes al mismo tiempo.,Desafío por partida doble,2744,1096,49651,0,0,0,11,0,0,0
¡Defiende la nave!,Defiéndete del ataque,2745,1096,66941,0,0,0,12,0,0,0
Usa lo que has aprendido para derrotar a un solo oponente.,Una prueba rápida,2746,1083,49668,0,0,0,9,0,0,0
Usa lo que has aprendido para derrotar a dos oponentes al mismo tiempo.,Desafío por partida doble,2747,1083,49666,0,0,0,10,0,0,0
Usa lo que has aprendido para derrotar a dos oponentes al mismo tiempo.,Desafío por partida doble,2748,1132,49681,0,0,0,11,0,0,0
¡Defiende la nave!,Defiéndete del ataque,2749,1132,66974,0,0,0,12,0,0,0
¡Defiende la nave!,Defiéndete del ataque,2750,1095,66982,0,0,0,10,0,0,0
Deja la nave y únete al ataque.,Órdenes de arriba,2751,1095,49687,0,0,0,11,0,0,0
Usa lo que has aprendido para derrotar a dos oponentes al mismo tiempo.,Desafío por partida doble,2752,1073,49719,0,0,0,10,0,0,0
¡Defiende la nave!,Defiéndete del ataque,2753,1073,66990,0,0,0,11,0,0,0
Ábrete camino hasta la Sala de los Campeones.,El Sagrario de la Luz,2755,1157,49733,0,0,0,5,0,0,0
Derrota a lady Liadrin en la Sala de los Campeones.,La señora de la Luz,2756,1157,49735,0,0,0,6,0,0,0
Abre la tumba de Tirion Vadín.,Una suerte profana,2757,1157,49737,0,0,0,7,0,0,0
Habla con el profeta Velen y luego escóltalo hasta el Trono de los Naaru.,Un largo descenso...,2758,1138,50158,0,0,0,4,0,0,0
¡Defiende la nave!,Defiéndete del ataque,2762,1090,66998,0,0,0,10,0,0,0
Deja la nave y únete al ataque.,Órdenes de arriba,2763,1090,49751,0,0,0,11,0,0,0
Mata a los archivistas Vigías del ocaso para escapar de la Biblioteca Olvidada.,Hincar los codos,2767,1159,49766,0,0,0,0,0,0,0
¡Defiende la nave!,Defiéndete del ataque,2768,1133,67006,0,0,0,11,0,0,0
Deja la nave y únete al ataque.,Órdenes de arriba,2769,1133,49780,0,0,0,12,0,0,0
¡Defiende la nave!,Defiéndete del ataque,2771,1091,67014,0,0,0,12,0,0,0
Deja la nave y únete al ataque.,Órdenes de arriba,2772,1091,50135,0,0,0,13,0,0,0
¡Defiende la nave!,Defiéndete del ataque,2773,1093,67038,0,0,0,11,0,0,0
Deja la nave y únete al ataque.,Órdenes de arriba,2774,1093,50143,0,0,0,12,0,0,0
Derrota al comandante de la Legión que amenaza la Puerta Trasera de Orgrimmar.,Derrota al comandante demoníaco,2775,958,50196,43299,0,0,1,0,0,0
Rechaza a los ejércitos de la Legión de Azshara.,Rechaza a los ejércitos de la Legión,2776,958,50199,43300,0,0,2,0,0,0
Derrota al señor demoníaco que lidera la invasión en la Puerta Trasera de Orgrimmar.,Derrota al señor demoníaco,2777,958,50204,43301,0,0,3,0,0,0
Únete a la batalla en el Templo de la Luz Abisal.,Únete a la batalla,2778,1160,50352,0,0,0,0,0,0,0
Mata a Balnazzar.,Derrota a Balnazzar,2779,1160,50223,0,0,0,3,0,0,0
Destruye 4 portales de la Legión.,Destruye portales de la Legión,2780,1160,50288,0,0,0,2,0,0,0
Derrota a Ogoroth y a Torenai el Devoraalmas.,Derrota a los tenientes de Balnazzar,2782,1160,50220,0,0,0,1,0,0,0
