ID,Text_lang,Title_lang,ConditionID
3,"A Rainha Invernal pediu a você que entregasse uma mensagem a Sir Denathrius, Mestre de Revendreth. Você precisará da ajuda dele no conflito que se anuncia.",Boas-vindas a Revendreth,0
111,Teste,,0
158,"Depois de um ataque não provocado ao Bastião, você recebeu a tarefa de viajar a Maldraxxus e investigar por que os exércitos dos mortos traíram o juramento de defender as Terras Sombrias.",Campeão da dor,0
277,"Com um conjunto de projetos que você recuperou e o poder destruidor do G.M.O.D. ao seu dispor, você e Gallywix destruíram uma aeronau usada pelo Grão-faz-tudo Mekkatorque e prejudicaram ainda mais os esforços da Aliança em Drustvar.",,0
1128,"Hadggar evocou você a Dalaran para ajudar a investigar uma figura misteriosa chamada de Emissária, que possui uma relíquia poderosa chamada de Coração Sombrio. O Arquimago também pediu que Alleria Correventos se juntasse a você para oferecer sua perspectiva singular.",Caçada à Emissária,0
1254,"Convocaram você a Silithus em busca de Magni, o Mensageiro de Azeroth, para saber mais sobre o misterioso Canto Radiante ouvido por toda Azeroth.",O Clamor Radiante,0
1427,"Orweyna revela que encontrou uma gravação de ninguém menos que Gallywix, líder das operações no Ponto da Oportunidade. Mas ela está preocupada com o que ouviu atrás de uma parede enorme da caverna. Máquinas triturando e perfurando com fins que, por ora, permanecem desconhecidos...",Mandante revelado,0
1928,"Convocaram você a Silithus em busca de Magni, o Mensageiro de Azeroth, para saber mais sobre o misterioso Canto Radiante ouvido por toda Azeroth.",O Clamor Radiante,0
1966,"Com os reagentes reunidos e as almas recuperadas, você se prepara para testemunhar os frutos sombrios da incessante labuta de Sylvana.",,0
