ID,Name_lang,Description_lang,BountySetID,SkillLineID,DeathTeleportSpellID,Field_9_0_2_36165_006,Field_9_0_2_36165_007,FactionID,Field_10_0_0_45141_008
1,Кирии,"Кирии – несгибаемые стражи загробного мира, которые переносят души мертвых в Темные Земли. Они посвящают себя служению и принимают в свои ряды только самых достойных.",111,2730,315066,346042,346046,2407,1829
2,Вентиры,"Вентиры – аристократы, чьим заботам поручаются души, обремененные злобой и гордыней. Они направляют грешников на трудный путь к искуплению, добывая при этом аниму для нужд своего мира.",112,2731,344545,346037,346043,2413,1830
3,Ночной народец,"Ночной народец ухаживает за павшими духами природы, дремлющими в безмятежном лесу. Те, кто посвятил свою жизнь природе, могут примкнуть к ним и помогать возвращать духов в вечный круговорот.",114,2732,344538,346039,346044,2465,1831
4,Некролорды,"Некролорды вознаграждают сильных и избавляются от слабых. Амбициозные и свирепые души становятся частью бессмертной армии, стоящей на страже Темных Земель.",113,2733,344544,346041,346045,2410,1832
12,Кентавры Маруук,"Разные кланы кентавров с равнин Он'ары, вместе образующие племя Маруук.",119,0,0,0,0,2503,2002
13,Драконья экспедиция,Лига исследователей и Реликварий организовали совместную экспедицию на Драконьи острова.,119,0,0,0,0,2507,2021
14,Искарские клыкарры,Племя суровых клыкарров с Драконьиих островов.,119,0,0,0,0,2511,2087
15,Союз Вальдраккена,"Вальдраккен – сияющая столица драконов, где они заключили союз, чтобы вновь прийти на помощь смертным.",119,0,0,0,0,2510,2088
