ID,Text_lang,SortIndex,Min_level,Max_level,ContentTuningID
201,"|cffffd100Совет.|r Чтобы прервать свое заклинание, переместитесь, подпрыгните или нажмите клавишу <ESC>.",2,20,250,0
222,"|cffffd100Совет.|r Чтобы увидеть, как предмет будет смотреться на персонаже, щелкните по этому предмету, зажав Ctrl.",4,20,250,0
223,"|cffffd100Совет.|r Если название предмета написано серым цветом, значит, этот предмет низкого качества. Обычно такие вещи продают торговцам.",5,6,250,0
224,"|cffffd100Совет.|r Если название предмета написано белым цветом, значит, он может быть полезен. Вы можете использовать этот предмет сами или выставить его на аукцион.",6,20,250,0
225,"|cffffd100Совет.|r В любом почтовом ящике можно оставить письмо для другого игрока или вашего альтернативного персонажа, если они находятся в вашем игровом мире.",7,20,250,0
226,|cffffd100Совет.|r В сообщение можно вставить ссылку на какой-либо игровой предмет. Для этого щелкните по нужному предмету при нажатой клавише <Shift>.,8,30,250,0
227,"|cffffd100Совет.|r Вы можете переназначить клавиши управления в меню, нажав клавишу Esc и выбрав ""Назначение клавиш"".",11,15,250,0
229,"|cffffd100Совет.|r Если цель на вашей мини-карте отмечена серым цветом, она расположена в пещере или в здании, вне которого вы находитесь в данный момент.",12,11,49,0
230,"|cffffd100Совет.|r В игре можно выражать самые разные эмоции. Попробуйте, например, набрать команду /танец – и ваш персонаж примется танцевать.",17,25,250,0
231,"|cffffd100Совет.|r Чтобы настроить интерфейс по своему вкусу, нажмите Esc и выберите ""Интерфейс"".",20,10,49,0
234,"|cffffd100Совет.|r Значок в виде конверта рядом с мини-картой означает, что вам пришло письмо. Его можно получить в ближайшем почтовом ящике.",21,10,250,0
235,|cffffd100Совет.|r В меню настройки интерфейса (клавиша <ESC>) на игровой экран можно добавить дополнительные панели команд.,22,250,250,0
236,"|cffffd100Совет.|r Чтобы забрать всю добычу с поверженного противника, щелкните по нему ПКМ, зажав Shift.",23,10,49,0
237,"|cffffd100Совет.|r Если вам понравилось играть с кем-нибудь, добавьте этого игрока в список друзей!",27,20,250,0
240,"|cffffd100Совет.|r Если вы не хотите видеть сообщения от какого-то игрока, щелкните ПКМ по его имени и выберите ""Игнорировать"". Позже вы можете передумать.",159,10,250,0
241,"|cffffd100Совет.|r Вы можете выбирать участников группы с помощью функциональных клавиш. Чтобы выбрать себя, нажмите F1, чтобы выбрать второго игрока из группы – F2 и так далее.",31,40,250,0
242,"|cffffd100Совет.|r Будьте вежливы с товарищами по группе, и вас непременно пригласят в следующий раз!",30,0,0,0
243,"|cffffd100Совет.|r Во вкладке репутации записаны названия различных фракций. Щелкнув по названию фракции, вы получите дополнительные сведения о ней, а также сможете выполнить ряд других связанных с нею действий.",32,0,0,0
244,"|cffffd100Совет.|r Если портрет монстра отмечен звездой, это значит, что монстр редкий и добыча с него будет ценнее, чем обычно.",33,15,250,0
245,|cffffd100Совет.|r При просмотре главной карты можно увеличить изображение с помощью колесика мыши.,36,0,0,0
251,|cffffd100Совет.|r Выполнение заданий и прохождение подземелий – это лучшие способы повысить уровень.,45,10,40,0
254,"|cffffd100Совет.|r Вы можете убрать весь интерфейс, нажав <Alt>+Z, а затем сделать скриншот клавишей Print Screen.",44,0,0,0
256,"|cffffd100Совет.|r Щелкните правой кнопкой по главной карте, чтобы отдалить камеру и перейти к просмотру континента или всего мира. Щелчок левой кнопкой позволяет приблизить камеру.",40,1,20,0
258,"|cffffd100Совет.|r Чтобы получить дополнительные сведения об игроке, щелкните по его имени в окне чата при нажатой клавише <Shift>.",3,20,49,0
261,"|cffffd100Совет.|r Если над персонажем, дающим задания, отображается синий вопросительный знак, это означает, что его задания можно выполнять по нескольку раз.",48,50,250,0
263,|cffffd100Совет.|r Вы можете переключаться между ближайшими находящимися перед вами противниками с помощью клавиши <Tab>.,13,1,60,0
281,"|cffffd100Совет.|r Чтобы купить у торговца несколько одинаковых предметов, нажмите <Shift>, а затем щелкните по необходимому предмету.",50,10,250,0
282,|cffffd100Совет.|r После обучения профессии вы можете воспользоваться своим новым навыком с помощью вкладки профессий книги заклинаний.,10,11,250,0
321,"|cffffd100Совет.|r Если вы заблудились в крупном городе, попробуйте щелкнуть по стражу, чтобы спросить у него дорогу.",14,10,250,0
341,"|cffffd100Совет.|r Не забывайте, что все хорошо в меру (даже World of Warcraft)!",143,0,0,0
381,"|cffffd100Совет.|r Чтобы разделить одинаковые предметы в одной ячейке, щелкните по ним при нажатой клавише <Shift>.",54,30,250,0
382,"|cffffd100Совет.|r Зажать обе кнопки мыши одновременно – еще один способ добиться, чтобы ваш персонаж двигался вперед.",55,0,0,0
384,"|cffffd100Совет.|r Вы можете отменять большую часть действующих на вас благотворных эффектов, щелкая ПКМ по их значку.",9,25,250,0
388,"|cffffd100Совет.|r Другие игроки могут приводить ссылки на предметы в окне чата. Щелкнув по такой ссылке, вы получите дополнительные сведения о предмете.",57,0,0,0
389,"|cffffd100Совет.|r Вы можете освоить только две профессии, зато вам доступны все вспомогательные навыки (археология, рыбная ловля и кулинария).",19,10,49,0
390,"|cffffd100Совет.|r Прежде чем приглашать игрока в группу или предлагать ему сделку, проявите учтивость и спросите, не против ли он.",58,0,0,0
392,"|cffffd100Совет.|r Если вашего персонажа убьет игрок из враждебной фракции, прочность ваших предметов не уменьшится.",60,20,250,0
393,"|cffffd100Совет.|r Чтобы отслеживать выполнение задания, щелкните по его названию в журнале при нажатой клавише <Shift>.",61,10,250,0
394,"|cffffd100Совет.|r Местонахождение находящихся рядом персонажей, которые дали вам задание и теперь ждут вашего возвращения, отображается на мини-карте желтыми вопросительными знаками.",63,1,20,0
396,"|cffffd100Совет.|r Вопросительными знаками на мини-карте обозначаются находящиеся рядом персонажи, которые дали вам задание и теперь ждут вашего возвращения.",1,1,15,0
398,"|cffffd100Совет.|r Чтобы выбрать, какое задание отслеживать, вы можете щелкать по пронумерованным значкам заданий в интерфейсе отслеживания.",41,5,49,0
399,"|cffffd100Совет.|r Достигнув максимального уровня, за выполнение заданий вы будете получать не опыт, а дополнительное золото.",64,50,60,0
403,"|cffffd100Совет.|r Чтобы открыть все сумки одновременно, нажмите клавишу B.",65,20,49,0
404,"|cffffd100Совет.|r При общении с другими игроками не забывайте, что доброта украшает мир!",156,0,0,0
405,|cffffd100Совет.|r На дорогах вы гораздо меньше рискуете столкнуться с бродячими монстрами.,42,5,49,0
406,"|cffffd100Совет.|r Чтобы быстро отправиться в подземелье, рассчитанное на 5 игроков, воспользуйтесь поиском подземелий.",28,15,49,0
407,"|cffffd100Совет.|r Приводите своих друзей в Азерот, но не забывайте встречаться с ними и за его пределами.",66,0,0,0
409,"|cffffd100Совет.|r Если вы держите почтовый ящик пустым, то сможете узнать о новом письме по значку в виде конверта.",67,0,0,0
410,|cffffd100Совет.|r Никогда не передавайте другим игрокам информацию о вашей учетной записи.,68,0,0,0
411,"|cffffd100Совет.|r Не рекомендуется использовать одну учетную запись на двоих, это небезопасно.",35,0,0,0
419,"|cffffd100Совет.|r Монстр с серым индикатором здоровья атакован другим игроком. Его убийство не принесет вам ни добычи, ни опыта.",70,10,59,0
422,"|cffffd100Совет.|r Чтобы развернуть карту, щелкните по соответствующему значку в верхнем правом углу мини-карты или нажмите клавишу ""M"".",72,1,20,0
423,"|cffffd100Совет.|r В высокоуровневых подземельях часто предусмотрен эпохальный режим, который не включен в систему поиска подземелий, но предлагает ценнейшую добычу для отважных искателей приключений.",73,60,250,0
426,"|cffffd100Совет.|r Если ваша группа набрана с помощью системы поиска, вы можете сразу телепортироваться в подземелье. В противном случае отсутствующих участников можно вызвать с помощью камня призыва.",77,25,250,0
427,|cffffd100Совет.|r На странице управления учетной записью есть раздел родительского контроля. В этом разделе вы сможете поставить ограничения на игровое время.,78,10,250,0
428,"|cffffd100Совет.|r Чтобы отслеживать более одного локального задания, щелкните по названиям заданий при нажатой клавише <Shift>.",79,60,60,0
429,"|cffffd100Совет.|r Задания с пометкой ""Неудача"" можно заново получить у того же персонажа.",80,20,59,0
430,"|cffffd100Совет.|r Когда вы находитесь в группе, цифра рядом с названием задания в вашем журнале заданий показывает, сколько игроков из вашей группы тоже выполняют это задание.",81,40,250,0
431,"|cffffd100Совет.|r Находясь в рейде, вы не можете выполнять никаких заданий, кроме тех, что помечены как рейдовые.",82,50,250,0
432,"|cffffd100Совет.|r Вы не можете отменить свои ставки на аукционе, поэтому будьте внимательны, когда их делаете.",83,30,250,0
434,"|cffffd100Совет.|r Почта хранится тридцать дней, а затем удаляется.",85,40,250,0
435,"|cffffd100Совет.|r Чтобы изменить внешний вид вашей экипировки или оружия, посетите трансмогрификатора в любой из столиц.",86,40,250,0
438,"|cffffd100Совет.|r Вы можете заново приобрести у торговца недавно проданные предметы, перейдя на вкладку выкупа.",88,10,250,0
439,|cffffd100Совет.|r Лидер группы может обновить подземелье или изменить его уровень сложности. Для этого ему нужно щелкнуть правой кнопкой по своему портрету и выбрать соответствующий пункт в появившемся меню.,89,50,250,0
440,|cffffd100Совет.|r Новый камень возвращения можно получить у любого трактирщика.,90,10,250,0
442,"|cffffd100Совет.|r Игроки не могут парировать и блокировать атаки, проводимые со спины, а также уклоняться от них.",92,30,250,0
444,"|cffffd100Совет.|r Вы можете заменить драгоценный камень, вставленный в ваш предмет, на другой, поместив новый самоцвет поверх него в окне инкрустирования.",93,40,250,0
446,|cffffd100Совет.|r Вы можете находиться под влиянием только одного боевого эликсира и одного защитного эликсира одновременно.,95,50,250,0
447,"|cffffd100Совет.|r Нажав Shift при наведении курсора на предмет, можно посмотреть, как он отличается по характеристикам от аналогичного предмета, надетого на вашего героя.",96,40,250,0
448,|cffffd100Совет.|r В одном игровом мире можно создать до 18 персонажей. Максимальное количество персонажей во всех игровых мирах не должно превышать 50.,97,250,250,0
449,"|cffffd100Совет.|r Ранее набранный текст можно ввести повторно. Для этого нажмите Enter, а затем, нажимая одновременно Alt клавишу со стрелкой вверх, выберите нужное сообщение.",98,40,250,0
450,|cffffd100Совет.|r Большинство средств передвижения и питомцев доступны всем персонажам в вашем отряде.,101,30,250,0
451,"|cffffd100Совет.|r Благодарим вас за то, что играете в World of Warcraft!",102,10,250,0
452,"|cffffd100Совет.|r Побеждайте игроков из вражеской фракции, чтобы заслужить уровни чести и получить престижные декоративные награды!",103,20,250,0
453,|cffffd100Совет.|r Воздушный транспорт становится доступным на 30-м уровне!,108,20,59,0
454,|cffffd100Совет.|r За некоторые достижения можно получить уникальные небоевые предметы.,109,40,250,0
456,"|cffffd100Совет.|r Нанесение урона и исцеление повышают уровень угрозы. Как правило, монстры атакуют игрока с наивысшим уровнем угрозы. Танки способны создавать больше угрозы и должны удерживать на себе внимание противников.",111,15,59,0
457,|cffffd100Совет.|r Эпохальные подземелья – отличный способ пережить эпические (или даже легендарные) приключения вместе с друзьями!,112,250,250,0
458,|cffffd100Совет.|r Хотите познакомиться с новым классом? Создайте пробного персонажа и поиграйте за него!,113,60,70,0
459,"|cffffd100Совет.|r В парикмахерских, расположенных во многих городах, можно бесплатно полностью изменить внешность персонажа!",114,40,250,0
460,|cffffd100Совет.|r Пригласите вашего друга в World of Warcraft – и вы оба получите награду!,115,20,250,0
461,"|cffffd100Совет.|r Чтобы встать в очередь в героическое подземелье, вам потребуется некоторый минимальный уровень экипировки. Однако группа друзей освобождается от этого требования.",117,60,250,0
462,|cffffd100Совет.|r Почти любая добыча при некотором везении может оказаться улучшенной до следующего уровня качества с существенным повышением ее характеристик.,116,20,250,0
464,"|cffffd100Совет.|r В календаре можно увидеть грядущие праздники и запланировать события с членами гильдии или сообщества, а также друзьями.",99,40,250,0
465,"|cffffd100Совет.|r Чтобы установить будильник или показать секундомер, щелкните правой кнопкой по часам под мини-картой.",100,20,250,0
466,"|cffffd100Совет.|r Если окажетесь одни среди цветущего луга, обжигаемого солнцем, ничего не бойтесь – ибо вы уже в Азероте!",104,20,250,0
467,"|cffffd100Совет.|r Если вы хотите отвлечься от привычного течения игры, попробуйте заслужить некоторые необычные достижения.",105,50,250,0
468,"|cffffd100Совет.|r Начните новую строку в чате и щелкните по заданию, предмету или достижению, зажав Shift, чтобы создать в своем сообщении ссылку.",106,60,250,0
469,"|cffffd100Совет.|r Вы можете отслеживать состояние текущих заданий и достижений, зажав клавишу Shift и щелкая по их названиям мышью.",107,40,250,0
470,"|cffffd100Совет.|r Радар в виде лупы на мини-карте позволяет видеть местонахождение узкоспециализированных продавцов, персонажей, дающих задания низкого уровня, и многое другое.",16,11,250,0
471,"|cffffd100Совет.|r Святилище – это место, где запрещены стычки между игроками. Обычно их охраняют сильные нейтральные бойцы.",119,60,250,0
472,"|cffffd100Совет.|r У большей части фракций есть интенданты, продающие разные товары игрокам с достаточно высокой репутацией.",120,40,250,0
473,"|cffffd100Совет.|r В календаре отображается время сброса сохраненных рейдов. Его можно изменить на панели рейда, чтобы сохранить ваш прогресс.",121,60,250,0
475,"|cffffd100Совет.|r Если у вас возникли трудности с большой группой монстров в подземелье, попробуйте использовать способности контроля, такие как ""Превращение"" или ""Ошеломление"". Разделяйте и властвуйте!",154,15,69,0
476,"|cffffd100Совет.|r Цели на мини-карте отмечены стрелочкой вверх или вниз – в зависимости от того, ниже или выше цели вы находитесь.",15,0,0,0
479,|cffffd100Совет.|r С помощью функции управления экипировкой можно быстро переключаться между часто используемыми комплектами обмундирования.,124,50,250,0
483,"|cffffd100Совет.|r Если нажать Alt, наведя курсор на ячейку в окне персонажа, появится список вещей, которые можно поместить в эту ячейку.",128,20,250,0
489,"|cffffd100Совет.|r Если полоска заклинания противника имеет серый цвет или отмечена знаком щита, вы не сможете прервать его прочтение своими способностями.",129,40,250,0
490,"|cffffd100Совет.|r Гильдия может планировать события, пользуясь игровым календарем. Вы можете подписываться на события сами, а не ждать приглашения.",157,25,250,0
491,"|cffffd100Совет.|r Когда функция автозаполнения предлагает вам имена персонажей, вы можете выбрать имя в списке с помощью клавиш Tab или Shift + Tab.",131,40,250,0
500,"|cffffd100Совет.|r Убедитесь, что вы находитесь на официальном сайте Blizzard, прежде чем указывать данные своей учетной записи.",132,0,0,0
501,|cffffd100Совет.|r Обратный адрес электронных писем от компании Blizzard всегда заканчивается на blizzard.com.,133,5,250,0
504,|cffffd100Совет.|r Брелок Blizzard Authenticator поможет защитить учетную запись World of Warcraft от кражи.,136,10,250,0
505,"|cffffd100Совет.|r Чтобы избежать кражи учетной записи, не авторизуйтесь в World of Warcraft на компьютерах с общественным доступом, так как они могут быть заражены вредоносными программами.",137,10,250,0
