ID,Text_lang,SortIndex,Min_level,Max_level,ContentTuningID
506,"|cffffd100Совет.|r Остерегайтесь неофициальных сайтов, предлагающих платные услуги, связанные с World of Warcraft. Такие сайты могут распространять вредоносные программы, способствующие кражам учетных записей.",138,10,250,0
508,"|cffffd100Совет.|r Местонахождение заданий и персонажей, дающих их, отмечены на карте.",140,1,15,0
509,"|cffffd100Совет.|r Вы можете заработать награды за прохождение случайных подземелий, найденных с помощью системы поиска подземелий. Проходить их можно вместе с друзьями или в группе, собранной с помощью поиска подземелий.",141,20,49,0
538,"|cffffd100Совет.|r Вы можете поворачивать персонажа, передвигая мышь при зажатой ПКМ. Перемещая мышь при зажатой ЛКМ, вы можете изменить положение камеры.",142,1,9,0
543,|cffffd100Совет.|r Не стойте в огне!,145,50,250,0
578,"|cffffd100Совет:|r Лидер вашей группы может предложить другой группе провести маневры на арене или поле боя по своему выбору. Чтобы начать маневры, откройте окно PvP.",162,249,250,0
589,"|cffffd100Совет.|r Вы можете воспользоваться ""Поиском рейда"", чтобы присоединиться к рейдовой группе из 25 игроков и принять участие в самых захватывающих сражениях World of Warcraft.",164,70,70,0
596,"|cffffd100Совет.|r Есть много достижений, для выполнения которых засчитывается прогресс всех персонажей из вашего отряда.",167,10,250,0
597,"|cffffd100Совет.|r Если вы хотите собирать спутников и тренировать их для сражений, обратитесь к наставнику боевых питомцев.",168,15,250,0
601,"|cffffd100Совет.|r Спутники принадлежат всем персонажам в вашем отряде. Если один персонаж получил питомца, другие тоже смогут его призывать.",172,35,250,0
602,"|cffffd100Совет.|r Вы можете перетаскивать на панели команд значки способностей из книги заклинаний, а также окна специализации или талантов.",173,10,30,0
603,"|cffffd100Совет.|r Создайте нового персонажа, чтобы попробовать новую расу, класс или фракцию. Таких персонажей часто называют ""альтами"".",174,10,59,0
604,"|cffffd100Совет.|r Основная роль танка в группе – отвлечение противников на себя. Танки наносят меньше урона, но зато очень живучи.",175,10,59,0
605,|cffffd100Совет.|r Задача лекаря – оставаться в живых и не давать умирать другим участникам группы.,176,10,59,0
606,"|cffffd100Совет.|r Бойцы (иногда их называют ""дпс"" или ""дд"") специализируются на нанесении урона. В группе бойцам нужна поддержка в виде танков и лекарей.",177,10,59,0
612,|cffffd100Совет.|r Не получается выполнить задание? Не можете найти персонажа? Сложно разобраться с характеристиками предметов? Загляните на официальный форум WOW и посвященные игре фан-сайты!,181,0,0,0
620,"|cffffd100Совет.|r Вы можете изменить тип получаемой добычи, указав другую классовую специализацию. Для этого нужно щелкнуть ПКМ по портрету персонажа и выбрать другую специализацию добычи.",185,35,250,0
624,|cffffd100Совет.|r В обычном или героическом режиме рейда может участвовать любое число игроков от 10 до 30. Сложность и награды соответствуют числу участников. Для всех найдется место!,186,60,250,0
626,"|cffffd100Совет.|r В меню ""Коллекции"" есть пункт ""Игрушки"", куда автоматически помещаются все ваши декоративные предметы и игрушки после получения.",187,30,250,0
630,|cffffd100Совет.|r При использовании системы поиска подземелий в группе с друзьями вы сможете получить больше золота в качестве награды.,191,250,250,0
631,"|cffffd100Совет.|r Характеристики предметов, выделенные серым цветом, не оказывают влияния на возможности вашего персонажа.",192,15,250,0
632,"|cffffd100Совет.|r Инструмент ""Заранее собранные группы"" поможет вам создать или найти группу для прохождения подземелий, рейдов, заданий, PvP-битв и прочих совместных мероприятий.",193,60,250,0
643,|cffffd100Совет.|r Не можете одолеть сильного противника? Помните: главное – поддерживать уровень своего здоровья выше 0 и свести здоровье противника к 0. Проверено – работает всегда!,197,60,250,0
746,"|cffffd100Совет.|r Настроены по-боевому? Включите в столице своей фракции режим войны. Сражаясь с другими игроками в открытом мире в этом режиме, вы получите дополнительный опыт и награды за выполнение заданий!",200,30,250,0
749,"|cffffd100Совет:|r в сообществах есть каналы чата, поддержка голосовой связи и календарь мероприятий – то есть все, что нужно для поиска группы и общения с друзьями на любом сервере!",203,50,250,0
754,"|cffffd100Совет.|r Выбор ковенанта – шаг важный, но не необратимый. Достигнув максимального уровня известности в одном из них, вы сможете свободно выбрать новый ковенант в Орибосе.",205,250,250,0
755,"|cffffd100Совет.|r Вы новичок в WoW? Игроки со значком в виде зеленого флажка над головой – менторы, которые могут помочь вам освоиться на Азероте!",206,1,20,0
757,"|cffffd100Совет.|r Персонажи низкого уровня могут обратиться к Хроми в столице своей фракции, чтобы отправиться в другие миры и пройти кампании прошлых дополнений.",208,50,60,0
758,"|cffffd100Совет.|r Находясь в группе, вы можете включить режим синхронизации, чтобы выполнять вместе с друзьями задания низкого уровня – даже если вы их уже прошли.",209,60,250,0
760,"|cffffd100Совет.|r Задания, связанные с кампанией, отмечены особым значком и находятся в верхней части журнала. Выполняйте эти задания, чтобы продвигаться по сюжету и открывать новый контент.",211,50,250,0
761,"|cffffd100Совет.|r Таинственный Резчик Рун в Торгасте может усиливать качественные предметы, созданные игроками, превращая их в легендарное снаряжение!",212,250,250,0
762,|cffffd100Совет:|r Эффективность некоторых умений и заклинаний снижена в боях с другими игроками (PvP).,213,25,250,0
763,"|cffffd100Совет.|r Щелкните по карте, удерживая Ctrl, чтобы поставить точку маршрута для удобства ориентации. Щелкните по точке маршрута, зажав Shift, чтобы поделиться ею с другими игроками.",214,20,250,0
764,"|cffffd100Совет.|r Щелкните по номеру рядом с заданием в списке целей, чтобы включить навигационный указатель, который поможет вам добраться до нужного места.",215,10,69,0
765,"|cffffd100Совет.|r В разделе настроек ""Спецвозможности"" есть различные вспомогательные инструменты, в том числе параметры для тех, кто не различает цветов, страдает от укачивания или нарушений зрения.",216,10,250,0
766,"|cffffd100Совет.|r Игроки с навыком портняжного дела могут изготавливать сумки куда большего размера, чем можно купить у торговцев. Эти сумки часто выставляют на продажу в аукционном доме.",217,15,49,0
767,"|cffffd100Совет.|r Служба поиска гильдий и сообществ (""J"" по умолчанию) поможет вам найти других игроков, которые разделяют ваши интересы в WoW.",218,15,250,0
768,"|cffffd100Совет.|r Путеводитель по приключениям (""SHIFT-J"" по умолчанию) покажет вам оптимальный контент для вашего уровня, а также текущие временные события.",219,20,250,0
772,"|cffffd100Совет.|r Повышая уровень, вы получаете очко талантов для ветки класса или специализации, которое можно потратить для улучшения и персонализации боевых навыков.",223,10,69,0
773,"|cffffd100Совет.|r Чтобы настроить WoW по своему вкусу, нажмите Esc и перейдите в режим редактирования. Он позволит вам передвинуть многие элементы интерфейса и изменить их размер.",224,40,250,0
775,"|cffffd100Совет.|r У всех персонажей в вашем отряде общее количество очков достижений. Учитываются даже те достижения, которые были получены только определенными персонажами.",225,10,250,0
776,|cffffd100Совет.|r Для изготовления предметов можно использовать реагенты из банка отряда. Это позволяет совмещать профессии всех ваших персонажей.,226,10,250,0
777,"|cffffd100Совет.|r В отряде состоят все персонажи учетной записи. У них много общих функций: общая коллекция, воздушные маршруты и даже прогресс некоторых репутаций.",227,10,250,0
778,"|cffffd100Совет.|r Контент с отметкой ""Отряд"" доступен всем персонажам вашей учетной записи.",228,10,250,0
779,"|cffffd100Совет.|r Валюты, помеченные как общие для отряда можно передавать между своими персонажами. Для этого выберите ее в меню валют.",229,10,250,0
780,"|cffffd100Совет.|r Нашли предмет, а вашему персонажу он не подходит? Если он привязан к отряду, передайте его другим персонажам или попробуйте новый подходящий класс!",230,10,250,0
781,"|cffffd100Совет.|r У вас есть предмет, который становится персональным при надевании, и вы не можете его надеть, но хотите добавить облик в коллекцию? Нажмите на него ПКМ или перетащите в окно персонажа.",231,10,250,0
782,"|cffffd100Совет.|r Вы можете собирать облики большинства предметов в коллекцию отряда, даже если ваш персонаж не может их надеть.",232,10,250,0
783,"|cffffd100Совет.|r Большая часть заданий, которые вы уже выполнили в отряде, будет скрыта на карте и затемнена в других местах. Если вы не хотите, чтобы это происходило, отключите функцию в меню отслеживания или фильтрах карты.",233,60,250,0
784,"|cffffd100Совет.|r Наберите команду ""/трюк"", пока ваше средство передвижения находится на земле, и для него сработает особая анимация. Чтобы облегчить доступ к команде, для нее можно создать макрос.",234,40,250,0
