ActivityName_lang,Description_lang,ID,CriteriaTreeID,ThresholdContributionAmount,Field_10_1_0_48480_005,Field_10_1_0_48776_006
"Победите боссов события ""Неистовство бури""","Победите боссов события ""Неистовство бури"" в будущем воинов стихий на Драконьих островах.",150,142527,100,0,0
Выполните публичные заказы на предметы,"Поговорите с управляющим заказами на рынке ремесленников Вальдраккена, чтобы посмотреть заказы на предметы.",152,142299,100,0,0
Откройте двери Зкерских хранилищ,Найдите ключи и откройте двери в Зкерских хранилищах.,154,143906,100,0,0
Завершите каждую великую охоту кентавров Маруук,Завершите каждую великую охоту кентавров Маруук на Драконьих островах.,155,143919,150,0,0
"Скажите ""Да, шеф!"" на большом пиршестве","Скажите ""Да, шеф!"" на большом пиршестве в Искаре на Драконьих островах.",156,143922,50,0,0
Выполните локальные задания по гонкам на драконах,,157,144066,50,0,0
Пройдите локальные задания Драконьей экспедиции,Выполните локальные задания Драконьей экспедиции на Драконьих островах.,158,143930,100,0,0
Победите боссов изначальных бурь в Запретном краю,Победите боссов изначальных бурь в Запретном краю на Драконьих островах.,159,143936,50,0,0
"Выполните задание ""Искры жизни""","Выполните задание ""Искры жизни"" на Драконьих островах",160,143949,100,0,0
Выполните еженедельные задания Зкерских хранилищ,Выполните еженедельные задания Зкерских хранилищ в Запретном крае на Драконьих островах.,161,143955,75,0,0
Победите укротителей питомцев Драконьих островов с питомцами-драконами,Возьмите в команду как минимум двух питомцев-драконов и победите опытных укротителей питомцев Драконьих островов.,162,143959,200,0,0
"Используйте игрушку ""Скользящие пески"" в подземелье Warlords of Draenor",,163,143966,50,0,0
Детская неделя: выполните задание,From {EventStartDate} - {EventEndDate} complete a Children's Week quest.,164,143968,100,0,0
Детская неделя: проходите ежедневные задания вместе с сиротой,From {EventStartDate} - {EventEndDate} complete daily quests while you have an orphan alongside you.,165,143977,100,0,0
Детская неделя: охотьтесь на рыб-гигантов с гарпуном в сопровождении сироты,From {EventStartDate} - {EventEndDate} use a harpoon to land lunkers while you have an orphan alongside you.,166,143998,50,0,0
Детская неделя: выполняйте задания,From {EventStartDate} - {EventEndDate} complete 4 Children's Week quests.,167,144000,150,0,0
"Детская неделя: порадуйтесь успехам (/рад) Паэры Чистый Ветер, находясь в сопровождении сироты",From {EventStartDate} - {EventEndDate} emote /cheer at Paera Finebreeze in Iskaara while you have an orphan alongside you.,168,144011,50,0,0
Детская неделя: проходите подземелья с эпохальным ключом вместе с сироткой,From {EventStartDate} - {EventEndDate} complete Mythic+ dungeons while you have an orphan alongside you.,169,144013,100,0,0
Весенний фестиваль воздушных шаров: Полетайте на воздушном шаре,From {EventStartDate} - {EventEndDate} hop into a hot air balloon and enjoy the whole ride.,170,144015,100,0,0
Фестиваль огнешляпок: Станьте свидетелем расцвета и увядания Фшу,On {EventStartDate} help keep the great Fshoo alive as long as possible in Sporeggar in Zangarmarsh.,171,144017,150,0,0
"Ярмарка Новолуния: выполните задание ""Командир танка""",From {EventStartDate} - {EventEndDate} complete the quest Tonk Commander on Darkmoon Faire Island.,172,144021,50,0,0
Ярмарка Новолуния: Шарик + пони = потеха,From {EventStartDate} - {EventEndDate} ride a Darkmoon Pony around Darkmoon Faire Island while holding a balloon.,173,144028,50,0,0
Рыбалка с игрушечной уточкой,"Используйте игрушку ""Ящик поплавков: уточка"" и выудите предметы на Драконьих островах.",174,144039,50,0,0
Убивайте существ во славу Пылающего Клинка,"Убивайте существ, которые дают опыт, находясь под действием эффектов от знамени клана Пылающего Клинка, на Драконьих островах.",175,144041,50,0,0
"Используйте игрушку ""Мурл-очки""","Используйте мурл-очки в Вальдраккене, Искаре, Марукай и лагере Драконьей экспедиции.",176,144043,100,0,0
Потанцуйте (/танец) с мурл-очками,"Потанцуйте (/танец) с игроком под действием игрушки ""Мурл-очки"".",177,144048,50,0,0
Переверните доску для игры в Hearthstone,"Поставьте доску для игры в Hearthstone и переверните игральное поле Hearthstone в таверне ""Двери нараспашку"" в Лазурном Просторе.",178,144050,50,0,0
Впрягитесь в клыкаррские волокуши или покатайтесь на них,Впрягитесь в клыкаррские волокуши или покатайтесь на них.,179,144056,50,0,0
Timewalking: Defeat Draenor Pet Tamers,From {EventStartDate} - {EventEndDate} defeat Draenor Master Tamers.,180,144059,100,0,0
Пройдите обратные маршруты гонок на драконах в Запретном крае.,Поговорите с бронзовым хранителем времени Запретного края на Драконьих островах.,181,144100,100,0,0
Поймайте лавовую рыбу на Драконьих островах.,,182,144559,100,0,0
[DNT] Test: Noblegarden: Complete a Dragonflight Dungeon in a Spring Circlet,"[DNT]  Test: From {EventStartDate} - {EventEndDate}, complete a Dragonflight dungeon wearing any Spring Circlet.",184,144640,150,0,0
Восстановите бодрость в бреющем полете на драконе.,,185,144628,100,0,0
Пройдите локальные задания Драконьей экспедиции в пещере Заралек,Выполните локальные задания по скалолазанию и каталогизированию в пещере Заралек.,186,144630,100,0,0
Поймайте крупную лавовую рыбу гарпуном,"Вытащите крупную лавовую рыбу искарским гарпуном возле места, где клыкарры видели крупную рыбу у рыболовной лунки.",187,144835,100,0,0
Убивайте игроков на на Берегах Пробуждения,,188,144916,100,0,0
Победите грозовых питомцев-боссов Запретного края с питомцами-элементалями.,Возьмите в команду как минимум двух питомцев-элементалей и победите грозовых питомцев-боссов Запретного края.,189,146075,200,0,0
Праздник Огненного солнцеворота: выполняйте ежедневные задания,From {EventStartDate} - {EventEndDate} complete Midsummer Fire Festival daily quests.,190,145066,200,0,0
Огненный солнцеворот: поклонитесь огням в Пандарии,From {EventStartDate} - {EventEndDate} honor the flames on Pandaria.,191,145072,200,0,0
Огненный солнцеворот: оскверните костер в Пандарии,From {EventStartDate} - {EventEndDate} desecrate the bonfire in Vale of Eternal Blossoms on Pandaria.,192,145087,100,0,0
Огненный солнцеворот: поклонитесь огням на Драконьих островах,From {EventStartDate} - {EventEndDate} honor the flames on the Dragon Isles.,193,145090,200,0,0
Огненный солнцеворот: станцуйте у огня возле Обсидианового Трона.,From {EventStartDate} - {EventEndDate} emote /dance with the Brazier of Dancing Flames toy at the Obsidian Throne in the Waking Shores.,194,145097,100,0,0
Огненный солнцеворот: победите Ахуна,From {EventStartDate} - {EventEndDate} defeat the Frost Lord Ahune.,195,145187,200,0,0
Выполняйте задания в Пандарии,"Пройдите задания в Пандарии, за выполнение которых можно получить опыт.",196,145189,150,0,-40
Поймайте рыбу в Пандарии,,200,145221,100,0,-40
Timewalking: Defeat Pandaria Master Tamers,From {EventStartDate} - {EventEndDate} defeat 3 Pandaria Master Tamers.,201,145232,100,0,-40
Вечеринка тысячи лодок: изготовьте маленькую лодку,From {EventStartDate} - {EventEndDate} complete Thousand Boat Bash quests to acquire and combine parts into a Small Boat.,202,145239,100,0,0
Вечеринка тысячи лодок: плавание вокруг Драконьих островов,From {EventStartDate} - {EventEndDate} use a Small Boat to sail around the Dragon Isles.,203,145241,150,0,0
"Ярмарка Новолуния: выполните задание ""Вызов огнекрыла""",From {EventStartDate} - {EventEndDate} complete the quest Firebird's Challenge at the Darkmoon Faire.,205,145281,50,0,0
"Ярмарка Новолуния: используйте игрушку ""Горящий обруч"" на острове Новолуния и в Вальдраккене",From {EventStartDate} - {EventEndDate} use the Flaming Hoop toy on Darkmoon Faire Island and in Valdrakken.,206,145285,50,0,0
"Победите Кокию Пламенное Копыто, после того как разогреете Омуты Жизни","Победите Кокию Пламенное Копыто в Рубиновых Омутах Жизни в эпохальном режиме, после того как разогреете 4 омута с помощью пылающего валуна.",207,145290,100,0,0
Пройдите маршруты для гонок драконов в пещере Заралек,Поговорите с бронзовым хранителем времени в пещере Заралек на Драконьих островах.,209,145403,100,0,0
Убивайте игроков в пещере Заралек,,210,145405,100,0,0
Проходите локальные задания по битвам питомцев в пещере Заралек,Проходите локальные задания по битвам питомцев в пещере Заралек с полной командой питомцев 25-го уровня.,211,145407,150,0,0
Выполните локальные задания по скалолазанию в пещере Заралек.,,212,145414,100,0,0
Путешествия во времени: пройдите 1 подземелье в режиме путешествия во времени Warlords of Draenor.,From {EventStartDate} - {EventEndDate} complete Warlords of Draenor Timewalking dungeons.,213,145430,25,0,0
Путешествия во времени: пройдите 1 подземелье в режиме путешествия во времени Legion.,From {EventStartDate} - {EventEndDate} complete Legion Timewalking dungeons.,214,145441,25,0,0
Путешествия во времени: пройдите 5 подземелье в режиме путешествия во времени Legion.,From {EventStartDate} - {EventEndDate} complete Legion Timewalking dungeons.,215,145457,100,214,0
Завершите испытание в битве питомцев.,"Посетите магазин питомцев в Даларане, Тиззи Шестеряд в Боралусе или Радека Фитильфикса в Дазар'алоре, чтобы начать испытание.",216,145477,100,0,0
Праздник фейерверков: потанцуйте (/танец) с гуляками.,"On {EventStartDate} emote /dance at a reveler in Stormwind, Orgrimmar, and Booty Bay.",217,145546,100,0,-4
"Используйте игрушку ""Медальон пылающего защитника"" и убивайте существ","Убивайте существ, которые дают опыт, находясь под действием медальона пылающего защитника, на Драконьих островах.",218,145550,100,0,0
Убейте существ в крепости Расколотой Чешуи или в Обсидиановой цитадели,Убейте существ в крепости Расколотой Чешуи или в Обсидиановой цитадели на Берегах Пробуждения,219,145554,100,0,0
Свет под водой: купите выделения медуз.,On {EventStartDate} purchase Jelly Jam from Max Megablast in Vashj'ir.,220,145559,120,0,-13
Свет под водой: купите подводный буксировщик.,On {EventStartDate} purchase a Submersible Propulsion Device from Max Megablast in Vashj'ir.,221,145563,130,0,-13
Свет под водой: купите поврежденный шлем для подводного плавания.,On {EventStartDate} purchase a Damaged Diving Helmet from Max Megablast in Vashj'ir.,222,145565,150,0,-13
"Покажите, что вам /холодно, игроку под действием игрушки ""Коробок спичек""","Покажите, что вам /холодно, игроку под действием игрушки ""Коробок спичек"".",223,145567,50,0,0
Танцевальная вечеринка аукциона: выразите /несогласие с разгневанной торговкой.,On {EventStartDate} emote /disagree at an Angry Trader outside of a Stormwind or Orgrimmar Auction House.,224,145569,100,0,-22
"Используйте игрушку ""Коробок спичек""","Используйте коробок спичек в Вальдраккене, Искаре, лагере Драконьей экспедиции и Марукае.",225,145571,100,0,0
"Танцевальная вечеринка аукциона: получите эффект ""Ноги в пляс"".",On {EventStartDate} gain Happy Feet by being summoned on stage at the Stormwind or Orgrimmar Auction House.,226,145586,100,0,-22
Огненный солнцеворот: украдите пламя.,From {EventStartDate} - {EventEndDate} complete the Stealing Orgrimmar's Flame or Stealing Stormwind's Flame quest.,227,145588,150,0,-2
Покажите свою радость (/рад) торговой лавке,Покажите радость (/рад) торговцам в торговой лавке и их товарам.,228,145597,20,0,0
Покажите свою радость (/рад) супербанде Великого Панциря,"Используйте игрушку ""Супербанда Великого Панциря"" и покажите радость (/рад) супербанде Великого Панциря.",230,145600,20,0,0
Покажите свою радость (/рад) драконьим Аспектам,Покажите радость (/рад) драконьим Аспектам в Вальдраккене.,231,145602,20,0,0
Используйте термические танцевальные стельки,"Используйте игрушку ""Термические танцевальные стельки"" в Вальдраккене и Лоамме.",232,145606,50,0,-30
Крикните /браво термическим танцевальным стелькам,"Покричите /браво игроку противоположной фракции под действием эффекта ""Пламенные ноги"" от игрушки ""Термические танцевальные стельки"".",233,145613,100,0,-30
Выполните ежедневные задания в лагерях насыщения во время налета Фиракка,Выполните ежедневные задания в лагерях насыщения во время налета Фиракка на Драконьих островах.,234,145702,100,0,0
Покажите радость (/рад) гоночным улиткам в Мерцающем Огге,Покажите радость (/рад) гоночным улиткам в Мерцающем Огге.,235,145736,50,0,0
"Используйте игрушку ""Веселая клыкаррская вечеринка""","Используйте игрушку ""Веселая клыкаррская вечеринка"" в Вальдраккене и Лоамме.",236,145723,50,0,0
"Используйте игрушку ""Скользящие пески"".","Используйте игрушку ""Скользящие пески"" в Вальдраккене, деревне моркутов и Лоамме.",237,145741,50,0,-40
"Потанцуйте (/танец) с игрушкой ""Скользящие пески""","Потанцуйте (/танец) с игроком противоположной фракции под действием игрушки ""Скользящие пески"".",238,145745,100,0,-40
Запустите инженерные салюты драконов в столицах,Запустите инженерные салюты драконов в Вальдраккене и Штормграде/Оргриммаре.,239,145765,50,0,-50
Откройте сундуки с сокровищами в пещерах ниффов.,"Откройте сундуки с добычей, исследуя пещеру Заралек со спутником-ниффом.",240,145770,200,0,0
Запустите салюты драконов в подземельях Dragonflight,Запустите инженерные салюты драконов в подземельях Dragonflight.,241,145788,50,0,-50
Запустите салюты драконов в подземельях Dragonflight,Запустите инженерные салюты драконов в рейдовых подземельях Dragonflight.,242,145790,50,0,-50
"Используйте игрушку ""Танцы Новой Луны"".","Используйте игрушку ""Танцы Новой Луны"" в Лоамме.",243,145792,50,0,0
Расставьте драконий чайный сервиз.,"Используйте игрушку ""Драконий чайный сервиз"" в Вальдраккене, Искаре, деревне моркутов и у Обсидианового Трона.",244,145794,50,0,0
"Используйте игрушку ""Т.А.Н.Э.Ц.""","Послушайте музыку из игрушки ""Т.А.Н.Э.Ц."" в Вальдраккене и Штормграде/Оргриммаре.",245,145801,50,0,0
Ярмарка Новолуния: покажите свою радость (/рад) музыкальным группам,From {EventStartDate} - {EventEndDate} emote /cheer at the bands on Darkmoon Faire Island.,246,145810,50,0,0
Получите энергию стихий.,Добудьте энергию стихий  у существ в зоне изначальных бурь.,247,145813,100,0,0
Получите добычу из горнил насыщения во время налета Фиракка,Получите добычу из горнил насыщения во время налета Фиракка на Драконьих островах.,248,145855,100,0,0
Найдите древние камни в пещере Заралек,,249,145857,100,0,0
"Соберите детали титанов во время события ""Исследователи под огнем""","Соберите детали титанов во время события ""Исследователи под огнем: режим изоляции"".",250,145862,100,0,0
Попытайтесь /принюхаться к Мирриту.,/Принюхайтесь к Мирриту во время поисков сокровищ в пещере Заралек.,251,145976,50,0,0
Отгоните воодушевленных болельщиков на улиточных бегах.,"Отгоните воодушевленных болельщиков, мешающих улиточным бегам в Мерцающем Огге.",252,145980,50,0,0
"Убейте существ во время события ""Исследователи под огнем""","Убейте существ во время события ""Исследователи под огнем"" в руинах Дреказеры в пещере Заралек.",253,145988,150,0,0
Алчный посланец: убейте алчных гоблинов,"From {EventStartDate} - {EventEndDate} kill treasure goblins in Stormwind, Orgrimmar, or on the Dragon Isles.",254,146252,250,0,0
Улучшите отношения с лоаммскими ниффами,,255,146080,100,0,0
Огненный солнцеворот: Совершите /поклон перед сполохом,From {EventStartDate} - {EventEndDate} emote /bow at a Summer Scorchling or a Festival Scorchling.,256,146088,50,0,0
Одержите победу в 1 битве питомцев в режиме PvP.,,258,146502,50,0,0
Одержите победу в 5 битвах питомцев в режиме PvP.,,259,146504,100,258,0
Поймайте необычного боевого питомца,Поймайте необычного боевого питомца в пещере Заралек.,260,146506,100,0,0
Победите в дуэлях на Драконьих островах,"Победите другого игрока в дуэли в Вальдраккене, Марукае и Лоамме.",261,146508,100,0,0
Помогите Хитрику победить в улиточных бегах,Герои Орды помогают улитке Хитрику победить в улиточных бегах Мерцающего Огга в пещере Заралек.,262,146515,100,0,0
Помогите Робышу победить в улиточных бегах,Герои Альянса помогают улитке Робышу победить в улиточных бегах Мерцающего Огга в пещере Заралек.,263,146539,100,0,0
Помогите Брюли победить в улиточных бегах,Помогите Брюли победить в улиточных бегах Мерцающего Огга в пещере Заралек.,264,146541,100,0,0
Пройдите 1 маршрут для гонок драконов на Драконьих островах,Поговорите с бронзовым хранителем времени на месте состязания на Драконьих островах.,265,146543,100,0,0
"Шоу ""Наденьте это немедленно!"": получите 20 жетонов.",From {EventStartDate} - {EventEndDate} earn Trial of Style Tokens by participating in the Trial of Style.,266,146545,20,0,0
"Шоу ""Наденьте это немедленно!"": получите 300 жетонов.",From {EventStartDate} - {EventEndDate} earn Trial of Style Tokens by participating in the Trial of Style.,267,146547,200,61,0
"Шоу ""Наденьте это немедленно"": пройдите 2 задания ""Работай на камеру!""","From {EventStartDate} - {EventEndDate} complete ""Work It"" quests on the Dragon Isles.",268,146549,20,0,0
"Шоу ""Наденьте это немедленно"": пройдите 10 заданий ""Работай на камеру!""","From {EventStartDate} - {EventEndDate} complete ""Work It"" quests on the Dragon Isles.",269,146551,180,268,0
