ActivityName_lang,Description_lang,ID,CriteriaTreeID,ThresholdContributionAmount,Field_10_1_0_48480_005,Field_10_1_0_48776_006
Выполните 30 заданий,"Пройдите задания, за выполнение которых можно получить опыт.",3,135693,200,0,0
Победите 50 боссов в подземельях,"Пройдите боссов, которые дают вам опыт, в подземельях.",4,135695,200,0,0
Feast of Winter Veil: Obtain a Finely-Tailored Holiday Hat,"From {EventStartDate} - {EventEndDate}, obtain a Finely-Tailored Holiday Hat",5,135697,50,0,-100
Пройдите 5 эпохальных подземелий с ключом,,6,135699,200,0,7
Выполните 15 локальных заданий,,7,136176,150,0,0
Победите 10 рейдовых боссов Dragonflight,,8,136202,200,0,0
Заработайте 7500 очков чести,,10,136220,200,0,0
Одержите победу на 5 полях боя,,11,136222,200,0,0
Одержите победу в 10 матчах на арене (кроме стычек),,12,136224,200,0,0
Выполните заказы на предметы,Поговорите с управляющим заказами на рынке ремесленников в Вальдраккене.,13,136242,200,0,0
Одержите победу в 15 битвах питомцев,,14,136244,200,0,0
Победите 25 боссов в подземельях в группе для обеих фракций,"Победите боссов подземелий, которые дают опыт, в составе межфракционной группы.",16,136248,150,0,0
Complete Quests in Northrend,,17,136250,100,0,0
Пройдите 5 подземелий в режиме путешествия во времени Wrath of the Lich King,,18,136265,250,0,0
Defeat the Lich King,Kill the Lich King in the Icecrown Citadel.,19,136286,50,0,0
Complete Alterac Valley Battlegrounds,,20,136288,100,0,0
Battle Pet Week: Defeat Northrend Master Tamers with a Little Helper,"From {EventStartDate} - {EventEndDate}, use at least one Little Helper to defeat all Northrend Master Tamers.",21,136291,75,0,-110
Timewalking: Go Fishing in Northrend,From {EventStartDate} - {EventEndDate} fish up items in Northrend.,22,136300,100,0,0
Shiver at Ragnaros,Emote /cold at Ragnaros in the Molten Core.,23,136323,25,0,0
Feast of Winter Veil: Dance Around the Tree While Dressed for the Occasion,"From {EventStartDate} - {EventEndDate}, dance with another player near the festive tree while wearing Winter Garb.",24,136325,50,0,-100
Убейте 100 ледяных элементалей,,25,136327,100,0,0
Darkmoon Faire: Complete Target: Turtle,From 12/3 - 12/9 complete the quest Target: Turtle on Darkmoon Faire Island.,26,136357,50,0,-62
Feast of Winter Veil: Kill 3 Festive Bosses,From {EventStartDate} - {EventEndDate} kill three of the following bosses.,27,136359,50,0,-100
Wanderer's Festival: Attend the Festival,From {EventStartDate} - {EventEndDate} attend the Wanderer's Festival at Turtle Beach in Krasarang Wilds.,28,136364,100,0,-70
"Wanderer's Festival: Launch a Lantern and Read ""Waiting for the Turtle""","From {EventStartDate} - {EventEndDate}, launch a lantern and read ""Waiting for the Turtle"" at the Wanderer's Festival in Krasarang Wilds.",29,136366,75,0,-70
Darkmoon Faire: Eat a Corn-Breaded Sausage After Your Ride,"From 12/3 - 12/9 ride the Darkmoon carousel or roller-coaster, then eat a corn-breaded sausage.",30,136369,25,0,-62
Убейте лидера противоположной фракции,,31,136449,400,0,0
Explore a Snowy Region,Fully explore one of the following zones.,32,136527,50,0,0
Feast of Winter Veil: Gain Chillin',"From {EventStartDate} - {EventEndDate} (Winter Veil), gain Chillin' from Coldrage's Cooler.",34,136855,25,0,-100
Timewalking: Complete Quests in Draenor,From {EventStartDate} - {EventEndDate} complete quests in Draenor.,36,149949,100,0,0
Путешествия во времени: пройдите 5 подземелий в режиме путешествия во времени Warlords of Draenor,From {EventStartDate} - {EventEndDate} complete Warlords of Draenor Timewalking dungeons.,37,137530,100,213,0
Пройдите цитадель Адского Пламени,,38,137539,150,0,0
Убейте 15 игроков в Танаанских джунглях,,39,137541,200,0,0
Победите опытных укротителей питомцев Драконьих островов с питомцами-драконами,Возьмите в команду как минимум двух питомцев-драконов и победите двух опытных укротителей питомцев Драконьих островов,40,137543,200,0,0
Timewalking: Go Fishing in Draenor,From {EventStartDate} - {EventEndDate} fish up items in Draenor.,41,149979,100,0,0
"Покормите питомца закуской ""Счастливый питомец""","Купите закуски ""Счастливый питомец"" у Бреанни в ""Волшебном зверинце"" в Даларане.",42,137615,100,0,0
Любовная лихорадка: используйте камушек возвращения Мелкошустра на Драконьих островах,From {EventStartDate} - {EventEndDate} use the Peddlefeet's Lovely Hearthstone toy on the Dragon Isles.,43,137617,150,0,0
Любовная лихорадка: используйте корзинку для романтического пикника на равнинах Он'ары,From {EventStartDate} - {EventEndDate} use the Romantic Picnic Basket toy in Ohn'ahran Plains.,44,137619,150,0,0
"Любовная лихорадка: выполните задание ""Вкус конфет""",From {EventStartDate} - {EventEndDate} complete the quest Bonbon Blitz.,45,137621,150,0,0
Любовная лихорадка: победите аптекаря Хаммела.,From {EventStartDate} - {EventEndDate} defeat Apothecary Hummel in Shadowfang Keep.,46,137623,150,0,0
Любовная лихорадка: подарите чудесный браслет-оберег,From {EventStartDate} - {EventEndDate} present a Lovely Charm Bracelet to one of your faction leaders.,47,137625,150,0,0
Обнимите мертвого игрока,Обнимите (/обнять) мертвого игрока.,48,137634,50,0,0
Воскресите игроков,,49,137636,50,0,0
Примените медленный яд Занзила,"Выпейте медленный яд Занзила, который можно купить у Джеральда Черного в Штормграде или у Альфеуса Кейна в Оргриммаре.",50,137645,50,0,0
Заработайте золото на аукционе,,52,137647,100,0,0
"Съешьте кусок шоколадного торта, кусочек восхитительного торта и кусок ягодного пирога","Съешьте кусок шоколадного торта, кусочек восхитительного торта и кусок ягодного пирога, которые можно купить у Айми в старом Даларане.",53,137651,50,0,0
Вылупление гиппогрифов: блеклоперый птенец на плече,On {EventStartDate} incubate a Frayfeather Egg to get a hatchling to perch on your shoulder.,54,137655,150,0,0
Вылупление гиппогрифов: используйте призрачное перо,On {EventStartDate} loot a Spectral Feather from Lorthalium and use it.,55,137657,150,0,0
Ярмарка Новолуния: выставите большой ягодный пирог,From {EventStartDate} - {EventEndDate} set out a Big Berry Pie on Darkmoon Faire Island.,56,137659,50,0,0
"Шоу ""Наденьте это немедленно!"": получите 100 жетонов.",From {EventStartDate} - {EventEndDate} earn Trial of Style Tokens by participating in the Trial of Style.,61,137688,100,266,0
Timewalking: Go Fishing in the Broken Isles,From {EventStartDate} - {EventEndDate} fish up items in the Broken Isles.,63,149983,100,0,0
Получите игрушку для создания эффектного образа.,,64,137776,50,0,0
Наденьте это немедленно: порадуйтесь успехам других игроков (/рад),From {EventStartDate} - {EventEndDate} emote /cheer at players while participating in the Trial of Style.,65,137787,50,0,0
"Шоу ""Наденьте это немедленно!"": используйте прожектор, танцпол и всполохи пламени","From {EventStartDate} - {EventEndDate} use Trial of Style Spotlight, Dance Floor, and Flames while participating in the Trial of Style.",66,137789,100,0,0
"Шоу ""Наденьте это немедленно!"": воспользуйтесь письмом от поклонника",From {EventStartDate} - {EventEndDate} use Letter from an Admirer while participating in the Trial of Style.,67,137793,50,0,0
Победите Кель'таса Солнечного Скитальца на Террасе Магистров,,68,137795,150,0,0
Безумие Ун'Горо: получите моджо динозавра,From {EventStartDate} - {EventEndDate} loot Dino Mojo in Un'Goro Crater.,69,137797,150,0,0
Безумие Ун'Горо: получите крутую адаптацию,From {EventStartDate} - {EventEndDate} use Dino Mojo to increase Adaptation effects until you are awesome.,70,137799,150,0,0
"Ярмарка Новолуния: выполните задание ""Искусство быть пушечным ядром""",From {EventStartDate} - {EventEndDate} complete the quest The Humanoid Cannonball on Darkmoon Faire Island.,71,137801,50,0,0
Используйте перенастроенные коргогляды,,72,137803,50,0,0
Измените свою внешность,Посетите парикмахерскую в крупном городе и измените свою внешность.,73,137805,20,0,0
Наденьте это немедленно: откройте иллюзию внешнего вида двууголки торговца,From {EventStartDate} - {EventEndDate} collect the Trader's Bicorne appearance by participating in the Trial of Style.,74,137807,20,0,0
"Покажите /мускулы другому игроку, когда вы в эффектном образе","Продемонстрируйте /мускулы игрокам, получив эффектный образ от игрушки",75,137809,50,0,0
Сделайте /реверанс игроку из другой фракции,Сделайте /реверанс игроку из другой фракции.,76,137811,20,0,0
Испытайте благоговейный /трепет перед игроком в эффектном образе.,Продемонстрируйте /трепет игрокам с эффектным образом от игрушки,77,137813,50,0,0
Повысьте репутацию среди фракций Драконьих островов,,79,137872,150,0,0
Пройдите 15 эпохальных подземелий с ключом,,81,140979,200,6,5
Завершите каждую великую охоту кентавров Маруук,Завершите каждую великую охоту кентавров Маруук на Драконьих островах.,82,140981,150,0,0
Вытащите крупную рыбу вместе с другом,Вытащите гарпуном крупную рыбу на Драконьих островах вместе с другим игроком.,83,140983,50,0,0
Выполните задания во время большого пиршества искарских клыкарров,Выполните задания во время большого пиршества в Искаре на Драконьих островах.,84,140985,50,0,0
Завершите осаду Драконьей Погибели,"Пройдите сценарий ""Осада Драконьей Погибели"" на Берегах Пробуждения на Драконьих островах.",85,140987,50,0,0
Воспользуйтесь помощью друга во время скалолазания,Воспользуйтесь помощью друга во время локальных заданий по скалолазанию на Драконьих островах.,86,140989,50,0,0
Победите особых существ по время изначальных бурь,Особые существа появляются во время бурь стихий на Драконьих островах.,87,140991,100,0,0
Пройдите 4 маршрута для гонок драконов на Драконьих островах,Поговорите с бронзовым хранителем времени на месте состязания на Драконьих островах.,88,141010,250,265,0
Выполните локальное PvP-задание на Драконьих островах,,89,141012,100,0,0
Победите босса вне подземелья на Драконьих островах,,90,141021,100,0,0
Завершите сюжетные цепочки дополнительных заданий на Берегах Пробуждения,,91,141032,200,0,0
Выполните еженедельные задания по сбору ресурсов,Поговорите с учителем профессии на рынке ремесленников в Вальдраккене.,92,141044,100,0,0
Выполните еженедельные задания по изготовлению предметов,Поговорите с учителем профессии на рынке ремесленников в Вальдраккене.,93,141057,100,0,0
Заберите добычу из сундуков с военными припасами на Драконьих островах,,94,141095,100,0,0
Выудите предметы на Драконьих островах,,95,141125,100,0,0
Покажите свою /любовь драконьим Аспектам,Покажите свою /любовь драконьим Аспектам в Вальдраккене,96,141883,50,0,0
Покажите свою /любовь павшим драконам,Покажите свою /любовь двум из павших драконов в соответствующих рейдах.,97,141887,50,0,0
Получите весеннюю игрушку,,98,141941,50,0,0
Сад чудес: съешьте шоколадные яйца в Искаре,From {EventStartDate} - {EventEndDate} eat Noblegarden Chocolates in Iskaara on the Dragon Isles.,99,141949,100,0,0
Сад чудес: примените весенние цветы на арене или поле боя,From {EventStartDate} - {EventEndDate} use Spring Flowers on an opposing player in an arena or battleground.,100,141951,50,0,0
Сад чудес: соберите раскрашенные яйца,From {EventStartDate} - {EventEndDate} collect Brightly Colored Eggs.,101,141953,100,0,0
Сфотографируйте легендарных рыболовов,Сфотографируйте легендарных рыб во время локальных заданий по составлению каталога на Драконьих островах.,102,141960,50,0,0
Выполните локальные задания по составлению каталога,Выполните локальные задания по составлению каталога на Драконьих островах.,103,141971,50,0,0
Получите энергию стихий.,Добудьте энергию стихий  у существ в зоне изначальных бурь на Драконьих островах.,104,141979,100,0,0
Пройдите маршруты для гонок драконов на Драконьих островах,Поговорите с бронзовым хранителем времени на Драконьих островах.,105,141981,100,0,0
Сад чудес: положите яйца,From {EventStartDate} - {EventEndDate} place 12 Intricately-Painted Eggs or 1 Magnificently-Painted Egg.,106,141983,50,0,0
"Марш головастиков: выполните задание ""Подарок от вашего головастика""",On {EventStartDate} complete the quest A Gift From Your Tadpole.,107,141986,150,0,0
Завершите сюжетные цепочки дополнительных заданий на равнинах Он'ары,,108,141988,150,0,0
Победите боссов великой охоты,Победите боссов великой охоты кентавров Маруук на Драконьих островах.,109,141997,100,0,0
Поймайте крупных рыб с помощью гарпуна,Вытащите гарпуном крупных рыб на Драконьих островах.,110,142034,50,0,0
Принесите обсидиановые ключи,Принесите обсидиановые ключи представителям фракций в Обсидиановой цитадели на Драконьих островах.,111,142036,100,0,0
Измените внешность вашего ездового дракона,Посетите постамент трансформации на Драконьих островах.,112,142038,20,0,0
Заработайте очки чести на тренировочной площадке Кобальтовой ассамблеи в Лазурном Просторе,,113,142733,100,0,0
День стражей-добровольцев: убейте захватчиков города,On {EventStartDate} emote /salute at a Stormwind or Orgrimmar guard and slay City Invaders.,114,142040,200,0,0
"Ярмарка Новолуния: выполните задание ""Танцы Новой Луны""",From {EventStartDate} - {EventEndDate} complete the quest Dance Dance Darkmoon on Darkmoon Faire Island.,115,142044,50,0,0
"Ярмарка Новолуния: используйте эмоцию /рад, сидя на карусели или на тигре-качалке",From {EventStartDate} - {EventEndDate} emote /cheer while riding the carousel or a Sandbox Tiger on Darkmoon Faire Island.,116,142048,50,0,0
Воспользуйтесь сетью телепортации Драконьих островов,Пройдите через древние путевые врата и воспользуйтесь сетью телепортации Драконьих островов.,117,142050,100,0,0
Убейте существ на Пике драконьих источников,"Убейте существ, которые дают опыт, на Пике драконьих источников на юго-востоке равнин Он'ары.",118,142052,50,0,0
Пройдите испытание потопом,Пройдите испытание потопом в ключах Он'ир на Драконьих островах.,119,142054,50,0,0
"Завершите цепочку заданий курорта ""Мирные сны""","Завершите цепочку заданий курорта ""Мирные сны"" в Тальдразусе на Драконьих островах.",120,142056,50,0,0
Победите элитных боевых питомцев Драконьих островов с питомцами-драконами,Возьмите в команду как минимум двух питомцев-драконов и победите двух элитных боевых питомцев Драконьих островов.,121,142058,200,0,0
Выудите предметы в эффектном образе,"Выудите предметы, надев ониксовые смягчители взоров или монокль ремесленника.",122,142063,50,0,0
Изготовьте предметы в эффектном образе,"Изготовьте предметы, надев ониксовые смягчители взоров или монокль ремесленника.",123,142065,50,0,0
Завершите сюжетные цепочки дополнительных заданий в Лазурном Просторе,,124,142067,150,0,0
Заработайте очки чести на аванпосте Нокхуд,Заработайте очки чести на аванпосте Нокхуд на Драконьих островах,125,142046,100,0,0
Измените внешность своего спутника на великой охоте,Поговорите с наставником Фродрумом в месте проведения великой охоты на Драконьих островах.,126,142080,20,0,0
Найдите скрытые друзы самоцветов на Драконьих островах,Воспользуйтесь картами друз самоцветов на Драконьих островах.,127,142082,50,0,0
Победите опытных укротителей питомцев на Драконьих островах с механическими питомцами,Возьмите в команду как минимум двух механических питомцев и победите двух опытных укротителей питомцев на Драконьих островах.,128,142725,200,0,0
Получите награду и откройте сундук с военными припасами на равнинах Он'ары,Соберите добычу с тела мертвого игрока в режиме войны и откройте сундук с военными припасами на равнинах Он'ары.,129,142087,150,0,0
Выполните еженедельные задания по изготовлению предметов,Еженедельные задания для профессий можно взять на рынке ремесленников в Вальдраккене.,130,0,100,0,0
Завершите осаду Драконьей Погибели,"Пройдите сценарий ""Осада Драконьей Погибели"" на Берегах Пробуждения",133,0,50,0,0
Выполните локальные задания по скалолазанию,Выполните локальные задания по скалолазанию на Драконьих островах.,135,142099,100,0,0
Попадите в грозовые торнадо воинов стихий,Попадите в торнадо во время грозовой бури воинов стихий.,136,142112,50,0,0
Выполните задания каравана Айлааг,Выполните задания каравана Айлааг на равнинах Он'ары на Драконьих островах.,137,142114,100,0,0
Пролетите через ветра островов верхом на драконе,Пролетите через ветра островов верхом на драконе на Драконьих островах.,138,142133,50,0,0
Выудите предметы из клыкаррских рыбных лунок в Искаре,,139,142135,50,0,0
Соберите кровавые жетоны на Драконьих островах,Участвуйте в PvP-событиях на Драконьих островах.,140,142224,150,0,0
Сад чудес: выполните ежедневные задания,From {EventStartDate} - {EventEndDate} complete Noblegarden daily quests.,141,142243,100,0,0
По/прыгайте перед зверьками Драконьих островов.,Начните /прыгать перед зверьками Драконьих островов.,142,142248,50,0,0
Съешьте суп в эффектном образе,Съешьте суп из общинного котла в Искаре в эффектном образе.,143,142261,50,0,0
Покажите свою /любовь торговой лавке,Покажите свою /любовь торговцам в торговой лавке и их товарам,144,142268,50,0,0
Победите 25 рейдовых боссов,,145,142290,250,0,10
Вытащите крупную рыбу вместе с друзьями,Вытащите гарпуном крупную рыбу на Драконьих островах в компании минимум 5 других игроков.,146,142297,50,0,0
Выполните публичные заказы на предметы,"Поговорите с управляющим заказами на рынке ремесленников Вальдраккена, чтобы посмотреть заказы на предметы.",147,142299,100,0,0
Выполните частные заказы на предметы,Поговорите с учителем профессии на рынке ремесленников в Вальдраккене.,148,142303,100,0,0
Сад чудес: пройдите подземелье Dragonflight с весенним венцом на голове,From {EventStartDate} - {EventEndDate} complete a Dragonflight dungeon while wearing a spring circlet.,149,142324,50,0,0
