Name_lang,Description_lang,ID,UiTextureAtlasElementID,TraitTreeID
Yellow [DNT],[DNT] This is a UI Engineering test SubTree.,9,18688,898
Pink [DNT],[DNT] This is a UI Engineering test SubTree.,10,4076,898
Blue [DNT],[DNT] This is a UI Engineering test SubTree.,11,4073,898
Red [DNT],[DNT] This is a UI Engineering test SubTree.,12,11358,898
UI Test Subtree 1,Описание,16,11409,878
UI Test Subtree 2,Другое описание,17,0,880
Ткач Бездны,"Постигая первоистоки магии Бездны, ткачи открыли способ устанавливать с ней хрупкую связь через бреши в ткани реальности. Из-за непредсказуемости этой всепожирающей силы ее невероятно опасно держать под контролем.",18,26682,795
Архонт,"В своей непоколебимой вере архонты поддерживают глубокую связь и со Светом, и с Тьмой. Высшие силы могут ненадолго даровать архонтам свое благословение и вознести их на вершины могущества.",19,27430,795
Оракул,"Оракулы заглядывают в будущее и используют полученные знания, чтобы защищать и усиливать союзников. Видение будущего позволяет оракулам благословлять союзников и давать им уникальные эффекты, заранее предугадывая опасность.",20,26934,795
Друид-хищник,"Друиды-хищники в совершенстве владеют могучим звериным обликом. Превращаясь в кошек или медведей, они становятся свирепыми бойцами и защитниками дикой природы.",21,26675,793
Следопыт,"Следопыты живут в отдаленных уголках диких земель. Там они охотятся, поддерживая цикл жизни и смерти. Они уничтожают тех, кто покушается на сохранность природы и используют свои целительные навыки, возвращая жизнь в опустевшие края.",22,26677,793
Хранитель рощи,"Хранители рощи вдохновляются силой могучих детей Кенария, чтобы сохранять равновесие природы и оберегать Изумрудный Сон. Они могут наделять свои заклинания энергией Сна и призывать усиленных древней, которые защищают их союзников и сокрушают врагов.",23,26686,793
Избранник Элуны,"Избранники Элуны преданно служат богине луны и взамен обретают единение с луной и звездами. Их способности преисполняются астральной силой, а могучая лунная магия разит врагов.",24,26685,793
Боец,"Бранн разделывается с врагами на расстоянии с помощью ""Надежного средства"".",29,24179,874
Лекарь,Бранн исцеляет раненых игроков с помощью медицинских припасов и найденных реликвий.,30,24186,874
Сан'лейн,"Сан'лейн мастерски используют магию крови и темную магию, чтобы ослаблять противников и усиливать собственные возможности.",31,26673,750
Всадник апокалипсиса,"Всадники апокалипсиса призывают силу легендарных Четырех Всадников. Они ведут их в бой, насылая на врагов смерть, голод и мор.",32,27222,750
Вестник Смерти,"Станьте посланником смерти и разите души противников силой Темных Земель. Пусть враги не забывают, что все пути ведут в могилу.",33,26672,750
Истерзанный Скверной,Истерзанные Скверной принимают свою демоническую натуру и позволяют ей усиливать свои атаки взрывной силой огня Скверны.,34,27066,854
Альдрахийский разоритель,"Альдрахийские воины с исключительным мастерством владели боевыми клинками. Они наносили своим жертвам элегантные и смертоносные удары, поглощая души и преумножая мощь своего оружия.",35,27132,854
Дракомандир,"Дракомандиры – прирожденные лидеры, способные воодушевлять союзников на великие подвиги. Эти боевые предводители драктиров используют усиленные заклинания, чтобы отдавать приказы и координировать бойцов.",36,27067,872
Ваятель огня,"Ваятели огня тесно связаны с силой Алекстразы. Их навыки направлены на защиту союзников, восстановление и обновление. Они, как никто другой, способны управлять драконьим пламенем, а также распространять и усиливать его.",37,27223,872
Хроностраж,"Хроностражи способны управлять временем и заглядывать в будущее, чтобы ускорять свои атаки или повторять маневры через отголоски воспоминаний. Они лучше других постигли бронзовую магию, но не всегда могут держать ее под контролем из-за множества разветвлений времени перед глазами.",38,26678,872
Ярость солнца,"Маги школы ярости солнца изучают чародейское пламя, усиливая и без того смертоносные заклинания или даже призывая на помощь феникса огненных чар.",39,27133,658
Чаромет,"Научившись управлять дикой сущностью магии, чарометы разделяют заклинания на осколки и создают новые нестабильные эффекты.",40,27429,658
Ледяной огонь,"Маги ледяного огня укрощают будто бы несовместимые стихии. Овладев противоположными силами, они усиливают атаки стихий и совмещают их, применяя мощные комбинации.",41,27017,658
Часовой,"Часовые черпают силу в единстве с дикой природой. Их способности наносят дополнительный урон от тайной магии, а силы луны помогают наносить врагам сокрушительные удары.",42,27529,774
Вожак стаи,"Вожаки стаи установили особую связь со своими питомцами и самой природой. Такие охотники умеют призывать на помощь могучих зверей и действуют со своими питомцами слаженно, как единый организм, настигая цель с пугающей точностью.",43,27068,774
Темный следопыт,"Дайте волю ненависти и скрывайтесь в тенях, поражая своих жертв способностями, насыщенными некротической и темной энергией. С каждым убитым врагом ваши темные навыки еще больше усиливаются.",44,26679,774
Храмовник,"Храмовники не остановятся ни перед чем, чтобы свершить правосудие. Они призывают молоты Света и наносят сокрушительные удары, усиливая физический урон светлой магией.",48,26681,790
Кузнец Света,"Кузнецы Света достигли таких высот в своем искусстве, что научились призывать его материальные воплощения, чтобы усиливать оружие, укреплять защиту и защищать союзников.",49,26680,790
Вестник солнца,"Вестники солнца образуют с ним глубокую связь, испепеляя солнечной энергией врагов и прижигая раны союзников. Воззвав к Свету и став его воплощением, они являют мощь светила в палящих лучах огромной силы.",50,26702,790
Ловкач,"Подлые трюки и молниеносные удары – фирменный стиль ловкача. Он отвлекает врага ""Перенаправлением"" или затейливым взмахом меча, а затем подсекает зазевавшуюся жертву ударом кинжала.",51,27018,852
Служитель судьбы,"Служители судьбы с удовольствием вершат ее волю, спутывая планы врагов. Повинуясь броску своевольной судьбоносной монеты, они приводят в исполнение предрешенный и заслуженный приговор.",52,27433,852
Ловчий смерти,"Ловчие смерти – беспощадные убийцы, обрывающие жизнь жертвы быстрыми ударами из тени.",53,27432,852
Тотемист,"Шаманы-тотемисты превращают свои тотемы в мощнейшее оружие, усиливая их и обучаясь создавать новые. Они в совершенстве овладели зачарованием, чтобы не сбавлять натиск и в ближнем бою.",54,26703,786
Вестник шторма,"Вестники шторма взывают к грозной стихии, повелевая молниями. Призовите яростную бурю и сейте хаос среди врагов, пробуждая силу природы и уничтожая все на своем пути.",55,26683,786
Предсказатель,"Воззовите к магии духов, чтобы усилить заклинания и призвать предков на помощь себе и союзникам.",56,27019,786
Пожинатель душ,"Мало кто осознает, какая сила заключена в душах, но многие знают, как охотно демоны пожирают души павших. Заключая сделку с демонами из Круговерти Пустоты, пожинатели душ позволяют им вселиться в себя и обретают невообразимое могущество в обмен на души поверженных врагов.",57,27530,720
Призыватель огня,"Призывателей огня страшатся больше, чем любой другой секты сатиров на Азероте. Переплетая наимерзейшую темную магию и хаос огня Скверны, чернокнижники-призыватели платят за силу собственной отравленной душой.",58,27746,720
Демонопоклонник,"После победы над Легионом многие демоны остались без хозяина. Демонопоклонникам впервые удалось укротить самых могучих из них, чтобы обратить против своих врагов разрушительную энергию Круговерти Пустоты.",59,26935,720
Истребитель,"Безжалостный воитель, преследующий выбранную жертву до конца и ошеломляющий врагов могучим стальным шквалом.",60,26704,850
Горный тан,"Горные таны славятся свирепостью в бою и не мыслят жизни без поединка с очередным достойным соперником. Закаляя оружие мощью земли и яростью бурь, они ошеломляют врагов неистовым натиском.",61,26684,850
Колосс,"Ветеран бессчетных битв, с невозмутимостью скалы выдерживающий самые убийственные атаки. Опираясь на боевой опыт, он наносит точно выверенные удары, разящие врагов.",62,26765,850
Проводник Небожителей,"Проводники Небожителей посвящают себя учениям Августейших Небожителей Пандарии и становятся воплощениями их мудрости и силы. Проводники, достигшие особого уровня мастерства, могут даже ненадолго воспользоваться силой всех Небожителей сразу.",64,27069,1000
Шадо-Пан,"Шадо-Пан познают мудрость предшественников и защищают друзей и близких, вставая на пути врагов. Они копят силы и дожидаются лучшего момента, а затем поражают врагов сокрушительными шквалами ударов.",65,27070,1000
Мастер гармонии,"Мастера гармонии стремятся к идеальной физической форме, закаляя свое тело и становясь воплощением чистой мощи. Достигнув совершенства, они начинают чувствовать потоки энергии ци и природных циклов силы.",66,27745,1000
Вестник шторма,"Вестники шторма взывают к грозной стихии, повелевая молниями. Призовите яростную бурю и сейте хаос среди врагов, пробуждая силу природы и уничтожая все на своем пути.",70,26683,1033
Тотемист,"Шаманы-тотемисты превращают свои тотемы в мощнейшее оружие, усиливая их и обучаясь создавать новые. Они в совершенстве овладели зачарованием, чтобы не сбавлять натиск и в ближнем бою.",71,26703,1033
Предсказатель,"Воззовите к магии духов, чтобы усилить заклинания и призвать предков на помощь себе и союзникам.",72,27019,1033
Вестник шторма,"Вестники шторма взывают к грозной стихии, повелевая молниями. Призовите яростную бурю и сейте хаос среди врагов, пробуждая силу природы и уничтожая все на своем пути.",73,26683,1034
Тотемист,"Шаманы-тотемисты превращают свои тотемы в мощнейшее оружие, усиливая их и обучаясь создавать новые. Они в совершенстве овладели зачарованием, чтобы не сбавлять натиск и в ближнем бою.",74,26703,1034
Предсказатель,"Воззовите к магии духов, чтобы усилить заклинания и призвать предков на помощь себе и союзникам.",75,27019,1034
PH,Урон!,79,24179,1054
PH,Защита!,80,24199,1054
Танк,"Бранн сражается на передовой, полагаясь на помощь союзников, сложную технику, добытую в ходе исследований, а также на свой старый добрый дробовик.",81,24199,874
Танк,"Бранн сражается на передовой, полагаясь на помощь союзников, сложную технику, добытую в ходе исследований, а также на свой старый добрый дробовик.",82,24199,1060
Лекарь,Бранн исцеляет раненых игроков с помощью медицинских припасов и найденных реликвий.,83,24186,1060
Боец,"Бранн разделывается с врагами на расстоянии с помощью ""Надежного средства"".",84,24179,1060
Лекарь,Бранн исцеляет раненых игроков с помощью медицинских припасов и найденных реликвий.,98,24186,1151
Танк,"Бранн сражается на передовой, полагаясь на помощь союзников, сложную технику, добытую в ходе исследований, а также на свой старый добрый дробовик.",99,24199,1151
Боец,"Бранн разделывается с врагами на расстоянии с помощью ""Надежного средства"".",100,24179,1151
