Description_lang,SourceText_lang,ID,CreatureID,SummonSpellID,IconFileDataID,PetTypeEnum,Flags,SourceTypeEnum,CardUIModelSceneID,LoadoutUIModelSceneID,CovenantID
"Quando i Naga hanno invaso la Valle dei Sacraonda, si sono portati dietro i loro cuccioli preferiti: le Anguille Abissali.",|cFFFFD200Mercante: |rMadeline Netley|n|cFFFFD200Zona: |rValle dei Sacraonda|n|cFFFFD200Costo: |r75|Hitem:163036|h|TInterface\ICONS\INV_Currency_PetBattle.BLP:0|t|h|n|n|cFFFFD200Mercante: |rOlly|n|cFFFFD200Zona: |rZuldazar|n|cFFFFD200Costo: |r75|Hitem:163036|h|TInterface\ICONS\INV_Currency_PetBattle.BLP:0|t|h,2403,143175,279205,2027958,8,2,2,6,7,0
"Queste laboriose api sono la spina dorsale di una solida industria del miele. Per decenni, i Saggi delle Maree hanno proibito l'esportazione di questi animali dalla Valle dei Sacraonda.",|cFFFFD200Mercante: |rSorella Lilyana|n|cFFFFD200Zona: |rValle dei Sacraonda|n|cFFFFD200Fazione: |rDestatempesta - Riverito|n|cFFFFD200Costo: |r250|Hitem:163036|h|TInterface\ICONS\INV_Currency_PetBattle.BLP:0|t|h,2404,143176,279206,2027854,2,2,2,6,7,0
I Falconi di Corlain vengono addestrati dalla nascita per diventare esploratori e combattenti. I pochi sopravvissuti alla maledizione delle Frangicuore servono l'Ordine delle Braci svolgendo un ruolo analogo.,|cFFFFD200Mercante: |rQuartiermastro Alcorn|n|cFFFFD200Zona: |rDrustvar|n|cFFFFD200Fazione: |rOrdine delle Braci - Riverito|n|cFFFFD200Costo: |r200|Hitem:163036|h|TInterface\ICONS\INV_Currency_PetBattle.BLP:0|t|h,2405,143177,279207,132188,2,2,2,6,7,0
Questo maialino è fuggito alla trasformazione in salsicce da parte di Roland con l'aiuto di un furbo ragno.,|cFFFFD200Mercante: |rNigel Guardavarchi|n|cFFFFD200Zona: |rDrustvar|n|cFFFFD200Costo: |r75|Hitem:163036|h|TInterface\ICONS\INV_Currency_PetBattle.BLP:0|t|h|n|n|cFFFFD200Mercante: |rOlly|n|cFFFFD200Zona: |rZuldazar|n|cFFFFD200Costo: |r75|Hitem:163036|h|TInterface\ICONS\INV_Currency_PetBattle.BLP:0|t|h,2406,143178,279208,1721029,7,2,2,6,7,0
"Questo coniglio dal naso rosso è incredibilmente soffice al tatto. Fai attenzione alle dita, però.",|cFFFFD200Mercante: |rNigel Guardavarchi|n|cFFFFD200Zona: |rDrustvar|n|cFFFFD200Costo: |r300|Hitem:163036|h|TInterface\ICONS\INV_Currency_PetBattle.BLP:0|t|h|n|n|cFFFFD200Mercante: |rOlly|n|cFFFFD200Zona: |rZuldazar|n|cFFFFD200Costo: |r300|Hitem:163036|h|TInterface\ICONS\INV_Currency_PetBattle.BLP:0|t|h,2407,143179,279209,2399278,4,2,2,6,7,0
"La polvere d'argento sulle zampe di questo ragno attira le prede, che restano poi intrappolate in una ragnatela inestricabile.",|cFFFFD200Mercante: |rNigel Guardavarchi|n|cFFFFD200Zona: |rDrustvar|n|cFFFFD200Costo: |r100|Hitem:163036|h|TInterface\ICONS\INV_Currency_PetBattle.BLP:0|t|h|n|n|cFFFFD200Mercante: |rOlly|n|cFFFFD200Zona: |rZuldazar|n|cFFFFD200Costo: |r100|Hitem:163036|h|TInterface\ICONS\INV_Currency_PetBattle.BLP:0|t|h,2408,143181,279210,2027859,3,2,2,6,7,0
Meglio non parcheggiare la propria cavalcatura sotto di lui.,|cFFFFD200Mercante: |rDana Pull|n|cFFFFD200Zona: |rBaia di Tiragarde|n|cFFFFD200Costo: |r50|Hitem:163036|h|TInterface\ICONS\INV_Currency_PetBattle.BLP:0|t|h|n|n|cFFFFD200Mercante: |rOlly|n|cFFFFD200Zona: |rZuldazar|n|cFFFFD200Costo: |r50|Hitem:163036|h|TInterface\ICONS\INV_Currency_PetBattle.BLP:0|t|h,2409,143184,279211,1716280,2,2,2,6,7,0
"Questa adorabile accozzaglia di cavi, ingranaggi e ruote dentate non è stata assemblata a Gnomeregan. Da dove arriverà?",|cFFFFD200Mercante: |rDana Pull|n|cFFFFD200Zona: |rBaia di Tiragarde|n|cFFFFD200Costo: |r75|Hitem:163036|h|TInterface\ICONS\INV_Currency_PetBattle.BLP:0|t|h|n|n|cFFFFD200Mercante: |rOlly|n|cFFFFD200Zona: |rZuldazar|n|cFFFFD200Costo: |r75|Hitem:163036|h|TInterface\ICONS\INV_Currency_PetBattle.BLP:0|t|h,2410,143188,279212,2126363,9,2,2,6,7,0
"Adora i grattini alla pancia. Fai attenzione alle schegge, però.",|cFFFFD200Zona: |rDrustvar,2411,143189,279213,2030683,3,2,0,6,7,0
"Un comune compagno di giochi per i bambini, nonostante i frequenti casi di impalamento.",|cFFFFD200Mercante:|r Holaua la Felice|n|cFFFFD200Zona:|r Zuldazar|n|cFFFFD200Costo:|r 100|Hitem:163036|h|TInterface\ICONS\INV_Currency_PetBattle.BLP:0|t|h|n|n|cFFFFD200Mercante: |rSchivio|n|cFFFFD200Zona: |rPorto di Boralus|n|cFFFFD200Costo: |r100|Hitem:163036|h|TInterface\ICONS\INV_Currency_PetBattle.BLP:0|t|h,2412,143191,279214,1958452,7,2,2,6,7,0
"Noto per mordicchiare gli stinchi di qualsiasi creatura, dai sauridi ai brutosauri.",|cFFFFD200Mercante:|r Holaua la Felice|n|cFFFFD200Zona:|r Zuldazar|n|cFFFFD200Costo:|r 50|Hitem:163036|h|TInterface\ICONS\INV_Currency_PetBattle.BLP:0|t|h|n|n|cFFFFD200Mercante: |rSchivio|n|cFFFFD200Zona: |rPorto di Boralus|n|cFFFFD200Costo: |r50|Hitem:163036|h|TInterface\ICONS\INV_Currency_PetBattle.BLP:0|t|h|n,2413,143193,279215,797327,7,2,2,6,7,0
"Particolarmente morbidosi, specialmente dopo un pranzo abbondante.",|cFFFFD200Mercante: |rShoak|n|cFFFFD200Zona: |rNazmir|n|cFFFFD200Costo: |r200|Hitem:163036|h|TInterface\ICONS\INV_Currency_PetBattle.BLP:0|t|h|n|n|cFFFFD200Mercante: |rWunja la Cieca|n|cFFFFD200Zona: |rNazmir|n|cFFFFD200Costo: |r200|Hitem:163036|h|TInterface\ICONS\INV_Currency_PetBattle.BLP:0|t|h|n|n|cFFFFD200Mercante: |rSchivio|n|cFFFFD200Zona: |rPorto di Boralus|n|cFFFFD200Costo: |r200|Hitem:163036|h|TInterface\ICONS\INV_Currency_PetBattle.BLP:0|t|h,2414,143194,279216,1723703,4,2,2,6,7,0
Krag'wa ha inviato riluttantemente Tragg alla Spedizione di Talanji nella speranza che trovi qualcuno pronto a portarlo a fare il giro di Azeroth.,|cFFFFD200Mercante: |rApprovvigionatrice Lija|n|cFFFFD200Zona: |rNazmir|n|cFFFFD200Fazione: |rSpedizione di Talanji - Riverito|n|cFFFFD200Costo: |r75|Hitem:163036|h|TInterface\ICONS\INV_Currency_PetBattle.BLP:0|t|h,2415,143195,279217,1802889,8,2,2,6,7,0
"I brutosauri erano vicini all'estinzione, scongiurata da alcuni intraprendenti avventurieri. Il Piccolo Ben'fon avrà anche ereditato le dimensioni del padre, ma di sicuro ha il carattere della madre!",|cFFFFD200Mercante: |rHolaua la Felice|n|cFFFFD200Zona: |rZuldazar|n|cFFFFD200Costo: |r300|Hitem:163036|h|TInterface\ICONS\INV_Currency_PetBattle.BLP:0|t|h,2416,143196,279218,1881827,7,2,2,6,7,0
Sempre affamato e caratterizzato da una personalità elettrizzante.,|cFFFFD200Mercante: |rJenoh|n|cFFFFD200Zona: |rVol'dun|n|cFFFFD200Costo: |r250|Hitem:163036|h|TInterface\ICONS\INV_Currency_PetBattle.BLP:0|t|h|n|n|cFFFFD200Mercante: |rSchivio|n|cFFFFD200Zona: |rPorto di Boralus|n|cFFFFD200Costo: |r250|Hitem:163036|h|TInterface\ICONS\INV_Currency_PetBattle.BLP:0|t|h,2417,143197,279219,2399286,0,2,2,6,7,0
"Il Loa Sciacallo reputa che tu possa insegnare qualcosa a questo sauride. Tuttavia, fai attenzione a non perdere di vista il borsellino.",|cFFFFD200Mercante: |rHolaua la Felice|n|cFFFFD200Zona: |rZuldazar|n|cFFFFD200Costo: |r100|Hitem:163036|h|TInterface\ICONS\INV_Currency_PetBattle.BLP:0|t|h|n|n|cFFFFD200Mercante: |rSchivio|n|cFFFFD200Zona: |rPorto di Boralus|n|cFFFFD200Costo: |r100|Hitem:163036|h|TInterface\ICONS\INV_Currency_PetBattle.BLP:0|t|h,2418,143198,279220,2399239,7,2,2,6,7,0
Queste rane non amano essere toccate.,|cFFFFD200Mercante: |rShoak|n|cFFFFD200Zona: |rNazmir|n|cFFFFD200Costo: |r200|Hitem:163036|h|TInterface\ICONS\INV_Currency_PetBattle.BLP:0|t|h|n|n|cFFFFD200Mercante: |rSchivio|n|cFFFFD200Zona: |rPorto di Boralus|n|cFFFFD200Costo: |r200|Hitem:163036|h|TInterface\ICONS\INV_Currency_PetBattle.BLP:0|t|h,2419,143199,279221,804969,8,2,2,6,7,0
"Nessuno sa da dove arrivi questa Maschera Tiki infestata o come mai sia sempre così arrabbiata. A quanto sembra, però, le piaci!",|cFFFFD200Mercante: |rShoak|n|cFFFFD200Zona: |rNazmir|n|cFFFFD200Costo: |r500|Hitem:163036|h|TInterface\ICONS\INV_Currency_PetBattle.BLP:0|t|h|n|n|cFFFFD200Mercante: |rWunja la Cieca|n|cFFFFD200Zona: |rNazmir|n|cFFFFD200Costo: |r500|Hitem:163036|h|TInterface\ICONS\INV_Currency_PetBattle.BLP:0|t|h|n|n|cFFFFD200Mercante: |rSchivio|n|cFFFFD200Zona: |rPorto di Boralus|n|cFFFFD200Costo: |r500|Hitem:163036|h|TInterface\ICONS\INV_Currency_PetBattle.BLP:0|t|h,2420,143200,279224,1726347,5,2,2,241,238,0
Sono così carini... prima di sviluppare denti taglienti come rasoi e un veleno mortale.,|cFFFFD200Mercante:|r Madeline Netley|n|cFFFFD200Zona:|r Valle dei Sacraonda|n|cFFFFD200Costo:|r 200|Hitem:163036|h|TInterface\ICONS\INV_Currency_PetBattle.BLP:0|t|h|n|n|cFFFFD200Mercante:|r Holaua la Felice|n|cFFFFD200Zona:|r Zuldazar|n|cFFFFD200Costo:|r 200|Hitem:163036|h|TInterface\ICONS\INV_Currency_PetBattle.BLP:0|t|h,2421,143202,279225,2027847,1,2,4,6,7,0
È così carina che viene quasi voglia di mangiarla. Ma non farlo: è velenosa.,|cFFFFD200Mercante:|r Madeline Netley|n|cFFFFD200Zona:|r Valle dei Sacraonda|n|cFFFFD200Costo:|r 100|Hitem:163036|h|TInterface\ICONS\INV_Currency_PetBattle.BLP:0|t|h|n|n|cFFFFD200Mercante:|r Holaua la Felice|n|cFFFFD200Zona:|r Zuldazar|n|cFFFFD200Costo:|r 100|Hitem:163036|h|TInterface\ICONS\INV_Currency_PetBattle.BLP:0|t|h,2422,143203,279226,2059632,2,2,4,6,7,0
Trovare delle perle d'acqua dolce con l'aiuto di questo granchio sarà un gioco da ragazzi.,|cFFFFD200Mercante:|r Madeline Netley|n|cFFFFD200Zona:|r Valle dei Sacraonda|n|cFFFFD200Costo:|r 250|Hitem:163036|h|TInterface\ICONS\INV_Currency_PetBattle.BLP:0|t|h|n|n|cFFFFD200Mercante:|r Jenoh|n|cFFFFD200Zona:|r Vol'dun|n|cFFFFD200Costo:|r 250|Hitem:163036|h|TInterface\ICONS\INV_Currency_PetBattle.BLP:0|t|h,2423,143204,279227,2027880,8,2,4,6,7,0
Sembra che il peculiare colore rosso di questa rana si sia sviluppato specificamente per permetterle di mimetizzarsi nel sangue. Inquietante.,|cFFFFD200Mercante: |rNigel Guardavarchi|n|cFFFFD200Zona: |rDrustvar|n|cFFFFD200Costo: |r100|Hitem:163036|h|TInterface\ICONS\INV_Currency_PetBattle.BLP:0|t|h|n|n|cFFFFD200Mercante: |rShoak|n|cFFFFD200Zona: |rNazmir|n|cFFFFD200Costo: |r100|Hitem:163036|h|TInterface\ICONS\INV_Currency_PetBattle.BLP:0|t|h,2424,143205,279228,804966,8,2,2,6,7,0
"Voleva solo fuggire via, trovare un bel guscio e riposarsi sulla spiaggia. E invece è finito nelle tue mani.",|cFFFFD200Mercante:|r Madeline Netley|n|cFFFFD200Zona:|r Valle dei Sacraonda|n|cFFFFD200Costo:|r 50|Hitem:163036|h|TInterface\ICONS\INV_Currency_PetBattle.BLP:0|t|h|n|n|cFFFFD200Mercante:|r Jenoh|n|cFFFFD200Zona:|r Vol'dun|n|cFFFFD200Costo:|r 50|Hitem:163036|h|TInterface\ICONS\INV_Currency_PetBattle.BLP:0|t|h,2425,143206,279230,2027921,8,2,4,6,7,0
"È ben noto che le vespe producano del miele di qualità superiore a quella delle api. Ben noto in un circolo molto limitato di allevatori di vespe, s'intende.",|cFFFFD200Mercante:|r Madeline Netley|n|cFFFFD200Zona:|r Valle dei Sacraonda|n|cFFFFD200Costo:|r 50|Hitem:163036|h|TInterface\ICONS\INV_Currency_PetBattle.BLP:0|t|h|n|n|cFFFFD200Mercante:|r Jenoh|n|cFFFFD200Zona:|r Vol'dun|n|cFFFFD200Costo:|r 50|Hitem:163036|h|TInterface\ICONS\INV_Currency_PetBattle.BLP:0|t|h,2426,143207,279231,2027902,2,2,4,6,7,0
"Un vero soldato, sempre fedele a Kojo in tutti questi anni. Adora giocare a nascondino e scivolare sul proprio guscio.",|cFFFFD200Mercante: |rKojo il Collezionista|n|cFFFFD200Zona: |rValle dei Sacraonda|n|cFFFFD200Fazione: |rCercatori Tortolliani - Riverito|n|cFFFFD200Costo: |r200|Hitem:163036|h|TInterface\ICONS\INV_Currency_PetBattle.BLP:0|t|h|n|n|cFFFFD200Mercante: |rKojo il Collezionista|n|cFFFFD200Zona: |rZuldazar|n|cFFFFD200Fazione: |rCercatori Tortolliani - Riverito|n|cFFFFD200Costo: |r200|Hitem:163036|h|TInterface\ICONS\INV_Currency_PetBattle.BLP:0|t|h,2427,143209,279232,1738685,8,2,2,6,7,0
Questa orrenda pianta carnivora promette di realizzare i tuoi desideri più reconditi. A patto di sfamarla.,|cFFFFD200Mercante: |rJenoh|n|cFFFFD200Zona: |rVol'dun|n|cFFFFD200Costo: |r100|Hitem:163036|h|TInterface\ICONS\INV_Currency_PetBattle.BLP:0|t|h|n|n|cFFFFD200Mercante: |rMadeline Netley|n|cFFFFD200Zona: |rValle dei Sacraonda|n|cFFFFD200Costo: |r100|Hitem:163036|h|TInterface\ICONS\INV_Currency_PetBattle.BLP:0|t|h,2428,143211,279233,2027889,6,2,2,6,7,0
Tale e quale a chi l'ha messa al mondo. Azeriti è estremamente protettiva e attaccherà chiunque voglia far del male a sua madre.,|cFFFFD200Mercante: |rMagni Barbabronzea|n|cFFFFD200Zona: |rSilitus|n|cFFFFD200Faction: |rCampioni di Azeroth - Riverito|n|cFFFFD200Cost0: |r100|Hitem:163036|h|TInterface\ICONS\INV_Currency_PetBattle.BLP:0|t|h,2429,143214,279234,2032607,6,2,2,6,7,0
"Il platisauro si aggira per queste terre da prima che il tempo venisse misurato. Una specie antica che si è adattata a camminare sulla terraferma e che, per qualche oscuro motivo, adora ripetere degli strani suoni tre volte di seguito.",|cFFFFD200Mercante: |rTalutu|n|cFFFFD200Zona: |rZuldazar|n|cFFFFD200Costo: |r100.000|TINTERFACE\MONEYFRAME\UI-GOLDICON.BLP:0|t|n|n|cFFFFD200Mercante: |rNick l'Astuto|n|cFFFFD200Zona: |rBaia di Tiragarde|n|cFFFFD200Costo: |r100.000|TINTERFACE\MONEYFRAME\UI-GOLDICON.BLP:0|t,2430,143360,279433,1888348,8,18,2,6,7,0
"Le zecche sono diventate una specie invasiva e dominante: incredibilmente aggressive nei confronti delle altre specie, le attaccano finché non trovano un punto debole.",|cFFFFD200Impresa: |rScontri da safari|n|cFFFFD200Categoria: |rCollezione,2431,143464,279576,1618564,2,82,5,6,7,0
I cuccioli dei Ragni delle Pianure degli Altopiani d'Arathi possono emettere una nube di peli urticanti negli occhi dei predatori. Oltre a spruzzare direttamente il veleno.,|cFFFFD200Bottino: |rVelenus|n|cFFFFD200Zona: |rAltopiani d'Arathi,2432,143499,279631,2027962,7,2,0,6,7,0
"Finché resterà anche solo un germoglio, il Signore dei Rami Aldrus non morirà mai davvero.",|cFFFFD200Bottino: |rSignore dei Rami Aldrus|n|cFFFFD200Zona: |rAltopiani d'Arathi,2433,143503,279638,135437,6,2,0,6,7,0
Non è chiaro se Darbel Montrose fosse una pessima Strega o se semplicemente adorasse le cose carine. Probabilmente sia l'una che l'altra.,|cFFFFD200Bottino: |rDarbel Montrose|n|cFFFFD200Zona: |rAltopiani d'Arathi,2434,143507,279643,136221,5,2,0,6,7,0
"I costrutti vennero progettati per aiutare i Titani nei compiti più svariati, e questo in particolare è stranamente piccolo. Globo Titanico Piccino, tocca a te!",|cFFFFD200Bottino: |rEco di Myzrael|n|cFFFFD200Zona: |rAltopiani d'Arathi,2435,143515,279657,632352,5,2,0,6,7,0
"Benché Yogursa sia riuscita a sopravvivere alla piaga che ha infestato così tanti orsi di Colletorto, ne è uscita folle e i suoi cuccioli sono rimasti corrotti per sempre.",|cFFFFD200Bottino: |rYogursa|n|cFFFFD200Zona: |rAltopiani d'Arathi,2436,143533,279686,648803,7,2,0,6,7,0
"Parte gufo, parte orso... e parte cervo, il che evita possibili cause legali.",|cFFFFD200Bottino: |rBeccofurioso|n|cFFFFD200Zona: |rAltopiani d'Arathi,2437,143563,279723,132150,7,2,0,6,7,0
Piagapennuta e la sua progenie si nutrono a sazietà con i cadaveri che la Battaglia per Stromgarde ha lasciato sugli Altopiani d'Arathi.,|cFFFFD200Bottino: |rPiagapennuta|n|cFFFFD200Zona: |rAltopiani d'Arathi,2438,143564,279724,1929248,2,2,0,6,7,0
Queste gocce di Azerite sono instabili e tendono ad avere una reazione esplosiva se stimolate.,|cFFFFD200Mercante: |rMagni Barbabronzea|n|cFFFFD200Zona: |rSilitus|n|cFFFFD200Faction: |rCampioni di Azeroth - Riverito|n|cFFFFD200Cost0: |r200|Hitem:163036|h|TInterface\ICONS\INV_Currency_PetBattle.BLP:0|t|h,2439,143611,279365,2065616,5,2,2,6,7,0
"Un pezzo vivente del Behemoth più famigerato di Arathi, Fozruk.",|cFFFFD200Bottino: |rFozruk|n|cFFFFD200Zona: |rAltopiani d'Arathi,2440,143627,279929,451165,6,2,0,6,7,0
Le leggende dei Rocciadura narrano di una nube di avvoltoi che seguirono i Guerrieri Ogre attraverso il Portale Oscuro durante la Seconda Guerra. Non è da escludere che i saprofagi a due teste presenti su Azeroth siano loro discendenti.,|cFFFFD200Bottino: |rPredaumani Rog|n|cFFFFD200Zona: |rAltopiani d'Arathi,2441,143628,279930,132200,2,2,0,6,7,0
"Bombo non sarà l'ape più grande tra le milioni del suo alveare, ma ciò non significa che non possa trasformarsi in un vero campione.",|cFFFFD200Impresa: |rApicizia|n|cFFFFD200Categoria: |rBattle for Azeroth,2442,143730,280157,2027852,2,82,5,6,7,0
Una possente macchina da guerra di proporzioni adorabili.,|cFFFFD200Mercante: |rVendicatrice Jaelaana|n|cFFFFD200Zona: |rBoralus|n|cFFFFD200Fazione: |rVII Legione,2443,143738,280185,132486,9,514,2,6,7,0
Una possente macchina da guerra di proporzioni adorabili.,|cFFFFD200Mercante: |rRansa Piuma Grigia|n|cFFFFD200Zona: |rZuldazar|n|cFFFFD200Fazione: |rBrigata dell'Onore,2444,143739,280188,132485,9,258,2,6,7,0
Il Capitan Oblò è stato chiamato così per la sua propensione a creare buchi nelle navi che assalta!,|cFFFFD200Bottino:|r Scorrerie sulle Isole|n,2445,143794,177244,2061891,8,2,0,6,7,0
I gusci di questo particolare gruppo di granchi risplendono come gemme sulla sabbia.,|cFFFFD200Bottino:|r Scorrerie sulle Isole|n,2446,143801,177237,2027881,8,2,0,6,7,0
"I Ragni Telafiamma sono rinomati tra le tribù delle isole per la loro calda ragnatela, facile da filare.",|cFFFFD200Bottino:|r Scorrerie sulle Isole|n|n,2447,143802,177236,520757,6,2,0,34,7,0
Gli zoccoli di questa sottoclasse di capre si sono evoluti per essere stabili sia sulla roccia che sulla sabbia.,|cFFFFD200Bottino:|r Scorrerie sulle Isole|n,2448,143803,177235,877477,7,2,0,35,7,0
"Qualcuno ha piazzato questo gorilla meccanico sull'isola per monitorare le altre specie, ma chi è stato e perché?",|cFFFFD200Bottino:|r Scorrerie sulle Isole|n,2449,143804,177231,132189,9,2,0,6,7,0
"Le uniche palle che questo segugio è pronto a inseguire sono quelle di diamante: dure, ignifughe e molto pesanti, ma poco divertenti da lanciare.",|cFFFFD200Bottino:|r Scorrerie sulle Isole|n|n,2450,143805,177230,318343,6,2,0,34,7,0
"Hai per caso un verme velenoso in tasca o... Qualsiasi cosa sia, cosa ci fa lì?",|cFFFFD200Bottino:|r Scorrerie sulle Isole|n|n,2451,143816,280332,236197,7,2,0,6,7,0
"Poro non può volare, ma si gode una bella vita saltellando per terra e agitando gli alberi per far cadere i frutti.",|cFFFFD200Bottino:|r Scorrerie sulle Isole|n,2452,143797,177241,2061724,2,2,0,6,7,0
Anche i giovani Gusciosalmastro sono innatamente attratti dalla convergenza di cielo e mare.,|cFFFFD200Bottino:|r Scorrerie sulle Isole|n,2453,143819,280335,1508497,8,2,0,6,7,0
"Basandosi sulle sue dimensioni, sembra che i Mantid stiano ricreando uno sciame, probabilmente a causa della presenza di una nuova imperatrice.",|cFFFFD200Bottino:|r Scorrerie sulle Isole|n,2454,143820,280336,624010,7,2,0,6,7,0
"Il Capitano Nibs un tempo era il comandante di un malaugurato equipaggio composto da scimmie fin troppo intelligenti, che ben presto finì con il ribaltare la propria imbarcazione.",|cFFFFD200Bottino:|r Scorrerie sulle Isole|n,2455,143795,177243,2055038,3,2,0,6,7,0
"Un ricco capitano pirata si incontrò con uno strano individuo sul molo di una città sconosciuta e barattò il suo fedele compagno in cambio della vita eterna. Come per la maggior parte dei desideri, qualcosa andò storto.",|cFFFFD200Bottino:|r Scorrerie sulle Isole|n,2456,143796,177242,2055034,3,2,0,6,7,0
"I Lucefredda un tempo erano molto diffusi negli oceani, rendendo difficile la vita ai cacciatori, ma adesso non è più così.",|cFFFFD200Bottino:|r Scorrerie sulle Isole|n,2457,143821,280337,970832,0,2,0,6,7,0
Un solo esemplare umido di queste odorose creature genera lo stesso effetto olfattivo di decine di cani bagnati in una stanza chiusa.,|cFFFFD200Bottino:|r Scorrerie sulle Isole|n,2458,143818,280334,1029741,7,2,0,6,7,0
"Particolarmente adatta alla coriacea flora della costa, questa specie robusta è sopravvissuta per molti anni su lande inesplorate.",|cFFFFD200Bottino:|r Scorrerie sulle Isole|n,2459,143817,280333,616693,7,2,0,6,7,0
"I Voru'kar sono estremamente legati al proprio capo, Vorus'arak, che li ha condotti al sicuro dalla presa del Re dei Lich.",|cFFFFD200Bottino:|r Scorrerie sulle Isole|n,2460,143822,280338,237393,2,2,0,6,7,0
Nessuno conosce la storia della sua benda. Non ne vuole parlare mai.,|cFFFFD200Bottino:|r Scorrerie sulle Isole|n,2461,143799,177239,2101159,8,2,0,6,7,0
"Sono carinissimi, fin quando non imparano a spruzzare inchiostro.",|cFFFFD200Bottino:|r Scorrerie sulle Isole|n,2462,143798,177240,2101158,8,2,0,6,7,0
"Durante i caldi mesi estivi, queste pesti emettono un rumore così acuto da far impazzire la gente.",|cFFFFD200Bottino:|r Scorrerie sulle Isole|n,2463,143806,177229,134967,4,2,0,6,7,0
Nulla supera il dolore generato dalla sua puntura. Sei davvero sicuro di volerlo tenere con te?,|cFFFFD200Bottino:|r Scorrerie sulle Isole|n,2464,143807,177228,464143,7,2,0,6,7,0
"Hai presente il senso di sconforto quando torni al tavolo e tutto il ghiaccio si è sciolto nel bicchiere? Ecco, è colpa sua.",|cFFFFD200Bottino:|r Scorrerie sulle Isole|n,2465,143811,177222,656560,6,2,0,36,7,0
Il più nefando degli spiriti ingannatori e il motivo per cui i Pandaren hanno inventato i pantaloni ignifughi.,|cFFFFD200Bottino:|r Scorrerie sulle Isole|n,2466,143809,177225,774324,6,2,0,36,7,0
"Un vecchio proverbio dei Pandaren dice: fai attenzione alla brezza, se è fredda porta inganni.",|cFFFFD200Bottino:|r Scorrerie sulle Isole|n,2467,143812,177221,774322,6,2,0,36,7,0
La terra che trema sotto ai tuoi piedi... si sta agitando o sta ridendo? O entrambi?,|cFFFFD200Bottino:|r Scorrerie sulle Isole|n,2468,143810,177224,774323,6,2,0,36,7,0
Gli spiritelli che abitano le isole del Grande Mare hanno progettato numerose trappole per attirare i visitatori meno scaltri.,|cFFFFD200Bottino:|r Scorrerie sulle Isole|n,2469,143808,177226,458176,0,2,0,41,7,0
"A Zoccolino piace: saltellare, rimbalzare, divertirsi e tirare testate, esattamente in quest'ordine.",|cFFFFD200Bottino:|r Scorrerie sulle Isole|n,2471,143813,177219,1383844,4,2,0,6,7,0
"Indossa i guanti quando maneggi questo piccolino, adora mordere!",|cFFFFD200Bottino:|r Scorrerie sulle Isole|n,2472,143814,177217,1738684,8,2,0,6,7,0
"Le chiare scaglie di questo raro serpente volante assorbono la luce solare per tenersi al caldo, anche quando è all'ombra.",|cFFFFD200Bottino:|r Scorrerie sulle Isole|n,2473,143815,280331,132209,2,2,0,6,7,0
I Rospi Meccanici possono saltare oltre sette milioni di volte prima che i loro ingranaggi inizino a consumarsi.,|cFFFFD200Professione: |rAlchimia di Battle for Azeroth,2474,143957,280617,1694136,9,2,3,6,7,0
"Queste creature possono controllare ogni arto indipendentemente, il che permette loro di svolgere più compiti contemporaneamente e di dare degli abbracci spettacolari.",|cFFFFD200Professione: |rAlchimia di Battle for Azeroth,2475,143959,280619,254105,8,2,3,6,7,0
Anche la ferita più piccola può essere devastante per questa specie: inizierebbe a perdere fluidi dappertutto.,|cFFFFD200Professione: |rAlchimia di Battle for Azeroth,2476,143958,280618,1723701,4,2,3,6,7,0
Le zanne di un crog crescono a un ritmo altissimo sin dalla nascita e sono uno dei materiali naturali più duri generati da una creatura vivente.,|cFFFFD200Professione: |rAlchimia di Battle for Azeroth,2477,143374,279435,237402,7,2,3,6,7,0
"Nessuno sa chi abbia iniziato a vestire i granchi ad Azeroth, ma a quanto sembra, questa moda non ha intenzione di finire.",|cFFFFD200PvP:|r Ricompensa Livello Onore 400|n|n|cFFFFD200Mercante: |rCapitano Roberts|n|cFFFFD200Zona: |rDalaran|n|cFFFFD200Costo: |r500|TINTERFACE\MONEYFRAME\UI-GOLDICON.BLP:0|t|n|n|cFFFFD200Mercante: |rMaresciallo Frazer|n|cFFFFD200Zona: |rBaia di Tiragarde|n|cFFFFD200Costo: |r500|TINTERFACE\MONEYFRAME\UI-GOLDICON.BLP:0|t|n|n|cFFFFD200Mercante: |rCavalier-Capitano Jessica|n|cFFFFD200Zona: |rRoccavento|n|cFFFFD200Costo: |r500|TINTERFACE\MONEYFRAME\UI-GOLDICON.BLP:0|t,2478,144005,280728,2061889,8,594,5,6,7,0
"Nessuno sa chi abbia iniziato a vestire i granchi ad Azeroth, ma a quanto sembra, questa moda non ha intenzione di finire.",|cFFFFD200PvP:|r Ricompensa Livello Onore 400|n|n|cFFFFD200Mercante: |rSarah la Selvaggia|n|cFFFFD200Zona: |rDalaran|n|cFFFFD200Costo: |r500|TINTERFACE\MONEYFRAME\UI-GOLDICON.BLP:0|t|n|n|cFFFFD200Mercante: |rViolet Curaombre|n|cFFFFD200Zona: |rZuldazar|n|cFFFFD200Costo: |r500|TINTERFACE\MONEYFRAME\UI-GOLDICON.BLP:0|t|n|n|cFFFFD200Mercante: |rLegionaria Voladis|n|cFFFFD200Zona: |rOrgrimmar|n|cFFFFD200Costo: |r500|TINTERFACE\MONEYFRAME\UI-GOLDICON.BLP:0|t,2479,144004,280727,2061890,8,338,5,6,7,0
Famiglio di Prova.,|cFFFFD200Bottino:|r Famiglio di Prova|n,2480,144617,281878,133718,4,34,0,6,7,0
,,2481,145133,0,1711341,7,33840,-1,6,7,0
Un palloncino di Lunacupa che ricorda un lupo.,|cFFFFD200Mercante: |rCarl Buonvento|n|cFFFFD200Zona: |rIsola di Lunacupa|n|cFFFFD200Costo: |r90|Hcurrency:515|h|TInterface\ICONS\INV_Misc_Ticket_Darkmoon_01.blp:0|t|h,2482,145948,283744,2341437,2,144,2,6,7,0
Un palloncino di Lunacupa che ricorda un Murloc.,|cFFFFD200Mercante: |rCarl Buonvento|n|cFFFFD200Zona: |rIsola di Lunacupa|n|cFFFFD200Costo: |r90|Hcurrency:515|h|TInterface\ICONS\INV_Misc_Ticket_Darkmoon_01.blp:0|t|h,2483,145947,283741,2341436,2,144,2,6,7,0
Un palloncino di Lunacupa che ricorda un cavallo.,|cFFFFD200Mercante: |rCarl Buonvento|n|cFFFFD200Zona: |rIsola di Lunacupa|n|cFFFFD200Costo: |r90|Hcurrency:515|h|TInterface\ICONS\INV_Misc_Ticket_Darkmoon_01.blp:0|t|h,2484,145946,283740,2341435,2,144,2,6,7,0
,,2485,145968,0,2126350,3,32,-1,6,7,0
,,2486,145971,0,294474,4,32,-1,6,7,0
,,2487,145986,0,321487,9,32,-1,6,7,0
,,2488,145988,0,132996,9,1056,-1,6,7,0
,,2489,145990,0,894222,9,32,-1,6,7,0
,,2490,145995,0,1786409,9,32,-1,6,7,0
,,2492,146002,0,971291,9,32,-1,6,7,0
,,2493,146003,0,668552,9,32,-1,6,7,0
,,2494,146004,0,298587,9,32,-1,6,7,0
,,2495,146005,0,646782,3,1056,-1,6,7,0
,,2496,146006,0,133883,9,32,-1,6,7,0
,,2497,146148,0,133001,6,1056,-1,6,7,0
,,2498,146151,0,237032,6,1056,-1,6,7,0
,,2499,146150,0,133868,6,1056,-1,6,7,0
,,2500,146176,0,1336885,9,32,-1,6,7,0
,,2501,146001,0,133000,9,1056,-1,6,7,0
,,2502,146183,0,135790,6,32,-1,6,7,0
,,2503,146182,0,135862,6,32,-1,6,7,0
,,2504,146181,0,135851,6,32,-1,6,7,0
