Description_lang,SourceText_lang,ID,CreatureID,SummonSpellID,IconFileDataID,PetTypeEnum,Flags,SourceTypeEnum,CardUIModelSceneID,LoadoutUIModelSceneID,CovenantID
"Punzecchiare un piccolo gormino sui fianchi fa un suono piacevole e divertente. Tuttavia, non è consigliabile punzecchiarlo troppe volte.",|cFFFFD200Bottino: |rGorm Trivella|n|cFFFFD200Zona: |rSelvarden,3035,173993,341301,3065167,4,2,0,6,7,0
"Remornia è stata esposta a innominabili quantità di male e peccato, e assorbirà il potere da qualsiasi fonte disponibile per soddisfare i propri desideri.",|cFFFFD200Bottino: |rSire Denathrius|n|cFFFFD200Zona: |rCastello di Nathria,3036,173994,341302,3610989,5,82,0,363,364,0
"Fissare una di queste creature crea una profonda assenza di emozioni dentro di te, quindi la riempie con un senso di terrore.",|cFFFFD200Bottino: |rEternas il Tormentatore|n|cFFFFD200Zona: |rLa Fauce,3037,174081,341492,651083,6,2,0,6,7,0
Questa specie ha una serie di marchi ben distinta sul dorso che lo rende facile da identificare tra gli orrori infiniti della Fauce.,|cFFFFD200Bottino: |rLa Fauce|n,3038,174082,341493,3579949,4,2,0,6,7,0
"Piccole scaglie di pelle sembrano staccarsi costantemente da questa orribile creatura, che lascia dietro di sé una scia e un odore nauseabondo inconfondibile.",|cFFFFD200Bottino: |rLa Fauce|n,3039,174083,341494,3860390,4,2,0,6,7,0
"Gli artigli affilati squarceranno tutto con facilità, rendendo questa creatura un ottimo apriscatole d'emergenza.",|cFFFFD200Bottino: |rSanngror il Torturatore|n|cFFFFD200Zona: |rLa Fauce,3040,174084,341495,3862170,3,2,0,6,7,0
"Quali orrori hanno visto questi occhi, nella torre di Torgast, con il loro sguardo fisso ed eterno?",|cFFFFD200Impresa: |rCorridoi Contorti: Blocco 2|n|cFFFFD200Categoria: |rTorgast,3041,174085,341497,3729814,5,82,5,6,7,0
Staccare una piuma a un Factotum è considerato un peccato degno di un viaggio a Revendreth.,|cFFFFD200Congrega: |rKyrian|n|cFFFFD200Zona: |rBastione,3042,174087,341515,3731724,0,16466,2,6,7,0
"Anche se non è molto peloso, questo felino gelatinoso è pur sempre una delle cose più adorabili che tu abbia mai visto.",|cFFFFD200Congrega:|r Necrosignori|n|cFFFFD200Zona:|r Maldraxxus|n,3043,174088,341516,3732497,5,16466,2,6,7,0
"In giovane età hanno un volto adorabile e delle piccole antenne carine. Quando crescono, ottengono delle tenaglie affilatissime e diventano delle inarrestabili macchine divoratrici. La vita è piena di compromessi.",|cFFFFD200Bottino: |rTred'ova|n|cFFFFD200Zona: |rNebbie di Tirna Falcis|n|cFFFFD200Modalità: |rMitica,3044,174089,341519,3065164,4,2,0,6,7,0
"Queste melme sembrano cambiare colore mentre le si guardano, e poi, improvvisamente, sembra che tu guardino a loro volta. Forse è ora di riposare un po'.",|cFFFFD200Tesoro: |rCassa del Caduto della Piaga|n|cFFFFD200Zona: |rMaldraxxus,3045,174125,341635,1500910,5,2050,0,6,7,0
"Nonostante siano decrepiti e Non Morti, i Geist si muovono con velocità e agilità eccezionali.",|cFFFFD200Evento Mondiale: |rInvasione del Flagello delle Terretetre|n|cFFFFD200Costo: |r20|Hcurrency:1754|h|TInterface\ICONS\Achievement_Reputation_ArgentCrusader.blp:0|t|h,3046,174181,341825,336781,3,2,2,6,7,0
Sei stato vertebrucato!,|cFFFFD200Tesoro: |rVertebruco|n|cFFFFD200Zona: |rMaldraxxus,3047,174677,343161,3386337,3,2,0,6,7,0
"Normalmente di un semplice colore bianco, la sua pelle riflette ciò che ha mangiato e acquisisce delle meravigliose macchie di colore a seconda degli organi digeriti.",|cFFFFD200Scontri tra mascotte:|r Maldraxxus,3049,175021,0,2141734,4,26,4,6,7,0
"Le leggende dicono che se vedi un Saltatore Tetro in sogno, sei destinato a combatterne uno fino alla morte.",|cFFFFD200Scontri tra mascotte:|r Maldraxxus,3050,175022,0,2027947,7,26,4,6,7,0
"Queste viscide creature emettono uno strano rumore, come un risucchio, quando cercano di arrampicarsi su un muro. È un fatto che tutto conoscono a Maldraxxus, per ovvie ragioni.",|cFFFFD200Scontri tra mascotte:|r Maldraxxus,3051,175023,0,3459799,5,26,4,6,7,0
"Spore tossiche piovono dall'alto ovunque volino queste creature, invitando molte piccole creature a un banchetto raccapricciante.",|cFFFFD200Scontri tra mascotte:|r Maldraxxus,3052,175024,0,1570759,2,26,4,6,7,0
"Uno strano cucciolo nato sull'Isola degli Alafatua, che sembra essere stato benedetto dalle energie lunari della Valle di Torvaluna.",|cFFFFD20030° anniversario di WoW|r,3053,175203,344755,3846213,1,82,7,6,7,0
"Grande amica dell'Archivista Fane sin dai suoi primi giorni, Janeera è pronta anche ad allontanarsene un po', se dovesse sentire che è troppo coinvolto.",|cFFFFD200Mercante: |rArchivista Janeera|n|cFFFFD200Zona: |rRevendreth|n|cFFFFD200Fazione: |rAffermati - Osannato|n|cFFFFD200Costo: |r1.000|Hcurrency:1816|h|TInterface\ICONS\6BF_Blackrock_Nova.BLP:0|t|h,3054,175220,344792,2103808,5,2,2,6,7,0
"I Factotum che provano a salire nella scala sociale dei Factotum sanno come gonfiare le piume, servire tonnellate di succo ed essere sempre pronti a bubolare.",|cFFFFD200Mercante: |rZeleskos|n|cFFFFD200Congrega: |rKyrian|n|cFFFFD200Zona: |rBastione,3061,175561,345740,3731728,0,2,2,6,7,0
Si dice che i Factotum siano stati creati per aiutare gli abitanti del Bastione nei loro doveri eterni. A loro non sembra dispiacere.,|cFFFFD200Bottino: |rBastione|n|cFFFFD200Congrega: |rKyrian,3062,175560,345741,3731723,0,2,0,6,7,0
I larion sono bestie orgogliose e vedono chiunque entri nel loro territorio come una minaccia.,|cFFFFD200Bottino: |rCavaliere di Larion Orstus|n|cFFFFD200Zona: |rBastione,3063,175562,345742,3860694,2,2,0,6,7,0
Un larion adulto non lascerà mai l'Aspirante con cui è cresciuto.,|cFFFFD200Bottino:|r Rifornimenti degli Ascesi|n,3064,175564,345744,3860696,2,2,0,6,7,0
"I larion cuccioli vengono spesso affidati agli Aspiranti, per provarne precocemente la compassione e la capacità di comando.",|cFFFFD200Bottino:|r Coraggio|n|cFFFFD200Zona:|r Bastione|n,3065,175563,345743,3860695,2,2,0,6,7,0
"Lucy era stata mandata a Revendreth, come tutti gli altri gatti, ma in qualche modo è riuscita a fuggire. Quando sono stati interrogati, i Dragatori del luogo hanno detto che è tutta colpa del fatto che è un gatto.",|cFFFFD200Bottino:|r Oggetto Scintillante Sporco|n,3066,175715,346192,611425,3,2,0,41,7,0
Gli Spriggan sono nemici fastidiosi che dimorano vicino a Selvarden e tormentano i Silfi della Notte. Questo in particolare ha deciso di fare lo scherzo definitivo: stare con te.,|cFFFFD200AImpresa: |rEsorcista di Famiglia|n|cFFFFD200Categoria: |rBattaglia,3067,175756,346236,3536179,0,82,5,6,7,0
,,3068,175777,0,657918,8,1072,-1,6,7,0
,,3070,175778,0,3072466,7,1072,-1,6,7,0
,,3071,175779,0,3084143,4,1072,-1,6,7,0
,,3072,175780,0,2103813,1,1072,-1,6,7,0
,,3073,175781,0,3732243,6,1072,-1,6,7,0
,,3074,175782,0,3860424,2,1072,-1,6,7,0
,,3075,175783,0,3731723,0,1072,-1,6,7,0
,,3076,175784,0,3601538,5,1072,-1,6,7,0
,,3077,175785,0,3070805,9,1072,-1,6,7,0
,,3078,175786,0,3622122,3,1072,-1,6,7,0
Le alleanze degli Spriggan cambiano più spesso delle stagioni.,|cFFFFD200Impresa: |rAvversari abominevoli dell'aldilà|n|cFFFFD200Categoria: |rBattaglia,3079,175787,346260,3536177,0,82,5,6,7,0
"Cresciuti nelle foreste lussureggianti di Selvarden, questi cuccioli sono infusi con l'essenza della rinascita.",|cFFFFD200Scontri tra mascotte: |rSelvarden|n,3080,176019,0,3072464,7,26,4,6,7,0
Questi vermi consumano materiali privi d'Animum di tutti i tipi. Non sono schizzinosi.,|cFFFFD200Scontri tra mascotte: |rSelvarden,3081,176020,0,3065166,4,26,4,6,7,0
Le ali di questa falena brillano come i cieli stellati sopra Selvarden.,|cFFFFD200Scontri tra mascotte: |rSelvarden,3082,176021,0,3255390,2,26,4,6,7,0
"Per essere una mascotte tutta bocca, dove va a finire quello che mangia? I necromanti di Maldraxxus ne hanno dissezionato molti e non hanno trovato risposte.",|cFFFFD200Scontri tra mascotte:|r Maldraxxus,3083,176024,0,3731581,2,26,4,6,7,0
,,3089,176657,0,132263,9,48,-1,6,7,0
,,3090,176659,0,2490921,2,48,-1,6,7,0
,,3091,176658,0,1600298,7,48,-1,6,7,0
Cocoribot è progettato per non lasciare mai il tuo fianco.,|cFFFFD200Bottino:|r Borsa dei Grumyan|n,3092,176662,348561,2490921,9,2,0,6,7,0
"Gli sbrillovermi sono di gran valore al Bazar Celato, e quelli con pochi piccoli difetti arrivano a valere prezzi altissimi.",|cFFFFD200Mercante: |rCustode Ta'hult|n|cFFFFD200Zona: |rOribos|n|cFFFFD200Costo: |r10.000|Hitem:163036|h|TInterface\ICONS\INV_Currency_PetBattle.BLP:0|t|h,3097,178216,351636,3856132,7,2,2,6,7,0
"I campi di battaglia pullulano di pezzi di Abominietto, che sono perfettamente interscambiabili e facili da ricomporre.",|cFFFFD200Bottino:|r Assalto nella Fauce di Maldraxxus|n,3098,179008,353206,3622121,3,2,0,6,7,0
"I Dragoni dell'Etere Infusi possono essere usati come batterie di Animum portatili, ma devono essere addestrati a non fuggire alla vista del combattimento.",|cFFFFD200Bottino:|r Assalto nella Fauce di Selvarden|n|cFFFFD200Tesoro: |rGabbia del Dragone dell'Etere|n|cFFFFD200Zona: |rFauce,3099,179025,353230,3046536,2,2,0,6,7,0
"Esistono draghi con ogni tipo di classificazione temporale: senza tempo, fuoritempo e persino dell'infinito.",|cFFFFD200Mercante: |rStorica Ma'di|n|cFFFFD200Zona: |rTanaris|n|cFFFFD200Costo: |r200|Hcurrency:1166|h|TInterface\ICONS\PVECurrency-Justice.blp:0|t|h,3100,179125,353442,2892271,9,2,2,6,7,0
"Furbix si è intrufolato per fare un viaggetto nella Fauce. Non ha paura, vuole solo rimanere nel tuo zaino per un po'.",|cFFFFD200Impresa: |rFurbo come una volpe|n|cFFFFD200Categoria: |rCollezione,3101,179083,353450,3072461,7,2,5,6,7,0
"Un giovane Acaro dell'Animum cresce rapidamente se troppo nutrito. Affinché resti docile, si consiglia di fargli consumare più del valore medio di Animum di un'anima in un anno.",|cFFFFD200Scontri tra mascotte: |rKorthia,3102,179131,0,3155460,2,26,4,6,7,0
Le scaglie brillanti dei dragoni dell'etere riflettono i cieli luminosi del Bastione.,|cFFFFD200Bottino:|r Cassa da Guerra degli Ascesi|n|cFFFFD200Zona:|r Fauce,3103,179132,353451,3046536,2,2,0,6,7,0
Le gemme sugli sbrillovermi si deteriorano in fretta se l'animale viene ucciso. I vermi in salute sono considerati preziosi dagli Alienatori più benestanti.,|cFFFFD200Mercante: |rCustode Ta'hult|n|cFFFFD200Zona: |rOribos|n|cFFFFD200Costo: |r1|Hitem:36812|h|TInterface\ICONS\INV_Misc_Gear_01.blp:0|t|h 1|Hitem:62072|h|TInterface\ICONS\INV_Staff_11.blp:0|t|h 1|Hitem:67410|h|TInterface\ICONS\INV_Stone_13.blp:0|t|h,3104,179137,353456,3856131,7,2,2,6,7,0
Gli sbrillovermi furono scoperti dagli Alienatori su un mondo sconosciuto e le loro gemme furono reputate così belle che i membri della spedizione si rivoltarono l'uno contro l'altro.,|cFFFFD200Mercante: |rCustode Ta'hult|n|cFFFFD200Zona: |rOribos|n|cFFFFD200Costo: |r1|Hitem:3300|h|TInterface\ICONS\INV_Gauntlets_02.blp:0|t|h 1|Hitem:3670|h|TInterface\ICONS\INV_Misc_Bone_01.blp:0|t|h 1|Hitem:6150|h|TInterface\ICONS\INV_Misc_Bandage_06.blp:0|t|h,3105,179138,353457,3856130,7,2,2,6,7,0
Gli sbrillovermi non hanno predatori naturali e fanno crescere le gemme per attirare potenziali compagni.,|cFFFFD200Mercante: |rCustode Ta'hult|n|cFFFFD200Zona: |rOribos|n|cFFFFD200Costo: |r1|Hitem:11406|h|TInterface\ICONS\INV_Misc_Pelt_Bear_Ruin_02.blp:0|t|h 1|Hitem:11944|h|TInterface\ICONS\INV_Boots_06.blp:0|t|h 1|Hitem:25402|h|TInterface\ICONS\INV_Hammer_16.blp:0|t|h,3106,179139,353458,3856129,7,2,2,6,7,0
"Su Azeroth, vengono scoperte continuamente nuove specie di Murloc, nate grazie alla loro natura invasiva e alla dieta varia.",|cFFFFD200Missione: |rGorgolo e il bandito|n|cFFFFD200Zona: |rOcchio di Azshara,3107,179140,353460,3987165,0,82,1,6,7,0
"I fusini cacciano gli scratti del Bazar Celato, facendo in modo che la popolazione resti sufficientemente alta da essere sempre necessari.","|cFFFFD200Scontri tra mascotte: |rTazavesh, il Bazar Celato",3108,179164,0,3742945,7,26,4,6,7,0
I fusini sono le mascotte tradizionali degli Alienatori e il loro rapporto porta benefici a entrambi: una necessità nella cultura degli Alienatori.,"|cFFFFD200Scontri tra mascotte: |rTazavesh, il Bazar Celato",3109,179165,0,3742948,7,26,4,6,7,0
"Alienamicio è considerato il fusino perfetto, forse il migliore mai esistito. Inoltre, uccide senza pietà gli animaletti più piccoli.","|cFFFFD200Bottino: |rDirettore della P.O.S.T.A.|n|cFFFFD200Zona: |rTazavesh, il Bazar Celato",3110,179166,353525,3742944,7,2,0,6,7,0
"Gli scratti sono velenosi, tossici e stranamente umidi. Tutto ciò che si potrebbe desiderare in una mascotte.","|cFFFFD200Scontri tra mascotte: |rTazavesh, il Bazar Celato",3111,179167,0,3856133,4,26,4,6,7,0
"Gli scratti sono una specie particolarmente invasiva, in quanto si possono riprodurre solo con uno scratto e consumano praticamente qualsiasi cosa.","|cFFFFD200Scontri tra mascotte: |rTazavesh, il Bazar Celato",3112,179168,0,3856135,4,26,4,6,7,0
"Un particolare Alienatore si è appassionato alla specie degli scratti e ha conservato questo raro esemplare come mascotte, ereditandone l'odore.","|cFFFFD200Zona:|r Tazavesh, il Bazar Celato|n",3113,179169,353528,3856134,4,2,0,6,7,0
"Se sei un ricucitore di Maldraxxus e devi dare un nome a un sacco di abomini, a volte scegli l'opzione più ovvia.",|cFFFFD200Bottino: |r Cassa da Guerra dell'Armata Imperitura|n|cFFFFD200Zona: |r Fauce|n,3114,179171,353529,3622122,3,2,0,6,7,0
"Non proprio vivo, non esattamente morto... Semplicemente un braccio, senza testa.",|cFFFFD200Scontri tra mascotte:|r Fauce,3115,179179,0,3386323,3,26,4,6,7,0
I gorm trovano un modo per invadere qualunque posto... e la Fauce non fa eccezione.,|cFFFFD200Bottino:|r Cassa da Guerra della Caccia Selvaggia|n|cFFFFD200Zona:|r Fauce|n,3116,179180,353569,3084138,2,2,0,6,7,0
"Nonostante sia la prole di una Regina dei Gorm persa nella Fauce, questa mascotte sembra incontaminata dalla magia malvagia del Carceriere.","|cFFFFD200Bottino: |rGralebboih
|cFFFFD200Zona: |rFauce",3117,179181,353570,3084141,2,2,0,6,7,0
Le unghie dei rattifauce possono infettare con diverse malattie dell'aldilà.,|cFFFFD200Scontri tra mascotte:|r Fauce,3118,179182,0,3860391,4,26,4,6,7,0
Nella Fauce abbondano i frammenti di anime alla ricerca del significato o alla fine del proprio tormento. Ma alcune vogliono solo aiutare.,|cFFFFD200Scontri tra mascotte:|r Fauce,3119,179183,0,3862167,3,26,4,6,7,0
Questi guanti magici vengono usati dai Giurafauce per catturare i prigionieri in fuga.,|cFFFFD200Scontri tra mascotte:|r Fauce,3120,179219,0,3861531,3,26,4,6,7,0
"Lotta quanto vuoi, non farai che stringere la presa.",|cFFFFD200Bottino: |r Fauce|n,3121,179220,353638,3861530,3,2,0,6,7,0
C'era una volta un Giurafauce tanto vile che fu ucciso dai suoi stessi servitori. Tale fu il suo rancore che un suo frammento continua a vivere in questo guanto.,|cFFFFD200Bottino: |rLaceratore d'Anime Dormazain|n|cFFFFD200Zona: |rSanctum del Dominio,3122,179222,353639,3861529,3,2,0,6,7,0
"Una specie particolare di creature selvagge che vivono nella Fauce. Nessuno è sicuro di cosa mangino o del perché esistano, ma sembrano impossibili da debellare.",|cFFFFD200Scontri tra mascotte:|r Fauce,3123,179226,0,3579946,4,26,4,6,7,0
"Tutti gli scarafaggi della morte sono tecnicamente vili, ma questi lo sono davvero.",|cFFFFD200Scontri tra mascotte:|r Fauce,3124,179227,0,3579947,4,26,4,6,7,0
"Vedi i riflessi sull'acqua? Nelle profondità si nasconde qualcosa, oltre l'oscurità.",|cFFFFD200Bottino: |rCercatore d'Anime Helsvorn|n|cFFFFD200Zona: |rFauce,3125,179228,353644,3729672,5,2,0,6,7,0
"Questi occhi venivano inviati per rallentare e indebolire le anime ribelli della Fauce, così che fossero più facili da catturare.","|cFFFFD200Scontri tra mascotte: |rKorthia, Fauce",3126,179229,0,3729823,5,26,4,6,7,0
"Una tra tante mascotte indistinguibili, tutte chiamate Gnammi.",|cFFFFD200Missione giornaliera: |rMelme di carattere|n|cFFFFD200Zona: |rKorthia|n|n|cFFFFD200Missione giornaliera: |rReagenti locali|n|cFFFFD200Zona: |rKorthia,3127,179230,353645,3860692,2,2,0,6,7,0
"L'Occhio del Carceriere, attenuato, ora è solo una bolla magica onniveggente.",|cFFFFD200Bottino: |rOcchio del Carceriere|n|cFFFFD200Zona: |rSanctum del Dominio,3128,179232,353648,4062740,5,2,0,6,7,0
Nell'occhio riecheggia la rabbia che Zovaal covava per la sua esistenza punita.,|cFFFFD200Bottino: |rOcchio del Carceriere|n|cFFFFD200Zona: |rSanctum del Dominio|n|cFFFFD200Modalità: |rMitica,3129,179233,353649,4069937,5,2,0,6,7,0
L'armatura dorata di questi Giurafauce è fragile e si piega facilmente. Un'armatura dorata è una punizione.,"|cFFFFD200Bottino:|r Segrete Impenetrabili|n|cFFFFD200Zona:|r Torgast, Torre dei Dannati|n",3130,179239,353656,3731619,0,2,0,6,7,0
"Il Sanctum del Dominio accetta Giurafauce di ogni forma, dimensione e livello di corporeità.",|cFFFFD200Bottino: |rKel'Thuzad|n|cFFFFD200Zona: |rSanctum del Dominio,3131,179240,353658,3731616,0,2,0,6,7,0
"Un tormentatore spietato delle anime più piccole. Alcuni dicono che in vita fosse conosciuto con il nome di ""Termospin"".","|cFFFFD200Impresa: |rMolte, molte cose|n|cFFFFD200Categoria: |rTorgast",3132,179241,353659,3731620,0,82,5,6,7,0
Ruc non parla mai e si sa poco sul suo conto.,|cFFFFD200Bottino:|r Dono Misterioso di Ve'nari|n|cFFFFD200Zona:|r Fauce,3133,179242,353661,3731621,0,2,0,6,7,0
Non esiste mascotte a cui piaccia di più mordere.,|cFFFFD200Scontri tra mascotte: |rKorthia,3134,179248,0,3931156,4,26,4,6,7,0
"I golgranati si rotolano nei fiori rosso brillante per esaltare il proprio colore, in modo da attrarre gli altri esemplari e far paura ai nemici.",|cFFFFD200Scontri tra mascotte: |rKorthia,3135,179250,0,3931158,4,26,4,6,7,0
"Con Korthia fatta a pezzi dal Carceriere, le poche specie rimaste devono essere archiviate.",|cFFFFD200Bottino: |rZelnithop|n|cFFFFD200Zona: |rKorthia,3136,179251,353663,3931157,4,2,0,6,7,0
"Il colore della pelle di questa specie è più raro a Korthia e la aiuta a nascondersi dai predatori... E anche ai Giurafauce, in questo caso.",|cFFFFD200Bottino:|r Forniture della Marcia della Morte|n|cFFFFD200Zona:|r Korthia,3137,179252,353664,3931155,4,2,0,6,7,0
"Una specie addomesticata, piuttosto tranquilla e dall'aspetto famelico.",|cFFFFD200Mercante: |rDuchessa Mynx|n|cFFFFD200Zona: |rKorthia|n|cFFFFD200Fazione: |rMarcia della Morte - Onorato|n|cFFFFD200Costo: |r50|Hitem:163036|h|TInterface\ICONS\INV_Currency_PetBattle.BLP:0|t|h 1.500|Hcurrency:1767|h|TInterface\ICONS\INV_Stygia.BLP:0|t|h,3138,179253,353665,3931159,4,2,2,6,7,0
"Nell'Inframondo esistono divoratori di vari tipi e con diversi livelli di potere, ma sono sempre tutti alla ricerca di Animum.",|cFFFFD200Scontri tra mascotte: |rKorthia,3139,179256,0,3924117,7,26,4,6,7,0
"Ha solo due denti, ed entrambi contano.",|cFFFFD200Bottino:|r Rifornimenti del Codice degli Archivisti|n|cFFFFD200Zona:|r Korthia,3140,179255,353666,3924116,7,2,0,6,7,0
Le uova degli insetti necrofagi finiscono ovunque a Maldraxxus ed è facile trasportarle altrove per sbaglio.,|cFFFFD200Scontri tra mascotte: |rKorthia|n,3141,179329,0,3896756,2,26,4,6,7,0
"Lampeggino è appena nato ed è già pronto per l'avventura, ma potrebbe aver bisogno di qualche sonnellino lungo la strada.",|cFFFFD200Negozio Blizzard|r|n,3153,179589,354743,4080512,1,82,9,6,7,0
,,3155,179966,0,3987165,0,48,-1,6,7,0
,,3156,179809,0,1716280,2,32,-1,6,7,0
,,3158,179967,0,3069889,5,32,3,6,7,0
"Una parte focus, una parte nucleo, zero parti in condizioni coese o stabili.",|cFFFFD200Professione:|r Sintesi di Protoforma|n,3169,181308,359559,3851039,5,2,3,402,403,0
Il nucleo di una canzone sbiadito ormai molto tempo fa.,|cFFFFD200Professione:|r Sintesi di Protoforma|n,3170,181335,359604,4219625,5,2,3,402,403,0
"Potrebbe diventare qualsiasi cosa. Potrebbe diventare *tutto*. Nel frattempo, è... così.",|cFFFFD200Professione:|r Sintesi di Protoforma,3171,181336,359605,4219626,5,2,3,402,403,0
"È difficile dirlo con certezza, visto che non ha un volto, ma sembri piacergli.",|cFFFFD200Tesoro: |rGlobo di Effimero|n|cFFFFD200Zona: |rZereth Mortis,3172,181337,359606,4219627,5,82,0,402,403,0
Il suono peculiare del Bufonide Gracidante si può sentire anche a grandi distanze.,|cFFFFD200Scontri tra mascotte:|r Zereth Mortis|n,3173,181362,0,3778581,8,26,4,6,7,0
"Una parte sfera facciale, una parte manifattura cubica e una parte di pura curiosità.",|cFFFFD200Professione:|r Sintesi di Protoforma|n,3174,181488,359760,3747898,7,2,3,6,7,0
"Foskystrasza, regina dei cuccioli di Murloc, ha passato diversi anni a combattere con il suo acerrimo rivale, Morty.",|cFFFFD200Promozione:|r Dragonflight - Heroic Edition|n,3175,181535,359805,4050685,1,82,7,435,436,0
"È possibile avvistare solo i Vombatidi Scavatori sintetizzati più di recente. Il resto sta probabilmente scavando sottoterra, e non li vedremo mai più.",|cFFFFD200Professione:|r Sintesi di Protoforma|n,3176,181547,359813,3747899,7,2,3,6,7,0
"Un cucciolo di draconide è uno spettacolo davvero curioso, un po' come tutto di questi tempi.",|cFFFFD200Promozione: Dragonflight - Base Edition|r ,3177,181575,359855,4186101,1,82,7,6,7,0
"Una parte di becco, due parti di ali, una parte di impossibilità di fermarsi, una parte di riluttanza di fermarsi.",|cFFFFD200Professione: |rSintesi di Protoforma|n,3178,181578,359863,3672192,2,2,3,6,7,0
"Una parte di rocce, due parti di rocce più grandi, tre parti di rocce più piccole, una parte di abilità di muoversi a prescindere.",|cFFFFD200Professione:|r Sintesi di Protoforma|n,3179,181615,359898,4227081,6,2,3,6,7,0
Alcuni degli abitanti più avventurosi di Zereth Mortis considerano i Bufonidi Velenosi una prelibatezza.,|cFFFFD200Scontri tra mascotte:|r Zereth Mortis|n,3180,182019,0,3778583,8,26,4,6,278,0
"Una parte di pelle scivolosa, una parte di gambe forti, una parte di apparato vocale, una parte di completa auto accettazione.",|cFFFFD200Professione:|r Sintesi di Protoforma|n,3181,182081,360389,3778580,8,2,3,6,7,0
,,3188,182140,360567,134176,7,16466,-1,6,7,0
"Una parte di duplicati, due parti di duplicati, quattro parti di duplicati... Ooops.",|cFFFFD200Professione:|r Sintesi di Protoforma,3189,182183,360691,3922912,4,2,3,254,7,0
Alcuni leporidi sono docili e carini. Altri sono... comunque carini.,|cFFFFD200Scontri tra mascotte: |rZereth Mortis,3190,182216,0,3922917,4,26,4,6,7,0
"Alcuni dei leporidi più timidi vivono sottoterra. Escono solo per cercare cibo, prima di tornare nelle loro tane.",|cFFFFD200Scontri tra mascotte: |rZereth Mortis,3191,182234,0,3922913,4,26,4,6,7,0
"Anche se è risaputo che i proto-aviani più grandi si nutrono di piccoli animali, i pulcini mangiano principalmente vermi e insetti.",|cFFFFD200Scontri tra mascotte: |rZereth Mortis,3196,182260,0,4227077,2,26,4,6,7,0
"Una parte di branchie, una parte di velocità, una parte qualsiasi di cosa debba essere.",|cFFFFD200Professione:|r Sintesi di Protoforma|n,3197,182264,360800,3934485,8,2,3,6,7,0
"La peculiare colorazione rossa dei Proto-Aviani Scarlatti rende loro difficile nascondersi dai predatori, il che ironicamente li rende anche molto difficili da trovare.",|cFFFFD200Scontri tra mascotte: |rZereth Mortis,3200,182294,0,4227079,2,26,4,6,7,0
Otto parti di gambe. Otto parti di occhi. Una parte di corda. Una parte di fame insaziabile.,|cFFFFD200Professione:|r Sintesi di Protoforma|n,3201,182393,360986,3684808,7,2,3,6,7,0
"Alcuni taracnidi preferiscono aspettare la propria preda. A questi piace inseguirla, paralizzarla e poi mangiarsela tutta intera.",|cFFFFD200Scontri tra mascotte: |rZereth Mortis,3202,182437,0,3684809,7,26,4,6,7,0
"Quando la preda si avvicina alla sua portata, raramente si allontana.",|cFFFFD200Scontri tra mascotte: |rZereth Mortis,3203,182473,0,3684810,7,26,4,6,7,0
Una parte di guscio. Una parte di chela. Tutte le parti di resilienza che servono.,|cFFFFD200Professione: |rSintesi di Protoforma,3204,182504,361157,3922918,4,2,3,6,7,0
Alcuni degli scarabeidi più piccoli di Zereth Mortis hanno dei gusci metallici per proteggersi. Il guscio dona loro anche un aspetto favoloso.,|cFFFFD200Scontri tra mascotte: |rZereth Mortis,3205,182568,0,3922919,4,26,4,6,7,0
"Il guscio colorato di questo scarabeide lo rende più interessante agli occhi dei potenziali compagni. Purtroppo, lo rende anche più interessante ai potenziali predatori.",|cFFFFD200Scontri tra mascotte: |rZereth Mortis,3206,182691,0,3922921,4,26,4,6,7,0
"Tre parti di pianificazione, una parte di pericolo, una parte di spaghetto.",|cFFFFD200Professione:|r Sintesi di Protoforma|n,3207,182735,361400,4095284,7,2,3,6,7,0
"La peculiare colorazione rossa di questi viperidi funge da avvertimento per potenziali predatori: ""mangiami a tuo rischio e pericolo!""",|cFFFFD200Scontri tra mascotte: |rZereth Mortis,3208,182758,0,4095288,7,26,4,6,7,0
Dove si siede un viperide da 150 kg? Dove vuole.,|cFFFFD200Scontri tra mascotte: |rZereth Mortis,3209,182760,0,4095284,7,26,4,6,7,0
"I viperidi possono restare fermi silenziosamente per ore, in attesa della loro preda.",|cFFFFD200Scontri tra mascotte: |rZereth Mortis,3210,182768,0,4095286,7,26,4,6,7,0
"Due parti di ali, una parte di pugnale, cinque parti di sadismo.",|cFFFFD200Professione:|r Sintesi di Protoforma|n,3211,182840,361572,3741937,2,2,3,6,7,0
"Che sia in vita o nell'aldilà, alcune cose sono universali. I fastidiosi insetti succhiasangue sono una di quelle cose.",|cFFFFD200Scontri tra mascotte: |rZereth Mortis,3212,182876,0,3741939,2,26,4,6,7,0
"Nonostante il suo aspetto vulnerabile, spesso i predatori evitano di attaccare un piccolo di vombatide. Non si sa esattamente perché, ma molti credono che abbia a che fare con il loro tenero nasino.",|cFFFFD200Scontri tra mascotte: |rZereth Mortis,3213,183142,0,3747900,7,26,4,6,7,0
"Zereth Mortis è davvero terrificante, ma non è così terrificante (o adorabile) come un vombatide che protegge i suoi piccoli.",|cFFFFD200Scontri tra mascotte: |rZereth Mortis,3214,183158,0,3747901,7,26,4,6,7,0
