Description_lang,SourceText_lang,ID,CreatureID,SummonSpellID,IconFileDataID,PetTypeEnum,Flags,SourceTypeEnum,CardUIModelSceneID,LoadoutUIModelSceneID,CovenantID
"Anche se sono più piccoli dei famigerati Covi Gilneani, i corvi comuni non sono né meno astuti né meno pericolosi.",|cFFFFD200Scontri tra mascotte: |rAppare occasionalmente insieme ad altre mascotte durante gli scontri sull'Isola di Lunacupa.,1068,67443,0,645217,2,26,4,6,7,0
"Terky è tanto timido quanto adorabile, e preferisce stare in compagnia dei vecchi amici piuttosto che farsene di nuovi.",|cFFFFD200Bottino:|r Uovo di Murloc Bianco,1073,16445,28487,656558,0,82,0,6,7,0
Un piccolo piromane che ama fare le fusa. Attenzione: accarezzarlo solo se provvisti di guanti ignifughi!,|cFFFFD200Negozio|r,1117,68267,134538,666530,6,82,9,6,7,0
"Benché possa sembrare un cugino lontano del Micio Cinereo, le due creature non hanno un antenato in comune.",|cFFFFD200Missione: |rIl domatore degli Spiriti dei Pandaren|n|cFFFFD200Zona: |rVallata dell'Eterna Primavera|n,1124,68466,134892,774324,6,2,1,36,7,0
Questi spiriti rappresentano il cuore del potere elementale di Pandaria.,|cFFFFD200Missione: |rIl domatore degli Spiriti dei Pandaren|n|cFFFFD200Zona: |rVallata dell'Eterna Primavera|n,1125,68467,134894,774322,6,2,1,36,7,0
"Gli elementi di Pandaria sono carini e giocosi, fin quando la loro terra natale non è in pericolo.",|cFFFFD200Missione: |rIl domatore degli Spiriti dei Pandaren|n|cFFFFD200Zona: |rVallata dell'Eterna Primavera|n,1126,68468,134895,774323,6,2,1,36,7,0
È capace di entrare anche nelle scatole più piccole grazie alla sua natura spettrale.,|cFFFFD200Promozione:|r Battle.net World Championship di Shanghai 2012,1127,68502,132759,298591,5,16466,7,6,7,0
Un roditore di dimensioni normali.,|cFFFFD200Scontri tra mascotte:|r Giungla di Krasarang,1128,68506,0,645526,7,26,4,6,7,0
,,1129,68555,0,651538,4,1072,4,6,7,0
,,1130,68567,0,134153,1,48,4,6,7,0
,,1131,68568,0,236196,2,48,4,6,7,0
,,1132,68569,0,133922,8,48,4,6,7,0
,,1133,68570,0,643423,8,48,4,6,7,0
,,1134,68572,0,252178,5,48,4,6,7,0
,,1135,68575,0,236193,2,48,4,6,7,0
,,1136,68571,0,630863,1,48,4,6,7,0
,,1137,68573,0,648644,7,48,4,6,7,0
,|n|n,1138,68577,0,656560,6,48,1,6,7,0
,,1139,68580,0,774324,6,48,-1,6,7,0
,,1140,68579,0,774322,6,48,-1,6,7,0
,,1141,68578,0,774323,6,48,-1,6,7,0
"Creato con uno scopo, uno solo: fare del male alle altre mascotte, più male che può.","|cFFFFD200Mercante: |rTrellis Brezzamarina|n|cFFFFD200Zona: |rTram degli Abissi|n|cFFFFD200Costo: |r500|TINTERFACE\MONEYFRAME\UI-GOLDICON.BLP:0|t|n|cFFFFD200Reputazione: |rClub dei Combattenti di Bizmo, Grado 3|n|n|cFFFFD200Mercante: |rPaul Nurt|n|cFFFFD200Zona: |rArena dei Combattenti|n|cFFFFD200Costo: |r500|TINTERFACE\MONEYFRAME\UI-GOLDICON.BLP:0|t|n|cFFFFD200Reputazione: |rArena dei Combattenti, Grado 3",1142,68601,135156,134152,9,18,2,39,7,0
"Scoperte in una covata nel retro della tana di Maexxna, sono creature già non morte al momento della nascita.",|cFFFFD200Bottino: |rMaexxna|n|cFFFFD200Zona: |rNaxxramas,1143,68656,135254,134899,3,2,0,6,7,0
"Il cadavere di Loatheb è ricoperto di piccoli bozzoli in grado di sparare spore fungine infette a una distanza di 1.000 m, con vento favorevole.",|cFFFFD200Bottino: |rLoatheb|n|cFFFFD200Zona: |rNaxxramas,1144,68657,135255,571319,3,2,0,6,7,0
"Dopo essere uscito dalla gelida necropoli di Naxxramas, il Signor Bigolo ha trovato un bel posticino caldo in cui farsi un sonnellino.",|cFFFFD200Impresa: |rIncursore animalista|n|cFFFFD200Categoria: |rScontri tra Mascotte,1145,68655,135256,656579,3,82,5,6,7,0
"Quando Gluth morì per mano di un manipolo di avventurieri, furono ritrovate nel suo cadavere queste piccole creature, che masticavano le enormi ossa non morte.",|cFFFFD200Bottino: |rGluth|n|cFFFFD200Zona: |rNaxxramas,1146,68654,135257,133718,3,2,0,6,7,0
"Ne sono sopravvissuti pochi, di questi araldi ardenti, dopo la sconfitta di Ragnaros nelle Terre del Fuoco.",|cFFFFD200Bottino: |rSulfuron l'Araldo|n|cFFFFD200Zona: |rNucleo Ardente,1147,68665,135258,132312,0,2,0,35,7,0
Questi minuscoli Imp vagano per il Nucleo Ardente in gruppi numerosi che sono in grado di rinfoltirsi rapidamente.,|cFFFFD200Bottino: |rMagmadar|n|cFFFFD200Zona: |rNucleo Ardente,1149,68664,135259,136218,0,2,0,6,7,0
Il nucleo di Golemagg raffreddato sembra aver conservato qualche proprietà semi-senziente.,|cFFFFD200Bottino: |rGolemagg il Crematore|n|cFFFFD200Zona: |rNucleo Ardente|n,1150,68666,135259,237011,6,2,0,39,7,0
"Una delle uova di Alafurion è miracolosamente sopravvissuta, nella Fortezza dell'Ala Nera.",|cFFFFD200Bottino: |rAlafurion l'Indomabile|n|cFFFFD200Zona: |rFortezza dell'Ala Nera,1151,68661,135263,236469,1,2,0,6,7,0
Gli avversari di questa mostruosità cromatica sperano solo che non abbia l'abilità di fermare il tempo!,|cFFFFD200Bottino: |rCromaggus|n|cFFFFD200Zona: |rFortezza dell'Ala Nera,1152,68662,135264,377270,1,2,0,6,7,0
Un cucciolo lasciato a guardia dei draghetti.,|cFFFFD200Bottino: |rFustigor il Signore della Progenie|n|cFFFFD200Zona: |rFortezza dell'Ala Nera,1153,68663,135265,236472,1,2,0,6,7,0
Questo piccolo globulo non ha fatto in tempo a ritornare da Viscidus per coagularsi in lui.,|cFFFFD200Bottino: |rViscidus|n|cFFFFD200Zona: |rAhn'qiraj,1154,68660,135266,132108,5,2,0,6,7,0
Un Idolo Anubisath dal Tempio di Ahn'qiraj infuso con un'antica magia qiraji.,|cFFFFD200Bottino: |rImperatore Vek'lor|n|cFFFFD200Zona: |rAhn'qiraj,1155,68659,135267,134908,0,2,0,35,7,0
L'anatema di molti avventurieri: guardare nei suoi occhi significa conoscere la vera pazzia.,|cFFFFD200Bottino: |rProfeta Skeram|n|cFFFFD200Zona: |rAhn'qiraj,1156,68658,135268,134896,5,2,0,6,7,0
"Più invecchiano, più diventano belli.",|cFFFFD200Scontri tra mascotte:|r Savane Settentrionali,1157,68804,0,132921,0,26,4,6,7,0
"Una razza estremamente rara, cacciata dai locali per anni.",|cFFFFD200Scontri tra mascotte:|r Feralas,1158,68805,0,458252,0,26,4,36,7,0
La maggior parte della gente non ha mai letto questo libro.,|cFFFFD200Scontri tra mascotte:|r Alture di Colletorto|n,1159,68806,0,133740,5,26,4,6,7,0
Mai perderlo d'occhio.,|cFFFFD200Scontri tra mascotte:|r Valico Ventomorto|n,1160,68819,0,134416,5,26,4,39,7,0
Credici: sa che ore sono.,|cFFFFD200Scontri tra mascotte:|r Caverne del Tempo|n,1161,68820,0,298656,1,26,4,6,7,0
"Creato originariamente dagli ingegneri nelle profondità di Gnomeregan, il Felino Termoflussante è un capolavoro di meccanica moderna.",|cFFFFD200Scontri tra mascotte:|r Gnomeregan|n,1162,68838,0,668552,9,26,4,6,7,0
"I geni dell'ingegneria di Lungavista crearono questo cucciolo come prototipo. Sfortunatamente, alcuni esemplari furono rubati e non furono mai più rinvenuti.",|cFFFFD200Scontri tra mascotte:|r Fontefredda|n,1163,68839,0,773096,9,26,4,6,7,0
Questo tipo di raptor viene costruito sulle Montagne Spinaguzza. Il suo ruggito robotico si sente piuttosto spesso vicino alla Stazione di Toshley.,|cFFFFD200Scontri tra mascotte:|r Montagne Spinaguzza|n,1164,68841,0,774414,9,26,4,6,7,0
"Bestie della progenie di Malygos, questi draghetti sono molto preziosi per le loro incredibili magie arcane.",|cFFFFD200Scontri tra mascotte:|r Ibernia|n,1165,68845,0,797547,1,26,4,6,7,0
"Originario del Massiccio del Kun-Lai, questo raro yeti è più pericoloso di quanto sembri.",|cFFFFD200Scontri tra mascotte:|r Massiccio del Kun-Lai|n,1166,68846,0,797882,0,26,4,6,7,0
Questi drachi meravigliosi si trovano lungo le spiagge di Nordania.,|cFFFFD200Scontri tra mascotte:|r Bacino di Sholazar|n,1167,68850,0,587740,1,26,4,34,7,0
Foski è una delle specie di Murloc più rare del mondo.,|cFFFFD200Promozione:|r Evento Promozionale Corea,1168,15361,25018,132834,0,16466,7,6,7,0
Un tomo vile che custodisce segreti talmente terribili e assurdi che le sue pagine sembrano quasi aver preso vita. Si trova sui comodini delle camere di molti Stregoni.,|cFFFFD200Gioco di carte:|r Tradimento del Guardiano,1174,69208,136484,355498,5,2,8,33,7,0
"Toccati dal fulmine, questi pericolosi roditori dovrebbero essere tenuti a distanza di sicurezza.",|cFFFFD200Scontri tra mascotte:|r Isola del Tuono,1175,69648,0,796787,6,26,4,6,7,0
"È incredibile quanto sia carino, vero? Anche io sono senza parole!",|cFFFFD200Missione:|r Bestie Leggendarie|n,1176,69649,137568,774009,7,82,1,6,7,0
"Nate dalla sabbia, queste pericolose creature possono formarsi e disperdersi in un batter d'occhio.",|cFFFFD200Bottino:|r Regno del Tuono|n|n,1177,69748,137977,796636,6,2,0,6,7,0
"Fedeli ai Predatori del Sole che li hanno creati, questi costrutti, anche se piccoli, si sanno difendere come si deve.",|cFFFFD200Bottino: |rCostrutto dei Predatori del Sole Fuori Controllo|n|cFFFFD200Zona: |rIsola del Tuono,1178,69778,138082,838516,9,2,0,6,7,0
"I fulmini attraversano costantemente il suo corpo, dalla punta della coda ai denti affilati.",|cFFFFD200Scontri tra mascotte:|r Isola del Tuono,1179,69794,0,801473,6,26,4,6,7,0
Questo raptor unico è nativo dell'isola di Zandalar ed è stato trasportato qui insieme al resto dell'armata degli Zandalari.,|cFFFFD200Bottino: |rDinomante Zandalari|n|cFFFFD200Zona: |rIsola dei Giganti,1180,69796,138087,797325,7,2,0,6,7,0
Si dice che questi serpenti siano in grado di ingoiare uno Gnomo in un sol boccone.,|cFFFFD200Scontri tra mascotte:|r Isola del Tuono,1181,69818,0,801474,7,26,4,6,7,0
Forse è meglio non toccarla...,|cFFFFD200Scontri tra mascotte:|r Isola del Tuono,1182,69819,0,804969,8,26,4,6,7,0
"Forgiate nel Regno del Tuono, queste piccole creazioni sono i servi del grande Animus Oscuro.",|cFFFFD200Bottino:|r Animus|n|cFFFFD200Zona:|r Regno del Tuono,1183,69820,138161,838812,9,2,0,6,7,0
"Anche quando hanno dimensioni così ridotte, i cornofurente sono noti per ferire gravemente le ignare vittime.",|cFFFFD200Impresa: |rAllenatore Brutale|n|cFFFFD200Categoria: |rScontri tra mascotte,1184,69849,138287,840541,7,82,5,6,7,0
C'è qualcosa di familiare in questa creatura...,|cFFFFD200Missione: |rUn mucchio di Ossa Giganti di Dinosauro|n|cFFFFD200Zona: |rIsola dei Giganti,1185,69848,138285,838549,5,2,1,6,7,0
,,1187,68558,0,644001,7,1072,4,6,7,0
,,1188,68559,0,645906,8,1072,4,6,7,0
,,1189,68560,0,646378,7,1072,4,6,7,0
,,1190,68561,0,646325,4,1072,4,6,7,0
,,1191,68562,0,133936,8,1072,4,6,7,0
,,1192,68563,0,237398,7,1072,4,6,7,0
,,1193,68564,0,633440,8,1072,4,6,7,0
,,1194,68565,0,646059,4,1072,4,6,7,0
,,1195,68566,0,643423,8,1072,4,6,7,0
"Queste adorabili canaglie amano crogiolarsi al sole, dormire al sole e riposare al sole.",|cFFFFD200Missione:|r Bestie Leggendarie|n,1196,69891,138380,774009,7,2,1,6,7,0
La pelliccia bianca del Panda delle Nevi gli permette di nascondersi nei mucchi di neve del Massiccio del Kun-Lai.,|cFFFFD200Missione:|r Bestie Leggendarie|n,1197,69893,138381,838693,7,2,1,6,7,0
"Parenti dei Panda delle Nevi, i Panda di Montagna vivono nelle regioni più basse del Massiccio del Kun-Lai.",|cFFFFD200Missione:|r Bestie Leggendarie|n,1198,69892,138382,838691,7,2,1,6,7,0
Non accarezzare l'estremità appuntita. Nota: tutte le estremità sono appuntite.,|cFFFFD200Bottino: |rHorridon|n|cFFFFD200Zona: |rRegno del Tuono,1200,70083,138825,840540,7,2,0,6,7,0
Alcuni Pandaren credono che G'nathus sia un antico Loa degli Zandalari posto a guardia delle acque a sud dell'isola fortificata di Lei Shen.,|cFFFFD200Bottino: |rG'nathus|n|cFFFFD200Zona: |rSteppe di Tong Long,1201,70098,138913,133898,8,2,0,6,7,0
"Micidiale progenie dell'Antica Madre, i Cuccioli di Ji-Kun sono considerati tesori sacri in molte culture.",|cFFFFD200Bottino:|r Ji-Kun|n|cFFFFD200Zona:|r Regno del Tuono,1202,70144,139148,838694,2,2,0,6,7,0
"Il sogno di ogni cuoco, incartato in una splendida confezione fatta di metallo e viti. Peccato che ciò che cucina non sia commestibile per gli umanoidi. Secondo le note di Jard, è stato costruito per la sua amica, Emily Cole.",|cFFFFD200Professione:|r Ingegneria di Mists of Pandaria|n,1204,70082,138824,798062,9,2,3,6,7,0
Gli Zandalari allevano una razza speciale di cornofurenti di piccole dimensioni da utilizzare come cavalcature.,|cFFFFD200Bottino: |rCornofurente|n|cFFFFD200Zona:|r Isola dei Giganti,1205,70154,139153,840542,7,2,0,6,7,0
Si pensa che le scaglie rosse di questi pesci siano un monito della tossicità delle loro carni ai predatori delle Steppe di Tong Long e delle Distese del Terrore. I pescatori più zelanti possono riuscire ad addomesticarne uno.,|cFFFFD200Professione:|r Pesca di Mists of Pandaria,1206,70257,139361,850139,8,2,3,6,7,0
"Questi piccoli animaletti si trovano nelle acque dell'Isola Senza Tempo, o in compagnia di Danii e Panciarossa Mandarini. I bravi pescatori spesso riescono ad addomesticarli.",|cFFFFD200Professione:|r Pesca di Mists of Pandaria,1207,70258,139362,850137,8,2,3,6,7,0
"Si pensa che la colorazione verde a strisce di questa piccola carpa la aiuti a mimetizzarsi nelle acque della Foresta di Giada, della Valle dei Quattro Venti e della Giungla di Krasarang. I pescatori più zelanti possono riuscire ad addomesticarne una.",|cFFFFD200Professione:|r Pesca di Mists of Pandaria,1208,70259,139363,850138,8,2,3,6,7,0
"Questi intrepidi pesci possono sopravvivere in un'ampia gamma di climi, dalle montagne innevate del Massiccio del Kun-Lai alle salate acque oceaniche attorno a Pandaria. I pescatori più zelanti possono riuscire ad addomesticarne uno.",|cFFFFD200Professione:|r Pesca di Mists of Pandaria|n,1209,70260,139365,850140,8,2,3,6,7,0
Questi piccoli servitori degli Zandalari sono abili nell'infiltrarsi nelle immense cambuse delle navi da guerra dei Troll.,|cFFFFD200Bottino: |rDinomante Zandalari|n|cFFFFD200Zona: |rIsola dei Giganti,1211,70451,139932,797326,7,2,0,6,7,0
"Anche se sono di piccole dimensioni, questi raptor possono squartare una mucca in meno di 10 secondi.",|cFFFFD200Bottino: |rDinomante Zandalari|n|cFFFFD200Zona: |rIsola dei Giganti,1212,70452,139933,797327,7,2,0,6,7,0
Queste adorabili bestiole sono perfette da coccolare... sempre che non ti importi di perdere le mani.,|cFFFFD200Bottino: |rDinomante Zandalari|n|cFFFFD200Zona: |rIsola dei Giganti,1213,70453,139934,797328,7,2,0,6,7,0
"Il poco noto cucciolo del Lupo Cattivo, ritrovato rimpinzato e addormentato in una cesta ormai vuota di dolciumi.",|cFFFFD200Bottino: |rLupo Cattivo|n|cFFFFD200Zona: |rKarazhan,1226,71014,141433,463876,0,2,0,6,7,0
"Tra i suoi compiti principali vi è lo spolverare i numerosi artefatti magici di Medivh, un'attività che è costata la vita, la sanità mentale o l'integrità fisica a molti custodi prima di Moroes.",|cFFFFD200Bottino: |rCuratore|n|cFFFFD200Zona: |rKarazhan,1227,71015,141434,236513,9,2,0,6,7,0
"Abbandonando lo Spaziofatuo, gli Abissali di Malchezaar furono bizzarramente distorti dalle protezioni magiche di Karazhan, diventando piccoli e più propensi a eruttare fiamme.",|cFFFFD200Bottino: |rPrincipe Malchezaar|n|cFFFFD200Zona: |rKarazhan,1228,71016,141435,615096,5,2,0,6,7,0
"Servitore di Terestian Malazampa, questo scaltro Imp venne abbandonato a Karazhan quando il portale per la Distorsione Fatua si chiuse dietro di lui.",|cFFFFD200Bottino: |rTerestian Malazampa|n|cFFFFD200Zona: |rKarazhan,1229,71033,141451,460856,0,2,0,6,7,0
"Un'incredibile scoperta da parte della comunità scientifica di Azeroth, che per molto tempo si era chiesta (generalmente in una taverna) che forma potesse avere un cucciolo di Gigante del Mare.",|cFFFFD200Bottino: |rMorogrim Calcamaree|n|cFFFFD200Zona: |rCaverna di Sacrespire,1230,71017,141436,443382,8,2,0,6,7,0
"La prole di Idross, considerato un ""Conte delle Pozzanghere"" dalla comunità degli elementali.",|cFFFFD200Bottino: |rIdross l'Instabile|n|cFFFFD200Zona: |rCaverna di Sacrespire,1231,71018,141437,136030,6,2,0,6,7,0
"È un mistero come faccia Dama Vashj a infondere poteri mentali nei Camminatori della Palude; anche in giovane età, essi dimostrano possenti capacità psichiche.",|cFFFFD200Bottino: |rDama Vashj|n|cFFFFD200Zona: |rCaverna di Sacrespire,1232,71019,141446,254502,5,2,0,36,7,0
Inviato attraverso la Distorsione Fatua dal grande Archimonde il Profanatore per terrorizzare le civiltà inferiori con i suoi passi prorompenti.,|cFFFFD200Bottino: |rRazziatore del Vuoto|n|cFFFFD200Zona: |rForte Tempesta,1233,71020,141447,466089,9,2,0,6,7,0
"Le lanterne trasportate dagli Invocatori del Vuoto uniscono il reame dei vivi con quello dei morti, e spesso attraggono fantasmi e spiriti ribelli.",|cFFFFD200Bottino: |rGran Astromante Solarian|n|cFFFFD200Zona: |rForte Tempesta,1234,71021,141448,538447,5,2,0,6,7,0
Questi draghifalco vivacemente colorati trasportano le forze di Kael'thas rapidamente e in modo infallibile attraverso la Tempesta Fatua che circonda Forte Tempesta.,|cFFFFD200Bottino: |rAl'ar|n|cFFFFD200Zona: |rForte Tempesta,1235,71022,141449,132188,1,2,0,6,7,0
"Benché si tratti di professionisti, più di una volta è stato necessario interrompere lo spettacolo perché Tito e Ruggito si guardavano fissi negli occhi, finendo con l'inseguirsi per tutto il teatro di Karazhan.",|cFFFFD200Impresa: |rIncursore animalista II: sintonie perdute|n|cFFFFD200Categoria: |rScontri tra Mascotte,1236,71023,141450,133695,7,82,5,6,7,0
"I Troll hanno una lunga tradizione in fatto di evocazioni di idra. Benché non sia la più grossa o potente delle idra, Gahz'rooki è capace di staccare un dito se ci si avvicina troppo.",|cFFFFD200Mercante: |rRavika|n|cFFFFD200Zona: |rDurotar|n|cFFFFD200Costo: |r1|TINTERFACE\ICONS\inv_drink_31_embalmingfluid:0|t|n|n|cFFFFD200Mercante: |rTenuki|n|cFFFFD200Zona: |rDurotar|n|cFFFFD200Costo: |r1|TINTERFACE\ICONS\inv_drink_31_embalmingfluid:0|t,1237,71159,141789,463493,8,2,2,34,7,0
"Le Val'kyr sono considerate ""impure"" finché non sconfiggono una creatura sufficientemente nobile.",|cFFFFD200Scontri tra mascotte: |rNordania,1238,71163,0,851119,3,26,4,6,7,0
"Le oscure pozze nella sala di Primordius sono ora immobili dopo la caduta dei Mogu, e tenebrose emozioni cominciano a condensarsi.",|cFFFFD200Bottino:|r Primordius|n|cFFFFD200Zona: |rRegno del Tuono|n|cFFFFD200Difficoltà: |rRicerca delle Incursioni|n,1243,71199,142028,237513,5,2,0,33,7,0
Queste crudeli melme sono molto sensibili alla scia di feromoni di Primordius.,|cFFFFD200Bottino:|r Primordius|n|cFFFFD200Zona: |rRegno del Tuono|n|cFFFFD200Difficoltà: |rNormale o Eroica|n,1244,71200,142029,576309,5,2,0,33,7,0
Gli allenatori di mascotte sono pregati di lavarsi le mani per almeno 30 minuti dopo aver giocato con le Fecciole.,|cFFFFD200Bottino: |rFeccia Tremolante,1245,71201,142030,576313,5,2,0,33,7,0
,,1247,71438,0,327502,8,1072,-1,6,7,0
"Questo piccolo Antico è di una razza unica su Azeroth. Creato dai rami eterni del Grande Albero, può fiorire in qualsiasi stagione.",|cFFFFD200Negozio|r,1248,71488,142880,874857,6,82,9,35,7,0
"Infame ariete psionico dei Protoss, Zeradar è anche l'unico Arconte che può utilizzare la Tempesta Psionica. Potere travolgente!",|cFFFFD200Promozione:|r Collector's Edition di StarCraft II: Legacy of the Void|n,1255,71655,143637,1125916,5,82,7,6,7,0
"Sembra che questo piccoletto si trovi sempre nei pressi di eventi cataclismici. Non ci sono prove che sia in qualche modo correlato con questi eventi, forse si tratta solo di un osservatore. O forse è sempre nel posto sbagliato al momento sbagliato.",|cFFFFD200Professione:|r Ingegneria di Mists of Pandaria|n,1256,71693,143703,876476,9,2,3,6,7,0
Ha buone possibilità di impazzire e uccidere qualcuno.,|cFFFFD200Bottino:|r Sviluppatori|n,1257,71700,143732,618977,0,34,0,6,7,0
,,1258,71816,0,648803,3,48,2,6,7,0
,,1259,71844,0,132196,7,48,-1,6,7,0
"Feroce e leale, Xu-Fu ama cacciare durante la notte. Una volta, durante una luna piena, divorò uno Yak Peloduro Adulto intero, trovandosi poi a sonnecchiare per due giorni.",|cFFFFD200Mercante:|r Torneo dei Celestiali,1266,71942,145696,877410,7,82,2,6,7,0
,,1267,72009,0,877410,7,1072,-1,6,7,0
,,1268,72053,0,840541,7,48,-1,6,7,0
,,1269,72054,0,516665,2,48,-1,6,7,0
,,1271,72055,0,132847,5,48,-1,6,7,0
"I cuccioli di Zannastrale diventano immense, bavose macchine da guerra dal pelo nero una volta cresciuti... tranne Zannina.",|cFFFFD200Bottino: |rZannastrale|n|cFFFFD200Zona: |rIsola di Lunacupa,1276,72160,144761,538568,7,2,0,34,7,0
,,1277,72100,0,133015,9,48,-1,6,7,0
,,1278,72098,0,136024,6,48,-1,6,7,0
,,1279,72099,0,133784,4,48,-1,6,7,0
,,1280,72103,0,669467,6,48,-1,6,7,0
,,1281,72102,0,646325,4,48,-1,6,7,0
,,1282,72101,0,646378,7,48,-1,6,7,0
,,1283,72105,0,652138,1,48,-1,6,7,0
,,1284,72104,0,655994,5,48,-1,6,7,0
,,1285,72106,0,132150,2,48,-1,6,7,0
,,1286,71898,0,132266,7,48,-1,6,7,0
,,1287,72097,0,668552,9,48,-1,6,7,0
,,1288,71897,0,797882,0,48,-1,6,7,0
,,1289,72109,0,254857,4,48,-1,6,7,0
,,1290,72108,0,645906,8,48,-1,6,7,0
,,1291,72107,0,646059,3,48,-1,6,7,0
,,1292,72110,0,574570,0,48,-1,6,7,0
,,1293,72111,0,574570,0,48,-1,6,7,0
,,1295,72112,0,574570,0,48,-1,6,7,0
,,1296,72113,0,633440,8,48,-1,6,7,0
,,1297,72114,0,135862,6,48,-1,6,7,0
,,1298,72115,0,893779,5,48,-1,6,7,0
,,1299,72118,0,237441,3,48,-1,6,7,0
,,1300,72116,0,441880,1,48,-1,6,7,0
,,1301,72117,0,134158,1,48,-1,6,7,0
Chi-Chi prova a ispirare speranza gracchiando sonoramente e rincorrendo le farfalle per mangiarle.,|cFFFFD200Mercante: |rMaestro Li|n|cFFFFD200Zona: |rIsola Senza Tempo|n|cFFFFD200Costo: |r3|TINTERFACE\ICONS\INV_MISC_TRINKETPANDA_07:0|t,1303,72462,145697,877514,2,82,2,6,7,0
"Un mastro scultore consacrò la sua vita alla creazione di una statua di incomparabile bellezza, ispirato dalla devozione verso Yu'lon. Quando morì, Yu'lon trasfuse parte della sua essenza nella statua, facendo entrare Yu'la nel nostro mondo.",|cFFFFD200Mercante: |rMaestro Li|n|cFFFFD200Zona: |rIsola Senza Tempo|n|cFFFFD200Costo: |r3|TINTERFACE\ICONS\INV_MISC_TRINKETPANDA_07:0|t,1304,72463,145698,877408,1,82,2,6,7,0
"Sempre in cerca di una sfida o di un prato dall'erba gustosa, Zao mantiene la testa bassa e gli occhi attenti.",|cFFFFD200Mercante:|r Torneo dei Celestiali,1305,72464,145699,900317,7,82,2,6,7,0
,,1311,72285,0,877514,2,1072,-1,6,7,0
,,1317,72291,0,877408,1,1072,-1,6,7,0
,,1319,72290,0,900317,7,1072,-1,6,7,0
"Questo bel robottino è tutto suo ""padre"", Orotron 4000. Poiché i circuiti della generosità degli Orotron non si sviluppano finché non si raggiungono le specifiche massime, meglio non aspettarsi alcun regalo.",|cFFFFD200Bottino:|r Pacco Dono di Orotron|n,1320,73011,147124,773178,9,2,0,39,7,0
I cuccioli di gru dell'Isola Senza Tempo a volte emettono un curioso canto che rilassa il corpo e rinvigorisce lo spirito.,|cFFFFD200Bottino:|r Nido di Gru|n|cFFFFD200Zona:|r Isola Senza Tempo,1321,73534,0,646586,2,2,0,6,7,0
"Quando l'Ingegnere d'Assedio Miccianera creò la prima Robobomba nella Fortezza Sotterranea, non ebbe il cuore di vederla distrutta. Decise così di tenerla come mascotte, nonostante la sua tendenza a esplodere.",|cFFFFD200Bottino:|r Ingegnere d'Assedio Miccianera|n|cFFFFD200Incursione:|r Assedio di Orgrimmar,1322,73352,15048,897633,9,2,0,6,7,0
I Folletti Fogliacinerea dell'Isola Senza Tempo proteggono instancabilmente la vegetazione dalla bruciante furia di Ordos e dei suoi servitori.,|cFFFFD200Bottino:|r Sanafoglia|n|cFFFFD200Zona:|r Isola Senza Tempo|n,1323,73533,148046,136021,0,2,0,41,7,0
Gli assassini Jinyu impiegano questa falena sia come diversivo portatile sia come strumento per localizzare i punti deboli delle armature dei nemici.,|cFFFFD200Scontri tra mascotte:|r Isola Senza Tempo|n,1324,73542,148068,236193,2,26,4,6,7,0
"I gatti e le altre creature curiose, durante i loro brevi momenti di gioco con questa falena, si ritrovano sempre con il muso bruciacchiato.",|cFFFFD200Scontri tra mascotte:|r Isola Senza Tempo|n,1325,73543,148069,236193,2,26,4,6,7,0
Questa curiosa falena a volte viene sorpresa a interrompere gli incantesimi di Maghi o Stregoni erranti.,|cFFFFD200Scontri tra mascotte:|r Isola Senza Tempo|n,1326,73368,148065,236193,2,26,4,6,7,0
"Le acque del Lago di Rubino hanno una strana colorazione rossastra, dovuta probabilmente alle formazioni di rubino presenti nelle profondità delle montagne dell'Isola Senza Tempo.",|cFFFFD200Bottino:|r Garnia|n|cFFFFD200Zona:|r Isola Senza Tempo,1328,73356,138161,669468,6,2,0,36,7,0
"Pur affascinati dai fiori, si sa che a questi giocherelloni piace ballare anche con i fili d'erba e le erbacce.",|cFFFFD200Bottino:|r Folletto Terrificante|n|cFFFFD200Zona:|r Isola Senza Tempo|n,1329,73532,148051,348547,0,2,0,41,7,0
"In età avanzata, se le condizioni ambientali lo permettono, i Serpenti della Morte possono fare la muta, trasformandosi in Pitoni Imperiali.",|cFFFFD200Bottino:|r Pitone Imperiale|n|cFFFFD200Zona:|r Isola Senza Tempo,1330,73364,148052,801475,7,2,0,6,7,0
"Una sola Lacrima di Y'shaarj, residuo del potere di Y'shaarj che ha generato gli Sha, è in grado di sublimare tutti gli stati emotivi nel raggio di chilometri, facendo sprofondare nel dubbio o nella paura intere città.","|cFFFFD200Bottino:|rSha dell'Orgoglio|n|cFFFFD200Incursione:|r Assedio di Orgrimmar|n|cFFFFD200Difficoltà:|r Dinamica, Normale o Eroica",1331,73350,148058,132851,6,2,0,6,7,0
"Gli Shaolini riflettono lo stato emotivo dei loro ospiti, rendendoli agitati, depressi, spaventati o dubbiosi a seconda della magnitudine dei pensieri negativi intorno a loro.",|cFFFFD200Bottino:|rSha dell'Orgoglio|n|cFFFFD200Incursione:|r Assedio di Orgrimmar|n|cFFFFD200Difficoltà:|r Ricerca delle Incursioni o Dinamica,1332,73351,148059,651085,6,2,0,6,7,0
I Danzatori Giadanube dell'Isola Senza Tempo hanno una singolare attrazione per gli sbuffi di vapore presenti sulla spiaggia nordoccidentale.,|cFFFFD200Bottino:|r Danzatore Giadanube|n|cFFFFD200Zona:|r Isola Senza Tempo,1333,73355,148060,656560,6,2,0,36,7,0
"Kovok, il piccolo flagello delle Distese del Terrore, preferisce una dieta a base di ""cervelli"": cervelli di mushan, cervelli umani, qualunque cervello va bene. Questo strano requisito alimentare potrebbe essere legato alla sua enorme testa.",|cFFFFD200Bottino:|r Eletti dei Klaxxi|n|cFFFFD200Incursione:|r Assedio di Orgrimmar|n,1334,73354,148061,624010,7,2,0,6,7,0
