ActivityName_lang,Description_lang,ID,CriteriaTreeID,ThresholdContributionAmount
Completa 30 missioni,Completa missioni che forniscono esperienza.,3,135693,200
Sconfiggi 50 boss delle spedizioni,Sconfiggi boss delle spedizioni che forniscono esperienza.,4,135695,200
Ottieni un Cappello della Festa Finemente Ricamato dal 16 dicembre al 2 gennaio (Grande Inverno),,5,135697,150
Completa 5 spedizioni Mitiche+,,6,135699,200
Completa 15 missioni mondiali,,7,136176,150
Uccidi 10 boss delle incursioni di Dragonflight,,8,136202,200
Guadagna 7.500 Punti Onore,,10,136220,200
Vinci 5 Campi di Battaglia,,11,136222,200
Vinci 10 incontri nell'arena (non schermaglie),,12,136224,200
Completa Ordini d'Artigianato,Parla con un cancelliere degli Ordini d'Artigianato nel Mercato degli Artigiani di Valdrakken per accedere agli Ordini d'Artigianato.,13,136242,200
Vinci 15 scontri tra mascotte,,14,136244,200
Sconfiggi 25 boss delle spedizioni in un gruppo multi-fazione,Sconfiggi boss delle spedizioni che forniscono esperienza.,16,136248,150
Completa 15 missioni a Nordania,,17,136250,200
Completa 5 spedizioni dei Viaggi nel Tempo di Wrath of the Lich King,,18,136265,300
Completa la Rocca della Corona di Ghiaccio,,19,136286,100
Completa 5 campi di battaglia della Valle d'Alterac,,20,136288,200
Usa almeno un Piccolo Aiutante per sconfiggere tutti i Maestri Allenatori di Nordania dal 16 dicembre al 2 gennaio (Grande Inverno),,21,136291,250
Pesca 50 pesci a Nordania,,22,136300,200
Fai sapere a Ragnaros che hai freddo nel Nucleo Ardente,,23,136323,50
Balla con indosso abiti natalizi presso l'albero di Babbo Inverno assieme a 5 personaggi dal 16 dicembre al 2 gennaio (Grande Inverno),,24,136325,150
Uccidi 10 Elementale del Ghiaccio,,25,136327,100
Completa Operazione: Tartaruga alla Fiera di Lunacupa,,26,136357,50
Grande Inverno: uccisione dei boss delle incursioni festivi,Uccidi i seguenti boss delle incursioni dal 16 dicembre al 2 gennaio.,27,136359,350
Partecipa alla Festa del Nomade dal 7 dicembre all'8 dicembre,,28,136364,150
Lancia una lanterna e leggi L'Attesa della Tartaruga dal 7 dicembre all'8 dicembre (Festa del Nomade),,29,136366,150
Fai un giro sulla Giostra di Lunacupa o sull'ottovolante e mangia una Salsiccia Impanata,,30,136369,100
Uccidi il capo della fazione opposta,,31,136449,400
Esplora una zona innevata,,32,136527,100
Usa il Rinfrescante di Rabbiafredda oppure ottieni la sua aura da brividi presso l'albero dal 16 dicembre al 2 gennaio (Grande Inverno),,34,136855,150
Sconfiggi Maestri Allenatori delle Isole dei Draghi con mascotte Dragoidi,Sconfiggi 2 Maestri Allenatori delle Isole dei Draghi con un gruppo composto da almeno 2 mascotte Dragoidi,40,137543,200
Usa Spuntini del Famiglio Felice,Puoi acquistare Spuntini del Famiglio Felice dal Mercante di Rifornimenti per mascotte a Dalaran.,42,137615,100
Amore nell'Aria: usa la Pietra del Ritorno di Stupìdo nelle Isole dei Draghi,Usa la Pietra del Ritorno di Stupìdo nelle Isole dei Draghi dal 6 al 20 febbraio.,43,137617,150
Amore nell'Aria: fai un Picnic Romantico nelle Pianure di Ohn'ahra,Usa un Cestino da Picnic Romantico nelle Pianure di Ohn'ahra dal 6 al 20 febbraio.,44,137619,150
"Amore nell'Aria: completa ""Dolciumi gratis!""","Completa la missione ""Dolciumi gratis!"" dal 6 al 20 febbraio",45,137621,150
Amore nell'Aria: uccidi lo Speziale Hummel,Uccidi lo Speziale Hummel nel Forte di Zannascura dal 6 al 20 febbraio.,46,137623,150
Amore nell'Aria: dona dei Braccialetti Portafortuna Amorosi,Dona dei Braccialetti Portafortuna Amorosi a un capo della tua fazione dal 6 al 20 febbraio.,47,137625,150
/abbraccia un giocatore morto,/abbraccia un giocatore morto.,48,137634,50
Resuscita dei personaggi,,49,137636,50
Bevi il Veleno Rallentante di Zanzil,,50,137645,50
Guadagna 5.000 oro dalle aste nella Casa d'Aste,,52,137647,100
"Mangia una Fetta di Torta al Cioccolato, una Fetta di Torta Deliziosa e una Fetta di Torta ai Mirtilli",,53,137651,50
Schiusa degli Ippogrifi: fai appollaiare un cucciolo su di te,Fai appollaiare un Cucciolo di Piumaribelle sulla tua spalla il 23 febbraio.,54,137655,150
Schiusa degli Ippogrifi: ottieni e usa una Piuma Spettrale,Ottieni e usa una Piuma Spettrale il 23 febbraio.,55,137657,150
Fiera di Lunacupa: piazza una Grossa Torta ai Mirtilli,Esponi una Grossa Torta ai Mirtilli alla Fiera di Lunacupa dal 5 all'11 febbraio.,56,137659,50
Prova dello Stile: ottieni Emblemi della Prova dello Stile,Ottieni Emblemi della Prova dello Stile dal 20 marzo al 24 marzo.,61,137688,100
Ottieni un giocattolo che ti renda niente male,,64,137776,50
Prova dello Stile: acclama altri giocatori,/acclama 5 altri giocatori nell'evento Prova dello Stile dal 20 al 24 marzo.,65,137787,50
"Prova dello Stile: usa il Riflettore, la Pista da Ballo e le Fiamme","Usa il Riflettore, la Pista da Ballo e le Fiamme della Prova dello Stile durante l'evento dal 20 marzo al 24 marzo.",66,137789,100
Prova dello Stile: evoca ammiratori,Evoca 3 ammiratori nella Prova dello Stile dal 20 marzo al 24 marzo.,67,137793,50
Uccidi Kael'thas Solealto alla Terrazza dei Magisteri,,68,137795,150
Follia a Un'Goro: ottieni Mojo Preistorico,Ottieni del Mojo Preistorico al Cratere di Un'Goro dal 17 al 19 marzo.,69,137797,150
Follia a Un'Goro: ottieni Adattamento meraviglioso,Usa il Mojo Preistorico per ottenere più di 20 Adattamenti e diventare una Meraviglia dal 17 al 19 marzo.,70,137799,150
Fiera di Lunacupa: la palla di cannone umanoide,"Completa la missione ""La palla di cannone umanoide"" alla Fiera di Lunacupa dal 5 all'11 marzo.",71,137801,50
Usa gli Occhiali da Corgi Troppo Potenti,Va tutto alla grande!,72,137803,50
Cambia il tuo aspetto,Usa una Seggiola del Barbiere per cambiare il tuo aspetto.,73,137805,20
Prova dello Stile: ottieni l'aspetto Bicorno del Mercante,"Dal 20/03 al 24/03, partecipa alla Prova dello Stile per ottenere l'aspetto Bicorno del Mercante.",74,137807,20
/fletti i muscoli verso un altro personaggio mentre sei niente male.,,75,137809,50
Mostra /riverenza a un personaggio della fazione opposta.,,76,137811,20
Mostra /ammirazione ai giocatori niente male,Usa l'emote /ammirazione con i personaggi sotto l'effetto di un giocattolo niente male.,77,137813,50
Ottieni reputazione nelle Isole dei Draghi,,79,137872,150
Completa 15 spedizioni Mitiche+,,81,140979,200
Completa Grandi Cacce con i Centauri Maruuk,Completa le Grandi Cacce nelle Isole dei Draghi.,82,140981,150
Arpiona un pesce con un amico,Usa un arpione con un altro giocatore per prendere un pesce nelle Isole dei Draghi.,83,140983,50
Partecipa al Banchetto della Comunità dei Tuskarr,Completa incarichi al Banchetto della Comunità presso Iskaara nelle Isole dei Draghi.,84,140985,50
Completa l'Assedio al Forte del Flagello dei Draghi,Completa lo scenario Assedio al Forte del Flagello dei Draghi sulle Sponde del Risveglio nelle Isole dei Draghi.,85,140987,50
Usa il Sistema degli Amici mentre ti arrampichi,Usa il Sistema degli Amici durante le missioni mondiali di arrampicata nelle Isole dei Draghi.,86,140989,50
Sconfiggi creature speciali durante le Tempeste Primaliste,Appariranno creature speciali durante gli eventi della Tempesta Primalista nelle Isole dei Draghi.,87,140991,100
Completa le corse dei draghi di gruppo,Parla con un Custode del Tempo Bronzeo nelle Isole dei Draghi per partecipare a una corsa di gruppo.,88,141010,150
Completa una missione mondiale PvP nelle Isole dei Draghi,,89,141012,100
Sconfiggi un boss mondiale delle Isole dei Draghi,,90,141021,100
Completa i gruppi di missioni opzionali delle Sponde del Risveglio,,91,141032,200
Completa missioni di raccolta settimanali,Puoi ottenere le missioni delle professioni settimanali presso il Mercato degli Artigiani a Valdrakken.,92,141044,100
Completa missioni di creazione settimanali,Puoi ottenere le missioni delle professioni settimanali presso il Mercato degli Artigiani a Valdrakken.,93,141057,100
Depreda Casse di Rifornimenti da Guerra nelle Isole dei Draghi,,94,141095,100
Pesca oggetti nelle Isole dei Draghi,,95,141125,100
Mostra un po' di amore agli Aspetti dei Draghi,Usa l'emote /amore con gli Aspetti dei Draghi a Valdrakken.,96,141883,50
Mostra un po' di amore ai draghi caduti,Usa l'emote /amore con 2 dei draghi caduti specificati nelle rispettive incursioni.,97,141887,50
Ottieni un giocattolo a tema primaverile,Ottieni uno dei seguenti giocattoli,98,141941,50
Festa di Nobiluova: mangia cioccolatini a Iskaara,Mangia Cioccolatini di Nobiluova a Iskaara nelle Isole dei Draghi dal 10 al 17 aprile.,99,141949,100
Festa di Nobiluova: usa Fiori Primaverili in un'arena o un campo di battaglia,Usa Fiori Primaverili contro un giocatore avversario in un'arena o un campo di battaglia dal 10 aprile al 17 aprile.,100,141951,50
Festa di Nobiluova: raccogli Uova Decorate,Raccogli 10 Uova Decorate dal 10 aprile al 17 aprile.,101,141953,100
Fotografa pescatori leggendari,Scatta delle foto di pescatori leggendari mentre affronti una missione mondiale di catalogazione.,102,141960,50
Completa missioni mondiali di catalogazione,"Nelle Isole dei Draghi, completa le missioni mondiali di catalogazione.",103,141971,50
Ottieni 500 Sovraccarichi Elementali,Puoi ottenere Sovraccarico Elementale dalle creature affette dalle Tempeste Primaliste.,104,141979,100
Completa corse dei draghi in solitaria,Parla con un Custode del Tempo Bronzeo nelle Isole dei Draghi per partecipare a una corsa in solitaria.,105,141981,100
Festa di Nobiluova: piazza uova,Metti 12 Uova Dipinte Accuratamente o 1 Uovo Dipinto Magnificamente dal 10 aprile al 17 aprile.,106,141983,50
"Marcia dei Girini: completa ""Un dono dal tuo girino""","Completa la missione ""Un dono dal tuo girino"" il 5 aprile.",107,141986,150
Completa i gruppi di missioni opzionali delle Pianure di Ohn'ahra,,108,141988,150
Sconfiggi boss della Grande Caccia,Sconfiggi boss durante le Grandi Cacce dei Centauri Maruuk nelle Isole dei Draghi.,109,141997,100
Cattura colossali con un arpione,Usa un arpione per agganciare colossali nelle Isole dei Draghi.,110,142034,50
Consegna Chiavi d'Ossidiana,Consegna Chiavi d'Ossidiana a personaggi che si trovano nella Cittadella d'Ossidiana nelle Isole dei Draghi.,111,142036,100
Cambia l'aspetto della tua cavalcatura del Volo Draconico,,112,142038,20
Guadagna onore nei Campi d'Addestramento della Vastità Azzurra,,113,142733,100
Giornata della Guardia: uccidi Invasori della Città,Uccidi Invasori della Città come guardia il 28 aprile a Roccavento o Orgrimmar.,114,142040,200
Fiera di Lunacupa: Ballo di Lunacupa,"Completa la missione ""Ballo di Lunacupa"" alla Fiera di Lunacupa dal 2 all'8 aprile.",115,142044,50
Fiera di Lunacupa: /acclama la tua felicità sulla Giostra di Lunacupa o su un Felino a Molla,Emote /acclama la tua felicità mentre sei sulla Giostra di Lunacupa o su un Felino a Molla alla Fiera di Lunacupa dal 2 aprile all'8 aprile.,116,142048,50
Usa la rete di teletrasporto nelle Isole dei Draghi,Usa la rete di teletrasporto nelle Isole dei Draghi 10 volte.,117,142050,100
Uccidi creature sulla Vetta delle Fonti dei Draghi,Uccidi 30 creature che forniscono PE sulla Vetta delle Fonti dei Draghi nelle Isole dei Draghi.,118,142052,50
Completa la Prova dell'Alluvione,Completa la Prova dell'Alluvione alle Sorgenti degli Ohn'ir nelle Isole dei Draghi.,119,142054,50
Completa il gruppo di missioni della Spa Sogni Sereni,Completa il gruppo di missioni della Spa Sogni Sereni a Thaldraszus nelle Isole dei Draghi.,120,142056,50
Sconfiggi mascotte élite delle Isole dei Draghi con mascotte Dragoidi,Sconfiggi 2 mascotte élite delle Isole dei Draghi con un gruppo composto da almeno 2 mascotte Dragoidi.,121,142058,200
"Pesca oggetti nelle Isole dei Draghi mentre hai un aspetto ""niente male""","Hai un aspetto ""niente male"" quando indossi i Riduttori di Bagliore d'Onice o il Monocolo dell'Artigiano.",122,142063,50
"Crea oggetti mentre sei ""niente male""","Hai un aspetto ""niente male"" quando indossi i Riduttori di Bagliore d'Onice o il Monocolo dell'Artigiano.",123,142065,50
Completa i gruppi di missioni opzionali della Vastità Azzurra,,124,142067,150
Guadagna Punti Onore al Forte di Nokhudon,Guadagna Punti Onore presso il Forte di Nokhudon nelle Isole dei Draghi.,125,142046,100
Cambia l'aspetto del tuo compagno della Grande Caccia,Parla con un Istruttore della Grande Caccia nelle Isole dei Draghi per cambiare l'aspetto del tuo compagno.,126,142080,20
Scopri le Formazioni di Gemme Nascoste nelle Isole dei Draghi,,127,142082,50
Sconfiggi Maestri Allenatori delle Isole dei Draghi con mascotte Meccaniche,Sconfiggi 2 Maestri Allenatori delle Isole dei Draghi con un gruppo composto da almeno 2 mascotte Meccaniche.,128,142725,200
Riscuoti la taglia su un giocatore ucciso e apri una Cassa di Rifornimenti da Guerra nelle Pianure di Ohn'ahra,Riscuoti la taglia su un personaggio ucciso e apri una Cassa di Rifornimenti da Guerra nelle Pianure di Ohn'ahra in modalità Guerra.,129,142087,150
Completa missioni di creazione settimanali,Puoi ottenere le missioni delle professioni settimanali presso il Mercato degli Artigiani a Valdrakken.,130,0,100
Completa missioni di raccolta settimanali,Puoi ottenere le missioni delle professioni settimanali presso il Mercato degli Artigiani a Valdrakken.,131,0,100
Completa corse dei draghi in solitaria,Parla con un Custode del Tempo Bronzeo nelle Isole dei Draghi per partecipare a una corsa in solitaria.,132,0,100
Completa l'Assedio al Forte del Flagello dei Draghi,Completa lo scenario dell'Assedio al Forte del Flagello dei Draghi nelle Sponde del Risveglio.,133,0,50
Completa Missioni Mondiali di arrampicata,Completa 8 missioni mondiali di arrampicata nelle Isole dei Draghi.,135,142099,100
Fatti colpire dai tornado,Fatti respingere da un tornado durante una Tempesta Primalista dell'Aria.,136,142112,50
Completa missioni della Carovana,Completa missioni della Carovana per il clan nomade dei Centauri Maruuk nelle Isole dei Draghi.,137,142114,100
Sfrutta i Venti delle Isole durante il Volo Draconico,Vola attraverso i Venti delle Isole mentre sei su una cavalcatura del Volo Draconico per raggiungere altezze maggiori.,138,142133,50
Pesca oggetti nelle Zone di Pesca dei Tuskarr,,139,142135,50
Ottieni Emblemi Insanguinati nelle Isole dei Draghi,,140,142224,150
Festa di Nobiluova: completa missioni giornaliere,Completa le missioni giornaliere di Nobiluova dal 10 aprile al 17 aprile.,141,142243,100
/saltella con gli animaletti nelle Isole dei Draghi,/saltella dinanzi ai seguenti animaletti nelle Isole dei Draghi (e valuta anche di mostrare loro un po' di /amore),142,142248,50
Banchetta con la zuppa mentre sei niente male,Banchetta con la Zuppa della Comunità a Iskaara nelle Isole dei Draghi mentre sei niente male.,143,142261,50
Mostra un po' d'amore all'Emporio,Usa l'emote /amore con i mercanti dell'Emporio e le loro merci.,144,142268,50
Sconfiggi 25 boss delle incursioni,,145,142290,250
Arpiona un Colossale con 5 amici,Usa un arpione con altri 5 giocatori per prendere un Colossale nelle Isole dei Draghi.,146,142297,50
Completa Ordini d'Artigianato pubblici,Parla con un cancelliere degli Ordini d'Artigianato nel Mercato degli Artigiani di Valdrakken per accedere agli Ordini d'Artigianato.,147,142299,100
Completa Ordini d'Artigianato personali,Parla con un cancelliere degli Ordini d'Artigianato nel Mercato degli Artigiani di Valdrakken per accedere agli Ordini d'Artigianato.,148,142303,100
Festa di Nobiluova: completa una spedizione di Dragonflight con delle Orecchie da Coniglio,Completa una spedizione di Dragonflight indossando un paio di Orecchie da Coniglio dal 10 aprile al 17 aprile.,149,142324,50
Sconfiggi boss durante l'evento Furia dei Cieli,L'evento Furia dei Cieli è disponibile presso il Futuro dei Primalisti nelle Isole dei Draghi.,150,142527,100
Completa Ordini d'Artigianato pubblici,Parla con un cancelliere degli Ordini d'Artigianato nel Mercato degli Artigiani di Valdrakken per accedere agli Ordini d'Artigianato.,152,142299,100
