Name_lang,Description_lang,ID,UiTextureAtlasElementID,TraitTreeID
Yellow [DNT],[DNT] This is a UI Engineering test SubTree.,9,18688,898
Pink [DNT],[DNT] This is a UI Engineering test SubTree.,10,4076,898
Blue [DNT],[DNT] This is a UI Engineering test SubTree.,11,4073,898
Red [DNT],[DNT] This is a UI Engineering test SubTree.,12,11358,898
UI Test Subtree 1,Descrizione,16,11409,878
UI Test Subtree 2,Altra descrizione,17,0,880
Tessitore del Vuoto,"I Tessitori del Vuoto si sono dedicati allo studio delle origini della magia del Vuoto e hanno scoperto un modo per instaurare una debole connessione con tale dimensione. Si tratta di un potere incredibilmente pericoloso e instabile, capace di consumare chiunque si trovi sul suo cammino.",18,26682,795
Arconte,"Gli Arconti sono estremamente devoti e intimamente connessi alla Luce e all'Ombra. Essi, grazie all'intercessione di esseri superiori, possono entrare in uno stato di ascensione, trasformandosi in una forma più definitiva.",19,27430,795
Oracolo,Gli oracoli riescono a scrutare nel futuro per proteggere e rigenerare i propri alleati. La capacità di scrutare nel futuro conferisce agli Oracoli l'abilità di garantire benedizioni e vantaggi prima ancora che i loro alleati si rendano conto di averne bisogno.,20,26934,795
Druido dell'Unghia,"I Druidi dell'Unghia sono maestri delle forme animali. Quando mutano in orsi o felini, si trasformano in feroci combattenti e protettori della selva.",21,26675,793
Cacciaselve,"I Cacciaselve vivono tra le remote terre selvagge, cacciando per perpetuare il ciclo della vita e della morte e per annientare coloro che vorrebbero contaminare la natura. Inoltre usano i loro poteri curativi per dare nuova vita alle terre aride.",22,26677,793
Custode del Boschetto,I Custodi del Boschetto sono ispirati ai potenti figli di Cenarius che proteggono l'equilibrio della natura e il Sogno. Canalizzano il potere del Sogno per migliorare i loro incantesimi ed evocano potenti Treant per proteggere gli alleati e schiacciare i nemici.,23,26686,793
Prescelto di Elune,I Prescelti di Elune dedicano la propria vita alla Dea della Luna e possono sfruttare la sua connessione con la luna e le stelle. Le loro abilità sono infuse con potenza astrale e possono richiamare potenti magie lunari dal cielo.,24,26685,793
Assaltatori,Brann abbatte i nemici a distanza impugnando Vecchio Arnese.,29,24179,874
Guaritore,Brann sfrutta le sue scorte mediche e le reliquie raccolte per curare i personaggi feriti.,30,24186,874
San'layn,I San'layn eccellono nell'uso del sangue e della magia dell'ombra per indebolire i propri nemici e migliorare le proprie abilità.,31,26673,750
Cavaliere dell'Apocalisse,"I Cavalieri dell'Apocalisse evocano il potere dei leggendari Quattro Cavalieri. Possono chiedere aiuto ai Cavalieri e attingere ai poteri della morte, della carestia e della peste.",32,27222,750
Araldo della Morte,Diventa un emissario della morte. Prendi di mira l'anima dei tuoi nemici con attacchi alimentati dal potere delle Terretetre e ricorda loro l'inevitabile destino che li attende.,33,26672,750
Vilsfregiato,I Vilsfregiati entrano in comunione col proprio demone interiore per amplificare la potenza esplosiva della scia di fuoco che brandiscono.,34,27066,854
Razziatore Aldrachi,"I combattenti Aldrachi sono campioni nell'uso delle lame che impugnano con grazia letale, infondendole di un potere superiore per consumare anime.",35,27132,854
Comandante delle Scaglie,"I Comandanti delle Scaglie sono dei leader nati, capaci di ispirare i propri seguaci a dare il massimo. Sono i generali prescelti dai Dracthyr e sfruttano i loro incantesimi potenziati per impartire ordini di battaglia ed evocare le truppe.",36,27067,872
Plasmafiamme,"I Plasmafiamme sono in profonda sintonia con Alexstrasza e la loro specialità è la protezione degli alleati, il rinvigorimento e il rinnovo. Hanno anche la peculiare abilità di diffondere, amplificare e manipolare la fiamma draconica.",37,27223,872
Cronoguardiano,"I Cronoguardiani manipolano il tempo per scrutare nel futuro e velocizzare gli attacchi, richiamando gli echi del passato per modificare le loro azioni. La specializzazione nella magia del bronzo può causare delle instabilità a causa dei possibili futuri che i Cronoguardiani sono in grado di vedere.",38,26678,872
Furia del Sole,"Grazie all'utilizzo delle fiamme arcane i Maghi Furia del Sole sono in grado di rafforzare i propri incantesimi più devastanti, fino a invocare l'aiuto di una Fenice di Fuocoincanto.",39,27133,658
Scagliamagie,"Padroneggiare la natura intrinsecamente instabile della magia consente agli Scagliamagie di manipolare i propri incantesimi, producendo nuovi effetti estremamente potenti e instabili.",40,27429,658
Fuocogelo,"I Maghi Fuocogelo sono in grado di imbrigliare e combinare forze elementali all'apparenza incompatibili. Padroneggiando queste forze opposte, sono in grado di migliorare i propri attacchi elementali fino a combinarli per ottenere ancora più potere.",41,27017,658
Sentinella,"Le Sentinelle traggono la propria energia dalle forze della natura, infliggendo danni da arcano aggiuntivi con le proprie abilità ed evocando il potere della luna per far piovere distruzione sui nemici.",42,27529,774
Capobranco,I Capobranco hanno creato un legame profondo con gli animali che li accompagnano e con la natura stessa: questo consente al Cacciatore e al proprio branco di braccare la preda sul campo di battaglia con una coordinazione letale e di chiedere aiuto a possenti bestie.,43,27068,774
Guardaboschi Oscuro,"Accogli l'odio dentro di te e colpisci dall'oscurità, assalendo i nemici con abilità necrotiche alimentate dall'ombra. I nemici che periranno per mano delle tue abilità alimenteranno ulteriormente le tue energie oscure.",44,26679,774
Templare,I Templari non si fermano di fronte a nulla pur di far trionfare la giustizia sui malvagi. Sono in grado di evocare dei martelli di Luce e di scatenare devastanti combinazioni di attacchi fisici e sacri per annientare i propri nemici.,48,26681,790
Plasmaluce,"I Plasmaluce hanno raggiunto un'estrema padronanza sulla Luce tanto da riuscire a impiegarla in maniera tangibile, utilizzando costrutti per infondere potere nelle proprie armi e difese e per proteggere i propri alleati.",49,26680,790
Alfiere del Sole,"Gli Alfieri del Sole sviluppano un profondo legame con il sole e l'energia solare, impiegandola per incenerire i nemici e cauterizzare le ferite degli alleati. Possono materializzare potenti raggi solari mentre instaurano una profonda connessione con la Luce.",50,26702,790
Ingannatore,"Quando un Ingannatore entra in scena, colpi sleali e lame accecanti sono all'ordine del giorno. Gli Ingannatori distraggono il nemico con depistaggi o virtuosismi con la spada, per poi trafiggerli con colpi totalmente inaspettati.",51,27018,852
Vincolafato,"I Vincolafato agiscono con fervore impersonando la Mano del Destino, per seminare il caos e mandare all'aria le strategie del nemico. Guidati dall'imprevedibilità del lancio di una Moneta Vincolafato, fanno in modo che i nemici vadano incontro al proprio meritato destino: la morte.",52,27433,852
Inseguitore della Morte,"Gli Inseguitori della Morte, portatori di sventura, colpiscono dalle ombre per dare una fine rapida ai loro bersagli.",53,27432,852
Totemista,"Gli sciamani Totemisti sono specializzati nel liberare il pieno potenziale dei propri totem, rafforzandoli e ottenendo l'accesso a nuove varianti. Hanno affinato le proprie capacità d'infusione per risultare ancora più temibili in combattimento.",54,26703,786
Araldo della Tempesta,"Gli Araldi della Tempesta sfruttano il potere della tempesta, potenziando il proprio controllo sul fulmine e plasmandolo a loro piacimento. Evoca una feroce tempesta per scatenare il caos sui tuoi avversari, risvegliando il tuono e seminando devastazione sul tuo cammino.",55,26683,786
Chiaroveggente,Sfrutta la tua magia spirituale per migliorare le tue capacità nel lancio d'incantesimi ed evocare gli spiriti dei tuoi antenati che affiancheranno te e i tuoi alleati in combattimento.,56,27019,786
Mietitore d'Anime,"In pochi attingono al potere racchiuso nelle anime, ma a molti è nota la brama dei demoni per gli spiriti dei caduti. I Mietitori d'Anime stringono patti coi demoni della Distorsione Fatua, fungendo da ricettacolo per questi spiriti e nutrendoli con le anime dei nemici in cambio di immensi poteri.",57,27530,720
Invocatore Infernale,"Tra le sette di Satiri sparse per Azeroth, gli Invocatori Infernali sono i più temuti: hanno infatti appreso come combinare la magia oscura più spregevole e il vilfuoco entropico, anche se il prezzo da pagare è stato la corruzione della loro anima.",58,27746,720
Demonista,"Molti demoni, dopo la sconfitta della Legione, sono rimasti liberi e privi di vincoli. I Demonisti dominano i demoni più potenti un tempo creduti incontrollabili e sfruttano sul campo di battaglia i poteri abissali provenienti dalla Distorsione Fatua.",59,26935,720
Uccisore,"Un Guerriero feroce che sceglie un bersaglio e lo attacca senza tregua, travolgendo i propri nemici con una carica di acciaio e potenza.",60,26704,850
Thane della Montagna,"I Thane della Montagna sono feroci guerrieri la cui ragione di vita è mettersi alla prova contro degni avversari. Assorbendo forza dalla terra e potere dalla tempesta, vibrano colpi che si abbattono come fulmini sui nemici, travolgendoli.",61,26684,850
Colosso,"Un veterano d'innumerevoli battaglie in grado di sostenere attacchi che per altri guerrieri risulterebbero fatali, sfruttando la propria esperienza per vibrare colpi possenti e schiacciare il nemico.",62,26765,850
Condotto dei Celestiali,I Condotti dei Celestiali si dedicano anima e corpo agli insegnamenti dei quattro Venerabili Celestiali per incarnare la loro saggezza e sfruttare la loro forza. I Condotti Supremi possono canalizzare il potere di tutti Celestiali in una volta.,64,27069,1000
Shandaren,"I Monaci Shandaren hanno appreso l'arte del combattimento dai propri antenati e si ergono fieri contro gli avversari in difesa degli amici e dei propri cari. Prima di attaccare caricano il proprio potere, per poi scatenare una devastante raffica di colpi e travolgere gli avversari.",65,27070,1000
Maestro dell'Armonia,I Maestri dell'Armonia perseguono la perfezione fisica e il potenziamento del corpo per ottenere forza nella sua forma più pura: questo gli permette di attingere al flusso del chi e ai naturali cicli di potere.,66,27745,1000
Araldo della Tempesta,"Gli Araldi della Tempesta sfruttano il potere della tempesta, potenziando il proprio controllo sul fulmine e plasmandolo a loro piacimento. Evoca una feroce tempesta per scatenare il caos sui tuoi avversari, risvegliando il tuono e seminando devastazione sul tuo cammino.",70,26683,1033
Totemista,"Gli sciamani Totemisti sono specializzati nel liberare il pieno potenziale dei propri totem, rafforzandoli e ottenendo l'accesso a nuove varianti. Hanno affinato le proprie capacità d'infusione per risultare ancora più temibili in combattimento.",71,26703,1033
Chiaroveggente,Sfrutta la tua magia spirituale per migliorare le tue capacità nel lancio d'incantesimi ed evocare gli spiriti dei tuoi antenati che affiancheranno te e i tuoi alleati in combattimento.,72,27019,1033
Araldo della Tempesta,"Gli Araldi della Tempesta sfruttano il potere della tempesta, potenziando il proprio controllo sul fulmine e plasmandolo a loro piacimento. Evoca una feroce tempesta per scatenare il caos sui tuoi avversari, risvegliando il tuono e seminando devastazione sul tuo cammino.",73,26683,1034
Totemista,"Gli sciamani Totemisti sono specializzati nel liberare il pieno potenziale dei propri totem, rafforzandoli e ottenendo l'accesso a nuove varianti. Hanno affinato le proprie capacità d'infusione per risultare ancora più temibili in combattimento.",74,26703,1034
Chiaroveggente,Sfrutta la tua magia spirituale per migliorare le tue capacità nel lancio d'incantesimi ed evocare gli spiriti dei tuoi antenati che affiancheranno te e i tuoi alleati in combattimento.,75,27019,1034
PH,Danni!,79,24179,1054
PH,Scudo!,80,24199,1054
Difensore,"Brann fa affidamento sui propri alleati, sull'avanzata tecnologia recuperata e sul suo fidato fucile per lanciarsi alla carica in prima linea.",81,24199,874
Difensore,"Brann fa affidamento sui propri alleati, sull'avanzata tecnologia recuperata e sul suo fidato fucile per lanciarsi alla carica in prima linea.",82,24199,1060
Guaritore,Brann sfrutta le sue scorte mediche e le reliquie raccolte per curare i personaggi feriti.,83,24186,1060
Assaltatore,Brann abbatte i nemici a distanza impugnando Vecchio Arnese.,84,24179,1060
