Description_lang,SourceText_lang,ID,CreatureID,SummonSpellID,IconFileDataID,PetTypeEnum,Flags,SourceTypeEnum,CardUIModelSceneID,LoadoutUIModelSceneID,CovenantID
N’est-ce pas le plus adorable des petits hélicidés ?,|cFFFFD200Métier :|r synthèse de protoforme,3222,184196,364255,3764237,4,2,3,6,7,0
"Les ambystomes sont des créatures aussi rapides que peureuses. Au premier signe de danger, le petit poisson se réfugie dans le trou le plus proche.",|cFFFFD200Métier :|r synthèse de protoforme,3223,184183,364174,3934487,8,2,3,6,7,0
La couleur rouge de ce scarabidé avertit ses prédateurs potentiels qu’on ne s’y frotte pas impunément.,|cFFFFD200Métier :|r synthèse de protoforme,3224,184184,364176,3922923,4,10,3,6,7,0
"Ces galliformes sont hostiles, mais jamais en colère. Ils savourent le moindre moment de chaque bataille.",|cFFFFD200Métier :|r synthèse de protoforme,3225,184189,364178,4096554,2,2,3,6,7,0
On se demande bien ce que ces créatures ont de « multi ».,|cFFFFD200Métier :|r synthèse de protoforme,3226,184190,364181,4096555,2,2,3,6,7,0
Les créations géomentaires de Lihuvim sont les plus majestueux de tous les tas de rochers ambulants.,|cFFFFD200Métier :|r synthèse de protoforme,3227,184191,364182,4227083,6,2,3,6,7,0
Une pure méduse revue et corrigée à l’infini.,|cFFFFD200Métier :|r synthèse de protoforme,3229,184186,364259,4227094,8,2,3,6,7,0
"Cette créature se nourrit de peur, mais elle est souvent trop mignonne pour en inspirer elle-même.",|cFFFFD200Métier :|r synthèse de protoforme,3230,184192,364184,4227092,8,2,3,6,7,0
"L’existence même de cette créature suggère celle d’autres aurélidés plus complexes, aux filaments chatouilleurs.",|cFFFFD200Métier :|r synthèse de protoforme,3231,184193,364193,4227093,8,2,3,6,7,0
"Livrés à eux-mêmes, ces léporidés font des bonds impressionnants à la moindre provocation. Il arrive même qu’ils retombent sur leurs pattes.",|cFFFFD200Métier :|r synthèse de protoforme,3232,184194,364251,3922916,4,2,3,254,7,0
"Un savant mélange de forteresse imprenable, de pédoncules oculaires et de bave gluante.",|cFFFFD200Métier :|r synthèse de protoforme,3233,184187,364254,3764235,4,2,3,6,7,0
"Si certains vipéridés attendent patiemment leur proie, ceux-là n’hésitent pas à traquer leur futur repas des heures durant.",|cFFFFD200Métier :|r synthèse de protoforme|n,3234,184197,364256,4095289,7,2,3,6,7,0
"Qui a eu l’idée saugrenue de concevoir un hélicidé immature, alors que les créatures synthétisées sont créées pleinement formées ?",|cFFFFD200Métier :|r synthèse de protoforme,3235,184195,364252,3764238,4,2,3,6,7,0
"Enjouée, originale et un peu maladroite… pas de doute possible, c’est une ingénieur gnome jusqu’au bout des ongles !",|cFFFFD200Promotion|r,3236,184285,364451,4226119,0,82,7,6,7,0
"Un petit ambystome d’abord trop gros, puis trop petit, et enfin parfait. Il vous a emboîté le pas !",|cFFFFD200Quête :|r Je peux le garder ?,3237,184923,366069,3934488,8,82,1,6,7,0
"On dirait que Ben’jin et Maka’fon n’ont pas chômé depuis votre dernière rencontre. Maka’jin est prêt à partir à l’aventure, mais pourrait se contenter d’un gros tas de verdure.",|cFFFFD200Comptoir|r,3242,185322,366833,4559236,7,16466,2,6,7,0
"Il a un cœur d’or, au sens propre du terme. Ces bons chiens-chiens brillants sont très prisés des Gnomes fortunés.",|cFFFFD200Comptoir|r,3243,183686,366841,1567069,9,16466,2,6,7,0
"Contrainte depuis une éternité à servir le rusé loa de la mort, cette minuscule créature d’une époque révolue accomplit son devoir sans jamais décolérer.",|cFFFFD200Comptoir|r,3244,185324,366842,2027568,3,16466,2,6,7,0
Le nom « Biipboup » suivi des mots « Fabriqué par Filys » ont été grossièrement mais amoureusement gravés sous ce petit robot de facture nérubienne.,|cFFFFD200Évènement mondial :|r Semaine des enfants,3245,185425,367189,4235634,9,2,6,6,7,0
,,3246,185475,0,236446,2,16400,-1,6,7,0
Cette réplique de la véritable Pocopoc peut être utilisée en dehors de Zereth Mortis. Elle est si fidèle que quiconque n’a pas passé énormément de temps avec l’Automa dont elle s’inspire jurerait d’avoir affaire à l’originale.,|cFFFFD200Vendeur : |rOléa Manu|n|cFFFFD200Région : |rZereth Mortis|n|cFFFFD200Coût : |r500|Hcurrency:1979|h|TInterface\ICONS\INV_Trinket_ProgenitorRaid_02_Blue.BLP:0|t|h,3247,185477,367376,4327611,5,147,2,41,7,0
"Première version des redoutables golems des moissons qui sèment la terreur parmi les fermiers de la marche de l’Ouest, Ichabod a depuis été repris en main par les ingénieurs gnomes qui l’ont rendu bien plus docile.",|cFFFFD200Promotion|r |n,3248,183638,367696,4206469,9,16466,9,6,7,0
"Avant d’intégrer le panthéon des dieux sauvages, le jeune Ursoc a longtemps écumé les Grisonnes.",|cFFFFD200Boutique en jeu|r|n,3249,185586,367702,4208901,7,82,9,6,7,0
Certains faucons-pérégrins ont une destinée hors du commun. Egbob n’est pas de leur nombre.,|cFFFFD200Comptoir|r,3250,183708,367732,294475,4,16466,2,6,7,0
Certaines espèces d’abeilles rouges sont connues pour mener des existences solitaires. Celle-ci semble cependant heureuse de passer du temps avec vous.,|cFFFFD200Comptoir|r,3251,185604,367748,2027854,2,16466,2,6,7,0
"Un sang gorien ancestral coule dans les veines de Garrlok. Pour autant que l’on sache, seule sa petite taille freine ses ambitions impériales.",|cFFFFD200Comptoir|r,3252,185606,367768,4215254,0,16466,11,6,7,0
Les jeunes kodos affichant un manque total de retenue lorsqu’il s’agit de tout casser sont formés très tôt aux techniques de siège. Gare à vos tibias.,|cFFFFD200Boutique en jeu|r,3253,185611,367778,4205812,7,16466,2,33,7,0
"Pour ses proies, ses yeux pleins d’innocence cachent le danger mortel d’une chasseresse à l’affût dans les ombres.",|cFFFFD200Comptoir|r,3254,185621,367800,133247,2,16466,2,6,7,0
Ses bois roses en font une véritable attraction festive.,|cFFFFD200Comptoir|r,3255,185756,368314,2481371,7,16466,2,6,7,0
Les plus grands joailliers et joaillières des îles aux Dragons ont poussé leur art si loin que leurs statues ornées de gemmes peuvent prendre vie. Mieux vaut donc prendre ce dragonnet forgé en obsidienne avec des pincettes.,|cFFFFD200Métier :|r joaillerie|n,3256,186844,369723,4397690,1,2,3,6,7,0
,,3257,186884,0,3922922,4,56,-1,6,7,0
Ce lapinou est adorable. Qui pourrait résister à son petit nez croquant ou ses griffes mortelles ?,|cFFFFD200Trésor : |rsac de curiosités,3259,188709,371534,3733064,4,2,0,6,7,0
"Quasiment invisible, cette créature bondit d’arbre en arbre couvert de neige.",|cFFFFD200Combats de mascottes :|r Travée d’Azur,3260,188792,0,4528721,4,26,4,6,7,0
"Tout comme ce phénix, l’espoir renaît des cendres des rêves brisés.",|cFFFFD200Butin : |rgardienne Entrix|n|cFFFFD200Région : |rconfins Interdits,3261,188821,371594,4007138,5,2,0,6,7,0
"Quelque mage, Dragon ou créature magique a eu l’idée saugrenue de colorer un élémentaire de glace en violet dans le but de faire un jeu de mots tiré par les cheveux. Mais peut-être n’était-ce pas une si mauvaise idée…",|cFFFFD200Haut fait :|r Est-ce ma faute si elles m’adorent ?|n,3262,188849,371621,4572524,7,82,5,6,7,0
"Ça ressemble à un canard, ça sent le canard, ça cancane comme un canard, et pourtant…",|cFFFFD200Haut fait :|r Propriétaire de mascottes habile,3263,188861,371636,4533201,8,82,5,6,7,0
Un éclat d’un fragment d’un morceau de cristal qui se comporte comme s’il était le propriétaire des lieux. Heureusement qu’il vous trouve sympathique.,|cFFFFD200Haut fait :|r Une armée de mini mascottes,3264,188885,371655,133244,5,82,5,6,7,0
Indiscutablement le plus digne des musquards malodorants.,|cFFFFD200Haut fait :|r Les petits ruisseaux font les grandes rivières,3265,188901,371675,4572410,7,80,5,6,7,0
"Le rusard vole au-dessus des vastes plaines verdoyantes et des collines à perte de vue, laissant pour seule trace de son passage de minuscules ombres sur le sol.",|cFFFFD200Combats de mascottes :|r Plaines d’Ohn’ahra,3266,189160,0,4215000,2,26,4,6,7,0
"De votre point de vue, vous avez rencontré ce rusard la semaine prochaine, mais du sien, c’était l’année dernière.",,3267,189211,371930,4215003,2,16416,-1,6,7,0
,,3268,189376,0,2399293,8,33840,-1,6,7,0
"Curieusement, vous avez trouvé ce poisson alors qu’il flottait dans l’air.",|cFFFFD200Trésor :|r dériveur à bulles|n|cFFFFD200Région : |rRivages de l’Éveil,3269,189663,372585,4539687,8,2,0,6,7,0
"D’après certains, ce poisson discourt avec éloquence sur sa survie dans les conditions les plus hostiles. Mais pour la plupart des gens, il dit simplement « gloups ».",|cFFFFD200Vendeur : |rPatchou|n|cFFFFD200Région : |rTravée d’Azur|n|cFFFFD200Coût : |r300|Hitem:163036|h|TInterface\ICONS\INV_Currency_PetBattle.BLP:0|t|h,3270,189695,372750,4539689,8,2,2,6,7,0
La créature hérissée de pointes la plus adorable et abordable que vous croiserez.,"|cFFFFD200Combats de mascottes :|r Plaines d’Ohn’ahra, Thaldraszus, Travée d’Azur, Rivages de l’Éveil",3272,189093,0,3733067,4,26,4,6,7,0
"D’une manière ou d’une autre, cette créature s’est débrouillée pour être tout à la fois chaude, rocailleuse et visqueuse.",|cFFFFD200Combats de mascottes :|r Rivages de l’Éveil,3273,189094,0,3996722,6,26,4,6,7,0
"Quand Enclumette a déclaré vouloir devenir la meilleure enclume de tous les temps, tout le monde s’est moqué d’elle. Mais à présent, si les enclumes pouvaient rire, elle s’en donnerait à cœur joie.",|cFFFFD200Métier :|r forge|n,3274,189095,378738,1020356,9,2,3,6,7,0
"Un jour, Châtaigne a trouvé un gland plus gros que lui, l’a mangé en entier et a doublé de volume. Heureusement qu’il n’a pas mangé un trompalumpf.",|cFFFFD200Trésor :|r glaneur de glands|n|cFFFFD200Région :|r Thaldraszus|n,3275,189096,374600,4528722,4,2,0,6,7,0
Nombreux sont ceux qui ont tenté de pincer ces adorables joues… et y ont laissé des doigts.,"|cFFFFD200Combats de mascottes : |rPlaines d’Ohn’ahra, Thaldraszus, Travée d’Azur",3276,189097,0,4528723,4,26,4,6,7,0
"Ces trois années ont été bien remplies pour cette petite créature. Elle est née l’année prochaine, a été élevée l’an dernier et est devenue votre mascotte cette année.",,3277,189098,374710,3732476,4,16416,-1,6,7,0
Pistache a obtenu son nom exactement de la manière dont on peut l’imaginer.,|cFFFFD200Vendeur : |rPatchou|n|cFFFFD200Région : |rTravée d’Azur|n|cFFFFD200Coût : |r50|Hitem:163036|h|TInterface\ICONS\INV_Currency_PetBattle.BLP:0|t|h,3278,189099,374734,4528732,4,2,2,6,7,0
"Adepte de la course, cette créature n’en a jamais loupé une et n’a jamais eu maille à partir avec la concurrence.",|cFFFFD200Haut fait :|r perfectionniste des courses de Dragons – Argent|n,3279,189101,387685,4452490,1,82,5,6,7,0
"Ces mystérieuses créatures sont particulièrement difficiles à trouver, sauf si vous savez déjà où chercher. Heureusement, Haniko vous l’a justement indiqué.",|cFFFFD200Combats de mascottes :|r Rivages de l’Éveil,3280,189102,0,3995640,2,65546,4,6,7,0
"Entre les bagarres, les bains et les jeux, ces loutrèkes n’ont pas le temps de s’ennuyer.","|cFFFFD200Combats de mascottes :|r Plaines d’Ohn’ahra, Travée d’Azur, Rivages de l’Éveil",3281,189103,0,3751917,8,26,4,6,7,0
"Le fracas retentissant d’un rot de bufflacien adulte peut être entendu à des lieues à la ronde. Plus discret, celui des bufflouilles est peut-être moins sonore, mais il est bien plus mélodieux.","|cFFFFD200Combats de mascottes :|r Plaines d’Ohn’ahra, Thaldraszus, Travée d’Azur, Rivages de l’Éveil",3282,189104,0,1802889,8,26,4,6,7,0
"Si vous sentez un frisson vous parcourir l’échine, pas de panique. Il s’agit probablement de votre floconou préféré.","|cFFFFD200Combats de mascottes :|r Travée d’Azur, Rivages de l’Éveil",3283,189107,0,4554460,6,26,4,6,7,0
"Les bébés loutrèkes passent leurs journées à nager, à chasser des papillons et à s’entraîner à pousser des rugissements intimidants.",|cFFFFD200Faction : |rRoharts iskaariens|n|cFFFFD200Renom : |r9|n|cFFFFD200Vendeur : |rJiq|n|cFFFFD200Région : |rIskaara,3284,189105,374889,3751919,8,18,2,6,7,0
"Vous apercevez votre propre reflet dans ses grands yeux. Et tout le reste, d’ailleurs, tellement ceux-ci sont immenses.",|cFFFFD200Butin : |rLuttrok|n|cFFFFD200Région : |rconfins Interdits,3285,189106,374895,3751920,8,2,0,6,7,0
On le surnomme « Monsieur Pouêt » à cause du son mélodieux que produit sa trompe.,"|cFFFFD200Quête : |rAlors, quelles nouvelles ?|n|cFFFFD200Région : |rRivages de l’Éveil",3286,189108,374998,3946881,7,82,1,6,7,0
Un songe né de souvenirs incendiaires.,|cFFFFD200Vendeur : |rMythressa|n|cFFFFD200Région : |rValdrakken|n|cFFFFD200Coût : |r1000|Hcurrency:2118|h|TInterface\ICONS\INV_Misc_Powder_Thorium.blp:0|t|h,3287,189111,375035,4554439,3,2,2,6,7,0
"Si leurs défenses minuscules ne sont pas très utiles au combat, les trompalumpfs compensent largement par leur poids.","|cFFFFD200Combats de mascottes :|r Plaines d’Ohn’ahra, Travée d’Azur",3288,189110,0,3946882,7,26,4,6,7,0
"Une étincelle peut se changer en braise et une braise en feu rugissant. Mais cette créature n’a rien connu de tel, elle qui a toujours été un brasier infernal.","|cFFFFD200Butin :|r Butin mondial|n|cFFFFD200Météo :|r Tempête élémentaire (feu)|n|cFFFFD200Région :|r Rivages de l’Éveil, Plaines d’Ohn’ahra, Travée d’Azur, Thaldraszus",3289,189112,389363,4554438,6,2,0,6,7,0
"Il s’assoit où il veut, mais principalement sur les genoux.","|cFFFFD200Trésor : |rcaveaux de Zskera, confins Interdits",3290,189113,375045,3946885,7,2,0,6,7,0
Skroful a le combat dans le sang.,|cFFFFD200Butin : |rVraken le Chasseur|n|cFFFFD200Région : |rconfins Interdits,3291,189115,375047,3946886,7,2,0,6,7,0
"Ce ne sont pas les flammes de son corps qui lui ont valu le nom d’incandescent, mais son regard ardent.",|cFFFFD200Quête : |rLa légende du phénix|n|cFFFFD200Région : |rrivages de l’Éveil,3292,189117,375084,4007139,5,2,1,6,7,0
Aussi rouge que les flammes qui l’ont vu naître.,|cFFFFD200Butin : |rfouillesable Marwak|n|cFFFFD200Région : |rconfins Interdits,3293,189118,375085,4007140,5,2,0,6,7,0
Est-il possible de renaître des cendres du temps ? Gérald semble le penser et rien ne pourra le faire changer d’avis.,|cFFFFD200Haut fait : |rDressage de mascottes familiales de la grotte de Zaralek|n|cFFFFD200Catégorie : |rcombat,3294,189119,375089,4007141,5,82,5,6,7,0
"Les ignoïdes se forment quand le magma remonté à la surface d’Azeroth est imprégné de magie noire élémentaire. Il en résulte une créature certes minuscule et adorable, mais néanmoins féroce.","|cFFFFD200Combats de mascottes :|r Thaldraszus, Travée d’Azur, Rivages de l’Éveil",3295,189121,0,1016245,6,26,4,6,7,0
Cette dracamandre ne demande qu’à devenir votre meilleure amie.,"|cFFFFD200Combats de mascottes :|r Plaines d’Ohn’ahra, Thaldraszus, Travée d’Azur, Rivages de l’Éveil",3296,189122,0,4056158,8,26,4,6,7,0
"Alors qu’elle était perdue dans le temps, cette dracamandre a fait sa propre rencontre. Les deux créatures sont restées quelques heures ensemble sur un rocher. C’était sympa.",|cFFFFD200Comptoir|r ,3297,189123,375235,4056156,8,16466,7,6,7,0
"La plupart des dracamandres arborent des couleurs intéressantes, mais celle-ci a la plus sympa.",,3298,189128,375242,4056157,8,16416,-1,6,7,0
Les profondeurs ne rendent jamais ce qu’elles attrapent.,"|cFFFFD200Butin :|r Butin mondial|n|cFFFFD200Météo :|r Tempête élémentaire (eau)|n|cFFFFD200Région :|r Rivages de l’Éveil, Plaines d’Ohn’ahra, travée d’Azur, Thaldraszus",3299,189130,389378,4554443,6,2,0,6,7,0
"Si les îles aux Dragons abritent bon nombre de créatures mystérieuses, les canards sont peut-être les plus insaisissables de toutes. D’où viennent-ils, où vont-ils et que mijotent-ils ? Nous ne le saurons peut-être jamais.","|cFFFFD200Combats de mascottes :|r Plaines d’Ohn’ahra, Rivages de l’Éveil",3300,189131,0,3953209,2,26,4,6,7,0
Coin-coin.,"|cFFFFD200Combats de mascottes :|r Plaines d’Ohn’ahra, Thaldraszus, Rivages de l’Éveil",3301,189136,429055,4048813,8,26,4,6,7,0
Ne maîtrise toujours pas le vol.,|cFFFFD200Quête : |rEncore… une victoire de canard !|n|cFFFFD200Région : |rPlaines d’Ohn’ahra,3302,189138,375266,4048814,8,2,1,6,7,0
"Que donne-t-on à manger à un mignon petit caneton ? Non, certainement pas du Fromton ! Ce n’est pas bon pour eux.",|cFFFFD200Vendeur :|r Pakak|n|cFFFFD200Région :|r Valdrakken|n|cFFFFD200Coût :|r 1|Hitem:197788|h|TInterface\ICONS\INV_Misc_Food_Meat_Cooked_06.blp:0|t|h 1|Hitem:197789|h|TInterface\ICONS\INV_Misc_Food_99.blp:0|t|h 3|Hitem:197792|h|TInterface\ICONS\INV_Misc_FortuneCookie_color03.BLP:0|t|h,3303,189140,375312,4048815,8,2,2,6,7,0
Bip. Bip. Coin-coin.,|cFFFFD200Métier : |ringénierie,3306,189142,375321,4048816,8,2,3,6,7,0
"La terreur dont le battement d’ailes résonne au-dessus des îles aux Dragons, le cauchemar ailé qui picore goulûment vos rêves d’émeraude. Non, ce n’est pas Aile de mort, c’est un canard !","|cFFFFD200Combats de mascottes : |rPlaines d’Ohn’ahra, Rivages de l’Éveil, Valdrakken",3307,189144,429053,4048817,8,26,4,6,7,0
"Étant donné sa petite taille, rien d’étonnant à ce que ce caneton se soit perdu dans le temps.",,3308,189145,375336,4048818,8,16416,-1,6,7,0
"Aussi majestueux qu’insaisissables, ces oiseaux aux mouvements migratoires imprévisibles sont difficiles à suivre, à tel point que l’on serait tenté, à tort, de douter de leur existence.",|cFFFFD200Trésor :|r œuf de canard légèrement mâchouillé|n|cFFFFD200Région :|r Plaines d’Ohn’ahra|n,3309,189133,375344,3953211,2,2,0,6,7,0
"Dans l’air de la montagne, le givre s’accroche aux brins d’herbe sous la tempête qui approche.","|cFFFFD200Butin :|r Butin mondial|n|cFFFFD200Météo :|r Tempête élémentaire (air)|n|cFFFFD200Région :|r Rivages de l’Éveil, Plaines d’Ohn’ahra, Travée d’Azur, Thaldraszus",3310,189132,389384,4554444,6,2,0,6,7,0
Son regard peut capter le bout de la queue d’une souris à des kilomètres.,|cFFFFD200Butin :|r butin de la grande chasse|n,3311,189134,389429,4094306,2,82,0,6,7,0
"Si un canard fait coin-coin dans les bois, mais que personne n’est là pour l’entendre, existe-t-il seulement ?",,3312,189135,375355,3953208,2,16416,-1,6,7,0
"Cette créature fait trembler le sol à chacun de ses pas. Quand elles se déplacent en troupeau, on croirait entendre l’orage gronder au loin.","|cFFFFD200Combats de mascottes : |rPlaines d’Ohn’ahra, Thaldraszus, Rivages de l’Éveil",3313,189153,0,4033837,7,26,4,6,7,0
"Contrairement à ce que son nom laisserait supposer, cette petite créature ne fait rien trembler lorsqu’elle se déplace.",,3314,189150,375366,4033838,7,16416,-1,6,7,0
Qui est le monstre le plus adorable au monde ? C’est toi !,|cFFFFD200Quête :|r Où peut-il bien être ?|n|cFFFFD200Région :|r Thaldraszus,3316,189152,386575,4452489,1,82,1,6,7,0
"S’il s’agit d’un phénomène rare, il arrive que des lézards-tonnerre se lient à des Centaures… ainsi qu’à leurs proches connaissances. Une chance pour vous !",|cFFFFD200Vendeur :|r intendant Huseng|n|cFFFFD200Région :|r Plaines d’Ohn’ahra|n|cFFFFD200Coût :|r 100|Hcurrency:2003|h|TInterface\ICONS\INV_Faction_WarResources.BLP:0|t|h,3317,189154,375378,4033840,7,18,2,6,7,0
Une ruée de ces créatures rappelle le grondement d’un orage. Une ruée de ces créatures sous un orage fait penser à un cataclysme.,|cFFFFD200Combats de mascottes :|r Rivages de l’Éveil,3318,189155,0,4033841,7,26,4,6,7,0
"Peu après avoir mis à mort la mère putréfiée de ce rusard, vous avez appris à vos dépens d’où lui venait son nom et pourquoi Zon’Wogi vous a demandé de vous en occuper.",|cFFFFD200Quête : |rLa grande Shokhari|n|cFFFFD200Région : |rTravée d’Azur,3319,189204,371925,4215001,2,2,1,6,7,0
La fourrure blanche de ces créatures les aide à se cacher des prédateurs dans la neige.,|cFFFFD200Combats de mascottes :|r Travée d’Azur,3320,189209,0,4215002,2,26,4,6,7,0
Il n’y a pas de fureur plus grande que celle d’une femelle plume-noire qui défend son nid.,|cFFFFD200Trésor :|r Nicheur plume-noire|n|cFFFFD200Région :|r Travée d’Azur|n,3321,189156,375413,3998670,2,2,0,6,7,0
"Ces oiseaux utilisent leurs becs coupants et leurs griffes draconiques pour creuser les troncs et les branches à la recherche de nourriture. Ils communiquent entre eux en tambourinant les arbres avec leurs becs, ce son distinct portant sur de longues distances.","|cFFFFD200Combats de mascottes :|r Plaines d’Ohn’ahra, Travée d’Azur",3322,189157,0,3998673,2,26,4,6,7,0
Ses plumes sont vives. Que dire de plus ?,"|cFFFFD200Trésor : |rcaveaux de Zskera, confins Interdits",3323,189158,375448,3998672,2,2,0,6,7,0
"Fidèle et féroce, ce bakar est le meilleur ami de tout héros ou héroïne qui se respecte.",|cFFFFD200Butin :|r butin de la grande chasse|n,3325,189159,389503,1033494,7,82,0,6,7,0
"Lorsqu’il n’est pas en train de flotter tranquillement dans la rivière, ce rongebois est friand de nourriture et de câlins.",|cFFFFD200Faction : |rRoharts iskaariens|n|cFFFFD200Renom : |r9|n|cFFFFD200Vendeur : |rJiq|n|cFFFFD200Région : |rIskaara,3326,189655,375473,4227787,7,18,2,6,7,0
Les chasseurs apprécient ces créatures davantage pour leur compagnie que pour leur peau.,|cFFFFD200Combats de mascottes :|r Plaines d’Ohn’ahra,3327,189657,0,4227788,7,26,4,6,7,0
"Vaut son pesant d’or. Si elles n’ont rien de bien imposant, ces petites créatures n’en sont pas moins d’un courage gigantesque. – Bob GrandCœur","|cFFFFD200Combats de mascottes :|r Plaines d’Ohn’ahra, Travée d’Azur",3328,189658,0,4227789,7,26,4,6,7,0
Un rongebois imprégné de foudre ? Choquant !,|cFFFFD200Combats de mascottes :|r Plaines d’Ohn’ahra,3329,189660,0,4227790,7,26,4,6,7,0
"En rongeant les racines des arbres magiques, cette créature a acquis la capacité de transcender le temps lui-même.",|cFFFFD200Vendeur : |rTurik|n|cFFFFD200Région : |rconfins Interdits|n|cFFFFD200Coût : |r25000|Hcurrency:2118|h|TInterface\ICONS\INV_Misc_Powder_Thorium.blp:0|t|h,3330,189661,375499,4227791,7,2,2,6,7,0
Est-il normal qu’un poisson soit doté de crocs ?,"|cFFFFD200Métier : |rPêche|n|cFFFFD200Région : |rcaveaux de Zskera, confins Interdits|n",3331,189694,375511,4539688,8,2,3,6,7,0
Le pescorpe est un poisson sans arêtes.,"|cFFFFD200Trésor : |rpoisson unique|n|cFFFFD200Région : |rcaveau de Zskera, confins Interdits",3332,189696,375536,4539690,8,2,0,6,7,0
Les vorquins des îles aux Dragons ont des crinières qui se déclinent en une multitude de couleurs éclatantes.,"|cFFFFD200Trésor : |rcaveaux de Zskera, confins Interdits",3333,191287,375553,4218747,7,2,0,6,7,0
"Il est tout à fait possible que cette créature vieillisse à l’envers. Chaque fois que vous la voyez, elle semble un peu plus jeune.",|cFFFFD200Vendeuse :|r Brendormi|n|cFFFFD200Coût :|r 105|Hitem:202039|h|TInterface\ICONS\inv_misc_stormlordsfavor.blp:0|t|h 1500|Hcurrency:2118|h|TInterface\ICONS\INV_Misc_Powder_Thorium.blp:0|t|h,3334,191298,375567,4218748,7,18,2,6,7,0
Admirez ! Un vorquin pâle !,|cFFFFD200Combats de mascottes :|r Travée d’Azur,3335,191316,0,4218751,7,26,4,6,7,0
"Il va sans doute continuer à grandir. C’est probable, du moins.","|cFFFFD200Combats de mascottes :|r Thaldraszus, Travée d’Azur, Rivages de l’Éveil",3336,191323,0,4218749,7,26,4,6,7,0
"Des épines de cristal acérées parsèment le dos de cette créature, et pourtant, elle veut quand même que vous la caressiez.",|cFFFFD200Trésor : |rcristalépine animé|n|cFFFFD200Région : |rconfins Interdits,3338,191435,375642,4572405,5,2,0,6,7,0
Ce petit Dragon ne tient pas en place ! Il a semble-t-il beaucoup à faire.,|cFFFFD200Quête :|r Vacances de Dragon|n,3342,191381,375707,4572403,1,16466,1,6,7,0
"Parfois, on aperçoit un éclat bleu scintiller au cœur des pierres qui composent cette étrange créature.",|cFFFFD200Métier :|r joaillerie,3344,191383,375709,4397609,1,2,3,6,7,0
C’est le petit museau de ce dragonnet qui a été le plus difficile à façonner.,|cFFFFD200Métier :|r joaillerie|n,3345,191384,375710,4397692,1,2,3,6,7,0
Le prince marchand Gallywix aimerait vous faire savoir qu’il en possède déjà trois exemplaires.,|cFFFFD200Métier :|r joaillerie|n,3346,191385,375711,4397694,1,2,3,6,7,0
Une émeraude imprégnée de magie se trouve au cœur de cette créature.,|cFFFFD200Métier :|r joaillerie|n,3347,191386,375712,4397693,1,2,3,6,7,0
"Des gouttes de pluie virevoltent autour de cette créature à une vitesse stupéfiante, lacérant quiconque se risquerait à la toucher. À en croire les spécialistes, le plus sûr est de commencer par lui donner une friandise ou par lui faire un câlin.","|cFFFFD200Quête :|r Menace primordiale|n|cFFFFD200Région :|r barricade de Dranosh’ar (Horde), port de Hurlevent (Alliance)|n",3348,191387,375713,4554454,6,2,1,6,7,0
"Assistant et apprenti de génie, Basilton adore fourrer son nez dans tout ce qui a le don d’éveiller sa curiosité.","|cFFFFD200Quête : |rBasilton, jusqu’au bout|n|cFFFFD200Région : |rThaldraszus",3350,191627,376302,4572408,5,82,1,6,7,0
"Ces petits ours ne s’en prennent généralement pas aux gens, mais sont connus pour dérober les paniers de pique-nique.","|cFFFFD200Combats de mascottes :|r Thaldraszus, Travée d’Azur",3351,194720,0,4532348,7,26,4,6,7,0
