ID,Description_lang,Name_lang,ManagedWorldStateInputID,OrderIndex,ContributionStyleContainer,UiTextureAtlasMemberID[0],UiTextureAtlasMemberID[1],UiTextureAtlasMemberID[2],UiTextureAtlasMemberID[3]
1,Exploite les énergies arcaniques pour positionner rapidement les troupes du Déclin de la Légion dans les îles Brisées et découvrir les agents les plus menaçants de la Légion.,Tour des mages,1,1,1,6325,6322,6324,6323
2,,,0,0,0,0,0,0,0
3,Une base d’opérations fortifiée où les dirigeants des domaines de classe se réunissent et planifient leurs attaques au rivage Brisé.,Base stratégique,2,2,1,6321,6318,6320,6319
4,Un ancien puits de lune elfique assez puissant pour repousser les énergies du Néant qui émanent de la tombe et dévoiler ses secrets.,Disrupteur de Néant,3,3,1,6329,6326,6328,6327
11,Donnez des ressources pour l’effort de guerre en vue de la bataille pour le contrôle des hautes-terres Arathies.,Bataille de Stromgarde,10,1,2,6321,6318,6320,6319
116,Donnez des ressources pour l’effort de guerre en vue de la bataille pour le contrôle des hautes-terres Arathies.,Bataille de Stromgarde,115,1,2,6321,6318,6320,6319
117,Donnez des ressources pour l’effort de guerre en vue de la bataille pour le contrôle de Sombrivage.,Bataille de Sombrivage,116,1,2,6321,6318,6320,6319
118,Donnez des ressources pour l’effort de guerre en vue de la bataille pour le contrôle de Sombrivage.,Bataille de Sombrivage,117,1,2,6321,6318,6320,6319
119,Contribuez à la collection de cire de Middles pour débloquer de nouvelles récompenses !,Collection de cire,118,2,1,6321,6318,6320,6319
