Description_lang,StandingModified_lang,StandingChangedText_lang,ID,FactionID,TextureFileID,Flags
Relation avec le fermier Fung : %s. Fung aime les lys des marais et le rôti de sauvagine.,,,2,1283,604882,0
Relation avec Chii Chii : %s. Chii Chii aime les plumes bleues et le sauté de la vallée.,,,16,1277,604882,0
Relation avec Ella : %s. Ella aime les chats de jade et les raviolis aux crevettes.,,,17,1275,604882,0
Relation avec Marée Pelage de Roseau : %s. Marée aime les chats de jade et les plats de poissons jumeaux.,,,18,1282,604882,0
Relation avec Gina Griffe de Tourbe : %s. Gina aime les lys des marais et la soupe de brumes tourbillonnantes.,,,19,1281,604882,0
Relation avec Haohan Griffe de Tourbe : %s. Haohan aime les éclats de rubis et le steak de tigre grillé au feu de bois.,,,20,1279,604882,0
Relation avec Jogu l’Ivrogne : %s. Jogu aime les pommes délicieuses et les carottes sautées.,,,21,1273,604882,0
Relation avec le Vieux Patte des Hauts : %s. Le Vieux Patte des Hauts aime les plumes bleues et la tortue braisée.,,,22,1276,604882,0
Relation avec Sho : %s. Sho aime les pommes délicieuses et le poisson de l’Éternel printemps.,,,23,1278,604882,0
Relation avec Tina Griffe de Tourbe : %s. Tina aime les éclats de rubis et le saumon de l’esprit du feu.,,,24,1280,604882,0
"Nomi est %s cuisinier très talentueux. À chaque nouvelle leçon, il devient de plus en plus compétent.",,,25,1357,604882,0
"Relation avec Nat : %s. Nat aime boire. Peut-être que si vous lui rapportez des poissons rares, il partagera ses boissons !",,,26,1358,604882,0
Vous êtes actuellement au %s dans l’arène de Castagn’ar.,,,28,2372,666624,0
Vous êtes actuellement au %s au Bar-Tabasse de Bizmo.,,,43,2371,666623,0
La Rébellion sombrelance est %s.,,,72,1440,666624,0
Tormmok est actuellement votre %s.,,,160,1736,666623,0
Illona est actuellement votre %s.,,,162,1738,666623,0
Aeda Brillaube est actuellement votre %s.,,,163,1740,666623,0
Delvar Poing-de-Fer est actuellement votre %s.,,,164,1733,666623,0
Vivianne est actuellement votre %s.,,,165,1739,666623,0
Le prêtre de la serre Ishaal est actuellement votre %s.,,,166,1737,666623,0
Leorajh est actuellement votre %s.,,,167,1741,666623,0
%s,,,171,1374,666624,0
%s,,,172,1419,666623,0
"La Première arcaniste Thalyssra est dans un état de %s.

Les Sacrenuit ont une soif insatiable de |cFF66BBFFmana ancestral|r, que l’on peut trouver un peu partout à Suramar.",,,181,1860,1391545,0
"Silgryn est dans un état de %s.

Les Souffrenuit ont une soif inextinguible de |cFF66BBFFmana ancestral|r. Il en existe de nombreuses sources naturelles à Suramar, même si aucune n’est aussi puissante que le Puits de la nuit.",,,182,1861,1391545,0
"Le télémancien en chef Oculeth est dans un état de %s.

Les Sacrenuit ont une soif insatiable de |cFF66BBFFmana ancestral|r, que l’on peut trouver un peu partout à Suramar.",,,183,1862,1391545,0
7.0 Champions Test - Chen Stormstout - Uses Test Faction (949),,,184,949,666623,0
"L’arcaniste Valtrois est dans un état de %s.

Les Sacrenuit ont une soif insatiable de |cFF66BBFFmana ancestral|r, que l’on peut trouver un peu partout à Suramar.",,,185,1919,1391545,0
Relation avec l’adjurateur Margoss : %s. Il n’a jamais particulièrement aimé les arts magiques. La pêche est sa véritable passion !,,,193,1975,604882,0
Relation avec Olissara et Angélique : %s. Elles cherchent à apporter leur aide en fournissant du matériel médical.,,,195,1984,604882,0
Arne Test - is currently your %s.,,,198,0,666623,0
Relation avec Ilyssia des Eaux : %s. Pêchez avec elle sur Azsuna.,,,199,2097,604882,0
Relation avec Akule : %s. Pêchez avec lui à Haut-Roc.,,,200,2099,604882,0
Relation avec Diablotus : %s. Pêchez avec lui au rivage Brisé.,,,202,2102,604882,0
Relation avec la gardienne Raynae : %s. Pêchez avec elle en Val’sharah.,,,204,2098,604882,0
Relation avec Sha’leth : %s. Pêchez avec elle à Suramar.,,,206,2101,604882,0
Relation avec Corbyn : %s. Pêchez avec lui en Tornheim.,,,208,2100,604882,0
Relation avec Chromie : %s.,,,209,2135,4191562,0
%s,,,210,1691,666624,0
%s,,,212,1690,666624,0
Le pterreurdactyle est devenu un %s.,,,213,2233,1391545,0
Le navrecorne est devenu un %s.,,,315,2370,604882,0
Le chasseur Akana est %s.,Le chasseur Akana a gagné %d points d’expérience du combat.,Le chasseur Akana a atteint %s,316,2375,604882,25
Le long-voyant Ori est %s.,Le long-voyant Ori a gagné %d points d’expérience du combat.,Le long-voyant Ori a atteint %s.,317,2376,604882,25
Le maître-lame Inowari est %s.,Le maître-lame Inowari a gagné %d points d’expérience du combat.,Le maître-lame Inowari a atteint %s.,318,2377,604882,25
Néri Tranchécaille est %s.,Néri Tranchécaille a gagné %d points d’expérience du combat.,Néri Tranchécaille a atteint %s.,320,2389,604882,25
Poën Seldemer est %s.,Poën Seldemer a gagné %d points d’expérience du combat.,Poën Seldemer a atteint %s.,323,2388,666624,25
Vim Saumecœur est %s.,Vim Saumecœur a gagné %d points d’expérience du combat.,Vim Saumecœur a atteint %s.,324,2390,604882,25
Une butineuse dos-de-miel %s.,,,325,2398,604882,0
Un faux-bourdon dos-de-miel %s.,,,326,2396,604882,0
Une reine de l’essaim dos-de-miel %s.,,,327,2397,604882,0
%s,,,339,2011,666624,0
%s,,,340,2010,666624,0
Le jeune aqir est devenu un %s.,,,365,2427,604882,0
Ve’nari vous considère avec %s.,Ve’nari juge votre bataillon plus favorablement. [Réputation gagnée : %d.],Ve’nari considère à présent votre bataillon avec %s.,366,2432,4216713,8
Relation avec la baronne Vashj : %s.,,,367,2446,604882,0
Relation avec dame Baie-de-Lune : %s.,,,368,2447,604882,0
Relation avec Mikanikos : %s.,,,370,2448,604882,0
Relation avec la comtesse : %s.,,,371,2449,604882,0
Relation avec Alexandros Mograine : %s.,,,372,2450,604882,0
Relation avec le capitaine de l’Hallali Korayn : %s.,,,373,2451,604882,0
Relation avec le marchedroit Adrestès : %s.,,,375,2452,604882,0
Relation avec Rondel et Férul : %s.,,,376,2453,604882,0
Relation avec Choufa : %s.,,,377,2454,604882,0
Relation avec le gardien de la crypte Kassir : %s.,,,379,2455,604882,0
Relation avec la dromane Aliothe : %s.,,,381,2456,604882,0
Relation avec le grand maître Vole : %s.,,,382,2457,604882,0
Relation avec Kléia et Pélagos : %s.,,,383,2458,604882,0
Relation avec Sika : %s.,,,384,2459,604882,0
Relation avec Tête-de-Caillasse : %s.,,,385,2460,604882,0
"Relation avec Marileth, catalyseur de peste : %s.",,,387,2461,604882,0
Réputation auprès des maîtres des sutures : %s.,,,389,2462,604882,8
Réputation auprès de Marasmius : %s.,,,390,2463,604882,8
Réputation de votre bataillon auprès de la cour de la Nuit : %s.,,,391,2464,604882,8
Rang %s,Savoir fractal augmenté de %d,,392,2469,3762255,24
Recherche |2 %s,,,393,2472,4191562,16
Relation de votre bataillon avec Irion : %s.,,Votre bataillon est à présent considéré comme %s d’Irion.,396,2517,604882,0
Relation de votre bataillon avec Sabellian : %s.,,Votre bataillon est à présent considéré comme %s de Sabellian.,397,2518,604882,0
Relations avec le Consortium d’artisanat des îles aux Dragons : %s.,,,398,2544,604882,0
Niveau de puissance arcanique de l’assemblée de Cobalt : %s.,Le niveau de puissance arcanique de l’assemblée de Cobalt augmente.,Niveau de puissance arcanique de l’assemblée de Cobalt : %s.,400,2550,4191562,0
Briggul considère que votre niveau de dressage d’escargot est le suivant : %s.,,,408,2568,604882,0
Relation de votre bataillon avec Soridormi : %s.,,Relation de votre bataillon avec Soridormi : %s.,411,2553,604882,0
Brann Barbe-de-Bronze a atteint : %s.,Brann Barbe-de-Bronze a gagné %d points d’expérience.,Brann Barbe-de-Bronze a atteint : %s.,412,2640,604882,1
"Autrefois tisserande royale, la veuve Arak’nai pose désormais un regard critique sur son ancien foyer. Grâce à son réseau de tisse-rats et d’espions, peu de choses lui échappent.",,Niveau de relation avec la Tisserande : %s.,416,2601,5862764,0
"Autrefois le plus illustre chef militaire d’Azj-Kahet, Anub’azal a dû laisser sa place à l’un des Transcendés si chers au cœur d’Ansurek. Une décision qui ne restera pas sans conséquences.",,Niveau de relation avec le général : %s.,417,2605,5862762,0
"Occupant la position la plus dangereuse de toutes, l’exécuteur Nizrek passe ses journées à conseiller la reine Ansurek. Fort heureusement, Ansurek ignore qu’il passe le reste de son temps à essayer de mettre fin à son règne.",,Niveau de relation avec le vizir : %s.,418,2607,5862763,4
Vous avez gagné le rang d’archiviste classe %s.,,"Vous portez à présent le grade d’Archiviste, classe %s.",419,2615,1391545,0
