ID,Name_lang,Description_lang,GarrAbilityCategoryID,GarrFollowerTypeID,IconFileDataID,FactionChangeGarrAbilityID,Flags
332,Amélioration,Un guerrier totémique capable de contrer certains |C00b3ffffboss|R avec des armes imprégnées de puissance élémentaire.,0,4,132314,0,560
333,Restauration,Un soigneur qui fait appel aux esprits ancestraux et au pouvoir purificateur de l’eau pour contrer certains |C00b3ffffboss|R.,0,4,136052,0,560
334,Marche-vent,Un expert des arts martiaux qui contre certains |C00b3ffffboss|R à l’aide de ses mains et de ses poings.,0,4,608953,0,560
335,Maître brasseur,Un robuste combattant qui se sert de breuvages fortifiants et de mouvements imprévisibles pour contrer certains |C00b3ffffboss|R.,0,4,608951,0,560
336,Tisse-brume,Un soigneur qui maîtrise l’art mystérieux de la manipulation des énergies vitales pour contrer certains |C00b3ffffboss|R.,0,4,608952,0,560
337,Affliction,Un maître de la magie de l’Ombre qui se spécialise dans les drains et les dégâts sur la durée pour contrer certains |C00b3ffffboss|R.,0,4,136145,0,560
338,Démonologie,Un maître des démons qui contraint les puissances démoniaques à lui venir en aide afin de contrer certains |C00b3ffffboss|R.,0,4,136172,0,560
339,Destruction,Un maître du chaos qui invoque le feu pour brûler et contrer certains |C00b3ffffboss|R.,0,4,136186,0,560
340,Sacré,Invoque la puissance de la Lumière pour protéger ses alliés et contrer certains |C00b3ffffboss|R.,0,4,135920,0,560
341,Vindicte,Un vertueux croisé qui contre et juge certains |C00b3ffffboss|R à l’aide de ses armes et de la magie du Sacré.,0,4,135873,0,560
342,Protection,"Utilise la magie du Sacré pour se protéger, défendre ses alliés et contrer certains |C00b3ffffboss|R.",0,4,236264,0,560
343,Fureur,Un furieux berserker qui manie une arme dans chaque main et déchaîne une multitude d’attaques pour contrer certains |C00b3ffffboss|R.,0,4,132347,0,560
344,Armes,"Un maître endurci dans l’art du combat avec des armes à deux mains, qui associe mobilité et frappes surpuissantes pour contrer certains |C00b3ffffboss|R.",0,4,132355,0,560
345,Protection,Un protecteur fidèle qui utilise un bouclier pour contrer les |C00b3ffffboss|R.,0,4,132341,0,560
346,Arcanes,Manipule la puissance phénoménale des énergies arcaniques pour contrer certains |C00b3ffffboss|R.,0,4,135932,0,560
347,Feu,Embrase l’air avec des boules de feu et des flammes dévorantes pour contrer certains |C00b3ffffboss|R.,0,4,135812,0,560
348,Givre,Contre certains |C00b3ffffboss|R en les gelant sur place avant de les détruire grâce à la magie du Givre.,0,4,135846,0,560
349,Hors-la-loi,Un fugitif impitoyable utilisant ses techniques et sa ruse pour contrer certains |C00b3ffffboss|R.,0,4,135340,0,560
350,Finesse,Un sombre traqueur qui surgit de l’ombre pour tendre des embuscades et contrer certains |C00b3ffffboss|R.,0,4,132320,0,560
351,Assassinat,Un impitoyable maître des poisons qui contre certains |C00b3ffffboss|R par de vicieux coups de dague.,0,4,236270,0,560
352,Sacré,Un soigneur polyvalent capable de contrer certains |C00b3ffffboss|R.,0,4,237542,0,560
353,Ombre,Utilise la sinistre magie de l’Ombre pour contrer certains |C00b3ffffboss|R.,0,4,136207,0,560
354,Discipline,Utilise la magie pour protéger ses alliés des dégâts et contrer certains |C00b3ffffboss|R.,0,4,135940,0,560
355,Equilibre,Peut prendre la forme d’un redoutable sélénien qui fait appel à la puissance des Arcanes et à la magie de la Nature pour contrer certains |C00b3ffffboss|R.,0,4,136096,0,560
356,Combat farouche,Prend la forme d’un grand félin pour infliger des dégâts de saignement et des morsures afin de contrer certains |C00b3ffffboss|R.,0,4,132115,0,560
357,Restauration,Utilise de puissants sorts de Nature pour maintenir ses alliés en vie et contrer certains |C00b3ffffboss|R.,0,4,136041,0,560
358,Dévastation,Un taciturne maître des glaives de guerre qui utilise la puissance destructrice de la magie gangrenée pour contrer certains |C00b3ffffboss|R.,0,4,1247264,0,560
359,Vengeance,Accepte son démon intérieur pour incinérer ses ennemis et protéger ses alliés afin de contrer certains |C00b3ffffboss|R.,0,4,1247265,0,560
360,Paria,"Alliés des chasseurs de démons, composés de Nagas, de Roués et même de démons, les parias utilisent tout un éventail de techniques pour contrer certains |C00b3ffffboss|R.",0,4,1391770,0,560
361,Givre,Un funeste messager de glace qui canalise sa puissance runique et frappe brutalement avec son arme pour contrer certains |C00b3ffffboss|R.,0,4,135773,0,560
362,Sang,Un sombre gardien qui manipule et corrompt l’énergie vitale pour se renforcer lors des assauts ennemis et contrer certains |C00b3ffffboss|R.,0,4,135770,0,560
363,Impie,Un maître de la mort et de la décomposition qui répand les maladies et soumet des serviteurs morts-vivants à sa volonté pour contrer certains |C00b3ffffboss|R.,0,4,135775,0,560
364,Maîtrise des bêtes,Un maître de la faune capable de dompter une grande variété de bêtes qui l’aideront à contrer certains |C00b3ffffboss|R.,0,4,461112,0,560
365,Précision,Un maître-archer ou une fine gâchette qui excelle dans l’art de contrer certains |C00b3ffffboss|R à distance.,0,4,236179,0,560
366,Survie,"Un traqueur endurci qui contre certains |C00b3ffffboss|R avec tout un attirail de venins d’animaux, d’explosifs et de pièges mortels.",0,4,461113,0,560
388,Sac à dos de voyageur,Confère une chance de rapporter un objet aléatoire lors des missions.,0,4,133633,0,2
389,Masque à gaz de gangrelige,Neutralise la puanteur de l’air corrompu par l’énergie gangrenée.,0,4,133133,0,2
393,Invasion déjouée,Augmente les chances de succès des missions dans cette zone.,0,4,1099803,0,2
394,L’ami Chen,Augmente de ${$a478}% les chances de succès des missions auxquelles participe Chen Brune d’Orage.,0,4,236701,0,18
404,Carotte et bâton,Réduit la durée des missions de 3%.,0,4,134010,0,2
406,Téléporteur portable,Réduit la durée des missions de 30%.,0,4,321487,0,2
407,Voie du Buffle,Augmente de ${$a491}% les chances de succès des missions impliquant des initiés du Buffle.,0,4,615340,0,18
408,Voie du Tigre,"Augmente de ${$a492}% les chances de succès des missions impliquant des initiés, des adeptes ou des maîtres du Tigre.",0,4,606548,0,18
410,Test - Follower Test Ability,Test follower ability description,0,4,463852,0,321
412,Roulade,Vous effectuez une roulade sur une courte distance pour contrer un |C00b3ffffdanger|R.,0,4,574574,0,16
413,7.0 - Test - Anders Garrison Ability Test,"Desc of ID410 $@garrabdesc410 
7 * action flat: ${$a497*7$}
Combatmax /  by 5: ${$m497/5$}
Base + max: ${$b497+$m497$}
Hours - 10: ${$h497-10$}
No expression: $a497  -  $m497
My spellDesc $@spelldesc191997",11,4,1028994,0,0
414,Emplacement d’équipement vide,Équipez-vous d’objets ici.,0,4,0,0,1025
415,Emplacement d’équipement vide,Équipez-vous d’objets ici.,0,4,0,0,1025
416,Souffle de feu,Vous crachez du feu devant vous pour contrer un |C00b3ffffserviteur|R.,0,4,615339,0,16
417,Pique de main,Vous frappez l’ennemi à la gorge pour contrer un |C00b3ffffsort|R.,0,4,608940,0,16
418,En avant la banane !,Confère une chance de revenir des missions réussies avec une banane d’or que vous pouvez donner aux champions pour augmenter les chances de succès.,0,4,133980,0,18
419,Poings de fureur,Augmente de ${$a503}% les chances de succès des missions impliquant des |C00b3ffffserviteurs|R.,0,4,627606,0,18
420,Chance du brasseur,Augmente de ${$a504}% les chances de succès des missions présentant des |C00b3ffffdangers|R.,0,4,839394,0,18
421,Voie de la Grue,Augmente de ${$a505}% les chances de succès des missions impliquant des initiés de la Grue.,0,4,988195,0,18
422,Héros du Nexus,Augmente de ${$a506}% les chances de succès en l’absence d’autres champions.,0,4,136111,0,18
423,Coup du serpent volant,Réduit la durée des missions de ${100-$a507*100}%.,0,4,606545,0,18
428,Ralentissement,Durée de la mission augmentée.,0,4,1383681,0,0
435,Force des anciens,Augmente de ${$a523}% les chances de succès des missions.,0,4,874857,0,18
436,Puissant,Réduit les chances de succès.,0,4,1390116,0,0
437,Mort,Les troupes engagées dans cette mission seront tuées.,0,4,1383682,0,0
438,Flammes infernales,Vous embrasez la zone autour du démoniste pour contrer un |C00b3ffffserviteur|R.,0,4,135818,0,16
439,Verrou magique,Interrompt l’incantation de l’ennemi pour contrer un |C00b3ffffsort|R.,0,4,136174,0,16
440,Cercle démoniaque,Vous téléporte jusqu’à votre cercle démoniaque et contre un |C00b3ffffdanger|R.,0,4,237560,0,16
441,Cisaille de vent,Perturbe la concentration de la cible avec une bourrasque pour contrer un |C00b3ffffsort|R.,0,4,136018,0,16
442,Loup fantôme,"Transforme le chaman en loup fantôme, ce qui augmente sa vitesse de déplacement et lui permet de contrer un |C00b3ffffdanger|R.",0,4,136095,0,16
443,Chaîne d’éclairs,Lance un éclair qui inflige des dégâts de Nature pour contrer un |C00b3ffffserviteur|R.,0,4,136015,0,16
444,Gel de l’esprit,Le froid s’abat sur l’esprit de la cible pour contrer un |C00b3ffffsort|R.,0,4,237527,0,16
445,Mort et décomposition,"Corrompt le sol, ce qui inflige des dégâts d’Ombre pour contrer les |C00b3ffffserviteurs|R.",0,4,136144,0,16
446,Robustesse glaciale,Le chevalier de la mort fait geler son sang pour contrer un |C00b3ffffdanger|R.,0,4,237525,0,16
447,Aspect du guépard,Augmente la vitesse de déplacement pendant une courte durée pour contrer un |C00b3ffffdanger|R.,0,4,132242,0,16
448,Piège explosif,Vous placez à l’emplacement ciblé un piège de feu qui explose pour contrer un |C00b3ffffserviteur|R.,0,4,135826,0,16
449,Tir de riposte,Interrompt les incantations pour contrer un |C00b3ffffsort|R.,0,4,249170,0,16
450,Tourbillon,Vous contrez un |C00b3ffffserviteur|R dans un tourbillon d’acier.,0,4,132369,0,16
451,Bond héroïque,Vous sautez dans les airs pour contrer un |C00b3ffffdanger|R.,0,4,236171,0,16
452,Volée de coups,Vous assénez une volée de coups à la cible pour contrer un |C00b3ffffsort|R.,0,4,132938,0,16
453,Consécration,Vous consacrez le sol autour de vous pour contrer un |C00b3ffffserviteur|R.,0,4,135926,0,16
454,Réprimandes,Vous réprimandez l’ennemi pour contrer un |C00b3ffffsort|R.,0,4,523893,0,16
455,Bouclier divin,Vous protège des dégâts pour contrer un |C00b3ffffdanger|R.,0,4,524354,0,16
456,Silence,Réduit la cible au silence pour contrer un |C00b3ffffsort|R.,0,4,458230,0,16
457,Nova sacrée,Provoque une explosion de lumière sacrée autour du lanceur de sorts pour contrer un |C00b3ffffserviteur|R.,0,4,135922,0,16
458,Saut de foi,Vous attirez l’esprit de la cible alliée. Son corps est alors instantanément déplacé devant vous pour contrer un |C00b3ffffdanger|R.,0,4,463835,0,16
459,Coup de pied,Un coup de pied rapide pour contrer un |C00b3ffffsort|R.,0,4,132219,0,16
460,Éventail de couteaux,Lance des couteaux tout autour de vous pour contrer un |C00b3ffffserviteur|R.,0,4,236273,0,16
461,Sprint,Augmente votre vitesse de déplacement pour contrer un |C00b3ffffdanger|R.,0,4,132307,0,16
462,Ruée fulgurante,Vous chargez vers l’avant pour contrer un |C00b3ffffdanger|R.,0,4,1247261,0,16
463,Lancer de glaive,Vous lancez un glaive démoniaque en direction de vos ennemis pour contrer un |C00b3ffffserviteur|R.,0,4,1305159,0,16
464,Consumer la magie,Interrompt l’ennemi pour contrer un |C00b3ffffsort|R.,0,4,1305153,0,16
465,Transfert,Vous vous téléportez vers l’avant sur une courte distance pour contrer un |C00b3ffffdanger|R.,0,4,135736,0,16
466,Contresort,Vous interrompez l’incantation de l’ennemi pour contrer un |C00b3ffffsort|R.,0,4,135856,0,16
467,Blizzard,Des éclats de glace s’abattent sur la zone ciblée pour contrer un |C00b3ffffserviteur|R.,0,4,135857,0,16
468,Coup de crâne,Vous donnez un coup de crâne à la cible pour contrer un |C00b3ffffsort|R.,0,4,236946,0,16
469,Météores,Invoque une pluie de lumière stellaire pour contrer un |C00b3ffffserviteur|R.,0,4,135753,0,16
470,Célérité,Vous prenez votre forme de félin et foncez pour contrer un |C00b3ffffdanger|R.,0,4,132120,0,16
471,Malédiction,Aucun butin bonus.,0,4,1380306,0,0
472,Désorientation,Coût de la mission augmenté.,0,4,1383683,0,0
473,Blessure à la tête,Les champions engagés dans cette mission perdront de l’expérience.,0,4,1380307,0,0
474,Équipement endommagé,Les champions engagés dans cette mission perdront des niveaux d’objets.,0,4,1380306,0,0
475,Héroïque,Chances de succès réduites de 50%.,0,4,1380305,0,0
476,Mythique,Chances de succès réduites de 75%.,0,4,1380305,0,0
482,Puissant,Réduit les chances de succès.,0,4,1390116,0,0
485,Pluie de gangrefeu,Augmente de ${$a578}% les chances de succès des missions impliquant des |C00b3ffffserviteurs|R.,0,4,840196,0,18
486,Gangréclair,Augmente de ${$a579}% les chances de succès des missions.,0,4,135797,0,18
487,Zélote,Augmente de ${$a580}% les chances de succès des missions.,0,4,1380866,0,18
488,Messager de la Moisson noire,Augmente de ${$a581}% les chances de succès des missions impliquant des acolytes ou des adjurateurs de la Moisson noire.,0,4,537517,0,18
489,Lien spirituel,Augmente les chances de succès des missions de ${$a582}% par point de vitalité des troupes.,0,4,607854,0,18
490,Création d’un puits des âmes,Confère une chance de revenir de mission avec une pierre de soins utilisable pour rendre 1 point de vitalité aux troupes.,0,4,136194,0,18
491,Agonie,Augmente les chances de succès des missions dont la durée est supérieure à ${$h584} heures de ${$a584}%.,0,4,136139,0,18
492,Destrier de l’effroi,Réduit la durée des missions de ${100-$a585*100}%.,0,4,132238,0,18
493,Renforcement démoniaque,Augmente de ${$a586}% les chances de succès des missions impliquant un essaim de diablotins ou de diablotins sauvages.,0,4,236292,0,18
494,Matriarche des diablotins,Confère une chance de revenir d’une mission réussie avec un objet permettant d’invoquer un essaim de diablotins ou de diablotins sauvages.,0,4,136218,0,18
496,Force démoniaque,Augmente de ${$a612}% les chances de succès des missions.,0,4,236293,0,18
497,Pacte démoniaque,Augmente de ${$a613}% les chances de succès des missions impliquant d’autres diablotins.,0,4,136121,0,18
498,Terrain d’entraînement,Augmente de $a614 le nombre maximum d’acolytes que vous pouvez recruter.,0,4,538444,0,18
499,Rituel d’invocation,Réduit la durée des missions de ${100-$a615*100}%.,0,4,136194,0,18
500,Invocation d’un garde funeste,Augmente de ${$a616}% les chances de succès de la première mission du jour.,0,4,615103,0,274
501,Vert - Coût de la mission,Coût de la mission réduit de 10%.,0,4,646671,0,2
502,Courroux du Titan,Augmente de ${$a641}% les chances de succès en l’absence d’autres champions.,0,4,237046,0,18
503,Cri de commandement,Augmente les chances de succès des missions de ${$a619}% par point de vitalité des troupes.,0,4,132351,0,18
504,Cris des morts,Confère une chance de revenir d’une mission réussie avec un objet permettant d’invoquer une troupe d’aspirants valarjar ou des valarjar forge-foudre.,0,4,136184,0,18
505,Lignée royale,Augmente de ${$a621}% les chances de succès des missions impliquant différents types de troupes.,0,4,132346,0,18
506,Enrager,Augmente de ${$a622}% les chances de succès des missions impliquant des troupes ayant seulement ${$m622} de vitalité.,0,4,132345,0,18
507,Gardien de la porte,Augmente les chances de succès des missions dont la durée est supérieure à ${$h623} heures de ${$a623}%.,0,4,515033,0,18
508,Coups gelés,Augmente de ${$a624}% les chances de succès des missions impliquant des |C00b3ffffserviteurs|R.,0,4,237523,0,18
509,Impulsion farouche,Augmente de ${$a625}% les chances de succès des missions présentant des |C00b3ffffdangers|R.,0,4,1027879,0,18
510,Force des marées,Augmente les chances de succès des missions dont la durée est supérieure à ${$h626} heures de ${$a626}%.,0,4,971078,0,18
511,Attaque de Foudrebec,Réduit la durée des missions de ${100-$a627*100}%.,0,4,132239,0,18
512,Totem guérisseur,Confère une chance de revenir de mission avec un totem guérisseur utilisable pour rendre 1 point de vitalité aux troupes.,0,4,135127,0,18
513,Bouclier de foudre,Augmente de ${$a629}% les chances de succès des missions impliquant des |C00b3ffffserviteurs|R.,0,4,136051,0,18
514,Voie de la terre,Augmente de ${$a630}% les chances de succès des missions impliquant un cercle d’implorateurs de la terre ou des géomanciens du Cercle terrestre.,0,4,1016245,0,18
515,Avantage élémentaire,Augmente de ${$a631}% les chances de succès des missions impliquant des élémentaires inférieurs ou supérieurs.,0,4,651081,0,18
516,Marque du chasseur,Augmente de ${$a632}% les chances de succès des missions impliquant une escouade d’archers ou des tireurs d’élite invisibles.,0,4,236188,0,18
517,Visée sûre,Augmente de ${$a633}% les chances de succès des missions.,0,4,1033497,0,18
518,Tirs perforants,Augmente de ${$a634}% les chances de succès des missions.,0,4,236198,0,18
519,Instincts de survie,Augmente de ${$a635}% les chances de succès des missions.,0,4,236808,0,18
520,Piège explosif,Augmente de ${$a636}% les chances de succès des missions impliquant des |C00b3ffffserviteurs|R.,0,4,135826,0,18
521,Gardiens élémentaires,Augmente de ${$a637}% les chances de succès des missions.,0,4,136029,0,18
522,Fureur des éléments,Augmente de ${$a638}% les chances de succès des missions.,0,4,651244,0,18
524,Communion avec la meute,Augmente de ${$a640}% les chances de succès des missions impliquant d’autres champions Maîtrise des bêtes.,0,4,236172,0,18
525,Puissance des Mok’Nathal,Augmente de ${$a641}% les chances de succès en l’absence d’autres champions.,0,4,463283,0,18
526,Appeler Baron,Augmente de ${$a642}% les chances de succès des missions impliquant une bande de pisteurs ou des guides.,0,4,930453,0,18
528,Salve,Augmente de ${$a644}% les chances de succès des missions impliquant des |C00b3ffffserviteurs|R.,0,4,132222,0,18
529,Chasseur de gros gibier,Augmente de ${$a645}% les chances de succès des missions impliquant des |C00b3ffffboss|R.,0,4,461115,0,18
530,Pérégrin,Réduit la durée des missions de ${100-$a646*100}%.,0,4,236190,0,18
531,Fureur de l’ascendant,Augmente de ${$a647}% les chances de succès des missions.,0,4,132148,0,18
532,Marées purificatrices,Augmente de ${$a648}% les chances de succès des missions impliquant des |C00b3ffffsorts|R.,0,4,136213,0,18
533,Faisceau de lave,Augmente de ${$a649}% les chances de succès des missions impliquant des |C00b3ffffserviteurs|R.,0,4,136110,0,18
534,Bourrasque,Augmente de ${$a650}% les chances de succès des missions présentant des |C00b3ffffdangers|R.,0,4,135863,0,18
535,Arme du Maelström,Augmente de ${$a651}% les chances de succès des missions.,0,4,237584,0,18
537,Rugissement incapacitant,Augmente de ${$a656}% les chances de succès des missions impliquant des |C00b3ffffserviteurs|R.,0,4,132121,0,18
538,Renaissance,Confère ${$a657}% de chances de ressusciter une unité avec ${$m657} de vitalité après une mission réussie.,0,4,136080,0,18
539,Berserk,Réduit le coût de lancement d’une mission de ${100-$a658*100}%.,0,4,236149,0,18
540,Efflorescence,Confère une chance de revenir de mission avec un champignon sauvage utilisable pour rendre 1 point de vitalité aux troupes.,0,4,134222,0,18
541,Équilibre naturel,Augmente de ${$a660}% les chances de succès des missions impliquant des tréants de la Sylverêve ou des filles de Cénarius.,0,4,132113,0,18
542,Ruée rugissante,Augmente de ${$a661}% les chances de succès des missions présentant des |C00b3ffffdangers|R.,0,4,464343,0,18
543,Fureur d’Élune,Augmente de ${$a662}% les chances de succès des missions impliquant des druides de la Griffe ou des gardiens du Bosquet.,0,4,132123,0,18
544,Tapis volant,Réduit la durée des missions de ${100-$a663*100}%.,0,4,370404,0,18
545,Communion avec les éléments,Augmente de ${$a664}% les chances de succès des missions impliquant des élémentaires d’eau ou des golems arcaniques.,0,4,651085,0,18
546,Grand discours verbeux,Augmente de ${$a889}% les chances de succès contre les |C00b3ffffboss|R mais double la durée des missions.,0,4,800996,0,18
547,Noyau chargé,Augmente les chances de succès des missions dont la durée est supérieure à ${$h666} heures de ${$a666}%.,0,4,429383,0,18
548,Tempête de cendres,Augmente de ${$a669}% les chances de succès des missions impliquant des |C00b3ffffserviteurs|R.,0,4,135815,0,18
549,Maître des mages,Augmente de ${$a672}% les chances de succès des missions impliquant des apprentis de la Tirisgarde ou des adjurateurs du Kirin Tor.,0,4,975740,0,18
550,Invocation de rafraîchissements,Confère une chance de revenir de mission avec des rafraîchissements invoqués utilisables pour rendre 1 point de vitalité aux troupes.,0,4,609813,0,18
551,Pouvoir des Arcanes,Augmente de ${$a674}% les chances de succès des missions.,0,4,136048,0,18
552,Présence spirituelle,Augmente de ${$a675}% les chances de succès des missions impliquant des |C00b3ffffsorts|R.,0,4,136031,0,18
553,Armure de givre,Augmente de ${$a676}% les chances de succès des missions.,0,4,135843,0,18
554,Vivacité,Augmente de ${$a677}% les chances de succès des missions.,0,4,1033914,0,18
555,Force de la nature,Augmente de ${$a678}% les chances de succès des missions.,0,4,136085,0,18
556,Bénédiction de Cénarius,Augmente de ${$a679}% les chances de succès des missions.,0,4,236692,0,18
557,Résolution d’Ursol,Augmente de ${$a680}% les chances de succès des missions.,0,4,1378703,0,18
558,Croissance sauvage,Augmente de ${$a681}% les chances de succès des missions impliquant des |C00b3ffffserviteurs|R.,0,4,236153,0,18
559,Bénédiction du roi,Augmente de ${$a682}% les chances de succès des missions.,0,4,135993,0,18
560,Rempart divin,Augmente de ${$a683}% les chances de succès des missions.,0,4,135923,0,18
561,Epée de Lumière,Augmente de ${$a684}% les chances de succès des missions.,0,4,1360757,0,18
562,Gardiens des rois,Augmente de ${$a685}% les chances de succès des missions impliquant des écuyers ou des porte-boucliers.,0,4,135919,0,18
563,Palefroi divin,Réduit la durée des missions de ${100-$a686*100}%.,0,4,1360759,0,18
564,Lumière de vaillance,Une unité aléatoire prenant part à la mission récupère ${$a687} de vitalité.,0,4,461859,0,18
565,Zèle,Augmente de ${$a688}% les chances de succès des missions impliquant des |C00b3ffffserviteurs|R.,0,4,135961,0,18
566,Absolution,Confère ${$a689}% de chances de ressusciter une unité avec ${$m689} de vitalité après une mission réussie.,0,4,1030102,0,18
567,Bénédiction de Liadrin,Augmente de ${$a690}% les chances de succès des missions présentant des |C00b3ffffdangers|R.,0,4,135968,0,18
568,Grand croisé,Augmente de ${$a691}% les chances de succès des missions impliquant des chevaliers ou des templiers de la Main d’argent.,0,4,461857,0,18
569,Bénédiction de puissance,Augmente les chances de succès des missions de ${$a692}% par point de vitalité des troupes.,0,4,135908,0,18
570,Enveloppe porte-bonheur,Augmente de ${$a693}% les chances de succès de la première mission du jour.,0,4,134268,0,274
571,Quartiers personnels,Augmente de $a694 le nombre maximum d’élèves du Tigre que vous pouvez recruter.,0,4,538444,0,18
572,Posture du buffle,Augmente de ${$a695}% les chances de succès des missions.,0,4,611419,0,18
573,Virevolte,Augmente de ${$a696}% les chances de succès des missions présentant des |C00b3ffffdangers|R.,0,4,642416,0,18
574,Bagarreur intouchable,Augmente de ${$a697}% les chances de succès des missions.,0,4,620830,0,18
575,Posture du tigre féroce,Augmente de ${$a698}% les chances de succès des missions.,0,4,611420,0,18
576,Coup tournoyant de la Grue,Augmente de ${$a699}% les chances de succès des missions impliquant des |C00b3ffffserviteurs|R.,0,4,606543,0,18
577,Frappes létales,Augmente de ${$a700}% les chances de succès des missions.,0,4,606552,0,18
578,Furie sanguinaire,Augmente de ${$a701}% les chances de succès de la première mission du jour.,0,4,136012,0,274
579,Robustesse élémentaire,"Augmente de ${$a702} le nombre maximum d’implorateurs de la terre, de géomanciens et d’élémentaires inférieurs et supérieurs que vous pouvez recruter.",0,4,135776,0,18
580,Puissance du parlevent,Réduit la durée des missions de ${100-$a703*100}%.,0,4,511726,0,18
581,Posture du tigre magistral,Augmente de ${$a704}% les chances de succès des missions.,0,4,620832,0,18
582,Posture du buffle magistral,Augmente de ${$a705}% les chances de succès des missions.,0,4,627607,0,18
583,Tempête de magma,Augmente de ${$a706}% les chances de succès des missions impliquant des |C00b3ffffserviteurs|R.,0,4,524795,0,18
584,Longue portée,Augmente de ${$a707}% les chances de succès de la première mission du jour.,0,4,1392555,0,274
585,Tentes résistantes,"Augmente de ${$a708} le nombre maximum d’archers, de tireurs d’élite, de pisteurs et de guides que vous pouvez recruter.",0,4,236200,0,18
586,Sceau d’Élune,Augmente de ${$a709}% les chances de succès des missions impliquant des |C00b3ffffsorts|R.,0,4,135967,0,18
587,Nova de givre,Augmente de ${$a710}% les chances de succès des missions impliquant des |C00b3ffffserviteurs|R.,0,4,135848,0,274
588,Bibliothèque arcanique,Augmente de $a711 le nombre maximum d’apprentis et d’adjurateurs que vous pouvez recruter.,0,4,354435,0,18
589,Transfert,Réduit la durée des missions de ${100-$a712*100}%.,0,4,135736,0,18
591,Racines,Augmente de ${$a714}% les chances de succès des missions impliquant des |C00b3ffffserviteurs|R.,0,4,134412,0,274
592,Forme de voyage,Réduit la durée des missions de ${100-$a715*100}%.,0,4,132144,0,18
