ID,Name_lang,Location_lang,Description_lang,MapPos[0],MapPos[1],WorldPos[0],WorldPos[1],GarrTypeID,GarrMissionTypeID,GarrFollowerTypeID,MaxFollowers,MissionCost,MissionCostCurrencyTypesID,OfferedGarrMissionTextureID,UiTextureKitID,EnvGarrMechanicID,EnvGarrMechanicTypeID,PlayerConditionID,GarrMissionSetID,TargetLevel,TargetItemLevel,MissionDuration,TravelDuration,OfferDuration,BaseCompletionChance,BaseFollowerXP,OvermaxRewardPackID,FollowerDeathChance,AreaID,Flags,AutoMissionScalar,AutoMissionScalarCurveID,AutoCombatantEnvCasterID
1659,Tonnerre sur la toundra,Tornheim,,619,225,3028.499,1450.5498,3,71,4,3,250,1220,0,250,0,0,0,233,110,895,14400,0,129600,0,3000,672,0,8596,0,1,0,0
1660,"Au revoir, à jamais",Suramar,,477,299,1636.2295,4121.42,3,71,4,3,150,1220,0,251,0,0,0,234,110,900,25200,0,129600,0,3000,672,0,7637,0,1,0,0
1661,Déchus,Suramar,,470,312,1380.5098,4263.49,3,71,4,3,250,1220,0,251,0,0,61243,233,110,880,28800,0,129600,0,3000,253,0,7637,0,1,0,0
1662,Chiens de la tempête,Tornheim,,615,234,2858.0195,1535.79,3,71,4,3,250,1220,0,250,0,0,61243,233,110,880,43200,0,129600,0,3000,253,0,8596,0,1,0,0
1663,Des renforts à la frontière,Haut-Roc,,476,142,4591.249,4149.83,3,71,4,3,250,1220,0,248,0,0,61243,233,110,880,28800,0,129600,0,3000,253,0,8646,0,1,0,0
1664,Déluge de grells,Val’sharah,,365,197,3539.9492,6224.019,3,71,4,3,250,1220,0,252,0,0,61243,233,110,880,28800,0,129600,0,3000,253,0,7558,0,1,0,0
1665,Bandits barjots,Rivage Brisé,,542,459,-1375.6104,2899.6387,3,71,4,3,300,1220,0,249,0,0,0,233,110,885,43200,0,129600,0,3000,304,0,7796,0,1,0,0
1666,Le patrimoine du Freux,Val’sharah,,330,231,2914.8496,6877.5293,3,71,4,3,250,1220,0,252,0,0,0,233,110,885,28800,0,129600,0,3000,299,0,7558,0,1,0,0
1667,L’épreuve du temps,Azsuna,,356,397,-210.65234,6394.5005,3,71,4,3,250,1220,0,246,0,0,0,233,110,885,28800,0,129600,0,3000,672,0,8625,0,1,0,0
1668,Plus jamais ça,Tornheim,,592,219,3142.1494,1961.9912,3,71,4,3,150,1220,0,250,0,0,0,234,110,900,32400,0,129600,0,3000,672,0,8596,0,1,0,0
1669,Les traîtres en dessous,Haut-Roc,,504,151,4420.7695,3609.9814,3,71,4,3,250,1220,0,248,0,0,0,233,110,885,21600,0,129600,0,3000,672,0,8646,0,1,0,0
1670,Plus tôt que prévu,Suramar,,460,303,1550.9893,4433.9707,3,71,4,3,300,1220,0,251,0,0,0,233,110,885,43200,0,129600,0,3000,304,0,7637,0,1,0,0
1671,Délivrance,Rivage Brisé,,542,459,-1375.6104,2899.6387,3,71,4,3,150,1220,0,249,0,0,0,234,110,900,43200,0,129600,0,3000,255,0,7796,0,1,0,0
1672,Prisonniers de valeur,Val’sharah,,341,217,3170.5696,6678.64,3,71,4,3,250,1220,0,252,0,0,0,233,110,890,25200,0,129600,0,3000,672,0,7558,0,1,0,0
1673,Visions entachées,Azsuna,,338,379,130.31055,6735.4707,3,71,4,3,100,1220,0,246,0,0,0,234,110,900,10800,0,129600,0,3000,299,0,8625,0,1,0,0
1674,Grands steaks,Haut-Roc,,482,154,4363.9395,4036.1797,3,71,4,3,250,1220,0,248,0,0,0,233,110,890,28800,0,129600,0,3000,672,0,8646,0,1,0,0
1675,Hydrobelle,Tornheim,,618,220,3113.7393,1478.96,3,71,4,3,250,1220,0,250,0,0,0,233,110,890,28800,0,129600,0,3000,672,0,8596,0,1,0,0
1676,N’en perdez pas une goutte,Suramar,,447,306,1494.1694,4689.6904,3,71,4,3,250,1220,0,251,0,0,0,233,110,890,43200,0,129600,0,3000,672,0,7637,0,1,0,0
1680,Tombe de Sargeras,Rivage Brisé,,575,417,-580.0303,2274.54,3,76,4,3,500,1220,0,249,125,0,49056,235,110,900,57600,0,864000,0,3000,111,0,7796,259,1,0,0
1681,Tombe de Sargeras,Rivage Brisé,,575,417,-580.0303,2274.54,3,76,4,3,500,1220,0,249,125,0,49076,235,110,900,57600,0,864000,0,3000,111,0,7796,259,1,0,0
1682,Tombe de Sargeras,Rivage Brisé,,575,417,-580.0303,2274.54,3,76,4,3,500,1220,0,249,125,0,49077,235,110,900,57600,0,864000,0,3000,111,0,7796,259,1,0,0
1683,Tombe de Sargeras,Rivage Brisé,,575,417,-580.0303,2274.54,3,76,4,3,500,1220,0,249,125,0,49078,235,110,900,57600,0,864000,0,3000,111,0,7796,259,1,0,0
1687,Amis haut placés,Haut-Roc,,473,166,4136.63,4206.66,3,71,4,3,150,1220,0,248,0,0,0,26,110,900,50400,0,129600,0,3000,91,0,8646,0,1,0,0
1697,Commando d’élite : le Sentinax,Rivage Brisé,La base stratégique nous a fourni des informations urgentes sur le Sentinax. Seuls vos champions et vos soldats les plus chevronnés ont une chance de pouvoir en tirer parti.,578,430,-835.75195,2217.71,3,71,4,3,1000,1220,0,249,123,0,48703,230,110,900,259200,0,259200,0,10000,0,0,7543,1,1,0,0
1698,Commando d’élite : cache de fournitures de la Légion,Rivage Brisé,"Grâce aux informations envoyée par la base stratégique, une cache de fournitures de la Légion a été découverte. Seuls vos champions et vos soldats les plus chevronnés ont une chance de tirer avantage de cette occasion.",578,430,-835.75195,2217.71,3,71,4,3,1000,1220,0,249,123,0,48703,230,110,900,259200,0,259200,0,10000,0,0,7543,1,1,0,0
1699,Commando d’élite : le temple Perdu,Rivage Brisé,La base stratégique nous a signalé une bibliothèque contenant d’antiques parchemins cachée sous le temple Perdu. Seuls vos champions et vos soldats les plus chevronnés ont une chance de tirer avantage de cette occasion.,578,430,-835.75195,2217.71,3,71,4,3,1000,1220,0,249,123,0,48703,230,110,900,259200,0,259200,0,10000,0,0,7543,1,1,0,0
1704,"Antorus, le Trône ardent",Étendues Antoréennes,"Antorus, le siège du pouvoir de la Légion, sera bientôt à notre portée. Avant de marcher sur le Trône ardent, envoyez nos troupes en reconnaissance.",696,386,0,0,3,76,4,3,500,1220,0,259,125,0,51414,247,110,950,57600,0,864000,0,3000,401,0,8899,259,1,0,0
1708,"Antorus, le Trône ardent",Étendues Antoréennes,"Antorus, le siège du pouvoir de la Légion, sera bientôt à notre portée. Avant de marcher sur le Trône ardent, envoyez nos troupes en reconnaissance.",696,386,0,0,3,76,4,3,500,1220,0,259,125,0,51415,247,110,950,57600,0,864000,0,3000,401,0,8899,259,1,0,0
1709,"Antorus, le Trône ardent",Étendues Antoréennes,"Antorus, le siège du pouvoir de la Légion, sera bientôt à notre portée. Avant de marcher sur le Trône ardent, envoyez nos troupes en reconnaissance.",696,386,0,0,3,76,4,3,500,1220,0,259,125,0,51416,247,110,950,57600,0,864000,0,3000,401,0,8899,259,1,0,0
1710,"Antorus, le Trône ardent",Étendues Antoréennes,"Antorus, le siège du pouvoir de la Légion, sera bientôt à notre portée. Avant de marcher sur le Trône ardent, envoyez nos troupes en reconnaissance.",696,386,0,0,3,76,4,3,500,1220,0,259,125,0,51417,247,110,950,57600,0,864000,0,3000,401,0,8899,259,1,0,0
1711,Corruption cristallisée,Krokuun,Le bastion de Nath’raxas abrite une cache de gangrecristaux qui pourrait alimenter nos défenses. Infiltrez la base de la Légion et trouvez-la.,696,386,0,0,3,71,4,3,300,1220,0,259,0,0,0,237,110,900,21600,0,21600,0,3000,674,0,8574,0,1,0,0
1712,Coupe franche,Krokuun,"Le bosquet de Naroua est envahi par les pantharas, qui menacent la population de foule-combes. Réduisez leur nombre.",696,386,0,0,3,71,4,3,400,1220,0,259,0,0,0,237,110,900,25200,0,21600,0,3000,674,0,8574,0,1,0,0
1713,Infectes manigances,Krokuun,La Légion construit une arme dans le bastion de Nath’raxas. Envoyez nos champions découvrir à quoi elle ressemble et comment la détruire.,696,386,0,0,3,71,4,3,250,1220,0,259,0,0,61243,237,110,900,28800,0,21600,0,3000,253,0,8574,0,1,0,0
1714,Justes représailles,Krokuun,L’armée de la Lumière a besoin de renfort pour défendre l’épave du Xénédar. Aidez-la à tenir la position.,696,386,0,0,3,71,4,3,250,1220,0,259,0,0,61243,237,110,900,21600,0,21600,0,3000,253,0,8574,0,1,0,0
1715,Lourdes conséquences,Krokuun,Les armes lourdes du Xénédar doivent être retirées avant que la Légion ne trouve un moyen de dépasser l’armée de la Lumière.,696,386,0,0,3,71,4,3,300,1220,0,259,0,0,0,237,110,900,25200,0,21600,0,3000,304,0,8574,0,1,0,0
1716,Soif de vengeance,Krokuun,Un seigneur des abîmes fou furieux compte reprendre les abîmes Annihiléens avec un bataillon de démons. Préparez-vous à les accueillir.,696,386,0,0,3,71,4,3,300,1220,0,259,0,0,0,237,110,900,28800,0,21600,0,3000,389,0,8574,0,1,0,0
1717,Le destin des défunts,Krokuun,Des fanatique annihiléennes tentent de récupérer la dépouille d’Aggonar dans le but d’accélérer sa renconstitution. Sapez leurs efforts.,696,386,0,0,3,71,4,3,1200,1220,0,259,0,0,0,237,110,900,21600,0,21600,0,3000,357,0,8574,0,1,0,0
1718,Feu à volonté,Krokuun,La Légion s’emploie à fortifier la brèche du Trompeur avec des dévastateurs gangrenés. Sabotez-les avant qu’ils soient opérationnels.,696,386,0,0,3,71,4,3,300,1220,0,259,0,0,0,237,110,900,25200,0,21600,0,3000,304,0,8574,0,1,0,0
1719,L’évasion de la Légion,Krokuun,Plusieurs pilotes d’armures de combat sancteforge sont piégés en territoire ennemi dans les étendues Dévastées. Il faut les secourir.,696,386,0,0,3,71,4,3,500,1220,0,259,0,0,0,237,110,900,28800,0,21600,0,3000,674,0,8574,0,1,0,0
1720,Gangre-lié,Krokuun,Les sculpte-âmes érédars créent des ur’zul monstrueux dans la forêt Pétrifiée. Il faut les arrêter.,696,386,0,0,3,71,4,3,300,1220,0,259,0,0,0,237,110,900,25200,0,21600,0,3000,360,0,8574,0,1,0,0
1721,En plein cœur,Krokuun,Le combat fait rage dans les étendues Dévastées. Faites tourner la bataille en notre faveur.,696,386,0,0,3,71,4,2,100,1220,0,259,0,0,0,238,110,900,43200,0,21600,0,6000,674,0,8574,0,1,0,0
1722,Machinerie gangrenée,Krokuun,L’oblitérateur garothi qui sillonne le désert d’Argus constitue une sérieuse menace pour les troupes en déplacement. Il doit être abattu.,696,386,0,0,3,71,4,2,200,1220,0,259,0,0,0,238,110,900,64800,0,21600,0,6000,674,0,8574,0,1,0,0
1723,Un pied dans l’abysse,Krokuun,Nos champions peuvent arrêter l’avancée de l’une des armées de la Légion dans la gorge Noire. Empêchez l’ennemi d’accéder au passage.,696,386,0,0,3,71,4,2,100,1220,0,259,0,0,61243,238,110,900,86400,0,21600,0,6000,253,0,8574,0,1,0,0
1724,Chevauchée sauvage,Krokuun,"Le désert d’Argus regorge de richesses, et les langues-de-wyrms savent où les trouver. Suivez l’un de ces charognards jusqu’au trésor.",696,386,0,0,3,71,4,2,200,1220,0,259,0,0,61243,238,110,900,43200,0,21600,0,6000,253,0,8574,0,1,0,0
1725,La fin du siège,Krokuun,Le maître de siège Voraan lance un nouvel assaut sur la crête de Noirdéclin. Défendez le Vindicaar contre les assaillants.,696,386,0,0,3,71,4,2,100,1220,0,259,0,0,0,238,110,900,64800,0,21600,0,6000,304,0,8574,0,1,0,0
1726,Dos au mur,Krokuun,Tereck le Sélectionneur capture les dresseurs krokuls dans la forêt Pétrifiée. Mettez fin à ses activités.,696,386,0,0,3,71,4,2,200,1220,0,259,0,0,0,238,110,900,86400,0,21600,0,6000,390,0,8574,0,1,0,0
1727,Artillerie lourde,Krokuun,La Légion emprunte la gorge Noire pour acheminer le ravitaillement du bastion de Nath’raxas vers les étendues Dévastées. Confisquez ou détruisez la cargaison suivante.,696,386,0,0,3,71,4,2,1200,1220,0,259,0,0,0,238,110,900,43200,0,21600,0,6000,357,0,8574,0,1,0,0
1728,Maudites défenses,Krokuun,La vie prolifère toujours plus dans le bosquet de Naroua. Elle doit être défendue contre les patrouilles de la Légion.,696,386,0,0,3,71,4,2,100,1220,0,259,0,0,0,238,110,900,64800,0,21600,0,6000,304,0,8574,0,1,0,0
1729,Enfoui,Krokuun,Les Krokuls cherchent à retrouver des reliques perdues dans les ruines de la crête de Noirdéclin. Défendez-les contre la Légion pendant qu’ils y travaillent.,696,386,0,0,3,71,4,2,200,1220,0,259,0,0,0,238,110,900,86400,0,21600,0,6000,674,0,8574,0,1,0,0
1730,Théorie du chaos,Krokuun,Le vaisseau de Kil’jaeden renferme de puissantes reliques. Envoyez nos champions récupérer ce qu’ils peuvent dans l’épave.,696,386,0,0,3,71,4,2,100,1220,0,259,0,0,0,238,110,900,64800,0,21600,0,6000,360,0,8574,0,1,0,0
1731,L’émancipation d’un peuple,Érédath,Des Krokuls touchés par l’Ombre ont réduits leurs frères en esclavage dans les ruines d’Oronaar. Libérez-les des murmures insoutenables du Vide.,696,386,0,0,3,71,4,3,400,1220,0,259,0,0,0,239,110,925,21600,0,21600,0,3000,674,0,8701,0,1,0,0
1732,Sombre passé,Érédath,Des esprits du passé revivent le cauchemar de leurs derniers instants à la Chute du triumvirat. Apportez-leur la paix.,696,386,0,0,3,71,4,3,300,1220,0,259,127,0,0,239,110,925,25200,0,21600,0,3000,674,0,8701,0,1,0,0
1733,Le doute s’installe,Érédath,Le Vide commence à étendre son influence au cercle des Aspirants. Ne le laissez pas gagner de terrain à Érédath.,696,386,0,0,3,71,4,3,250,1220,0,259,127,0,61243,239,110,925,28800,0,21600,0,3000,253,0,8701,0,1,0,0
1734,Le temps presse,Érédath,Le bazar de Reflet-d’Azur abondait autrefois de trésors anciens en tous genres. Passez les lieux au peigne fin.,696,386,0,0,3,71,4,3,250,1220,0,259,0,0,61243,239,110,925,21600,0,21600,0,3000,253,0,8701,0,1,0,0
1735,Expatriation,Érédath,Renforcez le corridor de l’Ombre pour empêcher les éthériens de circuler librement entre les avens Ombreux et l’Incursion ombre-garde.,696,386,0,0,3,71,4,3,300,1220,0,259,0,0,0,239,110,925,25200,0,21600,0,3000,304,0,8701,0,1,0,0
1736,Préfiguration,Érédath,Les chasseurs de la Légion occupent les jardins d’Arinor. Découvrez la nature de leur mission et empêchez sa réussite.,696,386,0,0,3,71,4,3,300,1220,0,259,0,0,0,239,110,925,28800,0,21600,0,3000,389,0,8701,0,1,0,0
1737,Conjuration des défunts,Érédath,"Avant que la corruption ne les frappe, les érédars étaient des maîtres des Arcanes. Explorez le Prétoire à la recherche de magie perdue.",696,386,0,0,3,71,4,3,1800,1220,0,259,0,0,0,239,110,925,21600,0,21600,0,3000,358,0,8701,0,1,0,0
1738,Espèces en voie de disparité,Érédath,Les aberrations du Vide se multiplient dans les avens Ombreux. Réduisez leur nombre avant qu’elles envahissent Érédath.,696,386,0,0,3,71,4,3,300,1220,0,259,127,0,0,239,110,925,25200,0,21600,0,3000,304,0,8701,0,1,0,0
1739,Délirium,Érédath,Il n’y a plus d’espoir pour les Krokuls marqués par le Vide de l’effondrement d’Oronaar. Mettez un terme à leur souffrance.,696,386,0,0,3,71,4,3,300,1220,0,259,0,0,0,239,110,925,28800,0,21600,0,3000,361,0,8701,0,1,0,0
1740,Obscurité ambiante,Érédath,Le voile entre Érédath et le Vide est extrêmement fin au sein d’Isolon. Empêchez l’Ombre-Garde d’exploiter cette fragilité.,696,386,0,0,3,71,4,3,500,1220,0,259,0,0,0,239,110,925,25200,0,21600,0,3000,674,0,8701,0,1,0,0
1741,Vide amalgamé,Érédath,Les eaux qui coulent dans la Retraite du prophète sont exemptes de souillure de la corruption et du Vide. Découvrez comment cela est possible.,696,386,0,0,3,71,4,2,100,1220,0,259,0,0,0,240,110,925,43200,0,21600,0,6000,674,0,8701,0,1,0,0
1742,Souvenirs des égarés,Érédath,Les vigilants patrouillent sans interruption sur la place de Reflet-d’Azur. Retrouvez ceux qui peuvent être purifiés. Éliminez les autres.,696,386,0,0,3,71,4,2,200,1220,0,259,0,0,0,240,110,925,64800,0,21600,0,6000,674,0,8701,0,1,0,0
1743,Vers la Lumière,Érédath,L’Ombre-Garde doit être arrêtée dans les avens Ombreux. Envoyez nos champions mettre fin à ses rituels.,696,386,0,0,3,71,4,2,100,1220,0,259,0,0,61243,240,110,925,86400,0,21600,0,6000,253,0,8701,0,1,0,0
1744,Antiquités d’Argus,Érédath,Le bazar de Reflet-d’Azur était jadis un marché florissant. Peut-être abrite-t-il encore des trésors perdus des érédars.,696,386,0,0,3,71,4,2,200,1220,0,259,0,0,61243,240,110,925,43200,0,21600,0,6000,253,0,8701,0,1,0,0
1745,Vers le Néant,Érédath,Les implorateurs du Vide errants renforcent l’influence de l’Ombre dans l’Incursion ombre-garde. Éliminez-les.,696,386,0,0,3,71,4,2,100,1220,0,259,0,0,0,240,110,925,72000,0,21600,0,6000,304,0,8701,0,1,0,0
1746,Maudits échos,Érédath,Des énergies circulent dans le conservatorium des Arcanes. Les éveilleurs augari y exercent leurs pouvoirs de mort et doivent être éradiqués.,696,386,0,0,3,71,4,2,200,1220,0,259,0,0,0,240,110,925,86400,0,21600,0,6000,390,0,8701,0,1,0,0
1747,Sombre prémonition,Érédath,Le vaisseau talgathi stationné au-dessus de la terrasse de Kil’jaeden assure à la Légion le contrôle de la zone. Trouvez un moyen de le détruire.,696,386,0,0,3,71,4,2,1800,1220,0,259,0,0,0,240,110,925,43200,0,21600,0,6000,358,0,8701,0,1,0,0
1748,En proie à la débâcle,Érédath,Le secret de la création des vigilants repose dans l’enclave des Éveilleurs. Envoyez vos champions à sa découverte.,696,386,0,0,3,71,4,2,100,1220,0,259,0,0,0,240,110,925,64800,0,21600,0,6000,304,0,8701,0,1,0,0
1749,Pacification du Néant,Érédath,Des implorateurs des abîmes ombre-gardes tentent d’invoquer un nouveau seigneur du Vide à l’enclave Ombreuse. Empêchez l’accomplissement de leur rituel.,696,386,0,0,3,71,4,2,100,1220,0,259,0,0,0,240,110,925,86400,0,21600,0,6000,361,0,8701,0,1,0,0
1750,Le tissu de la réalité,Érédath,Les moissonneurs du Vide récoltent une quantité d’énergie considérable dans l’Incursion ombre-garde. Il faut les détruire !,696,386,0,0,3,71,4,2,200,1220,0,259,0,0,0,240,110,925,64800,0,21600,0,6000,674,0,8701,0,1,0,0
1751,Satanée corruption,Étendues Antoréennes,La voie profanée conduit tout droit à la brèche Ardente. Partez en éclaireur pour ouvrir la voie.,696,386,0,0,3,71,4,3,300,1220,0,259,128,0,0,241,110,950,21600,0,21600,0,3000,674,0,8899,0,1,0,0
1752,La riposte,Étendues Antoréennes,Des infernaux s’enflamment à la jonction du Gardien. Renvoyez-les dans le Néant.,696,386,0,0,3,71,4,3,400,1220,0,259,0,0,0,241,110,950,25200,0,21600,0,3000,674,0,8899,0,1,0,0
1753,Un avantage technologique,Étendues Antoréennes,Les munitions explosives de la Légion sont fabriquées à l’armurerie du Gangrefeu. Volez-en autant que vous le pourrez.,696,386,0,0,3,71,4,3,250,1220,0,259,127,0,61243,241,110,950,28800,0,21600,0,3000,402,0,8899,0,1,0,0
1754,La machine est en marche,Étendues Antoréennes,Explorez les abords de la brèche Ardente et évaluez les défenses de la Légion.,696,386,0,0,3,71,4,3,250,1220,0,259,128,0,61243,241,110,950,21600,0,21600,0,3000,402,0,8899,0,1,0,0
1755,L’avant-garde de la Légion,Étendues Antoréennes,"Des vaisseaux de la Légion sont à quai au Terminus, où ils embarquent soldats et ravitaillement en vue d’attaquer Azeroth. Détruisez-les.",696,386,0,0,3,71,4,3,300,1220,0,259,0,0,0,241,110,950,25200,0,21600,0,3000,304,0,8899,0,1,0,0
1756,Garde-portails,Étendues Antoréennes,Des invocateur érédars font appel à des infernaux énormes issus du Néant. Détruisez leurs portails.,696,386,0,0,3,71,4,3,300,1220,0,259,0,0,0,241,110,950,28800,0,21600,0,3000,389,0,8899,0,1,0,0
1757,Puissance accablante,Étendues Antoréennes,Deux immenses grangrecanons affaiblissent les boucliers du Vindicaar. Neutralisez-les !,696,386,0,0,3,71,4,3,2400,1220,0,259,0,0,0,241,110,950,21600,0,21600,0,3000,359,0,8899,0,1,0,0
1758,Un funeste sort,Étendues Antoréennes,L’amiral Rel’var coordonne les déplacements de la Légion depuis le Terminus. Éliminez-le.,696,386,0,0,3,71,4,3,300,1220,0,259,128,0,0,241,110,950,25200,0,21600,0,3000,304,0,8899,0,1,0,0
1759,Une faille inopinée,Étendues Antoréennes,Les ingénieurs langues-de-wyrms qui travaillent à l’armurerie du Gangrefeu se laissent facilement amadouer par quelques richesses. Exploitez ce point faible.,696,386,0,0,3,71,4,3,300,1220,0,259,127,0,0,241,110,950,28800,0,21600,0,3000,674,0,8899,0,1,0,0
1760,Rencontre fortuite,Étendues Antoréennes,Un grand nombre d’esclaves krokuls est exploité au poste des charognards. Libérez-en autant que possible.,696,386,0,0,3,71,4,3,500,1220,0,259,0,0,0,241,110,950,25200,0,21600,0,3000,362,0,8899,0,1,0,0
1761,À contre-courant,Étendues Antoréennes,Un flux incessant de démons de la Légion arpente la voie profanée en direction de nos campements. Résistez à la marée.,696,386,0,0,3,71,4,2,100,1220,0,259,127,0,0,242,110,950,43200,0,21600,0,6000,674,0,8899,0,1,0,0
1762,Exterminateurs de démons,Étendues Antoréennes,Une multitude d’archnides démoniaques infestent la tanière de Ven’orn. Exterminez-les.,696,386,0,0,3,71,4,2,200,1220,0,259,0,0,0,242,110,950,64800,0,21600,0,6000,674,0,8899,0,1,0,0
1763,Richesse corrompue,Étendues Antoréennes,De nombreux morts reposent dans le cimetière. Fouillez la zone en quête d’équipement de valeur.,696,386,0,0,3,71,4,2,100,1220,0,259,0,0,61243,242,110,950,86400,0,21600,0,6000,402,0,8899,0,1,0,0
1764,Le malheur des langues-de-wyrm,Étendues Antoréennes,Une multitude de langues-de-wyrms sillonnent le poste des charognards à la recherche d’objets de valeur. Coiffez-les au poteau.,696,386,0,0,3,71,4,2,200,1220,0,259,127,0,61243,242,110,950,43200,0,21600,0,6000,402,0,8899,0,1,0,0
1765,Renforcement défensif,Étendues Antoréennes,Les démons ne doivent contourner nos défenses à la Passe démonique sous aucun prétexte. Renforcez les flancs.,696,386,0,0,3,71,4,2,100,1220,0,259,0,0,0,242,110,950,64800,0,21600,0,6000,304,0,8899,0,1,0,0
1766,Position retranchée,Étendues Antoréennes,Une marée de soldats de la Légion menace de bouter à jamais le Vindicaar hors des étendues Antoréennes. Ne laissez pas cela se produire.,696,386,0,0,3,71,4,2,200,1220,0,259,0,0,0,242,110,950,86400,0,21600,0,6000,390,0,8899,0,1,0,0
1767,Les saigner à blanc,Étendues Antoréennes,Des sorciers de la Légion utilisent du sang de démon pour accomplir leurs infâmes rituels. Coupez-leur les vivres.,696,386,0,0,3,71,4,2,2400,1220,0,259,0,0,0,242,110,950,43200,0,21600,0,6000,359,0,8899,0,1,0,0
1768,Hérauts de guerre,Étendues Antoréennes,De puissants seigneurs démons constituent l’avant-garde de l’assaut de la Légion qui a lieu à la Passe démonique. Nous devons les abattre.,696,386,0,0,3,71,4,2,100,1220,0,259,127,0,0,242,110,950,64800,0,21600,0,6000,304,0,8899,0,1,0,0
1769,Libérer le prisonnier,Étendues Antoréennes,Des combattants sancteforge sont prisonniers des toiles au sein de la tanière de Ven’orn. Libérez-les.,696,386,0,0,3,71,4,2,100,1220,0,259,0,0,0,242,110,950,86400,0,21600,0,6000,362,0,8899,0,1,0,0
1770,Manœuvre de décryptage,Étendues Antoréennes,L’ennemi s’en prend à nos armures de combat sancteforge. Défendez-les contre les hurleurs de la Légion.,696,386,0,0,3,71,4,2,200,1220,0,259,0,0,0,242,110,950,64800,0,21600,0,6000,674,0,8899,0,1,0,0
1771,Les instruments de la défiance,Krokuun,Des armes krokuls ont été abandonnées dans la forêt Pétrifiée. Retrouvez-les.,696,386,0,0,3,71,4,2,100,1220,0,259,0,0,51468,243,110,760,21600,0,129600,0,4500,394,0,8574,1,1,0,0
1772,Armement érédar,Érédath,D’anciennes armes et armures érédars sont dissimulées dans les ruines d’Érédath. Retrouvez-les.,696,386,0,0,3,71,4,2,100,1220,0,259,0,0,51469,243,110,900,36000,0,129600,0,4500,395,0,8701,1,1,0,0
1773,Armes consacrées,Étendues Antoréennes,Les armes arrachées à la Légion peuvent être fondues et reforgées en équipement pour l’armée de la Lumière. Pillez les armureries de l’ennemi.,696,386,0,0,3,71,4,2,100,1220,0,259,0,0,51470,243,110,925,57600,0,129600,0,4500,396,0,8899,1,1,0,0
1774,Une résistance à toute épreuve,Krokuun,"La colonie de la crête de Noirdéclin a connu des décennies de prospérité. En expulsant la Légion, il sera possible d’y trouver des vivres et des provisions.",696,386,0,0,3,71,4,2,100,1220,0,259,0,0,50765,243,110,900,25200,0,21600,0,4500,394,0,8574,0,1,0,0
1775,Instruments de guerre,Krokuun,Des caches de fournitures krokuls sont disséminées dans le désert d’Argus. Localisez-les.,696,386,0,0,3,71,4,2,100,1220,0,259,0,0,50765,243,110,900,72000,0,21600,0,4500,394,0,8574,0,1,0,0
1776,Reliques de l’ascendance,Érédath,L’Ombre-Garde imprègne ses armes d’Ombre. Découvrir comment elle procède nous permettrait de la contrer plus efficacement.,696,386,0,0,3,71,4,2,100,1220,0,259,0,0,51511,243,110,900,43200,0,21600,0,4500,395,0,8701,0,1,0,0
1777,Armes ancestrales,Érédath,Le Siège du triumvirat était autrefois un lieu de miracles. Emparez-vous des merveilles qu’il reste dans les ruines.,696,386,0,0,3,71,4,2,100,1220,0,259,0,0,51511,243,110,900,28800,0,21600,0,4500,395,0,8701,0,1,0,0
1778,Munitions sanctifiées,Étendues Antoréennes,Interceptez les cargaisons de matières premières en cours d’acheminement vers l’armurerie du Gangrefeu et ramenez les à bord du Vindicaar.,696,386,0,0,3,71,4,2,100,1220,0,259,0,0,51512,243,110,900,86400,0,21600,0,4500,396,0,8899,0,1,0,0
1779,Protection bénie,Étendues Antoréennes,Apportez la Lumière au Creuset aux esprits. Ne laissez plus la Légion consommer aucune âme pour son armée.,696,386,0,0,3,71,4,2,100,1220,0,259,0,0,51512,243,110,900,50400,0,21600,0,4500,396,0,8899,0,1,0,0
1780,Fournitures de la crête de Noirdéclin,Krokuun,"Le chef Hatuun vous a demandé de récupérer des fournitures cachées à la crête de Noirdéclin. En retour, les rôdeurs des crêtes krokuls aideront vos troupes à traverser les terres désolées d’Argus.",696,386,0,0,3,74,4,3,100,1220,0,259,0,0,51462,252,110,760,57600,0,0,0,10000,0,0,8574,0,1,0,0
1781,L’évasion de Nath’raxas,Krokuun,"Les Krokuls veulent secourir leurs frères au bastion de Nath’raxas avant que la corruption ne les transforme. Si vous réussissez, l’influence de la Légion dans cette région diminuera.",696,386,0,0,3,74,4,3,100,1220,0,259,128,0,51463,252,110,900,57600,0,0,0,10000,0,0,8574,0,1,0,0
1782,Au bord de la folie,Érédath,Alleria vous a demandé de fouiller les ruines d’Oronaar à la recherche de Krokuls qui n’auraient pas été consumés par les Ombres.,696,386,0,0,3,74,4,3,100,1220,0,259,0,0,51464,252,110,900,57600,0,0,0,10000,0,0,8701,0,1,0,0
1783,Disperser l’Ombre-Garde,Érédath,Arracher Argus aux griffes de la Légion ne servira à rien si le Vide l’emporte. Expulsez l’Ombre-Garde d’Érédath.,696,386,0,0,3,74,4,3,100,1220,0,259,129,0,51465,252,110,925,57600,0,0,0,10000,0,0,8701,0,1,0,0
1784,Stratagème antoréen,Étendues Antoréennes,Le grand exarque Turalyon a demandé votre aide pour une attaque ambitieuse contre la machine de guerre de la Légion.,696,386,0,0,3,74,4,3,100,1220,0,259,0,0,51466,252,110,925,57600,0,0,0,10000,0,0,8899,0,1,0,0
