ID,Name_lang,Location_lang,Description_lang,MapPos[0],MapPos[1],WorldPos[0],WorldPos[1],GarrTypeID,GarrMissionTypeID,GarrFollowerTypeID,MaxFollowers,MissionCost,MissionCostCurrencyTypesID,OfferedGarrMissionTextureID,UiTextureKitID,EnvGarrMechanicID,EnvGarrMechanicTypeID,PlayerConditionID,GarrMissionSetID,TargetLevel,TargetItemLevel,MissionDuration,TravelDuration,OfferDuration,BaseCompletionChance,BaseFollowerXP,OvermaxRewardPackID,FollowerDeathChance,AreaID,Flags,AutoMissionScalar,AutoMissionScalarCurveID,AutoCombatantEnvCasterID
1171,Mers scintillantes,Tornheim,"Les Murlocs en général nous posent problème, mais l’un d’eux en particulier, Grrvrgull le Conquérant, a volé une armure vrykule. Tâchez de l’empêcher de nuire.",554,217,3170.5696,2672.331,3,71,4,3,150,1220,0,250,0,0,44651,164,101,760,7200,0,129600,0,400,245,0,7541,0,1,0,0
1172,Sur les ailes des dragons,Tornheim,"Dans les hauteurs des montagnes surplombant Tornheim, la matriarche des dragons aile-tempête constitue sa couvée. Mieux vaut les tuer, ses rejetons et elle.",601,269,2204.5093,1791.5098,3,71,4,3,100,1220,0,250,0,0,44643,164,105,760,14400,0,129600,0,1200,245,0,7541,0,1,0,0
1173,Une tâche des plus baveuses,Suramar,"L’un de nos alliés pense qu’Anax, le crapaud géant de Suramar, secrète un venin qui pourrait nous être utile. Retrouvez ce monstre et récupérez ce que vous pouvez.",420,259,2374.9888,5201.1304,3,71,4,3,150,1220,0,251,0,0,44632,165,103,760,28800,0,129600,0,800,669,0,7637,0,1,0,0
1174,Purge colossale,Suramar,Les infernaux se déversent du bastion Gangrâme si vite que nous n’arrivons plus à suivre. Réduisons leur nombre pour empêcher la Légion de nous submerger à loisir.,489,346,755.41064,3894.1104,3,71,4,3,250,1220,0,251,0,0,5793,165,106,760,21600,0,129600,0,1400,92,0,7637,0,1,0,0
1175,Baignade interdite,Haut-Roc,Un poisson géant vivant dans les lacs de Haut-Roc terrorise les tribus locales et n’hésite pas à s’en prendre aux pêcheurs.,471,105,5273.1797,4235.0703,3,71,4,3,150,1220,0,248,0,0,44646,165,108,760,7200,0,129600,0,1800,245,0,7503,0,1,0,0
1176,Le pilon ou la cuisse ?,Haut-Roc,"Parmi les cimes de Haut-Roc, un Ettin solitaire menace les voyageurs. Éliminez cette créature connue sous le nom d’Oubdob le Pilonneur.",489,164,4165.04,3894.1104,3,71,4,3,100,1220,0,248,0,0,44634,165,105,760,14400,0,129600,0,1200,669,0,7503,0,1,0,0
1177,Le fléau tempétueux,Tornheim,Une terrible tourmente au sentier Brise-Vent empêche nos alliés d’avancer. Elle vient sans doute de l’élémentaire de tempête éveillé il y a peu. Éliminez ce Lamorage.,571,279,2005.6094,2359.7803,3,71,4,3,250,1220,0,250,0,0,5793,165,102,760,21600,0,129600,0,600,92,0,7541,0,1,0,0
1178,Le froid du tombeau,Tornheim,Rois et héros morts-vivants ne sont pas les seuls dangers des cimetières vrykuls. Fjorlag le froid du tombeau traque les vivants comme les morts.,593,237,2801.189,1933.581,3,71,4,3,150,1220,0,250,0,0,44650,165,102,760,7200,0,129600,0,600,669,0,7541,0,1,0,0
1179,Les tisseuses,Suramar,"Des araignées et leur progéniture ont pris possession des jardins proches de la retraite de Tombelune, à Suramar. Détruisons leurs toiles, que nos troupes puissent passer.",510,299,1636.2295,3496.3203,3,71,4,3,100,1220,0,251,0,0,44641,165,103,760,14400,0,129600,0,800,245,0,7637,0,1,0,0
1180,Ombres et flétrissement,Suramar,"Autrefois idylliques, les jardins du val d’Ambre ont été envahis par des bois flétris, dont Shal’an, qui se renforce de jour en jour.",432,326,1124.7896,4973.83,3,71,4,3,250,1220,0,251,0,0,5793,165,101,760,28800,0,129600,0,400,92,0,7637,0,1,0,0
1181,Le dresseur de molosses,Tornheim,"Un chasseur de Worgens, le maître-chien Ely, a décidé de traquer les Réprouvés sans en avoir reçu l’ordre.",581,297,1664.6494,2160.88,3,72,4,3,150,1220,0,250,0,0,0,168,110,805,39600,0,129600,0,3000,118,0,7541,0,1,0,0
1182,La reine des pierres,Val’sharah,Une matrone harpie du nom de Sorsei façonne des statues étonnamment réalistes dans la forêt de Val’sharah.,285,247,2602.3003,7729.939,3,71,4,3,100,1220,0,252,0,0,0,166,110,765,14400,0,129600,0,3000,670,0,7558,0,1,0,0
1183,Harpie c’est tout,Val’sharah,Les Harpies vers-de-serre se sont emparées d’Ombrefange et les anciens villageois cherchent à se venger et à récupérer certaines de leurs affaires. Aidez-les.,355,253,2488.6396,6422.9194,3,71,4,3,150,1220,0,252,0,0,0,166,110,770,36000,0,129600,0,3000,670,0,7558,0,1,0,0
1184,Amasseur à la masse,Haut-Roc,"En temps normal, nous n’aurions que faire d’un géant des mers gobant des Murlocs, mais Bodash l’amasseur s’en prend à tous ceux qui approchent son antre.",463,185,3767.249,4377.1406,3,71,4,3,250,1220,0,248,0,0,5793,166,110,770,43200,0,129600,0,3000,92,0,7503,0,1,0,0
1185,"Il est l’or, monseignor",Haut-Roc,"Il est très difficile de repousser les Harpies amatrices de babioles brillantes. Pourtant, Coiffe-Crâne, un Kobold moustache-bleue, s’est installé dans leurs collines.",498,220,3113.7393,3723.63,3,72,4,3,150,1220,0,248,0,0,0,166,110,760,25200,0,129600,0,3000,249,0,7503,0,1,0,0
1186,Encré dans la défaite,Tornheim,Les Vrykuls imprègnent leurs tatouages d’une magie ancienne et ont un profond respect pour leurs lieurs-d’encre. Tuer de ces derniers affaiblirait nettement leur magie.,575,204,3426.2903,2274.54,3,71,4,3,250,1220,0,250,0,0,5793,166,110,775,28800,0,129600,0,3000,92,0,7541,0,1,0,0
1187,Le dû de l’aspirante,Tornheim,"Au pied des murs de Skold-Ashil, Lagertha, une vierge guerrière tombée en disgrâce complote pour prendre de force sa place parmi les Valkyras.",580,228,2971.6694,2189.2998,3,72,4,3,150,1220,0,250,0,0,0,166,110,760,50400,0,129600,0,3000,249,0,7541,0,1,0,0
1188,Châteaux de sable,Azsuna,"Dalaran a commandé une cargaison de sable de première qualité. Alaplage, le célèbre élémentaire des sables, est le mieux placé pour nous en fournir.",379,448,-1176.7305,5968.2993,3,72,4,3,150,1220,0,246,0,0,0,166,110,780,25200,0,129600,0,3000,118,0,7334,0,1,0,0
1189,Un mal invisible,Suramar,"À Suramar, une guerrière vrykule nommée Hertha Grimdottir s’en prend aux voyageurs. Mettez fin à ses méfaits !",474,299,1636.2295,4178.25,3,71,4,3,250,1220,0,251,0,0,5793,166,110,760,28800,0,129600,0,3000,92,0,7637,0,1,0,0
1190,Nuit étoilée,Tornheim,"Le voyant des runes Sigvid était l’un des gardiens des esprits du Repos du bouclier, mais il a perdu la raison en voyant les Helarjar profaner les tombes. Abrégez ses souffrances.",619,243,2687.54,1450.5498,3,71,4,3,250,1220,0,250,0,0,5793,166,110,760,28800,0,129600,0,3000,92,0,7541,0,1,0,0
1191,La montagne s’éveille,Haut-Roc,"Drogbars et Vrykuls se livrent à d’étranges rituels dans les galeries du roi de la montagne, dans l’espoir de contrôler la puissance des lieux. Mettez fin à cette folie.",429,83,5699.38,5030.6504,3,71,4,3,150,1220,0,248,0,0,0,166,110,760,25200,0,129600,0,3000,670,0,7503,0,1,0,0
1192,Un rituel cauchemardesque,Val’sharah,"Sous les branches de Germe de l’Effroi, un puissant Satyre nommé Thondrax soumet les énergies du Putribois à sa volonté afin d’accomplir un rituel terrifiant.",382,172,4022.9795,5911.471,3,71,4,3,150,1220,0,252,0,0,0,166,110,760,39600,0,129600,0,3000,670,0,7558,0,1,0,0
1193,Défense d’échouer,Azsuna,"Les géants des mers aiment faire sombrer les navires, mais l’un d’eux prend un malin plaisir à envoyer les bateaux se fracasser contre les rochers d’Azsuna.",380,341,840.65576,5939.89,3,72,4,3,100,1220,0,246,0,0,0,166,110,760,18000,0,129600,0,3000,249,0,7334,0,1,0,0
1194,Un éclat dans les ténèbres,Haut-Roc,Les légendes kobolds font état d’une présence sombre et dévorante au cœur des cavernes de Haut-Roc. C’est d’ailleurs pour cette raison qu’ils ont peur du noir.,500,126,4875.3896,3695.2197,3,72,4,3,100,1220,0,248,0,0,0,166,110,760,14400,0,129600,0,3000,249,0,7503,0,1,0,0
1195,Un bon gros tas de restes,Azsuna,"Les mages de Dalaran ont demandé un fertilisant particulièrement dense. Les restes des repas de Mac l’Ours, qui rôde sur Azsuna, feront parfaitement l’affaire.",311,324,1153.1992,7246.9097,3,71,4,3,250,1220,0,246,0,0,5793,166,110,785,21600,0,129600,0,3000,92,0,7334,0,1,0,0
1196,Blanc comme neige,Haut-Roc,"Les tribus de Haut-Roc convoitent la peau d’une créature rare et insaisissable, le noble-bois majestueux. Elles l’utilisent pour leurs cérémonies. Traquez cette bête.",513,172,4022.9795,3439.4912,3,71,4,3,100,1220,0,248,0,0,0,166,110,785,18000,0,129600,0,3000,670,0,7503,0,1,0,0
1197,Vigilant,Tornheim,"La sentinelle d’ivoire, un assemblage des Titans, veille sur Skold-Ashil et repousse ceux qui sont indignes d’en approcher. Prouvons que nos champions sont plus forts qu’elle.",565,167,4108.2197,2473.4307,3,71,4,3,250,1220,0,250,0,0,5793,168,110,790,64800,0,129600,0,3000,92,0,7541,0,1,0,0
1198,Les morts appartiennent au passé,Val’sharah,"En surplomb de Ruissecôte rôde le fantôme malfaisant de Kiranys Murmesoir, et nul n’est encore parvenu à le contenir ou le déloger de sa veille.",311,253,2488.6396,7246.9097,3,72,4,3,100,1220,0,252,0,0,0,168,110,760,14400,0,129600,0,3000,112,0,7558,0,1,0,0
1199,Plaie-des-Elfes,Suramar,"Les Ettins de Koralune vivent dans les jardins du val d’Ambre, à Suramar. L’un d’eux est particulièrement dangereux, notamment pour les Elfes.",479,272,2147.6802,4093.0098,3,71,4,3,250,1220,0,251,0,0,5793,168,110,790,32400,0,129600,0,3000,92,0,7637,0,1,0,0
1200,Chasse aux trophées,Val’sharah,"Le Satyre Perrexx s’amuse à chasser les druides du val des Griffelunes afin d’en faire ses trophées. Traquez-le, qu’il sache ce que ressent une proie aux abois.",395,201,3483.1204,5655.7505,3,72,4,3,150,1220,0,252,0,0,0,166,110,760,32400,0,129600,0,3000,249,0,7558,0,1,0,0
1201,Le dompte-drakes,Tornheim,"Les Vrykuls domptent les drakes ailes-tempête grâce à des méthodes peu orthodoxes. L’un d’eux a pour nom Glimar Poing-de-Fer, le dompte-drakes.",457,146,4506.009,4490.789,3,72,4,3,150,1220,0,248,0,0,0,168,110,760,28800,0,129600,0,3000,249,0,7541,0,1,0,0
1202,À la bouffe !,Haut-Roc,La tribu Corne-Céleste de Haut-Roc est aux prises avec un roc de grande taille surnommé Tombe-Furie l’Affamé qui terrorise le village.,618,231,2914.8496,1478.96,3,72,4,3,100,1220,0,248,0,0,0,168,110,760,18000,0,129600,0,3000,249,0,7503,0,1,0,0
1203,Pince-m’en une,Suramar,"La guerre a mis à mal notre ravitaillement et nos troupes rêvent de chair fraîche. Un énorme crabe des rivières, Griffe-des-marées, devrait suffire à les nourrir un bon moment.",427,246,2630.7095,5059.0703,3,72,4,3,100,1220,0,251,0,0,0,168,110,790,14400,0,129600,0,3000,118,0,7637,0,1,0,0
1204,L’eau contaminée,Dalaran,"Il faut toujours rester sur ses gardes, même à Dalaran. La Légion s’est infiltrée dans les égouts de la ville et cherche à contaminer les réserves d’eau potable.",456,445,-1119.8906,4519.21,3,72,4,3,100,1220,0,247,0,0,0,166,110,790,18000,0,129600,0,3000,118,0,7502,0,1,0,0
1205,Préparatifs de l’invasion : reconnaissance du bastion ennemi,Suramar,"Allari vous demande d’envoyer vos troupes en reconnaissance dans le bastion Gangrâme à Suramar. Une fois sur place, il leur faudra identifier des cibles à capturer.",445,300,1607.8193,4718.1006,3,70,4,3,50,1220,0,251,0,0,41555,181,108,760,3600,0,0,0,1800,89,0,7637,0,1,0,0
1206,Préparatifs de l’invasion : amélioration des armes,Le Marteau gangrené,Tout le monde n’a pas de glaives de guerre prodigieux. Mieux vaut donc faire parvenir des armes améliorées aux Illidari avant d’envahir un monde démoniaque.,459,436,-949.40625,4462.379,3,70,4,3,50,1220,0,249,0,0,45155,181,108,760,3600,0,0,0,1800,89,0,8022,0,1,0,0
1207,Préparatifs de l’invasion : enlèvement,Suramar,"Maintenant que les cibles de la Légion au bastion Gangrâme ont été convenablement observées, il faut envoyer vos meilleurs soldats pour les capturer.",430,255,2460.2295,5002.24,3,70,4,3,50,1220,0,251,0,0,45156,181,108,760,3600,0,0,0,1800,89,0,7637,0,1,0,0
1208,Préparatifs de l’invasion : maintenance indispensable,Le Marteau gangrené,Cela fait des années que le Marteau gangrené n’est plus pleinement opérationnel. Jace a besoin d’aide pour effectuer des tâches de maintenance indispensables.,450,436,-949.40625,4632.8594,3,70,4,3,50,1220,0,249,0,0,45157,181,108,760,3600,0,0,0,1800,89,0,8022,0,1,0,0
1209,Préparatifs de l’invasion : où sont les Gangrâme ?!,Le Marteau gangrené,"Maintenant que les démons capturés sont à fond de cale à bord du Marteau gangrené, Allari s’apprête à les soumettre à la question avec la Faux des âmes.",460,442,-1063.0605,4433.9707,3,70,4,3,50,1220,0,249,0,0,45158,181,108,760,3600,0,0,0,1800,89,0,8022,0,1,0,0
1210,Répandre la nouvelle,Dalaran,"Les chevaliers de la Lame d’ébène sont désormais bien établis à Achérus, mais nous allons avoir besoin d’alliés contre la Légion. Chargez Nazgrim de contrer cette menace.",459,436,-949.4053,4462.379,3,70,4,1,20,1220,0,247,0,0,41568,127,100,760,120,0,0,0,100,0,0,7502,128,1,0,0
1211,Des troupes sur le terrain,Azsuna,"Maintenant que nous sommes plus nombreux, il faut déployer des troupes pour afficher notre puissance. Les géants des mers feront une bonne mise à l’épreuve.",385,433,-892.58057,5854.651,3,70,4,3,20,1220,0,246,0,0,41569,153,100,760,3600,0,0,0,100,0,0,7334,128,1,0,0
1212,Répandre la nouvelle,Dalaran,"Nous avons fait du temple Halo-du-Néant un sanctuaire, mais il est désormais temps de charger Calia Menethil de le faire savoir et d’enrôler des renforts.",459,436,-949.4053,4462.379,3,70,4,1,20,1220,0,247,0,0,41570,127,100,760,120,0,0,0,100,0,0,7502,128,1,0,0
1213,Entraînement militaire,Dalaran,Nous allons pouvoir utiliser les soldats que nous avons recrutés pour épauler nos champions. Envoyez-les en mission de reconnaissance de routine.,457,432,-864.1675,4490.8,3,70,4,3,20,1220,0,247,0,0,41571,153,100,760,3600,0,0,0,100,0,0,7502,128,1,0,0
1214,"Minou, minou…",Haut-Roc,Les membres de la tribu de Haut-Roc n’osent plus sortir à la nuit tombée car un gros félin rôde autour de leur village.,501,113,5131.1094,3666.7988,3,71,4,3,250,1220,0,248,0,0,5793,168,110,805,14400,0,129600,0,3000,128,0,7503,0,1,0,0
1215,"Arme prodigieuse : Aluneth, grand bâton de la magna",Néant distordu,"Aegwynn, la seule femme à avoir rejoint les rangs des Gardiens de Tirisfal, fut l’une des plus célèbres porteuses d’Aluneth, bien qu’à en croire différentes légendes, ce bâton aurait été fabriqué bien avant son époque. Lorsqu’elle dut s’en séparer, il fut enfermé dans un lieu tenu secret où il repose encore aujourd’hui.",225,559,-3250.9102,8866.48,3,70,4,2,500,1220,0,249,0,0,5703,218,102,760,3600,0,0,0,100,26,0,7879,0,1,0,0
1216,Arme prodigieuse : Felo’melorn,Néant distordu,"Felo’melorn, ou « Choc de flammes » dans la langue natale de son créateur, fut l’arme de prédilection des Haut-Soleil avant d’être perdue dans le Norfendre.",225,559,-3250.9102,8866.48,3,70,4,2,500,1220,0,249,0,0,5703,218,102,760,3600,0,0,0,100,26,0,7879,0,1,0,0
1217,Arme prodigieuse : Frissébène,Néant distordu,"Le grand bâton connu sous le nom de Frissébène extermina en son temps d’innombrables démons de la Légion. Lorsqu’Alodi renonça à sa charge de Gardien, le bâton fut transmis à ses apprentis avant d’être finalement perdu dans les limbes du temps. Personne ne sait où il se trouve aujourd’hui, à l’exception peut-être d’Alodi lui-même.",225,559,-3250.9102,8866.48,3,70,4,2,500,1220,0,249,0,0,5703,218,102,760,3600,0,0,0,100,26,0,7879,0,1,0,0
1218,Larguer le SI:7 : Dalaran,Dalaran,"Si nous voulons nous débarrasser du SI:7, nous devons d’abord attirer son attention. Commençons par monter une fausse cabale contre l’archimage Khadgar.",456,439,-1006.2305,4519.21,3,70,4,3,50,1220,0,247,0,0,41693,183,102,760,3600,0,0,0,600,89,0,7502,0,1,0,0
1219,Larguer le SI:7 : Tornheim,Tornheim,"Sylvanas Coursevent a disparu en Tornheim. Laissons le SI:7 penser que nous sommes sur sa piste. C’est vrai, au demeurant, mais nous dépêcherons un agent qui fera diversion.",598,208,3341.0498,1848.3389,3,70,4,3,50,1220,0,250,0,0,45167,183,102,760,3600,0,0,0,600,89,0,7541,0,1,0,0
1220,Larguer le SI:7 : Azsuna,Azsuna,"Nous avons sur Azsuna un contact qui utilise différentes couvertures, dont celle de M. Menottes. Envoyez un groupe sur place pour « perturber » ses opérations.",333,415,-551.6162,6820.71,3,70,4,3,50,1220,0,246,0,0,45168,183,102,760,3600,0,0,0,600,89,0,7334,0,1,0,0
1221,Larguer le SI:7 : Haut-Roc,Haut-Roc,"Les tribus de Haut-Roc sont connues pour leurs redoutables guerriers, chasseurs et chamans, non pour leur discrétion. Faites surveiller chacun de leurs camps.",470,172,4022.9795,4263.49,3,70,4,3,50,1220,0,248,0,0,45169,183,102,760,3600,0,0,0,600,89,0,7503,0,1,0,0
1222,Larguer le SI:7 : Suramar,Suramar,"Il y a anguille sous roche chez les Sacrenuit de Suramar. Malheureusement, la cité est trop bien défendue. Pour autant, il vaudrait mieux que le SI:7 nous voit faire un essai.",447,308,1465.7495,4689.6904,3,70,4,3,50,1220,0,251,0,0,45170,183,102,760,3600,0,0,0,600,89,0,7637,0,1,0,0
1223,L’assemblée des Tisse-Rêves : Graham Griffargent,Azsuna,"Graham Griffargent, un jeune druide au grand potentiel, a conduit nos éclaireurs jusqu’aux abords de Suramar, mais a croisé des chasseurs de la Légion et a besoin d’aide.",398,225,3028.499,5598.92,3,70,4,3,50,1220,0,246,0,0,41776,156,102,760,3600,0,0,0,600,89,0,7334,0,1,0,0
1224,Alimentation du portail : Orneval,Orneval,"Des Satyres ont été repérés dans les forêts du val d’Ambre. Menés par Rethazar le Déchu, ils risquent d’attaquer à tout moment.",436,432,-864.1631,4888.58,3,70,4,3,50,1220,0,249,0,0,40362,157,108,760,3600,0,0,0,1800,89,0,331,0,1,0,0
1225,Alimentation du portail : Reflet-de-Lune,Reflet-de-Lune,Le garde funeste Métréon a rallié à sa cause les Satyres de Gangrebois et attaqué Reflet-de-Lune ! La retraite ne doit pas tomber entre les griffes de la Légion !,460,442,-1063.0605,4433.9707,3,70,4,3,50,1220,0,249,0,0,40362,157,108,760,3600,0,0,0,1800,89,0,493,0,1,0,0
1226,Alimentation du portail : Andu’talah,Val’sharah,Certains de nos anciens alliés ont succombé au Cauchemar. C’est notamment le cas des gardiennes dryades près d’Andu’talah.,335,225,3028.499,6792.29,3,70,4,3,50,1220,0,252,0,0,40362,157,108,760,3600,0,0,0,1800,89,0,7558,0,1,0,0
1227,Alimentation du portail : Kal’delar,Val’sharah,"L’oracle Maréen, une puissante ensorceleuse naga, a été vue en compagnie de Satyres sombrefiels. Tuez-les, elle et ses camarades.",320,163,4193.46,7076.4297,3,70,4,3,50,1220,0,252,0,0,40362,157,108,760,3600,0,0,0,1800,89,0,7558,0,1,0,0
1231,99.0 [reuse me],[PH],99.0 [reuse me],374,402,-295.89502,6053.54,3,70,4,3,5,1220,0,246,0,0,0,218,110,760,1800,0,0,0,100,26,0,7334,192,1,0,0
1232,[PH],[PH],[PH],204,541,-2909.9502,9264.27,3,70,4,2,10,1220,0,249,0,0,5703,218,110,760,7200,0,0,0,100,0,0,7534,192,1,0,0
1233,Relève au front,Rivage Brisé,Des prêtres de tout Azeroth aident nos alliés engagés au front depuis le début de l’invasion de la Légion ardente. Il est temps de leur envoyer des renforts.,547,438,-977.8203,2814.4004,3,70,4,3,50,1220,0,249,0,0,41887,185,100,760,3600,0,0,0,300,89,0,7543,0,1,0,0
1234,Terre sacrée : la chapelle de l’Espoir de Lumière,Maleterres de l’Est,"Depuis l’époque de l’Aube d’argent, la chapelle de l’Espoir de Lumière est un haut lieu de la Lumière sur Azeroth. Allez sur place et rapportez un fragment de Lumière.",456,438,-977.8203,4519.21,3,70,4,3,50,1220,0,249,0,0,41889,186,102,760,3600,0,0,0,600,89,0,139,0,1,0,0
1235,Terre sacrée : l’Exodar,L’Exodar,"Les prêtres de l’Exodar préservent les traditions de la Lumière. Récupérez un fragment de l’Exodar, mais prenez garde, car il attirera peut-être les troupes de la Légion.",457,439,-1006.2305,4490.8,3,70,4,3,50,1220,0,249,0,0,45162,186,102,760,3600,0,0,0,600,89,0,3557,0,1,0,0
1236,Terre sacrée : le tombeau d’Uther,Maleterres de l’Ouest,"Premier paladin de la Main d’argent, Uther le Porteur de Lumière n’a jamais trahi ses convictions. Sa tombe, sacrée pour les fidèles de la Lumière, attire parfois des esprits malveillants.",465,447,-1148.3018,4348.7305,3,70,4,3,50,1220,0,249,0,0,45163,186,102,760,3600,0,0,0,600,89,0,139,0,1,0,0
1237,Terre sacrée : Auchindoun,Auchindoun,"Loin sous Auchindoun, le Naaru D’ore se régénère et redevient peu à peu un être de Lumière pure. Cherchez son sanctuaire sacré.",459,442,-1063.0605,4462.379,3,70,4,3,50,1220,0,249,0,0,45164,186,102,760,3600,0,0,0,600,89,0,3917,0,1,0,0
1238,Terre sacrée : le Puits de soleil,Île de Quel’Danas,"La Légion est bien décidée à ce qu’on ne ravive jamais le feu follet, et veut nous empêcher de récupérer le dernier fragment.",459,439,-1006.2305,4462.379,3,70,4,3,50,1220,0,249,0,0,45165,186,102,760,3600,0,0,0,600,89,0,4075,0,1,0,0
1239,Infiltrer les rangs ennemis,Azeroth,"Si nous voulons voir s’accomplir la prophétie de Velen, nous devons infiltrer les rangs ennemis et chercher parmi eux d’éventuels alliés.",459,439,-1006.2305,4462.379,3,70,4,3,20,1220,0,249,0,0,41888,184,108,760,3600,0,0,0,1800,0,0,7502,0,1,0,0
1240,Luménite : Faronaar,Azsuna,Les érédars de Faronaar fabriquent des armes en luménite. Attaquez leurs forges et emparez-vous du métal afin de faire d’une pierre deux coups.,285,405,-352.72656,7729.939,3,70,4,3,50,1220,0,246,0,0,41890,187,108,760,3600,0,0,0,1800,89,0,7334,0,1,0,0
1241,Luménite : Suramar,Suramar,Les Sacrenuit de Suramar étudient les propriétés de la luménite pour déterminer si elle peut améliorer leurs assemblages. Introduisez-vous en ville et volez leurs réserves.,482,320,1238.4395,4036.1797,3,70,4,3,50,1220,0,251,0,0,44674,187,108,760,3600,0,0,0,1800,89,0,7637,0,1,0,0
1242,Luménite : Tornheim,Tornheim,Nos éclaireurs signalent que les Vrykuls ont mis la main sur une cache d’armes en luménite et comptent tout fondre afin de fabriquer des armures pour leurs drakes.,606,231,2914.8496,1706.2705,3,70,4,3,50,1220,0,250,0,0,44675,187,108,760,3600,0,0,0,1800,89,0,7541,0,1,0,0
1243,Luménite : rivage Brisé,Rivage Brisé,"Les démons ont abandonné des armes en luménite un peu partout sur le rivage Brisé. En faisant vite, nous pourrons les récupérer.",547,454,-1290.3701,2814.4004,3,70,4,3,50,1220,0,249,0,0,44676,187,108,760,3600,0,0,0,1800,89,0,7543,0,1,0,0
1244,Luménite : Vashj’ir,Vashj’ir,"Il y a longtemps, une cargaison de luménite est passée par-dessus bord lors d’une tempête à Vashj’ir. Malheureusement, les Nagas pourraient bien l’avoir trouvée avant nous.",456,445,-1119.8906,4519.21,3,70,4,3,100,1220,0,249,0,0,44677,187,108,760,3600,0,0,0,1800,89,0,5146,0,1,0,0
1245,Sécurisation de Mardum,"Mardum, les abysses Brisés",Il reste des poches de résistance démoniaques éparpillées à travers Mardum qui risquent de menacer le Marteau gangrené.,460,441,-1034.6494,4433.9707,3,70,4,3,20,1220,0,249,0,0,41925,188,102,760,3600,0,0,0,600,89,0,7502,0,1,0,0
1246,Où est passé Mathias ? Commencer par le commencement,Rivage Brisé,Nous devons déterminer où la Légion retient maître Mathias Shaw ; le rivage Brisé est l’endroit idéal où commencer nos recherches.,545,445,-1119.8906,2842.8096,3,70,4,3,50,1220,0,249,0,0,41972,189,108,760,3600,0,0,0,1800,89,0,7796,0,1,0,0
1247,Où est passé Mathias ? Le bastion du Freux,Val’sharah,Le seigneur de l’effroi Detheroc n’est pas né de la dernière pluie et fait déplacer Mathias. La piste mène au bastion du Freux. Dommage que vous ne l’ayez pas vu la dernière fois.,361,190,3682.0095,6309.26,3,70,4,3,50,1220,0,252,0,0,45171,189,108,760,3600,0,0,0,1800,89,0,7558,0,1,0,0
1248,Où est passé Mathias ? L’autel de la Fin des temps,Azsuna,"Le centre de commandement connu sous le nom d’autel de la Fin des temps flotte au-dessus de Faronaar, sur Azsuna. Tâchez de découvrir ce qui s’y trame.",361,377,158.72461,6309.26,3,70,4,3,50,1220,0,246,0,0,45172,189,108,760,3600,0,0,0,1800,89,0,7334,0,1,0,0
1249,Où est passé Mathias ? Les portes des Valeureux,Tornheim,La Légion ardente a un puissant allié en la personne de Skovald le Dieu-Roi des Vrykuls. Peut-être retiennent-ils Mathias aux portes des Valeureux ?,612,238,2772.7798,1592.6094,3,70,4,3,50,1220,0,250,0,0,45173,189,108,760,3600,0,0,0,1800,89,0,7541,0,1,0,0
1250,Où est passé Mathias ? SI:7,Hurlevent,Il semble que nous soyons dans une impasse. Il faut tenter l’impossible en nous infiltrant dans le QG du SI:7. Peut-être Detheroc a-t-il laissé des indices ?,456,439,-1006.2305,4519.21,3,70,4,3,50,1220,0,249,0,0,45174,189,108,760,3600,0,0,0,1800,89,0,1519,0,1,0,0
1251,Le sang de notre ennemi : Tornheim,Tornheim,"Les Gangremorgue, dont une brute colossale, Northamel le Fendeur, sont rassemblés aux portes des salles des Valeureux. Tuez Northamel et récupérez son sang.",595,225,3028.499,1905.1592,3,70,4,3,50,1220,0,250,0,0,42035,190,102,760,3600,0,0,0,600,89,0,7541,0,1,0,0
1252,Le sang de notre ennemi : Val’sharah,Val’sharah,Les druides de Val’sharah ne savent plus où donner de la tête entre les Satyres et le Cauchemar. Aidons-les en tuant les Satyres dirigés par le porte-peine Zizzifrax.,346,226,3000.0898,6593.401,3,70,4,3,50,1220,0,252,0,0,44565,190,102,760,3600,0,0,0,600,89,0,7558,0,1,0,0
1253,Le sang de notre ennemi : Haut-Roc,Haut-Roc,La Légion a profané les sites funéraires sacrés de la tribu de Haut-Roc en ramenant les morts à la vie. À nous de leur permettre de retrouver le repos.,471,172,4022.9795,4235.0703,3,70,4,3,50,1220,0,248,0,0,44566,190,102,760,3600,0,0,0,600,89,0,7503,0,1,0,0
