ID,Name_lang,Description_lang,GarrAbilityCategoryID,GarrFollowerTypeID,IconFileDataID,FactionChangeGarrAbilityID,Flags
4,Tueur d’Orcs,Augmente les chances de succès lorsque le sujet combat des Orcs.,1,1,897144,0,1
5,Blizzard,Permet à un mage d’infliger des dégâts à de nombreux ennemis.,0,1,135857,0,0
6,Pavois,Permet à un guerrier de réduire fortement les dégâts.,0,1,132362,0,0
7,Montagnard,Augmente les chances de succès lorsque le sujet combat en montagne.,6,1,236848,0,1
8,Sang froid,Augmente les chances de succès lorsque le sujet combat dans la neige.,6,1,236833,0,1
9,Habitué du désert,Augmente les chances de succès lorsque le sujet combat dans le désert.,6,1,236846,0,1
10,Saut de foi,Permet à un prêtre d’aider la cible à échapper au danger (ou juste l’embêter).,0,1,463835,0,0
11,Prière de soins,Permet à un prêtre de soigner un groupe d’alliés.,0,1,135943,0,0
29,Bon élève,Augmente de 50 % la quantité d’expérience accumulée par ce sujet pendant les missions.,7,1,236225,0,33
30,Meneur naturel,Augmente l’expérience gagnée par les sujets pendant les missions.,0,1,236362,0,3
36,Tueur de démons,Augmente les chances de succès lorsque le sujet combat des démons.,1,1,254651,0,1
37,Tueur de bêtes,Augmente les chances de succès lorsque le sujet combat des bêtes.,1,1,298659,0,1
38,Tueur d’ogres,Augmente les chances de succès lorsque le sujet combat des Ogres.,1,1,236695,0,1
39,Tueur de primordiaux,Augmente les chances de succès lorsque le sujet combat des ennemis primordiaux et leurs sbires.,1,1,254105,0,1
40,Tueur de Gronns,Augmente les chances de succès lorsque le sujet combat des briseurs et leurs sbires.,1,1,236412,0,1
41,Tueur de furies,Augmente les chances de succès lorsque le sujet combat des fureurs élémentaires.,1,1,254652,0,1
42,Tueur du Vide,Augmente les chances de succès lorsque le sujet combat des aberrations et des Morts-vivants.,1,1,298680,0,1
43,Tueur d’arakkoa,Augmente les chances de succès lorsque le sujet combat des arakkoa et leurs sbires.,1,1,952507,0,1
44,Naturaliste,Augmente les chances de succès lorsque le sujet combat dans la forêt.,6,1,236830,0,1
45,Troglodyte,Augmente les chances de succès lorsque le sujet combat sous terre.,6,1,409595,0,1
46,Guérillero,Augmente les chances de succès lorsque le sujet combat dans la jungle.,6,1,236850,0,1
47,Maître assassin,Octroie un bonus très important aux chances de succès des missions.,11,1,458726,0,19
48,Marcheur des marais,Augmente les chances de succès lorsque le sujet combat dans un marais.,6,1,236819,0,1
49,Coureur des plaines,Augmente les chances de succès lorsque le sujet combat dans les plaines.,6,1,236712,0,1
52,Minage,Améliore la production des commandes lors de son assignation à la mine.,5,1,4620679,0,33
53,Herboristerie,Apporte des améliorations en herboristerie et améliore la production des commandes lors de son assignation au jardin de simples.,5,1,4620675,0,33
54,Alchimie,Propose diverses améliorations en alchimie lors de son assignation au laboratoire d’alchimie et augmente les chances de réussite des missions d’alchimie.,5,1,4620669,0,33
55,Forge,Permet de réduire la perte de durabilité de vos objets et améliore la production des commandes lors de son assignation à la forge et augmente les chances de réussite des missions de forge.,5,1,4620670,0,33
56,Enchantement,Propose diverses améliorations en enchantement lors de son assignation au cabinet d’enchanteur et augmente les chances de réussite des missions d’enchantement.,5,1,4620672,0,33
57,Ingénierie,"Vend des gadgets d’ingénierie, améliore la production des commandes lors de son assignation au pôle d’ingénierie et augmente les chances de réussite des missions d’ingénierie.",5,1,136243,0,33
58,Calligraphie,"Permet de créer des documents spéciaux et améliore la production des commandes lors de son assignation à l’étude de scribe, et augmente les chances de réussite des missions de calligraphie.",5,1,4620676,0,33
59,Joaillerie,Propose diverses améliorations en joaillerie lors de son assignation à la boutique de gemmes et augmente les chances de réussite des missions de joaillerie.,5,1,4620677,0,33
60,Travail du cuir,"Vous permet de créer des tentes, améliore la production des commandes lors de son assignation à la tannerie et augmente les chances de réussites des missions de travail du cuir.",5,1,4620678,0,33
61,Couture,Propose diverses améliorations en couture lors de son assignation à l’atelier de couture et augmente les chances de réussite des missions de couture.,5,1,4620681,0,33
62,Dépeçage,Améliore la production des commandes suivant le niveau du sujet si vous l’affectez à la grange.,5,1,4620680,0,33
63,Ami des Gnomes,Augmente les chances de succès lors des missions avec un Gnome.,4,1,236446,73,9
64,Humaniste,Augmente les chances de succès lors des missions avec un Humain.,4,1,236447,71,9
65,Barbophile,Augmente les chances de succès lors des missions avec un Nain.,4,1,236443,70,9
66,Enfant d’Élune,Augmente les chances de succès lors des missions avec un Elfe de la nuit.,4,1,236450,74,9
67,Allié d’Argus,Augmente les chances de succès lors des missions avec un Draeneï.,4,1,236442,72,9
68,Cynophile,Augmente les chances de succès lors des missions avec un Worgen.,4,1,528692,75,9
69,Boit-sans-soif,Augmente les chances de succès lors des missions avec un Pandaren.,4,1,626190,0,1
70,Rejeton de Draenor,Augmente les chances de succès lors des missions avec un Orc.,4,1,236451,65,5
71,Fascination morbide,Augmente les chances de succès lors des missions avec un Mort-vivant.,4,1,236457,64,5
72,Totémiste,Augmente les chances de succès lors des missions avec un Tauren.,4,1,236454,67,5
73,Zélote vaudou,Augmente les chances de succès lors des missions avec un Troll.,4,1,236456,63,5
74,Elficacité,Augmente les chances de succès lors des missions avec un Elfe de sang.,4,1,236440,66,5
75,Économiste,Augmente les chances de succès lors des missions avec un Gobelin.,4,1,632354,68,5
76,Bonne endurance,Augmente les chances de succès lors des missions dont la durée est supérieure à 7 heures.,8,1,135987,0,1
77,Sursaut de puissance,Augmente les chances de succès lors des missions dont la durée est inférieure à 7 heures.,8,1,136088,0,1
78,Loup solitaire,Augmente les chances de succès lors des missions en solo.,9,1,538568,0,3
79,Ferrailleur,Augmente de 100% la quantité de ressources de fief obtenues pendant les missions.,7,1,413571,0,1
80,Entraînement additionnel,Augmente de 30% l’expérience gagnée par tous les sujets pendant les missions.,7,1,975743,0,1
100,Provocation,Force un ennemi à attaquer le guerrier.,0,1,136080,0,0
101,Flèches multiples,Permet à un chasseur de blesser de nombreux ennemis.,0,1,132330,0,0
102,Bond héroïque,Permet à un guerrier d’échapper rapidement au danger.,0,1,236171,0,0
103,Tir rapide,Augmente considérablement les dégâts en rafale du chasseur.,0,1,132208,0,0
104,Assommer,Permet à un voleur de neutraliser un ennemi dangereux (ou juste vous ennuyer).,0,1,132310,0,0
105,Coup de pied,Permet à un voleur d’interrompre un sort (super frustrant).,0,1,132219,0,0
106,Salve de guérison,Permet à un chaman de soigner un groupe d’alliés.,0,1,136042,0,0
107,Purifier l’esprit,Permet à un chaman d’annuler un effet magique néfaste.,0,1,236288,0,0
108,Grondement,Force la cible à attaquer le druide.,0,1,132270,0,0
114,Sombre ordre,Force la cible à attaquer le chevalier de la mort.,0,1,136088,0,0
115,Bouclier d’os,Protège le chevalier de la mort avec un bouclier d’os.,0,1,458717,0,0
116,Mort et décomposition,Permet à un chevalier de la mort de blesser de nombreux ennemis.,0,1,136144,0,0
117,Gel de l’esprit,Gèle le cerveau de l’adversaire pour interrompre un sort.,0,1,237527,0,0
118,Renforcer l’arme runique,Augmente considérablement les dégâts en rafale du chevalier de la mort.,0,1,135372,0,0
119,Carapace anti-magie,Protège le chevalier de la mort des effets magiques néfastes.,0,1,136120,0,0
120,Enchaînement,Permet à un guerrier de blesser plusieurs ennemis. Sert également à décrire toutes les équipes d’arène.,0,1,132338,0,0
121,Volée de coups,Permet à un guerrier d’interrompre un sort.,0,1,132938,0,0
122,Témérité,Permet à un guerrier d’augmenter fortement les dégâts en rafale.,0,1,603532,0,0
123,Rétribution,Force la cible à attaquer le paladin.,0,1,135984,0,0
124,Bouclier divin,Permet à un paladin d’éviter de subir des dégâts. Sert aussi à s’échapper comme un lâche (honteux).,0,1,524354,0,0
125,Epuration,Permet à un paladin d’annuler un effet magique néfaste.,0,1,135949,0,0
126,Réprimandes,Permet à un paladin d’interrompre un sort.,0,1,523893,0,0
127,Repentir,Permet à un paladin de neutraliser un ennemi dangereux.,0,1,135942,0,0
128,Radiance sacrée,Permet à un paladin de soigner un groupe d’alliés.,0,1,457654,0,0
129,Supplique divine,Permet à un paladin de régénérer rapidement du mana.,0,1,237537,0,2
130,Tempête divine,Permet à un paladin d’infliger des dégâts à de nombreux ennemis.,0,1,236250,0,0
131,Courroux vengeur,Permet à un paladin d’augmenter fortement les dégâts en rafale.,0,1,135875,0,0
132,Ecorce,"La peau du druide durcit, réduisant considérablement les dégâts subis.",0,1,136097,0,0
133,Innervation,Permet à un druide de régénérer rapidement le mana de la cible.,0,1,136048,0,2
134,Sarments,Permet à un druide de neutraliser un ennemi dangereux.,0,1,136100,0,0
135,Croissance sauvage,Permet à un druide de soigner un groupe d’alliés.,0,1,236153,0,0
136,Soins naturels,Permet à un druide d’annuler un effet magique néfaste.,0,1,236288,0,0
137,Ouragan,Permet à un druide de blesser de nombreux ennemis.,0,1,136018,0,0
138,Berserk,Augmente considérablement les dégâts en rafale du druide.,0,1,236149,0,0
139,Alignement céleste,Augmente considérablement les dégâts en rafale du druide.,0,1,136060,0,0
140,Persiflage,Force l’ennemi à attaquer le moine.,0,1,620830,0,0
141,Garde,Permet à un moine de réduire considérablement les dégâts.,0,1,611417,0,0
142,Onde de chi,Permet à un moine de soigner un groupe d’alliés.,0,1,606541,0,0
143,Roulade,Permet à un moine de se mettre rapidement hors de danger.,0,1,574574,0,0
144,Paralysie,Permet à un moine de neutraliser un ennemi dangereux.,0,1,629534,0,0
145,Détoxification,Permet à un moine d’annuler un effet magique néfaste.,0,1,460692,0,0
146,Thé de mana,Permet à un moine de régénérer rapidement le mana de la cible.,0,1,608949,0,2
147,Pique de main,Permet à un moine d’interrompre un sort.,0,1,608940,0,0
148,Dissipation de la magie,Permet à un prêtre d’annuler un effet magique néfaste.,0,1,135894,0,0
149,Ombrefiel,Permet à un prêtre d’augmenter fortement les dégâts en rafale et la régénération du mana.,0,1,136199,0,2
150,Incandescence mentale,Permet à un prêtre de blesser de nombreux ennemis.,0,1,237565,0,0
151,Emprise,Permet à un prêtre de neutraliser un ennemi dangereux. Très populaire dans le bassin Arathi et dans l’Œil du cyclone.,0,1,136206,0,0
152,Infusion de puissance,Permet à un prêtre d’augmenter fortement les dégâts en rafale.,0,1,135939,0,0
153,Bouclier d’eau,Permet à un chaman d’augmenter fortement la régénération de mana.,0,1,132315,0,2
154,Chaîne d’éclairs,Permet à un chaman de blesser de nombreux ennemis.,0,1,136015,0,0
155,Cisaille de vent,Permet à un chaman d’interrompre un sort.,0,1,463565,0,0
156,Loup fantôme,Permet à un chaman de se mettre rapidement hors de danger.,0,1,136095,0,0
157,Maléfice,Permet à un chaman de neutraliser un ennemi dangereux. Le fait aussi se sentir stupide.,0,1,237579,0,0
158,Ascendance,Permet à un chaman d’augmenter fortement les dégâts en rafale. Peut parfois paraître injuste.,0,1,135791,0,0
159,Évasion,Permet à un voleur d’éviter des dégâts considérables.,0,1,136205,0,0
160,Sprint,Permet à un voleur de se mettre hors de danger. Ou à se déplacer rapidement entre la boîte aux lettres et l’hôtel des ventes.,0,1,132307,0,0
161,Éventail de couteaux,Permet à un voleur de blesser de nombreux ennemis.,0,1,236273,0,0
162,Désigné pour mourir,Permet à un voleur d’augmenter fortement les dégâts en rafale.,0,1,236364,0,0
163,Feindre la mort,Permet à un chasseur de forcer l’ennemi à attaquer une autre cible.,0,1,132293,0,0
164,Dissuasion,Permet à un chasseur d’éviter les dégâts.,0,1,132369,0,0
165,Désengagement,Permet à un chasseur de se mettre rapidement hors de danger.,0,1,132294,0,0
166,Tir de riposte,Permet à un chasseur d’interrompre un sort.,0,1,249170,0,0
167,Piège givrant,Permet à un chasseur de neutraliser un ennemi dangereux. Regardez où vous mettez les pieds !,0,1,135834,0,0
168,Bloc de glace,Permet à un mage d’éviter des dégâts considérables. Temporairement.,0,1,135841,0,0
169,Invocation de nourriture,Votre corps a besoin d’énergie pour fonctionner à plein régime !,0,1,609812,0,2
170,Transfert,Permet à un mage de se téléporter rapidement hors de danger.,0,1,135736,0,0
171,Contresort,Permet à un mage d’interrompre un sort.,0,1,135856,0,0
172,Métamorphose,Permet à un mage de neutraliser un ennemi dangereux.,0,1,136071,0,0
173,Distorsion temporelle,Permet à un mage d’augmenter fortement les dégâts en rafale.,0,1,458224,0,0
174,Résolution interminable,Permet à un démoniste d’éviter des dégâts considérables.,0,1,136150,0,0
175,Drain de vie,Permet à un démoniste de récupérer de la vie. Sans blague.,0,1,136169,0,0
176,Brûle-magie,Permet à un diablotin agaçant d’annuler un effet magique néfaste.,0,1,841219,0,0
177,Métamorphose,Permet à un démoniste de se prendre pour un chasseur de démons. Augmente fortement les dégâts en rafale.,0,1,236293,0,0
178,Pluie de feu,Permet à un démoniste de blesser de nombreux ennemis.,0,1,135804,0,0
179,Verrou magique,Permet à un démoniste d’interrompre un sort.,0,1,136174,0,0
180,Peur,"Permet de neutraliser un adversaire dangereux, ce qui l’amène parfois à violer les lois fondamentales de la physique. Étrange.",0,1,136183,0,0
181,Invocation : Infernal,Permet à un démoniste de se sentir puissant et d’infliger également des dégâts considérables. Rend très nerveux les innocents à proximité.,0,1,136219,0,0
182,Célérité,"Permet à un druide de se mettre rapidement hors de danger, comme si les représentants de cette classe ne bougeaient pas déjà assez vite.",0,1,132120,0,0
183,Infusion énergisante,Permet à un moine d’augmenter considérablement les dégâts en rafale. Et son goût est délicieux.,0,1,608938,0,0
199,Entraînement additionnel,Octroie un bonus d’expérience lorsqu’une mission est réussie.,0,1,236221,0,2
200,Entraînement additionnel,Octroie un bonus d’expérience lorsqu’une mission est réussie.,0,1,236221,0,2
201,Expérience du combat,Octroie un bonus aux chances de succès des missions.,11,1,458725,0,51
202,Expérience du combat,Octroie un bonus aux chances de succès des missions.,0,1,236221,0,2
203,Téléportation,Réduit le temps de voyage des missions.,0,1,236221,0,2
204,Téléportation,Réduit le temps de voyage des missions.,0,1,236221,0,2
205,Récupération des armes,Octroie un bonus en ressources de fief lorsqu’une mission est réussie.,0,1,236221,0,2
206,Récupération des armes,Octroie un bonus en ressources de fief lorsqu’une mission est réussie.,0,1,236221,0,2
221,Monture épique,Réduit le temps de voyage des missions de 50%.,8,1,631718,0,1
222,Propulsé par la mort,Réduit la durée des missions de 25%.,0,1,575534,0,3
227,Pêcheur,"Grâce aux connaissances de Nat, votre compétence en pêche vous permet d’attraper des malabars de Draenor sans appât.",5,1,236574,0,19
228,Verpérenne,"Lorsqu’il est assigné à la scierie, traite le bois de façon plus efficace, et surtout beaucoup plus humaine.",5,1,236160,0,19
231,Garde du corps,Vous accompagne et vous protège en Draenor si vous l’affectez à une caserne de niveau 2 ou 3.,5,1,1037260,0,19
232,Danseur,Votre agilité naturelle vous permet de sortir des zones dangereuses un tout petit peu plus vite.,12,1,132171,0,3
236,Pro de Hearthstone,Un maître tacticien à suivre absolument. Sa présence augmente de 35 % la vitesse à laquelle les membres du groupe accumulent de l’expérience.,7,1,1061040,0,3
244,Brute,Augmente fortement les chances de succès lors des missions solo.,9,1,1035504,0,19
248,Mentor,Les sujets qui l’accompagnent bénéficient de l’efficacité au combat de ce sujet.,7,1,442732,0,19
249,Explorateur extraordinaire,"Expert en connaissance des bêtes et en exploration du terrain, Harrison anticipe tous les dangers.



|cFFFFD200« Fortune et gloire, petit. Fortune et gloire. » – Harrison Jones |r",0,1,646781,0,18
250,Vitesse de la Lumière,La plume de Rukhmar touchée par le soleil donne à un sujet une vitesse épique.,8,1,642580,0,3
252,Pote ogre,Augmente les chances de succès lors des missions avec un Ogre.,4,1,1030796,0,3
253,Afficionado mécano,Augmente les chances de succès lors des missions avec un assemblage ou une machine.,4,1,254104,0,3
254,Ornithologue,Augmente les chances de succès lors des missions avec un Arakkoa.,4,1,1042646,0,3
255,Sauvageon,Augmente les chances de succès lors des missions avec un compagnon bestial.,4,1,134176,0,3
256,Récupérateur extrême,Augmente de 200% le montant de ressources de fief obtenues en mission.,7,1,1005027,0,1
257,Test - Temporary Follower Ability,Description de technique de sujet temporaire. Dure une mission.,0,1,463852,0,65
260,Groupe d’abordage,Permet aux transporteurs d’effectuer des missions nécessitant du personnel au sol.,0,2,1141393,0,51
261,Sous-marin,Permet aux sous-marins de s’approcher des navires ennemis sans être détectés par leurs radars.,0,2,1141396,0,51
262,Cuirassé,Tire des munitions antiblindage capables de transpercer l’armure.,0,2,1141390,0,51
263,Destroyer,Largue des obus explosifs dans l’eau pour détruire les embarcations submergées.,0,2,1141395,0,51
264,Porte-nefs,Une flotte de bombardiers qui peut attaquer depuis les airs.,0,2,1141394,0,51
265,Brise-glace,Permet de se frayer un chemin dans les eaux gelées.,0,2,892834,0,0
266,Pompe de cale,"Pompe l’excès d’eau hors du bateau, ce qui lui permet de rester à flot par temps orageux.",0,2,986488,0,0
267,Lumières antibrouillard à haute intensité,Transperce le brouillard (et peut-être quelques rétines) avec ces phares super lumineux.,0,2,460953,0,0
268,Stabilisateur interne gyroscopique,"Redresse et stabilise le navire, lui permettant de se déplacer plus aisément dans les tourbillons chaotiques.",0,2,657937,0,0
269,Haut-fourneau,"Un énorme fourneau, capable de produire une puissance de 11 sur 10.",0,2,900306,0,0
270,Gouvernail en vérifer,"Renforce le gouvernail, permettant de prendre des virages plus serrés et à plus grande vitesse.",0,2,986491,0,0
271,Cuve de requins entraînés,Aucune mine ne saurait faire face à une cuve pleine de requins entraînés.,0,2,294472,0,0
272,Lanceur de gangrefumée,"Crée un écran de fumée autour de votre navire, bloquant la vue lors d’une frappe initiale.",0,2,627487,0,0
273,Réservoirs de nitro carburant,"Permet au navire de consommer du nitro carburant, afin de se rendre sur le lieu de la mission et d’en revenir plus rapidement. Réduit le temps de voyage des missions de 50%.",0,2,237030,0,18
274,Équipage expérimenté,Cet équipage a tout vu et peut le prouver. Octroie un bonus aux chances de succès des missions.,0,2,669453,0,18
275,Insubmersible,Équipe le navire d’un bouclier impénétrable qui se déclenche lorsqu’un tir dévastateur vise le navire. Insubmersible est détruit lors de son déclenchement.,0,2,1030102,0,2
276,Compartiment de stockage de nourriture,"Ajoute un espace de rangement supplémentaire pour la nourriture, ce qui améliore les chances de succès lors des longues missions.",0,2,651578,0,18
277,Scanner aérien automatisé,Augmente les chances de succès lors des missions avec un porte-nefs.,0,2,133873,0,0
278,Réserves de munitions,Augmente les chances de succès lors des missions avec un cuirassé.,0,2,249177,0,0
279,Champ d’amplification sonore,Augmente les chances de succès lors des missions avec un destroyer.,0,2,252188,0,0
280,Quartiers supplémentaires,Augmente les chances de succès lors des missions avec un transporteur.,0,2,133004,0,0
281,Mines sonores Q-43,Augmente les chances de succès lors des missions avec un sous-marin.,0,2,948864,0,0
282,Équipage orc,Les eaux qui encerclent Givrefeu sont depuis longtemps un terrain d’entraînement à la navigation en eaux glacées.,0,2,236452,284,5
283,Équipage nain,Permet de récupérer de l’équipement naval pour les missions réussies.,0,2,236443,286,9
284,Équipage draenique,Les Draeneï ont l’habitude de naviguer à travers le brouillard dense qui entoure la vallée d’Ombrelune.,0,2,236442,282,9
285,Équipage tauren,Augmente de 50% l’expérience gagnée par tous les navires pendant les missions.,0,2,236453,291,5
286,Équipage gobelin,Permet de récupérer de l’équipement naval pour les missions réussies.,0,2,632354,283,5
287,Équipage gnome,Permet de récupérer de l’équipement naval lors des missions réussies.,0,2,236446,290,9
288,Équipage elfe de la nuit,Réduit le temps de voyage des missions de 50%.,0,2,236450,289,9
289,Équipage elfe de sang,Réduit le temps de voyage des missions de 50%.,0,2,236439,288,5
290,Équipage troll,Permet de récupérer de l’équipement naval lors des missions réussies.,0,2,236456,287,5
291,Équipage worgen,Augmente de 50% l’expérience gagnée par tous les navires pendant les missions.,0,2,463876,285,9
292,Équipage Humain,Augmente les chances de succès pendant les missions.,0,2,236447,293,9
293,Équipage mort-vivant,Augmente les chances de succès pendant les missions.,0,2,236457,292,5
294,Équipage pandaren,"Les équipages pandarens emportent des réserves supplémentaires sur leurs navires, ce qui leur permet de mieux supporter les longues missions.",0,2,626190,0,1
299,Compartiment d’équipement vide,Installe l’équipement d’un navire dans ce compartiment.,0,2,0,0,2
300,Compartiment d’équipement vide,Installe l’équipement d’un navire dans ce compartiment.,0,2,0,0,2
303,Connaissance démoniaque,Octroie un important bonus aux chances de succès des missions.,11,1,1020342,0,51
304,Module de récupération d’épaves,"Déployé lors des missions réussies, il drague les eaux environnantes et remonte une caisse pleine de débris utiles.",0,2,236815,0,18
305,Filet de pêche rohart,"Filet de pêche attaché à l’arrière d’un navire, gracieusement fourni par les roharts. Procure du poisson au retour d’une mission réussie.",0,2,134325,0,2
306,Longue-vue fantomatique,Une longue-vue qui semble ne rien montrer quand on regarde au travers. Elle sera peut-être utile plus tard.,0,2,134441,0,2
307,Ruée fulgurante,Bondit sur un ennemi. Parfois utilisé sur des bestioles pour se déplacer rapidement.,0,4,135788,0,0
308,Nova du chaos,Les chasseurs de démons s’en servent pour contrôler simultanément plusieurs ennemis dangereux.,0,4,135795,0,0
309,Peau de pierre,La peau des chasseurs de démons peut se recouvrir de pierre gangrenée pour absorber les coups les plus dévastateurs. Notoirement inconfortable.,0,4,538745,0,0
310,Immolation,Certains chasseurs de démons prennent l’expression « combattre le feu par le feu » un peu trop au premier degré.,0,4,135817,0,0
311,Dévorer la magie,La magie est une vraie gourmandise pour les Illidari qui affirment qu’elle aurait goût de poulet.,0,4,236298,0,0
312,Retraite vengeresse,Technique utilisée par les chasseurs de démons qui n’étaient… pas prêts.,0,4,236171,0,0
313,Métamorphose,Les chasseurs de démons peuvent déchaîner leur démon intérieur pour triompher des adversaires les plus redoutables.,0,4,237558,0,0
314,Mécano,Augmente la quantité de carburant obtenu pendant les missions de 100%.,7,1,252178,0,1
315,Equipage murloc,"Les Murlocs peuvent quitter leur navire et nager jusqu’au rivage, même sous l’eau, tout en continuant de servir de transport. Cela a des avantages d’être amphibien.",0,2,134169,0,3
317,Tempête apogide,Le kraken libéré dans cette zone octroie des cristaux apogides lorsqu’une mission est un succès.,0,2,1061300,0,2
318,Supériorité aérienne,"Un vaisseau aérien repère et attaque les navires hostiles dans la zone, augmentant ainsi les chances de succès des missions.",0,2,342918,0,2
319,Commandement du capitaine Reania,Augmente de 50% l’expérience gagnée par tous les navires pendant les missions.,0,2,1139028,0,2
320,Carte au trésor,Confère des cristaux apogides supplémentaires pour une mission réussie.,0,2,237386,0,2
321,Commandement du capitaine Throkash,Augmente de 50% l’expérience gagnée par tous les navires pendant les missions.,0,2,1126434,0,2
322,Corsaire intrépide,Augmente les chances de succès pendant les missions.,0,2,1126433,0,2
323,Groupe d’abordage,Permet aux transporteurs d’effectuer des missions nécessitant du personnel au sol.,0,2,1141392,0,51
324,Prédateur dominant,Augmente fortement les chances de succès lorsque le sujet combat de nombreux types de créatures.,1,1,236186,0,19
325,Exorciste,Octroie un bonus aux chances de succès des missions et augmente les chances de succès lorsque le sujet combat des démons.,1,1,236262,0,19
326,Atténuation apogide,Augmente la quantité de cristaux apogides obtenus pendant les missions de 100%.,7,1,1061300,0,19
327,Équipage arakkoa,Peut lancer des attaques depuis les airs.,0,2,1042646,0,3
331,Élémentaire,Un lanceur de sorts qui utilise les forces destructrices de la nature et des éléments pour contrer certains |C00b3ffffboss|R.,0,4,136048,0,560
