ActivityName_lang,Description_lang,ID,CriteriaTreeID,ThresholdContributionAmount,Supersedes,Priority
Achever la suite de quêtes La reconquête de Gilnéas,Parlez à Genn Grisetête à Hurlevent ou à Calia Menethil dans la forêt des Pins-Argentés pour commencer cette suite de quêtes.,520,153375,150,0,0
Accomplir 5 expéditions des archives d’Azeroth,Accomplissez des expéditions des archives d’Azeroth sur les îles aux Dragons.,521,153597,50,0,0
Accomplir 15 expéditions des archives d’Azeroth,Accomplissez des expéditions des archives d’Azeroth sur les îles aux Dragons.,522,153609,150,521,0
Faire /signe à l’approvisionneuse Aristta,Faites /signe à l’approvisionneuse Aristta à l’académie d’Algeth’ar.,523,153611,50,0,0
Accomplir 1 grande fouille des archives d’Azeroth,Terminez une grande fouille des archives d’Azeroth sur les îles aux Dragons.,524,153632,50,0,0
Accomplir 5 grandes fouilles des archives d’Azeroth,Terminez des grandes fouilles des archives d’Azeroth sur les îles aux Dragons.,525,153634,150,524,0
Gagner un combat de mascottes avec une mascotte ravissante.,"Gagnez un combat de mascotte avec la phalène cherche-coeur, Colportecœur ou l’oisillon inséparable.",526,154011,50,0,0
Gagner un combat de mascottes avec les trois mascottes ravissantes.,"Gagnez un combat de mascottes avec la phalène cherche-coeur, Colportecœur et l’oisillon inséparable.",527,154013,100,526,0
Gagner 10 points de connaissance de métier,Gagnez de la connaissance des îles aux Dragons avec n’importe quel métier de collecte ou de fabrication.,528,154015,50,0,0
Gagner 25 points de connaissance de métier,Gagnez de la connaissance des îles aux Dragons avec n’importe quel métier de collecte ou de fabrication.,529,154027,100,528,0
Accomplir 15 expéditions en mode Guerre,,530,154039,50,0,0
Alchimie des îles aux Dragons : faire une découverte,"Comme alchimiste, découvrez une nouvelle recette des îles aux Dragons par expérimentation.",531,154041,50,0,0
Essayer les scénarios de Dragonflight,"Terminez une faille temporelle, un festin tribal ou une superfloraison.",532,154043,100,0,0
De l’amour dans l’air : achever les 6 quêtes journalières,"Du {EventStartDate} au {EventEndDate}, achevez toutes les quêtes journalières suivantes :",533,154051,100,0,0
De l’amour dans l’air : achever l’histoire de la Cie de Chimie La Royale,"Du {EventStartDate} au {EventEndDate}, achevez toutes les quêtes suivantes :",534,154061,100,0,0
De l’amour dans l’air : don au Consortium d’artisanat,"Du {EventStartDate} au {EventEndDate}, faites un don important au Consortium d’artisanat au Gala des cadeaux.",535,154065,25,0,0
De l’amour dans l’air : découvrir le véritable soulagement,"Du {EventStartDate} au {EventEndDate}, atteignez 250 cumuls de Soulagement de la frustration en attaquant les mannequins dans la quête Un don de soulagement.",536,154067,50,0,0
De l’amour dans l’air : jeter des pétales de rose sur les joueurs,"Du {EventStartDate} au {EventEndDate}, jetez une poignée de pétales de rose sur chacune des classes suivantes :",537,154069,50,0,0
De l’amour dans l’air : lancer des explosions lumineuses roses en portant une rose,"Du {EventStartDate} au {EventEndDate}, lancez 5 explosions lumineuses rose en portant une rose colorée du Gala des cadeaux.",538,154083,25,0,0
De l’amour dans l’air : aimez-vous vous-même,"Du {EventStartDate} au {EventEndDate}, achevez Un don pour soi de trois manière différentes.",539,154085,100,0,0
Fête lunaire : achever la quête Préservation lunaire,"Du {EventStartDate} au {EventEndDate}, parlez à Myraël Lunefleur à Reflet-de-Lune pour commencer la quête.",540,154089,50,0,0
Fête lunaire : obtenir une pierre de lune des anciens,"Du {EventStartDate} au {EventEndDate}, trouvez une pierre de lune des anciens dans une enveloppe rouge porte-bonheur offerte par les anciens partout sur Azeroth.",541,154091,50,0,0
Fête lunaire : obtenir 10 pierres de lune des anciens,"Du {EventStartDate} au {EventEndDate}, trouvez 10 pierres de lune des anciens dans des enveloppes rouges porte-bonheur offertes par les anciens partout sur Azeroth",542,154093,150,541,0
Fête lunaire : manger des raviolis et lancer un pétard,"Du {EventStartDate} au {EventEndDate}, mangez une portion de raviolis de fête et lancez un pétard de fête.",543,154095,25,0,0
Foire de Sombrelune : remporter 1 partie de jeu d’arcade,"Du 4 au 10 février, remportez 1 partie d’un des jeux d’arcade suivants sur l’île de la foire de Sombrelune.",544,154101,25,0,0
Foire de Sombrelune : remporter 5 parties de jeu d’arcade,"Du 4 au 10 février, remportez 5 parties des jeux d’arcade suivants sur l’île de la foire de Sombrelune.",545,154105,50,544,0
Terminer des donjons avec sujets avec chaque rôle,"Terminer des donjons avec sujets avec les spécialisations tank, soins et dégâts.",546,154140,100,0,0
"Gagner 10 niveaux avec un personnage prêtre, chaman ou druide",,547,154146,100,0,0
Raviver les braseros de Maldraxxus,Accomplissez l’expédition Appel aux champions à Maldraxxus.,548,154148,25,0,0
Anniversaire du comptoir : acheter une nouvelle transmogrification au comptoir,,549,154150,25,0,0
Anniversaire du comptoir : jouer avec votre nouveau jouet,Utilisez l’un des jouets du catalogue du comptoir de l’année dernière listés ci-dessous :,550,154152,25,0,0
Anniversaire du comptoir : gagner des combats de mascottes avec des mascottes du comptoir,Gagnez des combats de mascottes avec au moins une mascotte du catalogue du comptoir de l’année dernière.,551,154156,50,0,0
Anniversaire du comptoir : célébrer en mangeant et en dansant,Mangez du gumbo gobelin et utilisez le jouet D.I.S.C.O.,552,154158,25,0,0
De l’amour dans l’air : pique-nique aux destinations de rêve,"Du {EventStartDate} au {EventEndDate}, partagez un panier à pique-nique romantique à chaque destination proposée par le portail du refuge panoramique.",553,154162,50,0,0
Organiser une réception de la cour des Braises,"Comme membre de la congrégation des Venthyrs, parlez au contremaître Plannulaire à Tombe-Vice pour débloquer la cour des Braises.",554,154196,50,0,0
Organiser 5 réceptions de la cour des Braises,"Comme membre de la congrégation des Venthyrs, parlez au contremaître Plannulaire à Tombe-Vice pour débloquer la cour des Braises.",555,154198,100,554,0
"Prendre une photo de P.R.O.F.I.L. avec une tiare, un haut-de-forme ou un monocle",Parlez à Arielle Instaglam à Hurlevent ou à Vivica Taplapose à Orgrimmar pour obtenir l’appareil photo P.R.O.F.I.L.,556,154204,25,0,0
Restons civils,Buvez les thés listés ci-dessous :,557,154206,50,0,0
Achever des quêtes à Suramar,,558,154214,100,0,0
Gagner un duel avec un look qui tue,"Battez un autre personnage-joueur en duel en portant une tiare, un haut-de-forme ou un monocle.",559,154218,25,0,0
Gagner 5 duels avec un look qui tue,"Battez d’autres personnages-joueurs en duels en portant une tiare, un haut-de-forme ou un monocle.",560,154220,50,559,0
Vous /incliner devant votre adversaire de l’arène,,561,154222,25,0,0
Voyage en première classe,Dépensez un total de 25 pièces d’or auprès des maîtres et maîtresses de vol et d’autres services de transport.,562,154224,25,0,0
Tailler |A:Professions-Icon-Quality-Tier3-Small:16:16|a gemmes de Dragonflight,,563,154226,50,0,0
Pêcher une pièce des îles,,564,154228,50,0,0
"Gagner 10 niveaux avec un personnage démoniste, mage ou paladin",,565,154233,100,0,0
Gagner un combat de mascottes en JcJ avec 3 mascottes humanoïdes,,566,154235,75,0,0
Goûter aux plats raffinés du Festin rubis,Goûtez 5 plats du Festin rubis à Valdrakken.,567,154237,25,0,0
Terminer l’évènement de l’échiquier à Karazhan,,568,154258,75,0,0
Dire à votre sujet de donjon qu’il est /magnifique,Adressez l’emote /magnifique à un sujet dans un donjon avec sujets.,569,154260,25,0,0
Obtenir votre diplôme de l’académie d’Algeth’ar en smoking complet,"Triomphez de l’écho de Doragosa en portant une veste, une chemise et un pantalon de smoking.",570,154262,50,0,0
Vous /incliner ou faire une /courbette devant des nobles élégants et élégantes de la cour des Étoiles,,571,154264,25,0,0
Foire de Sombrelune : acheter une tenue de noble ou utiliser l’emote /frime avec votre tenue,"Du 3 au 9 mars, achetez un article de noble à la mode auprès de Chester ou utilisez l’emote /frime devant lui en tenue de noble complète.",572,154267,75,0,0
Foire de Sombrelune : découvrir votre bonne aventure,"Du 3 au 9 mars, obtenez votre bonne aventure de la part de Sayge sur l’île de la foire de Sombrelune.",576,154288,25,0,0
