ActivityName_lang,Description_lang,ID,CriteriaTreeID,ThresholdContributionAmount,Supersedes,Priority
Foire de Sombrelune : terminer Il est temps de cogner,"Du {EventStartDate} au {EventEndDate}, accomplissez la quête Il est temps de cogner sur l’île de la foire de Sombrelune.",341,147895,50,0,0
Foire de Sombrelune : faire un tour,"Du {EventStartDate} au {EventEndDate}, faites un tour de manège ou de montagnes russes sur l’île de la foire de Sombrelune.",342,147897,50,0,0
/danser avec un client ou une cliente du Trésor du dragon,"Utilisez l’emote /danser avec un participant ou une participante à la fête dansante du Trésor du dragon, à Valdrakken.",343,147900,50,0,0
RdR : terminer un raid avec votre chapeau de fête rose,Terminez un scénario de recherche de raid en portant le chapeau de fête rose.,344,147905,50,0,0
Fête des Brasseurs : terminer 2 quêtes de la fête des Brasseurs,"Du {EventStartDate} au {EventEndDate}, terminez des quêtes de la fête des Brasseurs dans le monde.",345,147937,50,0,-50
Fête des Brasseurs : terminer 5 quêtes de la fête des Brasseurs,"Du {EventStartDate} au {EventEndDate}, terminez des quêtes de la fête des Brasseurs dans le monde.",346,147939,150,345,-50
Gagner 1 combat de mascottes en JcJ avec des mascottes mortes-vivantes,Gagnez 1 combat de mascottes en JcJ avec au moins 2 mascottes mortes-vivantes.,347,148003,50,0,0
Sanssaint : piochez dans les seaux à bonbons en mode Guerre,"Du {EventStartDate} au {EventEndDate}, prenez des poignées de sucreries dans les seaux à bonbons du monde en mode Guerre.",348,148005,50,0,-60
Occupez-vous de votre ferme au Chant du Soleil,Labourez la terre de la ferme Chant du Soleil dans la vallée des Quatre vents.,350,148009,50,0,-40
Obtenir l’or dans 4 courses de vol à dos de Dragon sur les îles aux Dragons,Parlez à un chronométreur de bronze sur les îles aux Dragons.,351,148012,50,0,0
Sanssaint : piocher dans les seaux de bonbons des îles aux Dragons,"Du {EventStartDate} au {EventEndDate}, prenez des poignées de sucreries dans les seaux à bonbons des îles aux Dragons.",353,148016,50,0,-50
Sanssaint : piocher dans les seaux de bonbons de Pandarie,"Du {EventStartDate} au {EventEndDate}, prenez des poignées de sucreries dans les seaux à bonbons de Pandarie.",354,148018,50,0,-50
Sanssaint : terminer 5 quêtes journalières de la Sanssaint,"Du {EventStartDate} au {EventEndDate}, rendez-vous à Hurlevent ou Fossoyeuse pour achever des quêtes journalières de la Sanssaint.",355,148020,100,0,-60
Sanssaint : terminer 15 quêtes journalières de la Sanssaint,"Du {EventStartDate} au {EventEndDate}, rendez-vous à Hurlevent ou Fossoyeuse pour achever des quêtes journalières de la Sanssaint.",356,148022,150,355,-60
Sanssaint : vaincre sans relâche le Cavalier sans tête,"Du {EventStartDate} au {EventEndDate}, vainquez sans relâche le Cavalier sans tête.",357,148026,100,0,-60
Sanssaint : vaincre le Cavalier sans tête avec les 4 malédictions des maccarbres.,"Du {EventStartDate} au {EventEndDate}, vainquez le Cavalier sans tête après avoir accepté les 4 malédictions des maccarbres.",358,148028,100,0,-60
Sanssaint : pêcher des pommes avec un masque de la Sanssaint,"Du {EventStartDate} au {EventEndDate}, pêchez des pommes avec un masque de la Sanssaint.",359,148042,50,0,-60
Foire de Sombrelune : parler avec un esprit sans repos,"Du 6 au 12 octobre, parlez à un fantôme sur l’île de la foire de Sombrelune.",360,148056,50,0,-10
Grand prix de Gnomeregan : participer au Grand prix de Gnomeregan,"Le {EventStartDate}, participez à la course de la Nouvelle-Brikabrok en Dun Morogh.",361,148058,100,0,-30
Fête des Brasseurs : participer à un gueulethon,"Du {EventStartDate} au {EventEndDate}, participez à une compétition de gueulethon de la fête des Brasseurs près de Forgefer ou Orgrimmar.",362,148060,50,0,-20
/glousser devant un personnage-joueur réprouvé,Utilisez l’emote /glousser devant un personnage-joueur réprouvé.,363,148065,50,0,0
Terminer des expéditions de vol à dos de Dragon dans les confins Interdits,Parlez à un chronométreur de bronze sur les îles aux Dragons.,364,148098,100,0,0
Terminer des courses de vol à dos de Dragon avancées sur les îles aux Dragons,"Terminez des courses de vol à dos de Dragon avancées sur les rivages de l’Éveil, dans les plaines d’Ohn’ahra, dans la travée d’Azur et en Thaldraszus.",365,148100,100,0,0
Foire de Sombrelune : porter une tête de poisson dans les donjons,"Du 6 au 12 octobre, utilisez l’outil de recherche de donjon pour terminer un donjon en portant une tête coupée d’écaille-cramoisie ou d’azurette pêchée sur l’île de la foire de Sombrelune.",366,148102,100,0,-30
Grand Prix de Gnomeregan : terminer le Grand Prix de Gnomeregan avec un ou une Gnome de niveau 10 ou moins portant une chemise rose,"Le {EventStartDate}, participez à la course de la Nouvelle-Brikabrok en Dun Morogh avec un Gnome ou Méchagnome de niveau 1 à 10 en portant une chemise rose en tisse-mage.",367,148104,150,0,-30
"Récolter 50 herbes, échantillons de minerai ou peaux sur les îles aux Dragons",,368,148528,50,0,0
"Récolter 250 herbes, échantillons de minerai ou peaux sur les îles aux Dragons",,369,148743,100,368,0
Terminer 2 des expéditions de vol à dos de Dragon suivantes,,370,148532,100,0,0
Dépenser 100 points de vigueur en vol à dos de Dragon,,371,148542,50,0,0
Dépenser 1 000 points de vigueur en vol à dos de Dragon,,372,148546,100,371,0
Foire de Sombrelune : terminer Il tire et… il marque,"Du 5 au 11 novembre, terminez la quête Il tire et… il marque sur l’île de la foire de Sombrelune.",373,148550,50,0,-30
Achever une quête Étincelles de vie sur les îles aux Dragons,Achevez une quête Étincelles de vie sur les îles aux Dragons.,375,148554,100,0,0
Gagner un champ de bataille sous le niveau 70,,376,148556,100,0,0
Gagner un combat de mascottes en JcJ avec une dinde,Gagnez un combat de mascottes en JcJ avec une dinde dans votre équipe.,377,148558,100,0,0
Donner une friandise à votre mascotte,"Nourrissez une mascotte de combat avec une friandise pour familier, du Ragoutoutou ou une friandise pour familier inférieure.",378,148560,50,0,0
Semaine de bonus des expéditions : accomplir des expéditions en groupe,"Du {EventStartDate} au {EventEndDate}, accomplissez des expéditions en groupe.",379,148564,100,0,0
Semaine de bonus des expéditions : gagner un champ de bataille épique,"Du {EventStartDate} au {EventEndDate}, gagnez un champ de bataille épique.",380,148566,100,0,0
Semaine de bonus des donjons de Dragonflight : terminer des donjons héroïques avec des joueurs aléatoires,"Du {EventStartDate} au {EventEndDate}, utilisez l’outil Donjons pour terminer des donjons héroïques avec des joueurs aléatoires.",381,148568,150,0,0
Emmener sa guilde en donjon,Utilisez l’outil de recherche de donjon pour terminer des donjons en groupe de guilde.,383,148572,150,0,0
Accomplir des quêtes en groupe,,384,148574,100,0,0
Gagner toutes les améliorations suivantes à la fois,,385,148576,50,0,0
Monter sur la monture d’un autre personnage,,386,148582,50,0,0
Jour des Morts : vaincre un belligérant,"Du {EventStartDate} au {EventEndDate}, achetez un costume de belligérant à Chapman et vainquez un autre personnage-joueur également en tenue de belligérant.",387,148584,100,0,-10
Jour des Morts : achever la quête Les morts reconnaissants,"Du {EventStartDate} au {EventEndDate}, terminez la quête Les morts reconnaissants, que vous trouverez dans la capitale de votre race.",388,148586,100,0,-10
Festival des séléniens : terminer Observation des séléniens,"Le {EventStartDate}, terminez la quête Observation des séléniens à Reflet-de-Lune en Kalimdor.",389,148588,150,0,-40
Anniversaire de WoW : participer à Vengeance de Korrak,"Du {EventStartDate} au {EventEndDate}, participez au champ de bataille Vengeance de Korrak.",390,148590,100,0,-60
Anniversaire de WoW : tuer Marche-funeste,"Du {EventStartDate} au {EventEndDate}, tuez Marche-funeste à Tanaris.",391,148592,100,0,-60
Anniversaire de WoW : /acclamer Leeroy Jenkins,"Du {EventStartDate} au {EventEndDate}, utilisez l’emote /acclamer pour Leeroy Jenkins dans les Grottes du temps.",392,148594,50,0,-60
Anniversaire de WoW : achever des quêtes en groupe en-dessous du niveau 20,"Du {EventStartDate} au {EventEndDate}, achevez 5 quêtes en groupe en-dessous du niveau 20.",393,148596,100,0,-60
Festival des séléniens : tuer des ennemis avec votre bébé sélénien,"Le {EventStartDate}, devenez l’ami(e) d’un bébé sélénien à Reflet-de-Lune en Kalimdor, puis tuez 25 ennemis qui rapportent de l’expérience avec votre ami sélénien.",394,148609,150,0,-40
Anniversaire de WoW : lancer des feux d’artifice dans les capitales,"Du {EventStartDate} au {EventEndDate}, lancez 10 feux d’artifice de célébration ou fusées d’artifice à Hurlevent ou Orgrimmar.",395,148611,50,0,-60
Les Bienfaits du pèlerin : Esprit du partage,"Du {EventStartDate} au {EventEndDate}, mangez tous les plats à la table des Bienfaits pour obtenir Esprit du partage.",396,148617,50,0,-70
Les Bienfaits du pèlerin : obtenir Esprit du partage dans toutes les zones des îles aux Dragons,"Du {EventStartDate} au {EventEndDate}, mangez tous les plats à la table des Bienfaits pour obtenir Esprit du partage dans chacune des régions suivantes.",397,148619,100,396,-70
Les Bienfaits du pèlerin : cuisiner toutes les recettes des Bienfaits du pèlerin,"Du {EventStartDate} au {EventEndDate}, préparez tous les plats des Bienfaits du pèlerin suivants.",398,148638,100,0,-70
Les Bienfaits du pèlerin : achever des quêtes,"Du {EventStartDate} au {EventEndDate}, terminez 5 quêtes des Bienfaits du pèlerin.",399,148656,100,0,-70
Les Bienfaits du pèlerin : goûter les saveurs d’Azeroth,"Du {EventStartDate} au {EventEndDate}, mangez chacun des aliments indiqués ci-dessous.",400,148660,150,0,-70
Les Bienfaits du pèlerin : couvrir tout le monde de plumes de dindes,"Du {EventStartDate} au {EventEndDate}, tirez sur chacune des races de joueurs suivantes avec un dindoflingue.",401,148674,100,0,-70
Les Bienfaits du pèlerin : partir à la chasse aux dindes avec un chapeau de pèlerin,"Du {EventStartDate} au {EventEndDate}, tuez rapidement des dindes sauvages dans la forêt d’Elwynn, les clairières de Tirisfal ou sur les plaines d’Ohn’ahra pour gagner Domination des dindes en portant un chapeau de pèlerin.",402,148717,150,0,-70
Anniversaire de WoW : gagner un combat de mascottes en JcJ avec votre nouveau familier,"Du {EventStartDate} au {EventEndDate}, gagnez un combat de mascottes en JcJ avec P’tit Aile-de-Givre dans votre équipe.",403,148719,100,0,-60
Améliorer des objets en utilisant des pierres de Vol,,404,148721,100,0,0
Terminer un donjon aléatoire ou champ de bataille aléatoire avec l’ami que vous avez recruté ou qui vous a recruté,Utilisez l’outil de recherche de donjon pour accomplir un donjon aléatoire ou un champ de bataille aléatoire en groupe avec l’ami que vous avez recruté ou qui vous a recruté.,405,148739,150,0,0
Prise de niveau en cuisine classique,,406,149016,100,0,0
Manger un festin tribal épique ou légendaire,"Participez au festin tribal rohart iskaarien pour augmenter sa rareté, puis mangez une soupe épique !",407,149018,100,0,0
Participer au feu de l’action,,409,149478,50,0,0
Remporter 1 manche de baston du feu de l’action,,410,149481,50,0,0
Remporter 5 manches de baston du feu de l’action,,411,149571,50,410,0
Atteindre le niveau 20,Atteignez le niveau 20 avec n’importe quel personnage.,412,149577,25,0,0
Gagner de la réputation sur les îles aux Dragons,,414,149607,70,0,0
Vaincre 5 boss de raid,,415,149619,50,0,10
Vaincre 20 boss de raid,,416,149621,100,415,10
Terminer 10 quêtes,Terminez des quêtes rapportant de l’expérience.,417,149633,100,0,0
Terminer 25 quêtes,Terminez des quêtes rapportant de l’expérience.,418,149635,100,417,0
Terminer 50 quêtes,Terminez des quêtes rapportant de l’expérience.,419,149637,100,418,0
Accomplir 5 expéditions,,420,149639,50,0,0
Accomplir 10 expéditions,,421,149641,50,420,0
Accomplir 25 expéditions,,422,149643,100,421,0
Vaincre 25 boss de donjons,Venez à bout de boss de donjons rapportant de l’expérience.,423,149645,100,0,0
Créer un écu d’ombreflamme,Récupérez des fragments d’écus d’ombreflamme et créez n’importe quel type d’écu d’ombreflamme.,424,149647,30,0,0
Atteindre le niveau 30,Atteignez le niveau 30 avec n’importe quel personnage.,426,149713,25,0,0
Atteindre le niveau 40,Atteignez le niveau 40 avec n’importe quel personnage.,427,149715,25,0,0
Atteindre le niveau 50,Atteignez le niveau 50 avec n’importe quel personnage.,428,149717,25,0,0
Atteindre le niveau 60,Atteignez le niveau 60 avec n’importe quel personnage.,429,149719,25,0,0
Atteindre le niveau 70,Atteignez le niveau 70 avec n’importe quel personnage.,430,149721,25,0,0
Gagner des niveaux de classe,Gagnez des niveaux avec n’importe quel personnage.,431,149723,50,0,0
Marcheurs du temps : vaincre des dompteurs de mascottes des îles Brisées,"Du {EventStartDate} au {EventEndDate}, terrassez les maîtres dompteurs des îles Brisées.",432,149987,100,0,0
Marcheurs du temps : vaincre des boss de raid de Burning Crusade,"Du {EventStartDate} au {EventEndDate}, terrassez des boss de raid de Burning Crusade.",433,149937,100,0,0
Marcheurs du temps : vaincre des boss de raid de Wrath of the Lich King,"Du {EventStartDate} au {EventEndDate}, terrassez des boss de raid de Wrath of the Lich King.",434,149935,100,0,0
Marcheurs du temps : vaincre des boss de raid de Cataclysm,"Du {EventStartDate} au {EventEndDate}, terrassez des boss de raid de Cataclysm.",435,149945,100,0,0
Marcheurs du temps : vaincre des boss de raid de Mists of Pandaria,"Du {EventStartDate} au {EventEndDate}, terrassez des boss de raid de Mists of Pandaria.",436,149941,100,0,0
Marcheurs du temps : vaincre des boss de raid de Warlords of Draenor,"Du {EventStartDate} au {EventEndDate}, terrassez des boss de raid de Warlords of Draenor.",437,149939,100,0,0
Marcheurs du temps : vaincre des boss de raid de Legion,"Du {EventStartDate} au {EventEndDate}, terrassez des boss de raid de Legion.",438,149943,100,0,0
Marcheurs du temps : achever des quêtes en Outreterre,"Du {EventStartDate} au {EventEndDate}, achevez des quêtes en Outreterre.",439,149951,100,0,0
Marcheurs du temps : achever des quêtes en Norfendre,"Du {EventStartDate} au {EventEndDate}, achevez des quêtes en Norfendre.",440,149947,100,0,0
Marcheurs du temps : achever des quêtes en Kalimdor et dans les royaumes de l’Est,"Du {EventStartDate} au {EventEndDate}, achevez des quêtes en Kalimdor et dans les royaumes de l’Est.",441,149957,100,0,0
Marcheurs du temps : achever des quêtes en Pandarie,"Du {EventStartDate} au {EventEndDate}, achevez des quêtes en Pandarie.",442,149953,100,0,0
Marcheurs du temps : achever des quêtes dans les îles Brisées,"Du {EventStartDate} au {EventEndDate}, achevez des quêtes dans les îles Brisées.",443,149955,100,0,0
"Marcheurs du temps : récolter des herbes, des minerais, des peaux ou des poissons en Outreterre","Du {EventStartDate} au {EventEndDate}, récoltez des plantes, des minerais, des peaux ou des poissons en Outreterre.",444,149965,100,0,0
"Marcheurs du temps : récolter des herbes, des minerais, des peaux ou des poissons en Norfendre","Du {EventStartDate} au {EventEndDate}, récoltez des plantes, des minerais, des peaux ou des poissons en Norfendre.",445,149959,100,0,0
"Marcheurs du temps : récolter des herbes, des minerais, des peaux ou des poissons en Kalimdor et dans les royaumes de l’Est","Du {EventStartDate} au {EventEndDate}, récoltez des plantes, des minerais, des peaux ou des poissons en Kalimdor et dans les royaumes de l’Est.",446,149974,100,0,0
"Marcheurs du temps : récolter des herbes, des minerais, des peaux ou des poissons en Pandarie","Du {EventStartDate} au {EventEndDate}, récoltez des plantes, des minerais, des peaux ou des poissons en Pandarie.",447,149968,100,0,0
"Marcheurs du temps : récolter des herbes, des minerais, des peaux ou des poissons sur Draenor","Du {EventStartDate} au {EventEndDate}, récoltez des plantes, des minerais, des peaux ou des poissons sur Draenor.",448,149962,100,0,0
"Marcheurs du temps : récolter des herbes, des minerais, des peaux ou des poissons dans les Îles Brisées","Du {EventStartDate} au {EventEndDate}, récoltez des plantes, des minerais, des peaux ou des poissons dans les îles Brisées.",449,149971,100,0,0
Marcheurs du temps : aller pêcher en Kalimdor et dans les royaumes de l’Est,"Du {EventStartDate} au {EventEndDate}, repêchez des objets en Kalimdor et dans les royaumes de l’Est.",450,149985,100,0,0
Marcheurs du temps : aller pêcher en Pandarie,"Du {EventStartDate} au {EventEndDate}, repêchez des objets en Pandarie.",451,149981,100,0,0
Améliorer votre réputation auprès des Gardiens du Rêve,,452,149756,100,0,0
Cueillir des fruits du Rêve dans la superfloraison,Gagnez 10 pouvoirs de fruit du Rêve pendant des évènements de superfloraison dans le Rêve d’émeraude.,453,149763,25,0,0
Participer à une superfloraison épique,Participez à un évènement de superfloraison du Rêve d’émeraude qui rapporte une qualité épique.,454,149765,25,0,0
Planter 15 graines oniriques dans le Rêve d’émeraude,,455,149767,25,456,0
Planter 5 graines oniriques dans le Rêve d’émeraude,,456,149771,25,0,0
Refaçonner de l’équipement,Utilisez une profession d’artisanat pour refaçonner de l’équipement avec un établi.,457,149775,50,0,0
Terminer des courses de vol à dos de Dragon dans le Rêve d’émeraude,Parlez à un chronométreur de bronze dans le Rêve d’émeraude.,458,149784,50,0,0
Terminer des défis de courses de vol à dos de Dragon dans le Rêve d’émeraude,Parlez à un chronométreur de bronze dans le Rêve d’émeraude.,459,149786,50,0,0
Terminer des courses de vol à dos de Dragon inversées dans le Rêve d’émeraude,Parlez à un chronométreur de bronze dans le Rêve d’émeraude.,460,149788,50,0,0
Tuer des personnages-joueurs dans le Rêve d’émeraude,,461,149795,100,0,0
Obtenir Courroux agité,,462,149797,100,0,0
Vaincre des mascottes de rêve,Vainquez 5 des mascottes suivantes dans le Rêve d’émeraude.,463,149799,50,0,0
Attraper une mascotte d’hiver,Attrapez l’une des mascottes d’hiver suivantes.,464,149801,50,0,0
Vous faire ressusciter,,465,149808,25,0,0
Tuer des ennemis dans le froid,Tuez 30 ennemis dans l’une des régions suivantes.,466,149823,50,0,0
Infliger des dégâts de givre,"Infligez un total de 500 000 points de dégâts de givre. Les dégâts de givre sont généralement infligés par les mages, les chamans et les chevaliers de la mort.",467,0,50,0,0
Participer à des superfloraisons,Participez à 3 évènements de superfloraison dans le Rêve d’émeraude.,468,149832,25,0,0
Planter des graines oniriques dans le Rêve d’émeraude,,469,149834,25,0,0
Semaine de bonus d’escarmouche en arène : remporter des matchs d’arène journaliers,"Du {EventStartDate} au {EventEndDate}, remportez un match d’arène quatre jours différents.",470,150004,100,0,0
Semaine de bonus des expéditions : accomplir des expéditions,"Du {EventStartDate} au {EventEndDate}, accomplissez des expéditions.",471,149857,50,0,0
Nouvel an : lancer des feux d’artifice rouges et bleus dans les capitales,"Le {EventStartDate}, lancez 10 feux d’artifice rouges ou bleus à Hurlevent ou Orgrimmar pendant les feux d’artifice.",473,149871,100,0,-500
Fête du Voile d’hiver : tuer 6 boss festifs,"Du {EventStartDate} au {EventEndDate}, tuez six des boss suivants.",474,149883,50,27,-100
Fête du Voile d’hiver : tuer 9 boss festifs,"Du {EventStartDate} au {EventEndDate}, tuez neuf des boss suivants.",475,149897,50,474,-100
"Fête du Voile d’hiver : tuer l’abominable Grinche (deux fois, par sécurité)","Du {EventStartDate} au {EventEndDate}, tuez l’abominable Grinche dans les contreforts de Hautebrande. Deux fois.",476,149911,50,0,-100
[DNT] Complete World Quests during World Quest Bonus Week,[DNT] From {EventStartDate} - {EventEndDate} complete world quests.,477,149857,50,0,0
Ultime surtension : achever des quêtes,"Du {EventStartDate} au {EventEndDate}, achevez des quêtes rapportant de l’expérience.",478,149923,150,0,0
Ultime surtension : accomplir des expéditions,"Du {EventStartDate} au {EventEndDate}, accomplissez des expéditions.",479,149925,150,0,0
Achever l’histoire Dragons marginaux,Parlez à Irion dans le Rêve d’émeraude pour commencer son histoire.,483,150035,50,0,0
Elfe de la nuit : accomplir la suite de quêtes de l’armure ancestrale,"En tant qu’Elfe de la nuit, accomplissez les quêtes d’armure ancestrale suivantes :",484,150069,100,0,0
Gagner des niveaux de classe,Gagnez des niveaux avec n’importe quel personnage.,486,150278,50,0,0
Gagner des niveaux de classe,Gagnez des niveaux avec n’importe quel personnage.,487,149723,50,0,0
Fête du Voile d’hiver : jouer avec votre cadeau du Voile d’hiver,"Du {EventStartDate} au {EventEndDate}, gagnez 100 charges au total en jouant avec votre nouveau jouet ou celui de quelqu’un d’autre.",489,151021,200,0,-100
Faire une bataille de boules de neige,"Touchez d’autres personnages-joueurs avec des boules de neige, ou recevez les leurs ! Vous pouvez acheter des boules de neige aux vendeurs des Gourmandises Fumebois dans les capitales.",491,151329,25,0,0
Utiliser le jouet bannière des Dragons de bronze,Utilisez le jouet bannière des Dragons de bronze dans les îles aux Dragons.,492,151369,50,0,0
Utiliser le jouet pennon de pilote en bronze devant Nozdormu et lui faire /signe,Utilisez le jouet pennon de pilote en bronze et utilisez l’emote /signe devant Nozdormu dans Valdrakken.,493,151372,50,0,0
Utiliser le jouet sablier de l’éternité,Utilisez le jouet sablier de l’éternité devant la confluence Temporelle sur les îles aux Dragons.,494,151374,50,0,0
Utiliser /frime devant une assistante chronométreuse de bronze,Utilisez l’emote /frime devant un assistant chronométreur de bronze.,495,151392,25,0,0
Gagner 5 combats de mascottes en Silithus,,496,151396,100,0,0
Utiliser la montre en bronze pendant une course de vol à dos de Dragon,,497,151400,25,0,0
Appel du Scarabée : tuer un colosse,"Du {EventStartDate} au {EventEndDate}, tuez un colosse en Silithus.",498,151404,50,0,-10
Appel du Scarabée : tuer un colosse de chaque ruche,"Du {EventStartDate} au {EventEndDate}, tuez un colosse dans chacune des ruches de silithides de Silithus.",499,151408,100,0,-11
Appel du Scarabée : faire de la /provoc à un personnage-joueur de la faction adverse,"Du {EventStartDate} au {EventEndDate}, utilisez l’emote /provoc sur un personnage-joueur de la faction adverse en Silithus.",500,151412,25,0,-9
Coupe d’Outreterre : terminer 5 courses draconiques,"Du {EventStartDate} au {EventEndDate}, parlez à un chronométreur de bronze d’Outreterre.",501,151414,100,0,0
Coupe d’Outreterre : terminer 10 courses draconiques,"Du {EventStartDate} au {EventEndDate}, parlez à un chronométreur de bronze d’Outreterre.",502,151416,150,501,0
Coupe d’Outreterre : terminer 20 courses draconiques,"Du {EventStartDate} au {EventEndDate}, parlez à un chronométreur de bronze d’Outreterre.",503,151418,200,502,0
Ultime surtension : terminer des donjons de Dragonflight,"Du {EventStartDate} au {EventEndDate}, terminez des donjons de Dragonflight.",504,151511,150,0,0
Foire de Sombrelune : remporter 1 partie de jeu d’arcade,"Du 7 au 13 janvier, remportez 1 partie d’un des jeux d’arcade suivants sur l’île de la foire de Sombrelune.",505,151640,25,0,0
Foire de Sombrelune : remporter 5 parties de jeu d’arcade,"Du 7 au 13 janvier, remportez 5 parties des jeux d’arcade suivants sur l’île de la foire de Sombrelune.",506,151642,100,505,0
Gagner 5 combats de mascottes dans le Rêve d’émeraude,,507,151646,100,0,0
Gagner des niveaux de classe,Gagnez des niveaux avec n’importe quel personnage.,508,151650,100,0,0
/penser dans Amirdrassil,Utilisez l’emote /penser dans Amirdrassil au sein du Rêve d’émeraude.,509,151652,25,0,0
Tuer des créatures dans le Rêve d’émeraude,Tuez des créatures donnant de l’expérience dans le Rêve d’émeraude sur les îles aux Dragons.,510,151658,100,0,0
Achever la suite de quêtes Aventures temporelles,Parlez à Nozdormu dans la confluence Temporelle en Thaldraszus pour lancer la quête Dégringolade temporelle.,511,151660,200,0,0
Foire de Sombrelune : utiliser le jouet Feu d’artifice éternel de Sombrelune sur l’île de la foire de Sombrelune,"Du 7 au 13 janvier, utilisez le jouet Feu d’artifice éternel de Sombrelune sur l’île de la foire de Sombrelune",512,151686,25,0,0
Tuer des personnages-joueurs dans le Rêve d’émeraude,,513,151688,50,0,0
Appel du Scarabée : accomplir la silithyste,"Du {EventStartDate} au {EventEndDate}, accomplissez l’expédition de la silithyste en Silithus.",514,151833,50,0,-5
Appel du Scarabée : donner des fournitures de guerre,"Du {EventStartDate} au {EventEndDate}, donnez des fournitures de guerre 3 fois pour la cause en Silithus.",515,151923,100,0,-6
Terminer les quêtes du jeune Dragon de bronze,Terminez les quêtes du jeune Dragon de bronze à la Nourricerie « Petites écailles » à Valdrakken.,516,151957,100,0,0
Utiliser le jouet sable de stase,Utilisez le jouet sable de stase devant la confluence Temporelle sur les îles aux Dragons.,517,151982,50,0,0
Terminer 1 donjon avec sujets,,518,152017,50,0,0
Terminer 5 donjons avec sujets,,519,152023,150,518,0
