ActivityName_lang,Description_lang,ID,CriteriaTreeID,ThresholdContributionAmount,Supersedes,Priority
Terminer 30 quêtes,Terminez des quêtes rapportant de l’expérience.,3,135693,200,0,0
Vaincre 50 boss de donjons,Venez à bout de boss de donjons rapportant de l’expérience.,4,135695,200,0,0
Fête du Voile d’hiver : obtenir un chapeau de fête bien coupé,"Du {EventStartDate} au {EventEndDate}, obtenez un chapeau de fête bien coupé.",5,135697,50,0,-100
Terminer 5 donjons mythiques +,,6,135699,200,0,7
Accomplir 15 expéditions,,7,136176,150,0,0
Vaincre 10 boss de raids de Dragonflight,,8,136202,200,0,0
Obtenir 7 500 points d’honneur,,10,136220,200,0,0
Remporter 5 champs de bataille,,11,136222,200,0,0
Remporter 10 matchs d’arène hors escarmouches,,12,136224,200,0,0
Honorer des commandes d’artisanat,Parlez à un représentant ou une représentante au marché d’artisanat de Valdrakken.,13,136242,200,0,0
Gagner 15 combats de mascottes,,14,136244,200,0,0
Vaincre des boss de donjons au sein d’un groupe interfactions,Venez à bout de boss de donjons rapportant de l’expérience au sein d’un groupe interfactions.,16,136248,150,0,0
Achever des quêtes en Norfendre,,17,136250,100,0,0
Terminer 5 donjons des Marcheurs du temps de Wrath of the Lich King,,18,136265,250,0,0
Vaincre le roi-liche,Tuez le roi-liche dans la citadelle de la Couronne de glace.,19,136286,50,0,0
Terminer le champ de bataille de la vallée d’Alterac,,20,136288,100,0,0
Semaine des combats de mascotte : vaincre les dompteurs du Norfendre avec un petit assistant,"Du {EventStartDate} au {EventEndDate}, utilisez au moins un petit assistant pour vaincre tous les maîtres dompteurs du Norfendre.",21,136291,75,0,-110
Marcheurs du temps : aller pêcher en Norfendre,"Du {EventStartDate} au {EventEndDate}, repêchez des objets en Norfendre.",22,136300,100,0,0
Frissonner devant Ragnaros,Utilisez l’emote /froid devant Ragnaros dans le Cœur du Magma.,23,136323,25,0,0
Fête du Voile d’hiver : danser autour de l’arbre avec une tenue adaptée à l’occasion,"Du {EventStartDate} au {EventEndDate}, dansez avec un autre personnage-joueur près de l’arbre festif en portant les atours d’hiver.",24,136325,50,0,-100
Tuer 100 élémentaires de glace,,25,136327,100,0,0
Foire de Sombrelune – terminer Cible : tortue,"Du 3 au 9 décembre, achevez la quête Cible : tortue sur l’île de la foire de Sombrelune.",26,136357,50,0,-62
Fête du Voile d’hiver : tuer 3 boss festifs,"Du {EventStartDate} au {EventEndDate}, tuez trois des boss suivants.",27,136359,50,0,-100
Festival de l’explorateur : participer au festival,"Du {EventStartDate} au {EventEndDate}, assistez au Festival de l’explorateur sur la plage aux Tortues des étendues sauvages de Krasarang.",28,136364,100,0,-70
Festival de l’explorateur : lancer une lanterne et lire En attendant la tortue,"Du {EventStartDate} au {EventEndDate}, lancez une lanterne et lisez En attendant la tortue au Festival de l’explorateur dans les étendues sauvages de Krasarang.",29,136366,75,0,-70
Foire de Sombrelune : manger une saucisse au pain de maïs après votre tour,"Du 3 au 9 décembre, allez faire un tour sur le manège ou le grand huit, puis allez manger une saucisse au pain de maïs.",30,136369,25,0,-62
Tuer le ou la chef de la faction adverse,,31,136449,400,0,0
Explorer une région enneigée,Explorez entièrement l’une des régions suivantes.,32,136527,50,0,0
Fête du Voile d’hiver : obtenir l’aura de la glacière,"Du {EventStartDate} au {EventEndDate}, obtenez l’aura de la glacière de Froiderage.",34,136855,25,0,-100
Marcheurs du temps : terminer des quêtes sur Draenor,"Du {EventStartDate} au {EventEndDate}, accomplissez des quêtes sur Draenor.",36,149949,100,0,0
Marcheurs du temps : terminer 5 donjons des Marcheurs du temps de Warlords of Draenor,"Du {EventStartDate} au {EventEndDate}, terminez des donjons des Marcheurs du temps de Warlords of Draenor.",37,137530,100,213,0
Terminer la citadelle des Flammes infernales,,38,137539,150,0,0
Tuer 15 personnages-joueurs dans la jungle de Tanaan,,39,137541,200,0,0
Terrasser des maîtres dompteurs des îles aux Dragons avec des mascottes de type Draconien,Terrassez 2 maîtres dompteurs des îles aux Dragons avec au moins 2 mascottes de type Draconien.,40,137543,200,0,0
Marcheurs du temps : aller pêcher sur Draenor,"Du {EventStartDate} au {EventEndDate}, repêchez des objets sur Draenor.",41,149979,100,0,0
Utiliser du Ragoutoutou,Achetez du Ragoutoutou à Breanni à la Ménagerie magique de Dalaran.,42,137615,100,0,0
De l’amour dans l’air : utiliser la pierre de foyer ravissante de Colportecœur sur les îles aux Dragons,"Du {EventStartDate} au {EventEndDate}, utilisez la pierre de foyer ravissante de Colportecœur sur les îles aux Dragons.",43,137617,150,0,0
De l’amour dans l’air : utiliser le panier à pique-nique romantique dans les plaines d’Ohn’ahra,"Du {EventStartDate} au {EventEndDate}, utilisez le panier à pique-nique romantique dans les plaines d’Ohn’ahra.",44,137619,150,0,0
De l’amour dans l’air : accomplir la quête « Bombardement de bonbons »,"Du {EventStartDate} au {EventEndDate}, accomplissez la quête Bombardement de bonbons.",45,137621,150,0,0
De l’amour dans l’air : vaincre l’apothicaire Hummel,"Du {EventStartDate} au {EventEndDate}, terrassez l’apothicaire Hummel dans le donjon d’Ombrecroc.",46,137623,100,0,0
De l’amour dans l’air : offrir un bracelet de breloques ravissantes,"Du {EventStartDate} au {EventEndDate}, offrez un bracelet de breloques ravissantes à l’un ou l’une de vos chefs de faction.",47,137625,150,0,0
/serrer un personnage-joueur mort,Utilisez l’emote /serrer devant un personnage-joueur mort.,48,137634,50,0,0
Ressusciter des personnages-joueurs,,49,137636,50,0,0
Utiliser le poison lent de Zanzil,"Utilisez le poison lent de Zanzil, qui s’obtient auprès de Gérald Black à Hurlevent ou d’Alpheus Cain à Orgrimmar.",50,137645,50,0,0
Obtenir de l’or à l’hôtel des ventes,,52,137647,100,0,0
"Manger une part de gâteau au chocolat, une part de délicieux gâteau et une part de tarte aux baies","Mangez une part de gâteau au chocolat, une de délicieux gâteau et une de tarte aux baies, qui s’obtiennent auprès d’Aimée à la vieille Dalaran.",53,137651,50,0,0
Naissance des hippogriffes : perchoir de nouveau-né aigreplume,"Le {EventStartDate}, faites incuber un œuf d’aigreplume pour qu’un nouveau-né vienne se percher sur votre épaule.",54,137655,150,0,0
Naissance des hippogriffes : utiliser une plume spectrale,"Le {EventStartDate}, récupérez une plume spectrale de Lorthalium et utilisez-la.",55,137657,150,0,0
Foire de Sombrelune : offrir une grande tarte aux baies,"Du {EventStartDate} au {EventEndDate}, offrez une grande tarte aux baies sur l’île de la foire de Sombrelune.",56,137659,50,0,0
Épreuve du style : gagner 100 marques de l’épreuve du style,"Du {EventStartDate} au {EventEndDate}, gagnez des marques de l’épreuve du style en participant à cette épreuve.",61,137688,100,266,0
Marcheurs du temps : aller pêcher dans les îles Brisées.,"Du {EventStartDate} au {EventEndDate}, repêchez des objets dans les îles Brisées.",63,149983,100,0,0
Obtenir un jouet qui vous donne « la classe »,,64,137776,50,0,0
Épreuve du style : utiliser /acclame devant des personnages-joueurs,"Du {EventStartDate} au {EventEndDate}, utilisez l’emote /acclame devant des personnages-joueurs en participant à l’épreuve du style.",65,137787,50,0,0
"Épreuve du style : utiliser le projecteur, la piste de danse et les flammes de l’épreuve du style","Du {EventStartDate} au {EventEndDate}, utilisez le projecteur, la piste de danse et les flammes de l’épreuve du style en y participant.",66,137789,100,0,0
Épreuve du style : utiliser la lettre d’un admirateur,"Du {EventStartDate} au {EventEndDate}, utilisez la lettre d’un admirateur en participant à l’épreuve du style.",67,137793,50,0,0
Vaincre Kael’thas Haut-Soleil à la terrasse des Magistères,,68,137795,150,0,0
Paléon’Goro : récupérer du mojo de dinosaure,"Du {EventStartDate} au {EventEndDate}, récupérez du mojo de dinosaure dans le cratère d’Un’Goro.",69,137797,150,0,0
Paléon’Goro : obtenir la super adaptation,"Du {EventStartDate} au {EventEndDate}, utilisez du mojo de dinosaure pour renforcer vos effets d’adaptation jusqu’à devenir super.",70,137799,150,0,0
Foire de Sombrelune : accomplir « Le boulet de canon humanoïde »,"Du 3 au 9 mars, achevez la quête Le boulet de canon humanoïde sur l’île de la foire de Sombrelune.",71,137801,50,0,0
Utiliser les lunettes corgi suroptimisées,,72,137803,50,0,0
Modifier votre apparence,Rendez-vous dans un salon de coiffure dans une grande ville pour changer votre apparence.,73,137805,25,0,0
Épreuve du style : récupérer l’apparence de Bicorne de commerce,"Du {EventStartDate} au {EventEndDate}, récupérez l’apparence de bicorne de commerce en participant à l’épreuve du style.",74,137807,25,0,0
Utiliser /frime devant un personnage-joueur en ayant « la classe »,Utilisez l’emote /frime devant un personnage-joueur en étant sous l’effet d’un jouet qui donne « la classe ».,75,137809,50,0,0
Utiliser /courbette devant un personnage-joueur de la faction adverse,Utilisez l’emote /courbette devant un personnage-joueur de la faction adverse.,76,137811,20,0,0
Utiliser /admiration devant un personnage-joueur ayant « la classe »,Utilisez l’emote /admiration devant un personnage-joueur sous l’effet d’un jouet qui donne « la classe ».,77,137813,50,0,0
Gagner de la réputation sur les îles aux Dragons,,79,137872,150,0,0
Terminer 15 donjons mythiques +,,81,140979,200,6,5
Terminer des grandes chasses des Centaures maruuks,Terminez des grandes chasses des Centaures maruuks sur les îles aux Dragons.,82,140981,150,0,0
Attraper un malabar avec un ami,Utilisez un harpon pour attraper un malabar avec un autre personnage-joueur sur les îles aux Dragons.,83,140983,50,0,0
Accomplir des tâches durant le festin tribal des Roharts iskaariens,Accomplissez des tâches durant le festin tribal d’Iskaara sur les îles aux Dragons.,84,140985,50,0,0
Terminer le siège du donjon du Fléau-des-Dragons,Terminez le siège du donjon du Fléau-des-Dragons sur les rivages de l’Éveil sur les îles aux Dragons.,85,140987,50,0,0
Utiliser l’entraide en escaladant,Utilisez l’entraide au cours d’expéditions d’escalade sur les îles aux Dragons.,86,140989,50,0,0
Terrasser des créatures spéciales lors des tempêtes primalistes,Des créatures spéciales apparaîtront lors des tempêtes primalistes sur les îles aux Dragons.,87,140991,100,0,0
Terminer 4 courses draconiques sur les îles aux Dragons,Parlez à un chronométreur de bronze près d’un lieu de course actif sur les îles aux Dragons.,88,141010,250,265,0
Accomplir une expédition JcJ sur les îles aux Dragons,,89,141012,100,0,0
Vaincre un boss hors instance des îles aux Dragons,,90,141021,100,0,0
Achever les suites de quêtes optionnelles des rivages de l’Éveil,,91,141032,200,0,0
Terminer des quêtes de récolte hebdomadaires,Parlez à un maître ou une maîtresse de métier de collecte au marché d’artisanat de Valdrakken.,92,141044,100,0,0
Terminer des quêtes de fabrication hebdomadaires,Parlez à un maître ou une maîtresse de métier de fabrication au marché d’artisanat de Valdrakken.,93,141057,100,0,0
Piller des coffres de fournitures de guerre sur les îles aux Dragons,,94,141095,100,0,0
Pêcher des objets sur les îles aux Dragons,,95,141125,100,0,0
Utiliser /amour devant les Aspects dragons,Utilisez l’emote /amour devant les Aspects dragons à Valdrakken.,96,141883,50,0,0
Utiliser /amour devant des Dragons déchus,Utilisez l’emote /amour devant 2 Dragons déchus dans leurs raid.,97,141887,50,0,0
Obtenir un jouet printanier,,98,141941,50,0,0
Jardin des nobles : manger des chocolats du Jardin des nobles à Iskaara,"Du {EventStartDate} au {EventEndDate}, mangez des chocolats du Jardin des nobles à Iskaara sur les îles aux Dragons.",99,141949,100,0,0
Jardin des nobles : utiliser des fleurs printanières dans une arène ou sur un champ de bataille,"Du {EventStartDate} au {EventEndDate}, utilisez des fleurs printanières sur un personnage-joueur adverse dans une arène ou sur un champ de bataille.",100,141951,50,0,0
Jardin des nobles : récupérer des œufs vivement colorés,"Du {EventStartDate} au {EventEndDate}, récupérez des œufs vivement colorés.",101,141953,100,0,0
Prendre en photo des pêcheurs et pêcheuses légendaires,Prenez en photo des pêcheurs et pêcheuses légendaires lors d’une expédition de catalogage sur les îles aux Dragons.,102,141960,50,0,0
Terminer les expéditions de catalogage,Terminez des expéditions de catalogage sur les Îles aux Dragons.,103,141971,50,0,0
Obtenir un débordement élémentaire,Obtenez des débordements élémentaires sur des créatures touchées par des tempêtes primalistes sur les îles aux Dragons.,104,141979,100,0,0
Terminer des courses draconiques sur les îles aux Dragons,Parlez à un chronométreur de bronze sur les îles aux Dragons.,105,141981,100,0,0
Jardin des nobles : placer des œufs,"Du {EventStartDate} au {EventEndDate}, placez 12 œufs finement décorés ou 1 œuf remarquablement décoré.",106,141983,50,0,0
Marche des têtards : accomplir la quête « Un cadeau de votre têtard »,"Du {EventStartDate} au {EventEndDate}, accomplissez la quête Un cadeau de votre têtard.",107,141986,150,0,0
Achever les suites de quêtes optionnelles des plaines d’Ohn’ahra,,108,141988,150,0,0
Terrasser des boss lors des grandes chasses,Terrassez des boss des grandes chasses des Maruuks sur les îles aux Dragons.,109,141997,100,0,0
Attraper des malabars au harpon,Utilisez un harpon pour attraper des malabars sur les îles aux Dragons.,110,142034,50,0,0
Donner des clés d’obsidienne,Donnez des clés d’obsidienne à des individus de la citadelle d’Obsidienne sur les îles aux Dragons.,111,142036,100,0,0
Modifier l’apparence de votre monture draconique,Rendez-vous à une tribune de transformation sur les îles aux Dragons pour changer les personnalisations de votre monture de vol à dos de Dragon.,112,142038,20,0,0
Gagner des points d’honneur sur le terrain d’entraînement de l’assemblée de Cobalt dans la travée d’Azur,,113,142733,100,0,0
Journée des gardes volontaires : tuer des envahisseurs de la ville,"Le {EventStartDate}, utilisez l’emote /salut devant un garde de Hurlevent ou d’Orgrimmar et tuez des envahisseurs de la ville.",114,142040,200,0,0
"Foire de Sombrelune : accomplir la quête « Danse, Sombrelune, danse »","Du {EventStartDate} au {EventEndDate}, accomplissez la quête Danse, Sombrelune, danse sur l’île de la foire de Sombrelune.",115,142044,50,0,0
Foire de Sombrelune : utiliser /acclame sur le manège ou sur un tigre de bac à sable,"Du {EventStartDate} au {EventEndDate}, utilisez /acclame sur le manège ou sur un tigre de bac à sable sur l’île de la foire de Sombrelune.",116,142048,50,0,0
Utiliser le réseau de téléportation des îles aux Dragons,Empruntez un portail d’accès antique pour utiliser le réseau de téléportation des îles aux Dragons.,117,142050,100,0,0
Tuer des créatures au sommet des sources draconiques,Tuez des créatures rapportant de l’expérience au sommet des Sources draconiques dans le sud-est des plaines d’Ohn’ahra.,118,142052,50,0,0
Accomplir l’épreuve du déluge,Accomplissez l’épreuve du déluge aux sources des Ohn’irs sur les îles aux Dragons.,119,142054,50,0,0
Achever la suite de quêtes « Spa Rêves sereins »,Achevez la suite de quêtes « Spa Rêves sereins » à Thaldraszus sur les îles aux Dragons.,120,142056,50,0,0
Terrasser des mascottes élites des îles aux Dragons avec des mascottes de type Draconien,Terrassez 2 mascottes élites des îles aux Dragons avec au moins 2 mascottes de type Draconien.,121,142058,200,0,0
Pêcher des objets d’un œil inquisiteur,Pêchez des objets en portant des réducteurs d’éblouissement en onyx ou un monocle d’artisan.,122,142063,50,0,0
Fabriquer des objets d’un œil inquisiteur,Fabriquez des objets en portant des réducteurs d’éblouissement en onyx ou un monocle d’artisan.,123,142065,50,0,0
Achever les suites de quêtes optionnelles de la travée d’Azur,,124,142067,150,0,0
Gagner des points d’honneur au bastion Nokhudon,Gagnez des points d’honneur au bastion Nokhudon sur les îles aux Dragons.,125,142046,100,0,0
Modifier l’apparence de votre compagnon pour la grande chasse,Parlez au maître Frodrum à un endroit de grande chasse sur les îles aux Dragons.,126,142080,20,0,0
Découvrir des chapelets de gemmes cachés sur les îles aux Dragons,Utilisez des cartes d’amas de gemmes sur les îles aux Dragons.,127,142082,50,0,0
Terrasser des maîtres dompteurs des îles aux Dragons avec des mascottes de type Machine,Terrassez 2 maîtres dompteurs des îles aux Dragons avec au moins 2 mascottes de type Machine.,128,142725,200,0,0
Récupérer une prime et un coffre de fournitures de guerre dans les plaines d’Ohn’ahra,Récupérez une prime de mode Guerre sur un personnage-joueur et ouvrez un coffre de fournitures de guerre dans les plaines d’Ohn’ahra.,129,142087,150,0,0
Terminer le siège du donjon du Fléau-des-Dragons,Terminez le scénario « Siège du donjon du Fléau-des-Dragons » sur les rivages de l’Éveil.,133,0,50,0,0
Accomplir des expéditions d’escalade,Accomplissez des expéditions d’escalade sur les îles aux Dragons.,135,142099,100,0,0
Se faire toucher par des tornades de tempête primaliste,Faites-vous toucher par des tornades durant un orage primaliste.,136,142112,50,0,0
Terminer des quêtes de caravane aylaag,Terminez des quêtes de caravane aylaag dans les plaines d’Ohn’ahran sur les îles aux Dragons.,137,142114,100,0,0
Traverser les vents des îles sur une monture draconique,Traversez les vents des îles sur une monture draconique sur les îles aux Dragons.,138,142133,50,0,0
Pêcher des objets dans des coins de pêche des Roharts iskaariens,,139,142135,50,0,0
Récupérer des jetons sanglants sur les îles aux Dragons,Accomplissez des activités JcJ sur les îles aux Dragons.,140,142224,150,0,0
Jardin des nobles : accomplir des quêtes quotidiennes,"Du {EventStartDate} au {EventEndDate}, accomplissez des quêtes du Jardin des nobles.",141,142243,100,0,0
Utiliser /sautiller devant des bestioles sur les îles aux Dragons,Utilisez l’emote /sautiller devant des bestioles sur les îles aux Dragons.,142,142248,50,0,0
Manger de la soupe en ayant « la classe »,Mangez de la soupe de la marmite commune à Iskaara en étant sous l’effet d’un jouet qui donne « la classe ».,143,142261,50,0,0
Anniversaire du comptoir : montrer votre /amour au comptoir,Utilisez l’emote /amour devant les marchands et marchandes du comptoir et leurs articles.,144,142268,50,0,0
Vaincre 25 boss de raid,,145,142290,250,0,10
Attraper un malabar avec des amis,Utilisez un harpon pour attraper un malabar avec au moins 5 autres personnages-joueurs sur les îles aux Dragons.,146,142297,50,0,0
Honorer des commandes d’artisanat publiques,Parlez à un représentant ou une représentante du Consortiumun au marché d’artisanat de Valdrakken pour accéder aux commandes.,147,142299,100,0,0
Honorer des commandes d’artisanat personnelles,Parlez à un maître de métier au marché d’artisanat de Valdrakken.,148,142303,100,0,0
Jardin des nobles : terminer un donjon de Dragonflight en portant un diadème du printemps,"Du {EventStartDate} au {EventEndDate}, terminez un donjon de Dragonflight en portant un diadème du printemps",149,142324,50,0,0
Vaincre des boss de la Fureur de l’orage,Vainquez des boss de la Fureur de l’orage dans l’avenir des Primalistes sur les îles aux Dragons.,150,142527,100,0,0
Honorer des commandes d’artisanat publiques,Parlez à un représentant ou une représentante du Consortium au marché d’artisanat de Valdrakken pour accéder aux commandes.,152,142299,100,0,0
Ouvrir des portes de caveaux de Zskera,Utilisez des clés pour ouvrir des portes dans les caveaux de Zskera.,154,143906,100,0,0
Terminer des grandes chasses des Centaures maruuks,Terminez des grandes chasses des Centaures maruuks sur les îles aux Dragons.,155,143919,150,0,0
"« Oui, chef ! » lors d’un festin tribal","« Oui, chef ! » à un festin tribal d’Iskaara sur les îles aux Dragons.",156,143922,50,0,0
Accomplir des expéditions de course draconique,,157,144066,50,0,0
Terminer les expéditions de l’expédition du Dracaret,Terminez des expéditions de l’expédition du Dracaret sur les îles aux Dragons.,158,143930,100,0,0
Vaincre des boss des tempêtes primordiales dans les confins Interdits,Venez à bout de boss des tempêtes primordiales dans les confins Interdits des îles aux Dragons.,159,143936,50,0,0
Achever les quêtes « Étincelles de vie »,Achevez les quêtes « Étincelles de vie » sur les îles aux Dragons.,160,143949,100,0,0
Accomplir des quêtes hebdomadaires dans les caveaux de Zskera,"Accomplissez des quêtes hebdomadaires dans les caveaux de Zskera, dans les confins Interdits des îles aux Dragons.",161,143955,75,0,0
Terrasser des dompteurs de mascottes des îles aux Dragons avec des mascottes de type Draconien,Terrassez les dompteurs des îles aux Dragons avec au moins 2 mascottes de type Draconien.,162,143959,200,0,0
Utiliser les sables traînants dans un donjon de Warlords of Draenor,,163,143966,50,0,0
Semaine des enfants : terminer une quête,"Du {EventStartDate} au {EventEndDate}, accomplissez une quête de la Semaine des enfants.",164,143968,100,0,0
Semaine des enfants : achever des quêtes journalières aux côtés d’un orphelin,"Du {EventStartDate} au {EventEndDate}, terminez des quêtes journalières avec un orphelin à vos côtés.",165,143977,100,0,0
Semaine des enfants : attraper des malabars au harpon aux côtés d’un orphelin,"Du {EventStartDate} au {EventEndDate}, utilisez un harpon pour attraper des malabars avec un orphelin à vos côtés.",166,143998,50,0,0
Semaine des enfants : terminer des quêtes,"Du {EventStartDate} au {EventEndDate}, accomplissez 4 quêtes de la Semaine des enfants.",167,144000,150,0,0
Semaine des enfants : utiliser /acclame devant Paéra Bonnebrise aux côtés d’un orphelin,"Du {EventStartDate} au {EventEndDate}, utilisez l’emote /acclame devant Paéra Bonnebrise à Iskaara avec un orphelin à vos côtés.",168,144011,50,0,0
Semaine des enfants : terminer des donjons mythiques + aux côtés d’un orphelin,"Du {EventStartDate} au {EventEndDate}, terminez des donjons mythiques + avec un orphelin à vos côtés.",169,144013,100,0,0
Printemps des montgolfières : effectuer une promenade en ballon,"Du {EventStartDate} au {EventEndDate}, grimpez dans une montgolfière et profitez du voyage.",170,144015,100,0,0
Fête des Chapeluisants : assister à la gloire et à la chute de Fshou,"Le {EventStartDate}, maintenez Fshou en vie le plus longtemps possible à Sporeggar, dans le marécage de Zangar.",171,144017,150,0,0
Foire de Sombrelune : accomplir la quête « Commandant de chariotte »,"Du {EventStartDate} au {EventEndDate}, accomplissez la quête Commandant de chariotte sur l’île de la foire de Sombrelune.",172,144021,50,0,0
Foire de Sombrelune : ballon + poney = génial,"Du {EventStartDate} au {EventEndDate}, chevauchez un poney de Sombrelune avec un ballon à la main sur l’île de la foire de Sombrelune.",173,144028,50,0,0
Pêche au canard en plastique,"Utilisez le jouet caisse de flotteurs : canard en plastique, puis pêchez des objets sur les îles aux Dragons.",174,144039,50,0,0
Tuer des créatures sous la bannière de la Lame-Ardente,Tuez des créatures donnant de l’expérience sous l’influence de la bannière de la Lame-Ardente sur les îles aux Dragons.,175,144041,50,0,0
Utiliser le bourboculaire,"Utilisez le bourboculaire à Valdrakken, Iskaara, Maruukaï et au camp de base du Dracaret.",176,144043,100,0,0
/Danser devant un bourboculaire,Utilisez l’emote /danser devant un personnage-joueur ayant l’effet du bourboculaire.,177,144048,50,0,0
Renverser un plateau de Hearthstone,Utilisez le jouet Plateau de Hearthstone ou le plateau disponible à l’auberge de la Charnière égarée dans la travée d’Azur.,178,144050,50,0,0
Tirer ou utiliser un traîneau à traction d’Iskaara,Utilisez le traîneau à traction d’Iskaara pour le tirer ou monter sur celui d’un autre.,179,144056,50,0,0
Marcheurs du temps : vaincre des dompteurs de mascottes de Draenor,"Du {EventStartDate} au {EventEndDate}, terrassez les maîtres dompteurs de Draenor.",180,144059,100,0,0
Terminer des courses draconiques inversées dans les confins Interdits,Parlez à un chronométreur de bronze des confins Interdits sur les îles aux Dragons.,181,144100,100,0,0
Pêcher des poissons de lave sur les îles aux Dragons,,182,144559,100,0,0
[DNT] Test: Noblegarden: Complete a Dragonflight Dungeon in a Spring Circlet,"[DNT]  Test: From {EventStartDate} - {EventEndDate}, complete a Dragonflight dungeon wearing any Spring Circlet.",184,144640,150,0,0
Récupérer de la Vigueur en volant en rase-mottes à dos de Dragon,,185,144628,100,0,0
Terminer les expéditions de l’expédition du Dracaret dans la grotte de Zaralek,Terminez des expéditions de catalogage et d’escalade dans la grotte de Zaralek.,186,144630,100,0,0
Attraper des malabars de lave au harpon,Utilisez un harpon iskaarien pour attraper des malabars de lave près d’un coin de pêche à malabar sur les îles aux Dragons.,187,144835,100,0,0
Tuer des personnages-joueurs sur les rivages de l’Éveil,,188,144916,100,0,0
