ID,Description_lang,Name_lang,ManagedWorldStateInputID,OrderIndex,ContributionStyleContainer,UiTextureAtlasMemberID[0],UiTextureAtlasMemberID[1],UiTextureAtlasMemberID[2],UiTextureAtlasMemberID[3]
1,"Nutzt arkane Energien, um Streitkräfte der Legionsrichter schnell über die Verheerten Inseln zu bewegen und gefährliche Handlanger der Legion zu entdecken.",Magierturm,1,1,1,6325,6322,6324,6323
2,,,0,0,0,0,0,0,0
3,"Ein befestigter Stützpunkt, an dem sich die Anführer der Klassenorden versammeln und ihre Angriffe an der Verheerten Küste planen können.",Kommandozentrale,2,2,1,6321,6318,6320,6319
4,"Ein uralter Mondbrunnen der Elfen, dessen Macht die aus dem Grabmal ausströmende Netherenergie eindämmen und bisher verhüllte Geheimnisse aufdecken kann.",Netherdisruptor,3,3,1,6329,6326,6328,6327
11,"Spendet Vorräte für die Kriegsanstrengungen, während die drohende Schlacht um das Arathihochland näher rückt.",Schlacht um Stromgarde,10,1,2,6321,6318,6320,6319
116,"Spendet Vorräte für die Kriegsanstrengungen, während die drohende Schlacht um das Arathihochland näher rückt.",Schlacht um Stromgarde,115,1,2,6321,6318,6320,6319
117,"Spendet Vorräte für die Kriegsanstrengungen, während die drohende Schlacht um die Dunkelküste näher rückt.",Schlacht um die Dunkelküste,116,1,2,6321,6318,6320,6319
118,"Spendet Vorräte für die Kriegsanstrengungen, während die drohende Schlacht um die Dunkelküste näher rückt.",Schlacht um die Dunkelküste,117,1,2,6321,6318,6320,6319
119,"Steuert Wachs zu Middels' Sammlung bei, um neue Belohnungen freizuschalten!",Wachssammlung,118,2,1,6321,6318,6320,6319
