ID,Name_lang,Description_lang,BountySetID,SkillLineID,DeathTeleportSpellID,Field_9_0_2_36165_006,Field_9_0_2_36165_007,FactionID,Field_10_0_0_45141_008
1,Kyrianer,"Die Kyrianer sind die standhaften Wächter des Jenseits und geleiten die Seelen der Toten in die Schattenlande. Sie widmen ihr ganzes Dasein ihren Pflichten und ihrem ewigen Dienst, und nur den Würdigen ist es vergönnt, sich ihnen anzuschließen.",111,2730,315066,346042,346046,2407,1829
2,Venthyr,"Die adligen Venthyr sind die Aufseher aller Seelen, auf denen die Bürde exzessiven Stolzes und maßloser Boshaftigkeit lastet. Sie führen derart geplagte Seelen auf den rechtschaffenen Pfad zur Sühne und ernten dabei Anima, um die Stärke ihres Reichs zu bewahren.",112,2731,344545,346037,346043,2413,1830
3,Nachtfae,"Die Nachtfae kümmern sich um die gefallenen Naturgeister, die in ihrem friedvollen Wald ruhen. Wer eine innige Verbindung zur Natur besitzt, vermag sich ihrer Sache anzuschließen, um dafür zu sorgen, dass die regenerierten Geister eines Tages wieder in den ewigen Kreislauf zurückkehren können.",114,2732,344538,346039,346044,2465,1831
4,Nekrolords,"Unter den Nekrolords wird Stärke belohnt und Schwäche getilgt. Die Seelen der Ehrgeizigen und Streitsüchtigen werden zu einer Armee aus unsterblichen Soldaten geschmiedet, deren Aufgabe es ist, die Schattenlande zu verteidigen.",113,2733,344544,346041,346045,2410,1832
12,Zentauren der Maruuk,Die verschiedenen Zentaurenklans der Ebenen von Ohn'ahra werden allesamt als Zentauren der Maruuk bezeichnet.,119,0,0,0,0,2503,2002
13,Drachenschuppenexpedition,Die Forscherliga und die Archäologische Akademie haben sich für eine gemeinsame Expedition auf den Dracheninseln zusammengeschlossen.,119,0,0,0,0,2507,2021
14,Tuskarr von Iskaara,Zäher Tuskarrstamm der Dracheninseln.,119,0,0,0,0,2511,2087
15,Das Valdrakkenabkommen,"Valdrakken ist die strahlende Hauptstadt der Drachenschwärme, und an diesem Ort wurde eine Abkommen geschlossen, den sterblichen Völkern auf ein Neues zu helfen.",119,0,0,0,0,2510,2088
