Field_9_2_0_42174_000_lang,ID,Season,Field_9_2_0_41827_001,ExpansionID,Field_10_0_2_45779_004,DelvesSeasonID
Besiegt %d |4Schlachtzugboss:Schlachtzugbosse; in Schloss Nathria,10,5,1,8,1,0
Besiegt %d |4Schlachtzugboss:Schlachtzugbosse; im Sanktum der Herrschaft,11,6,2,8,1,0
Besiegt %d |4Schlachtzugboss:Schlachtzugbosse; im Mausoleum der Ersten,12,7,3,8,1,0
Besiegt %d |4Boss:Bosse; (Schicksalhafter Schlachtzug),17,8,4,8,1,0
Besiegt %d |4Boss:Bosse; der Gewölbe der Inkarnationen,19,9,1,9,2,0
"Besiegt %d |4Boss:Bosse; in Aberrus, Schmelztiegel der Schatten.",21,10,2,9,2,0
"Besiegt %d |4Boss:Bosse; in Amirdrassil, Hoffnung des Traums",22,11,3,9,2,0
Besiegt %d |4Boss:Bosse; (Erweckter Schlachtzug),23,12,4,9,2,0
Besiegt %d |4Boss:Bosse; im Palast der Nerub'ar,24,13,1,10,3,1
Besiegt %d |4Boss:Bosse in Befreiung von Lorenhall,25,14,2,10,3,2
