ID,Text_lang,Title_lang,ConditionID
3,"The Winter Queen has asked for you to deliver a message to Sire Denathrius, the Master of Revendreth. You will need his help for the coming conflict.",Welcome to Revendreth,0
111,Test,,0
158,"Following an unprovoked assault on Bastion, you were tasked with journeying to Maldraxxus and investigating why the armies of the dead have betrayed their oath to defend the Shadowlands.",Champion of Pain,0
277,"Using a set of blueprints you recovered and the destructive capabilities of the G.M.O.D. at your disposal, you and Gallywix managed to destroy an airship utilized by High Tinker Mekkatorque and set Alliance interests in Drustvar back even further.",,0
1062,"With Deathwing's menace ended, Warchief Garrosh Hellscream seized the opportunity to strike at the Alliance and expand the Horde's territory on Kalimdor. His assault completely obliterated the human city of Theramore, causing world-wide violence between the factions to erupt anew.

A destructive naval skirmish left you stranded in the Jade Forest on the fog-shrouded island of Pandaria. To survive, you must find new allies in this strange land.",Into the Mists,49081
1076,"In the aftermath of the shipwreck, you were able to locate many of your allies that had gone missing. With them you repelled both the hozen and the Alliance. You defeated a group of Alliance soldiers and were able to claim their base for the Horde.",,120133
1064,"After a battle with the Alliance, you witnessed General Nazgrim being overcome by a mysterious dark energy called the ""Sha."" He was saved by a pandaren named Taran Zhu, who told you that the Sha thrives on negative emotions such as anger, fear, and doubt. Taran Zhu warned that the conflict between the Alliance and the Horde will have immense consequences for the land itself.

Largely ignoring this warning, the Horde began to expand its presence in the Jade Forest.",The Jade Forest,120008
1079,"In the village of Dawn's Blossom, you heard that some locals had gone missing lately. Together with some of the local children, you discovered that a witch who lived nearby had been turning people into Jade Statues. You confronted the witch in her home, defeated her, and restored to life all the people who had been turned to statues.",,120136
1078,"You met the pandaren Lorewalker Cho and exchanged stories about your peoples. He taught you about pandaren history and offered to help you befriend a nearby tribe of hozen. After helping the hozen with a host of problems, they agreed to join the Horde in its efforts.",,120135
