Description_lang,SourceText_lang,ID,CreatureID,SummonSpellID,IconFileDataID,PetTypeEnum,Flags,SourceTypeEnum,CardUIModelSceneID,LoadoutUIModelSceneID,CovenantID
무엇이든 될 수 있습니다. *모든 것*이 될 수 있죠. 그전까진... 이 모습이겠지만요.,|cFFFFD200전문 기술:|r 원생형태 합성,3171,181336,359605,4219626,5,2,3,402,403,0
"얼굴이 없어 장담하긴 어렵지만, 어쨌든 당신을 좋아하는 것 같습니다.",|cFFFFD200보물: |r찰나의 보주|n|cFFFFD200지역: |r제레스 모르티스,3172,181337,359606,4219627,5,82,0,402,403,0
이 원시두꺼비의 상징적인 노래는 아주 먼 거리에서도 들릴 정도입니다.,|cFFFFD200애완동물 대전:|r 제레스 모르티스|n,3173,181362,0,3778581,8,26,4,6,7,0
"안면 구체와 제조 입방체, 성공적인 호기심이 어우러진 결과물입니다.",|cFFFFD200전문 기술:|r 원생형태 합성|n,3174,181488,359760,3747898,7,2,3,6,7,0
아기 멀록의 부화 여왕인 아옳스트라자는 숙적 데씨와 오랜 세월 싸워왔습니다.,|cFFFFD200프로모션:|r 용군단 영웅 에디션|n,3175,181535,359805,4050685,1,82,7,435,436,0
땅굴을 파는 모습을 보이는 봄바타는 하나같이 합성된 지 얼마 안 된 친구들입니다. 나머지는 지하에서 즐겁게 땅을 파며 두 번 다시 나타나지 않죠.,|cFFFFD200전문 기술:|r 원생형태 합성|n,3176,181547,359813,3747899,7,2,3,6,7,0
"아기 용기병은 참 귀한 구경이지만, 세상은 별난 일로 가득하답니다.",|cFFFFD200프로모션:|r 용군단 일반 에디션,3177,181575,359855,4186101,1,82,7,6,7,0
"부리와 날개 두 개, 멈출 수 없는 기질, 멈추지 않으려는 의지가 어우러진 결과물입니다.",|cFFFFD200전문 기술:|r 원생형태 합성|n,3178,181578,359863,3672192,2,2,3,6,7,0
"바위와 더 큰 바위 두 개, 작은 바위 세 개, 무엇이든 옮기는 능력이 어우러진 결과물입니다.",|cFFFFD200전문 기술:|r 원생형태 합성|n,3179,181615,359898,4227081,6,2,3,6,7,0
모험심이 강한 제레스 모르티스 주민들은 맹독 원시두꺼비를 별미로 여깁니다.,|cFFFFD200애완동물 대전:|r 제레스 모르티스|n,3180,182019,0,3778583,8,26,4,6,278,0
"미끈거리는 피부와 강력한 다리, 울음주머니 한 개, 완전한 자아수용 하나가 어우러진 결과물입니다.",|cFFFFD200전문 기술:|r 원생형태 합성|n,3181,182081,360389,3778580,8,2,3,6,7,0
,,3188,182140,360567,134176,7,16466,-1,6,7,0
"복제 부품이 하나, 복제 부품이 둘, 복제 부품이 넷... 이런.",|cFFFFD200전문 기술:|r 원생형태 합성,3189,182183,360691,3922912,4,2,3,254,7,0
"온순하고 깜찍한 원시토끼가 있는가 하면, 다른 녀석들은... 귀엽긴 귀여운데...",|cFFFFD200애완동물 대전: |r제레스 모르티스,3190,182216,0,3922917,4,26,4,6,7,0
소심한 원시토끼는 땅속 깊은 곳에서 살아갑니다. 먹이를 구할 때만 지상에 올라왔다 돌아가죠.,|cFFFFD200애완동물 대전: |r제레스 모르티스,3191,182234,0,3922913,4,26,4,6,7,0
"덩치 큰 새 원형은 작은 동물을 먹이로 삼지만, 새끼들은 대체로 곤충과 벌레를 먹습니다.",|cFFFFD200애완동물 대전: |r제레스 모르티스,3196,182260,0,4227077,2,26,4,6,7,0
"아가미, 성급함, 그리고 무엇이든 하려는 기질이 어우러진 결과물입니다.",|cFFFFD200전문 기술:|r 원생형태 합성|n,3197,182264,360800,3934485,8,2,3,6,7,0
주홍빛 새 원형은 붉은 천연색을 타고나기에 포식자에게서 몸을 숨기는 데 많은 어려움이 뒤따릅니다. 그렇다 보니 역설적이게도 찾아보기 매우 어렵습니다.,|cFFFFD200애완동물 대전: |r제레스 모르티스,3200,182294,0,4227079,2,26,4,6,7,0
"다리 여덟 개, 눈 여덟 개, 밧줄, 만족을 모르는 허기가 어우러진 결과물입니다.",|cFFFFD200전문 기술:|r 원생형태 합성|n,3201,182393,360986,3684808,7,2,3,6,7,0
"가만히 먹잇감을 기다리는 원시거미도 있지만, 이 녀석들은 먹잇감을 추적해 무력화한 뒤 통째로 삼키는 걸 선호합니다.",|cFFFFD200애완동물 대전: |r제레스 모르티스,3202,182437,0,3684809,7,26,4,6,7,0
이 생명체의 영역에 들어온 먹잇감은 대부분 살아나가지 못합니다.,|cFFFFD200애완동물 대전: |r제레스 모르티스,3203,182473,0,3684810,7,26,4,6,7,0
"껍질, 발톱, 가능한 한 많은 회복력이 어우러진 결과물입니다.",|cFFFFD200전문 기술: |r원생형태 합성,3204,182504,361157,3922918,4,2,3,6,7,0
제레스 모르티스의 몇몇 소형 원시풍뎅이는 자신을 보호하기 위한 금속 껍질을 보유하고 있습니다. 근사한 생김새는 덤이죠.,|cFFFFD200애완동물 대전: |r제레스 모르티스,3205,182568,0,3922919,4,26,4,6,7,0
이 원시풍뎅이의 밝은 껍질은 잠재적인 짝의 흥미를 돋웁니다. 바꿔 말하자면 잠재적인 포식자의 흥미를 돋우기도 하는 셈이죠.,|cFFFFD200애완동물 대전: |r제레스 모르티스,3206,182691,0,3922921,4,26,4,6,7,0
"계획성 세 개와 위험성, 고불고불한 면이 어우러진 결과물입니다.",|cFFFFD200전문 기술:|r 원생형태 합성|n,3207,182735,361400,4095284,7,2,3,6,7,0
이 원시뱀의 두드러지는 붉은 천연색은 잠재적인 포식자에게 경고로 통합니다. '먹으려거든 위험을 감수할 것!',|cFFFFD200애완동물 대전: |r제레스 모르티스,3208,182758,0,4095288,7,26,4,6,7,0
육중한 원시뱀은 어디에 자리를 잡느냐고요? 어디든 내키는 곳에 앉는답니다.,|cFFFFD200애완동물 대전: |r제레스 모르티스,3209,182760,0,4095284,7,26,4,6,7,0
이 원시뱀은 몇 시간이고 가만히 먹잇감을 기다릴 수 있습니다.,|cFFFFD200애완동물 대전: |r제레스 모르티스,3210,182768,0,4095286,7,26,4,6,7,0
"날개 두 개와 단검, 가학성 다섯 개가 어우러진 결과물입니다.",|cFFFFD200전문 기술:|r 원생형태 합성|n,3211,182840,361572,3741937,2,2,3,6,7,0
"이승에서든, 사후 세계에서든 불변하는 것은 있기 마련입니다. 피를 빨아먹는 고약한 곤충이 그렇습니다.",|cFFFFD200애완동물 대전: |r제레스 모르티스,3212,182876,0,3741939,2,26,4,6,7,0
"취약한 외형을 갖고 있지만, 포식자가 어린 봄바타를 공격하는 경우는 드문 편입니다. 이유는 명확하게 밝혀진 바가 없지만 봄바타의 깜찍한 코와 관련이 있다는 것이 중론입니다.",|cFFFFD200애완동물 대전: |r제레스 모르티스,3213,183142,0,3747900,7,26,4,6,7,0
제레스 모르티스에는 무시무시한 존재가 수없이 많습니다. 그렇지만 새끼를 지키는 봄바타보다 무서운(동시에 깜찍한) 건 없습니다.,|cFFFFD200애완동물 대전: |r제레스 모르티스,3214,183158,0,3747901,7,26,4,6,7,0
나락에 물든 대지정령을 보고 정신이 온전한 이는 하나도 없습니다. 그렇지만 나락에 물든 대지정령을 본 사람은 무척이나 많습니다.,|cFFFFD200애완동물 대전: |r제레스 모르티스,3215,183230,0,4227080,6,26,4,6,7,0
이 덥석이 원시도롱뇽은 제레스 모르티스의 생명체 중 가장 서글서글한 녀석입니다... 돌변할 때가 문제죠.,|cFFFFD200애완동물 대전: |r제레스 모르티스,3216,183277,0,3934486,8,26,4,6,7,0
"제레스 모르티스의 원시해파리 대부분은 수영을 선호하지만, 비행 능력을 타고나는 녀석도 있습니다!",|cFFFFD200애완동물 대전: |r제레스 모르티스,3217,183281,0,4227095,8,26,4,6,7,0
이 원시닭을 감히 '닭'이라고 부를 수 있는 사람은 없을 겁니다.,|cFFFFD200애완동물 대전: |r제레스 모르티스,3218,183285,0,4096556,2,26,4,6,7,0
이 원시달팽이는 싸움이 붙으면 육중한 장갑 껍질 안으로 숨습니다. 여기서 더 자극하면 압도적인 힘으로 공격을 퍼붓죠.,|cFFFFD200애완동물 대전: |r제레스 모르티스,3219,183292,0,3764236,4,26,4,6,7,0
"날개 두 개와 부리, 갈퀴발톱 두 개, 우쭐함이 어우러진 결과물입니다.",|cFFFFD200전문 기술:|r 원생형태 합성,3220,183557,362640,4096544,2,2,3,6,7,0
이 자그마한 토르가스트의 고문관은 탑에서 자신을 밟지 못하는 영혼에게 고통을 주는 데서 쾌락을 얻습니다.,|cFFFFD200업적: |r간수의 시험: 1단계|n|cFFFFD200분류: |r토르가스트,3221,183772,363086,3731618,0,82,5,6,7,0
정말 사랑스러운 원시달팽이죠?,|cFFFFD200전문 기술: |r원생형태 합성,3222,184196,364255,3764237,4,2,3,6,7,0
원시도롱뇽은 날렵하지만 겁이 많은 생명체입니다. 위험을 인지하는 순간 쏜살같이 가장 가까운 구멍 속으로 숨어 버리죠.,|cFFFFD200전문 기술: |r원생형태 합성,3223,184183,364174,3934487,8,2,3,6,7,0
이 붉은빛을 띠는 원시풍뎅이는 잠재적인 적에게 함부로 건드려선 안 될 존재라는 인식을 심어줍니다.,|cFFFFD200전문 기술:|r 원생형태 합성,3224,184184,364176,3922923,4,10,3,6,7,0
이 원시닭은 적개심이 강하지만 화를 내는 법이 없습니다. 전투의 매 순간을 즐길 뿐이죠.,|cFFFFD200전문 기술: |r원생형태 합성,3225,184189,364178,4096554,2,2,3,6,7,0
어떤 부분이 “다중”인지는 명확하지 않습니다.,|cFFFFD200전문 기술: |r원생형태 합성,3226,184190,364181,4096555,2,2,3,6,7,0
리후빔의 대지정령 창조물은 걸어 다니는 바윗덩어리 중에서도 제일 멋진 녀석들입니다.,|cFFFFD200전문 기술: |r원생형태 합성,3227,184191,364182,4227083,6,2,3,6,7,0
몇 번이고 계속 반복해서 부활하는 젤리로 구성된 결과물입니다.,|cFFFFD200전문 기술: |r원생형태 합성,3229,184186,364259,4227094,8,2,3,6,7,0
"공포를 먹고 살지만, 너무 깜찍해서 직접 공포를 불어넣진 못합니다.",|cFFFFD200전문 기술: |r원생형태 합성,3230,184192,364184,4227092,8,2,3,6,7,0
이 생명체의 존재야말로 저 바깥 어딘가에 좀 더 고등하고 간질간질한 원시해파리가 존재함을 강력하게 나타내는 증거입니다.,|cFFFFD200전문 기술: |r원생형태 합성,3231,184193,364193,4227093,8,2,3,6,7,0
이 원시토끼는 혼자 내버려 두면 하늘 높이 펄쩍 뛰어오르곤 합니다. 어떨 때는 제대로 착지하기도 하죠.,|cFFFFD200전문 기술: |r원생형태 합성,3232,184194,364251,3922916,4,2,3,254,7,0
"굳건함 두 개와 눈자루, 점액이 어우러진 결과물입니다.",|cFFFFD200전문 기술: |r원생형태 합성,3233,184187,364254,3764235,4,2,3,6,7,0
"얌전히 먹잇감을 기다리는 원시뱀도 있지만, 이 변종은 몇 시간이고 식사를 뒤쫓는 집념을 발휘하곤 합니다.",|cFFFFD200전문 기술:|r 원생형태 합성|n,3234,184197,364256,4095289,7,2,3,6,7,0
"합성 생명체는 만들어질 때부터 성체인데, 미성숙한 원시달팽이는 대체 누가 설계한 걸까요?",|cFFFFD200전문 기술: |r원생형태 합성,3235,184195,364252,3764238,4,2,3,6,7,0
"용감하고, 파격적이며, 살짝 덤벙대는 면까지. 그야말로 노움 공학자의 표상이랍니다!",|cFFFFD200프로모션|r,3236,184285,364451,4226119,0,82,7,6,7,0
"너무 커졌다가, 지나치게 작아졌다가, 겨우겨우 딱 알맞은 덩치를 찾은 원시도롱뇽입니다. 보금자리까지 당신을 뒤따라왔답니다!",|cFFFFD200퀘스트:|r 제가 키워도 되나요?,3237,184923,366069,3934488,8,82,1,6,7,0
"마지막 만남 이후로 벤진과 마카폰이 바쁘게 지낸 모양입니다. 마카진은 모험을 떠날 준비가 됐지만, 채소를 산더미처럼 주는 것만으로도 만족할 겁니다.",|cFFFFD200교역소|r,3242,185322,366833,1881827,7,16466,2,6,7,0
황금과도 같은 마음을 갖고 있습니다. 문자 그대로 말이죠. 세계의 부자 노움들 사이에서는 이 반짝이는 친구들이 선풍적인 인기를 끌고 있다네요.,|cFFFFD200교역소|r,3243,183686,366841,1567069,9,16466,2,6,7,0
아득히 먼 옛날 영리한 죽음의 로아에게 속아 끝없는 봉사를 하게 된 고대의 존재입니다. 언제나 분노로 가득한 채 책무를 수행합니다.,|cFFFFD200교역소|r,3244,185324,366842,2027568,3,16466,2,6,7,0
이 작은 네루비안제 로봇의 바닥 부분에는 '빕밥'이라는 이름과 '제작자: 스레디스'라는 문구가 정성스레 새겨져 있습니다.,|cFFFFD200이벤트:|r 어린이 주간,3245,185425,367189,4235634,9,2,6,6,7,0
,,3246,185475,0,236446,2,16400,-1,6,7,0
"진짜 포코폭은 아니지만, 제레스 모르티스 외부에서도 사용할 수 있도록 건네받은 복제품입니다. 만듦새가 어찌나 세밀한지, 진짜와 오랜 시간을 보내지 않은 사람이라면 깜빡 속아 넘어가고도 남을 정도입니다.",|cFFFFD200상인: |r올리아 마누|n|cFFFFD200지역: |r제레스 모르티스|n|cFFFFD200가격: |r500|Hcurrency:1979|h|TInterface\ICONS\INV_Trinket_ProgenitorRaid_02_Blue.BLP:0|t|h,3247,185477,367376,4327611,5,147,2,41,7,0
이카보드는 원래 서부 몰락지대의 농부들을 공포의 도가니로 몰아넣었던 허수아비골렘의 시험생산품이 시초였습니다. 하지만 노움 특유의 기발함이 살짝 가미되면서 사람의 무릎을 공격할 확률도 크게 줄어들게 되었습니다.,|cFFFFD200프로모션|r |n,3248,183638,367696,4206469,9,16466,9,6,7,0
"야생의 신으로 알려지기 전, 우르속은 그저 회색 구릉지를 배회하는 한 마리의 새끼 곰에 불과했습니다.",|cFFFFD200게임 내 상점|r |n,3249,185586,367702,4208901,7,82,9,6,7,0
위대한 운명을 타고나는 매타조도 있기 마련입니다. 에그밥이 될 운명을 타고나는 녀석도 있고요.,|cFFFFD200교역소|r,3250,183708,367732,294475,4,16466,2,6,7,0
고독한 삶을 사는 것으로 알려진 붉은 벌의 한 종입니다. 그래도 당신과는 기꺼이 어울려줄 것 같습니다.,|cFFFFD200교역소|r,3251,185604,367748,2027854,2,16466,2,6,7,0
가를로크는 고대 고리안 혈통입니다. 제국을 세우겠다는 야심을 품고 있지만 특유의 왜소한 체구가 걸림돌이 되고 있죠.,|cFFFFD200교역소|r,3252,185606,367768,4215254,0,16466,11,6,7,0
거리낌 없이 물건을 부수는 기질을 타고난 코도들은 어릴 때부터 공성 훈련을 받습니다. 정강이 조심하시길.,|cFFFFD200게임 내 상점|r,3253,185611,367778,4205812,7,16466,2,33,7,0
이 감시자의 순진무구한 눈 이면에는 그림자 속에서 적들을 노리는 여사냥꾼의 치명적인 위험성이 숨어 있습니다.,|cFFFFD200교역소|r,3254,185621,367800,133247,2,16466,2,6,7,0
분홍색 가지뿔 덕분에 어떤 연회에서든 주인공 대우를 받습니다.,|cFFFFD200교역소|r,3255,185756,368314,2481371,7,16466,2,6,7,0
용의 섬의 전문 보석세공인들이 실력을 완벽하게 갈고닦은 나머지 보석 조각상이 살아 움직이는 경지에 올랐습니다. 이 흑요석 새끼용은 결코 함부로 건드려선 안 될 존재입니다.,|cFFFFD200전문 기술:|r 보석세공|n,3256,186844,369723,4397690,1,2,3,6,7,0
,,3257,186884,0,3922922,4,56,-1,6,7,0
"단추 같은 코부터 치명적인 발톱까지, 깜찍함으로 무장한 토끼 친구랍니다.",|cFFFFD200보물: |r특이품 자루,3259,188709,371534,3733064,4,2,0,6,7,0
사실상 투명에 가까운 이 동물은 눈으로 뒤덮인 나무 사이를 풀쩍풀쩍 뛰어다닙니다.,|cFFFFD200애완동물 대전: |r하늘빛 평원,3260,188792,0,4528721,4,26,4,6,7,0
"희망은 이 불사조와 같아서, 산산이 조각난 꿈의 잿더미 속에서 일어나기 마련입니다.",|cFFFFD200획득: |r감시자 엔트릭스|n|cFFFFD200지역: |r금지된 해안,3261,188821,371594,4007138,5,2,0,6,7,0
"마법사인지, 용인지, 아니면 다른 마법의 존재인지는 몰라도 참 영리한 친구가 만든 결과물입니다. 얼음 정령을 보라색으로 물들이면 참 재밌을 거라고 생각한 모양이에요. 뭐, 틀린 생각은 아닙니다.",|cFFFFD200업적:|r 세상의 사랑을 받는 몸|n,3262,188849,371621,4572524,7,82,5,6,7,0
"오리처럼 생겼고, 오리 냄새가 나고, 오리 소리를 냅니다. 그런데 오리가 뭐죠?",|cFFFFD200업적:|r 진정한 애완동물 보호자,3263,188861,371636,4533201,8,82,5,6,7,0
수정 조각의 단면의 파편의 편린의 부스러기입니다. 그렇지만 기세만큼은 세상의 주인 못지않죠. 당신을 마음에 들어 하는 것 같아 참 다행입니다.,|cFFFFD200업적:|r 미니 하수인이 너무 많아,3264,188885,371655,133244,5,82,5,6,7,0
악취가 진동하는 머스켄을 가능한 한 미화하면 이런 모습일 겁니다.,|cFFFFD200업적:|r 소소하지만 확실한 행복,3265,188901,371675,4572410,7,80,5,6,7,0
슬라이번은 푸른 평야와 굴곡진 언덕 위를 누빕니다. 지면에 남는 자그마한 그림자는 슬라이번이 지나간 하늘길을 어렴풋이 보여줄 뿐입니다.,|cFFFFD200애완동물 대전: |r온아라 평야,3266,189160,0,4215000,2,26,4,6,7,0
당신 관점으로는 다음 주에 만난 적 있는 슬라이번이랍니다. 슬라이번 관점에서는 작년이 되겠군요.,,3267,189211,371930,4215003,2,16416,-1,6,7,0
,,3268,189376,0,2399293,8,33840,-1,6,7,0
하늘을 누비던 중 만난 물고기입니다. 참 유별난 일이죠.,|cFFFFD200보물:|r 거품 떠돌이|n|cFFFFD200지역: |r깨어나는 해안,3269,189663,372585,4539687,8,2,0,6,7,0
이 생선은 몇몇 이들에게 고된 환경에서의 생존담을 능수능란하게 이야기해줍니다. 하지만 대부분의 사람들은 '보글' 소리만 듣게 되지요.,|cFFFFD200상인: |r패추|n|cFFFFD200지역: |r하늘빛 평원|n|cFFFFD200가격: |r300|Hitem:163036|h|TInterface\ICONS\INV_Currency_PetBattle.BLP:0|t|h,3270,189695,372750,4539689,8,2,2,6,7,0
지금까지 만나본 뾰족한 생명체 중 이렇게 쓰다듬고 싶은 녀석은 없었을 겁니다.,"|cFFFFD200애완동물 대전: |r온아라 평야, 탈드라서스, 하늘빛 평원, 깨어나는 해안",3272,189093,0,3733067,4,26,4,6,7,0
"무슨 조화를 부렸는지는 몰라도, 이 생명체는 열기와 단단함, 끈적함을 동시에 유지하는 방법을 터득했습니다.",|cFFFFD200애완동물 대전: |r깨어나는 해안,3273,189094,0,3996722,6,26,4,6,7,0
"앨빈이 최고의 모루가 되고 싶다고 했을 때, 모두가 의구심을 표했습니다. 모루가 웃을 수 있다면 앨빈은 지금쯤 박장대소를 터뜨리고 있을 거예요.",|cFFFFD200전문 기술:|r 대장기술|n,3274,189095,378738,1020356,9,2,3,6,7,0
언젠가 한 번은 밤이 자기 몸집보다 큰 도토리를 찾은 적이 있었습니다. 그걸 통째로 삼켜 덩치를 두 배로 불렸죠. 트룬칼룸프를 먹지 않아서 다행이 아닐 수 없습니다.,|cFFFFD200보물:|r 도토리 수확꾼|n|cFFFFD200지역:|r 탈드라서스|n,3275,189096,374600,4528722,4,2,0,6,7,0
이 깜찍한 생물의 코를 쿡 찌르려고 시도한 이들은 수없이 많습니다. 그리고 대다수가 손가락을 잃었죠.,"|cFFFFD200애완동물 대전: |r온아라 평야, 탈드라서스, 하늘빛 평원",3276,189097,0,4528723,4,26,4,6,7,0
"이 꼬마 동물 친구는 지난 3년을 참 부산하게 보냈습니다. 다음 해에 태어나 작년에 무럭무럭 컸고, 올해 당신의 애완동물이 되었죠.",,3277,189098,374710,3732476,4,16416,-1,6,7,0
피스타치오의 이름이 피스타치오인 이유가 있냐고요? 지금 머릿속에 떠올린 바로 그 이유 때문이랍니다.,|cFFFFD200상인: |r패추|n|cFFFFD200지역: |r하늘빛 평원|n|cFFFFD200가격: |r50|Hitem:163036|h|TInterface\ICONS\INV_Currency_PetBattle.BLP:0|t|h,3278,189099,374734,4528732,4,2,2,6,7,0
"이 꼬마 경주 애호가가 경주를 얼마나 그리워했는지 모릅니다. 게다가, 아직 마음에 드는 경주자를 한 번도 못 만나봤다네요.",|cFFFFD200업적:|r 용 경주 완전 정복 - 은메달|n,3279,189101,387685,4452490,1,82,5,6,7,0
이 쉽게 볼 수 없는 생명체들은 찾기 무척이나 어려운 것으로 악명이 자자합니다. 어디에서 찾아야 할지 안다면 얘기가 달라지지만요. 하니코가 방법을 알려줬으니 다행이죠.,|cFFFFD200애완동물 대전: |r깨어나는 해안,3280,189102,0,3995640,2,65546,4,6,7,0
"싸우고, 씻고, 놀고... 우리 오투크들은 무척이나 바쁜 일정을 소화하고 있답니다.","|cFFFFD200애완동물 대전: |r온아라 평야, 하늘빛 평원, 깨어나는 해안",3281,189103,0,3751917,8,26,4,6,7,0
다 큰 용뿔두꺼비의 배가 울리는 소리는 아주 먼 거리에서도 들을 수 있습니다. 새끼 용뿔두꺼비의 앙증맞은 소리는 그보다 범위는 좁지만 음율이 살아있죠.,"|cFFFFD200애완동물 대전: |r온아라 평야, 탈드라서스, 하늘빛 평원, 깨어나는 해안",3282,189104,0,1802889,8,26,4,6,7,0
등골이 서늘해져도 두려워 마세요. 애완 눈송이 정령일 겁니다.,"|cFFFFD200애완동물 대전: |r하늘빛 평원, 깨어나는 해안",3283,189107,0,4554460,6,26,4,6,7,0
"아기 오투크들은 수영, 나비 꽁무니 쫓아다니기, 위협적인 포효 연습 등을 하면서 유년기를 보냅니다.",|cFFFFD200진영: |r이스카라 투스카르|n|cFFFFD200영예: |r9|n|cFFFFD200상인: |r지크|n|cFFFFD200지역: |r이스카라,3284,189105,374889,3751919,8,18,2,6,7,0
똘망똘망한 눈망울에 당신의 모습이 비쳐 보입니다. 사실 눈이 너무 커서 다른 모든 게 보이죠.,|cFFFFD200획득: |r루트로크|n|cFFFFD200지역: |r금지된 해안,3285,189106,374895,3751920,8,2,0,6,7,0
이 친구 이름이 왜 털털 군이냐고요? 털털대는 소리를 내면서 돌아다니거든요.,|cFFFFD200퀘스트: |r상황 전달|n|cFFFFD200지역: |r깨어나는 해안,3286,189108,374998,3946881,7,82,1,6,7,0
불의 기억이 품었던 꿈입니다.,|cFFFFD200상인: |r미트레사|n|cFFFFD200지역: |r발드라켄|n|cFFFFD200가격: |r1000|Hcurrency:2118|h|TInterface\ICONS\INV_Misc_Powder_Thorium.blp:0|t|h,3287,189111,375035,4554439,3,2,2,6,7,0
"자그마한 엄니가 싸움에 별 보탬이 되진 않지만, 트룬칼룸프는 부족한 부분을 무게로 벌충합니다.","|cFFFFD200애완동물 대전: |r온아라 평야, 하늘빛 평원",3288,189110,0,3946882,7,26,4,6,7,0
"작은 불똥이 불씨가 되는 법입니다. 그리고 불씨는 맹렬한 불길이 될 수 있죠. 이 생명체는 불똥도, 불씨도 아니었습니다. 언제나 맹렬한 불길이었죠.","|cFFFFD200획득:|r 무작위 전리품|n|cFFFFD200날씨:|r 정령 폭풍 (화염)|n|cFFFFD200지역:|r 깨어나는 해안, 온아라 평야, 하늘빛 평원, 탈드라서스",3289,189112,389363,4554438,6,2,0,6,7,0
"어디든 원하는 대로 앉지만, 주로 무릎 위를 선호하는 편입니다.","|cFFFFD200보물: |r지스케라 금고, 금지된 해안",3290,189113,375045,3946885,7,2,0,6,7,0
전투를 향한 투닥이의 욕망은 무척이나 깊습니다.,|cFFFFD200획득: |r사냥꾼 브라켄|n|cFFFFD200지역: |r금지된 해안,3291,189115,375047,3946886,7,2,0,6,7,0
이 친구가 이글거린다는 말이 불타고 있어서인 줄 아는 사람들도 있더군요. 사실은 타오르는 시선 때문이랍니다.,|cFFFFD200퀘스트: |r불사조 이야기|n|cFFFFD200지역: |r깨어나는 해안,3292,189117,375084,4007139,5,2,1,6,7,0
불길 속에서 태어난 탓인지 붉습니다.,|cFFFFD200획득: |r뼈선별자 마르와크|n|cFFFFD200지역: |r금지된 해안,3293,189118,375085,4007140,5,2,0,6,7,0
시간의 잿더미 속에서도 살아나는 게 가능할까요? 제럴드는 가능하다고 생각합니다. 반박 시 본인 말이 맞다네요.,|cFFFFD200업적: |r자랄레크 동굴 모든 애완동물의 용사|n|cFFFFD200분류: |r대전,3294,189119,375089,4007141,5,82,5,6,7,0
"이그네이드는 용암이 아제로스의 표면에 나와 암흑 정령 마법이 주입됐을 때 형성됩니다. 그 결과 아주 작고, 흉포하며, 깜찍한 생명체가 탄생하죠.","|cFFFFD200애완동물 대전: |r탈드라서스, 하늘빛 평원, 깨어나는 해안",3295,189121,0,1016245,6,26,4,6,7,0
절친한 친구가 되고 싶어 하는 도롱뇽 친구입니다.,"|cFFFFD200애완동물 대전: |r온아라 평야, 탈드라서스, 하늘빛 평원, 깨어나는 해안",3296,189122,0,4056158,8,26,4,6,7,0
이 도롱뇽은 시간 속을 헤매다 자기 자신을 만났습니다. 바위에서 몇 시간은 어울려 놀았죠. 즐거웠다고 하네요.,|cFFFFD200교역소|r ,3297,189123,375235,4056156,8,16466,7,6,7,0
흥미로운 색을 지닌 도롱뇽은 대단히 많습니다. 하지만 어떤 도롱뇽도 이 녀석보다 멋지진 않을 겁니다.,,3298,189128,375242,4056157,8,16416,-1,6,7,0
심연이 차지한 것은 누구도 가져갈 수 없습니다.,"|cFFFFD200획득:|r 무작위 전리품|n|cFFFFD200날씨:|r 정령 폭풍 (물)|n|cFFFFD200지역:|r 깨어나는 해안, 온아라 평야, 하늘빛 평원, 탈드라서스",3299,189130,389378,4554443,6,2,0,6,7,0
"용의 섬에는 불가사의한 생명체가 수없이 많지만, 오리만 한 종은 없을 것입니다. 이 아이들은 어디서 온 걸까요? 또, 어디로 가는 걸까요? 무슨 계획이 있기에? 우린 영영 알 수 없을지도 모릅니다.","|cFFFFD200애완동물 대전: |r온아라 평야, 깨어나는 해안",3300,189131,0,3953209,2,26,4,6,7,0
꽥꽥.,"|cFFFFD200애완동물 대전: |r온아라 평야, 탈드라서스, 깨어나는 해안",3301,189136,429055,4048813,8,26,4,6,7,0
