Text_lang,Text1_lang,ID,LanguageID,ConditionID,EmotesID,Flags,ChatBubbleDurationMs,VoiceOverPriorityID,SoundKitID[0],SoundKitID[1],EmoteID[0],EmoteID[1],EmoteID[2],EmoteDelay[0],EmoteDelay[1],EmoteDelay[2]
저기 있다!,저기 있다!,231193,0,0,603,68,0,4,0,0,0,0,0,0,0,0
우와! 예쁘다!,우와! 예쁘다!,231194,0,0,603,68,0,4,0,0,0,0,0,0,0,0
아야!,아야!,231195,0,0,0,68,0,4,0,0,0,0,0,0,0,0
안 돼!,안 돼!,231196,0,0,22,68,0,4,0,0,0,0,0,0,0,0
"괘, 괜찮습니다. 별일 없을 거예요. 약간 마나 연소 증상이 와서...","괘, 괜찮습니다. 별일 없을 거예요. 약간 마나 연소 증상이 와서...",231197,0,0,274,68,0,4,0,0,0,0,0,0,0,0
하나도 믿을 수 없어. 모두 거짓말이야! 너도 우릴 감옥에 가두었지!,,231198,0,0,0,68,0,4,209453,0,0,0,0,0,0,0
,"아이야, 단언컨대 나는 모르는 일이었다. 다른 푸른용들도 몰랐고.",231199,0,0,0,68,0,4,0,209454,0,0,0,0,0,0
거짓말! 존재하지도 않는 주문 주제에! 네겐 오직 거짓뿐이야!,,231200,0,0,0,68,0,4,209455,0,0,0,0,0,0,0
"네가 뭘 숨겼는지 알아내겠다, 환영아. 그리고 온 세상이 진실을 알게 되겠지!",,231201,0,0,0,68,0,4,209456,0,0,0,0,0,0,0
,"말리고스, 내 사랑. 대체 왜 그렇게 많은 이들에게 고통을 안겨준 건가요?",231202,0,0,0,68,0,4,0,209457,0,0,0,0,0,0
네지가 엉엉 웁니다.,네지가 엉엉 웁니다.,231217,0,0,0,68,0,4,0,0,0,0,0,0,0,0
,미안하구나. 잠시 다른 데 신경이 가 있었다. 탐구를 이어 나가고 싶다고 했지. 다른 고서들도 열어주마.,231239,0,0,0,68,0,4,0,209495,0,0,0,0,0,0
,반갑구나.,231256,0,0,0,68,0,4,0,0,1,0,0,0,0,0
아으! 또 시작이군!,,231258,0,0,0,68,0,4,0,0,1,0,0,0,0,0
,재밌는 무리로구나. 무슨 일로 나의... 기록 보관소를 찾아왔느냐?,231259,0,0,0,68,0,4,0,0,1,0,0,0,0,0
,우린 푸른용 말리고스가 우리를 속박했던 일에 관한 정보를 찾고 있다.,231260,0,0,0,68,0,4,0,0,1,0,0,0,0,0
,어쩌면... 내가 도움을 줄 수 있을지도 모르겠군.,231261,0,0,0,68,0,4,0,0,1,0,0,0,0,0
"잡담은 집어치워! 해답을 내놓아라, 망령.",,231262,0,0,0,68,0,4,0,0,1,0,0,0,0,0
걱정 마세요! 여기서 뭐가 폭발하는 게 하루 이틀 있는 일이 아니거든요. 우린 비늘이 튼튼해서 괜찮습니다!,걱정 마세요! 여기서 뭐가 폭발하는 게 하루 이틀 있는 일이 아니거든요. 우린 비늘이 튼튼해서 괜찮습니다!,231340,0,0,0,68,0,4,0,0,0,0,0,0,0,0
뭐야? 여기도 폭주하는 마법이? 혹시 다쳤나?,뭐야? 여기도 폭주하는 마법이? 혹시 다쳤나?,231341,0,0,6,68,0,4,0,0,0,0,0,0,0,0
"아! 어, 아, 아뇨! 다친 사람 아무도 없어요. 여긴 완전히 안전하다고요! 제발... 다른 데로 보내지 말아 주세요.","아! 어, 아, 아뇨! 다친 사람 아무도 없어요. 여긴 완전히 안전하다고요! 제발... 다른 데로 보내지 말아 주세요.",231342,0,0,669,68,0,4,0,0,0,0,0,0,0,0
너희는 아직 애잖아! 하물며 나도 아이들은 보호자 없이 두면 안 된다는 걸 아는데...,너희는 아직 애잖아! 하물며 나도 아이들은 보호자 없이 두면 안 된다는 걸 아는데...,231343,0,0,1005,68,0,4,0,0,0,0,0,0,0,0
,조금만 더...,231592,0,0,0,102,0,4,0,209884,0,0,0,0,0,0
<고통스러운 신음>,,232128,0,0,0,102,0,6,211288,0,0,0,0,0,0,0
<놀란 신음>,,232159,0,0,0,102,0,6,211321,0,0,0,0,0,0,0
훌륭합니다! 정렬이 잘못된 지맥을 하나 더 찾아내셨군요. 하늘빛 평원을 복구하려면 반드시 흐트러진 마법의 흐름을 바로잡아야 합니다.,,232247,0,0,0,68,0,4,0,0,0,0,0,0,0,0
"고맙습니다, $n 님. 이렇게 지맥을 복구할 때마다 용의 섬 전체가 한층 더 건강해질 겁니다.",,232249,0,0,0,68,0,4,0,0,0,0,0,0,0,0
,<숨결>,232812,0,0,0,68,0,6,0,216071,0,0,0,0,0,0
,<거친 호흡>,232813,0,0,0,102,0,6,0,216072,0,0,0,0,0,0
,<숨결>,232814,0,0,0,68,0,6,0,216073,0,0,0,0,0,0
,<숨결>,232815,0,0,0,68,0,6,0,216074,0,0,0,0,0,0
,<한숨>,232816,0,0,0,102,0,6,0,216075,0,0,0,0,0,0
,<숨결>,232817,0,0,0,68,0,6,0,216076,0,0,0,0,0,0
,제각기 모체 서약의 돌에 정수를 집중하면 위상의 힘이 복원될 것이다.,233018,0,0,0,102,0,6,0,215861,0,0,0,0,0,0
<쇼에게 정보원에게 신호를 보내라고 합니다.>,<쇼에게 정보원에게 신호를 보내라고 합니다.>,233055,0,0,0,70,0,4,0,0,0,0,0,0,0,0
,다시 만나는 그날까지...,233377,0,0,0,102,0,6,0,0,0,0,0,0,0,0
그 어떤 배상으로도 부족해! 스톰윈드의 모든 부는 석공 길드가 가져야 마땅하다! 클레싱턴 님이 그 결과로 이끌어 주시리라!,,233386,0,0,22,68,0,4,219869,0,0,0,0,0,0,0
,던컨?! 넌 석공도 아니었잖아! 도둑이 되려고 들어왔으면서!,233387,0,0,274,68,0,4,0,219827,0,0,0,0,0,0
"드디어 모습을 드러내셨군, 밴클리프. 그것도 스톰윈드의 개를 달고 오다니! 봐라, 데피아즈단! 저 여자는 우릴 스톰윈드의 개로 만들려는 속셈이다!",,233388,0,0,22,68,0,4,219870,0,0,0,0,0,0,0
북녘골에서 집결한다! 우리를 따라라! 스톰윈드로 진격하리라! 데피아즈단을 위하여!,,233389,0,0,22,68,0,4,219871,0,0,0,0,0,0,0
데피아즈단을 위하여!,데피아즈단을 위하여!,233390,0,0,71,68,0,4,0,0,0,0,0,0,0,0
,아뮬렛이다!,233502,0,0,5,68,0,4,0,219828,0,0,0,0,0,0
|cffdb453d필요: 원시 티끌|r,|cffdb453d필요: 원시 티끌|r,233777,0,0,0,68,0,4,0,0,0,0,0,0,0,0
|cff34cceb필요: 원시 티끌|r,|cff34cceb필요: 원시 티끌|r,233778,0,0,0,68,0,4,0,0,0,0,0,0,0,0
,"할아버지, 왜 무덤 관리 일을 계속하시는 거예요? 어린 비룡들한테 맡겨도 되잖아요.",233785,0,0,0,68,0,4,0,221555,0,0,0,0,0,0
"잠깐, 뭔가 이상한데...",,233961,0,0,274,68,0,4,219885,0,0,0,0,0,0,0
...바네사.,,233964,0,0,274,68,0,4,219886,0,0,0,0,0,0,0
,재빨리 빼돌렸는데 용케 알아챘네? 설마 이런 물건을 스톰윈드에 맡길 리 없잖아. 비룡불꽃 아뮬렛은 내가 갖겠어.,233965,0,0,153,68,0,4,0,219837,0,0,0,0,0,0
"어림도 없지, 밴클리프! 이리 내놔!",,233966,0,0,22,68,0,4,219887,0,0,0,0,0,0,0
,"아, 결국 다른 놈들처럼 힘이 탐났나 보군!",233967,0,0,22,68,0,4,0,219838,0,0,0,0,0,0
,"뭐, 뭐가 어떻게 돌아가는 거죠?",233968,0,0,274,68,0,4,0,0,0,0,0,0,0,0
"도착했군. 반갑소, 칼렉고스.그리고... 생명의 어머니시여.",,234015,0,0,0,68,0,4,221558,0,0,0,0,0,0,0
세네고스가 스텔라고사의 옆구리를 쿡쿡 찔러 인사를 시킵니다.,,234016,0,0,0,68,0,4,0,0,0,0,0,0,0,0
,"아, 세네고스. 비전 구슬의 잔재로 보았네. 과거의 모습 그대로인 것 같아 기뻤다.",234017,0,0,0,68,0,4,0,221329,0,0,0,0,0,0
,"칼렉고스, 말리고스와 신드라고사의 정수를 안식에 들게 하는 건 네가 하는 게 좋겠다.",234018,0,0,0,68,0,4,0,221330,0,0,0,0,0,0
감사합니다. 신드라고사... 말리고스... 늦게 안식을 선사하게 되어 죄송합니다.,,234019,0,0,0,68,0,4,221123,0,0,0,0,0,0,0
지금이라도 생전에 빼앗겼던 안식을 누리기를.,,234020,0,0,0,68,0,4,221124,0,0,0,0,0,0,0
별일이 다 있군요... 저건 말리고스와 신드라고사의 과거가 남긴 잔재 아닙니까?,,234023,0,0,0,68,0,4,221126,0,0,0,0,0,0,0
,그런 것 같다. 두 사람 모두 눈을 감을 때 이 세상을 떠나지 못했던 모양이구나.,234024,0,0,0,68,0,4,0,221331,0,0,0,0,0,0
"넬타리온의 배신 이후 이곳으로 돌아온 푸른용들에게 영면을 선사할 때, 이 기묘한 현상을 수없이 봤지요.",,234025,0,0,0,68,0,4,221561,0,0,0,0,0,0,0
,신드라고사를 포함해 많은 이가 희생된 비극이었지... 게다가 리치 왕이 휴식조차 허락하지 않았다. 언데드로 되살아난 모습을 보고 가슴이 찢어질 듯 아팠지.,234026,0,0,0,68,0,4,0,221332,0,0,0,0,0,0
그녀가 돌아오기를 간절히 바랐건만. 수천 년이 지나고 그녀에게 무슨 일이 있었는지 우리 혈족이 소식을 접했을 땐...,,234028,0,0,0,68,0,4,0,0,0,0,0,0,0,0
신드라고사 님에게 무슨 일이 있었는지 소식을 접하고 도저히 믿지 못했습니다. 그나마 언데드로 오랜 시간을 보내지 않으셨다니 다행이지요.,,234029,0,0,0,68,0,4,221562,0,0,0,0,0,0,0
신드라고사와 말리고스 둘 다 그렇게 갈 인물은 아니었습니다. 지금이라도 제대로 안식에 들게 되었길.,,234030,0,0,0,68,0,4,221127,0,0,0,0,0,0,0
전 여기서 다른 분들과 상황을 지켜보겠습니다... 하늘빛나래 혈족과 관련해 세네고스와 할 얘기도 있고요.,,234383,0,0,0,68,0,4,221141,0,0,0,0,0,0,0
"잠깐이면 된다오, 칼렉고스. 스텔라고사, 엠미고사. 너희 둘도 남아서 듣거라.",,234384,0,0,0,68,0,4,221763,0,0,0,0,0,0,0
,"네, 할아버지. 뭐든 말씀하세요.",234385,0,0,0,68,0,4,0,221764,0,0,0,0,0,0
좋아. 도착했군.,,234471,0,0,0,70,0,4,218808,0,0,0,0,0,0,0
당분간 요람에 발을 들일 생각은 없어.,,234472,0,0,0,70,0,4,218809,0,0,0,0,0,0,0
엠버탈 님이 안에서 기다리신다.,,234473,0,0,0,70,0,4,218810,0,0,0,0,0,0,0
"아, 그리고... 흠흠. 고맙다. 우릴 도와줘서.",,234474,0,0,0,70,0,4,218811,0,0,0,0,0,0,0
,데이모스가 그대를 높이 평가하더군...,234475,0,0,0,70,0,4,0,220812,0,0,0,0,0,0
,좀처럼 안 그러는 친구인데 말이야.,234476,0,0,0,70,0,4,0,220813,0,0,0,0,0,0
,다모스를 비롯한 모두가 해답을 찾고 있다. 이 모든 일의 이유를 말이지.,234477,0,0,0,70,0,4,0,220814,0,0,0,0,0,0
,그간 많은 일이 있지 않았나. 우리도 숱한 역경을 거쳐 왔고...,234478,0,0,0,70,0,4,0,220815,0,0,0,0,0,0
,이젠 의문이 든다. 내가 찾는 게... 여기 없는 건 아닐까.,234479,0,0,0,70,0,4,0,220816,0,0,0,0,0,0
,아냐... 안 돼...,234480,0,0,0,70,0,4,0,220817,0,0,0,0,0,0
(단말마),,234484,0,0,0,70,0,4,220941,0,0,0,0,0,0,0
사라져라. 금지된 해안은 분리된 불길의 것이다.,,234485,0,0,0,70,0,4,220821,0,0,0,0,0,0,0
,사카레스!,234486,0,0,0,70,0,4,0,220818,0,0,0,0,0,0
,데이모스...,234487,0,0,0,70,0,4,0,220819,0,0,0,0,0,0
,"(거칠게 숨을 몰아쉼, 슬픔이 분노로 변함, 결의를 다짐)",234488,0,0,0,70,0,4,0,220820,0,0,0,0,0,0
신드라고사와 말리고스 둘 다 영면에 들기는커녕 분노가 시시각각으로 커지고 있다.,,234761,0,0,0,68,0,4,221766,0,0,0,0,0,0,0
끝맺음을 바라는 건 아닐까요? 두 분 모두 끔찍한 죽음을 맞이했잖습니까.,,234762,0,0,0,68,0,4,221767,0,0,0,0,0,0,0
,수정노래 숲의 영혼들과 같은 처지일 겁니다... 신드라고사와 말리고스 두 분 모두 최후의 순간 속에 표류하고 있는 겁니다.,234763,0,0,0,68,0,4,0,221768,0,0,0,0,0,0
,최후의 순간을 끊임없이 반복해서 경험하고 있는 셈이로군요.,234764,0,0,0,68,0,4,0,221769,0,0,0,0,0,0
,이 아수라장이 우리의 관심을 끌기 위한 저들의 표현이라면요? 누군가가 알아봐 주길 바라며 날뛰는 거죠.,234765,0,0,0,68,0,4,0,221770,0,0,0,0,0,0
"목소리를 들었으니 도와줘야지. 용사여, 두 사람의 정수를 회수해다오. 하늘빛 기록 보관소로 데려갈 거다.",,234766,0,0,0,68,0,4,221771,0,0,0,0,0,0,0
엠버탈 님!,,234867,0,0,0,70,0,4,218996,0,0,0,0,0,0,0
"저는 내버려 두고 말입니까? 이거 참, 저도 용인 건 어쩔 수 없나 봅니다!",,234994,0,0,0,68,0,4,221213,0,2,0,0,0,0,0
,주변을 둘러보세요! 제가 왜 판다리아에 반했는지 알 것 같나요?,235015,0,0,0,68,0,4,0,221688,0,0,0,0,0,0
아름답습니다!,,235016,0,0,0,68,0,4,221214,0,0,0,0,0,0,0
,"서리와 눈보단 훨씬 낫죠! 뒤처지지 말아요, 칼렉고스! 따스한 바람에 몸을 맡겨요.",235017,0,0,0,68,0,4,0,221689,0,0,0,0,0,0
하하!,,235018,0,0,0,68,0,4,221215,0,0,0,0,0,0,0
,좋아하는 것 좀 보세요.,235019,0,0,0,68,0,4,0,221690,0,0,0,0,0,0
어디로 가는 거죠?,,235020,0,0,0,68,0,4,221216,0,0,0,0,0,0,0
,제 집으로요!,235021,0,0,0,68,0,4,0,221691,0,0,0,0,0,0
,제 집이에요.,235022,0,0,0,68,0,4,0,221692,0,0,0,0,0,0
"<훌쩍> 논문 소재가... 논문 소재가 정말 많아요! 황홀해라! 아, 역시 해내실 줄 알았습니다!",,235034,0,0,0,68,0,4,0,0,0,0,0,0,0,0
이걸 보니 기념용 나무 조각품이 하나 떠오르는군. 아주 잘 팔릴 것 같아!,이걸 보니 기념용 나무 조각품이 하나 떠오르는군. 아주 잘 팔릴 것 같아!,235035,303,0,0,68,0,4,221108,221108,0,0,0,0,0,0
,"역시 마음에 들더라니. 이보게, $n... 떠드는 게 지겨워지면 말하게. 사냥할 야수는 언제나 있으니까!",235036,303,0,0,68,0,4,0,202152,0,0,0,0,0,0
$p 님 덕분에 부족이 다시 하나가 됐습니다.,,235037,303,0,0,68,0,4,202162,0,0,0,0,0,0,0
새 보금자리라...,새 보금자리라...,235038,0,0,0,68,0,4,202163,202163,0,0,0,0,0,0
$p|1을;를; 위하여! 겨울가죽을 위하여!,$p|1을;를; 위하여! 겨울가죽을 위하여!,235039,0,0,0,4,0,4,0,0,0,0,0,0,0,0
나는... 어릴 때 켄타우로스에게 납치당한 적이 있네.,,235127,0,0,0,70,0,4,220500,0,0,0,0,0,0,0
그런 나를 찾아 구출해준 자가 바로 보반일세.,,235128,0,0,0,70,0,4,220501,0,0,0,0,0,0,0
"그 친구가 없었더라면, 나는 영영...",,235129,0,0,0,70,0,4,220502,0,0,0,0,0,0,0
이번엔 내가 구해줄 기회였건만.,,235130,0,0,0,70,0,4,220503,0,0,0,0,0,0,0
이렇게 무참하게 빼앗기고 말다니.,,235131,0,0,0,70,0,4,220504,0,0,0,0,0,0,0
<상실과 분노가 어린 울음소리>,,235132,0,0,0,70,0,4,220505,0,0,0,0,0,0,0
다시는 누구도 해치지 못하게 할 걸세.,,235133,0,0,0,70,0,4,220506,0,0,0,0,0,0,0
"3차 대전쟁이 끝나고 몇 년 뒤, 레지널드 윈저 치안대장은 스톰윈드에 악이 도사린다 생각했습니다. ",,235325,0,0,0,102,0,4,219947,0,0,0,0,0,0,0
"다른 이들은 혼돈을 보았지만, 그는 역모를 보았지요.",,235326,0,0,0,102,0,4,219948,0,0,0,0,0,0,0
부패한 귀족들의 모략과 데피아즈 결사단의 부흥을 감지한 겁니다.,,235327,0,0,0,102,0,4,219949,0,0,0,0,0,0,0
치안대장은 각고의 노력 끝에 거대한 음모의 실체를 알아냈습니다.,,235328,0,0,0,102,0,4,220086,0,0,0,0,0,0,0
용사님은 현장에 계셨으니 익숙하시겠지요.,,235329,0,0,0,102,0,4,220085,0,0,0,0,0,0,0
"그날 치안대장은 스톰윈드 최고의 권력자, 여군주 카트라나 프레스톨에게 맞섰습니다.",,235330,0,0,0,102,0,4,220093,0,0,0,0,0,0,0
"거짓이 탄로나자, 프레스톨은 곧바로 본모습을 드러내더군요.",,235331,0,0,0,102,0,4,220087,0,0,0,0,0,0,0
"윈저는 목숨을 바쳐 오닉시아의 마수를 벗겨냈고, 그렇게 스톰윈드는 해방되었습니다.",,235332,0,0,0,102,0,4,220088,0,0,0,0,0,0,0
"오닉시아가 달아난 후, 우린 그 여자가 많은 이를 조종하고 휘두르는 데 쓴 저주받은 아뮬렛을 찾았습니다.",,235333,0,0,0,102,0,4,220089,0,0,0,0,0,0,0
"이제 알겠나, 엠버탈? 우린 넬타리온 님이 바라시던 궁극의 이상향이다. 걸작이지.",,235334,0,0,6,4,0,4,220304,0,1,0,0,0,0,0
,고작 힘을 위해 드랙티르 목숨을 내던지겠다? 대체 뭘 위해 피비린내 나는 대가를 치르는거냐?,235335,0,0,1,4,0,4,0,220305,1,0,0,0,0,0
"목적이다, 엠버탈. 우리가 빼앗긴 목적 말이지.",,235337,0,0,1,4,0,4,220306,0,1,0,0,0,0,0
,"동족을 파멸로 이끌게 두지 않겠다, 사카레스.",235338,0,0,1,4,0,4,0,220308,1,0,0,0,0,0
엠버탈...,,235339,0,0,0,4,0,4,219918,0,1,0,0,0,0,0
내게 맞서기는커녕 용의 명령을 받들겠단 말이냐? 한심하군! 드랙티르의 정체성을 완전히 잃었구나.,,235340,0,0,1,4,0,4,220309,0,1,0,0,0,0,0
"아뮬렛에 오닉시아의 힘이 남아 있을지도 모른다는 우려에 아뮬렛은 안전한 곳에 보관됐고, 기억 속에서 잊혔습니다...",,235341,0,0,0,102,0,4,220090,0,0,0,0,0,0,0
,나는... 너와 싸우고 싶지 않다.,235342,0,0,1005,4,0,4,0,220310,1,0,0,0,0,0
지금까지는요.,,235343,0,0,0,102,0,4,220092,0,0,0,0,0,0,0
부하들이 네 한심한 꼴을 보느니 정지장에 갇혀 죽은 게 다행이란 생각이 드는구나. 새 주인 옆에 붙어 있어라. 쫓아오면 네 목숨을 거두겠다.,,235344,0,0,603,68,0,4,220311,0,1,0,0,0,0,0
용의 섬 어딘가에 넬타리온 님의 비밀이 숨겨져 있다. 내가 찾아내 유산의 주인이 될 거다.,,235447,0,0,0,4,0,4,220307,0,0,0,0,0,0,0
"아뮬렛에 오닉시아의 힘이 남아 있을지도 모른다는 우려가 있었으나, 끝내 당신에게 맡겨졌습니다...",,235462,0,0,0,102,0,4,220091,0,0,0,0,0,0,0
,멋진 공격이었습니다.,235467,0,0,0,70,0,4,0,220447,0,0,0,0,0,0
그대가... 와줄 줄은 몰랐어.,,235468,0,0,0,70,0,4,220498,0,0,0,0,0,0,0
,우리 종족은 명예를 중시합니다.,235469,0,0,0,70,0,4,0,220448,0,0,0,0,0,0
그래... 우리 종족도 마찬가지일세.,,235472,0,0,0,70,0,4,220499,0,0,0,0,0,0,0
,가시죠. 시신을 수습합시다.,235473,0,0,0,70,0,4,0,220449,0,0,0,0,0,0
모두 이렇게 자리를 빛내줘서 고맙네.,,235474,0,0,0,102,0,6,220511,0,0,0,0,0,0,0
"우리 종족이 드레노어에서 아제로스로 왔을 무렵, 그 길은 순탄하지 않았네.",,235475,0,0,0,102,0,6,220512,0,0,0,0,0,0,0
그 과정에서 여러 유서 깊은 전통의 명맥이 끊겼지.,,235476,0,0,0,102,0,6,220513,0,0,0,0,0,0,0
이 용사는 새로운 옴고라를 처음으로 완수해 보였네.,,235477,0,0,0,102,0,6,220515,0,0,0,0,0,0,0
앞으로 후손들이 용사의 발자취를 따르기를.,,235478,0,0,0,102,0,6,220516,0,0,0,0,0,0,0
록타르!,,235479,0,0,0,102,0,6,220517,0,0,0,0,0,0,0
미사용,,235480,0,0,0,102,0,4,0,0,0,0,0,0,0,0
미사용,,235481,0,0,0,102,0,4,0,0,0,0,0,0,0,0
,그럼 아제로스 최초의 코쉬하그를 마무리하노라.,235482,0,0,0,102,0,4,0,220495,0,0,0,0,0,0
,옛 의례를 계승하고 새 전통을 만들어 나가는 데 정령이 우리를 인도하시길.,235483,0,0,0,102,0,4,0,220496,0,0,0,0,0,0
,"그리고 다시 만날 때까지, 명예로운 선조들께서 우리를 굽어살피시길.",235484,0,0,0,102,0,4,0,220497,0,0,0,0,0,0
하지만 이젠 옛날의 의례를 기억하고... ,,235485,0,0,0,102,0,6,220514,0,0,0,0,0,0,0
그를 쫓아가... 어떻게 할 생각입니까?,,235486,0,0,0,70,0,4,220798,0,0,0,0,0,0,0
,적을 멸할 거다. 훈련받은 대로.,235487,0,0,0,70,0,4,0,220805,0,0,0,0,0,0
그게 넬타리온입니다. ,,235488,0,0,0,86,0,4,220799,0,0,0,0,0,0,0
,지금 감히 우릴 속단하는가?,235489,0,0,0,86,0,4,0,220806,0,0,0,0,0,0
맞습니다.,,235490,0,0,0,86,0,4,220800,0,0,0,0,0,0,0
,왜 그러지 않았지?,235491,0,0,0,86,0,4,0,220807,0,0,0,0,0,0
저 또한 넬타리온의 자식이니까요. 저는 그 사실이 수치스러웠습니다. ,,235492,0,0,0,86,0,4,220801,0,0,0,0,0,0,0
,실망이 컸겠어.,235493,0,0,0,86,0,4,0,220808,0,0,0,0,0,0
아니요. 조금 전 그대는 내면에서 들리는 넬타리온의 목소리를 거부했습니다.,,235494,0,0,0,86,0,4,220802,0,0,0,0,0,0,0
,가족이라.,235495,0,0,0,86,0,4,0,220809,0,0,0,0,0,0
엠버탈.,,235496,0,0,0,86,0,4,220803,0,0,0,0,0,0,0
,"나를 도와주겠나, 에비시안?",235497,0,0,0,86,0,4,0,220810,0,0,0,0,0,0
서로를... 도와줍시다.,,235498,0,0,0,86,0,4,220804,0,0,0,0,0,0,0
저게 뭐지? 저기! 함몰지 안쪽에!,,235503,0,0,0,70,0,4,222266,0,0,0,0,0,0,0
,"다시 만날 때까지, 명예로운 선조들께서 우리를 굽어살피시길.",236664,0,0,0,102,0,4,0,220710,0,0,0,0,0,0
용의 피 냄새가 나는구나...,,236716,0,0,0,70,0,4,222436,0,0,0,0,0,0,0
피락!,,236717,0,0,0,70,0,4,223385,0,0,0,0,0,0,0
사벨리안이 다쳤습니다! 용사여! 퇴각해야 합니다!,,236721,0,0,0,70,0,4,223387,0,0,0,0,0,0,0
"훨훨 날아가라, 작은 용들아.",,236722,0,0,0,70,0,4,222437,0,0,0,0,0,0,0
우리의 자랑스러운 유산을 기리는 새 전통을 만들어가야 하네.,,237096,0,0,0,102,0,6,220894,0,0,0,0,0,0,0
신성한 스톰윈드 왕궁에까지 뻗친 악이었죠.,,237097,0,0,0,102,0,4,220895,0,0,0,0,0,0,0
데스윙의 딸 오닉시아였습니다.,,237098,0,0,0,102,0,4,220896,0,0,0,0,0,0,0
,(내쉬는 소리),237112,0,0,0,70,0,4,0,220902,0,0,0,0,0,0
,정말 미안하다.,237114,0,0,0,70,0,4,0,220903,0,0,0,0,0,0
살아있는 전설...,살아있는 전설...,237126,0,0,0,69,0,4,0,0,0,0,0,0,0,0
저기 영웅이 가신다.,저기 영웅이 가신다.,237127,0,0,0,69,0,4,0,0,0,0,0,0,0,0
길을 비켜라!,길을 비켜라!,237128,0,0,0,69,0,4,0,0,0,0,0,0,0,0
담력이 토륨같이 센 분이라는군.,담력이 토륨같이 센 분이라는군.,237129,0,0,0,69,0,4,0,0,0,0,0,0,0,0
이날을 언제까지나 기억하겠습니다.,이날을 언제까지나 기억하겠습니다.,237130,0,0,0,69,0,4,0,0,0,0,0,0,0,0
보석을 사용해 과거의 파편을 끌어당기마. 무언가 알아낼 수 있을지도 모른다.,,237225,0,0,0,68,0,4,222837,0,0,0,0,0,0,0
너희 셋은 모든 드랙티르의 귀감이 되어야 한다.,,237259,0,0,0,68,0,4,222824,0,0,0,0,0,0,0
"사카레스, 나의 절멸자여. 너는 붉은용과 푸른용군단의 힘으로 적을 도륙 내라.",,237260,0,0,0,68,0,4,222825,0,0,0,0,0,0,0
"비리디아, 나의 보존자여. 너는 녹색용과 청동용군단의 힘으로 동료를 치유하거라.",,237261,0,0,0,68,0,4,222826,0,0,0,0,0,0,0
"끝으로, 엠버탈. 검은용군단의 정수를 품은 너는 나의 힘으로 주변의 모두를 강인하게 만들거라.",,237262,0,0,0,68,0,4,222827,0,0,0,0,0,0,0
명령을 내리노니... 무릎을 꿇고 복종해라!,,237263,0,0,0,68,0,4,222828,0,0,0,0,0,0,0
이 시점이다! 넬타리온이 서약체결자를 활성화하는... 이 순간 기억을 끌어내 새로운 장치를 만들 수 있다.,,237264,0,0,0,68,0,4,222844,0,0,0,0,0,0,0
아아악!,,237308,0,0,0,70,0,4,218812,0,0,0,0,0,0,0
모두 잘 오셨습니다. 옛날의 전 푸른용군단은 뿔뿔이 흩어져 각자의 목적을 추구하는 게 낫다고 믿었습니다. 잘못된 판단이었죠.,,237803,0,0,0,68,0,4,221137,0,0,0,0,0,0,0
푸른용은 하나의 가족일 때 제일 뛰어난 역량을 발휘합니다. 우리가 힘을 합치면...,,237804,0,0,0,68,0,4,221138,0,0,0,0,0,0,0
칼렉고스! 장막의 납골당에 도움이 필요하다! 신드라고사와 말리고스의 기억이 납골당을 부수고 있다!,,237806,0,0,0,68,0,4,221762,0,0,0,0,0,0,0
"알겠습니다. 친구들, 갑작스레 부탁하게 되어 죄송하지만... 벌써 여러분의 힘이 필요합니다.",,237807,0,0,0,68,0,4,221139,0,0,0,0,0,0,0
,할아버지?,237996,0,0,0,102,0,4,0,221954,0,0,0,0,0,0
"아... 울지 말려무나, 우리 손녀딸.",,237997,0,0,0,102,0,4,221955,0,0,0,0,0,0,0
나는 보람찬 생을 살았다. 슬퍼할 게 아니라 기념할 일이지.,,237998,0,0,0,102,0,4,221956,0,0,0,0,0,0,0
하늘빛나래를 네 손에 맡기마.,,237999,0,0,0,102,0,4,221957,0,0,0,0,0,0,0
,가지 마세요. 전 아직 준비가 안 됐어요!,238000,0,0,0,102,0,4,0,221958,0,0,0,0,0,0
별빛 같은 아이야. 처음엔 다 그렇단다.,,238001,0,0,0,102,0,4,221959,0,0,0,0,0,0,0
내 가르침을 가슴에 품고 살아가거라. 언제나 함께하마.,,238002,0,0,0,102,0,4,221960,0,0,0,0,0,0,0
"아, 친구들. 무슨 보물을 가져왔나?",,238057,0,0,0,70,0,4,222257,0,0,0,0,0,0,0
무시해라. 놈은 아버지의 물건을 가질 권리가 없다.,,238058,0,0,0,70,0,4,222251,0,0,0,0,0,0,0
지금 그걸 따질 때입니까?,,238059,0,0,0,70,0,4,222241,0,0,0,0,0,0,0
"기만과 지배, 공포의 유산을 가질 정당한 후계자가 대체 누구란 말입니까?",,238060,0,0,0,70,0,4,222242,0,0,0,0,0,0,0
뭘 찾긴 찾았나 보군.,,238061,0,0,0,70,0,4,222256,0,0,0,0,0,0,0
,그래. 내 손으로 부쉈지.,238064,0,0,0,70,0,4,0,222245,0,0,0,0,0,0
네가 감히!,,238065,0,0,0,70,0,4,222252,0,0,0,0,0,0,0
,그럴 권리가 있었다.,238066,0,0,0,70,0,4,0,222247,0,0,0,0,0,0
대체 무슨 짓을 한 거야?,,238067,0,0,0,70,0,4,222258,0,0,0,0,0,0,0
"그대들이 어린 새끼용처럼 투덕거릴 때, 엠버탈은 동족을 위한 용단을 내렸습니다.",,238068,0,0,0,70,0,4,222243,0,0,0,0,0,0,0
과거는 놓아주십시오.,,238069,0,0,0,70,0,4,222244,0,0,0,0,0,0,0
,"너는 망가졌다, 티르.",238315,0,0,0,102,0,4,0,221943,0,0,0,0,0,0
,타락이 너희 모두를 삼키리라...,238316,0,0,0,102,0,4,0,221942,0,0,0,0,0,0
,...네가 애지중지하는 위상들까지도.,238317,0,0,0,102,0,4,0,221929,0,0,0,0,0,0
네놈 말이 사실로 드러날지도 모르지.,,238318,0,0,0,102,0,4,223842,0,0,0,0,0,0,0
그럼에도 위상의 용기와 필멸자의 가능성은 나를 희망으로 가득 채운다.,,238319,0,0,0,102,0,4,223846,0,0,0,0,0,0,0
그러니 이 몸을 부숴 네 녀석을 세상에서 지울 수 있다면... 받아들이겠다.,,238320,0,0,0,102,0,4,223843,0,0,0,0,0,0,0
<고통스러운 비명>,,238321,0,0,0,102,0,4,222924,0,0,0,0,0,0,0
,알렉스트라자가 광적인 웃음을 터뜨립니다.,238448,0,0,0,110,0,4,0,221944,0,0,0,0,0,0
"아... 음. 고맙다, 사벨리안.",,238648,0,0,1,70,0,4,223118,0,0,0,0,0,0,0
"상황이 심각합니다, 알렉스트라자 여왕님.",,238652,0,0,0,70,0,4,224285,0,0,0,0,0,0,0
피락을 쫓으니 지하에 있는 거대한 도가니가 나타나더군요. 정령 불꽃의 샘이었습니다.,,238653,0,0,0,70,0,4,223514,0,0,0,0,0,0,0
놈이 그 안의 마력을 흡수한 뒤 나타났습니다. 암흑불길에 휩싸여 있더군요.,,238654,0,0,0,70,0,4,222228,0,0,0,0,0,0,0
,암흑불길... 너희를 그 타락의 힘에 잃을 수는 없다.,238655,0,0,0,70,0,4,0,221910,0,0,0,0,0,0
"생명의 어머니시여, 외람된 말씀이오나 그 타락에 굴복한 건 데스윙입니다.",,238656,0,0,0,70,0,4,223513,0,0,0,0,0,0,0
