Text_lang,Text1_lang,ID,LanguageID,ConditionID,EmotesID,Flags,ChatBubbleDurationMs,VoiceOverPriorityID,SoundKitID[0],SoundKitID[1],EmoteID[0],EmoteID[1],EmoteID[2],EmoteDelay[0],EmoteDelay[1],EmoteDelay[2]
발키르의 여왕이여. 제 영혼은 저편으로 보내졌다가 다시 이곳으로 돌아왔습니다. 당신이 하신 일입니까?,,162764,0,0,0,70,0,0,121065,0,0,0,0,0,0,0
,"어둠사냥꾼이여, 넌 더 이상 미약한 영혼이 아니다. 넌 내가 벼려낼 수 있는 힘을 넘어섰다.",162765,0,0,0,70,0,0,0,121071,0,0,0,0,0,0
그런 힘을 누가 가졌단 말입니까? 제게 실바나스를 대족장으로 명하라 말한 자와 같은 존재입니까?,,162766,0,0,0,70,0,0,121066,0,0,0,0,0,0,0
,용맹의 손길이 널 거치지 않았나. 그런 힘은 필멸의 일에 계략을 쓰지 않는다.,162767,0,0,0,70,0,0,0,121072,0,0,0,0,0,0
"절 이곳으로 보낸 자와, 제게 속삭인 자가 다르단 말씀입니까?",,162768,0,0,0,70,0,0,121067,0,0,0,0,0,0,0
,"알려줄 만한 것은 모두 전해 주었다. 이제 떠나라, 다시는 돌아오지 마라.",162769,0,0,0,70,0,0,0,121073,0,0,0,0,0,0
"마침내... 자유를 찾았군. 충분한 보상을 해 주겠소, 친구들이여.",,162778,0,0,0,70,0,0,0,0,0,0,0,0,0,0
,"이건 정말 당신이 생각한 것 중 가장 멍청하고... 말도 안 되고... 우스꽝스러운 계획이에요, 버드!",162779,0,0,0,70,0,0,0,0,0,0,0,0,0,0
,그래도 계획이라고는 이것뿐이니 어쩔 수 없겠죠.,162783,0,0,0,70,0,0,0,0,0,0,0,0,0,0
,네? 어딜 잡으라고요?,162785,0,0,0,70,0,0,0,0,0,0,0,0,0,0
"당신의 접근 방식은... 정도를 벗어나 있긴 하오. 하지만 화재 때문에 연기가 날 테니, 놈들에게는 우리 모습이 검은 윤곽으로만 보일 거요.",,162787,0,0,0,70,0,0,0,0,0,0,0,0,0,0
날 봐!!! 내가 맨타우로스가 되었다니!!!,,162809,0,0,0,70,0,0,0,0,0,0,0,0,0,0
,"멍청한 소리는 그만둬요, 버드. 조용히 하라고요!!",162812,0,0,0,70,0,0,0,0,0,0,0,0,0,0
갑시다!,,162814,0,0,0,70,0,0,0,0,0,0,0,0,0,0
,줄다자르 해안에 병력 지원이 필요합니다!,162846,0,0,1,68,0,0,0,142414,0,0,0,0,0,0
,우리 양조사가 보내주신 인력과 일하길 거부했어요.,162848,0,0,1,68,0,0,0,142413,0,0,0,0,0,0
,나가가 줄다자르 해안에 진격해오고 있습니다. 더 큰 위험 요소가 되기 전에 몰아내야 합니다!,162849,0,0,1,68,0,0,0,142416,0,0,0,0,0,0
,"바인이 비전주 생산을 도울 인력을 수라마르에 파견했지만, 이들을 관리하기가... 까다롭더군요.",162851,0,0,1,68,0,0,0,142415,0,0,0,0,0,0
"황송하기 이를 데 없는 요청이네만, 애석하게도 사양해야겠네.",,162854,0,0,1,68,0,0,142445,0,0,0,0,0,0,0
호드는 지금도 동맹들의 청을 들어주느라 과중하고 무리하는 실정일세. 그대 종족을 받아들였다간 도리어 악수가 될 게야.,,162855,0,0,1,68,0,0,142446,0,0,0,0,0,0,0
,,162856,0,0,6,68,0,0,0,0,0,0,0,0,0,0
"대신 손님의 예를 갖출 테니, 오그리마의 환대를 즐겨주시게. 호드든 아니든, 불페라는 언제나 환영받을 걸세.",,162857,0,0,1,68,0,0,142447,0,0,0,0,0,0,0
"아, 어디까지 했지요?",,162858,0,0,6,68,0,0,0,0,0,0,0,0,0,0
,우리 모두에겐 주어진 역할이 있습니다.,162862,0,0,0,68,0,0,0,0,1,0,0,0,0,0
상황이 나빠지기 전에 대부족장이 대처해야 하오.,,162863,0,0,0,68,0,0,0,0,1,0,0,0,0,0
,"줄다자르는 호드에 최정예 전사들을 보냈습니다. 어떤 대가가 따랐는지 아십니까? 우리 해안이 무방비해졌습니다. 

나가가 남부 해안을 따라 진격하고 있습니다. 놈들의 존재가 심히 거슬립니다. 

호드가 동맹을 보호해야 합니다! 스스로를 지킬 여력이 없는 우방이라면 더더욱!",162867,0,0,0,68,0,0,0,0,1,0,0,0,0,0
"전쟁 관련 공사는 모두 내 소관이오. 

이 시각에도 아제로스 곳곳에 호드의 새로운 전초기지가 지어지고 있다오. 

원래는 계획대로 진행되고 있었다오. 박살의 땅 야영지 공사가 중단되기 전까지는. 

일꾼들이 홱 사라져버렸소! 

바인이 나서지 않으면 기한을 절대 못 맞출 거요.",,162868,0,0,0,68,0,0,0,0,1,0,0,0,0,0
,"호드에 가입한 이후로, 비전주 생산량을 늘려달라는 요청을 꾸준히 받아왔어요. 

그런 와중에 바인이 사려 깊게도 일손을 파견해줬죠. 애석하게도 오히려 역효과만 일어났답니다. 

수습할 수 있을지 잘 모르겠어요...",162869,0,0,0,68,0,0,0,0,1,0,0,0,0,0
"니샤, 줄다자르로 가서 실력을 보여주세요.",,162870,0,0,1,68,0,0,142450,0,0,0,0,0,0,0
"미라, 수라마르 양조사들 문제를 해결해 주시겠어요?",,162871,0,0,6,68,0,0,142451,0,0,0,0,0,0,0
좋습니다. 그럼 시작하죠.,,162872,0,0,1,68,0,0,142452,0,0,0,0,0,0,0
,나가는 뭐에 맞았는지도 모르겠죠!,162873,0,0,1,68,0,0,0,142417,0,0,0,0,0,0
,"알겠어요, 키로!",162874,0,0,1,68,0,0,0,142418,0,0,0,0,0,0
"좋다, 내 병력이 널 죽이지 못한다면, 내가 하지! 댈린 프라우드무어 님을 위하여!",,162885,0,0,0,70,0,0,0,0,0,0,0,0,0,0
암흑 파라오가 쓰러졌다! 불멸의 거대괴수도 장난감처럼 부서져 내린다!,,162888,0,0,0,70,0,0,0,0,0,0,0,0,0,0
연장 내려놓고 주먹을 하늘 높이 드시오!,,162905,0,0,1,68,0,0,142456,0,0,0,0,0,0,0
뭐지? 오그리마에서 보낸 거요?,,162906,0,0,6,68,0,0,142457,0,0,0,0,0,0,0
드디어 우리 요구를 들어줄 의향이 생긴 거요?,,162907,0,0,6,68,0,0,142458,0,0,0,0,0,0,0
옳소!,,162908,0,0,4,68,0,0,0,0,0,0,0,0,0,0
네페르세트 도시도 무너질 것이다! 공격하라!!!,,162919,0,0,0,71,0,0,0,0,0,0,0,0,0,0
전 이제 호드 명령대로 안 할 거예요.,,162925,0,0,0,68,0,0,0,0,1,0,0,0,0,0
돌아갈 마음 없네요!,,162926,0,0,0,68,0,0,0,0,1,0,0,0,0,0
마그록 현장감독님이 우리 일꾼들을 잘 챙겨주셔요.,,162927,0,0,0,68,0,0,0,0,1,0,0,0,0,0
전초기지 같은 거 안 지을 거예요!,,162928,0,0,0,68,0,0,0,0,1,0,0,0,0,0
여긴 일꾼 전용 모임이에요!,,162929,0,0,0,68,0,0,0,0,1,0,0,0,0,0
박살의 땅 일꾼이 당신을 무시합니다.,,162934,0,0,0,68,0,0,0,0,0,0,0,0,0,0
연장이 망가져서 맨손을 썼죠. 이젠 손도 망가질 지경이에요!,,162935,0,0,1,68,0,0,0,0,0,0,0,0,0,0
일꾼들은 시궁창 같은 취급을 받아요. 좋은 건 누리지도 못하죠.,,162936,0,0,1,68,0,0,0,0,0,0,0,0,0,0
늘 일꾼으로만 불렸어요. 다른 게 아니라. 그 이상은 안 되나?,,162937,0,0,6,68,0,0,0,0,0,0,0,0,0,0
"정말 무사히 빠져나갈 수 있다고 생각했어, $p? 응?",,163024,0,0,0,70,0,0,0,0,0,0,0,0,0,0
"우선, 넌 울둠이 마치 네 것인 양 터벅터벅 침입해 들어왔어.",,163048,0,0,0,70,0,0,0,0,0,0,0,0,0,0
서툰 솜씨로 내 작전을 방해하려고도 했고...,,163049,0,0,0,70,0,0,0,0,0,0,0,0,0,0
그리고 내 충성스러운 부하들을 해치기도 했지...,,163050,0,0,0,70,0,0,0,0,0,0,0,0,0,0
변명은 필요 없어! 입 닥쳐! 계속 움직여!,,163051,0,0,0,70,0,0,0,0,0,0,0,0,0,0
하지만...,하지만...,163052,0,0,0,78,0,0,0,0,0,0,0,0,0,0
"그 죄는 말할 것도 없고, 내 의식을 방해해서 고블스를 죽음에 이르게 했지!",,163053,0,0,0,70,0,0,0,0,0,0,0,0,0,0
"이 빚을 갚으려면 말이야, $p, 총살형으로 사라져 줘야겠어!",,163054,0,0,0,70,0,0,0,0,0,0,0,0,0,0
그 정도면 됐어!,,163055,0,0,0,70,0,0,0,0,0,0,0,0,0,0
"여기서부터는 내가 맡을게요, 친구들. 문제를 잘 처리했다고 주인님께 보고나 잘 해줘요.",,163056,0,0,0,70,0,0,0,0,0,0,0,0,0,0
우릴 방해할 녀석이 더는 없을 거라고 전해달라고요.,,163057,0,0,0,70,0,0,0,0,0,0,0,0,0,0
"그 말이 사실이어야 할 거야, 슈노츠. 데스윙 님의 인내심이 한계에 다다르고 있으니까.",,163058,0,0,0,70,0,0,0,0,0,0,0,0,0,0
"자, 아까 무슨 얘기를 하고 있었더라?",,163059,0,0,0,70,0,0,0,0,0,0,0,0,0,0
"아, 그렇지. 남길 말은 없나? 응?",,163060,0,0,0,70,0,0,0,0,0,0,0,0,0,0
"집어치워, 슈노츠!",,163062,0,0,0,70,0,0,0,0,0,0,0,0,0,0
"나 아직 안 죽었다고, $p!",,163063,0,0,0,102,5000,0,0,0,0,0,0,0,0,0
"댈린 님을 살해한 자가 심판을 받을 수만 있다면, 모든 쿨 티란이 기꺼이 목숨을 바칠 것이다!",,163145,0,0,0,78,0,0,121155,0,0,0,0,0,0,0
아제라이트 전차의 보호막이 풀리고 무리에 공격이 쏟아지는 장면이 짧게 지나감,아제라이트 전차의 보호막이 풀리고 무리에 공격이 쏟아지는 장면이 짧게 지나감,163167,0,0,0,70,0,0,0,0,0,0,0,0,0,0
이제 제가 대장이에요?,,163177,0,0,6,68,0,0,0,0,0,0,0,0,0,0
어머니가 자랑스러워하실 거예요!,,163178,0,0,1,68,0,0,0,0,0,0,0,0,0,0
나도 이제 중요한 사람이다!,,163179,0,0,1,68,0,0,0,0,0,0,0,0,0,0
이러면 될 거요!,,163182,0,0,0,70,0,0,0,0,0,0,0,0,0,0
저걸 보시오...,,163183,0,0,0,70,0,0,0,0,0,0,0,0,0,0
$p! 우리가 해냈소!,,163184,0,0,0,70,0,0,0,0,0,0,0,0,0,0
"아주 잘했어, 존스 박사!",,163185,0,0,0,70,0,0,0,0,0,0,0,0,0,0
날 성궤까지 데려와 준 것도 모자라 방어막까지 없애 줬어!,,163186,0,0,0,70,0,0,0,0,0,0,0,0,0,0
가엾군...,,163187,0,0,0,70,0,0,0,0,0,0,0,0,0,0
너라면 내 조직에서도 꽤 중요한 직책을 맡을 수 있을 텐데... 아쉽게도 여기서 죽어줘야겠어.,,163188,0,0,0,70,0,0,0,0,0,0,0,0,0,0
그전에 우선!,,163189,0,0,0,70,0,0,0,0,0,0,0,0,0,0
이제 네가 그렇게 아끼던 존재의 파멸을 지켜보라고!,,163190,0,0,0,70,0,0,0,0,0,0,0,0,0,0
성궤!? 설마...,,163191,0,0,0,70,0,0,0,0,0,0,0,0,0,0
"아, 이 멍청한 녀석 같으니! 내가 정말 네 멍청한 상자 따위를 원했다고 생각해?",,163192,0,0,0,70,0,0,0,0,0,0,0,0,0,0
그 유물만 없으면 데스윙 님이 시초 재개 기계장치를 가동시킬 수 있어!,,163193,0,0,0,70,0,0,0,0,0,0,0,0,0,0
"그분께서 복수에 대한 열망을 충족시키시고 나면, 난 내가 원하는 대로 아제로스를 지배할 수 있지!",,163194,0,0,0,70,0,0,0,0,0,0,0,0,0,0
"아! 빨리 좀 작동하라고, 이 멍청한 고물아...",,163195,0,0,0,70,0,0,0,0,0,0,0,0,0,0
음? 무슨 소리지?,,163196,0,0,0,70,0,0,0,0,0,0,0,0,0,0
알게 뭐야! 잠시 후에는 여기 아무것도 남지 않을 텐데!,,163197,0,0,0,70,0,0,0,0,0,0,0,0,0,0
눈을 감으라고. 기분 좋은 광경은 아닐 거야...,,163198,0,0,0,70,0,0,0,0,0,0,0,0,0,0
"이게 제대로 된 방식이오, $p. 원하는 게 있으면 요구해야지!",,163204,0,0,0,68,0,0,0,0,1,0,0,0,0,0
일꾼들의 고충을 해결하러 온 게 아니면 썩 꺼지시오!,,163205,0,0,0,68,0,0,0,0,1,0,0,0,0,0
호드의 미래 대족장에게 도전하는 거요? 이거 맞아야 정신차리겠군!,,163207,0,0,0,68,0,0,142464,0,0,0,0,0,0,0
설마 또 때릴 생각이오? 그건 아니겠지?,,163208,0,0,0,68,0,0,0,0,430,0,0,0,0,0
"알겠소, 항복하지! 당신 승리요!",,163209,0,0,1,68,0,0,142465,0,0,0,0,0,0,0
들었소? 호드가 드디어 우리 얘기를 듣기 시작했소!,,163215,0,0,1,68,0,0,142462,0,0,0,0,0,0,0
박살의 땅에서 잔치를! 갑시다!,,163216,0,0,603,68,0,0,142463,0,0,0,0,0,0,0
난 뼈라도 좀 밟으면서 여길 둘러봐야겠네. 혹시 모르니 자네는 언제든지 싸울 수 있도록 대비하게나.$b$b준비가 다 되면 말하게.,,163223,0,0,0,70,0,0,0,0,1,0,0,0,0,0
"이제 파괴하... 잠깐, 저게 뭐지?!",,163347,0,0,0,70,0,0,0,0,0,0,0,0,0,0
이야! 이 얼마 만의 신선한 공기인가!,,163361,0,0,0,70,0,0,0,0,0,0,0,0,0,0
"이번에도 내가 너보다 한 발짝 빨랐구나, 얘야! 언제나 그렇지만.",,163362,0,0,0,70,0,0,0,0,0,0,0,0,0,0
"대여사제님, 저도 이 상황이 달갑지 않지만... 아라시와 잔달라에서 전력을 나눠 어둠해안까지 습격하려면 전선이 너무 얇아질 것 같습니다.",,163390,0,0,1,70,0,6,122280,0,0,0,0,0,0,0
전쟁이 끝나기 전에 텔드랏실을 되찾을 것을 맹세할게요. 당장은 자원은 부족해지고 희생자는 늘고 있는 상황입니다. 조금만 더 기다려달라 부탁드릴 수 밖에는...,,163391,0,0,1,70,0,6,122281,0,0,0,0,0,0,0
,지금 필요한 건 변명이 아니라 행동입니다! 호드가 우리 땅을 더럽힐 동안 스톰윈드에 갇혀 있진 않을 거예요!,163396,0,0,274,70,0,6,0,122283,0,0,0,0,0,0
,아니요. 우린 고향을 되찾을 겁니다. 지금 당장.,163398,0,0,274,70,0,6,0,122284,0,0,0,0,0,0
,비린내 나는 바다 마녀를 처치하고 침략을 끝내버리죠!,163524,0,0,0,68,0,0,0,142421,0,0,0,0,0,0
,나가 사냥이 이렇게 재밌을 줄 누가 알았겠어요?,163525,0,0,0,68,0,0,0,142423,0,0,0,0,0,0
,"이놈은 제가 처리할게요! 칼맛이 어떠냐, 너울파괴자!",163556,0,0,1,68,0,0,0,142422,0,0,0,0,0,0
"작업이 재개됐소, 대부족장. 호드가 이런 사안을 잘 처리해 주니 기쁘구려.",,163624,0,0,1,68,0,0,142466,0,0,0,0,0,0,0
"그렇고 말고, 사령관. 하나 이 요행을 내 공으로 돌릴 순 없네.",,163627,0,0,6,68,0,0,142467,0,0,0,0,0,0,0
,신속하게 문제를 해결해 주셔서 감사합니다. 잔달라에게 믿음직한 동맹이 있어 다행입니다.,163631,0,0,1,68,0,0,0,142425,0,0,0,0,0,0
"이번 건은 내 작품이 아닐세, 손지. 어쨌든 위협이 해소됐다니 다행이로군.",,163632,0,0,6,68,0,0,142468,0,0,0,0,0,0,0
상자 속으로 들어가시오! 어서!,,163672,0,0,0,70,0,0,0,0,0,0,0,0,0,0
"안녕하세요, $p 님. 잠시 눈을 쉬고 있었답니다. 무엇을 도와드릴까요?",,163706,0,0,0,68,0,0,0,0,1,0,0,0,0,0
,"휴! 잘 오셨어요. 이 동네는 ""뭔가""를 넘어 그냥 ""다"" 이상해요!",163734,0,0,1,68,0,0,0,142426,0,0,0,0,0,0
"어서 오십시오, $p 님. 

포도주를 만드는 건 이번이 처음이지만, 아무렴 얼마나 어렵겠습니까?",,163738,0,0,0,68,0,0,0,0,588,0,0,0,0,0
일더스 님이 제게 포도주 관리를 맡기셨습니다. 호드의 입맛에 맞춰 어떤 재료를 넣을지 결정하는 일이지요.,,163740,0,0,0,68,0,0,0,0,1,0,0,0,0,0
,"카지트 좀 보세요. 엄청 열심히 하고 있잖아요. 

하다 보면 익숙해질 거예요.",163742,0,0,0,68,0,0,0,0,1,0,0,0,0,0
,일더스 님이 통 안에서 방방 뛰면 된다고 하시더라고요. 그래서 카지트한테 통 안에서 뛰라고 했죠. 세상에서 가장 쉬운 일이에요.,163745,0,0,0,68,0,0,0,0,1,0,0,0,0,0
포도주에 필요한 재료를 모으고 있죠. 피곤한 작업이에요. 이왕 이렇게 된 거 잠깐 쉬어야겠군요...,,163747,0,0,0,68,0,0,0,0,1,0,0,0,0,0
"마음씨가 참 고우십니다, $p 님.",,163755,0,0,0,68,0,0,0,0,588,0,0,0,0,0
어떤 형태로든 도울 수 있으면 좋겠습니다.,,163756,0,0,1,68,0,0,0,0,0,0,0,0,0,0
알겠습니다. 필요한 일이면 뭐든 하겠습니다.,,163762,0,0,1,68,0,0,0,0,0,0,0,0,0,0
,지당하신 말씀이죠. 이거 해라 저거 해라 명령하는 게 보기보다 쉬운 일은 아니라고요!,163785,0,0,1,68,0,0,0,0,0,0,0,0,0,0
,그럼요! 카지트를 보내서 어떤 재료가 필요한지 알아볼게요.,163790,0,0,0,68,0,0,0,0,1,0,0,0,0,0
,"네, 물론이죠. 카지트를 시켜서 포도주를 만들면 돼요. 그 대신 전 안 마실 거예요.",163791,0,0,0,68,0,0,0,0,1,0,0,0,0,0
,"정말 반가워요, $p 님.",163793,0,0,0,68,0,0,0,0,1,0,0,0,0,0
환상적이네요! 음식과 음료 개발이라면 마다할 이유가 없죠.,,163849,0,0,0,68,0,0,0,0,1,0,0,0,0,0
"시키신 대로 하긴 할 건데요, 그럼 발이 축축하게 젖는 거 아닌가요?",,163855,0,0,0,68,0,0,0,0,6,0,0,0,0,0
참 친절하시군요. 그렇지만 진실은 우리 둘 다 알지 않나요.,,163857,0,0,1,68,0,0,0,0,1,0,0,0,0,0
,필요한 물건이면 뭐든 구해드릴게요.,163971,0,0,0,68,0,0,0,0,1,0,0,0,0,0
키로. 일전에 그대의 요청을 성급히 거절해서 미안하네.,,164008,0,0,1,68,0,0,142473,0,0,0,0,0,0,0
호드가 쓰러지지 않는 건 고난 앞에서 뭉치기 때문이지.,,164009,0,0,1,68,0,0,142474,0,0,0,0,0,0,0
그대는 내 거부에도 불구하고 헌신적으로 우릴 도왔네. 볼둔에서 그랬던 것처럼.,,164010,0,0,1,68,0,0,142475,0,0,0,0,0,0,0
그게 바로 호드의 참된 기상일세. 변심한 게 아니라면 쌍수를 들고 그대 종족을 환영하겠네.,,164011,0,0,1,68,0,0,142476,0,0,0,0,0,0,0
,,164012,0,0,1,68,0,0,0,0,0,0,0,0,0,0
,,164013,0,0,1,68,0,0,0,0,0,0,0,0,0,0
,,164014,0,0,1,68,0,0,0,0,0,0,0,0,0,0
"영광입니다, 대부족장님.",,164015,0,0,1,68,0,0,142477,0,0,0,0,0,0,0
"그럼 결정됐군. 오늘 이 날을 기점으로, 볼둔의 불페라를 호드의 동맹으로 선포하겠네!",,164016,0,0,1,68,0,0,142478,0,0,0,0,0,0,0
,여기서는 알파카 안 먹죠?,164017,0,0,6,68,0,0,0,142439,0,0,0,0,0,0
,"괜찮은 거래군요. 친구여, 어둠이 당신을 인도하기를.",164058,0,0,1,70,0,6,0,124761,0,0,0,0,0,0
,고대의 언어로 당신의 무자비한 모습을 불러내리니.,164275,0,0,0,70,0,6,0,121999,0,0,0,0,0,0
,이 공물로 당신의 가장 어두운 얼굴을 제게 드리우소서.,164276,0,0,0,70,0,6,0,122000,0,0,0,0,0,0
,엘룬이시여! 내가 당신의 복수가 되게 하소서!,164282,0,0,0,70,0,6,0,122001,0,0,0,0,0,0
,"이제, 정의로 심판하리라. 밤 전사가... 내 안에 깨어났으니.",164283,0,0,0,70,0,6,0,122002,0,0,0,0,0,0
,,164476,0,0,0,70,0,0,0,0,0,0,0,0,0,0
"좋아, 시작해보자고! 연료도 채웠겠다, 계획도 세웠고, 실행에 옮길 손까지 빠진 게 하나도 없군!",,164508,0,0,0,68,0,0,0,0,0,0,0,0,0,0
멕카토크에게 우린 멍청하지 않다는 걸 보여주자고. 비행선에 불이 붙으면 거기 올라타서 가짜 구조 요청을 보내는 거야.,,164509,0,0,0,68,0,0,0,0,0,0,0,0,0,0
"그럼 멕카토크가 돌아오겠지. 장담컨대 막 ""이런, 갤리윅스한테 제대로 놀아났군. 놈이 내 비행선을 파괴했잖아? 사람들을 구해야 해!"" 이러면서 나타날 거야.",,164510,0,0,0,68,0,0,0,0,0,0,0,0,0,0
"녀석이 나타나면 우리가 동시에 덮치는 거야! 난 기계를 타고 공격할 테니, 너는, 그 뭐냐, 옆에서 어떻게 잘 해봐.",,164511,0,0,0,68,0,0,0,0,0,0,0,0,0,0
그 순간 너랑 내가 놈의 불타는 비행선에서 녀석을 날려 버리는 거야. 극적인 연출로는 최고봉이지!,,164512,0,0,0,68,0,0,0,0,0,0,0,0,0,0
"아, 이거 너무 신나는구먼. 턱이 막 떨릴 지경이야! 차근차근 하면 돼. 일단 비행선부터 날려 버리자고.",,164513,0,0,0,68,0,0,0,0,0,0,0,0,0,0
,"심연의 신이여, 내 말을 들어 주세요! 당신에게 문을 열 힘과... 진실의 인도자와... 길을 비추는 횃불을 가져왔습니다!",164890,0,0,0,70,0,6,0,124759,0,0,0,0,0,0
,거래를 받아들이고... 운명을 개척할 자유를 내게 줘요!,164891,0,0,1,70,0,6,0,124760,0,0,0,0,0,0
가라... 하지만 비수는 남아... 내 대의에 동참하거라.,,164892,0,0,0,70,0,6,124655,0,0,0,0,0,0,0
"난 네 운명을 꿈꾸었다, 필멸자여. ",,164893,0,0,0,70,0,6,124656,0,0,0,0,0,0,0
때가 가까워졌노라.,,164895,0,0,0,70,0,6,124657,0,0,0,0,0,0,0
어서! 비행기를 타시오!,,165029,0,0,0,70,0,0,0,0,0,0,0,0,0,0
놈들을 처치해! 당장! 어서 가!,,165030,0,0,0,70,0,0,0,0,0,0,0,0,0,0
"어쨌든 신경이 좀 쓰이는군. 앞으로 와라, 호드의 대변자. 어쩌면... 네가 원하는 걸 찾을 방법이 있을지도.",,165057,0,0,0,70,0,0,122999,0,0,0,0,0,0,0
실바나스!,,165359,0,0,0,70,0,0,121419,0,0,0,0,0,0,0
대체 무엇 때문에 이런 광기를 부리는 것이오?!,,165360,0,0,0,70,0,0,121420,0,0,0,0,0,0,0
,데렉 프라우드무어는 쿨 티란의 영웅이었소.,165361,0,0,0,70,0,0,0,121502,0,0,0,0,0,0
,"그의 정신이 제대로 길들여졌을 때, 프라우드무어 가문이 고대하던 자신들의 왕자를 만날 수 있게 해주는 거요...",165362,0,0,0,70,0,0,0,121504,0,0,0,0,0,0
이건 너무 지나치오.,,165363,0,0,0,70,0,0,121421,0,0,0,0,0,0,0
,"바인, 우리에겐 승리 아니면 죽음 뿐이오.",165364,0,0,0,70,0,0,0,121506,0,0,0,0,0,0
이... 이게 뭐지? 내가 어째서... 대체 내게 무슨 짓을 한 거냐?!,,165365,0,0,0,70,0,0,121383,0,0,0,0,0,0,0
,"자아, 프라우드무어 경, 내가 친히 네 가족과 재회할 기회를 주겠다.",165366,0,0,0,70,0,0,0,121508,0,0,0,0,0,0
,쿨 티라스를 위하여!,165395,0,0,0,70,2000,6,0,122685,0,0,0,0,0,0
으아아아아아!!!!,,165397,0,0,0,70,0,6,120939,0,0,0,0,0,0,0
으윽... 크흐윽...,,165398,0,0,0,84,0,6,121156,0,0,0,0,0,0,0
티란데 님...,,165649,0,0,274,70,0,6,122282,0,0,0,0,0,0,0
,"목숨을 잃은 자들의 복수를 하고, 실바나스가 이긴 게 아니란 걸 보여주죠! 얼라이언스가 돕지 않겠다면... 우리끼리 알아서 하겠습니다.",165650,0,0,274,70,0,6,0,122285,0,0,0,0,0,0
,"오늘 밤, 우린 승리할 겁니다!",165651,0,0,1,70,0,6,0,122004,0,0,0,0,0,0
,엘룬께서 우리 스스로를 구해낼 힘을 주셨으니!,165652,0,0,0,70,0,6,0,122005,0,0,0,0,0,0
,호드는 우리의 숲을 불태우면 희망도 사라지리라 생각했겠지요.,165653,0,0,0,70,0,6,0,122006,0,0,0,0,0,0
,"그 오판이 죽음을 부른 겁니다. 희망은 숲에 있는 것이 아니라, 서로에 대한 결속 안에 있는 것!",165654,0,0,0,70,0,6,0,122007,0,0,0,0,0,0
,우리는... 칼도레이입니다!,165655,0,0,0,70,0,6,0,122008,0,0,0,0,0,0
"리치 왕이 날 불러낸 게 아니었네. 에이르는 모조를 가져가지 않았다 하고, 브원삼디 님은 우리처럼 혼란스러워 하네. 그 누구도 실바나스를 그 자리에 앉히길 원치 않았어.",,165707,0,0,0,70,0,0,121093,0,1,0,0,0,0,0
,"상황이 어찌되었든 간에, 그녀는 호드의 수장입니다. 저는 그녀의 규칙이 제대로 관철되도록 최선을 다할 것입니다.",165708,0,0,0,70,0,0,0,122755,0,0,0,0,0,0
"잔달라는 탈란지, 자네의 용기 덕에 여전히 굳건하지. 자네 아버진 그 옛날 트롤 제국을 꿈꾸며 낡은 방식에 빠져 있었어.",,165710,0,0,0,70,0,0,121095,0,0,0,0,0,0,0
"하나, 자네는 처음으로 미래를 내다보았네... 트롤의 가능성을 본 게지. 자넨 어리지만, 참으로 정의롭네. 옛 족장의 조언이 필요하다면 언제든 내 영혼을 부르게나.",,165711,0,0,0,70,0,0,121096,0,0,0,0,0,0,0
"지금은 답을 찾아 계속 나아가겠네. 어둠 속에 새로운 적들이 모이기 시작하면, 그들을 사냥해야겠지... 놈들이 우릴 사냥하기 전에.",,165712,0,0,0,70,0,0,121074,0,0,0,0,0,0,0
,"날 감옥에서 꺼내준 이유는, 내게 원하는 바가 있어서겠지.",165792,0,0,6,70,0,6,0,123041,0,0,0,0,0,0
,"예리하군, 애쉬베인 여군주. 우리의 공통된 관심사에 대해... 얘기를 나눠볼까 하는데.",165793,0,0,1,70,0,6,0,123049,0,0,0,0,0,0
,삶은 이런 식이죠.,165879,0,0,1,70,0,6,0,121839,0,0,0,0,0,0
돌아갈 방법은 알아서 찾아야겠군.,,165880,0,0,1,70,0,6,122737,0,0,0,0,0,0,0
"그렇네, 친구여. 호드는 다시 한 번... 갈림길에 서 있네.",,165881,0,0,1,70,0,6,122738,0,0,0,0,0,0,0
,전쟁의 흐름이 여러 번 바뀌었어요. 제겐 우리가 가는 길이 왠지... 위험해 보이는군요.,165883,0,0,1,70,0,6,0,121840,0,0,0,0,0,0
,"데렉의 운명을 알게 된다면, 놈들은 분명 그를 구출하려 들 터.",165960,0,0,0,70,0,6,0,121503,0,0,0,0,0,0
,... 놈들이 잠든 사이에 죽일 수 있도록.,165961,0,0,0,70,0,6,0,121505,0,0,0,0,0,0
우리가 대체 몇 번이나 명예를 저버려야 하오?,,165963,0,0,0,70,0,6,121465,0,0,0,0,0,0,0
,그리고 죽음은 내 전문이지.,165971,0,0,0,70,0,6,0,121507,0,0,0,0,0,0
,황송하지 않느냐.,165973,0,0,0,70,0,6,0,121509,0,0,0,0,0,0
조심하십시오...,,166138,0,0,0,70,0,6,121651,0,0,0,0,0,0,0
걱정마세요. 해낼 겁니다.,,166139,0,0,0,102,3800,6,121652,0,0,0,0,0,0,0
이제 걱정하면 됩니까?,,166140,0,0,0,70,0,6,121653,0,0,0,0,0,0,0
"아뇨, 아뇨. 달려야 해요.",,166141,0,0,0,102,3700,6,121654,0,0,0,0,0,0,0
느낌이 영 좋지가 않네. 숨길 함선이 없는데 안개는 왜 만들어 낸 거지?,,166142,0,0,0,70,0,6,121655,0,0,0,0,0,0,0
,상식적으로 말이 안 됩니다. 일부러... 나즈미르로 유인한 게 아니라면...,166143,0,0,0,70,0,6,0,121657,0,0,0,0,0,0
,놈들이 우릴 속인 겁니다! 지금 아버지 홀로 도시를 지키고 계십니다!,166144,0,0,0,70,0,6,0,121658,0,0,0,0,0,0
뱀 같은 얼라이언스 놈들!,,166145,0,0,0,70,0,6,121656,0,0,0,0,0,0,0
,우리 고향이 공격받고 있다! 당장 줄다자르로 가야 한다!,166146,0,0,0,70,0,6,0,121659,0,0,0,0,0,0
,"조타수, 항구 쪽으로! 로아시여... 대체 여기 무슨 일이?",166289,0,0,0,70,0,0,0,122437,0,0,0,0,0,0
브원삼디!,,166423,0,0,0,70,0,6,122273,0,0,0,0,0,0,0
"아, 이런 이런 이런... 위대하신 라스타칸께 이 브원삼디의 도움이 또 필요한 모양이로군?",,166424,0,0,0,70,0,6,122274,0,0,0,0,0,0,0
도와주십시오... 그렇지 않으면 이 왕국은 당신을 기억하는 이 하나 없는 폐허가 될 것입니다.,,166425,0,0,0,70,0,6,122275,0,0,0,0,0,0,0
흐음.,,166426,0,0,0,70,0,6,122276,0,0,0,0,0,0,0
"일어나라, 사자들이여!",,166427,0,0,0,70,0,6,122277,0,0,0,0,0,0,0
이 거리를 저 이방인들의 피로 온통 물들여라!,,166428,0,0,0,70,0,6,122278,0,0,0,0,0,0,0
잔달라는 우리의 것이다... 영원히!,,166429,0,0,0,70,0,6,122279,0,0,0,0,0,0,0
,이만하면 적이 충분히 약해졌을 거예요. 당장 돌아가서 군대에 진군 신호를 보내죠!,167636,0,0,0,68,0,0,0,0,0,0,0,0,0,0
개발 중,,169022,0,0,0,93,555555,0,0,0,0,0,0,0,0,0
,쿨 티라스 사람들은 모두 바다와 연결되어 있소.,169101,0,0,0,70,0,6,0,126196,0,0,0,0,0,0
