Text_lang,Text1_lang,ID,LanguageID,ConditionID,EmotesID,Flags,ChatBubbleDurationMs,VoiceOverPriorityID,SoundKitID[0],SoundKitID[1],EmoteID[0],EmoteID[1],EmoteID[2],EmoteDelay[0],EmoteDelay[1],EmoteDelay[2]
"아, 달콤한 자유여! 후회 안 할 거요, 사령관. 드레노어 최고의 장비를 만들어 주지!",,81957,0,0,0,68,0,0,45831,0,0,0,0,0,0,0
뭐가 있는지 한번 볼까.,,81959,0,0,0,68,0,0,45832,0,0,0,0,0,0,0
가열로는 대장간의 영혼이지. 이건 작지만 도구만 있다면 내가 손볼 수 있소.,,81960,0,0,0,68,0,0,45833,0,0,0,0,0,0,0
괜찮아 보이는군. 살짝 손을 보면 포에 실어서 쏠 수 있겠소.,,81961,0,0,0,68,0,0,0,0,0,0,0,0,0,0
"쉬이이! 쟤들이 우리 소리를 들으면, 내가 숨어 있는 걸 들키고 말 거야!",,81971,0,0,0,68,0,0,0,0,0,0,0,0,0,0
"전차는 내가 작동시키지. 카드가 님, 시간을 벌어 주십쇼!",,81980,0,0,0,68,0,0,45748,0,0,0,0,0,0,0
할 수 있는 데까지 해보겠소.,,81981,0,0,0,68,0,0,44866,0,0,0,0,0,0,0
"영웅이여, 이 오크들을 쫓아 주시오!",,81982,0,0,0,68,0,0,44867,0,0,0,0,0,0,0
,전차가 공격해 옵니다! 조심하세요!,81983,0,0,0,68,0,0,0,45555,0,0,0,0,0,0
이 제어 장치는 도통 이해할 수가 없어! 오크가 만든 전차는 다신 몰지 말아야지.,,81984,0,0,0,68,0,0,45749,0,0,0,0,0,0,0
모두 힘을 내게. 적이 다가오고 있네!,,81985,0,0,0,68,0,0,46408,0,0,0,0,0,0,0
놈들이 폭탄을 꺼내고 있네. 수레가 다가오기 전에 폭파시켜!,,81986,0,0,0,68,0,0,45701,0,0,0,0,0,0,0
적의 수가 너무 많군...,,81987,0,0,0,68,0,0,44779,0,0,0,0,0,0,0
포기하기엔 너무 이르오.,,81988,0,0,0,68,0,0,46709,0,0,0,0,0,0,0
됐다! 움직이기 시작했네! 이제 끝장을 내자고!,,81989,0,0,0,68,0,0,45750,0,0,0,0,0,0,0
"오호호, 잘 쐈네.",,82005,0,0,0,68,0,0,45700,0,0,0,0,0,0,0
"좋아. 하지만 너무 시간을 쏟진 마시오. 곧 당신들 둘 모두가 필요하게 될 텐데, 그때는 다들 살아 있어야 하니까.",,82103,0,0,0,68,0,0,0,0,0,0,0,0,0,0
"가지, 콜다나!",,82111,0,0,0,68,0,0,0,0,0,0,0,0,0,0
적 요새를 정찰할 작은 파티를 모으고 있습니다.,적 요새를 정찰할 작은 파티를 모으고 있어요.,82117,0,0,0,68,0,0,0,0,0,0,0,0,0,0
"스랄, 남은 생존자들을 지휘하시오. 앞쪽에서 다시 만납시다.","스랄, 남은 생존자들을 지휘하시오. 앞쪽에서 다시 만납시다.",82120,0,924,0,68,0,0,0,0,0,0,0,0,0,0
"마라아드, 남은 생존자들을 지휘하시오. 앞쪽에서 다시 만납시다.","마라아드, 남은 생존자들을 지휘하시오. 앞쪽에서 다시 만납시다.",82121,0,923,0,68,0,0,0,0,0,0,0,0,0,0
그렇게 하겠습니다.,,82122,0,924,0,68,0,0,0,0,0,0,0,0,0,0
"네, 대마법사님.",,82124,0,923,0,68,0,0,0,0,0,0,0,0,0,0
앞쪽입니다! 보십시오!,,82130,0,923,0,68,0,0,0,0,0,0,0,0,0,0
"조상님들이여, 도와주십시오... 저걸 보게!",,82131,0,924,0,68,0,0,0,0,0,0,0,0,0,0
흠... 내가 할 일이 있겠군.,,82149,0,0,0,68,0,0,46164,0,0,0,0,0,0,0
피와 명예를 위해!,,82150,0,0,0,68,0,0,46165,0,0,0,0,0,0,0
킬로그 데드아이,킬로그 데드아이,82151,0,0,0,71,0,0,0,0,0,0,0,0,0,0
피눈물 부족 전쟁군주,피눈물 부족 전쟁군주,82152,0,0,0,71,0,0,0,0,0,0,0,0,0,0
내 밀림에 뭔가 기어들어 왔구나. 하하하... 신선한 고기다!,,82153,0,0,0,70,0,0,0,0,0,0,0,0,0,0
"싸우지 않고 물러나지는 않겠다, 데드아이.",,82154,0,0,0,68,0,0,0,0,0,0,0,0,0,0
도움이 필요할 것 같군.,,82155,0,0,0,68,0,0,0,0,0,0,0,0,0,0
안 돼! 나를 상대해라!,,82156,0,0,0,68,0,0,0,0,0,0,0,0,0,0
어서... 카드가에게... 가시오...,,82157,0,0,0,68,0,0,46166,0,0,0,0,0,0,0
,우와! 감사해요. 감사해요. 정말 감사해요!,82178,0,0,1,68,0,0,0,0,0,0,0,0,0,0
"모두 절 잊어버린 줄 알았어요. 정말 감사해요, 친절한 $G형:누나;!",,82179,0,0,1,68,0,0,0,0,0,0,0,0,0,0
"우와, 저 많은 오크를 무찌르고 오신 거예요? 진짜 강하시네요!",,82180,0,0,1,68,0,0,0,0,0,0,0,0,0,0
,<소녀가 슬픔을 가누지 못하고 흐느낍니다.>,82182,0,0,1,68,0,0,0,0,0,0,0,0,0,0
"운이 좋으면 이제 작은 녀석들은 모두 도망가고, 우린 본격적으로 주둔지를 세울 수 있을 걸세.",,82199,0,0,0,68,0,0,0,0,0,0,0,0,0,0
"싸우지 않고 물러나지는 않겠다, 데드아이.",,82215,0,0,0,68,0,0,0,0,0,0,0,0,0,0
흠.,,82258,0,0,0,70,0,0,46707,0,0,0,0,0,0,0
놈에게 명예란 없습니다.,,82259,0,0,0,68,0,0,44590,0,0,0,0,0,0,0
계속 숨어 있을 순 없소.,,82260,0,0,0,68,0,0,44851,0,0,0,0,0,0,0
내 투기장으로 들어와서 명예롭게 죽어라.,,82261,0,0,0,70,0,0,0,0,0,0,0,0,0,0
"내 투기장에 온 걸 환영한다, 이방인. 승리하지 못하면... 시체가 될 것이다.",,82262,0,0,0,70,0,0,0,0,0,0,0,0,0,0
이게 으스러진 손의 방식이다!,,82263,0,0,0,68,0,0,0,0,0,0,0,0,0,0
"투기장이라니. 함정인지도 모르지만, 적어도 명예롭게 죽겠군요.",,82264,0,0,0,68,0,0,46407,0,0,0,0,0,0,0
,"서둘러, 이렐. 네 망치가 큰 도움이 될 거야.",82361,0,0,1,68,0,0,0,0,0,0,0,0,0,0
당신이 투석기를 부수는 동안 난 성문을 정찰하겠소. 록타르 오가르!,,82486,0,0,0,68,0,0,45840,0,0,0,0,0,0,0
"사령관, 여기라오!",,82494,0,0,0,68,0,0,45841,0,0,0,0,0,0,0
망할 오우거와 마법 같으니! 보호막을 내릴 방법을 못 찾겠군. 어떻게든 숨어 들어가야 하네.,,82496,0,0,0,68,0,0,45827,0,0,0,0,0,0,0
반대편에서 만나지.,,82497,0,0,0,68,0,0,0,0,0,0,0,0,0,0
"세상에, 대단한 싸움이었소!",,82525,0,0,0,68,0,0,45838,0,0,0,0,0,0,0
오우거 좀 잡아 봅시다!,,82530,0,0,1,68,0,0,45839,0,0,0,0,0,0,0
"따라오게, 영웅이여. 공중에서 지원하세!",,82568,0,0,1,70,0,0,44799,0,0,0,0,0,0,0
나루의 빛은 우리의 망치이자 방패라네.,,82569,0,0,1,70,0,0,44800,0,0,0,0,0,0,0
놈들이 사원에 거의 다다랐네! 서두르게!,,82570,0,0,1,70,0,0,44801,0,0,0,0,0,0,0
선회하게. 계단을 막아야 하네.,,82571,0,0,1,70,0,0,44802,0,0,0,0,0,0,0
아카마 총독! 측면을 조심하게!,,82572,0,0,1,70,0,0,0,0,0,0,0,0,0,0
"감사합니다, 오랜 친구여!",,82573,0,0,1,70,0,0,0,0,0,0,0,0,0,0
너희 오크 호드가 카라보르의 빛을 가리는 일은 다시는 없을 것이다!,,82574,0,0,1,70,0,0,44803,0,0,0,0,0,0,0
전진하라. 나루의 빛을 위하여!,,82575,0,0,1,70,0,0,44804,0,0,0,0,0,0,0
"빛과 함께 나아가라, 형제자매여!",,82576,0,0,1,70,0,0,44805,0,0,0,0,0,0,0
이 정도면 된 것 같군...,,82577,0,0,1,70,0,0,44806,0,0,0,0,0,0,0
해냈군! 방벽을 무너뜨렸어!,,82578,0,0,1,70,0,0,0,0,0,0,0,0,0,0
선봉대를 격퇴했네! 지상군과 합류하세.,,82579,0,0,1,70,0,0,44822,0,0,0,0,0,0,0
남은 병력은 이게 다입니다. 우린 여기서 사원 문을 지키겠습니다.,,82580,0,0,1,70,0,0,46723,0,0,0,0,0,0,0
"용사여, 항만까지 길을 뚫어 주십시오.",,82581,0,0,1,70,0,0,46724,0,0,0,0,0,0,0
,전 남쪽에서 전진할게요. 빛의 가호를 빕니다.,82582,0,0,1,70,0,0,0,45626,0,0,0,0,0,0
,"용사여, 나루가 도우러 왔습니다. 나루가 힘을 모으는 동안 지켜야 돼요!",82583,0,0,1,70,0,0,0,45628,0,0,0,0,0,0
,해냈군요! 이제 이 공격을 끝장냅시다...,82584,0,0,1,70,0,0,0,45629,0,0,0,0,0,0
강철 호드의 진정한 힘을 보아라!,,82585,0,0,1,70,0,0,0,0,0,0,0,0,0,0
그만. 이제 제대로 상대해 주마. 내 손으로 직접.,,82586,0,0,1,70,0,0,0,0,0,0,0,0,0,0
,저길 보세요! 놈들의 사령관입니다.,82587,0,0,1,70,0,0,0,45630,0,0,0,0,0,0
,나루가 뭘 하는 거죠?,82588,0,0,6,70,0,0,0,45631,0,0,0,0,0,0
끝났군. 우리가 이겼네!,,82589,0,0,1,70,0,0,44823,0,0,0,0,0,0,0
,"영웅이여, 용맹히 싸워 주셨습니다. 당신에게 진심으로 감사드려요.",82590,0,0,1,70,0,0,0,45632,0,0,0,0,0,0
"반갑네, 우리 민족의 구원자여!",,82592,0,0,1,70,0,0,45364,0,0,0,0,0,0,0
"이걸 듣고 있다면, 내가 이 세상에 없단 얘기겠지... 하지만 카라보르는 건재할 터.",,82593,0,0,1,70,0,0,45365,0,0,0,0,0,0,0
자네에게 설명해 줘야 옳겠지.,,82594,0,0,1,70,0,0,45366,0,0,0,0,0,0,0
우리 드레나이가 숭배하는 나루는 순수한 빛으로 이루어진 생명체이네.,,82595,0,0,1,70,0,0,45367,0,0,0,0,0,0,0
하지만 죽음이 가까워지면 나루는 정수를 잃고 어둠의 존재로 무너져 내리게 되지.,,82596,0,0,1,70,0,0,45368,0,0,0,0,0,0,0
"우리 드레나이가 처음 이 세계에 왔을 때, 나루도 우리와 함께 있었네. 하지만 함선이 추락하는 걸 막진 못했지.",,82597,0,0,1,70,0,0,45369,0,0,0,0,0,0,0
"그 끔찍한 밤에 드레노어 하늘에 나타났던 ""검은 별""은... 사실 진짜 별이 아니라네.",,82598,0,0,1,70,0,0,45370,0,0,0,0,0,0,0
그건 타락한 나루였어. 혼란과 공포의 순간에 우리 함선에서 빠져나간. 그 이름은 크아라라네.,,82599,0,0,1,70,0,0,45371,0,0,0,0,0,0,0
"한때는 믿음과 아름다움의 생명체였던 것이 어둡고 탐욕스러운 신, 살아 있는 어둠 그 자체가 되었지.",,82600,0,0,1,70,0,0,45372,0,0,0,0,0,0,0
우리는 크아라에게 엄청난 빚을 졌네. 그 나루가 없었다면 우린 고향 아르거스 행성에서 탈출하지 못했겠지.,,82601,0,0,1,70,0,0,45373,0,0,0,0,0,0,0
크아라가 암흑으로 변하는 걸 보는 건 감당하기 어려운 고통이었네. 나루가 돌아왔을 때... 난 해야만 하는 일을 했지.,,82602,0,0,1,70,0,0,45374,0,0,0,0,0,0,0
"기억하게... 생명은 곧 빛이며... 빛은 생명 그 자체임을. 서로 형태가 바뀔 뿐, 영영 없어지는 게 아니라네.",,82603,0,0,1,70,0,0,45375,0,0,0,0,0,0,0
어둠이... 다가온다...,,82676,0,0,1,70,0,0,0,0,0,0,0,0,0,0
어둠이 점점 더 강해진다!,,82677,0,0,1,70,0,0,0,0,0,0,0,0,0,0
검은 별이 온다...,,82678,0,0,1,70,0,0,0,0,0,0,0,0,0,0
공허가 모든 것을 삼키리라...,,82679,0,0,1,70,0,0,0,0,0,0,0,0,0,0
"고맙네, 대장. 저 교활한 전쟁부족 놈들은 이 늙은 즈완이 손봐줘야 하는데 말이지.",,82684,1,0,0,68,0,0,0,0,0,0,0,0,0,0
난 사메디의 영토로 가겠네. 훗날 다시 만나지.,,82685,1,0,0,68,0,0,0,0,0,0,0,0,0,0
전쟁군주 블랙핸드,전쟁군주 블랙핸드,82687,0,0,0,71,0,0,0,0,0,0,0,0,0,0
검은바위 오크의 지도자,검은바위 오크의 지도자,82688,0,0,0,71,0,0,0,0,0,0,0,0,0,0
축복해 주셔서 고맙습니다. 무덤의 주인께서 사령관님께 미소를 짓길.,,82711,1,0,0,68,0,0,0,0,0,0,0,0,0,0
오슈군에 뭔가 제 영혼을 끌어당기는 게 있습니다. 가서 살펴봐야겠군요.,,82712,1,0,0,68,0,0,0,0,0,0,0,0,0,0
이게 뭐지? 내가 서... 설마 죽었어?,,82714,1,0,0,68,0,0,0,0,0,0,0,0,0,0
전쟁노래 부족을 영원히 저주하겠습니다. 부두교에 너무 심취하지 마십시오.,,82715,1,0,0,68,0,0,0,0,0,0,0,0,0,0
으아아아아아악!,으아아아아아악!,82716,0,0,0,68,0,0,0,0,0,0,0,0,0,0
"정령의 옥좌에 머무는 격노여, 부름에 답하겠다. 어떻게 도와주면 되겠나?",,82847,0,0,1,68,0,0,46704,0,0,0,0,0,0,0
사령관! 오우거의 단말마를 듣고 달려왔다오. 다 잘 됐소?,,82858,0,0,0,68,0,0,45826,0,0,0,0,0,0,0
탈것 부르신 분?,,82860,0,0,0,68,0,0,0,0,0,0,0,0,0,0
"당신 셋은 우리 용사를 따라 전장으로 가서, 내 신호를 기다리시오.",,82963,0,0,0,68,0,0,44885,0,0,0,0,0,0,0
내게 생각이 있소.,,82964,0,0,0,68,0,0,44886,0,0,0,0,0,0,0
"그리고 까마귀 어미는 내게 말씀하셨다. 크릭카, 내 착한 아이야. 탕아들을 찾아서 다시 내 둥지로 데려오거라.",,82969,0,0,0,68,0,0,0,0,0,0,0,0,0,0
무리가 모두 모이면 종말이 다가오리라. 크나큰 재앙이 다가와 이 세계가 산산이 조각나리라! 그러나 두려워 말라. 까마귀 어미께서 우리를 구원하시리니!,,82970,0,0,0,68,0,0,0,0,0,0,0,0,0,0
"천상에서 까마귀 어미가 자식들을 구하러 내려오시리라. 우리는 그분의 흑단 같은 거대한 날개를 타고 날아올라, 그분의 검은 왕국에서 정당한 우리 자리를 차지할 터!",,82971,0,0,0,68,0,0,0,0,0,0,0,0,0,0
그날이 올 때까지 까마귀 어미를 칭송하라! 그분의 위대한 종족에서 가르침과 힘을 구하라. 까마귀 어미의 그림자가 우리에게 드리우길!,,82972,0,0,0,68,0,0,0,0,0,0,0,0,0,0
각인사! 모두 받아적었느냐?,,82973,0,0,0,68,0,0,0,0,0,0,0,0,0,0
"예, 고위 까마귀예언자 님.",,82974,0,0,0,68,0,0,0,0,0,0,0,0,0,0
까마귀 어미를 칭송하라!,,82975,0,0,0,68,0,0,0,0,0,0,0,0,0,0
그 돌이 있으면 혼자서 방어막을 통과할 수 있네. 안에 들어가서 저들의 방어막을 내리게. 그러면 우리도 합류하겠네.,,82993,0,0,1,70,0,0,45396,0,0,0,0,0,0,0
,스승님도 제가 이렇게 울면서 서 있는 건 원치 않으셨을 겁니다. 무기고로 가죠.,83044,0,0,0,68,0,0,0,44682,0,0,0,0,0,0
,굉장하군요! 아레드 님께서 살아서 이걸 보셨다면 정말 뿌듯해하셨을 겁니다!,83045,0,0,0,68,0,0,0,44683,0,0,0,0,0,0
항구로... 항구로 가시오. 어서! 모두 뛰어!,,83047,0,0,0,68,0,0,44874,0,0,0,0,0,0,0
"덤벼라, 헬스크림!",,83048,0,0,0,68,0,0,45043,0,0,0,0,0,0,0
어리석은 일이오. 다시 싸울 날이 있을 거요.,,83049,0,0,0,68,0,0,46712,0,0,0,0,0,0,0
,조심하세요!,83050,0,0,0,68,0,0,0,45557,0,0,0,0,0,0
,움직이세요. 앞쪽에 배가 보여요.,83051,0,0,0,68,0,0,0,45558,0,0,0,0,0,0
모든 적이 우릴 뒤쫓고 있소.,,83052,0,0,0,68,0,0,0,0,0,0,0,0,0,0
,모든 적이 우릴 뒤쫓고 있어요.,83053,0,0,0,68,0,0,0,0,0,0,0,0,0,0
이제 어쩝니까?,,83054,0,0,0,68,0,0,44598,0,0,0,0,0,0,0
도로 끝에 있는 배로 향하게.,,83056,0,0,0,68,0,0,44780,0,0,0,0,0,0,0
이쪽이오. 어서 갑시다! 가요!,,83057,0,0,0,68,0,0,44875,0,0,0,0,0,0,0
"도망갈 곳은 없다, 이방인들아. 여기는 내 세계다. 네놈들을 찾고야 말겠다!",,83058,0,0,0,68,0,0,46503,0,0,0,0,0,0,0
"서리늑대가 널 기다릴 거다, 헬스크림! 네 녀석과 오우거 돼지들, 망할 강철 호드까지... 모두 죽었다고 생각해라!",,83060,0,0,0,68,0,0,45044,0,0,0,0,0,0,0
놈은 무시하게. 어둠달 골짜기에서 지원군을 모아야 하네. 이번에야말로 드레나이가 승리할 걸세.,,83061,0,0,0,68,0,0,44781,0,0,0,0,0,0,0
"어서 출발합시다. 강철 호드를 막아내려면, 우리도 요새를 건설해야 하오. 이곳 주민들의 도움이 필요할 거요.",,83062,0,0,0,70,0,0,44876,0,0,0,0,0,0,0
어둠달 골짜기로!,,83063,0,0,0,70,0,0,44877,0,0,0,0,0,0,0
서리늑대의 고향으로!,,83064,0,0,0,70,0,0,44878,0,0,0,0,0,0,0
,당신이 투석기를 처리하는 동안 전 먼저 가서 요새 문을 정찰하겠습니다. 디오니스 아카.,83102,0,0,0,68,0,0,0,44677,0,0,0,0,0,0
,"사령관님, 여깁니다!",83105,0,0,0,68,0,0,0,44678,0,0,0,0,0,0
,이 마법 보호막이 너무 강해서 우리 폭약으로는 파괴할 수가 없습니다. 우회해서 몰래 들어가는 수밖에 없겠어요.,83106,0,0,0,68,0,0,0,44679,0,0,0,0,0,0
,제가 먼저 가면서 길을 뚫을 테니 반대편에서 만나죠.,83107,0,0,0,68,0,0,0,0,0,0,0,0,0,0
저 망할 놈들이 곧 들이닥칠 걸세. 어서 움직이자고!,,83127,0,0,0,68,0,0,45751,0,0,0,0,0,0,0
인원 대피 시스템 작동.,,83132,0,0,0,68,0,0,0,0,0,0,0,0,0,0
,정말 굉장한 전투였습니다.,83145,0,0,4,68,0,0,0,44672,0,0,0,0,0,0
,시작할까요?,83154,0,0,1,68,0,0,0,44681,0,0,0,0,0,0
위험했군.,,83203,0,0,0,68,0,0,44891,0,0,0,0,0,0,0
이제 돌아갈 수는 없소. 야수의 아가리 속으로... 계속 전진해야 하오.,,83204,0,0,0,68,0,0,44892,0,0,0,0,0,0,0
드레나이가 이토록 달콤한 보물을 사원에 숨겨뒀을 줄이야.,,83255,0,0,0,70,0,0,44423,0,0,0,0,0,0,0
"감히 내게 도전하느냐, 아킨둔의 수호자여?!",,83256,0,0,0,70,0,0,44424,0,0,0,0,0,0,0
내 결속을 풀어라... 그럼 차원문도 닫힌다...,,83257,0,0,0,70,0,0,45331,0,0,0,0,0,0,0
이 타락... 모두 불탈 것이다.,,83258,0,0,0,70,0,0,44425,0,0,0,0,0,0,0
그래... 이거야!,,83259,0,0,0,68,0,0,45332,0,0,0,0,0,0,0
그롬마쉬는 대가를 치르리라.,,83260,0,0,0,68,0,0,45334,0,0,0,0,0,0,0
군단이 와서... 너희 영혼을 취하리라.,,83261,0,0,0,70,0,0,44426,0,0,0,0,0,0,0
꾸물대지 마라. 너희 병력의 생명의 정수가 약해지는 것이 느껴진다. 후회는 나중에 해라...,,83262,0,0,0,70,0,0,45335,0,0,0,0,0,0,0
우린 다시 만나게 되리라...,,83263,0,0,0,70,0,0,45336,0,0,0,0,0,0,0
"굴단, 어리석구나. 이 선물은... 네 생각보다 훨씬 강력하다...",,83264,0,0,0,70,0,0,44427,0,0,0,0,0,0,0
참 오래 기다려왔다...,,83265,0,0,0,70,0,0,44428,0,0,0,0,0,0,0
...이토록... 굶주렸지...,,83266,0,0,0,70,0,0,44429,0,0,0,0,0,0,0
"이제, 모두 내 앞에 무릎 꿇을지어다!",,83268,0,0,0,70,0,0,44430,0,0,0,0,0,0,0
구속하는 힘이 약해지는군. 이제 자유다!,,83282,0,0,0,68,0,0,45333,0,0,0,0,0,0,0
"전원, 몸을 숨기시오!",,83285,0,0,0,68,0,0,0,0,0,0,0,0,0,0
,우리 위치를 소문 내고 있지. 저 바보가 제네사우루스를 끌고 왔어.,83312,0,0,0,68,0,0,0,46542,0,0,0,0,0,0
아니? 영웅 아니십니까? 고르그론드는 영웅이 올 곳이 아닙니다.,,83324,0,0,0,68,0,0,46251,0,0,0,0,0,0,0
놈들이 장막의 아크라즈를 공격했어!,,83338,0,0,0,68,0,0,0,0,0,0,0,0,0,0
송두리째... 사라져 버렸어...,,83339,0,0,0,68,0,0,0,0,0,0,0,0,0,0
서둘러! 어서 가야 해!,,83340,0,0,0,68,0,0,0,0,0,0,0,0,0,0
"하, 드디어 풀려났군.",,83386,0,0,0,68,0,0,45040,0,0,0,0,0,0,0
내 아버지의 영혼에 맹세하마. 이 대가는 톡톡히 받아내겠다!,,83387,0,0,0,68,0,0,45041,0,0,0,0,0,0,0
으아!,,83388,0,0,0,68,0,0,44888,0,0,0,0,0,0,0
윽... 아!,,83389,0,0,0,68,0,0,0,0,0,0,0,0,0,0
"뭐, 그 정도면...",,83390,0,0,0,68,0,0,0,0,0,0,0,0,0,0
나쁘지 않았군.,,83391,0,0,0,68,0,0,0,0,0,0,0,0,0,0
때맞춰 도착한 거 같군.,,83406,0,0,0,68,0,0,44889,0,0,0,0,0,0,0
드디어 자유로군! 일을 마치면 오우거 소굴에서 다시 만나지. 이번엔 오우거 족장을 함께 처치하도록 하자고.,,83431,0,0,0,68,0,0,0,0,0,0,0,0,0,0
"롤탈, 놈들을 산 채로 데려와라. 값을 톡톡히 받을 테니.",,83635,0,0,0,70,0,0,42066,0,0,0,0,0,0,0
이 해변에 강철 호드가 상륙했다네. 우리는 놈들이 후회하게 만들어야 하네.,,83688,0,0,396,68,0,0,0,0,0,0,0,0,0,0
여기로!,,83711,0,0,0,68,0,0,44882,0,0,0,0,0,0,0
계속 여기에만 있을 순 없소. 조만간 강철 호드의 본대가 우릴 덮칠 것이오.,,83718,0,0,0,68,0,0,44864,0,0,0,0,0,0,0
"우리 용사가 남아서 적의 야영지에 혼란을 일으키는 동안, 우리는 밀림을 통해 안전하게 빠져나갑시다.",,83719,0,0,0,68,0,0,44865,0,0,0,0,0,0,0
행운을 비네.,,83720,0,0,0,68,0,0,46406,0,0,0,0,0,0,0
잘 싸우게.,,83721,0,0,0,68,0,0,44778,0,0,0,0,0,0,0
아아아아아아아아아아악!,,83762,0,0,0,68,0,0,0,0,0,0,0,0,0,0
,"총독님, 영혼술사들을 제 야영지로 보내십시오. 테론고르가 악마를 더 풀기 전에 막으려 합니다.",83774,0,0,1,68,0,0,0,45718,0,0,0,0,0,0
이 세계 또한 파멸하기 전에 반드시 테론고르를 막아야 합니다.,,83775,0,0,1,68,0,0,44601,0,0,0,0,0,0,0
걱정 마. 우리가 지켜줄게!,,83778,0,0,0,68,0,0,45747,0,0,0,0,0,0,0
,"어서요, 지금 당장 가야 해요!",83834,0,0,0,68,0,0,0,0,1,0,0,0,0,0
"여기 있었군요, 핀치휘슬 양!",,83847,0,0,0,68,0,0,0,0,0,0,0,0,0,0
,"때맞춰 오셨네요! 어서 가죠, 가즈윗츠 씨.",83848,0,0,0,68,0,0,0,0,0,0,0,0,0,0
,물론이지요.,83849,0,0,0,68,0,0,0,0,0,0,0,0,0,0
,"물론 감독하고 있죠. 자, 어서 가요!",83850,0,0,0,68,0,0,0,0,0,0,0,0,0,0
"훌륭하군, $n.",,83959,0,0,0,69,0,0,0,0,0,0,0,0,0,0
이 동굴은 꽤 요긴하겠는걸.,,83960,0,0,0,69,0,0,0,0,0,0,0,0,0,0
내 뒤를 바짝 따라오시오.,,84009,0,0,0,68,0,0,44852,0,0,0,0,0,0,0
"자, 백 명의 목숨을 빼앗아봐라!",,84020,0,0,0,70,0,0,44509,0,0,0,0,0,0,0
"미안하지만, 그러고 있을 시간은 없다.",,84021,0,0,0,70,0,0,44853,0,0,0,0,0,0,0
"흥. 아직 한 명이 남았다, 마법사.",,84022,0,0,0,68,0,0,44511,0,0,0,0,0,0,0
"흥, 하나는 나중에 네놈으로 채우지.",,84023,0,0,0,68,0,0,44854,0,0,0,0,0,0,0
모두 나를 따라오시오!,,84024,0,0,0,68,0,0,44855,0,0,0,0,0,0,0
어서 동굴로 들어가시오! 얼음이 녹기 전에!,,84025,0,0,0,68,0,0,44856,0,0,0,0,0,0,0
이 정도면 된 것 같군...,,84062,0,0,0,68,0,0,44806,0,0,0,0,0,0,0
잡아라! 절대로 놓치지 마라!,,84086,0,0,0,68,0,0,44512,0,0,0,0,0,0,0
만족스럽군. 꽤 흥미진진해.,,84108,0,0,0,70,0,0,44510,0,0,0,0,0,0,0
"말라다르 총독, 퀴아나와 함께 동굴을 정찰하시오.",,84122,0,924,0,68,0,0,44857,0,0,0,0,0,0,0
알겠습니다.,,84123,0,0,0,68,0,0,44592,0,0,0,0,0,0,0
"$n, 당신이 할 일이 있소.",,84124,0,0,0,68,0,0,0,0,0,0,0,0,0,0
"리아드린, 올린과 함께 동굴을 정찰하시오.",,84125,0,923,0,68,0,0,44858,0,0,0,0,0,0,0
,알겠습니다.,84126,0,0,0,68,0,0,0,45711,0,0,0,0,0,0
도망치는 것도 이제 끝이다.,,84248,0,0,0,70,0,0,43708,0,0,0,0,0,0,0
"그렇겐 안 된다, 넬쥴.",,84249,0,0,0,70,0,0,44890,0,0,0,0,0,0,0
그래... 와라! 강철 호드의 이름으로 너희 모두를 산 채로 묻어 주마!,,84250,0,0,0,70,0,0,43709,0,0,0,0,0,0,0
쓸모없군...,,84268,0,0,0,70,0,0,43707,0,0,0,0,0,0,0
꿈에서 보았다... 다른 세계에서 온 이방인들이 우리가 지켜 온 것을 모조리 불태우는 것을...,,84374,0,0,0,70,0,0,46078,0,0,0,0,0,0,0
그러나 드레노어의 핏줄에는 오크의 피가 흐른다!,,84375,0,0,0,70,0,0,46079,0,0,0,0,0,0,0
"가라, 강철 호드여! 적을 시체로 만들어라.",,84376,0,0,0,70,0,0,46080,0,0,0,0,0,0,0
그롬마쉬의 영광을 위하여!,,84377,0,0,0,70,0,0,46081,0,0,0,0,0,0,0
내 힘은 어딨느냐?,,84445,0,0,0,70,0,0,45314,0,0,0,0,0,0,0
"네 힘이라고? (아니, 내 거야!)",,84446,0,0,0,70,0,0,46620,0,0,0,0,0,0,0
"복종하라, 사도여. 놈을 내게 건네라.",,84447,0,0,0,70,0,0,45315,0,0,0,0,0,0,0
그럴 생각 없다. (이제 네 말은 안 들어!),,84448,0,0,0,70,0,0,46621,0,0,0,0,0,0,0
크우레에게 많은 걸 배웠다. (우린 책을 쓸 거야!),,84463,0,0,0,70,0,0,46622,0,0,0,0,0,0,0
미쳤군.,,84464,0,0,0,70,0,0,45316,0,0,0,0,0,0,0
"도망쳐라, 늙은 오크. (이제 높은망치가 불타면, 다음은 온 세계야!)",,84465,0,0,0,70,0,0,46623,0,0,0,0,0,0,0
죽어서... 자유로워진다...,,84566,0,0,0,68,0,0,46294,0,0,0,0,0,0,0
저 겁쟁이들은 우릴 문의 동력원으로 쓰고 있었다. 후회하게 해주자고.,,84576,0,0,1,68,0,0,44445,0,0,0,0,0,0,0
고맙다.,,84577,0,0,273,68,0,0,44446,0,0,0,0,0,0,0
"정말 강철 호드를 막고 싶다면, 굴단을 찾아내라. (굴단이야! 굴단이 어둠의 문을 움직여!)",,84580,0,0,0,68,0,0,46626,0,0,0,0,0,0,0
굴단이야! 굴단이 어둠의 문을 움직여!,,84581,0,0,0,68,0,0,0,0,0,0,0,0,0,0
"그렇지만 소크레타르의 광기 속에도, 진실된 구석은 있었습니다.",,84658,0,0,396,68,0,0,0,0,0,0,0,0,0,0
"그는 우리의 안일함에 의문을 품었습니다. 어쩌면 우리는 드레노어에 숨어 살면서, 너무 만족하고 너무 안주했는지도 모릅니다.",,84659,0,0,396,68,0,0,0,0,0,0,0,0,0,0
"부름이 오고 있습니다, 영웅이여. 크나큰 무엇인가가, 지평선 바로 너머에서 숨죽이고 기다리고 있습니다. 때가 오면, 드레나이는 그 부름에 답해야 할 겁니다.",,84660,0,0,396,68,0,0,0,0,0,0,0,0,0,0
,"오늘, 우리는 굴단의 가장 강력한 동맹 중 하나를 쓰러뜨렸습니다.",84662,0,0,396,68,0,0,0,0,0,0,0,0,0,0
,"지도자가 없으니, 살게레이는 무너질 것입니다. 아키나이도 곧 도시를 수복할 수 있겠지요.",84663,0,0,396,68,0,0,0,0,0,0,0,0,0,0
,"일단은, 기념비적인 승리라고 생각해도 좋겠지요. 고맙습니다, 영웅이여.",84665,0,0,396,68,0,0,0,0,0,0,0,0,0,0
"지금 할 수 있는 건 후퇴하는 것뿐이오. 모두, 나를 따르시오!",,84866,0,0,0,68,0,0,44881,0,0,0,0,0,0,0
초갈!,,84872,0,0,0,70,0,0,44759,0,0,0,0,0,0,0
근위병! 막아라!,,84873,0,0,0,70,0,0,44760,0,0,0,0,0,0,0
문을 막아라! 높은망치는 너희 따위에게 쓰러지지 않는다.,,84874,0,0,0,70,0,0,44761,0,0,0,0,0,0,0
"우릴 가둘 수 있을 줄 알았나, 마르고크? (누구도 우릴 지배하지 못해!)",,84883,0,0,0,70,0,0,47434,0,0,0,0,0,0,0
파괴해라. 이 도시를 잿더미로 만들어! (마법석은 우리 거야! 어둠이 모든 것을 삼킨다!),,84884,0,0,0,70,0,0,47435,0,0,0,0,0,0,0
타나안 밀림 일은 문제가 없다. 성채도 거의 완성됐고.,,85014,0,0,0,68,0,0,45926,0,0,0,0,0,0,0
높은망치의 오우거들을 주시하고 있다. 아직까진... 협조적이더군.,,85015,0,0,0,68,0,0,44514,0,0,0,0,0,0,0
"넌 어떤가, 블랙핸드?",,85016,0,0,0,68,0,0,46505,0,0,0,0,0,0,0
"얼라이언스와 호드 놈들이 용광로에 침범했지만, 별일은 아니다.",,85017,0,0,0,68,0,0,45467,0,0,0,0,0,0,0
또 그런 소릴! 항상 변명만 늘어놓는군.,,85018,0,0,0,68,0,0,46506,0,0,0,0,0,0,0
아즈카! 우두머리를 찾는 건 어찌 됐나?,,85019,0,0,0,68,0,0,46507,0,0,0,0,0,0,0
,대족장님. 고르고렉의 심장만 있으면 됩니다.,85020,0,0,0,68,0,0,0,46350,0,0,0,0,0,0
좋다. 이계 놈들을 처리하는 것도 너에게 맡기마. 혹시... 피에 대한 갈증이 조상들보다 못한 건 아니겠지?,,85021,0,0,0,68,0,0,46508,0,0,0,0,0,0,0
,"제 검술은 조상님들을 압도합니다, 대족장님. 블랙핸드의 뒤처리는 제가 하겠습니다.",85022,0,0,0,68,0,0,0,46351,0,0,0,0,0,0
