ID,Text_lang,SortIndex,Min_level,Max_level,ContentTuningID
766,|cffffd100오늘의 팁:|r 재봉술 전문 기술을 보유한 플레이어는 상인이 판매하는 것보다 훨씬 큰 가방을 만들 수 있습니다. 이러한 가방은 일반적으로 경매장에서 구매가 가능합니다.,217,15,49,0
767,"|cffffd100오늘의 팁:|r 길드 & 커뮤니티 찾기(기본 단축키 ""J"")는 월드 오브 워크래프트에서 공통된 관심사와 목표를 가진 우호적인 플레이어 모임을 찾는 데 보탬이 됩니다.",218,15,250,0
768,"|cffffd100오늘의 팁:|r 모험 안내서(기본 단축키 ""SHIFT 키를 누른 상태로 J"")에서 현재 레벨에 적합한 콘텐츠 추천과 더불어 진행 중인 기간 제한 이벤트 관련 내용을 찾아볼 수 있습니다.",219,20,250,0
772,|cffffd100오늘의 팁:|r 레벨이 오를 때마다 직업 또는 전문화 특성 점수를 얻습니다. 이걸 사용해 전투 능력을 취향껏 조정하거나 강화할 수 있습니다.,223,10,69,0
773,|cffffd100오늘의 팁:|r WoW를 나만의 방식으로 만끽해 보세요. <ESC> 키를 누르고 편집 모드를 선택해 사용자 인터페이스의 여러 요소를 옮기거나 크기를 조정할 수 있습니다.,224,40,250,0
775,|cffffd100오늘의 팁:|r 업적 점수는 전투부대 전체가 공유합니다. 특정 캐릭터로만 획득한 업적 점수도 포함됩니다.,225,10,250,0
776,|cffffd100오늘의 팁:|r 전투부대 은행에 보관된 재료로 물품을 제작할 수 있습니다. 즉 서로 다른 전문 기술을 배운 여러 캐릭터가 손쉽게 협력할 수 있습니다.,226,10,250,0
777,"|cffffd100오늘의 팁:|r 전투부대는 계정에 속한 모든 캐릭터로 구성됩니다. 전투부대는 수집품, 비행 지점, 일부 평판 진행 상황 등 수많은 요소를 공유합니다.",227,10,250,0
778,"|cffffd100오늘의 팁:|r ""전투부대"" 꼬리표가 붙은 아이템은 계정 내 모든 캐릭터와 공유 가능합니다.",228,10,250,0
779,"|cffffd100오늘의 팁:|r ""전투부대 이전 가능"" 화폐는 다른 캐릭터에게 이전이 가능합니다. 화폐 메뉴에서 이전할 화폐를 선택해 보세요.",229,10,250,0
780,|cffffd100오늘의 팁:|r 캐릭터가 사용할 수 없는 아이템을 획득했나요? 전투귀속 아이템이라면 다른 캐릭터에게 이전하거나 착용이 가능한 새로운 직업을 육성해 보세요.,230,10,250,0
781,|cffffd100오늘의 팁:|r 착용이 불가능하지만 형상은 갖고 싶은 착용 시 귀속 아이템이 있나요? 우클릭을 하거나 캐릭터 메뉴로 끌어다 놓아보세요.,231,10,250,0
782,|cffffd100오늘의 팁:|r 현재 플레이 중인 캐릭터가 착용할 수 없는 장비라고 해도 전투부대 수집품으로 삼아 형상을 수집할 수 있습니다.,232,10,250,0
783,|cffffd100오늘의 팁:|r 전투부대로 완료한 퀘스트 대부분은 지도에서 숨김 처리됩니다. 이 기능을 비활성화하고 싶다면 추적 또는 지도 필터 메뉴를 확인하세요.,233,60,250,0
784,|cffffd100오늘의 팁:|r 지상에 있을 때 /탈것감정표현을 입력하면 탈것의 특수 애니메이션을 볼 수 있습니다. 이 명령어를 /매크로에 추가해 간편하게 사용해 보세요!,234,40,250,0
