ID,Name_lang,Description_lang,MapID,BackgroundFileDataID,ButtonFileDataID,ButtonSmallFileDataID,LoreFileDataID,Flags,AreaID,CovenantID
63,죽음의 폐광,"한때는 죽음의 폐광에서 캐낸 금이 스톰윈드 보물 저장실의 3분의 1을 채웠다고들 합니다. 그러나 1차 대전쟁의 혼란 속에서 죽음의 폐광은 버려졌고, 나중에는 저주받은 곳 취급을 받았습니다. 비교적 사람의 손길이 닿지 않은 이 미로에 데피아즈 결사단이 둥지를 틀었습니다. 과거에는 건실한 노동자였으나 이제는 무법자로 변해 버린 데피아즈단은 스톰윈드 전복을 꾀하며 이곳에서 작전을 세우고 있습니다.",36,522336,522352,136332,526404,1,1581,0
64,그림자송곳니 성채,"은빛소나무 숲 남쪽 절벽에 우뚝 솟은 그림자송곳니 성채는 그 역사만큼이나 어두운 그림자를 장작나무 마을에 드리우고 있습니다. 과거 대마법사 아루갈의 늑대인간들이 장악했던 이 폐허는 이제 사악한 세력의 보금자리입니다. 남작 실버레인의 잠들지 못한 영혼이 성채를 떠돌고, 고드프리 경과 길니아스의 옛 귀족들로 이루어진 패거리가 산 자와 죽은 자 모두를 파멸에 몰아넣을 계획을 꾸미고 있습니다.",33,522342,522358,136357,526410,0,0,0
65,파도의 왕좌,"파도의 왕좌는 심연의 구렁 깊숙한 곳에 자리 잡고 있습니다. 위대한 정령 군주인 바다사냥꾼 넵튤론은 오랫동안 이곳에서 물의 영지를 살펴보고 보호해 왔습니다. 이제 그에게 엄청난 시련이 닥쳐왔습니다. 비늘 달린 나가와 사악한 얼굴 없는 자들이 쳐들어와, 넵튤론을 왕좌에서 끌어내리고 그의 영지와 그 안에 담긴 비밀을 빼앗으려 합니다.",643,522346,522362,460875,526413,1,5382,0
66,검은바위 동굴,"소문에 의하면 황혼의 망치단은 지하 미로를 이용해 하이잘 산에서 검은바위 산으로 비밀스럽게 정령을 이동시키며, 그 미로를 뚫은 이는 바로 데스윙이라고 합니다. 이 어둠의 경로에서 중심지 역할을 하는 곳이 바로 검은바위 동굴입니다. 이교도가 들끓는 이곳에서는 황혼의 망치단 이교도가 황혼의 용족으로 탈바꿈하는 등, 가장 극악무도한 실험이 자행됩니다.",645,522334,522350,460859,526402,1,5374,0
67,바위심장부,"바위심장부는 심원의 영지 깊숙한 곳, 대지의 사원 안에 자리 잡고 있습니다. 바로 이 동굴 안에서 황혼의 망치단이 데스윙의 몸에 엘레멘티움을 덧씌워, 그의 찢긴 몸을 힘겹게 봉합했습니다. 몸이 회복되자 데스윙은 아제로스를 향해 날아올랐고, 그 와중에 세계 기둥이 부서지면서 심원의 영지는 불안정해지고 말았습니다.",725,522344,522360,460872,526412,1,5303,0
68,소용돌이 누각,"소용돌이 누각은 정령계인 하늘담 안에 있습니다. 순수한 공기의 소용돌이로 연결되는 단 위에는 금과 동이 씌워진 우아한 건물이 솟아 있습니다. 그러나 아름다운 외관 뒤에는 바람의 군주 알아키르의 무자비한 정령 군대와 네페르세트 톨비르가 버티고 있습니다. 하늘담과 아제로스의 경계가 무너져 있는 한, 울둠은 하늘에서 내려오는 공포에서 벗어날 수 없을 것입니다.",657,522345,522361,460873,526414,1,5583,0
69,톨비르의 잃어버린 도시,톨비르의 잃어버린 도시는 표범을 닮은 네페르세트 톨비르의 요새입니다. 이들은 육체의 저주를 치료받아 부드러운 피부를 돌 같은 가죽으로 되돌리는 대신 데스윙에게 충성을 약속했습니다. 저주가 사라지자 네페르세트는 은인에게 반기를 들었습니다. 그러나 이들은 어둠의 맹약에 의해 여전히 뒤틀려 있으며 공격적입니다.,755,522341,522357,460866,526409,1,0,0
70,시초의 전당,"위대한 티탄이 세운 시초의 전당은 고대 유물, 그리고 그 유물을 지키는 무시무시한 수호자들이 가득한 곳입니다. 또한 이 시설에는 모든 생명을 아제로스가 형성되기 전의 기본적인 요소로 되돌릴 수 있는 엄청난 무기가 있다는 소문도 들려옵니다. 데스윙은 바람의 군주 알아키르에게 이 끔찍한 장치를 손에 넣으라는 명령을 내렸습니다. 현재 이 시설 안의 통신 시스템은 완전히 변질되었지만, 무기 자체에는 아직도 데스윙의 손길이 닿지 않았습니다.",644,522340,522356,460865,526408,0,0,0
71,그림 바톨,"그림 바톨의 수수한 외관에 속아서는 안 됩니다. 이 산중 요새의 황폐한 전당은 황혼의 고원 깊숙이까지 뻗어 있습니다. 한때 와일드해머 드워프의 요새였다가 훗날 오크에게 넘어가 알렉스트라자를 가두는 감옥으로 쓰였던 이 도시는, 이제 황혼의 망치단 이교도의 손아귀에 넘어갔습니다.

혹시라도 이 음울한 요새에 침투하는 용감한 영웅들은 그림 바톨에 도사린 알 수 없는 악을 몰아내기 위해 데스윙의 요원들을 상대해야 할 것입니다.",670,522338,522354,460863,526406,0,0,0
72,황혼의 요새,"황혼의 요새는 고대 신이 아제로스에 미치는 영향력이 점점 강해지고 있음을 잘 보여주는 암울한 상징입니다. 이교도의 총본산인 그 육중한 건물 안에는 다양한 황혼의 망치단 분파와 뒤틀린 그들의 지도자 초갈이 거합니다. 요새 안에서 초갈과 그의 부하들은 아제로스에서 모든 이성, 희망, 생명을 말살하고 고대 신들이 꿈꾸는 종말을 실현할 음모를 꾸미고 있습니다.",671,522339,522355,460863,526407,0,0,0
73,검은날개 강림지,"네파리안이 검은날개 둥지에서 죽음을 맞으면서, 사람들은 네파리안 자신은 물론 새로운 용족을 창조하겠다는 그의 비뚤어진 시도도 완전히 끝났다고 생각했습니다. 그러나 네파리안의 아버지인 데스윙이 그를 되살려 검은날개 강림지로 보냈다는 소문이 들려옵니다. 소름 끼치는 실험이 재개되었습니다. 자연의 법칙을 거스르는 그의 실험은 이전보다도 더 극악무도할지 모릅니다.",669,522335,522351,460860,526403,0,5729,0
74,네 바람의 왕좌,"바람의 군주 알아키르가 거하는 네 바람의 왕좌는 드넓은 하늘담 창공을 부유하고 있습니다. 정령계의 경계가 무너지면서, 알아키르는 내키는 대로 아제로스의 바람을 탈 수 있게 되었습니다. 그는 맹렬한 폭풍을 동원해 울둠의 생명을 말살하고, 티탄이 만든 불가사의한 시초의 전당을 손에 넣으려고 합니다.",754,522343,522359,460874,526411,0,5684,0
75,바라딘 요새,"2차 대전쟁 이후, 외딴 섬 톨 바라드에 있는 황폐한 바라딘 요새는 아제로스에서 가장 위험한 죄수를 가두는 감옥으로 사용되었습니다. 그러나 대격변이 아제로스를 휩쓸자 이 견고한 감옥도 손상을 입고 말았습니다. 이제 호드와 얼라이언스가 섬의 패권을 두고 다투는 가운데, 오랫동안 뇌리에서 잊힌 끔찍한 존재가 곧 자유를 찾을지도 모릅니다.",757,522333,522349,464826,526401,2,0,0
76,줄구룹,"줄구룹은 한때 남부의 드넓은 밀림을 지배했던 구루바시 부족의 수도였습니다. 사술사 진도가 흉포한 로아인 영혼약탈자 학카르를 아제로스로 불러낸 곳도 바로 줄구룹이었습니다. 최근 구루바시와 잔달라 트롤이 통일된 트롤 제국을 세우고자 동맹을 맺으면서, 옛 영광을 되찾으려는 트롤의 시도는 새로운 국면을 맞고 있습니다.",859,522348,522364,136369,526416,0,0,0
77,줄아만,"한때 아마니 부족의 수도였던 줄아만에는 실현되지 않은 복수의 메아리가 맴돌고 있습니다. 온 아마니 트롤이 대장군의 부름에 응하였지만, 줄진은 결국 트롤 제국의 옛 영광을 되찾지 못하였습니다. 그러나 그가 이루지 못한 꿈을 잔달라 부족이 실현할 것입니다. 누군가 막지 않으면, 하나로 뭉친 트롤 부족은 자신들의 땅을 되찾고 피비린내 나는 복수의 잔치를 벌일 것입니다.",568,522347,522363,136367,526415,0,3508,0
78,불의 땅,"불의 땅은 티탄이 라그나로스와 그의 끈질긴 하수인들을 수용하려고 만든 화염의 영역입니다. 데스윙이 아제로스에 모습을 드러낸 이후 라그나로스가 부하들을 이끌고 하이잘 산을 덮쳤지만, 신성한 산을 지키는 용감한 수호자들이 이 침입자들을 몰아냈습니다. 이제 라그나로스는 충성스러운 수하를 불러모아 아제로스의 영웅들에게서 불의 땅을 방어할 준비를 하고 있습니다.",720,522337,522353,529270,526405,0,0,0
184,시간의 끝,"무수하게 갈라진 시간의 길 중에서, 이 길은 데스윙을 막아내지 못했을 때의 황량한 미래를 그리고 있습니다. 노즈도르무는 이 시간의 길에 엄청난 이상 현상이 존재하며, 그것이 과거로의 접근을 막고 있음을 알아냈습니다. 이것이 있는 한 용의 영혼을 손에 넣을 수는 없습니다. 뒤틀린 시간의 환영들 사이에서, 시간의 흐름을 벗어난 한 강력한 존재가 홀로 살고 있습니다.",938,571739,571754,575262,571758,1,0,0
185,영원의 샘,"만 년 전, 나이트 엘프의 수도인 진아즈샤리는 영원의 샘 가장자리에 자리 잡은 찬란하고 웅장한 도시였습니다. 바로 이곳에서 나이트 엘프 명가의 일원들이 뒤틀린 황천으로 통하는 차원문을 열고, 불타는 군단을 맞아들여 아제로스를 불길에 휩싸이게 했습니다. 지금 이들은 나이트 엘프 여왕인 아즈샤라의 명에 따라 차원문에 마력을 쏟아넣으며, 악마 신 살게라스의 무시무시하고 장엄한 등장을 준비하고 있습니다.",939,571741,571756,575266,571760,0,0,0
186,황혼의 시간,"과거에서 용의 영혼을 손에 넣은 아제로스의 영웅들은 이제 데스윙과 벌일 최후의 전투를 준비해야 합니다. 데스윙의 황혼 군단이 노스렌드의 얼어붙은 황무지에 우뚝 솟은 고룡쉼터 사원을 공격하고 있습니다. 아제로스를 구하려면, 스랄이 용의 영혼을 지닌 채 무사히 사원에 도착해야 합니다.",940,571740,571755,575264,571759,0,0,0
187,용의 영혼,"데스윙이 고대의 전쟁 때 만든 용의 영혼은 모든 용군단의 힘이 담긴 유물입니다. 용의 영혼은 과거에 파괴되었지만, 현재 남은 용의 위상들과 스랄이 시간의 동굴을 이용해 이 강력한 유물을 손에 넣었습니다. 이제 이들은 고룡쉼터 사원에 모여, 용의 영혼에 담긴 힘을 이용해 그 창조자인 데스윙에게 맞서려고 발버둥치고 있습니다.",967,571738,571753,575261,571757,0,0,0
226,성난불길 협곡,"성난불길 협곡은 대도시 오그리마 땅속 깊숙이 뻗어 있습니다. 원래는 야만적인 트로그와 비뚤어진 불타는 칼날단 이교도가 들끓는 곳이었지만, 최근 새로운 위협이 고개를 쳐들었습니다. 바로 암흑주술사입니다. 대족장 가로쉬 헬스크림이 최근 주술사들을 불러모아 얼라이언스에 대항하는 무기로 원소를 이용할 것을 명령하긴 했지만, 이 협곡에 들어앉은 주술사들은 보통 주술사들이 아닌 변절자들로 보입니다. 보고에 따르면 이 어두운 그림자들이 사나운 군대를 형성하고 있다고 합니다. 이 군대가 오그리마를 친다면 엄청난 참극이 벌어질지도 모릅니다.",389,608172,608211,136350,608250,0,0,0
227,검은심연 나락,"한때 나이트 엘프의 여신 엘룬을 위한 사원이었던 검은심연 나락은 세계의 분리 때 파괴되어 바닷속에 가라앉았다 여겨졌습니다. 수세기가 흐른 뒤, 황혼의 망치단 이교도들이 사악한 꿈과 속삭임에 이끌려 이 사원을 찾아왔습니다. 무고한 자들을 수없이 희생 제물로 바친 끝에, 이교도들은 고대 신이 아끼는 애완동물 하나를 지키라는 새 임무를 부여받았습니다. 아직은 보살핌이 필요한 이 생명체가 암흑의 힘으로 세상을 짓밟을 수 있을 만큼 자랄 때까지 말입니다.",48,608156,608195,136325,608234,0,0,0
228,검은바위 나락,"까맣게 그을린 검은바위 나락은 검은무쇠 드워프와 그들의 제왕, 다그란 타우릿산의 고향입니다. 전임자들과 마찬가지로 다그란은 수세기 전 이 세상에 소환된 무자비한 불의 군주 라그나로스를 섬깁니다. 혼돈의 정령들이 출몰하자 이에 이끌린 황혼의 망치단이 이 산을 찾아왔습니다. 라그나로스의 하수인들과 황혼의 망치단은 드워프가 추구하는 파괴적인 목표에 더욱 힘을 실어주었고, 이는 머지않아 온 아제로스에 파멸을 불러올지도 모릅니다.",230,608157,608196,136326,608235,0,0,0
229,검은바위 첨탑 하층,"검은바위 산의 불타는 중심부에 자리 잡은 강력한 요새, 검은바위 첨탑은 몇 세기 동안 검은무쇠 부족의 강대함을 상징하는 건물이었습니다. 그러나 검은용 네파리안과 그의 부하들이 첨탑 상층을 점령해, 드워프를 상대로 맹렬한 전쟁을 벌이기 시작했습니다. 용군단은 대족장 렌드 블랙핸드, 그리고 그를 따르는 가짜 호드와 동맹을 맺었고, 이 동맹은 오늘날까지도 첨탑을 지배하며 자신들의 세력을 강화하기 위해 끔찍한 실험을 자행하는 한편, 검은무쇠 부족의 몰락을 재촉하는 음모를 꾸미고 있습니다.",229,608158,608197,136327,608236,0,0,0
230,혈투의 전장 - 수도 정원,"수천 년 전 세워진 엘드탈라스는 칼도레이 비전 마법의 비밀을 간직한 위대한 도시였지만, 이제 폐허가 되어 뒤틀린 마력만이 이곳에 들끓고 있습니다. 한때는 사악한 무리들이 혈투의 전장에 넘치는 뒤틀린 마력을 손에 넣고자 서로 싸웠습니다. 그러나 이들은 결국엔 불안한 동맹을 맺고, 혈투의 전장 전체를 차지하려고 계속 싸우기보다는 자기 영토 안의 마력을 마음대로 사용하는 데 만족하기로 했습니다.",429,608161,608200,136333,608239,1,0,0
231,놈리건,"던 모로 산속 깊숙이 지어진 경이로운 도시, 놈리건은 노움의 지성과 발전된 공업 기술을 잘 보여주는 곳이었습니다. 그러나 트로그 무리가 놈리건에 쳐들어왔을 때, 조언자였던 시코 텔마플러그는 땜장이왕을 배반했습니다. 그 결과 놈리건은 방사능에 노출되었고, 대부분의 시민이 죽음을 맞았습니다. 살아남은 노움들은 언젠가 돌아와 고향을 되찾으리라 다짐하며 달아날 수밖에 없었습니다.",90,608163,608202,136336,608241,0,0,0
232,마라우돈,전설에 따르면 세나리우스의 아들인 재타르와 대지의 정령 공주 테라드리스의 결합에서 야만적인 켄타우로스 종족이 탄생했습니다. 무자비한 켄타우로스는 태어난 지 얼마 되지 않아 아버지를 살해했습니다. 비통에 잠긴 테라드리스는 사랑하는 이의 영혼을 마라우돈 안에 구속하여 이 지역을 더럽히고 있다고 합니다. 이제 포악한 켄타우로스 유령과 뒤틀린 정령들이 이 복잡한 동굴의 구석구석을 배회합니다.,349,608170,608209,136345,608248,0,0,0
233,가시덩굴 구릉,"전설에 따르면, 반신 아감마간이 쓰러진 자리에 그가 흘린 피로 인해 거대한 가시덩굴이 자라났다고 합니다. 최근 정찰대가 그 지역 주위를 맴도는 언데드 무리를 목격했는데, 무시무시한 스컬지가 칼림도어를 정복하기 위해 움직이고 있는 것인지도 모릅니다.",129,608173,608212,136352,608251,0,0,0
234,가시덩굴 우리,"전설에 따르면, 반신 아감마간이 쓰러진 자리에 그가 흘린 피로 인해 거대한 가시덩굴이 자라났다고 합니다. 아감마간이 안식에 들어간 곳으로 추앙받는 거대한 가시덩굴에는 수많은 가시멧돼지들이 정착해서 거주하고 있습니다.",47,608174,608213,136353,608252,0,0,0
236,스트라솔름 - 정문,"한때는 로데론 북부에서 보석처럼 빛나던 스트라솔름은 이제 이 도시를 폐허로 바꾼 끔찍한 사건으로만 기억되고 있습니다. 바로 이곳에서 아서스 왕자는 고귀한 성기사인 빛의 수호자 우서 경에게 등을 돌렸고, 무수한 시민을 끔찍한 언데드 역병에 걸렸다며 학살했습니다. 이 사건 이래, 저주받은 스트라솔름에는 죽음, 배신, 절망만이 들끓고 있습니다.",329,608177,608216,136359,608255,1,0,0
237,아탈학카르 신전,"수천 년 전, 구루바시 제국은 강력한 트롤 사제 세력에 의해 내전을 겪었습니다. 아탈라이라 알려진 이 세력은 자신들이 섬기는 혈신, 영혼약탈자 학카르의 화신을 아제로스에 소환하려고 했습니다. 구루바시 부족은 아탈라이를 슬픔의 늪으로 추방했고, 그들은 이곳에 아탈학카르 신전을 지었습니다. 녹색용군단의 위상 이세라는 이 사실을 알고 사원을 늪 아래로 가라앉혀 버렸고, 감독관들을 보내 소환 의식이 다시는 치러지지 못하게 감시하도록 했습니다.",109,608178,608217,136360,608256,0,0,0
238,스톰윈드 지하감옥,"스톰윈드 운하 지구의 지하에 자리 잡은 스톰윈드 지하감옥은 철통같이 감시되는 수감 시설입니다. 교도소장 델워터가 이 감옥, 그리고 이곳을 집이라 부르는 위험한 범죄자들을 관리합니다. 그러나 최근 수감자들이 반란을 일으켜 간수들을 내몰고 이 감옥을 엄청난 혼란 속에 몰아넣고 있습니다.",34,608184,608223,136358,608262,0,0,0
239,울다만,"울다만은 땅속 깊이 묻혀 있는 고대 티탄 금고입니다. 티탄은 실패한 실험체들을 이곳에 봉인한 후, 드워프의 기원과 관련된 모종의 새 프로젝트를 진행하기 시작했다고 합니다. 위대한 지식이 담긴 전설의 보물이 이곳에 숨겨져 있다는 이야기 때문에, 부를 쫓는 숱한 모험가들이 울다만의 비밀을 파헤치려고 시도해 왔습니다. 하지만 이 잊힌 도시에 도사린 바위 수호병과 야만적인 트로그, 검은무쇠 드워프 침입자를 비롯한 수많은 무시무시한 존재가 이 모험을 험난하게 하고 있습니다.",70,608186,608225,136363,608264,0,0,0
240,통곡의 동굴,"수년 전, 저명한 드루이드 나랄렉스와 그를 따르는 이들이 어두운 동굴로 내려갔습니다. 안쪽의 갈라진 틈새에서 증기가 뿜어져 나오는 소리가 구슬픈 통곡 같다 해서 ""통곡의 동굴""이라 불리는 곳이었습니다. 나랄렉스는 지하의 물줄기를 이용해 불모의 땅을 다시 푸르게 만들 생각이었습니다. 그러나 나랄렉스가 품은 재생의 꿈은 그가 에메랄드의 꿈에 들어가는 순간 걸어다니는 악몽으로 변하여, 지금까지도 이 동굴을 더럽히고 있습니다.",43,608190,608229,136364,608313,0,0,0
241,줄파락,"한때 줄파락은 타나리스의 빛나는 보석이었고, 교활한 성난모래 부족이 이 도시를 굳세게 지켰습니다. 그러나 트롤의 끈기만으로는 역부족이었고, 이 고립된 부족은 결국 역사를 통틀어 많은 영토를 잃었습니다. 이제 줄파락의 주민들은 언데드 트롤로 이루어진 무시무시한 군대를 꾸려, 주변 지역을 정복하려 합니다. 또 다른 충격적인 소문에 따르면 고대 생명체가 이 도시 안에서 잠자고 있다고 합니다. 만약 깨어나면 타나리스 전역에 죽음과 파괴를 불러올 무시무시한 생명체가 말입니다.",209,608191,608230,136368,608267,1,0,0
246,스칼로맨스,"언데드의 힘을 부리고자 하는 자라면 누구나 스칼로맨스에 대해 잘 압니다. 이 악명 높은 강령술 학교는 카엘 다로우 아래의 어둡고 불길한 지하묘지에 자리 잡고 있습니다. 최근 강사가 몇 명 바뀌었지만, 음험하고 가학적인 성격을 지닌 강령술 마법의 대가, 암흑스승 간들링이 여전히 이 학교를 관리하고 있습니다.",1007,608176,608215,136355,608254,1,0,0
247,아키나이 납골당,"드레노어의 옛 망명자들은 죽음이란 삶의 불행하고 불편한 결과라고 믿었기에, 죽은 이들의 시신을 테로카르 숲 깊은 곳에 위치한 경이로운 미로이자 무덤 도시인 아킨둔에 숨겼습니다.",558,608154,608193,136323,608232,0,0,0
248,지옥불 성루,"저주받은 아웃랜드의 지옥불 반도 한가운데에는 누구에게도 쉽게 함락당하지 않을 듯한 위용을 뽐내는 지옥불 성채가 서 있습니다. 이 성채는 1, 2차 대전쟁 동안 호드 진영의 작전 기지 역할을 했습니다.",543,608168,608207,136338,608246,0,0,0
249,마법학자의 정원,"폭풍우 요새에서 패배한 이후, 캘타스 선스트라이더는 무자비한 불타는 군단과 손잡았음을 공공연하게 밝혔습니다. 악마 군주 킬제덴을 소환하기로 작정한 캘타스는 주인을 맞을 마지막 준비를 하러 쿠엘다나스 섬으로 돌아갔습니다.",585,608169,608208,136344,608247,1,0,0
250,마나 무덤,"드레노어의 옛 망명자들은 죽음이란 삶의 불행하고 불편한 결과라고 믿었기에, 죽은 이들의 시신을 테로카르 숲 깊은 곳에 위치한 경이로운 미로이자 무덤 도시인 아킨둔에 숨겼습니다.",557,608154,608193,136323,608232,1,0,0
251,옛 언덕마루 구릉지,"시간의 동굴 안 깊은 곳에서 생각에 잠긴 용 노즈도르무가 깨어났습니다. 시간의 미묘한 균형을 유지하는 것을 소명으로 여기는 청동용군단은 변화하는 시간의 길, 그 구불구불한 미로를 세계가 요람기에 있을 때부터 감시하고 보호해 왔습니다.",560,608159,608198,136330,608237,0,0,0
252,세데크 전당,"드레노어의 옛 망명자들은 죽음이란 삶의 불행하고 불편한 결과라고 믿었기에, 죽은 이들의 시신을 테로카르 숲 깊은 곳에 위치한 경이로운 미로이자 무덤 도시인 아킨둔에 숨겼습니다.",556,608154,608193,136323,608232,0,0,0
253,어둠의 미궁,"드레노어의 옛 망명자들은 죽음이란 삶의 불행하고 불편한 결과라고 믿었기에, 죽은 이들의 시신을 테로카르 숲 깊은 곳에 위치한 경이로운 미로이자 무덤 도시인 아킨둔에 숨겼습니다.",555,608154,608193,136323,608232,0,0,0
254,알카트라즈,"웅장한 폭풍우 요새는 불타는 군단의 숙적이자 순수한 마력의 결정체, 불가사의한 지적 존재인 나루의 작품입니다. 이 구조물은 나루의 작전 기지일 뿐 아니라, 차원 사이를 오가는 기능을 지녀 눈 깜짝할 사이에 원하는 장소로 이동할 수 있게 해 줍니다.",552,608179,608218,136362,608257,0,0,0
255,검은늪,"시간의 동굴 안 깊은 곳에서 생각에 잠긴 용 노즈도르무가 깨어났습니다. 시간의 미묘한 균형을 유지하는 것을 소명으로 여기는 청동용군단은 변화하는 시간의 길, 그 구불구불한 미로를 세계가 요람기에 있을 때부터 감시하고 보호해 왔습니다.",269,608159,608198,136330,608237,0,0,0
256,피의 용광로,"저주받은 아웃랜드의 지옥불 반도 한가운데에는 누구에게도 쉽게 함락당하지 않을 듯한 위용을 뽐내는 지옥불 성채가 서 있습니다. 이 성채는 1, 2차 대전쟁 동안 호드 진영의 작전 기지 역할을 했습니다.",542,608168,608207,136338,608246,1,0,0
257,신록의 정원,"웅장한 폭풍우 요새는 불타는 군단의 숙적이자 순수한 마력의 결정체, 불가사의한 지적 존재인 나루의 작품입니다. 이 구조물은 나루의 작전 기지일 뿐 아니라, 차원 사이를 오가는 기능을 지녀 눈 깜짝할 사이에 원하는 장소로 이동할 수 있게 해 줍니다.",553,608179,608218,136362,608257,1,0,0
258,메카나르,"웅장한 폭풍우 요새는 불타는 군단의 숙적이자 순수한 마력의 결정체, 불가사의한 지적 존재인 나루의 작품입니다. 이 구조물은 나루의 작전 기지일 뿐 아니라, 차원 사이를 오가는 기능을 지녀 눈 깜짝할 사이에 원하는 장소로 이동할 수 있게 해 줍니다.",554,608179,608218,136362,608257,0,0,0
259,으스러진 손의 전당,"저주받은 아웃랜드의 지옥불 반도 한가운데에는 누구에게도 쉽게 함락당하지 않을 듯한 위용을 뽐내는 지옥불 성채가 서 있습니다. 이 성채는 1, 2차 대전쟁 동안 호드 진영의 작전 기지 역할을 했습니다.",540,608168,608207,136338,608246,1,0,0
260,강제 노역소,"장가르 습지대의 깊은 물 아래, 나가가 지배하는 시설이 숨어 있습니다. 거대한 파이프와 피스톤이 얽히고설킨 이 시설의 이름은 갈퀴송곳니 저수지로서, 나가 군대를 수용하기 충분할 만큼 큽니다. 그러나... 이 저수지가 단지 군사 목적으로만 쓰이는 것은 아닙니다.",547,608160,608199,136331,608238,0,0,0
