ID,Name_lang,Description_lang,MapID,BackgroundFileDataID,ButtonFileDataID,ButtonSmallFileDataID,LoreFileDataID,Flags,AreaID,CovenantID
727,영혼의 아귀,"위대한 브리쿨 전사들이 용맹의 전당에서 영원한 영광을 추구할 때, 저주받은 브리쿨들은 영혼의 아귀의 해안에 당도한 자신의 모습을 발견하게 됩니다. 그들은 자욱한 안갯속에서 힘줄과 뼈로 만들어진 무시무시한 배, 나글파르를 기다리며, 비참한 영혼 신세로 나글파르에 올라탄 채, 헬하임에 있는 헬리아의 품 안으로 향합니다.",1492,1411844,1411856,1411868,1411850,0,0,0
740,검은 떼까마귀 요새,"고대 엘프 석공들이 발샤라의 가장 거대한 산을 깎아 만든 검은 떼까마귀 요새는 고대의 전쟁 동안 불타는 군단의 공격을 막아낸 굳건한 보루입니다. 난공불락에 가까운 그 요새는 한때나마 일리단의 스승이었던 군주 쿠르탈로스 레이븐크레스트와 그 선조들이 살았던 장소이기도 합니다. 하지만 최근 군단의 침공 이후로, 요새에선 불길한 어둠의 마력이 흘러나오고 있으며 죽은 자들이 부활해 주변을 활보하고 있습니다.",1501,1411841,1411853,1411865,1411847,1,0,0
741,화산 심장부,,409,1396460,1396586,136346,1396505,0,0,0
742,검은날개 둥지,,469,1396454,1396580,136329,1396499,0,0,0
743,안퀴라즈 폐허,,509,1396465,1396591,136320,1396510,0,0,0
744,안퀴라즈 사원,,531,1396467,1396593,136321,1396512,0,0,0
745,카라잔,,532,1396458,1396584,136343,1396503,0,0,0
746,그룰의 둥지,,565,1396456,1396582,136337,1396501,0,0,0
747,마그테리돈의 둥지,,544,1396459,1396585,136340,1396504,0,0,0
748,불뱀 제단,,548,608160,608199,136356,608238,0,0,0
749,폭풍우 눈,,550,608179,608218,136362,608257,0,0,0
750,하이잘 산 전투,,534,608159,608198,136330,608237,0,0,0
751,검은 사원,,564,1396453,1396579,136328,1396498,0,0,0
752,태양샘 고원,,580,1396466,1396592,136361,1396511,0,0,0
753,아카본 석실,,624,1396470,1396596,303841,1396515,0,0,0
754,낙스라마스,,533,1396461,1396587,136347,1396506,0,0,0
755,흑요석 성소,,615,1396462,1396588,237594,1396507,0,0,0
756,영원의 눈,,616,1396455,1396581,237600,1396500,0,0,0
757,십자군의 시험장,,649,1396468,1396594,311221,1396513,0,0,0
758,얼음왕관 성채,,631,1396457,1396583,336390,1396502,0,0,0
759,울두아르,,603,1396469,1396595,304502,1396514,0,0,0
760,오닉시아의 둥지,,249,1396463,1396589,329121,1396508,0,0,0
761,루비 성소,,724,1396464,1396590,366689,1396509,0,0,0
762,어둠심장 숲,"샬라드라실의 그림자 아래에서 악몽이 퍼져나가며 한때 무성했던 숲을 점점 잠식하고 있습니다. 한때 가장 나이가 많고 위대한 드루이드들이 위대한 세계수 아래에서 명상하며 정성껏 돌보았던 숲은, 이제 타락과 광기로 물들어가고 있습니다. 복잡하게 얽힌 덤불 깊숙한 곳에 자리 잡은 악몽의 군주 자비우스는 그의 숙적 말퓨리온의 의지를 꺾으려고 온 힘을 다하고 있습니다.",1466,1411843,1411855,1411867,1411849,1,0,0
767,넬타리온의 둥지,"훗날 데스윙으로 알려진 대지수호자 넬타리온은 한때 이 동굴을 자신의 보금자리로 여겼습니다. 넬타리온이 죽자, 그를 숭배하던 드로그바가 이 고대의 둥지에 도시를 세웠습니다. 지금은 드로그바의 족장인 다르그룰이 도시의 깊은 곳에서 막강한 군대를 조직하고 있습니다. 이대로 내버려두면 다르그룰의 군대는 카즈고로스의 망치로 군사력을 증강해, 산비탈을 가로질러 높은산을 파괴할 뿐만 아니라 전 아제로스의 안전까지 위협할 것입니다.",1458,1450570,1450574,1450576,1450572,1,0,0
768,에메랄드의 악몽,"에메랄드의 꿈은 티탄이 아제로스 자체의 청사진으로 만들어 낸 영역입니다. 문명에 오염되지 않은 자연 그대로의 모습이 남아 있는, 아제로스를 거울에 비춘 반영입니다. 자연과 가장 긴밀한 관계를 맺은 드루이드와 수호자는 지난 여러 해에 걸쳐 에메랄드의 꿈 안에서 꿈틀대는 불안한 기운을 인지해 왔습니다. 마침내 군단과 악몽의 군주 자비우스의 영향을 받아, 그간 에메랄드의 꿈을 서서히 잠식하던 타락이 폭발적인 속도로 퍼지기 시작했습니다. 이 타락의 원천을 뿌리 뽑지 않으면, 머지않아 아제로스 전역이 휩쓸리고 말 것입니다.",1520,1452686,1452687,1452699,1452688,0,0,0
777,보랏빛 요새 침공,"노스렌드에서의 대장정과 푸른용군단이 달라란의 감옥을 공격했던 사건 이후, 보랏빛 요새가 복구되고 요새 안의 감옥에는 리치 왕의 가장 위험한 하수인 일부가 투옥되었습니다. 달라란이 부서진 섬 상공에서 군단에 맞설 전쟁의 기함 역할을 하는 지금, 보이지 않는 위협이 또다시 키린 토 내부에서 공격을 준비하고 있습니다.",1544,1498147,1498155,1498159,1498151,0,0,0
786,밤의 요새,"부서진 섬뿐 아니라 아제로스 전체에서도 가장 거대한 구조물인 밤의 요새는 위대한 나이트본 문명의 상징과도 같습니다. 수백 년 간 수라마르를 지탱해 온 비전 마력의 원천인 밤샘을 둘러싸고 있는 이 요새는, 세계의 어떤 위협에도 굴하지 않는 안식처가 되었습니다. 하지만 만 반대쪽에 있는 옛 엘룬의 사원 상공에서 지옥폭풍이 휘몰아치고, 굴단이 성 내부로 들어선 지금, 밤의 요새는 지금껏 한 번도 마주한 적 없는 거대한 위협을 맞닥뜨리고 있습니다.",1530,1450571,1450575,1450577,1450573,0,0,0
800,별의 궁정,"군단 병력이 거대한 수라마르 전역에 어둠의 그림자를 드리우며 전통의 거리를 정찰하는 순간에도, 나이트본 귀족들은 여전히 일상과 관습을 고수하며 사교 활동에 열을 올리고 있습니다. 맑게 갠 오늘 밤, 귀족 지구의 가장 웅장한 저택에서 화려한 축제가 열립니다. 저택의 문은 활짝 개방되고, 축제를 즐기는 주민들의 함성이 차가운 밤하늘에 울려 퍼집니다. 대마법학자 엘리산드가 최근의 불안한 정세에도 오늘은 불안해하는 측근들을 안심시키고자 축제에 얼굴을 비춘다고 합니다.",1571,1498148,1498156,1498160,1498152,1,0,0
822,부서진 섬,"이 지역은 과거 엘프 문명의 발상지이자, 세계의 분리 전까진 고대 엘프의 수도였던 수라마르를 중심으로 형성된 지역입니다. 세계의 분리가 일어나고, 밤샘의 힘에 보호된 수라마르 성은 살아남았지만, 인근 지역은 처참한 피해를 고스란히 입고 말았습니다. 이제 굴단이 살게라스의 무덤을 깨우자, 높은산 봉우리의 타우렌 마을과 발샤라의 드루이드 숲, 스톰하임에 흩어져 있는 브리쿨 마을을 포함한 부서진 섬 전역에 군단의 어두운 그림자가 드리우고 말았습니다.",1520,1411842,1411854,1411866,1411848,2,0,0
860,다시 찾은 카라잔,"이 수수께끼의 검은 탑은 처음 생겨난 이후로, 한때 군단에 저항하는 아제로스 최강의 보루였던 티리스팔의 수호자의 역사와 늘 함께했습니다. 하지만 이제는 아제로스를 비극적으로 배신한 끝에, 깨지지 않고 이어져 왔던 수호자의 역사에 최후를 안긴 메디브의 거처로 더 알려져 있을 뿐입니다. 이와 같은 유산을 간직하고 있기 때문에, 아제로스에 대한 새로운 전면전을 개시한 군단 역시 카라잔에 많은 관심을 보이고 있습니다.",1651,1537279,1537283,1537287,1537281,0,0,0
861,용맹의 시험,"로켄이 배신한 이후로 오딘은 용맹의 전당에 갇혀야 했고, 그 사이 헬리아는 어둠 속에서 그의 발라리아르 용사들의 영혼을 차지하려는 음모를 꾸몄습니다. 하지만 최근 군단의 도래와 함께 뛰어난 용사들이 스톰하임을 찾아왔습니다. 그들의 힘과 결의가 전황을 바꾸고 헬리아의 지배를 종식시키기를 희망하며, 오딘은 이 용사들을 불러 최후의 시험을 치르려 합니다.",1648,1537280,1537284,1537288,1537282,0,0,0
875,살게라스의 무덤,"에이그윈은 이 신성한 엘룬의 사원에 패배한 살게라스의 화신을 가둬 두었습니다. 에이그윈은 화신이 땅 속 깊은 곳에 묻혀 잠든 채로 남아 있기를 기대했지만, 그 강력한 힘에 이끌린 사악한 존재들이 계속해서 이 장소를 찾아왔습니다. 굴단이 이 무덤에 다시 들어갔을 때, 그는 에이그윈의 수호물을 모두 파괴하고 군단이 침공해올 수 있는 길을 열었습니다. 이제 지옥의 병력이 이 석실을 파고들어 주인의 힘을 되찾으려 합니다.",1676,1616104,1616106,1616207,1616105,0,0,0
900,영원한 밤의 대성당,"살게라스의 무덤 상층은 한때 엘룬을 섬기는 장소였습니다. 하지만 군단이 침공해 온 이후, 지옥의 하수인들이 이 신성한 장소를 더럽혀 자신들과 같은 모습으로 뒤틀어 놓았습니다. 이제 이곳에서 침공의 흐름을 돌려 놓을 수 있는 전투가 시작됩니다. 군단척결군이 지옥의 병력을 직접 상대하는 사이, 무리를 지은 영웅들이 성당 상층으로 침투하여 아그라마르의 아이기스를 안식처에 돌려 놓으려고 결전을 펼칩니다.",1677,1616892,1616922,1616925,1616920,0,0,0
945,삼두정의 권좌,"에레다르가 살게라스와의 불경한 계약을 맺기 전에는 빛나는 삼두정의 권좌가 아르거스를 다스렸습니다. 계약을 거부하고 떠난 벨렌에게 격분한 킬제덴은 권좌를 의미 없는 과거의 상징이라 선언하며 권좌를 버렸습니다... 이제는 군단이 그들의 미래가 되었으니 말입니다.

한때 빛나던 권좌의 전당은 암흑 속에 빠져 어둠의 마력을 내뿜고 있으며, 공허의 힘을 사용해 적을 없애 버리려는 자들은 어둠에 이끌려 그 앞에 몰려들었습니다.",1753,1718202,1718213,1718526,1718205,0,0,0
946,안토러스 - 불타는 왕좌,"아르거스의 핵에는 안토러스 - 불타는 왕좌가 자리 잡고 있습니다. 이 힘의 권좌에서 살게라스는 전 우주를 약탈하는 불타는 성전을 주도합니다.

침입이 거의 불가능하다고 알려진 이 왕좌의 심연에서는 태고의 힘이 벼려져 궁극의 학살 무기가 탄생합니다. 이곳의 병력이 그 주인을 섬기기 위해 일어서면, 모든 피조물의 최후가 가까워집니다.",1712,1718200,1718211,1718524,1718203,0,0,0
959,침공 거점,"아르거스의 요새로부터, 군단은 광범위한 차원문 망을 활용하여 역병처럼 온 우주로 번져 나갑니다. 헤아릴 수 없이 많은 세계가 자원을 빼앗겼고, 그곳의 거주민들은 암흑 티탄을 섬기거나 느리고 고통스러운 죽음을 맞이해야 했습니다.

이들 세계를 해방하지 못하면, 불타는 성전이 모든 것을 집어삼키고 전 우주를 잿더미로 만들 것입니다.",1520,1718201,1718212,1718525,1718204,2,0,0
968,아탈다자르,"수천 년 동안, 잔달라 왕들은 무감바 산 정상에 고립된 아탈다자르 무덤에 잠들어 있었습니다. 지도자가 죽을 때마다 그 막대한 부를 수용할 새로운 방을 만들었기 때문에, 이 피라미드들은 시간이 흐르면서 점점 더 화려해졌습니다. 하지만 한때 찬란했던 이 전당은 이제 고대 왕의 힘을 뒤틀어 자신의 추악한 계략에 사용하려는 예언자 줄과 그의 충성스러운 부관 야즈마의 손에 모두 더럽혀지고 말았습니다.",1763,1778888,1778892,1778896,1778890,1,0,0
1001,자유지대,"자유지대는 본래 해적과 악당, 그리고 쿨 티라스의 지배를 벗어나 자유로이 살고 싶은 이들의 안식처로 통했습니다. 그러나 자유지대를 점령한 무쇠파도 약탈단은 이제 이 도시를 무자비하게 지배하며 여러 해적단을 세력에 편입시키고 있습니다. 해적들이 집결하는 동안 일부 영웅들이 이 마을에 침투하여 지도부를 제거하고 점점 커져가는 범죄자 집단을 소탕하려 합니다.",1754,1778889,1778893,1778897,1778891,1,0,0
1002,톨 다고르,한때 잘 관리되던 톨 다고르 감옥을 애쉬베인 무역회사에서 사들여 운영하고 있습니다. 이제 이곳은 애쉬베인 무역회사에 저항하는 이들을 영원히 가두어 두는 함정으로 전락했습니다.,1771,2177519,2178276,2178737,2177730,0,0,0
1012,왕노다지 광산!!,"살게라스가 아제로스를 공격한 여파로, 카자로 섬의 분출과 함께 산산이 조각났던 케잔 섬에서 놀라운 양의 아제라이트가 노출되기 시작했습니다. 모굴 라즈덩크는 둘도 없는 기회에 막대한 재산을 축적하는 동시에 무역왕의 칭호를 차지하려 투자개발회사의 모든 자산을 동원해 아제라이트를 무기화하고 최고의 입찰가에 판매하는 일에 집중하고 있습니다.",1594,2177517,2178274,2178735,2177728,0,0,0
1021,웨이크레스트 저택,"한때 드러스트바를 지배하는 가문의 화려한 영지였던 웨이크레스트 저택은 웨이크레스트 부부가 알 수 없는 이유로 은둔 생활을 시작하면서 온갖 음울한 소문의 진원지가 되었습니다. 부정한 의식이 치러진다거나, 밤이면 사람들이 사라진다거나, 이 저택에서 끔찍한 비명 소리가 들린다거나 하는 이야기가 이 지역 주민들 사이에서 빈번하게 회자됩니다. 온갖 소문 중에서 분명한 건 단 하나, 무언가 사악한 존재가 웨이크레스트 가문의 영지에 뿌리를 내렸다는 것입니다.",1862,2177521,2178278,2178742,2177732,1,0,0
1022,썩은굴,"나즈미르의 늪지 깊은 곳에서는 감춰진 역병이 자라나고 있습니다. 이 타락을 어서 정화하지 못하면, 이 게걸스러운 역병이 사방의 대지로 번져 끔찍하게 곪은 세계만 남게 될 것입니다.",1841,2177518,2178275,2178736,2177729,0,0,0
1023,보랄러스 공성전,"여군주 애쉬베인은 대도시의 붕괴되어 가는 방어 병력을 상대로 분노를 방출합니다. 보랄러스가 불타오르는 사이, 소수의 영웅들이 들끓는 혼돈을 가라앉히고 이 지역을 지배하려는 애쉬베인의 계획을 막아내야 합니다.",1822,2177515,2178272,2178733,2177726,0,0,0
1028,아제로스,"아제로스의 평화를 위협한 최악의 존재들은 대부분 고대의 석실에 갇혀 있거나 솟아오른 요새의 정상에 자리잡고 있지만, 탁 트인 하늘 아래 아무렇지도 않게 세상을 활보하는 경우도 있습니다. 현명한 이들은 자기 보호 본능에 이끌려 이런 공포를 피할 피난처를 찾지만, 가장 막강한 적수에 맞서 자신의 힘을 시험하려 하는 용맹한 영웅들에게는 놀라운 영광이 기다리고 있습니다.",1861,2177522,2178279,2178743,2177733,2,0,0
1030,세스랄리스 사원,"수백 년 전, 미스락스가 자신의 지배자를 아제로스에 소환하려 할 때, 강력한 뱀의 로아 세스랄리스는 자신을 희생하여 이 끔찍한 사태를 막아냈습니다. 전투가 끝나고, 세스랄리스의 충직한 추종자들은 유해를 옮긴 후 그 주위에 사원을 건설하고 그녀의 부활을 기다렸습니다. 이제 어둠의 세력이 이 신성한 사원 안에서 꿈틀거리며, 로아의 힘을 뒤틀어 사악한 목적에 사용하려 하고 있습니다.",1877,2177516,2178273,2178734,2177727,1,0,0
1031,울디르,"수천 년 전, 티탄들은 영원한 적수의 본질을 이해하기 위해 이 무질서한 지하 시설을 제작하고 포획한 표본을 가뒀습니다. 고대 신에 결속된 공허 마력을 연구하여 그 약점과 반응을 자세히 파악해 보면, 무력화시킬 방법도 찾아낼 수 있을 거라고 생각했던 것입니다. 하지만 이건 끔찍할 정도로 잘못된 생각이었습니다. 결국 이 시설은 내부에 도사린 공포가 아제로스로 풀려나가지 못하도록 완전히 봉인되고 말았습니다. 하지만 그런 봉인이 깨어지고 말았습니다...",1861,2177520,2178277,2178738,2177731,0,0,0
1036,폭풍의 사원,"폭풍의 사원은 스톰송 가문과 파도현자 모두의 권좌입니다. 이곳에서는 쿨 티란 함대에 축복을 내려 무적의 함대를 구축합니다. 하지만 어둠의 세력이 이 신성한 땅을 더럽히고, 영원히 쿨 티란 함대를 장악하려고 위협하고 있습니다.",1864,2177514,2178271,2178732,2177725,1,0,0
1041,왕들의 안식처,"잔달라에서 왕들의 안식처보다 더 신성한 곳은 거의 없습니다. 잔달라 제국을 지배했던 모든 왕과 정복자, 폭군이 이 거대한 망자의 도시에 안치되었고, 후손들은 이들의 육체뿐 아니라 영혼까지도 보호하며 기리고 있습니다.

역사적으로 이 도시에 들어갈 수 있는 이들은 잔달라 사제와 귀족으로 제한되어 있지만, 줄의 암흑 마법이 이 무덤으로 스며들기 시작하면서, 이 신성한 땅을 뒤덮은 어둠의 힘을 종결시키는 일이 용사들의 몫이 되었습니다.",1762,2177512,2178269,2178730,2177723,1,0,0
1176,다자알로 전투,"헤아릴 수 없는 세월 동안, 다자알로는 위대하고 강력한 잔달라 제국의 중심지로서 우뚝 서 있었습니다. 이곳을 지키는 수호자들은 감히 왕 라스타칸의 목숨을 노린 수많은 찬탈자를 좌절시켰으며, 고대부터 현재까지 시련을 견뎌왔습니다. 그러나 전쟁의 화마가 줄다자르의 해안까지 번지면서 얼라이언스는 황금 피라미드를 공격하여 잔달라와 호드의 유대를 끊는 대담한 도박수를 던지려고 하고 있습니다.",2070,2482731,2482729,2482693,2482732,0,0,0
1177,폭풍의 용광로,"폭풍의 사원 아래에는 오랫동안 물속에 잠들어 있던 악이 똬리를 틀고 있습니다. 심연에서는 군주 스톰송을 광기의 구렁텅이로 몰아넣었던 속삭임이 메아리칩니다. 그 메아리는 흡사 무시무시한 힘을 울부짖는 세이렌의 노래 같기도 합니다. 이 소리에 귀를 기울이고 복종하는 자들은 주인의 의지를 집행할 어둠의 의식을 준비하고 있습니다. 이들이 무슨 악몽과도 같은 계획을 광적인 헌신의 원동력으로 삼는지는 아무도 모릅니다. 그러나 단 하나 확실한 것이 있다면, 그들을 반드시 막아야 한다는 것입니다.",2096,2498192,2498193,2498195,2498194,0,0,0
1178,작전명: 메카곤,"왕자 에라즈민이 뜻밖의 동맹을 이끌고 필사적으로 메카곤의 심장부에 진입하려고 합니다. 분초를 다투는 상황에서 이들은 종말의 기계가 아제로스의 모든 유기 생명체를 멸종시키기 전에, 왕 메카곤의 기계화 괴물 군대를 무찌르고 광기에 사로잡힌 천재를 타도해야 합니다.",2097,3025319,3025325,3025336,3025327,0,0,0
1179,영원한 궁전,"바야흐로 일만 년 전, 바다가 진아즈샤리를 집어삼킬 당시 여왕 아즈샤라는 느조스와 어둠의 거래를 맺고 자신의 충직한 백성을 사악한 나가로 변모시켰습니다. 이후 아즈샤라는 장장 수천 년에 걸친 무자비한 정복 사업 끝에 과거의 폐허에서 새로운 제국을 세웠으며, 한때 자신을 위협하던 심해의 주인으로 군림하고 있습니다. 그녀는 자애로운 군주로서 얼라이언스와 호드 양쪽을 영원한 궁전에 초대하였습니다. 본인의 영광스러운 승천을 목도하고... 궁극적인 최후를 맞이할 기회를 주려는 의도에서 말입니다.",2164,3025318,3025320,3025335,3025326,0,0,0
1180,깨어난 도시 나이알로사,"잠자는 도시 나이알로사가 깨어났습니다. 느조스의 통솔 아래 검은 제국의 군대는 세상을 집어삼키고 이를 주인의 환영에 맞추어 다시 빚어낼 기회를 호시탐탐 노리고 있습니다. 남은 희망은 단 하나, 바로 수리된 티탄 용광로를 사용해 타락자를 완전히 축출하는 것입니다. 그러나 느조스에게 용광로의 힘을 보여주려면 아제로스의 용사들이 공포의 영역 심층부로 들어가 고대 신과 최후의 결전을 벌여야 합니다.",2217,3221462,3221463,3221466,3221464,0,0,0
1182,죽음의 상흔,"어둠땅의 수호라는 책무를 짊어진 말드락서스의 군대가 용기의 사원을 침공하는 사상 초유의 배반을 저질렀습니다. 이들은 령을 약탈한 건 물론이요, 살육에 희생당한 키리안을 악행의 재료로 이용하고자 앗아가기까지 했습니다. 죽음의 요새 조르라무스에서 쏟아져 나오는 괴저의 군세를 견제하지 않으면 승천의 보루를 침탈해 지나간 자리에 파괴의 흔적만을 남길 것입니다.",2286,3759900,3759910,3759930,3759920,0,0,0
1183,역병 몰락지,폐허가 된 역병의 의회 지하에는 말드락서스 역사를 통틀어 가장 파괴적인 병력이 기거하고 있습니다. 이러한 힘을 탐내는 자들은 역병으로 점철된 잔해를 헤집고 다니며 누구보다 먼저 병기를 독차지하려 합니다. 누구든 이 보배를 손에 넣으면 어둠땅의 운명을 손아귀에 거머쥘 수 있게 될 것입니다.,2289,3759901,3759911,3759931,3759921,0,0,0
1184,티르너 사이드의 안개,"신록을 머금은 숲 티르너 사이드는 고대의 비밀이 숨겨져 있다는 전승이 전해져 내려오는 성역으로, 페이들의 부단한 보호를 받곤 했습니다. 전설에 따르면 신중하지 못한 나그네는 길을 잃고 무한한 안개로 가려진 길을 영원히 헤매는 신세가 된다고 합니다. 그러나 가뭄으로 몽환숲이 영락하면서 적들이 숲의 강력한 마법을 호시탐탐 노리는 지경에 이르고 말았습니다. 하물며 영역에서 살아가는 주민들조차 굶주림과 절박함을 이겨내지 못하고 겨울 여왕이 소중히 아끼는 것들을 흡수하려고 들고 있습니다.",2290,3759899,3759909,3759929,3759919,0,0,0
1185,속죄의 전당,"규탄자가 이끌어 나갈 당시만 해도 속죄의 전당은 레벤드레스의 사명에 헌신하는 장소였습니다. 고통과 죄악이 전당을 가득 메워 울려 퍼졌지만, 그 모든 것은 영혼이 나락에 떨어지지 않도록 방지하고 구원하기 위함이었습니다. 그러나, 최근 시종장이 제위에 오르면서 전당의 방향성은 이기적으로 령을 갈취하는 것으로 틀어지고 말았습니다. 정도가 지나쳐 영혼이 더는 구원받을 수 없는 상태에 이르는 일도 부지기수가 되었죠. 이젠 누군가가 나서서 전당에 뿌리내린 타락을 발본색원해야 합니다.",2287,3759898,3759908,3759928,3759918,0,0,0
1186,승천의 첨탑,"구름 사이를 부유하는 승천의 첨탑은 키리안이 추구하는 이상의 정점이요, 집정관의 권좌입니다. 영겁에 이르는 세월 동안 승천의 보루의 통치자는 한순간도 흔들리지 않고 책무와 헌신의 표상으로서 그 역할을 다했고, 의문을 던지거나 반기를 드는 자는 단 한 명도 없었습니다. 그러나 가뭄과 불안으로 승천자 체계에 관한 믿음에 균열이 생기고 말았습니다. 누구보다 신임하던 추종자가 악의 어둠에 사로잡혀 휘둘리는 지금, 집정관의 통치는 상상을 초월하는 위험을 앞두고 있습니다.",2285,3759903,3759913,3759933,3759923,0,0,0
1187,고통의 투기장,"말드락서스는 끊임없는 시험을 넘기며 어둠땅을 수호할 가장 우수한 인재라는 걸 증명해 보여야 합니다. 그런 역량을 입증할 최적의 장소가 바로 고통의 투기장입니다. 참가자들이 인산인해를 이뤄 용사와 자웅을 겨룰 순간을 고대하며 결투를 펼치는 곳이지요. 야성! 혼란! 폭력! 그리고 고통까지! 오로지 제일가는 강자만이 의회의 용사로 지명될 수 있으며, 그중에서도 단 한 명만이 최강자의 자리에 오릅니다.",2293,3759904,3759914,3759934,3759924,0,0,0
1188,저편,"브원삼디는 어둠땅에 저편이라고 하는 비밀 장소를 두고 있었습니다. 이윽고 망자들이 나락으로 쏟아져 들어가게 되자, 브원삼디는 몇몇 영혼을 자신의 작은 영역에 숨겨 트롤 추종자들의 안위를 살폈습니다. 하나 이러한 행위는 먼 옛날 무에젤라와 맺은 계약을 어기는 것이었고, 급기야 고대의 로아가 영혼을 수확하고 관리인을 멸하고자 강림하기에 이르렀습니다. 브원삼디가 공세에서 살아남아 영혼들을 지켜내려면 도움의 손길을 받아 다른 이들과 맺은 거래의 대가를 징수해야 합니다.",2291,3759905,3759915,3759935,3759925,0,0,0
