ID,Name_lang,Description_lang,MapID,BackgroundFileDataID,ButtonFileDataID,ButtonSmallFileDataID,LoreFileDataID,Flags,AreaID,CovenantID
261,증기 저장고,"장가르 습지대의 깊은 물 아래, 나가가 지배하는 시설이 숨어 있습니다. 거대한 파이프와 피스톤이 얽히고설킨 이 시설의 이름은 갈퀴송곳니 저수지로서, 나가 군대를 수용하기 충분할 만큼 큽니다. 그러나... 이 저수지가 단지 군사 목적으로만 쓰이는 것은 아닙니다.",545,608160,608199,136331,608238,0,0,0
262,지하수렁,"장가르 습지대의 깊은 물 아래, 나가가 지배하는 시설이 숨어 있습니다. 거대한 파이프와 피스톤이 얽히고설킨 이 시설의 이름은 갈퀴송곳니 저수지로서, 나가 군대를 수용하기 충분할 만큼 큽니다. 그러나... 이 저수지가 단지 군사 목적으로만 쓰이는 것은 아닙니다.",546,608160,608199,136331,608238,1,0,0
271,안카헤트: 고대 왕국,"노스렌드에 리치 왕이 도착했을 당시 아졸네룹은 강성한 제국이었습니다. 이들은 스컬지의 공격에 거세게 저항했지만, 결국 스컬지는 지하 왕국 아졸네룹을 정복하고 그곳에 사는 네루비안들을 학살했습니다. 오랜 전쟁으로 만신창이가 된 거대한 왕국은 이제 두 구역으로 나뉘었습니다.",619,608153,608192,237592,608231,0,0,0
272,아졸네룹,"노스렌드에 리치 왕이 도착했을 당시 아졸네룹은 강성한 제국이었습니다. 이들은 스컬지의 공격에 거세게 저항했지만, 결국 스컬지는 지하 왕국 아졸네룹을 정복하고 그곳에 사는 네루비안들을 학살했습니다. 오랜 전쟁으로 만신창이가 된 거대한 왕국은 이제 두 구역으로 나뉘었습니다.",601,608155,608194,237593,608233,1,0,0
273,드락타론 성채,"드락타론 성채는 드라카리 트롤의 제국인 줄드락 국경 지대에 자리 잡고 있습니다. 난공불락의 요새로 여겨졌던 이 성채도 최근 스컬지의 공격을 받아 리치 왕의 손아귀에 넘어가고 말았습니다. 성채를 방어하다가 쓰러진 자들은 이제 리치 왕의 언데드 부하가 되어, 드라카리 영토 중심부로 진격하고 있습니다.",600,608162,608201,237595,608240,0,0,0
274,군드락,"제국의 몰락만은 막아야 한다는 다급한 마음에 줄드락의 트롤은 숭배하던 고대 신들을 제물로 삼았습니다. 이제 야생 신들은 무한한 힘의 원천으로 취급되고 있으며, 강력한 힘이 담긴 신들의 피는 줄드락의 상당 부분을 점령한 리치 왕의 졸개들에게 대항하는 수단으로 쓰입니다. 혼돈에 빠진 줄드락에 최근 영웅들이 나타나, 광기에 사로잡힌 드라카리 예언자들과 야만적인 드라카리 트롤을 응징하기 시작했습니다.",604,608164,608203,237596,608242,1,0,0
275,번개의 전당,"티탄들은 아제로스를 떠나며 충성스러운 수호자들에게 폭풍우 봉우리 산골짜기에 자리 잡은 불가사의한 도시, 울두아르를 보호하는 임무를 맡겼습니다. 그중 제1관리자는 로켄이었으나, 티탄의 오묘한 힘을 손에 쥔 로켄은 그만 암흑에 물들어 온 지역을 혼돈에 빠뜨리고 말았습니다.",602,608165,608204,237598,608243,1,0,0
276,투영의 전당,"리치 왕에게 용감하게 맞선 아제로스의 영웅들이 잔혹하게 살해당하고, 언데드로 되살아나 그의 군대에 편입되는 일이 몇 년 동안 반복되었습니다. 이에 리치 왕을 막으려고 끊임없이 노력해 온 은빛십자군의 티리온 폴드링은 다리온 모그레인이 이끄는 칠흑의 기사단과 손을 잡고 잿빛 선고단을 결성했습니다.",668,608166,608205,336389,608244,0,0,0
277,돌의 전당,"티탄들은 아제로스를 떠나며 충성스러운 수호자들에게 폭풍우 봉우리 산골짜기에 자리 잡은 불가사의한 도시, 울두아르를 보호하는 임무를 맡겼습니다. 그중 제1관리자는 로켄이었으나, 티탄의 오묘한 힘을 손에 쥔 로켄은 그만 암흑에 물들어 온 지역을 혼돈에 빠뜨리고 말았습니다.",599,608167,608206,237599,608245,0,0,0
278,사론의 구덩이,"리치 왕에게 용감하게 맞선 아제로스의 영웅들이 잔혹하게 살해당하고, 언데드로 되살아나 그의 군대에 편입되는 일이 몇 년 동안 반복되었습니다. 이에 리치 왕을 막으려고 끊임없이 노력해 온 은빛십자군의 티리온 폴드링은 다리온 모그레인이 이끄는 칠흑의 기사단과 손을 잡고 잿빛 선고단을 결성했습니다.",658,608171,608210,336391,608249,0,0,0
279,옛 스트라솔름,"시간의 동굴 안 깊은 곳에서 생각에 잠긴 용 노즈도르무가 깨어났습니다. 시간의 미묘한 균형을 유지하는 것을 소명으로 여기는 청동용군단은 변화하는 시간의 길, 그 구불구불한 미로를 세계가 요람기에 있을 때부터 감시하고 보호해 왔습니다.",595,608180,608219,237601,608258,0,0,0
280,영혼의 제련소,"리치 왕에게 용감하게 맞선 아제로스의 영웅들이 잔혹하게 살해당하고, 언데드로 되살아나 그의 군대에 편입되는 일이 몇 년 동안 반복되었습니다. 이에 리치 왕을 막으려고 끊임없이 노력해 온 은빛십자군의 티리온 폴드링은 다리온 모그레인이 이끄는 칠흑의 기사단과 손을 잡고 잿빛 선고단을 결성했습니다.",632,608181,608220,336392,608259,1,0,0
281,마력의 탑,"푸른용의 위상 말리고스는 필멸자들과 아제로스에 흐르는 비전 에너지의 연결을 완전히 끊음으로써 다시 유일한 마법의 지배자가 되려고 합니다. 이를 위해 푸른용군단은 우뚝 솟은 말리고스의 둥지, 마력의 탑으로 세계의 지맥을 돌리고 있습니다.",576,608182,608221,237602,608260,1,0,0
282,마력의 눈,"푸른용의 위상 말리고스는 필멸자들과 아제로스에 흐르는 비전 에너지의 연결을 완전히 끊음으로써 다시 유일한 마법의 지배자가 되려고 합니다. 이를 위해 푸른용군단은 우뚝 솟은 말리고스의 둥지, 마력의 탑으로 세계의 지맥을 돌리고 있습니다.",578,608183,608222,237603,608261,0,0,0
283,보랏빛 요새,"달라란의 화려한 첨탑과 마력 깃든 거리 사이, 보랏빛 요새의 두꺼운 벽 안에서 어두운 존재가 꿈틀거립니다. 도시를 위협하는 존재들을 오랫동안 가두어 온 이 요새에서는 방마다 사나운 죄수들이 갇혀 키린 토의 끊임없는 감시를 받고 있습니다. 하지만 최근 갑작스러운 공격이 요새를 위험에 빠뜨리고, 나아가 감옥 밖의 모든 이를 위협하고 있습니다.",608,608189,608228,237604,608312,0,0,0
284,용사의 시험장,"짙은 구름이 얼음왕관의 하늘을 뒤덮고, 다가오는 폭풍에 대비하는 영웅들은 전쟁에 해진 깃발 아래 모여들고 있습니다. 칠흑 같은 먹구름 위에서도 해는 빛난다는 말이 있습니다. 은빛십자군을 움직이는 희망을 잘 표현해주는 말입니다. 힘겨운 시기에도 빛이 이끌어 주리라는 희망, 선이 악을 누르고 결국엔 승리하리라는 희망, 빛의 축복을 받은 영웅이 나타나 리치 왕의 통치에 종지부를 찍어 주리라는 희망 말입니다.",650,608185,608224,311220,608263,0,0,0
285,우트가드 성채,"우트가드 성채는 오랫동안 주인 없는 곳으로 여겨졌고, 울부짖는 협만 중앙의 절벽 사이에 잊혀진 문명의 잔재로만 남아 있었습니다. 그러나 최근 무언가가 성채 안에 잠들어 있던 브리쿨을 깨우고 말았습니다.",574,608187,608226,237605,608265,1,0,0
286,우트가드 첨탑,"우트가드 성채는 오랫동안 주인 없는 곳으로 여겨졌고, 울부짖는 협만 중앙의 절벽 사이에 잊혀진 문명의 잔재로만 남아 있었습니다. 그러나 최근 무언가가 성채 안에 잠들어 있던 브리쿨을 깨우고 말았습니다.",575,608188,608227,237606,608266,0,0,0
302,스톰스타우트 양조장,"네 바람의 계곡에 도착한 첸 스톰스타우트는 친족을 만나길 기대하며, 가문의 이름이 붙은 저 유명한 스톰스타우트 양조장을 찾아갔습니다. 그러나 양조장은 혼돈의 도가니였습니다. 무능한 가오 아저씨가 양조장 관리를 맡자, 혐오스러운 토깽과 제멋대로 구는 호젠이 건물 안에 침입해 파괴적인 향연을 벌이고 있습니다. 이대로 두면 곧 스톰스타우트 양조장에서 공급하는 맛있는 맥주를 다시는 맛볼 수 없을지도 모릅니다.",961,632268,632275,632362,632282,1,0,0
303,석양문,"용의 척추라 불리는 거대한 성벽이 수세기 동안 판다리아의 주민들을 미친 듯이 날뛰는 사마귀족에게서 보호해 왔습니다. 그런데 이 잔혹한 종족이 벌이는 주기적인 총공격이 이번엔 예상보다 일찍 찾아와, 성벽 방비에 빈틈이 생겼습니다. 전투에 닳은 관문으로 가장 강력한 사마귀 전사들이 돌격해 옵니다. 판다리아는 이 땅의 역사에 기록된 그 어느 군대보다도 파괴적인 무리를 막아내야 합니다.",962,632263,632270,632357,632277,1,0,0
311,붉은십자군 전당,"어두운 시대에 한 발짝도 물러서지 않고 싸워 수도원을 지켜 온 맹렬한 성전사들이 붉은십자군 전당 안에서 급속도로 조직화되고 있습니다. 이 병사들은 살아서 돌아다니는 망자에 대한 증오로 똘똘 뭉쳤고, 붉은십자군의 대의를 위해 무엇이든 희생할 준비가 되어 있습니다.",1001,643259,643262,643268,643265,0,0,0
312,음영파 수도원,"전쟁의 물결이 판다리아를 덮쳤고, 호드와 얼라이언스 사이의 파괴적인 분쟁은 장엄한 음영파 수도원 안의 혼란으로 이어졌습니다. 이곳에서 사악한 세 존재, 폭력의 샤, 증오의 샤, 분노의 샤가 감옥을 벗어났습니다. 분노의 샤는 이 한적한 수도원을 완전히 벗어났지만, 남은 샤는 수도원에 있는 용감한 음영파 수호자들을 무차별적으로 학살하고 있습니다.",959,632267,632274,632361,632281,1,0,0
313,옥룡사,"판다리아 동쪽 해안가에 높이 솟은 옥룡사는 수천 년 전, 전설적인 판다렌 황제 샤오하오가 의심의 샤에게 승리를 거둔 것을 기념하는 신성한 건물입니다. 최근 비취 숲에서 벌어진 격한 분쟁이 샤를 불렀고, 그중 일부는 옥룡사에 침입해 소중한 지혜와 지식의 보고를 더럽히고 있습니다.",960,632269,632276,632363,632283,1,0,0
316,붉은십자군 수도원,"붉은십자군의 광신적인 지도자들은 붉은십자군 수도원 중심에 있는 대성당에서 추종자들을 이끕니다. 경계가 삼엄한 이 수도원은 붉은십자군의 본부 역할을 하며, 가장 편협하고 열성적인 성전사들이 한때는 신성했던 이 장소를 배회합니다.",1004,608175,608214,136354,608253,0,0,0
317,모구샨 금고,"강력한 패권을 자랑스러워하던 모구는 자신들의 수많은 업적을 기록해 웅장한 금고 안에 보관했습니다. 이 광대한 전당은 판다렌의 역사에 기록된 어떤 사건보다도 먼저 지어졌고, 따라서 그 깊이는 비밀에 싸여 있습니다. 금고 안에는 엄청난 군대가 있다는 소문도 한때 돌았습니다. 이 때문에, 고대에 판다렌이 봉기했을 때 모구샨 금고는 첫 번째 목표가 되었고, 모구 제국이 무너진 이래 영원히 봉인되었습니다.",1008,632266,632273,632360,632280,0,0,0
320,영원한 봄의 정원,"높은 산 위에 숨겨져 있는 영원한 봄의 정원은 영원꽃 골짜기의 성스러운 심장부입니다. 그 안의 잔잔한 샘에서 솟는 물에는 치료와 회복의 힘이 있다고 합니다. 하지만 공포의 샤가 공격해 오자, 정원의 수호자들은 공포에 사로잡혀 서로에게 등을 돌렸습니다.",996,643261,643264,643270,643267,0,0,0
321,모구샨 궁전,"고대의 모구샨 궁전은 판다리아 본토에서 모구가 얼마나 강성했는지 잘 보여주는 궁극의 건축물입니다. 최근 모구 대부족 세 개가 모구의 왕, 무기달인 신의 부름을 받고 아름다운 모구샨 궁전에 모였습니다. 이 강력한 통치자는 흩어진 동족을 하나로 모으고 제국의 영광을 되찾겠다는 대담한 계획을 세웠습니다. 혼란이 판다리아를 휩쓰는 가운데, 정복을 향한 신의 원대한 꿈은 현실이 될지도 모릅니다.",994,632265,632272,632359,632279,1,0,0
322,판다리아,"만 년 전 일어난 세계의 분리 이래, 고대 왕국 판다리아는 짙은 안개에 둘러싸여 전쟁의 포화를 피해 왔습니다. 울창한 숲과 구름이 드리운 산에는 토착 종족과 이국적인 생명체들이 복잡한 생태계를 이루며 살아가고 있습니다. 이 땅의 주민인 불가사의한 판다렌은 고대의 악에게 위협받을 때조차도 열정적으로 삶을 누리는 종족입니다.",996,652217,652218,1062579,652219,2,0,0
324,니우짜오 사원 공성전투,"니우짜오 사원은 용의 척추라 불리는 우뚝 솟은 성벽 너머, 요새화된 두 개의 섬에 걸쳐 있습니다. 수년간 불굴의 판다렌 방어병들이 섬들을 연결하는 좁은 다리를 지키고, 호시탐탐 기회를 엿보는 침입자들을 막아 왔습니다. 그러나 최근 사마귀족이 거대한 나무 뿌리로 이루어진 자신들만의 다리를 통해 섬 하나를 급습했습니다. 이제 이 야만적인 벌레 인간들은 남아 있는 니우짜오의 수호자들을 공격할 만반의 준비를 마쳤습니다.",1011,643260,643263,643269,643266,0,0,0
330,공포의 심장,"공포의 샤가 사마귀 여제를 타락시켰습니다. 여제의 발작적이고 편집증적인 명령들에사마귀 문명의 수호자인 클락시가 공격적인 행동을 취하기 시작했습니다. 수적으로 불리한 클락시는 여제를 끌어내리고 동족에게서 샤의 부정적인 영향을 제거하기 위해, 마지못해 외부인의 도움을 받아들였습니다.",1009,632264,632271,632358,632278,0,0,0
362,천둥의 왕좌,"수천 년 전, 판다리아가 칼림도어로부터 분리됐을 때부터 짙은 안개의 장막이 외부인들로부터 이 신대륙을 가리었습니다. 그와 동시에 이 안개는 고대의 악이 존재했던 레이 션의 천둥의 왕좌 또한 숨겨왔습니다. 천둥왕의 재위 때 그의 본거지였던 이 요새에서는 왕의 죽음 이후에도 사악한 기운이 물씬 흘러나오고 있습니다. 다시금 부활한 천둥왕과 그를 따르는 잔달라 트롤들은 이 부정한 힘을 다루어 레이 션의 공포스러운 제국을 재건하려 합니다.",1098,828450,828453,838785,828454,0,0,0
369,오그리마 공성전,"가로쉬 헬스크림의 오만으로 촉발된 갈등이 정점에 이르고, 영원꽃 골짜기는 파괴의 해일에 뒤덮이고 말았습니다. 호드와 얼라이언스의 지도자들은 헬스크림의 요새를 향해 진격하고, 무자비한 폭군이 되어버린 대족장의 권세를 완전히 꺾어 놓으려 합니다.",1136,904980,904981,904241,904982,0,0,0
385,피망치 잿가루 광산,"피망치 오우거 일족은 서리불꽃 마루의 북쪽 외곽에 있는 활화산 동굴의 숨 막히는 열기 속에서 가혹한 환경의 채굴 기지를 운영합니다. 이들은 드레노어 대륙 전역에서 노예를 끌어와 가혹한 노역을 시키고 있습니다. 피망치 잿가루 광산에서는 보석과 광석이 다량 생산되지만, 이 광산의 진정한 목적은 엄청난 힘을 가진 고대 유물의 채굴에 있다는 소문이 최근 떠돌고 있습니다.",1175,1041968,1041994,1042059,1041984,1,0,0
457,검은바위 용광로,"이 용광로는 검은바위 오크 선조들의 고향으로, 대장장이 대가들이 부족의 이름을 따서 이름붙인, 가공이 거의 불가능하다고 할 만큼 단단한 검은바위 광석을 제련하고 주조하던 곳이었습니다. 지금은 천둥군주 부족에게 포로가 된 수많은 거인이 거대한 용광로에 열기를 공급하고, 불타는 칼날단의 화염칼날들이 검은바위 광석에 불길을 주입하거나, 강철 기술자들이 다른 세상의 설계에 따라 잿가루를 가공하고 있습니다. 전쟁군주 블랙핸드의 용광로는 아제로스를 휩쓸기 위해 사용될 병기들을 대량으로 생산하고 있는, 강철 호드 군사력의 심장부입니다.",1205,1041967,1041993,1042058,1041983,0,0,0
476,하늘탑,"구름 사이로 솟은 아라크 첨탑 중에서도 가장 높은 곳에 자리한 하늘탑은 루크마르 신봉자의 권좌처럼 우뚝 서 있습니다. 지금은 아라코아들이 조상의 에펙시스 기술을 수집해 동력으로 만들어, 그들의 적에게 태양의 힘을 집중한 광선을 발사하려고 합니다.",1209,1041973,1041999,1042064,1041989,1,0,0
477,높은망치,"고리안 제국의 권력자들인 높은망치 부족은 드레나이가 이 세계에 도착하기 전까지 대대로 드레노어 대륙을 지배하던 오우거 문명의 후손들입니다. 난폭한 바보라는 오우거의 평판이 무색하리만치 붐비는 시장과 부유한 귀족이 가득한 거대 도시 높은망치에는 원형경기장의 관중들이 내지르는 함성이 뒷골목 구석구석까지 메아리치고 있습니다. 도시의 성벽 안 어느 곳이라도 볼 수 있는 높은군주 마르고크의 성채는 커다란 그림자를 드리우고 있어, 감시의 눈과 철권의 힘을 떠오르게 합니다.",1228,1041971,1041997,1042062,1041987,0,0,0
536,파멸철로 정비소,"파멸철로 정비소는 강철 호드의 전쟁 기계를 위한 중추 기관과도 같은 곳으로 강철 호드의 병력과 검은바위 용광로에서 생산된 군수물자를 드레노어 전역의 최전선으로 수송하고 있습니다. 정비소의 이름 그대로 병력과 대포 부대가 가득 실려있는 수많은 파멸의 기차들이 있으며, 지금은 파멸철로가 샤트라스의 보호막을 산산조각내기에 충분한 거대하고 강력한 레일건으로 무장한 채 파괴를 위한 출정을 기다리고 있습니다.",1208,1041970,1041996,1042061,1041986,1,0,0
537,어둠달 지하묘지,"어둠달 부족의 전통적인 무덤 지역은 많은 선조가 대대로 최후의 안식을 취하고 있는 장소입니다. 하지만 타락한 부족장 넬쥴은 힘을 얻는 것에만 지나치게 열중한 나머지 부족의 영혼 그 자체를 희생시키고 있습니다. 그는 이제 안식을 취하지 못하고 고통받는 고대 영혼들을 어둠의 의식에 제물로 바쳐, 드레노어 대륙의 모든 것을 공허에 빠뜨리려고 합니다.",1176,1041972,1041998,1042063,1041988,1,0,0
547,아킨둔,"아킨둔은 죽은 영혼들이 휴식을 취하는 빛의 성소이자 드레나이의 성스러운 묘당입니다. 이 수정 구조물은 끊임없이 드레나이 영혼들을 갈망하는 불타는 군단과 같은, 드레나이의 영원한 적들로부터 드레나이 영혼들을 보호하고 감싸는 일도 하고 있습니다. 이 사실이 사악한 주인에게 비위를 맞추고 싶어하는 굴단과 어둠의 의회의 특별한 관심을 끌었습니다.",1182,1041966,1041992,1042057,1041982,1,0,0
556,상록숲,"어둠의 문이 파괴된 후, 키린 토는 강철 호드의 영토에서 그들과 전투를 벌이기 위해서는 지원을 위한 보급선이 필요하다는 것을 깨닫고, 드레노어 대륙 전역에 전초기지를 만들면서 각각에 아제로스로 통하는 연결 통로를 열었습니다. 하지만 고르그론드의 검은바위 용광로 근처 전략적 요충지로 보였던 곳이 사실은 신록지기들에게 상록숲으로 알려진 신성한 장소였습니다. 이 전초기지는 빠르게 식물에 뒤덮였지만, 아직 스톰윈드와의 연결 고리는 남아 있습니다...",1279,1060543,1060547,1060551,1060545,1,0,0
557,드레노어,"드레노어는 야만의 땅이자 수백 년 전 드레나이 피난민에 의해 이름이 붙여진 오크 종족의 출생지로, 수 대를 걸쳐 오크, 드레나이, 고리안 제국의 오우거 지배자들이 갈등과 영토 분쟁 속에서도 서로 공존하고 있었습니다. 가로쉬 헬스크림이 탈출한 후에 깨어난 곳이 바로 창조와 파괴의 힘을 가진 원시 세력들이 폭력을 통해 균형 상태를 유지하던 드레노어였습니다. 그리고 지금, 강철 호드와 굴단의 검은 손길에 의해 두 세계의 운명이 바람 앞의 등불 같은 처지가 되었습니다.",1228,1041969,1041995,1042060,1041985,0,0,0
558,강철 선착장,"고르그론드의 북쪽 해안가에 있는 강철 선착장은 강철 호드 해군력의 심장부로, 검은바위 용광로에서 주조되고 조립된 대규모의 전투함과 대포들이 이 커다란 항구에서 출전을 준비하고 있습니다. 드레노어의 가장 거대한 야수들도 정예병들과 함께 조련되고 훈련을 받습니다. 이들로 구성된 지상군은 적의 해안에 쇄도하여 강철 호드에 대항하는 자들의 의지를 초전에 꺾어 놓을 것입니다.",1195,1060544,1060548,1060552,1060546,0,0,0
559,검은바위 첨탑 상층,"이 인상적인 요새는 길고 복잡한 역사를 품고 있습니다. 수 세기 전 검은무쇠 드워프가 검은바위 산의 불타는 핵을 파내어 만든 이 요새는 한때 검은용 네파리안의 무리가 점령했었습니다. 하지만 이제 검은바위 첨탑의 상층은 강철선봉대의 기지입니다. 첨탑을 아제로스에 대한 전면 공격의 토대로 사용하려는 준비가 계속됨에 따라, 강철 호드는 끔찍한 비상 대책을 세워 두었습니다. 바로 파멸의 무기를 검은바위 산의 심장부에 건설한 것입니다.",1358,1041974,1042000,1042065,1041990,0,0,0
669,지옥불 성채,"가로쉬는 그롬마쉬를 설득하여 타나안 밀림의 심장부에, 아제로스를 향한 공격의 근거지가 될 이 거대한 요새를 세우게 했습니다. 다른 시간, 다른 땅에서 빌려 온 “지옥불”이라는 이름을 제안한 것도 가로쉬였습니다. 그는 자신이 알고 있던 아웃랜드의 황무지와는 무척 다른 이곳에서, 황폐화되지 않은 대지 위로 높이 솟아오른 오크의 강대한 강철 성채를 꿈꿨지만, 다른 시간 속에서도 두 요새의 운명은 비슷하게 흘러갑니다.",1448,1135117,1135118,136340,1135119,0,0,0
707,감시관의 금고,"이 감시관의 비밀 시설은 아즈스나의 산허리를 깊이 파들어가 만들어졌습니다. 마법 수호물로 봉인된 이 금고는 불청객의 침입을 막는 동시에 이 안에 갇힌 공포스러운 존재들이 절대로 탈출하지 못하게 하는 역할을 합니다. 감시관들이 상대했던 적들 중에서 가장 위험한 존재들이 금고 깊은 곳에 갇혀 있었습니다. 하지만 콜다나의 배신과 군단 침공의 여파로, 이 생물들이 감시관의 금고를 탈출하여 이곳 내부를 자유롭게 활보하고 있습니다.",1493,1411846,1411858,1411870,1411852,1,0,0
716,아즈샤라의 눈,"아즈스나 연안 외곽의 모래톱 사이, 파도 아래 고대 힘의 근원이 남아 있습니다. 오래전 여왕 아즈샤라가 이 땅 전체를 지배했을 때부터 지금까지, 나가는 아즈샤라의 명령에 따라 골가네스의 해일석을 찾고 있습니다. 구름이 밀려들고, 대기는 다가오는 폭풍의 힘으로 이글거리는 이 순간, 아즈샤라의 추종자들은 여왕의 분노의 현신을 소환하며 이 땅을 파괴할 계획을 실행에 옮기고 있습니다.",1456,1498149,1498157,1498161,1498153,1,0,0
721,용맹의 전당,"스톰하임 상공의 구름 속에서, 티탄 수호자 오딘은 아제로스에서 가장 위대한 브리쿨 전사들을 소환하여 그의 발라리아르로 받아들였습니다. 이 승천한 브리쿨 전사들은 연회장과 사냥터를 누비며 자신을 단련하고, 다가올 엄청난 전쟁에 대비하고 있습니다. 이 브리쿨 전사들로 가득한 연회장을 통과한 모험가만이 오딘 앞에 설 자격을 얻고, 아그라마르의 아이기스를 거머쥘 기회를 잡을 수 있을 것입니다.",1477,1498150,1498158,1498162,1498154,0,0,0
726,비전로,"광활한 수라마르 성 지하에는, 그물처럼 연결된 거대한 땅굴이 성의 규모보다도 더 크게 사방으로 뻗어 있습니다. 나이트본 사회는 밤샘의 힘으로 번창해 왔고, 비전로는 수라마르 전체에 생명력을 공급하는 역할을 했습니다. 미궁과도 같은 이 지하 통로는 수천 년 전에 만들어진 것으로, 수라마르에서 가장 거대한 건축물의 토대 아래를 지나고 있습니다. 하지만 오늘날 이곳의 거주민은 대부분 자신의 발밑에 어떤 어둠이 도사리고 있는지 전혀 모른 채 살아가고 있을 뿐입니다...",1516,1411845,1411857,1411869,1411851,0,0,0
