ID,Name_lang,Description_lang,MapID,BackgroundFileDataID,ButtonFileDataID,ButtonSmallFileDataID,LoreFileDataID,Flags,AreaID,CovenantID
1189,핏빛 심연,"나스리아 성채의 깊고 깊은 지하에는 대영주 데나트리우스가 지대한 관심을 두는 반란분자를 수용하는 감옥, 핏빛 심연이 자리하고 있습니다. 이곳 포로들은 영겁에 이르는 세월 동안 갇힌 채 연구에 쓰일 령을 흡수당하는 신세가 됩니다. 죄악의 몰락지 저항군은 대영주 데나트리우스와의 싸움에서 주도권을 가져오게 해줄 포로가 핏빛 심연에 갇혀 있다는 사실을 알곤 탈옥 작전에 지원을 요청했습니다.",2284,3759902,3759912,3759932,3759922,0,0,0
1190,나스리아 성채,"대영주 데나트리우스는 교만한 영혼들에게서 령을 수확하는 레벤드레스의 주민들을 오랫동안 지배해 왔습니다. 그러나 가뭄과 공포가 어둠땅을 휘어잡으면서, 데나트리우스도 충성이 향하는 진짜 방향을 드러내 보였습니다. 이제 옛 주인에게 맞서려 들고일어선 고귀한 왕자 레나탈은 얼마 남지 않은 아군을 불러모아, 나스리아 성채에 잠입하고 데나트리우스를 권좌에서 끌어내릴 필사적인 임무를 준비합니다.",2296,3759896,3759906,3759926,3759916,0,0,0
1192,어둠땅,"필멸자의 영역인 아제로스 그 너머에 자리한 어둠땅은 임종을 맞은 영혼이 향하는 목적지입니다. 한때는 원대한 힘을 지닌 심판관이 죽은 자의 영혼을 수없이 많은 내세로 인도하곤 했습니다. 하나 작금에 이르러서는 모든 영혼이 나락으로 보내져 영원한 고문의 희생양으로 전락하고 있습니다. 이젠 승천의 보루의 평화로운 키리안부터 몽환숲의 나이트 페이, 레벤드레스의 교활한 벤티르, 말드락서스의 호전적인 강령군주까지 어둠땅의 주민들이 일치단결하여 영혼의 흐름을 막아내야 합니다.",2559,3850568,3850569,3850571,3850570,2,0,0
1193,지배의 성소,"영겁의 세월 동안 간수는 나락에 구속되어 있었습니다. 그러나 지금 이 순간, 간수의 무한한 군대는 집결하고 있으며 그의 경계는 점점 뻗어 나가 오리보스를 집어삼키려고 합니다. 파멸 앞에 선 볼바르는 마지막 남은 동맹군을 이끌고 토르가스트에 진격해, 간수가 가장 강력한 힘을 발휘할 수 있는 장소에서 결전을 벌이고자 합니다.",2450,4182018,4182020,4181530,4182023,0,0,0
1194,미지의 시장 타자베쉬,피도 눈물도 없는 중개단장 소레아가 창시자의 비밀을 손에 넣기 위해 여러 영역을 넘나드는 강탈 작전을 주도하고 있습니다. 그런 그녀와 대립각을 세우는 자들이라곤 실각한 중개자 알달릴과 황급하게 긁어모은 일당이 전부입니다. 이들은 이제 수수께끼에 가려진 미지의 시장을 넘어 소레아가 금단의 힘을 손에 넣기 전에 저지해야 합니다.,2441,4182019,4182022,4181531,4182024,0,0,0
1195,태초의 존재의 매장터,"간수가 베일에 가려진 어둠땅의 심장부, 매장터를 돌파했습니다. 그가 매장터에 담긴 태고의 힘을 손에 넣으면 죽음을 앞세워 우주를 재창조할 것입니다. 조바알이 현실을 지배할 준비를 하는 이 순간, 그를 저지하려는 아제로스의 용사들은 진격하고 있습니다. 과연 용사들의 결의가 간수를 꺾을 수 있을까요?",2481,4423751,4423752,4423750,4425895,0,0,0
1196,담쟁이가죽 골짜기,"담쟁이가죽 골짜기는 용의 섬 최대 규모의 놀 거주지입니다. 하지만 이 야생 놀 정착지에는 형언할 수 없는 위험이 똬리를 틀고 있지요. 골짜기에서는 부패가 스며 나와 하늘빛 평원의 놀 부족을 잠식하고, 모든 생명에게 부식의 위협을 떨치고 있습니다. 이런 골짜기의 중심부에는 담쟁이가죽 놀의 수장이 기거하며, 자신의 지식을 메말라가는 동족과 즐겁게 향유하고 있습니다.",2520,4742820,4742923,4746635,4742933,0,0,0
1197,울다만: 티르의 유산,"울다만은 고대의 티탄 시설로, 아득히 먼 옛날 영웅적인 수호자 티르가 노르간논의 원반을 숨긴 장소입니다.

용의 섬으로 돌아온 이후, 알렉스트라자 여왕은 울다만에 또 다른 원반이 숨겨져 있다는 사실을 알게 됩니다... 티르 본인의 기억이 담긴 원반이 말입니다. 그 지식으로 위상의 힘을 되찾을 수 있을 거란 확신에 알렉스트라자는 필멸자 동료들에게 부탁을 하게 됩니다. 용족의 미래를 위해, 위험천만한 울다만을 돌파하고 티르의 기억을 회수해 달라는 부탁을.",2451,4742827,4742930,4746642,4742940,0,0,0
1198,노쿠드 공격대,"노쿠드 부족이 고대의 독수리 정령 온아라를 생포한 후, 내전이 온아라 평야를 불길처럼 휩쓸고 있습니다. 다른 부족들에게 있어 온아라는 단순한 정령이 아닌, 그들의 여신입니다. 원시술사들은 정령의 힘을 부리며, 강령술사들은 전설적인 켄타우로스의 영혼들을 조종합니다. 적에게 둘러싸인 마루크 부족들이 일치단결하는 가운데, 노쿠드의 폭군 발라카르 칸은 멀찍이서 바라보며 명령을 내리고 있습니다. 노쿠드가 굴복하기 전까지 끝없는 공세가 예상되는 가운데, 전장이 기다립니다.",2516,4742821,4742924,4746636,4742934,0,0,0
1199,넬타루스,흑요석 성채 지하에는 검은용군단의 보물고이자 전설적인 제련술의 비밀이 숨겨져 있는 넬타루스가 자리하고 있습니다. 자라딘은 잠에서 깨어난 후 넬타루스를 공격 목표로 삼았습니다. 하지만 을씨년스럽게 버려진 상태인 걸 보고는 당황하면서도 재빨리 비밀을 취했고... 나아가 흑요석 성채를 완전히 장악했습니다.,2519,4742825,4742928,4746640,4742938,0,0,0
1200,현신의 금고,"원시술사들이 수천 년 동안 현신들을 가둬온 티탄 감옥에 침입했습니다. 이곳에서 라자게스는 힘을 합쳐 이 세상에서 티탄의 영향력을 지우겠다는 속셈 아래 형제자매들을 해방할 부정한 의식을 치르고 있습니다. 아제로스의 용사들은 이 난공불락의 요새를 공격해 방어선을 돌파하고, 위협에 종지부를 찍어야 합니다. 수많은 이가 스러질지도 모르는 과업입니다. 그러나 패배하는 순간, 불과 피가 난무하는 현신들의 시대가 온 세상을 집어삼킬 것입니다.",2522,4742828,4742931,4746643,4742941,0,0,0
1201,알게타르 대학,"먼 옛날 알게타르 대학은 모든 용을 위한 고등 교육기관이었습니다. 그 이후로 섬의 다른 지역처럼 줄곧 휴면에 들어 있었지만, 교장 도라고사의 주도 아래 다시 교문을 열었습니다. 재밌고 참신한 변화로 무장한 알게타르 대학은 이제 용에 국한되지 않고 모든 생명체를 학생으로 받고 있으며, 한때 학생으로 북적거렸던 교육의 전당을 원래 모습으로 돌려놓는 데 힘을 보탤 자원자들도 모집하고 있습니다. 대학을 찾는 이는 누구든 새로운 지식을 얻어갈 수 있을 것입니다.",2526,4742826,4742929,4746641,4742939,0,0,0
1202,루비 생명의 웅덩이,"예로부터 다섯 용군단의 공동 부화장이었던 루비 생명의 웅덩이는 성역으로 여겨집니다. 모든 생명을 가꾸는 것을 책무로 받들고 있는 붉은용군단이 이 웅덩이를, 나아가 온 용족의 미래를 보호하고 있습니다.

그러나 라자게스와 원시술사들이 그 미래를 강탈하러 나타났습니다. 이들의 목적은 이 신성한 웅덩이에 자신들의 힘을 주입하는 것입니다. 용족의 번영을 위해 반드시 저지해야 합니다.",2521,4742824,4742927,4746639,4742937,0,0,0
1203,하늘빛 보관소,"아득히 먼 옛날, 말리고스는 하늘빛 보관소를 만들고 신드라고사에게 자신이 발견한 독특한 마법 유물을 분류하는 일을 맡겼습니다. 그렇게 봉인된 채 수천 년의 세월이 흐른 지금, 보관소는 마모되어 엉망이 되었고 외부와... 내부의 공격으로부터 취약한 상태가 되었습니다.",2515,4742819,4742829,4746634,4742932,0,0,0
1204,주입의 전당,"티르홀드 지하 깊은 곳에는 주입의 전당이 자리하고 있습니다. 이 구조물은 고대의 수원지 위에 지어졌는데, 수호자 티르는 이 수원지의 물을 붉은용군단이 관리하는 생명의 웅덩이의 원천으로 삼았습니다. 그리고 용의 섬이 다시 깨어나면서 원시술사 병력이 전당에 침입했습니다. 이들은 과연 시설을 파괴하러 온 것일까요... 아니면 티르가 남겨놓은 비밀을 파헤치러 온 걸까요?",2527,4742823,4742926,4746638,4742936,0,0,0
1205,용의 섬,"한때는 다섯 용군단이 온 용의 섬 하늘을 뒤덮었지만, 모두 수천 년 전에 적들로부터 아제로스를 지켜내기 위해 섬을 떠났습니다. 하지만 섬이 다시 깨어나 멀리 떠난 수호자들에게 돌아오라고 손짓하고 있습니다. 하지만 네 마리의 무시무시한 원시용 역시 섬으로 찾아왔습니다. 바로 대지와 암석의 지배자 바스리크론, 전류 폭풍의 지배자 스트루나란, 불을 다스리는 자 바주알, 그리고 얼음과 냉기의 지배자 리스카노스입니다.",2574,4742822,4742925,4746637,4742935,2,0,0
1206,노쿠드 공격대,"켄타우로스 내전이 평야를 집어삼켰습니다. 발라카르 칸은 동족을 배신하고 원시술사와 손을 잡았고, 다른 켄타우로스 부족과 녹색용에 대한 적개심을 드러냈습니다. 폭풍마술사가 전장에 정령을 소환하는 한편, 시카르 쇠뇌는 원시술사의 원시용을 격퇴하고 있습니다. 그러던 와중 폭군 발라카르가 바람의 여신 온아라를 사로잡았습니다. 발라카르를 처단하고 여신을 해방한다면 온아라 평야에도 자유가 찾아올 것입니다.",0,0,0,0,0,0,0,0
1207,꿈의 희망 아미드랏실,"에메랄드의 꿈에서 섬세한 보살핌을 받은 끝에, 비로소 아미드랏실이 개화하여 아제로스로 넘어갈 준비를 하고 있습니다. 하지만 새로운 세계수의 운명은 아직 안전하지 않으며, 아제로스의 용사들이 일치단결해 피락과 불타는 동맹에 대항해야 합니다. 피락이 아미드랏실의 심장을 집어삼켜 온 세상을 화마로 물들이지 못하게 저지해야 합니다.",2549,5409260,5409261,5409263,5409262,0,0,0
1208,어둠의 도가니 아베루스,"수천 년 전, 넬타리온은 비밀 실험실 아베루스를 세워 세계를 격변시킬 실험을 자행했습니다. 그리고 얼마 전에 다시 수면 위로 드러나면서 대지의 수호자의 유산을 탐내는 세력들로부터 십자 포화를 받고 있지요. 그 안에 남아 있는 힘을 손에 넣겠다고 말입니다. 아제로스의 용사들은 이제 어둠 속으로 나아가 넬타리온의 사악한 힘이 악인들의 수중에 들어가지 않도록 막아야 합니다.",2569,5149416,5149418,5149415,5149417,0,0,0
1209,무한의 여명,"청동 사원은 청동용군단의 귀환을 기다리며 수천 년 동안 잠들어 있었습니다. 청동용은 이 거룩한 사원을 재건하는 데 성공했지만, 그러기도 무섭게 어둠의 세력이 사원을 노리고 있습니다. 결국 무한의 용군단이 시간의 길을 장악하고, 무르도즈노가 강림하는 순간이 찾아오고 마는 걸까요? 아제로스의 용사들은 시간 그 자체로 뛰어들어 찬란하게 빛나는 미래를 지켜내야 합니다.",2579,5221758,5221768,5221804,5222376,0,0,0
1210,어둠불꽃 동굴,"어둠불꽃 동굴은 한때 번성했던 토석인 광산이었지만, 세월이 흐르며 그 번영도 막을 내렸습니다. 그렇게 토석인 기계 대변자들이 떠나자 얼마 지나지 않아 코볼트들이 몰려들었습니다. 곧이어 일꾼들은 백성들 위에 우뚝 선 거한이자 폭군인 양초왕에게 탄압받기에 이르렀지요. 넘쳐나는 부는 오래 전에 빼앗겼습니다. 진정한 기회를 얻기 위해서는 마지막 남은 끔찍한 왕의 하수인들을 물리치고 겁에 질린 코볼트들을 해방하는 것입니다.",2651,5912531,5912549,5912510,5912540,0,0,0
1267,신성한 불꽃의 수도원,"신성한 불꽃의 수도원은 신비한 황제의 환영을 참오하는 열렬한 신자들을 위해 지어졌습니다. 그러나 수행사제들은 메렐다르 주민들의 믿음이 약하다며 업신여기는 마음을 갖게 되었고, 종국에는 거리를 두게 되었습니다. 이에 에트나 블레이즈 수녀는 머프레이 수도원장의 내부 성소에 어떤 비밀이 숨겨져 있는지 조사하기 위해 용사들에게 도움을 요청했습니다.",2649,5912533,5912551,5912512,5912542,0,0,0
1268,부화장,"폭풍횃대는 폭풍떼까마귀의 보금자리이자 부화장일 뿐만 아니라, 폭풍기수 바엘그림과 폭풍기수들의 막사요, 본부이기도 합니다. 폭풍횃대는 지난 수천 년 동안 토석인의 적에게 침범당하지 않고 자리를 지켰습니다. 하지만 애석하게도 내부로부터의 침입에는 취약하다는 단점이 있습니다.",2648,5912535,5912553,5912514,5912544,0,0,0
1269,바위금고,"기계 대변자는 각성의 전당과 인접한 시설인 바위금고를 관리합니다. 이들의 전 지도자였던 공허 대변자 에리히는 얼마 전 공허의 타락에 물들면서 축출당했습니다. 기계공들이 일하고, 충성파가 순찰하는 사이 에리히는 가장 광신적이고 타락한 추종자들 뒤에 숨어 있습니다. 티탄 땅굴에 들어간 그는 끔찍한 변화를 겪었습니다. 에리히가 두 번 다시 권력을 쥐지 못하게 막으려면 신속하게 개입해야 할 것입니다.",2652,5912536,5912554,5912515,5912545,0,0,0
1270,새벽인도자호,"아라시가 기함 새벽인도자호의 건조를 완료했습니다. 새벽인도자호는 아즈카헤트와의 끝없는 전쟁에서 전세를 역전시킬 화력을 갖춘 신형 전함 설계가 접목된 결실입니다. 진수식 시작을 앞둔 가운데, 스틸스트라이크 장군은 이 역사적인 행사에 이방인 영웅들을 초청했습니다.",2662,5912534,5912552,5912513,5912543,0,0,0
1271,메아리의 도시 아라카라,실타래의 도시 바로 아래에는 이전 층의 버려진 폐허인 메아리의 도시 아라카라가 있습니다. 안수레크의 군대는 이곳에서 네루비안 문명 전체를 승천시킬 위험한 재료를 채취하고 있습니다. 원하든 원치 않든 네루비안 문명 전체를 승천시킬 계획인 셈이지요.,2660,5912528,5912546,5912507,5912537,0,0,0
1272,잿불맥주 양조장,"경영진 전격 교체! 잿불맥주 양조장은 해방자 토석인 문화의 중심지로, 웬브랜트의 지도 아래 모든 토석인이 즐기는 화끈한 맥주를 제조해 왔습니다. 하지만 이 양조장은 고블린 기업가 골디 바론바텀의 적대적인 기업 인수의 희생양으로 전락해 버렸고, 골디 바론바텀은 잿불맥주 대량 생산이라는 새로운 시대를 열었습니다.",2661,5912529,5912547,5912508,5912538,0,0,0
1273,네룹아르 궁전,"아즈카헤트 왕국 깊숙한 곳에는 안수레크 여왕의 권좌인 네룹아르 궁전이 있습니다. 안수레크 여왕은 그림자가 드리운 이 왕좌에서 수레키 추종자들을 강력하게 휘어잡은 채 새로운 미래로 이어지는 어두운 길을 이끌고 있습니다. 그렇게 여왕의 피해망상이 중증으로 치닫는 가운데, 음모를 꾸미던 단절된 실톳은 안수레크의 통치에 맞서 최후의 승부수를 띄우기에 이르렀습니다.",2657,5912532,5912550,5912511,5912541,0,0,0
1274,실타래의 도시,"실타래의 도시 깊숙한 곳에는 한때 네루비안 진화의 신성한 전당이었던 변신소가 있습니다. 지금은 ""자격을 갖춘"" 네루비안을 강력한 승천자로 변신시키는 데 사용되고 있습니다. 방직공과 재상은 이 승천이 아즈카헤트를 모두 집어삼키기 전에 어떻게 해서든 막으려고 합니다.",2669,5912530,5912548,5912509,5912539,0,0,0
1276,혈투의 전장 - 굽이나무 지구,"수천 년 전 세워진 엘드탈라스는 칼도레이 비전 마법의 비밀을 간직한 위대한 도시였지만, 이제 폐허가 되어 뒤틀린 마력만이 이곳에 들끓고 있습니다. 한때는 사악한 무리들이 혈투의 전장에 넘치는 뒤틀린 마력을 손에 넣고자 서로 싸웠습니다. 그러나 이들은 결국엔 불안한 동맹을 맺고, 혈투의 전장 전체를 차지하려고 계속 싸우기보다는 자기 영토 안의 마력을 마음대로 사용하는 데 만족하기로 했습니다.",429,608161,608200,136333,608239,1,0,0
1277,혈투의 전장 - 고르독 광장,"수천 년 전 세워진 엘드탈라스는 칼도레이 비전 마법의 비밀을 간직한 위대한 도시였지만, 이제 폐허가 되어 뒤틀린 마력만이 이곳에 들끓고 있습니다. 한때는 사악한 무리들이 혈투의 전장에 넘치는 뒤틀린 마력을 손에 넣고자 서로 싸웠습니다. 그러나 이들은 결국엔 불안한 동맹을 맺고, 혈투의 전장 전체를 차지하려고 계속 싸우기보다는 자기 영토 안의 마력을 마음대로 사용하는 데 만족하기로 했습니다.",429,608161,608200,136333,608239,0,0,0
1278,카즈 알가르,"최근 카즈 알가르의 심연은 크나큰 혼란에 빠졌습니다. 중심로는 제 기능을 하지 못하게 되었고, 네루비안이 준동하고 있으며, 그 외에도 여러 위협이 기지개를 틀고 있습니다. 이에 잠자는 수호병 코르닥이 도른의 섬을 지키기 위해 깨어났습니다. 울리는 심연에서는 공포의 집합체가 기다리고 있으며, 신성한 협곡의 바다는 깊은 바다의 참변 슈라이로 인해 소란스럽기만 합니다. 그리고 아즈카헤트 깊은 곳에서는 검은 피에 뒤틀려 버린 부서진 산 오르타가 심연을 거닐고 있습니다.",2774,5917062,5917063,5917061,5917064,2,0,0
1292,스트라솔름 - 공무용 입구,"한때는 로데론 북부에서 보석처럼 빛나던 스트라솔름은 이제 이 도시를 폐허로 바꾼 끔찍한 사건으로만 기억되고 있습니다. 바로 이곳에서 아서스 왕자는 고귀한 성기사인 빛의 수호자 우서 경에게 등을 돌렸고, 무수한 시민을 끔찍한 언데드 역병에 걸렸다며 학살했습니다. 이 사건 이래, 저주받은 스트라솔름에는 죽음, 배신, 절망만이 들끓고 있습니다.",329,608177,608216,136359,608255,1,0,0
1296,언더마인 해방전선,"무역회사들이 의기투합하여 최선을 다했지만, 재스터 갤리윅스는 기어코 갤라지오에 틀어박혀 마지막 남은 패까지 전부 꺼내 들었습니다... 그리고 언더마인의 고블린들 앞에 크롬왕에게 향하는 길을 가로막는 압제자들이 무수히 나타났습니다. 이제 가즈로와 고블린들은 어떻게든 카지노에 진입해 갤리윅스를 완벽하게 축출할 방법을 찾아내야 합니다.",2769,6422377,6422411,6422371,6422409,0,0,32
1298,작전명: 수문,칼잡이 렌직이 동료들을 이끌고 다크퓨즈가 수력작업장 댐에서 비밀리에 진행 중인 사악한 음모의 온상에 침투했습니다. 이 모든 일의 배후에 있는 미치광이 과학자를 제압하고 갤리윅스의 악랄한 음모에 공급되는 전력을 차단해야 합니다.,2773,6422378,6422412,6422372,6422410,0,0,0
1301,검은바위 나락,"까맣게 그을린 검은바위 나락은 검은무쇠 드워프와 그들의 제왕, 다그란 타우릿산의 고향입니다. 전임자들과 마찬가지로 다그란은 수세기 전 이 세상에 소환된 무자비한 불의 군주 라그나로스를 섬깁니다. 혼돈의 정령들이 출몰하자 이에 이끌린 황혼의 망치단이 이 산을 찾아왔습니다. 라그나로스의 하수인들과 황혼의 망치단은 드워프가 추구하는 파괴적인 목표에 더욱 힘을 실어주었고, 이는 머지않아 온 아제로스에 파멸을 불러올지도 모릅니다.",2792,608157,608196,136326,608235,0,0,0
1302,마나괴철로 종극점,"크아레쉬의 황원에서 비전 마력을 끌어내기 위해 건설된 마나괴철로 종극점이 불길한 광휘를 내뿜으며 전율하고 있습니다. 연합왕 살라다르는 이 종극점을 발판으로 삼아, 만물의 포식자 디멘시우스를 되살려 궁극의 힘을 얻으려 하고 있습니다. 아제로스의 용사들은 마나괴철로 종극점의 작동을 저지해야 합니다. 실패하면 부활한 디멘시우스가 현실 그 자체를 집어삼킬 테니 말이지요.",2810,7049243,7050019,7049159,7049313,0,0,0
1303,생태지구 알다니,"생태지구는 크아레쉬에 생명을 돌려놓을 가장 큰 희망입니다. 그중에서도 생태지구 알다니는 크아레쉬에서 가장 거룩한 폐허 중 한 곳의 터에 세워졌죠. 하지만 황무지인의 침공으로 생태지구 외벽이 무너졌고, 이대로 가다간 파괴될지도 모릅니다. 베나리는 크아레쉬의 마지막 희망이 무너지지 않도록 도움을 요청했습니다.",2830,7074040,7074042,7074037,7074041,0,0,0
1310,제크비르의 소굴,,0,0,0,0,0,0,0,0
