ID,Text_lang,Title_lang,ConditionID
3,"겨울 여왕이 레벤드레스의 주인, 대영주 데나트리우스에게 전갈을 전해달라 부탁했습니다. 앞으로 벌어질 충돌에 대비하려면 그의 도움이 필요할 겁니다.",레벤드레스에 오신 것을 환영합니다,0
111,Test,,0
158,"승천의 보루가 이유 없이 습격을 받자, 당신은 말드락서스를 찾아가 어둠땅의 군대가 어둠땅을 지키겠다는 맹세를 어긴 이유를 밝히는 임무를 받았습니다.",고통의 용사,0
277,"당신이 회수한 도면과 갤멋죽포의 파괴적인 능력을 활용하여, 당신과 갤리윅스는 땜장이왕 멕카토크가 이용하던 비행선을 파괴하고 드러스트바에 대한 얼라이언스의 영향력을 크게 위축시키는 데 성공했습니다.",,0
1128,"카드가가 당신을 달라란으로 불러들였습니다. 검은 심장이란 강력한 유물을 손에 쥔 정체불명의 인물, 전령을 조사하는 데 도움이 필요하다고 합니다. 그뿐만 아니라, 카드가는 독특한 관점에서 사건을 바라볼 수 있는 알레리아 윈드러너에게도 도움을 요청해 둔 상태였습니다.",전령 추적,0
1254,당신은 아제로스 전역에서 들리는 불가사의한 광휘의 노래를 자세히 조사하기 위해 아제로스의 대변자 마그니를 찾아 실리더스를 찾아갔습니다.,광휘의 포효,0
1427,오르웨냐가 다른 누구도 아닌 갤리윅스의 기록을 찾아냈습니다. 기회 거점에서 벌어지는 각종 사업의 우두머리가 갤리윅스였던 것입니다. 오르웨냐의 걱정거리는 이게 끝이 아니었습니다. 거대한 동굴 벽 뒤쪽에서 불길한 소리가 들려오고 있었습니다. 지금으로선 목적을 알 수 없는 기계들이 땅을 파내고 있었습니다...,드러난 배후,0
1928,당신은 아제로스 전역에서 들리는 불가사의한 광휘의 노래를 자세히 조사하기 위해 아제로스의 대변자 마그니를 찾아 실리더스를 찾아갔습니다.,광휘의 포효,0
1966,"필요한 재료를 모으고 잃어버린 영혼들을 되찾은 당신은, 실바나스가 끝없이 이어온 고된 노력이 빚어낸 쓸쓸한 결실을 지켜볼 준비를 합니다.",,0
