Description_lang,Title_lang,ID,ScenarioID,CriteriatreeID,RewardQuestID,RelatedStep,Supersedes,OrderIndex,Flags,VisibilityPlayerConditionID,WidgetSetID
원시 딱딱가시 분쇄꾼을 따라가야 합니다.,적을 뒤따라,4261,1741,79968,0,0,0,1,0,0,0
원시 딱딱가시 분쇄꾼을 공격해야 합니다.,분쇄꾼과의 대결,4262,1741,79970,0,0,0,2,0,0,0
원시 딱딱가시 분쇄꾼을 따라 둥지로 가야 합니다.,둥지로!,4263,1741,79972,0,0,0,3,0,0,0
둥지에서 원시 딱딱가시 분쇄꾼을 처치해야 합니다.,분쇄꾼 처치,4264,1741,79974,0,0,0,4,0,0,0
공포의 치악룡 우두머리를 몰아내야 합니다.,적의 공격이다!,4265,1742,79976,0,0,0,0,0,0,0
공포의 치악룡 우두머리를 따라가야 합니다.,적을 뒤따라,4266,1742,79978,0,0,0,1,0,0,0
공포의 치악룡 우두머리를 공격해야 합니다.,우두머리와의 대결,4267,1742,79980,0,0,0,2,0,0,0
공포의 치악룡 우두머리를 따라 둥지로 가야 합니다.,둥지로!,4268,1742,79982,0,0,0,3,0,0,0
둥지에서 공포의 치악룡 우두머리를 처치해야 합니다.,우두머리 처치,4269,1742,79984,0,0,0,4,0,0,0
거대한 심연갈퀴 대왕비단뱀을 몰아내야 합니다.,적의 공격이다!,4270,1743,79986,0,0,0,0,0,0,0
거대한 심연갈퀴 대왕비단뱀을 따라가야 합니다.,적을 뒤따라,4271,1743,79988,0,0,0,1,0,0,0
거대한 심연갈퀴 대왕비단뱀을 공격해야 합니다.,거대한 심연갈퀴 대왕비단뱀과의 대결,4272,1743,79990,0,0,0,2,0,0,0
거대한 심연갈퀴 대왕비단뱀을 따라 둥지로 가야 합니다.,둥지로!,4273,1743,79992,0,0,0,3,0,0,0
둥지에서 거대한 심연갈퀴 대왕비단뱀을 처치해야 합니다.,대왕비단뱀 처치,4274,1743,79994,0,0,0,4,0,0,0
거대한 동굴 반짝껍질을 몰아내야 합니다.,적의 공격이다!,4275,1744,79996,0,0,0,0,0,0,0
거대한 동굴 반짝껍질을 따라가야 합니다.,적을 뒤따라,4276,1744,79998,0,0,0,1,0,0,0
거대한 동굴 반짝껍질을 공격해야 합니다.,반짝껍질 게와의 대결,4277,1744,80000,0,0,0,2,0,0,0
거대한 동굴 반짝껍질을 따라 둥지로 가야 합니다.,둥지로!,4278,1744,80002,0,0,0,3,0,0,0
둥지에서 거대한 동굴 반짝껍질을 처치해야 합니다.,반짝껍질 게 처치,4279,1744,80004,0,0,0,4,0,0,0
늙은 해구 가오리를 몰아내야 합니다.,적의 공격이다!,4280,1745,80006,0,0,0,0,0,0,0
강화된 거대 서슬껍질을 따라가야 합니다.,적을 뒤따라,4281,1745,80008,0,0,0,1,0,0,0
늙은 해구 가오리를 공격해야 합니다.,가오리와의 대결,4282,1745,80010,0,0,0,2,0,0,0
늙은 해구 가오리를 따라 둥지로 가야 합니다.,둥지로!,4283,1745,80012,0,0,0,3,0,0,0
둥지에서 늙은 해구 가오리를 처치해야 합니다.,가오리 처치,4284,1745,80014,0,0,0,4,0,0,0
침략하는 암초지기를 몰아내야 합니다.,적의 공격이다!,4285,1746,80016,0,0,0,0,0,0,0
침략하는 암초지기를 따라가야 합니다.,적을 뒤따라,4286,1746,80018,0,0,0,1,0,0,0
침략하는 암초지기를 공격해야 합니다.,암초지기와의 대결,4287,1746,80020,0,0,0,2,0,0,0
침략하는 암초지기를 따라 둥지로 가야 합니다.,둥지로!,4288,1746,80022,0,0,0,3,0,0,0
둥지에서 침략하는 암초지기를 처치해야 합니다.,암초지기 처치,4289,1746,80024,0,0,0,4,0,0,0
거대한 대왕뱀장어를 몰아내야 합니다.,적의 공격이다!,4290,1747,80026,0,0,0,0,0,0,0
거대한 대왕뱀장어를 따라가야 합니다.,적을 뒤따라,4291,1747,80028,0,0,0,1,0,0,0
거대한 대왕뱀장어를 공격해야 합니다.,거대한 대왕뱀장어와의 대결,4292,1747,80030,0,0,0,2,0,0,0
거대한 대왕뱀장어를 따라 둥지로 가야 합니다.,둥지로!,4293,1747,80032,0,0,0,3,0,0,0
둥지에서 거대한 대왕뱀장어를 처치해야 합니다.,거대한 대왕뱀장어 처치,4294,1747,80034,0,0,0,4,0,0,0
나가가 심연의 생물을 소환하고 있습니다. 저들을 처치해야 합니다!,소환 의식,4307,1754,80054,0,0,0,0,0,0,0
소환된 흉물을 쓰러뜨려야 합니다.,심연의 부름,4308,1754,80056,56830,0,0,1,4,0,0
아즈샤라 본인이 나타나 흉물을 강화했습니다. 어떻게 해서든 처치해야 합니다!,강화된 흉물,4309,1754,80058,56830,0,0,1,4,0,0
시초의 전당 안쪽 방으로 가야 합니다.,환영받지 못한 손님,4311,1755,80179,0,0,0,0,0,0,0
메카곤 공격을 이끌어야 합니다.,작전명: 메카곤,4312,1756,80185,0,0,0,0,0,0,0
주홍빛 보루 꼭대기의 비룡들을 풀어주어야 합니다.,타락 저지,4313,1729,80196,0,0,0,2,0,0,0
예언의 방의 방어 시스템을 비활성화해야 합니다.,영원한 감시,4316,1755,80261,0,0,0,1,0,0,0
감시자 아움카를 쓰러뜨리고 창조주의 오름길에 있는 승강기를 가동해야 합니다.,피조물 파괴,4317,1755,80265,0,0,0,3,0,0,0
빛의 전당의 동력 회로를 창조주의 오름길 단말기에 연결해야 합니다.,올라가기,4318,1755,80267,0,0,0,5,0,0,0
태양 예언자 텐하멘을 쓰러뜨려야 합니다.,꼭두각시 제거,4319,1755,80269,0,0,0,6,0,0,0
"승강기를 타고 창조주의 오름길 상층 방으로 이동한 후, 시초의 용광로를 재가동해야 합니다.",다시 시작되는 시초,4320,1755,80305,0,0,0,7,0,0,0
창조주의 오름길에 있는 승강기로 가야 합니다.,적개심의 전당,4321,1755,80263,0,0,0,2,0,0,0
썩은위액 누더기골렘을 쓰러뜨려야 합니다.,그저 놀고 싶을 뿐!,4322,1724,80424,0,0,0,1,0,0,0
지구라트를 지키는 떠도는 악령과 지하마귀를 쓰러뜨려야 합니다.,무서운 악령과 무시무시한 마귀,4323,1724,80426,0,0,0,2,0,0,0
심문관 리즈를 쓰러뜨려야 합니다.,고통받는 영혼,4324,1724,80431,0,0,0,3,0,0,0
학살의 광장 깊이 들어가야 합니다.,유령 따윈 무섭지 않아,4325,1724,80433,0,0,0,4,0,0,0
역병 걸린 생물을 쓰러뜨려야 합니다!,매복!,4326,1724,80437,0,0,0,5,0,0,0
되살아난 경비병을 쓰러뜨려야 합니다.,왜 죽은 것들은 줄어들지 않지,4327,1724,80439,0,0,0,6,0,0,0
세상에서 가장 작은 강령술사가 길을 가로막고 있습니다. 그를 저지해야 합니다!,몸집은 작지만 엄청 사악하다구!,4328,1724,80441,0,0,0,7,0,0,0
썩은위액 누더기골렘을 조종하여 안뜰을 소탕해야 합니다!,통제된 혼돈,4329,1724,80443,0,0,0,8,0,0,0
도살장에 들어가 마지막 적과 대면해야 합니다!,도살장으로!,4331,1724,80444,0,0,0,9,0,0,0
정체불명의 인물이 돌아왔습니다! 이것 참 큰일이군요.,어둠의 귀환,4332,1724,80447,0,0,0,10,0,0,0
모구샨 궁전 지하로 내려갈 길을 찾아야 합니다.,아래로 뻗은 길,4336,1757,81246,0,0,0,0,0,0,0
진홍빛 회합 전당에 있는 고대 도르래를 가동해야 합니다.,발조심,4340,1757,81248,0,0,0,1,0,0,0
잊혀진 통로의 봉인된 문을 열 방법을 찾아야 합니다.,육중한 문제,4341,1757,81250,0,0,0,2,0,0,0
잊혀진 통로에서 비밀 경로를 통해 모구샨 금고로 가야 합니다.,길고 긴 여정,4342,1757,81252,0,0,0,3,0,0,0
보관소로 소환되는 느조스의 현신을 제거해야 합니다.,광기의 현신,4343,1757,81254,0,0,0,4,0,0,0
구체자의 전당에 도사리는 사마귀 병력을 돌파하고 나락샤의 동력장치로 가야 합니다.,구체자의 전당,4344,1757,81256,0,0,0,5,0,0,0
나락샤의 동력장치에서 요시스를 쓰러뜨려야 합니다.,최후의 소환,4345,1757,81258,0,0,0,6,0,0,0
나락샤의 동력장치를 심장의 방에 연결해야 합니다.,맥동하는 동력장치,4346,1757,81260,0,0,0,7,0,0,0
,마을회관 조사,4349,1759,81432,0,0,0,0,0,0,0
,괴수 쓰러뜨리기,4350,1759,81434,0,0,0,1,0,0,0
,박탈자 쓰러뜨리기,4351,1759,81747,0,0,0,2,0,0,0
,령 줄기 획득,4352,1759,81845,0,0,0,3,0,0,0
,제이나의 파편 찾기,4353,1759,81847,0,0,0,4,0,0,0
,제이나의 파편 놓기,4354,1759,81849,0,0,0,5,0,0,0
보상을 획득하고 환영에서 나가야 합니다.,보상 획득,4355,1733,83405,0,0,0,2,0,0,244
아즈샤라 여왕의 권좌에 공격을 쏟아부을 순간이 다가왔습니다.,성대한 환영,4356,1760,81865,0,0,0,0,0,0,0
"영원한 궁전 회랑의 깊은 곳, 여왕 아즈샤라의 충성스러운 부관들이 여러분의 공격을 저지하기 위해 나섭니다.",헌신한 자의 심연,4357,1761,81871,0,0,0,0,0,0,0
아즈샤라 여왕의 의식이 끝을 향해가자 심연 속에서 알 수 없는 힘이 꿈틀댑니다.,별들의 원,4358,1762,81875,0,0,0,0,0,0,0
아마셋이 시초의 전당을 돌파해 시초 프로토콜을 시작하지 못하도록 저지해야 합니다.,광휘의 칼날,4359,1763,82034,0,0,0,0,0,0,0
살점분리자의 작업장과 포식자의 굴에 있는 실험물을 조사하고 제거해야 합니다.,실험의 난관,4361,1764,82046,0,0,0,2,0,0,0
암흑불길 석실로 가야 합니다.,무단 침입,4362,1764,82052,0,0,0,0,0,0,0
래시온과 대화하여 의식을 시작해야 합니다.,화염의 의식,4364,1764,82250,0,0,0,8,0,0,0
오닉시아와 네파리안의 유해를 파괴해야 합니다.,예방 조치,4365,1764,82073,0,0,0,9,0,0,0
타락한 검은용 비늘을 회수해야 합니다.,타락의 비늘,4366,1764,82058,0,0,0,10,0,0,0
부두에서 가즈로와 대화해야 합니다.,적대적 인수,4367,1765,82082,0,0,0,0,0,0,0
호바트 그래플해머를 구출해야 합니다.,인질극,4368,1765,82084,0,0,0,1,0,0,0
X-52 방어구를 착용해야 합니다.,출동 준비 완료!,4369,1765,82086,0,0,0,2,0,0,0
도서관을 조사해야 합니다.,도서관,4370,1764,82075,0,0,0,5,0,0,0
도서관에 있는 타락한 실험체를 제거해야 합니다.,뒤틀린 실험,4371,1764,82077,0,0,0,6,0,0,0
보상을 획득하고 환영에서 나가야 합니다.,보상 획득,4373,1731,83403,0,0,0,2,0,0,458
갤리윅스를 쓰러뜨려야 합니다.,마을 탈환,4374,1765,82088,0,0,0,3,0,0,0
느조스의 환영에 다시 들어가야 합니다.,환영 속으로,4375,1766,82097,0,0,0,0,0,0,0
창조주의 오름길에 있는 현신을 쓰러뜨려야 합니다.,어둠의 현신,4376,1766,82099,0,0,0,2,0,0,0
창조주의 오름길에 있는 승강기를 사용해 이상 현상을 찾아야 합니다.,최후의 승천,4377,1766,82105,0,0,0,3,0,0,0
시초의 용광로에 있는 변형체를 쓰러뜨려야 합니다.,동력 복구,4378,1766,82103,0,0,0,4,0,0,0
하부 복도로 통하는 길을 막고 있는 보호막을 파괴해야 합니다.,광기의 내리막길,4380,1766,82119,0,0,0,1,0,0,0
의식을 막고 래시온을 풀어주어야 합니다.,어둠의 굴레를 벗어던지고,4381,1764,82054,0,0,0,7,0,0,0
암흑불길 석실의 마법 보호막에서 래시온을 만나야 합니다.,기묘한 마법,4382,1764,82153,0,0,0,3,0,0,0
래시온이 보호막을 해제하는 동안 그를 보호해야 합니다.,집중의 실마리,4383,1764,82246,0,0,0,4,0,0,0
빛의 전당에서 창조주의 오름길에 사용되는 동력 단말기를 찾아야 합니다.,동력 부족,4387,1755,82518,0,0,0,4,0,0,0
왕자 레나탈에게 충성을 바치는 돌숨결을 깨워야 합니다.,군대의 각성,4388,1767,82522,0,0,0,1,0,0,0
지배의 성문에서 왕자 레나탈과 동료를 만나야 합니다.,지배의 성문 집결,4389,1767,82524,0,0,0,2,0,0,0
지배의 성문 건너편에 도달해야 합니다.,돌 군단의 시련,4390,1767,82530,0,0,0,3,0,0,0
장군 카알을 쓰러뜨려야 합니다.,돌 군단의 장군,4391,1767,82536,0,0,0,4,0,0,0
령 전환기를 비활성화해야 합니다.,저주받은 자에게 저주를,4392,1767,82532,0,0,0,5,0,0,0
레나탈과 수확자들을 따라 최후의 공격을 감행해야 합니다.,주인,4393,1767,82534,0,0,0,7,0,0,0
,작전명: 메카곤,4394,1768,82551,53623,0,0,0,0,0,0
,작전명: 메카곤,4395,1768,82556,53623,0,0,0,0,0,0
,작전명: 메카곤,4396,1769,82541,53623,0,0,0,0,0,0
,작전명: 메카곤,4397,1769,82546,53623,0,0,0,0,0,0
늘 존재감을 과시하는 HK-8 공중 압박 유닛으로부터 녹슨나사 저항군을 구원해야 합니다.,작전명: 메카곤 - 고철장,4398,1770,82561,53623,0,0,0,0,0,0
,작전명: 메카곤 - 작업장,4399,1771,82566,53623,0,0,0,0,0,0
느조스는 암흑의 권좌에 앉아 아제로스가 몰락하고 자신의 제국에 저항할 이는 단 한 명도 남지 않은 미래를 그리고 있습니다.,운명의 환영,4404,1773,82602,0,0,0,0,0,0,0
어두컴컴한 전당에서 느조스의 헌신적인 신봉자들은 세상의 멸망을 초래할 불경한 의식을 거행합니다.,헌신의 전당,4405,1774,82606,0,0,0,0,0,0,0
뒤틀린 살점의 균열 깊고 깊은 곳에 파묻힌 일기노스의 타락은 다음 세계를 향해 끊임없이 퍼져나갈 뿐입니다.,육체의 축복,4406,1775,82611,0,0,0,0,0,0,0
"쌓아 올린 오물의 기념비 심층부에는 타락자가 기거하며, 그곳에서 아제로스의 운명을 결정지을 최후의 전투가 펼쳐질 것입니다.",깨어나는 꿈,4407,1776,82615,0,0,0,0,0,0,0
투기장에 들어가야 합니다.,그림자의 소굴,4408,1777,82988,0,0,0,0,0,0,0
성채 꼭대기로 올라가 고르그로스의 불경한 의식을 저지해야 합니다.,암흑망치 성채,4411,1779,82985,0,0,0,0,0,0,0
애완동물 대전에서 호루 클라우드와처를 꺾어야 합니다.,첫 번째 도전자,4412,1777,82990,0,0,0,1,0,0,0
풀려난 야수를 쓰러뜨려야 합니다.,죽어도 못 갇혀,4413,1777,82992,0,0,0,2,0,0,0
애완동물 대전에서 테린 스카이송을 꺾어야 합니다.,부질없는 저항,4414,1777,82994,0,0,0,3,0,0,0
풀려난 생명체를 쓰러뜨려야 합니다.,궁여지책,4415,1777,82996,0,0,0,4,0,0,0
애완동물 대전에서 알란 하트셰이드를 꺾어야 합니다.,새로운 계획,4416,1777,82999,0,0,0,5,0,0,0
애완동물 대전에서 주나 스컬크러쉬를 꺾어야 합니다.,한바탕 부숴볼까,4417,1777,83001,0,0,0,6,0,0,0
애완동물 대전에서 타샤 라일리를 꺾어야 합니다.,최후의 순간,4418,1777,83003,0,0,0,7,0,0,0
"픽시 위즐과 ""강력한 병기""에 맞서 결전을 치러야 합니다.",저런 거에 몇 년을 쏟았단 말이야?,4419,1777,83005,0,0,0,8,0,0,0
심장의 방을 방어해야 합니다.,심장의 방 방어,4420,1780,83067,0,0,0,0,0,0,0
엘룬의 사원 공격을 시작해야 합니다.,엘룬의 사원,4421,1781,83093,0,0,0,0,0,0,0
엘룬의 사원을 지키는 수호병을 처치해야 합니다.,이세라의 몰락,4422,1781,83205,0,0,0,1,0,0,0
조사를 이어나가야 합니다.,꼼꼼한 조사,4424,1764,82056,0,0,0,1,0,0,0
대지공포가 당신의 죽음에 이끌렸습니다! 그가 도착하기 전에 다음 층으로 넘어가야 합니다!,서두르십시오!,4425,1712,83466,0,0,0,1,0,0,291
상부 단상을 돌파해야 합니다.,조각이 떨어진 곳,4426,1782,83721,0,0,0,0,0,0,0
뼈장장이 에어미르를 도와야 합니다.,시초자의 후예,4427,1782,83506,0,0,0,1,0,0,0
전쟁 야수를 풀어줘야 합니다.,지옥개를 풀어라!,4428,1782,83504,0,0,0,2,0,0,0
알렉산드로스 및 남작 바쉬의 병력과 재집결해야 합니다.,대영주와 여군주,4429,1782,83508,0,0,0,3,0,0,0
선택받은 자의 의회에서 탈출해야 합니다.,용기가 당신의 검을 인도하리니,4430,1782,83511,0,0,0,4,0,0,0
메릴레트의 '실험'을 도와야 합니다.,부식성 화학 교실,4431,1782,83728,0,0,0,5,0,0,0
성소를 방어해야 합니다.,우린 함께 나아가리!,4432,1782,83803,0,0,0,6,0,0,0
후작 크렉서스를 쓰러뜨려야 합니다.,한 문이 닫히면...,4433,1782,83726,0,0,0,7,0,0,0
티르너 글레인에 있는 모든 침략자를 내몰아야 합니다.,숲 탈환,4434,1783,83609,0,0,0,0,0,0,0
니야의 덫을 사용해 북쪽 관문을 방어해야 합니다.,북쪽 관문,4435,1783,83611,0,0,0,1,0,0,0
드림위버와 함께 동쪽 관문의 페이를 치유해야 합니다.,동쪽 문,4436,1783,83661,0,0,0,2,0,0,0
코레인과 함께 티르너 글레인 서쪽 관문을 방어해야 합니다.,서쪽 관문,4437,1783,83671,0,0,0,3,0,0,0
잉그라 사오르를 쓰러뜨려야 합니다.,흡수자 사오르,4438,1783,83704,0,0,0,4,0,0,0
이세라의 번데기를 수레에 실어야 합니다.,위험 화물,4440,1783,84551,0,0,0,5,0,0,0
수레에 올라타 티르너 글레인을 탈출해야 합니다.,전원 탑승,4441,1783,84556,0,0,0,6,0,0,0
숲의 심장부로 피신해야 합니다.,환생의 길,4442,1783,84558,0,0,0,7,0,0,0
기억을 조사해야 합니다.,잃어버린 대의,4443,1784,83731,0,0,0,0,0,0,0
다음 기억을 찾아야 합니다.,필사적인 도박,4444,1784,83733,0,0,0,1,0,0,0
다음 기억을 찾아야 합니다.,만들어진 평화,4445,1784,83735,0,0,0,2,0,0,0
다음 기억을 찾아야 합니다.,갈림길,4446,1784,83737,0,0,0,3,0,0,0
다음 기억을 찾아야 합니다.,희생의 대가,4447,1784,83739,0,0,0,4,0,0,0
밤 전사의 마지막 순간을 다시 체험해야 합니다.,달의 죽음,4448,1784,83794,0,0,0,5,0,0,0
토르가스트에서 티란데 위스퍼윈드를 찾아야 합니다.,티란데 위스퍼윈드 찾기,4449,1785,84670,0,0,0,0,0,0,0
티란데를 도와 나락의 암살자를 쓰러뜨려야 합니다.,나락의 전사 격퇴,4450,1785,84672,0,0,0,1,0,0,0
티란데가 멈추질 않습니다. 최대한 뒤따라가야 합니다.,티란데 위스퍼윈드 따라잡기,4451,1785,84674,0,0,0,2,0,0,0
티란데가 앞으로 달려 나갔습니다. 몰려드는 나락의 하수인을 처리해야 합니다!,나락의 잠복꾼 쓰러뜨리기,4452,1785,84676,0,0,0,3,0,0,0
티란데가 전방에 있습니다. 어떻게든 따라잡아야 합니다!,티란데 따라잡기,4453,1785,84678,0,0,0,4,0,0,0
티란데가 정면으로 돌파했습니다. 그녀를 따라잡을 다른 방법을 강구해야 합니다.,티란데에게 이르는 새로운 길,4454,1785,84699,0,0,0,5,0,0,0
스컬드가 길을 가로막고 있습니다!,스컬드 처치,4455,1785,84707,0,0,0,6,0,0,0
티란데가 앞에 있습니다. 반드시 찾아야 합니다!,티란데 따라잡기,4456,1785,84719,0,0,0,7,0,0,0
나락이 고초에 시달린 나이트 엘프 영혼으로 융합체를 만들어 냈습니다. 티란데를 도와 무찔러야 합니다.,고통받는 융합체 쓰러뜨리기,4457,1785,84721,0,0,0,8,0,0,0
핏빛 심연 깊은 곳으로 들어가 동료를 구출해야 합니다.,핏빛 심연,4458,1786,84682,62658,0,0,0,0,0,0
핏빛 심연 깊은 곳으로 들어가 동료를 구출해야 합니다.,핏빛 심연,4460,1788,84687,62658,0,0,0,0,0,0
핏빛 심연 깊은 곳으로 들어가 동료를 구출해야 합니다.,핏빛 심연,4461,1789,84692,62658,0,0,0,0,0,0
충성의 성채로 진군해야 합니다.,작은 발걸음,4462,1790,84725,0,0,0,0,0,0,0
궁정을 준비하고 고용인에게 명령을 내려야 합니다.,막바지 준비,4463,1791,84766,0,0,0,0,0,0,459
의식의 의회에서 켈투자드와 대면해야 합니다.,역경을 무릅쓰고,4465,1792,84792,0,0,0,0,0,0,0
강화된 남작 니나다르를 처치해야 합니다.,남작 니나다르의 마지막 수업,4466,1792,84794,0,0,0,3,0,0,0
시초의 영소의 의식을 멈춰야 합니다.,시초의 영소,4467,1792,84797,0,0,0,4,0,0,0
말드락서스에서 켈투자드의 권모술수에 종언을 고해야 합니다.,켈투자드의 세 번째 몰락,4468,1792,84800,0,0,0,6,0,0,0
말드락서스 최초의 휴전 협정을 목격해야 합니다.,말드락시의 휴전,4470,1792,84806,0,0,0,7,0,0,0
안마당을 소탕해야 합니다.,의심은 없다,4471,1790,84818,0,0,0,1,0,0,0
아도니아스와 페드라를 쓰러뜨려야 합니다.,어두운 계략,4472,1790,84822,0,0,0,2,0,0,0
진실의 인도자를 향해 진군해야 합니다.,기회를 노린 공격,4473,1790,84826,0,0,0,3,0,0,0
이탈자가 진실의 인도자를 활성화하지 못하도록 막아야 합니다.,옛 친구,4475,1790,84830,0,0,0,4,0,0,0
나락 불지옥악마를 처치해야 합니다.,시초의 영소,4476,1792,84834,0,0,0,5,0,0,0
손님이 연회를 즐길 수 있도록 살펴야 합니다!,궁정,4483,1791,84846,0,0,0,1,0,0,461
손님이 남긴 공물을 획득해야 합니다.,공물,4484,1791,84848,0,0,0,2,0,0,0
사원으로 통하는 관문을 사용해야 합니다.,길을 따라서,4496,1790,84889,0,0,0,5,0,0,0
리소니아와 대면해야 합니다.,어둠의 영지,4497,1790,84891,0,0,0,6,0,0,0
엘리시안 요새 방어 시설로 집결해야 합니다!,현명한 계책,4498,1790,84893,0,0,0,7,0,0,0
리소니아를 완전히 쓰러뜨려야 합니다.,더 큰 대의,4499,1790,84895,0,0,0,8,0,0,0
말드락서스 병력의 손아귀에서 용기의 사원을 탈환해야 합니다!,죽음의 상흔,4500,1793,84930,62658,0,0,0,0,0,0
이세라에게 드러스트 병력 처단을 지시해야 합니다.,통로 확보,4501,1794,84993,0,0,0,0,0,0,0
겨울 여왕에게 어둠마루에서 있었던 일을 알려야 합니다.,겨울 여왕에게 보고,4502,1794,84995,0,0,0,1,0,0,0
야생 사냥단을 각성의 숲으로 이끌어야 합니다.,약진 앞으로!,4504,1794,84997,0,0,0,3,0,0,0
여왕과 대화해야 합니다.,여왕의 명령,4505,1794,85002,0,0,0,4,0,0,0
궁정이 각성의 숲을 다시 제어할 수 있도록 도와야 합니다.,힘의 반전,4506,1794,85004,0,0,0,5,0,0,0
각성의 숲의 힘을 되찾았습니다! 겨울 여왕에게 돌아간 후 고라크 자르를 격파해야 합니다!,여왕님과 숲을 위하여,4507,1794,85009,0,0,0,6,0,0,0
집정관의 권좌로 올라가 데보스를 처단해야 합니다.,승천의 첨탑,4508,1795,85026,62658,0,0,0,0,0,0
집정관의 권좌로 올라가 데보스를 처단해야 합니다.,승천의 첨탑,4509,1796,85031,0,0,0,0,0,0,0
여왕의 축복을 받아야 합니다.,여왕의 축복 받기,4511,1794,85057,0,0,0,2,0,0,0
레벤드레스에서 시종장을 쓰러뜨리고 속죄의 전당의 질서를 원래대로 돌려놓아야 합니다.,속죄의 전당,4515,1798,85156,62658,0,0,0,0,0,0
레벤드레스에서 시종장을 쓰러뜨리고 속죄의 전당의 질서를 원래대로 돌려놓아야 합니다.,속죄의 전당,4516,1799,85161,62658,0,0,0,0,0,0
레벤드레스에서 시종장을 쓰러뜨리고 속죄의 전당의 질서를 원래대로 돌려놓아야 합니다.,속죄의 전당,4517,1800,85166,62658,0,0,0,0,0,0
말드락서스 병력의 손아귀에서 용기의 사원을 탈환해야 합니다!,죽음의 상흔,4518,1801,85299,62658,0,0,0,0,0,0
말드락서스 병력의 손아귀에서 용기의 사원을 탈환해야 합니다!,죽음의 상흔,4519,1802,85304,62658,0,0,0,0,0,0
전투를 준비해야 합니다!,전투 준비,4521,1803,85338,0,0,0,0,0,0,0
수확자의 궁정에서 왕자 레나탈을 만나야 합니다.,반란군 결집,4523,1767,85505,0,0,0,0,0,0,0
역병의 근원을 제거하여 말드락서스에 퍼지지 않도록 막아야 합니다!,역병 몰락지,4524,1804,85515,62658,0,0,0,0,0,0
역병의 근원을 제거하여 말드락서스에 퍼지지 않도록 막아야 합니다!,역병 몰락지,4525,1805,85520,62658,0,0,0,0,0,0
말드락서스에 역병이 창궐하지 않도록 막아야 합니다!,역병 몰락지,4526,1806,85525,62658,0,0,0,0,0,0
긴장을 풀고 남은 음식을 즐겨야 합니다. 얼마든지 머물러도 좋습니다!,연회가 끝나고 난 뒤,4527,1791,85576,0,0,0,3,0,0,0
숙련된 강령술사를 심문하여 켈투자드의 위치를 알아내야 합니다.,죽음의 요새 탈취 작전,4535,1808,85611,0,0,0,0,0,0,0
장군 드레이븐을 도와 하늘의 적을 소탕해야 합니다.,하늘 높이!,4536,1808,85613,0,0,0,1,0,0,0
지상의 아군과 대화하여 진군 방안을 논의해야 합니다.,지상의 신호,4537,1808,85615,0,0,0,2,0,0,0
죽음의 수정을 파괴하여 아군을 되살려야 합니다.,아군 되살리기,4538,1808,85617,0,0,0,3,0,0,0
아군을 도와 나락 불지옥악마를 쓰러뜨려야 합니다.,협동전,4539,1808,85619,0,0,0,4,0,0,0
켈투자드에게서 지배의 메달을 되찾아야 합니다.,지배의 메달,4540,1808,85621,0,0,0,5,0,0,0
상대방과 대면해야 합니다!,전투,4542,1803,85638,0,0,0,1,0,0,0
승리 보상을 획득해야 합니다!,보상,4543,1803,85650,0,0,0,2,0,0,0
무릇 패배는 발전의 밑거름이 되기 마련입니다. 보상을 획득해야 합니다.,보상,4544,1803,85741,0,0,0,3,0,0,0
말드락서스의 시련을 극복하고 힘을 증명해 보여야 합니다!,고통의 투기장,4545,1809,85690,62658,0,0,0,0,0,0
말드락서스의 시련을 극복하고 힘을 증명해 보여야 합니다!,고통의 투기장,4547,1811,85696,62658,0,0,0,0,0,0
말드락서스의 시련을 극복하고 힘을 증명해 보여야 합니다!,고통의 투기장,4548,1812,85702,62658,0,0,0,0,0,0
"전투는 승리로 끝났지만, 과연 티란데는 어떻게 될까요?",티란데 위스퍼윈드의 거부,4549,1785,85749,0,0,0,9,0,0,0
"비록 티란데는 없지만, 나락에 갇힌 나이트 엘프를 구할 기회는 아직 남아 있습니다.",나이트 엘프의 구원,4550,1785,85751,0,0,0,10,0,0,0
트레도바를 쓰러뜨리고 티르너 사이드를 구해야 합니다.,티르너 사이드의 안개,4551,1813,85764,0,0,0,0,0,0,0
겨울 여왕과 대화하여 떠나야 합니다.,평온으로의 귀환,4552,1794,85771,0,0,0,7,0,0,0
말드락서스 병력의 손아귀에서 용기의 사원을 탈환해야 합니다!,죽음의 상흔,4553,1814,85773,0,0,0,0,0,0,0
저편으로 이동해 브원삼디를 도와 원시의 로아 무에젤라와 맞서 싸워야 합니다.,저편,4554,1815,85781,0,0,0,0,0,0,0
레벤드레스에서 시종장을 쓰러뜨리고 속죄의 전당의 질서를 원래대로 돌려놓아야 합니다.,속죄의 전당,4555,1816,85788,0,0,0,0,0,0,0
