Description_lang,Title_lang,ID,ScenarioID,CriteriatreeID,RewardQuestID,RelatedStep,Supersedes,OrderIndex,Flags,VisibilityPlayerConditionID,WidgetSetID
영혼지킴이가 무아지경 상태입니다. 그의 허리띠에 매달려 있는 열쇠를 얻어야 합니다.,열쇠,2364,1078,47360,0,0,0,1,0,0,0
아카리가 심문관 지러스를 보내 당신을 저지하려 합니다.,기만자의 눈,2366,1078,47364,0,0,0,3,0,0,0
성채 꼭대기에 있는 아카리 섀도고어를 찾아야 합니다.,등반,2367,1078,47366,0,0,0,4,0,0,0
아카리 섀도고어를 처치해야 합니다.,운명의 대결,2368,1078,47368,0,0,0,5,0,0,0
포식자의 송곳니를 획득해야 합니다.,어둠의 대가,2369,1078,47370,0,0,0,6,0,0,0
새로 배운 모든 기술을 표적 허수아비에 사용해야 합니다.,종합주문세트,2370,1073,47372,0,0,0,5,0,0,0
비행선을 떠나 공격에 참여해야 합니다.,사령관의 명령서,2371,1073,49710,0,0,0,12,0,0,0
그하니르 - 어머니 나무를 손에 넣어야 합니다.,부활한 그하니르,2372,1061,47101,0,0,0,5,0,0,0
감시의 언덕을 위협하는 군단 사령관을 처치해야 합니다.,악마 사령관 처치,2373,897,47385,43242,0,0,1,0,0,0
자신의 가치를 증명하고 아그라마르의 아이기스를 차지하십시오.,용맹의 전당,2389,1046,47415,0,0,0,0,0,0,0
방패의 안식처에 도착했습니다. 오리크를 만난 다음 무덤으로 들어갈 준비를 해야 합니다.,섬 도착,2390,1082,47433,0,0,0,0,0,0,0
무덤 내부에 진실의 수호자의 제단이 있습니다. 앞을 가로막는 방어자들을 극복하고 제단을 찾아야 합니다.,무덤 속으로,2391,1082,47435,0,0,0,1,0,0,0
제단으로 향하는 길이 열렸습니다. 아래쪽 어딘가에 있는 방패를 찾아야 합니다.,진실의 수호자의 제단,2392,1082,47521,0,0,0,3,0,0,0
야수 부르기에 대해 배워야 합니다.,친구 부르기,2393,1083,47479,0,0,0,1,0,0,0
진실의 수호자를 지키는 위르그림이 전투의 시험을 제안했습니다. 위르그림의 도전을 통과하여 그의 호의를 얻어야 합니다.,위르그림의 도전,2394,1082,47523,0,0,0,4,0,0,0
시험이 끝났습니다. 진실의 수호자를 들어올리십시오.,진실의 수호자,2395,1082,47525,0,0,0,5,0,0,0
공허방랑자를 소환하는 법을 배워야 합니다.,명령을 따르는 악마,2396,1084,47439,0,0,0,1,0,0,0
불안정한 고통에 대해 배워야 합니다.,불안정한 시작,2397,1084,47447,0,0,0,2,0,0,0
고통과 부패에 대해 배워야 합니다.,통렬한 고통,2398,1084,47441,0,0,0,3,0,0,0
어둠의 화살에 대해 배워야 합니다.,어둠을 부르는 자,2399,1084,66211,0,0,0,5,0,0,0
사악한 환희에 대해 배워야 합니다.,환희 어린 고뇌,2400,1084,85154,0,0,0,4,0,0,0
새로 배운 모든 기술을 표적 허수아비에 사용해야 합니다.,종합주문세트,2401,1084,47449,0,0,0,6,0,0,0
생명력 흡수에 대해 배워야 합니다.,생명력 훔치기,2402,1084,47445,0,0,0,7,0,0,0
공포에 대해 배워야 합니다.,공포,2403,1084,47456,0,0,0,8,0,0,0
비행선을 지켜야 합니다!,공격 막아내기,2404,1084,67030,0,0,0,11,0,0,0
비행선을 떠나 공격에 참여해야 합니다.,사령관의 명령서,2405,1084,49636,0,0,0,12,0,0,0
당신은 전투 중 흩어진 아군을 찾으려고 불타는 군단의 함선에 왔습니다. 구원자 보로스가 원기를 회복하는 것을 도와야 합니다.,구원자 보로스 치유,2406,1085,47496,0,0,0,0,0,0,0
제단으로 통하는 문이 첫 번째 시험입니다. 시험에서 살아남으십시오.,문 열기,2407,1082,47505,0,0,0,2,0,0,0
살상 명령에 대해 배워야 합니다.,"착하지, 물어!",2408,1083,47481,0,0,0,2,0,0,0
날카로운 사격에 대해 배워야 합니다.,날카로운 공격,2409,1083,67886,0,0,0,3,0,0,0
코브라 사격에 대해 배워야 합니다.,코브라의 일격,2410,1083,47485,0,0,0,4,0,0,0
야수의 격노에 대해 배워야 합니다.,드러난 광기,2411,1083,47487,0,0,0,5,0,0,0
새로 배운 모든 기술을 표적 허수아비에 사용해야 합니다.,종합주문세트,2412,1083,47489,0,0,0,6,0,0,0
일제 사격에 대해 배워야 합니다.,집중 사격,2413,1083,47514,0,0,0,7,0,0,0
죽은 척하기에 대해 배워야 합니다.,죽은 척하기,2414,1083,47499,0,0,0,8,0,0,0
비행선을 지켜야 합니다!,공격 막아내기,2415,1083,66958,0,0,0,11,0,0,0
비행선을 떠나 공격에 참여해야 합니다.,사령관의 명령서,2416,1083,49657,0,0,0,12,0,0,0
우리를 열어 사로잡힌 포로를 해방한 다음 대장 나라노스를 처치해야 합니다.,도움이 필요한 친구,2417,1085,47560,0,0,0,3,0,0,0
구원자 보로스를 따라가서 제이스를 도와야 합니다.,구출의 손길,2421,1085,47517,0,0,0,1,0,0,0
어둠의 권능: 고통에 대해 배워야 합니다.,고통의 결실,2422,1090,48723,0,0,0,1,0,0,0
전쟁군주 볼룬드가 당신이 티탄분쇄자를 차지하는 것을 저지하려 합니다.,볼룬드의 최후의 저항,2423,1068,47556,0,0,0,4,0,0,0
순간이동 장치를 사용하여 울두아르에 있는 미미론에게 가야 합니다.,기계노움의 부름,2424,1068,47558,0,0,0,5,0,0,0
아군의 도움을 받아 여군주 칼린드리스를 처치해야 합니다.,악의 소굴,2425,1085,47655,0,0,0,5,0,0,0
여군주 칼린드리스가 죽었으니 그 지팡이는 이제 당신의 것입니다. 지팡이를 가지고 니스카라를 떠나야 합니다.,다시 켜진 봉화,2426,1085,47678,0,0,0,6,0,0,0
화염 충격에 대해 배워야 합니다.,뜨거운 맛,2427,1091,47776,0,0,0,1,0,0,0
돌진에 대해 배워야 합니다.,일단 돌진,2428,1093,48065,0,0,0,1,0,0,0
시체 되살리기에 대해 배워야 합니다.,망자의 부활,2429,1094,49046,0,0,0,1,0,0,0
범의 장풍에 대해 배워야 합니다.,가혹한 일격,2430,1095,48408,0,0,0,1,0,0,0
표범 변신에 대해 배워야 합니다.,날렵한 움직임,2431,1096,48480,0,0,0,1,0,0,0
용암 폭발에 대해 배워야 합니다.,치솟는 용암,2432,1091,47778,0,0,0,2,0,0,0
번개 화살에 대해 배워야 합니다.,파지직!,2433,1091,47782,0,0,0,3,0,0,0
대지 충격에 대해 배워야 합니다.,요동하는 대지,2434,1091,47784,0,0,0,4,0,0,0
새로 배운 모든 기술을 표적 허수아비에 사용해야 합니다.,종합주문세트,2435,1091,47786,0,0,0,5,0,0,0
사술에 대해 배워야 합니다.,"개굴, 개굴",2436,1091,47791,0,0,0,6,0,0,0
연쇄 번개에 대해 배워야 합니다.,충격적인 세계,2437,1091,47793,0,0,0,7,0,0,0
치유의 파도에 대해 배워야 합니다.,상처 돌보기,2438,1091,47795,0,0,0,8,0,0,0
배운 것을 활용하여 적 한 명을 물리쳐야 합니다.,깜짝 시험,2439,1091,50133,0,0,0,10,0,0,0
배운 것을 활용하여 적 두 명과 동시에 싸워야 합니다.,난이도 두 배,2440,1091,50131,0,0,0,11,0,0,0
아군을 도와 불타는 군단 함선 선창에서 탈출해야 합니다.,탈출,2441,1085,47881,0,0,0,2,0,0,0
트래바드와 그의 동료들이 버려진 황혼의 야영지에서 준비를 마쳤습니다. 트래바드를 만나야 합니다.,버려진 야영지,2442,1092,47890,0,0,0,0,0,0,0
해골은 지옥영혼 요새 안에 있을 겁니다. 길을 따라가며 해골을 찾아야 합니다.,요새 수색,2443,1097,47894,0,0,0,0,0,0,0
트래바드와 무덤에 들어간 다음 티르의 납골당으로 가야 합니다.,길 뚫기,2444,1092,47896,0,0,0,1,0,0,0
서부 몰락지대 전역에 있는 군단 세력을 격퇴해야 합니다.,군단 격퇴,2445,897,47904,43288,0,0,2,0,0,0
대장 나라노스를 처치해야 합니다.,다가오는 악마의 정체,2446,1085,47908,0,0,0,4,0,0,0
티르의 납골당이 광기에 사로잡힌 돌연변이로 넘쳐납니다. 의식을 시작하려면 그들을 소탕해야 합니다.,수호자의 안식처,2447,1092,47934,0,0,0,2,0,0,0
트래바드가 의식을 시작하려고 합니다. 그를 도와야 합니다.,중단된 의식,2448,1092,47963,0,0,0,3,0,0,0
의식의 핵심 재료를 빼앗겼습니다. 아래로 내려가 되찾아야 합니다.,어둠 속으로,2449,1092,47965,0,0,0,4,0,0,0
불의 정령에 대해 배워야 합니다.,정령 해방,2450,1091,47967,0,0,0,9,0,0,0
"토림과 대화하고, 프루스타가의 공격에 대비해야 합니다.",천둥의 지배자 토림,2452,1099,47973,0,0,0,0,0,0,0
거대한 돌연변이가 불꽃을 가지고 있습니다. 돌연변이를 처치하고 불꽃을 회수해야 합니다.,괴수의 아귀,2453,1092,47979,0,0,0,5,0,0,0
불안정한 공허의 에너지가 모이고 있습니다. 공허의 힘이 이 지역을 통째로 삼켜버리기 전에 트래바드를 따라 납골당으로 가야 합니다.,감옥 탈출,2454,1092,48010,0,0,0,6,0,0,0
성기사들이 부상당하거나 공허 마법에 사로잡혀있습니다. 상처를 치유하거나 마법을 정화하여 그들이 다시 일어설 수 있게 해줘야 합니다.,성기사 구제,2455,1092,48012,0,0,0,7,0,0,0
"모두 통로를 빠져나갔지만, 아래에서 거대하고 사악한 무언가가 다가오고 있습니다. 트래바드와 함께 납골당으로 도망가야 합니다.",사악한 존재의 엄습,2456,1092,48015,0,0,0,8,0,0,0
수호물을 해제하고 망치를 얻으려면 트래바드가 의식을 완료해야 합니다. 그가 의식을 마칠 때까지 납골당을 방어하십시오!,의식 방어,2457,1092,48055,0,0,0,9,0,0,0
이제 은빛 손을 획득할 수 있습니다! 모르도스가 모두를 압도하기 전에 은빛 손을 확보해야 합니다.,은빛 손,2458,1092,48057,0,0,0,10,0,0,0
에테리얼에게 붙잡힌 아주어고스를 풀어주어야 합니다.,하늘빛 포로,2466,1101,47984,0,0,0,0,0,0,0
기록 보존소에 가서 마력의 금고로 가는 길을 알아내야 합니다.,답 구하기,2467,1101,47987,0,0,0,1,0,0,0
알루네스의 메아리를 물리쳐야 합니다.,고대의 힘의 메아리,2468,1101,47990,0,0,0,2,0,0,0
균열에 도착해야 합니다.,나가는 유일한 방법,2469,1101,47992,0,0,0,3,0,0,0
연합왕자 바이랄을 처치해야 합니다.,공허의 흡수,2470,1101,47994,0,0,0,4,0,0,0
알루네스를 제어해야 합니다.,구속과 해방,2471,1101,47996,0,0,0,5,0,0,0
알루네스를 획득한 다음 마력의 금고를 떠나야 합니다.,에이그윈의 힘,2472,1101,47998,0,0,0,6,0,0,0
열쇠를 구했으니 철창에서 나와 무기를 회수해야 합니다.,탈출의 명수,2473,1078,48001,0,0,0,2,0,0,0
프루스타가의 브리쿨 동맹의 공격을 막아야 합니다.,전투 시작,2474,1099,48008,0,0,0,1,0,0,0
지옥살이 거대마귀를 처치해야 합니다.,거대마귀 처치,2475,1097,48017,0,0,0,1,0,0,0
메피스트로스가 해골을 가지고 탈출했습니다. 덫을 통과하고 메피스트로스를 추격해야 합니다!,악마 사냥,2476,1097,48045,0,0,0,2,0,0,0
메피스트로스의 하수인들이 몰려오고 있습니다. 적의 공세를 막아내다가 여군주 티라나와 고통의 여주인 니크타가 나타나면 모두 처치해야 합니다.,군단,2477,1097,48047,0,0,0,3,0,0,0
메피스트로스가 해골을 파괴하려고 합니다! 적을 뚫고 메피스트로스의 의식 장소로 가서 막아야 합니다!,해골의 절규,2478,1097,48050,0,0,0,4,0,0,0
"메피스트로스는 탈출했지만, 다행히 해골은 무사합니다. 해골을 획득하십시오.",만아리의 해골,2479,1097,48053,0,0,0,5,0,0,0
프루스타가가 티탄분쇄자의 힘을 흡수하고 있습니다. 저지해야 합니다!,강탈자의 광기,2480,1099,48019,0,0,0,2,0,0,0
하티의 생명을 구하려면 그 영혼을 당신의 영혼에 결속해야 합니다.,천둥의 심장,2481,1099,48021,0,0,0,3,0,0,0
티탄분쇄자를 사용해 하티의 흡수된 힘이 전설의 라이플로 돌아가게끔 해야 합니다.,티탄의 힘,2482,1099,48023,0,0,0,4,0,0,0
그리프와 함께 달라란으로 귀환해야 합니다.,서사시의 끝,2483,1099,48025,0,0,0,5,0,0,0
필사의 일격에 대해 배워야 합니다.,큰 거 한 방,2490,1093,48067,0,0,0,2,0,0,0
격돌에 대해 배워야 합니다.,강력한 충돌,2491,1093,48069,0,0,0,3,0,0,0
제압에 대해 배워야 합니다.,산산조각 부수기,2492,1093,66087,0,0,0,4,0,0,0
연전연승에 대해 배워야 합니다.,패배는 없다,2493,1093,48073,0,0,0,6,0,0,0
새로 배운 모든 기술을 표적 허수아비에 사용해야 합니다.,종합주문세트,2494,1093,48075,0,0,0,5,0,0,0
소용돌이에 대해 배워야 합니다.,뱅글뱅글,2495,1093,48081,0,0,0,7,0,0,0
영웅의 도약에 대해 배워야 합니다.,격전 속으로,2496,1093,48084,0,0,0,8,0,0,0
배운 것을 활용하여 적 한 명을 물리쳐야 합니다.,깜짝 시험,2497,1093,50154,0,0,0,9,0,0,0
배운 것을 활용하여 적 두 명과 동시에 싸워야 합니다.,난이도 두 배,2498,1093,50152,0,0,0,10,0,0,0
가젯잔을 위협하는 군단 사령관을 처치해야 합니다.,악마 사령관 처치,2499,806,48783,43243,0,0,1,0,0,0
타나리스 전역에 있는 군단 세력을 격퇴해야 합니다.,군단 격퇴,2500,806,48090,43294,0,0,2,0,0,0
가젯잔 침공을 지휘하는 악마 군주를 처치해야 합니다.,악마 군주 처치,2501,806,48938,43244,0,0,3,0,0,0
해골을 손에 넣었습니다! 차원문을 통해 이곳을 떠나야 합니다.,주인은 갈아타라고 있는 것,2502,1097,48097,0,0,0,6,0,0,0
버스토크와 아샤메인의 송곳니를 찾아 팔라나아르 폐허에 왔습니다. 버스토크가 어디로 사라졌는지 알아내는 데 도움이 될 만한 단서를 찾으십시오.,탐색,2506,1108,48239,0,0,0,0,0,0,0
해오름차기에 대해 배워야 합니다.,면상 발차기,2511,1095,48409,0,0,0,2,0,0,0
후려차기에 대해 배워야 합니다.,연이어 발차기,2512,1095,48410,0,0,0,3,0,0,0
분노의 주먹에 대해 배워야 합니다.,주먹 작렬,2513,1095,48411,0,0,0,4,0,0,0
새로 배운 모든 기술을 표적 허수아비에 사용해야 합니다.,종합주문세트,2514,1095,48412,0,0,0,5,0,0,0
구르기에 대해 배워야 합니다.,데굴데굴,2515,1095,48413,0,0,0,6,0,0,0
생기 충전에 대해 배워야 합니다.,생기 재충전!,2516,1095,67046,0,0,0,7,0,0,0
배운 것을 활용하여 적 한 명을 물리쳐야 합니다.,깜짝 시험,2517,1095,49698,0,0,0,8,0,0,0
배운 것을 활용하여 적 두 명과 동시에 싸워야 합니다.,난이도 두 배,2518,1095,49696,0,0,0,9,0,0,0
"버스토크의 체취가 폐허 내부로 이어져 있지만, 문이 굳게 닫혀있습니다. 문을 열 방법을 알아내야 합니다.",메마른 자가 있는 곳에 길이 있다,2525,1108,48436,0,0,0,1,0,0,0
메릴은 이곳에서 습격을 준비하려고 합니다. 메릴과 알로디와 대화하고 준비를 시작해야 합니다.,준비,2526,1122,48439,0,0,0,0,0,0,0
내트에게 으스름 광포어를 줘야 합니다.,배달,2527,1025,48445,0,0,0,2,0,0,0
"지옥 감쇠 수호물이 잘 보이도록 높은 곳에 설치해야 합니다. 수호물을 설치할 장소를 확보한 다음, 수호물을 설치하고 방어해야 합니다.",수호물 설치,2528,1122,48461,0,0,0,1,0,0,0
수호물이 활성화되었으니 의식을 시작할 수 있습니다. 종말의 제단으로 간 다음 메릴 펠스톰과 대화해야 합니다.,종말의 제단,2529,1122,48463,0,0,0,2,0,0,0
언제든 가능할 때 의식 집중점을 사용하여 의식을 완료해야 합니다.,웅장한 의식,2530,1122,48466,0,0,0,3,0,0,0
발라두르의 힘에 휩쓸려 그의 세계로 들어왔습니다. 에레다르 군주 발라두르를 처치해야 합니다.,광기의 세계에서의 사투,2531,1122,48469,0,0,0,4,0,0,0
쓰러진 악마 주변에 칠흑한기가 놓여있습니다. 지팡이를 획득해야 합니다.,칠흑한기,2532,1122,48471,0,0,0,5,0,0,0
버스토크의 흔적을 따라 신전 깊은 곳으로 들어가야 합니다.,"앞, 아래, 위, 위, 아래",2533,1108,48476,0,0,0,2,0,0,0
송곳니의 힘 때문에 버스토크가 광기에 휩싸였습니다. 그를 제압해야 합니다.,감당할 수 없는 힘,2534,1108,48478,0,0,0,3,0,0,0
숨기에 대해 배워야 합니다.,"꼭꼭 숨어라, 머리카락 보인다",2535,1096,48481,0,0,0,2,0,0,0
칼날 발톱에 대해 배워야 합니다.,갈가리 찢기,2536,1096,48482,0,0,0,4,0,0,0
갈퀴 발톱에 대해 배워야 합니다.,발톱 세우기,2537,1096,48483,0,0,0,3,0,0,0
흉포한 이빨에 대해 배워야 합니다.,물어뜯기,2538,1096,48484,0,0,0,5,0,0,0
도려내기에 대해 배워야 합니다.,사정없이 찢기,2539,1096,48485,0,0,0,6,0,0,0
새로 배운 모든 기술을 표적 허수아비에 사용해야 합니다.,종합주문세트,2540,1096,48486,0,0,0,7,0,0,0
질주에 대해 배워야 합니다.,거침없이 달려들기,2541,1096,48489,0,0,0,8,0,0,0
재생에 대해 배워야 합니다.,상처 치유,2542,1096,48490,0,0,0,9,0,0,0
배운 것을 활용하여 적 한 명을 물리쳐야 합니다.,깜짝 시험,2543,1096,49653,0,0,0,10,0,0,0
비행선을 떠나 공격에 참여해야 합니다.,사령관의 명령서,2544,1096,49642,0,0,0,13,0,0,0
폐허 아래 동굴로 달아난 버스토크를 찾아야 합니다.,어둠 속으로,2545,1108,48487,0,0,0,4,0,0,0
"버스토크를 찾았지만, 그는 무시무시한 괴물이 쳐 놓은 거미줄에 잡혀있습니다. 우선 괴물을 처치해야 합니다.",휘감는 거미줄,2546,1108,48505,0,0,0,5,0,0,0
이제 아샤메인의 송곳니는 당신의 것입니다. 송곳니를 획득해야 합니다.,아샤메인의 송곳니,2547,1108,48507,0,0,0,6,0,0,0
단장 마티아스 쇼가 스톰윈드 성문을 감시하고 있습니다.,삼엄한 경계,2548,1123,48525,0,0,0,0,0,0,0
엘링 트리아스를 만나서 연막탄을 얻어야 합니다.,은밀한 교환,2549,1123,48530,0,0,0,1,0,0,0
교역의 전당에서 연막탄을 사용해 혼란을 조성해야 합니다.,장사의 비법,2550,1123,48532,0,0,0,2,0,0,0
광포어를 광분하게 만든 원인을 낚아야 합니다.,범인은 누구?,2551,1025,48562,0,0,0,3,0,0,0
칠흑송곳니를 타고 꿈숲으로 돌아가야 합니다.,꿈숲으로,2552,1108,48564,0,0,0,7,0,0,0
드디어 검은 사원을 보호하는 신성한 방벽을 뚫었습니다. 고뇌의 알트루이스와 의논하여 아카마와의 대면을 준비해야 합니다.,돌아온 일리다리,2553,1124,48570,0,0,0,0,0,0,0
관리자 G33-WH12를 따라서 대기실을 통과해야 합니다.,관리자 따라가기,2554,1125,48568,0,0,0,0,0,0,0
혼란을 뚫고 구 시가지의 돼지와 휘파람 선술집에 있는 가로나와 만나야 합니다.,약속 지점,2558,1123,48576,0,0,0,4,0,0,0
침입자를 물리쳐야 합니다.,침입자 소탕,2559,1125,48578,0,0,0,1,0,0,0
선술집에 들어가서 알시아 에본로크가 그녀의 주군이 있는 장소를 실토하게 해야 합니다.,실토,2560,1123,48584,0,0,0,5,0,0,0
스톰윈드 왕궁에 있는 전령이 군단을 소환하기 전에 찾아내야 합니다!,추적,2561,1123,48586,0,0,0,6,0,0,0
당신만이 멜리스를 암살할 수 있습니다. 그자의 목숨을 확실히 끊어놔야 합니다.,죽음의 표적,2562,1123,48588,0,0,0,7,0,0,0
국왕 시해자를 획득해야 합니다.,어둠의 선물,2563,1123,48590,0,0,0,8,0,0,0
마티아스 쇼가 친절하게도 달라란으로 가는 차원문을 제공해주었습니다.,다음에 만나요,2564,1123,48592,0,0,0,9,0,0,0
사원 정상으로 가는 관문이 닫혀있습니다. 아카마는 관문 너머에 있습니다. 일리다리 군대를 앞세워 길을 뚫어야 합니다.,진격의 일리다리,2565,1124,48598,0,0,0,1,0,0,0
사원 정상으로 올라가 아카마와 대면해야 합니다. 그리고 불타는 군단의 세계를 함께 침공하자고 설득해야 합니다.,숙적과의 조우,2566,1124,48604,0,0,0,2,0,0,0
아카마를 말로 설득할 수는 없을 겁니다. 강한 힘을 보여주는 편이 나을지 모릅니다. 어떻게 제압해야 가장 피해가 적을까요?,말을 듣지 않으면...,2567,1124,48606,0,0,0,3,0,0,0
아카마를 제압했습니다. 이제 그와 대화하여 힘을 빌려달라고 설득해야 합니다.,마지막 제안,2568,1124,48608,0,0,0,4,0,0,0
회개에 대해 배워야 합니다.,거룩한 신념,2569,1090,48724,0,0,0,2,0,0,0
성스러운 일격에 대해 배워야 합니다.,압도적인 성스러움,2570,1090,48725,0,0,0,3,0,0,0
새로 배운 모든 기술을 표적 허수아비에 사용해야 합니다.,종합주문세트,2571,1090,48726,0,0,0,4,0,0,0
신의 권능: 보호막에 대해 배워야 합니다.,거룩한 보호,2572,1090,48727,0,0,0,6,0,0,0
영혼의 절규에 대해 배워야 합니다.,공포 조장,2573,1090,48728,0,0,0,5,0,0,0
속죄에 대해 배워야 합니다.,적의 고통은 나의 힘,2574,1090,66220,0,0,0,7,0,0,0
배운 것을 활용하여 적 한 명을 물리쳐야 합니다.,깜짝 시험,2575,1090,49762,0,0,0,8,0,0,0
배운 것을 활용하여 적 두 명과 동시에 싸워야 합니다.,난이도 두 배,2576,1090,49760,0,0,0,9,0,0,0
검은 사원을 보호하는 신성한 방벽을 뚫었습니다. 카인 선퓨리와 의논하여 아카마와의 대면을 준비해야 합니다.,돌아온 일리다리,2582,1131,48812,0,0,0,0,0,0,0
사원 정상으로 가는 관문이 닫혀있습니다. 아카마는 관문 너머에 있습니다. 일리다리 군대를 앞세워 길을 뚫어야 합니다.,진격의 일리다리,2583,1131,48814,0,0,0,1,0,0,0
사원 정상으로 올라가 아카마와 대면해야 합니다. 그리고 불타는 군단의 세계를 함께 침공하자고 설득해야 합니다.,숙적과의 조우,2584,1131,48816,0,0,0,2,0,0,0
아카마를 말로 설득할 수는 없을 겁니다. 강한 힘을 보여주는 편이 나을지 모릅니다. 어떻게 제압해야 가장 피해가 적을까요?,말을 듣지 않으면...,2585,1131,48818,0,0,0,3,0,0,0
아카마를 제압했습니다. 이제 그와 대화하여 힘을 빌려달라고 설득해야 합니다.,마지막 제안,2586,1131,48820,0,0,0,4,0,0,0
물의 정령 소환에 대해 배워야 합니다.,차가운 친구,2587,1132,48833,0,0,0,1,0,0,0
맹독에 대해 배워야 합니다.,독한 단검,2588,1133,48991,0,0,0,1,0,0,0
얼음 화살에 대해 배워야 합니다.,차디찬 기운,2589,1132,48834,0,0,0,2,0,0,0
얼음창에 대해 배워야 합니다.,치명적인 얼음,2590,1132,48835,0,0,0,3,0,0,0
얼음창 및 서리의 손가락에 대해 배워야 합니다.,얼어붙은 손길,2591,1132,48836,0,0,0,4,0,0,0
새로 배운 모든 기술을 표적 허수아비에 사용해야 합니다.,종합주문세트,2593,1132,48838,0,0,0,6,0,0,0
점멸에 대해 배워야 합니다.,나 잡아봐라!,2594,1132,48839,0,0,0,7,0,0,0
얼음 회오리에 대해 배워야 합니다.,그대로 멈춰라!,2595,1132,48840,0,0,0,8,0,0,0
눈보라에 대해 배워야 합니다.,휘몰아치는 눈발,2596,1132,48841,0,0,0,9,0,0,0
배운 것을 활용하여 적 한 명을 물리쳐야 합니다.,깜짝 시험,2597,1132,49683,0,0,0,10,0,0,0
비행선을 떠나 공격에 참여해야 합니다.,사령관의 명령서,2598,1132,49672,0,0,0,13,0,0,0
타사리안과 대화해야 합니다.,개인적인 부탁,2599,1134,48927,0,0,0,0,0,0,0
악마를 뒤틀린 황천으로 돌려보내고 차원문을 닫아 군단 침공을 저지해야 합니다.,무너지는 하늘,2600,1135,48911,0,0,0,0,0,0,0
대마법사 바르고스를 구속하고 있는 군단 마법사 세 명을 처치해야 합니다.,뒤틀린 바람,2601,1135,48919,0,0,0,2,0,0,0
마력의 탑에 들어갈 방법을 찾아야 합니다.,은신의 왕도,2602,1135,49016,0,0,0,5,0,0,0
나이트본 영혼석에 카트라나티르를 가두어 그를 물리쳐야 합니다.,영혼석의 힘,2603,1135,49031,0,0,0,6,0,0,0
대마법사 바르고스와 대화해야 합니다.,대마법사 바르고스,2604,1135,48966,0,0,0,3,0,0,0
준비되면 카드가와 대화하여 정수를 비전 용기에 집중하도록 해야 합니다.,비전 정수,2605,1136,48943,0,0,0,0,0,0,0
연금술 실험실에 있는 콜티라를 구출해야 합니다.,그대에게 자유를,2606,1134,48941,0,0,0,2,0,0,0
대마법사 카드가가 그의 정수를 비전 용기에 집중하는 동안 그를 보호해야 합니다.,미끼가 된 대마법사,2608,1136,49361,0,0,0,1,0,0,0
섬광을 사용하여 학카르가 미끼를 물었는지 확인해야 합니다.,"어디, 월척이 잡혔나?",2609,1136,49365,0,0,0,2,0,0,0
비전 차원문을 사용하여 변환의 고리 중앙으로 이동해야 합니다.,중력의 중심,2610,1135,48936,0,0,0,1,0,0,0
사원에 도착했습니다. 원숭이 왕을 만난 다음 사원 내부 깊숙이 들어갈 준비를 해야 합니다.,사원의 위기,2613,1137,49114,0,0,0,0,0,0,0
은신에 대해 배워야 합니다.,살금살금,2617,1133,48992,0,0,0,2,0,0,0
목조르기에 대해 배워야 합니다.,조여드는 손,2618,1133,48993,0,0,0,3,0,0,0
절단에 대해 배워야 합니다.,단검 하나로는 부족해,2619,1133,48994,0,0,0,4,0,0,0
파열에 대해 배워야 합니다.,아낌없는 공격,2620,1133,48995,0,0,0,5,0,0,0
독살에 대해 배워야 합니다.,"독, 추가요!",2621,1133,48996,0,0,0,6,0,0,0
새로 배운 모든 기술을 표적 허수아비에 사용해야 합니다.,종합주문세트,2622,1133,48997,0,0,0,7,0,0,0
소멸에 대해 배워야 합니다.,그림자에 스며들기,2623,1133,48998,0,0,0,8,0,0,0
배운 것을 활용하여 적 한 명을 물리쳐야 합니다.,깜짝 시험,2624,1133,49791,0,0,0,9,0,0,0
배운 것을 활용하여 적 두 명과 동시에 싸워야 합니다.,난이도 두 배,2625,1133,49789,0,0,0,10,0,0,0
대마법사 바르고스와 대화하여 지상으로 순간이동해야 합니다.,지상으로,2626,1135,49014,0,0,0,4,0,0,0
