Description_lang,Title_lang,ID,ScenarioID,CriteriatreeID,RewardQuestID,RelatedStep,Supersedes,OrderIndex,Flags,VisibilityPlayerConditionID,WidgetSetID
티탄 봉쇄 병력을 처치하여 그레타에게 자료를 모을 시간을 벌어줘야 합니다.,티탄의 반격,5539,2152,143896,74906,0,0,9,0,0,0
분리된 불길 지원군이 도착했습니다. 연구원들이 철수할 때까지 야영지를 사수해야 합니다.,명백한 불청객,5540,2152,143904,74906,0,0,19,0,0,0
"분리된 불길의 지도자, 대장 레이칼이 직접 란난의 목숨을 노리기 시작했습니다.",불꽃의 지도자,5541,2152,143900,74906,0,0,20,0,0,0
화염의 원시술사 병력과 차원문 수호자 심브라를 처치해야 합니다.,피락과 유황,5542,2146,144009,0,0,0,2,0,0,0
광석 처리 장치에 특이한 광석 표본을 놓아 그레타의 오염 물질 중화 작업을 도와야 합니다.,오염 물질 중화,5546,2152,144237,74906,0,0,6,0,0,756
티탄 병력과의 충돌로 인해 지역 야생동물이 동요하고 있습니다.,적대적인 조사관,5547,2152,144240,74906,0,0,3,0,0,756
동굴에 침입해 오염 물질을 찾아야 합니다.,동굴 돌파,5548,2152,144241,74906,0,0,4,0,0,756
오염된 야생동물이 일대를 탈출하지 못하게 저지해야 합니다.,오염된 야생동물,5549,2152,144244,74906,0,0,7,0,0,756
마지막 남은 오염 물질이 적대적인 정령으로 응결되었습니다. 반드시 처치해야 합니다.,격렬한 반응,5550,2152,144247,74906,0,0,8,0,0,756
적대적인 야생동물로부터 지역을 확보해야 합니다.,결집 완료,5551,2152,144252,74906,0,0,10,0,0,805
약탈자 어미가 기지를 파괴하러 동굴 천장에서 내려왔습니다!,동굴 파괴자,5552,2152,144254,74906,0,0,11,0,0,805
자칼리 폐허에 적대적인 야생동물이 들끓고 있습니다. 연구원들이 조사할 수 있도록 일대를 정리해야 합니다.,점령당한 기념비,5553,2152,144256,74906,0,0,12,0,0,805
테일린을 도와 고대 자칼리 기둥을 복구해야 합니다.,우뚝 솟은 기둥,5554,2152,144258,74906,0,0,13,0,0,805
테일린이 정령 의식을 준비할 동안 지역에 있는 용암발톱을 정리해야 합니다.,기둥 활성화,5555,2152,144263,74906,0,0,14,0,0,789
거대한 용암발톱 덥썩이로부터 테일린을 보호해야 합니다!,거대한 용암발톱,5556,2152,144265,74906,0,0,15,0,0,805
테일린을 도와 자칼리 제단을 수리해야 합니다.,제단 복구 작업,5557,2152,144267,74906,0,0,16,0,0,805
자칼리 자라딘으로부터 연구원을 보호해야 합니다!,자라딘의 홍수,5558,2152,144270,74906,0,0,17,0,0,805
자칼리 의식의 대가가 제단에 접근 중입니다. 분노를 쏟아내기 전에 저지해야 합니다.,열기,5559,2152,144272,74906,0,0,18,0,0,805
일만 년 동안 갇혀 있던 탓인지 티탄 감시자가 오염되고 말았습니다.,격리 실패,5560,2152,144297,74906,0,0,5,0,0,756
넬타리온의 위험한 드랙티르 화신을 처치해야 합니다.,버려진 작업물,5561,2193,144315,0,0,0,0,0,0,0
라소크가 도가니를 파괴하기 전에 처치해야 합니다.,거인의 분노,5562,2194,144319,0,0,0,0,0,0,0
어둠을 해방하려는 넬타리온의 음모를 타도해야 합니다.,넬타리온의 어둠,5563,2195,144341,0,0,0,0,0,0,0
사카레스가 아베루스를 차지하기 전에 저지해야 합니다.,공허의 가장자리,5564,2196,144344,0,0,0,0,0,0,0
중앙 문을 열 수 있는 특별한 양초를 회수해야 합니다.,양초를 회수하여 문 열기,5577,2208,144656,0,0,0,0,0,0,0
양초를 넣어 문을 열어야 합니다.,양초 넣기,5578,2208,144659,0,0,0,1,0,0,0
,최종 우두머리 처치,5579,2208,144662,0,0,0,2,0,0,0
다시 시험해 봐야 합니다!,3단계,5595,2034,146208,0,0,0,2,0,0,0
소리도르미와 대화하여 도울 의사가 있음을 밝혀야 합니다.,보고,5596,2222,144583,0,0,0,0,8,0,792
,투기장으로 통하는 길 찾기,5623,2246,146258,0,0,0,0,0,0,842
,동전 수집가 도전,5624,2246,146262,0,0,0,1,0,0,842
시험용,1단계,5625,2034,156556,0,0,0,0,16,0,0
,아라토르 쌍둥이 처치,5632,2246,146297,0,0,0,2,0,0,0
,살인 사건 조사하기,5645,2246,146305,0,0,0,3,0,0,0
테스트,시험용,5647,2258,0,0,0,0,0,0,0,0
꿈열매를 섭취해 특별한 능력을 얻어 여정을 준비해야 합니다.,나무의 각성,5648,2259,147022,0,0,0,0,4,0,1002
스프루스크라운을 따라 이동하면서 비에 굶주린 꽃을 도와야 합니다.,모여드는 꿈,5649,2259,146455,78866,0,0,1,0,0,856
세계수를 위협하는 원시술사를 처치해야 합니다.,젊음의 우행,5653,2259,146446,78867,0,0,2,0,0,980
키리옳 토옳 마법사를 처리해야 합니다.,키리옳 토옳!,5654,2222,144598,76985,0,0,2,0,0,792
MR-7 멀록 암살자를 처리해야 합니다.,MR-7!,5655,2222,144602,76985,0,0,3,0,0,792
크옳 크르글 멀록 드루이드를 처치해야 합니다.,크옳 크르글!,5656,2222,144604,76985,0,0,4,0,0,792
울데로스 공룡을 처리해야 합니다.,울데로스 공룡,5657,2222,144606,76985,0,0,21,0,0,792
울데로스 식물을 처리해야 합니다.,울데로스 식물,5658,2222,144608,76985,0,0,22,0,0,792
울데로스 야수를 처리해야 합니다.,울데로스 야수,5659,2222,144610,76985,0,0,23,0,0,792
그옳마쉬 헬스크옳을 처치해야 합니다.,파티 임무: 그옳마쉬 헬스크옳,5660,2222,144635,76983,0,0,5,0,0,792
허수아옳 제작에 필요한 재료를 모아야 합니다.,허수아옳 부품,5661,2222,144920,76983,0,0,6,0,0,792
저수지 중앙에 있는 시간의 균열에 들어가야 합니다.,균열 속으로: 아즈메로스!,5662,2222,146301,0,0,0,142,0,0,864
균열을 벗어나는 생명체를 처치해야 합니다!,마구잡이 학살!,5664,2222,144723,76985,0,0,1,0,0,792
잃리단을 처치해야 합니다.,파티 임무: 잃리단,5665,2222,144906,76983,0,0,7,0,0,792
데스위이옳옳의 하수인을 처치해야 합니다.,파티 임무: 데스위이옳옳의 하수인,5666,2222,144908,76983,0,0,8,0,0,792
겁에 질린 아기 멀록을 원래 차원으로 던져 넣어야 합니다.,파티 임무: 겁에 질린 멀록,5667,2222,145179,76983,0,0,9,0,0,792
방황하는 아기 멀록을 원래 현실로 던져 넣어야 합니다.,파티 임무: 방황하는 아기 멀록,5668,2222,145219,76983,0,0,10,0,0,792
거대한 알을 차원문으로 끌고 가야 합니다.,파티 임무: 거대한 알,5672,2222,145288,76983,0,0,11,0,0,792
아즈메로스 거품술사의 거품을 터뜨려야 합니다.,파티 임무: 거품,5673,2222,145483,0,0,0,12,0,0,792
아즈메로스 거품술사를 처치해야 합니다.,파티 임무: 아즈메로스 거품술사,5674,2222,145561,76983,0,0,13,0,0,792
악취 나는 죽은 물고기 더미를 파괴해야 합니다.,악취 나는 죽은 물고기 더미,5675,2222,145329,76984,0,0,14,0,0,792
악취 나는 죽은 물고기 바구니를 파괴해야 합니다.,악취 나는 죽은 물고기 바구니,5676,2222,145331,76984,0,0,15,0,0,792
악취 나는 죽은 물고기 통을 파괴해야 합니다.,악취 나는 죽은 물고기 통,5677,2222,145333,76984,0,0,16,0,0,792
전장에서 부상당한 멀록을 치유해야 합니다.,부상당한 멀록,5678,2222,145428,76984,0,0,17,0,0,792
전장에서 다친 멀록을 치유해야 합니다.,다친 멀록,5679,2222,145473,76984,0,0,18,0,0,792
아즈메로스 점액 방울을 모아야 합니다.,점액 모으기,5680,2222,145611,0,0,0,19,0,0,792
자신과 아군이 사용할 수 있는 아즈메로스 점액 웅덩이를 만들어야 합니다.,점액 웅덩이 만들기,5681,2222,145678,76984,0,0,20,0,0,792
순혈 구름천둥매를 처치해야 합니다.,파티 임무: 순혈 구름천둥매,5682,2222,146101,76983,0,0,24,0,0,792
순혈 매머드를 처치해야 합니다.,파티 임무: 순혈 매머드,5683,2222,146103,76983,0,0,25,0,0,792
순혈 원시비룡을 처치해야 합니다.,파티 임무: 순혈 원시비룡,5684,2222,146105,76983,0,0,26,0,0,792
순혈 데빌사우루스를 처치해야 합니다.,파티 임무: 순혈 데빌사우루스,5685,2222,146107,76983,0,0,27,0,0,792
불순물 정화기를 파괴해야 합니다.,파티 임무: 불순물 정화기,5686,2222,146128,76983,0,0,28,0,0,792
소리도르미의 단상을 습격한 성가신 야수를 짓밟아야 합니다.,파티 임무: 성가신 야수,5687,2222,146130,76983,0,0,29,0,0,792
하늘에 있는 깔끔한 수정벌레를 통과하여 비행해야 합니다.,파티 임무: 깔끔한 수정벌레,5688,2222,146134,76983,0,0,30,0,0,792
뒤엉킨 새끼용을 구출해야 합니다.,뒤엉킨 새끼용,5689,2222,146109,76984,0,0,31,0,0,792
결점 없는 덩굴손을 파괴해야 합니다.,결점 없는 덩굴손,5690,2222,146111,76984,0,0,32,0,0,792
최상위 랩터를 찾아 처치해야 합니다.,최상위 랩터,5691,2222,146113,76984,0,0,33,0,0,792
최상위 호랑이를 찾아 처치해야 합니다.,최상위 호랑이,5692,2222,146115,76984,0,0,34,0,0,792
정화로 제작에 필요한 재료를 모아야 합니다.,모두를 위한 돌연변이,5693,2222,146117,0,0,0,35,0,0,792
최상위 테러닥스를 격추해야 합니다.,감도는 파멸,5694,2222,146119,0,0,0,36,0,0,792
최상위 테러닥스를 처치해야 합니다.,최상위 테러닥스,5695,2222,146122,76984,0,0,37,0,0,792
부상당한 감시자를 수리해야 합니다.,부상당한 감시자,5696,2222,146124,76984,0,0,38,0,0,792
이동하는 스프루스크라운을 따라 잡초를 뽑아야 합니다.,침입하는 종,5699,2259,147016,78868,0,0,3,0,0,866
베를란 팀버크러쉬가 스프루스크라운을 불태울 목적으로 세계수에 접근하고 있습니다. 베를란 팀버크러쉬를 처치해야 합니다!,이글거리는 최후,5700,2259,147032,78203,0,0,8,0,0,983
방랑하는 스프루스크라운을 따라 거름을 파내야 합니다.,혼돈의 씨앗,5701,2259,147067,78871,0,0,6,0,0,868
원시술사들이 세계수를 향해 몰려가고 있습니다. 세계수를 지켜야 합니다!,커지는 불안감,5702,2259,147059,78870,0,0,5,0,0,982
스프루스크라운을 따라 곤충 무리를 쫓아내야 합니다.,해충 순찰대,5703,2259,147056,78869,0,0,4,0,0,867
언데드를 처치해야 합니다.,비틀거리는 공격자,5706,2222,146855,76985,0,0,39,0,0,792
네루비안을 처치해야 합니다.,해충 통제,5707,2222,146856,76985,0,0,40,0,0,792
바르굴을 처치해야 합니다.,왕의 가호 아래,5708,2222,146857,76985,0,0,41,0,0,792
역병에 오염된 곡식을 파괴해야 합니다.,정화의 부름,5709,2222,146858,76984,0,0,42,0,0,792
피발굽의 시체를 처리해야 합니다.,시신 처분,5710,2222,146859,76984,0,0,43,0,0,792
켈투자드의 서를 파괴해야 합니다.,최후의 사서,5711,2222,146860,76984,0,0,44,0,0,792
얼어붙은 심장을 시간의 균열 속으로 걷어차야 합니다.,잊혀진 심연,5712,2222,146861,76984,0,0,45,0,0,792
부패한 검투사를 처치해야 합니다.,용맹의 투기장,5713,2222,146862,76984,0,0,46,0,0,792
썩어가는 거신을 원래 시간으로 돌려보내야 합니다.,싸늘한 탄생,5714,2222,146863,76984,0,0,47,0,0,792
태어나지 않은 발키르를 원래 시간으로 돌려보내야 합니다.,영혼 도깨비,5715,2222,146864,76984,0,0,48,0,0,792
볼바르 폴드라곤을 풀어줘야 합니다.,왕이 되지 않을 자,5716,2222,146865,76984,0,0,49,0,0,792
얼어붙은 시간의 균열을 조사해야 합니다.,파티 임무: 왕의 권속,5717,2222,146866,76983,0,0,50,0,0,792
배신자의 속박된 불길을 처치해야 합니다.,파티 임무: 망자의 궁정,5718,2222,146867,76983,0,0,51,0,0,792
밴시 여왕을 처치해야 합니다.,파티 임무: 한결같은 윈드러너,5719,2222,146868,76983,0,0,52,0,0,792
죽음의 인도자 우서를 처치해야 합니다.,파티 임무: 최후의 성기사,5720,2222,146869,76983,0,0,53,0,0,792
광신자의 성물함을 파괴해야 합니다.,파티 임무: 공격당한 빛,5721,2222,146870,76983,0,0,54,0,0,792
군주 타사리안을 처치해야 합니다.,파티 임무: 어둠에 물든 학살자,5722,2222,146871,76983,0,0,55,0,0,792
여왕 앵거보다를 처치해야 합니다.,파티 임무: 깨어난 여왕,5723,2222,146872,76983,0,0,56,0,0,792
타락한 무리 군주를 처치해야 합니다.,파티 임무: 공허한 패배,5724,2222,146873,76983,0,0,57,0,0,792
지옥에 물든 칼도레이와 경호원이 지역을 조사하고 있습니다. 최대한 많이 처치하여 방해해야 합니다.,넘어진 아이,5726,2222,146382,76985,0,0,60,0,0,792
슈할로 무리와 경호원이 주변 환경을 지옥 마력으로 더럽히고 있습니다. 최대한 많이 처치해야 합니다.,실추된 명예,5727,2222,147014,76985,0,0,58,0,0,792
지옥 펄볼그와 경호원이 주변 환경을 지옥 마력으로 더럽히고 있습니다. 최대한 많이 처치해야 합니다.,쓰러진 수호자,5728,2222,147020,76985,0,0,59,0,0,792
지옥에 물든 칼도레이를 처치해야 합니다.,달의 눈물,5729,2222,146840,76984,0,0,61,0,0,792
파멸자 지옥껍질을 처치해야 합니다.,대지의 파멸자,5730,2222,147160,76984,0,0,62,0,0,792
학살자를 찾아 처치해야 합니다.,학살자 학살,5731,2222,147162,76984,0,0,63,0,0,792
지옥 수정탑을 파괴하여 군단의 혼돈망을 파괴해야 합니다.,전력망 붕괴,5732,2222,147164,76984,0,0,64,0,0,792
지옥나물을 뽑아내야 합니다.,나물 뽑기,5733,2222,147232,76984,0,0,65,0,0,792
군단 제어장치 핵을 제거해야 합니다.,핵심 문제,5734,2222,147239,76984,0,0,66,0,0,792
지옥 솔방울 4개를 수집해야 합니다.,식용 아님,5735,2222,147246,0,0,0,67,0,0,792
지옥 솔방울을 파멸포 통풍구에 집어넣어야 합니다.,막힘 사고,5736,2222,147395,76984,0,0,68,0,0,792
크룰의 종복을 처치해야 합니다.,파티 임무: 크룰의 종복,5737,2222,146963,76983,0,0,69,0,0,792
파괴자 우르속을 처치해야 합니다.,파티 임무: 파괴자 우르속,5738,2222,146965,76983,0,0,70,0,0,792
지옥 감시자 마라를 처치해야 합니다.,파티 임무: 감시자 감시,5739,2222,146968,76983,0,0,71,0,0,792
지옥 살포기를 파괴해야 합니다.,파티 임무: 번식 예방,5740,2222,146874,76983,0,0,72,0,0,792
들이닥친 지옥불정령을 처치해야 합니다.,파티 임무: 파괴의 문턱,5741,2222,146940,76983,0,0,73,0,0,792
대형 지옥나물을 뽑아내야 합니다.,파티 임무: 지옥의 땅,5742,2222,147236,76983,0,0,74,0,0,792
공허 탐식자를 처치해야 합니다.,공허 탐식자,5745,2222,146896,76985,0,0,75,0,0,792
아퀴르를 처치해야 합니다.,아퀴르의 침공,5746,2222,146897,76985,0,0,76,0,0,792
클락시를 처치해야 합니다.,클락시 광신자,5747,2222,146898,76985,0,0,77,0,0,792
느조스의 환영을 무효화해야 합니다.,저주받은 시야,5749,2222,146900,76984,0,0,78,0,0,792
예언자 스키트라를 찾아 처치해야 합니다.,예언자 스키트라,5750,2222,146901,76984,0,0,79,0,0,792
황실 장로 조르로크를 찾아 처치해야 합니다.,황실 장로 조르로크,5751,2222,146902,76984,0,0,80,0,0,792
감염된 종양을 밟아 터뜨려야 합니다.,감염 확산,5752,2222,146903,76984,0,0,81,0,0,792
아퀴르 알을 파괴해야 합니다.,아퀴르 알,5753,2222,146904,76984,0,0,82,0,0,792
클락시 부화실을 파괴해야 합니다.,클락시 부화실,5754,2222,146905,76984,0,0,83,0,0,792
클락시 비행자를 호박석 감옥에 가둬야 합니다.,호박석으로 만들어진 감옥,5755,2222,146906,76984,0,0,84,0,0,792
느조스의 손아귀 촉수와 맞서 싸워야 합니다.,파티 임무: 타락 처치,5756,2222,146907,76983,0,0,85,0,0,792
비룡을 타고 날아올라 떠도는 감시자를 들이받아야 합니다.,파티 임무: 제공권 장악,5757,2222,146908,76983,0,0,86,0,0,792
막대기로 느조스의 눈을 쿡쿡 찔러야 합니다.,파티 임무: 눈에 꽂힌 막대기,5758,2222,146909,76983,0,0,87,0,0,792
공허의 감옥을 파괴해야 합니다.,파티 임무: 공허의 감옥,5759,2222,146910,76983,0,0,88,0,0,792
황혼의 예언자 초갈을 처치해야 합니다.,파티 임무: 황혼의 예언자 초갈,5760,2222,146911,76983,0,0,89,0,0,792
공허 탐식자 샤드하르를 처치해야 합니다.,파티 임무: 공허 탐식자 샤드하르,5761,2222,146912,76983,0,0,90,0,0,792
타락자 데스타가스를 처치해야 합니다.,파티 임무: 타락자 데스타가스,5762,2222,146913,76983,0,0,91,0,0,792
대장군 파발락을 처치해야 합니다.,파티 임무: 대장군 파발락,5763,2222,146914,76983,0,0,92,0,0,792
위대하고 영광스러운 얼라이언스 침략자를 최대한 많이 처치해야 합니다.,위대하고 영광스러운 얼라이언스,5764,2222,146915,76985,0,0,93,0,0,792
전쟁을 벌이는 위대하고 영광스러운 얼라이언스와 핏빛 호드 구성원을 최대한 많이 처치해야 합니다.,영원한 전쟁,5765,2222,146916,76985,0,0,94,0,0,792
핏빛 호드 침략자를 최대한 많이 처치해야 합니다.,핏빛 호드,5766,2222,146917,76985,0,0,95,0,0,792
적출자 킨타라를 찾아 처치해야 합니다.,적출자 킨타라,5767,2222,146918,76984,0,0,96,0,0,792
전쟁마법사 베르난테를 찾아 처치해야 합니다.,전쟁마법사 베르난테,5768,2222,146919,76984,0,0,97,0,0,792
위대하고 영광스러운 얼라이언스의 포탄을 폐기해야 합니다.,탄환 없음,5769,2222,146920,76984,0,0,98,0,0,792
핏빛 호드의 고철 폭탄을 일찍 터뜨려야 합니다.,폭탄 투하,5770,2222,146924,76984,0,0,99,0,0,792
자신과 아군이 사용할 수 있는 핏빛 호드 총 선반을 만들어야 합니다.,핏빛 호드의 총기,5771,2222,146925,76984,0,0,101,0,0,792
자신과 아군이 사용할 수 있는 위대하고 영광스러운 얼라이언스 총 선반을 만들어야 합니다.,위대하고 영광스러운 얼라이언스의 총기,5772,2222,146926,76984,0,0,103,0,0,792
연기붕붕이를 훔쳐 소리도르미에게 전달해야 합니다.,연기붕붕이,5773,2222,146927,76984,0,0,104,0,0,792
비행기를 훔쳐 소리도르미에게 전달해야 합니다.,비행기,5774,2222,146928,76984,0,0,105,0,0,792
안쿠라 블러드휴어를 처치해야 합니다.,파티 임무: 안쿠라 블러드휴어,5775,2222,146929,76983,0,0,106,0,0,792
하늘사령관 가드리우스 오크베인을 처치해야 합니다.,파티 임무: 하늘사령관 가드리우스 오크베인,5776,2222,146930,76983,0,0,107,0,0,792
연막꾼 마르고쉬를 처치해야 합니다.,파티 임무: 연막꾼 마르고쉬,5777,2222,146931,76983,0,0,108,0,0,792
대심문관 킬란드렐을 처치해야 합니다.,파티 임무: 대심문관 킬란드렐,5778,2222,146932,76983,0,0,109,0,0,792
거대 폭탄을 원래 현실로 끌고 가야 합니다.,파티 임무: 거대 폭탄!,5779,2222,146933,76983,0,0,110,0,0,792
핏빛 지뢰를 해체해야 합니다.,파티 임무: 핏빛 호드 지뢰밭,5780,2222,146934,76983,0,0,111,0,0,792
"축복받은 심문관의 보호막을 들이받아 파괴한 후, 축복받은 심문관을 처치해야 합니다.",파티 임무: 축복받은 심문관,5781,2222,146935,76983,0,0,112,0,0,792
용 조련술 탈것으로 들이받아 비행기를 처치해야 합니다.,파티 임무: 강철의 하늘,5782,2222,146936,76983,0,0,114,0,0,792
아제라이트 채굴기를 처리해야 합니다.,노천 채굴,5784,2222,146942,76985,0,0,115,0,0,792
부식된 작업반장과 녹슨 측량 로봇을 처리해야 합니다.,"수색, 저장, 섬멸",5785,2222,146943,76985,0,0,116,0,0,792
고장난 수확자를 처치해야 합니다.,고장 발견,5786,2222,146944,76985,0,0,117,0,0,792
오작동하는 제어판을 수리해야 합니다.,통제력 복구,5787,2222,146945,76984,0,0,118,0,0,792
U:\란.2 /스위프트를 찾아 저지해야 합니다!,말살 조건: 나 자신,5788,2222,146946,76984,0,0,119,0,0,792
악동-친9를 걷어차 모두 원래 시간으로 돌려보내야 합니다!,잡동사니 수집,5789,2222,146947,76984,0,0,120,0,0,792
기름 웅덩이를 닦아내야 합니다.,점액 전투,5790,2222,146948,76984,0,0,121,0,0,792
AQ-9 용학살자를 모두 격추해야 합니다.,하늘의 위협,5791,2222,146949,76984,0,0,122,0,0,792
오작동하는 도가니를 정리해야 합니다.,요리 시간,5792,2222,146950,76984,0,0,123,0,0,792
충전된 전지로 아제라이트 수집기를 파괴해야 합니다!,낙관적인 기분,5793,2222,146951,76984,0,0,124,0,0,792
화염방사기를 파괴해야 합니다!,치명적인 용암 등불,5794,2222,146952,76984,0,0,125,0,0,792
자석을 사용해 야전 절망 로봇을 전하 수정탑으로 밀어야 합니다!,파티 임무: 자력 속성,5795,2222,146953,76983,0,0,126,0,0,792
짜증이를 처치해야 합니다!,파티 임무: 최악의 로봇 집사,5796,2222,146954,76983,0,0,127,0,0,792
알파 변환기를 정지시켜야 합니다!,파티 임무: 알파 변환기 정지,5797,2222,146955,76983,0,0,128,0,0,792
악독로봇을 처치해야 합니다!,파티 임무: 선물과 고통,5798,2222,146956,76983,0,0,129,0,0,792
과부하된 고철 수류탄으로 불안정한 시간의 균열을 닫아야 합니다!,파티 임무: 두 고철 더미,5799,2222,146957,76983,0,0,130,0,0,792
그리브스를 처치해야 합니다.,파티 임무: 창조주와의 만남,5800,2222,146958,76983,0,0,131,0,0,792
홀로그램을 비활성화해야 합니다.,파티 임무: 기계가 미래다,5801,2222,146959,76983,0,0,132,0,0,792
절멸 폭탄 9000을 비활성화해야 합니다.,파티 임무: 희미한 생존 확률,5802,2222,146960,76983,0,0,133,0,0,792
잘못된 시간의 길에서 온 생명체를 분간하여 역설을 해결해야 합니다.,역설 해결,5806,2222,144612,76984,0,0,134,0,0,792
교차된 시간의 길을 풀어내 역설을 해결해야 합니다.,역설 해결,5807,2222,144910,76984,0,0,135,0,0,792
충전 속도를 조정하여 모래시계를 채워야 합니다.,모래시계 채우기,5808,2222,144912,76984,0,0,136,0,0,792
모래를 받아내 모래시계를 채워야 합니다.,모래시계 채우기,5809,2222,146985,76984,0,0,137,0,0,792
떨어지는 모래 밑으로 옮겨 모래시계를 채워야 합니다.,모래시계 채우기,5810,2222,146986,76984,0,0,138,0,0,792
특정 시간의 길에서 온 생명체를 찾아 역설을 해결해야 합니다.,역설 해결,5811,2222,146987,76984,0,0,139,0,0,792
,더 깊이 탐험하기,5812,2270,147112,0,0,0,0,8,0,842
몰려드는 분리된 불길을 몰아내야 합니다!,더럽혀진 보물,5813,2270,147114,0,0,0,1,0,0,842
괴물 무리를 상대로 버텨야 합니다!,도마뱀 떼,5815,2270,147116,0,0,0,2,0,0,842
계속 동굴을 탐험해야 합니다!,심층 탐험,5817,2270,147120,0,0,0,5,0,0,842
핏빛 호드 무기와 보관용 선반을 모아야 합니다.,호드의 병기,5818,2222,147190,0,0,0,100,0,0,792
위대하고 영광스러운 얼라이언스 무기와 보관용 선반을 모아야 합니다.,얼라이언스 무기,5819,2222,147191,0,0,0,102,0,0,792
축복받은 심문관을 처치해야 합니다.,파티 임무: 심문,5820,2222,147188,76983,0,0,113,0,0,792
분리된 불길 장군을 처치해야 합니다!,최후의 대결,5835,2270,147207,0,0,0,6,0,0,842
자신과 아군이 사용할 수 있는 정화로를 만들어야 합니다.,정화로,5849,2222,147530,76984,0,0,141,0,0,792
자신과 아군이 사용할 수 있는 허수아옳을 만들어야 합니다.,허수아옳,5850,2222,147531,76984,0,0,140,0,0,792
무한의 용군단이 청동 사원에 침입했습니다. 노즈도르무와 크로미를 도와 시간의 길을 탈환해야 합니다!,무한의 여명: 갈라크론드의 몰락,5851,2276,147543,0,0,0,0,0,0,0
무르도즈노가 기지개를 켜고 있습니다. 크로미와 함께 시간을 내달려 과거를 바로잡아야 합니다!,무한의 여명: 무르도즈노의 현신,5852,2277,147548,0,0,0,0,0,0,0
소리도르미가 시간의 길을 고칠 수 있도록 부서진 인과율을 파괴해야 합니다.,분열된 인과율,5853,2278,147554,0,0,0,0,0,0,0
소리도르미가 시간의 길을 고칠 수 있도록 부서진 인과율을 파괴해야 합니다.,분열된 인과율,5854,2280,147557,0,0,0,0,0,0,0
소리도르미가 시간의 길을 고칠 수 있도록 부서진 인과율을 파괴해야 합니다.,분열된 인과율,5855,2281,147559,0,0,0,0,0,0,0
소리도르미가 시간의 길을 고칠 수 있도록 부서진 인과율을 파괴해야 합니다.,분열된 인과율,5856,2282,147561,0,0,0,0,0,0,0
소리도르미가 시간의 길을 고칠 수 있도록 부서진 인과율을 파괴해야 합니다.,분열된 인과율,5857,2283,147563,0,0,0,0,0,0,0
소리도르미가 시간의 길을 고칠 수 있도록 부서진 인과율을 파괴해야 합니다.,분열된 인과율,5858,2284,147565,0,0,0,0,0,0,0
소리도르미가 시간의 길을 고칠 수 있도록 부서진 인과율을 파괴해야 합니다.,분열된 인과율,5859,2285,147567,0,0,0,0,0,0,0
이드위어드 주변에 서서 지시를 기다려야 합니다.,지식을 찾는 여정의 시작!,6191,2279,147682,0,0,0,0,8,0,1048
지점에 있는 덤불과 잡초를 제거해야 합니다.,휴식잡초 정리,6193,2279,147703,0,0,0,1,0,0,1048
놀이 공격해 오고 있습니다! 맞서 싸워 지점을 지켜내야 합니다!,놀 몰아내기,6194,2279,147707,0,0,0,7,0,0,1048
해골 주변에서 유물을 강조 표시한 후 분석해야 합니다!,고대의 유물 분석,6195,2279,147890,0,0,0,14,0,0,1048
파헤쳐진 흙을 살펴 유물을 발굴해야 합니다!,지점 측량,6196,2279,148274,0,0,0,17,0,0,1048
거대한 용의 뼈를 발굴해야 합니다!,용 뼈 발굴,6197,2279,148276,0,0,0,18,0,0,1048
