Text_lang,Text1_lang,ID,LanguageID,ConditionID,EmotesID,Flags,ChatBubbleDurationMs,VoiceOverPriorityID,SoundKitID[0],SoundKitID[1],EmoteID[0],EmoteID[1],EmoteID[2],EmoteDelay[0],EmoteDelay[1],EmoteDelay[2]
"Socorro, socorro! Estão me reprimindo!",,1,0,0,0,70,0,0,0,0,0,0,0,0,0,0
Sequência de autodestruição ativada.,,3927,0,0,0,69,0,0,0,0,0,0,0,0,0,0
Sejam purificados pelo fogo!,,9426,0,0,0,71,0,0,8046,0,0,0,0,0,0,0
,"Venha, por aqui.",15708,7,0,0,68,0,0,0,44118,0,0,0,0,0,0
"Pare aí mesmo, orquisa! Desmonte e renda-se ou, então, morra!","Pare aí mesmo, orquisa! Desmonte e renda-se ou, então, morra!",33630,0,8193,0,69,0,0,0,0,0,0,0,0,0,0
,"Saiam da frente, tolos!",33631,0,8193,0,69,0,0,0,0,0,0,0,0,0,0
Perda de vida inevitável.,,33996,0,0,0,65,0,0,0,0,0,0,0,0,0,0
Faço o que é preciso.,,33997,0,0,0,65,0,0,0,0,0,0,0,0,0,0
Vocês estão... sem tempo.,,34001,0,0,0,65,0,0,0,0,0,0,0,0,0,0
"Talvez seja a sua imperfeição, aquela que lhes concede o livre arbítrio, que permite que perseverem contra todas as probabilidades calculadas de modo cósmico. Vocês prevalecem onde as próprias criações perfeitas dos Titãs fracassaram.",,34012,0,0,0,65,0,0,0,0,0,0,0,0,0,0
,Capitão! Navio a pique a estibordo! Parece que há sobreviventes!,39672,0,0,0,71,0,0,0,20916,0,0,0,0,0,0
"Agora concentrem-se! Daqui a uma hora, estaremos matando orcs!",,41964,0,0,1,71,0,0,21208,0,0,0,0,0,0,0
Em formação!,,41984,0,0,22,71,0,0,21205,0,0,0,0,0,0,0
Nosso destino é aquela ilha no horizonte.,,42092,0,0,1,71,0,0,21185,0,0,0,0,0,0,0
"É lá que cumpriremos o nosso dever, pelo nosso rei, por Ventobravo e por seu povo...",,42093,0,0,1,71,0,0,21186,0,0,0,0,0,0,0
Grito Infernal mandou seus melhores homens para tomar a ilha. Cuidaremos para que nenhum volte para casa...,,42095,0,0,1,71,0,0,21188,0,0,0,0,0,0,0
Ventobravo nunca cairá!,,42097,0,0,53,71,0,0,21190,0,0,0,0,0,0,0
,"Vão, minhasss nagasss! Recccebam o poderoso Caçççador das Marésss em Azeroth!",42407,0,0,1,118,0,0,0,18874,0,0,0,0,0,0
Você e seus vermes escamosos não são páreo para mim...,,42434,0,0,0,118,0,0,19457,0,0,0,0,0,0,0
,Ssseu tolo! Essste ssserá ssseu último dia de vida!,42435,0,0,15,118,0,0,0,18875,0,0,0,0,0,0
"Você chegou longe demais, serpente. Você sofrerá muito pela transgressão!",,42518,0,0,0,118,0,0,19463,0,0,0,0,0,0,0
,"Venham a mim, meusss ssservosss! Ataquem agora!",42545,0,0,15,118,0,0,0,18876,0,0,0,0,0,0
,Agora! Libertem o kraken!,44211,0,0,15,118,0,0,0,18877,0,0,0,0,0,0
Aaaaaahhh...,,44212,0,0,0,118,0,0,19464,0,0,0,0,0,0,0
,"Sigam-me, meusss bichinhosss! Enfim, o reino do poderoso Neptulon é nossso!",44213,0,0,15,118,0,0,0,18878,0,0,0,0,0,0
"E agora, velho amigo?",,44214,0,0,1,118,0,0,21217,0,0,0,0,0,0,0
Sofremos uma derrota trágica.,,44215,0,0,396,118,0,0,19526,0,0,0,0,0,0,0
Todas as esperanças pelo futuro de nosso mundo se turvaram.,,44216,0,0,396,118,0,0,19527,0,0,0,0,0,0,0
Thrall precisa saber o que aconteceu hoje.,,44217,0,0,396,118,0,0,19528,0,0,0,0,0,0,0
Ele guiará nossos próximos passos.,,44218,0,0,396,118,0,0,19529,0,0,0,0,0,0,0
Erunak! Nããoo!,,44219,0,0,1,118,0,0,21218,0,0,0,0,0,0,0
Graaaahahhhh!,,44220,0,0,396,118,0,0,19530,0,0,0,0,0,0,0
,"Você era um verdadeiro homem do povo, Liam. Diferente de qualquer nobre que já conheci. Eles vão pagar por isso.",44223,0,0,0,71,0,0,0,19686,66,0,0,0,0,0
"E então, xamã, e agora?",,44225,0,0,1,118,0,0,21319,0,0,0,0,0,0,0
Erunak! Atrás de você!,,44226,0,0,1,118,0,0,21320,0,0,0,0,0,0,0
"Que a Luz guarde os espíritos de nossos ancestrais, pois eles permitiram que meu filho repousasse neste solo sagrado.",,50471,0,0,1,71,0,0,19713,0,0,0,0,0,0,0
"O lugar dele é aqui, cercado pelos heróis e patriotas de Guilnéas.",,50472,0,0,1,71,0,0,19714,0,0,0,0,0,0,0
"Nós voltaremos, Liam. Eu juro.",,50473,0,0,66,71,0,0,19715,0,0,0,0,0,0,0
"Guilnéas nunca se esquecerá de sua coragem, Liam.",,50477,0,0,66,71,0,0,19497,0,0,0,0,0,0,0
"Eu peço desculpas pelo engodo, mas foi necessário.",,56129,0,0,0,70,0,0,28571,0,0,0,0,0,0,0
"Em milhares de anos, nunca tínhamos visto um da sua raça.",,56130,0,13211,0,70,0,0,28572,0,0,0,0,0,0,0
Era necessário que eu primeiro avaliasse a natureza do seu coração.,,56131,0,0,0,70,0,0,28573,0,0,0,0,0,0,0
"Venha comigo, pequeno ser. Há algo que quero que você veja.",,56154,0,0,0,70,0,0,28574,0,0,0,0,0,0,0
"Vamos transformar este lugar num redemoinho, heh.",,57715,0,0,0,70,0,0,30625,0,5,0,0,0,0,0
[NOTE: Many placeholder visuals in this cinematic. Expecting Observatory WMO & charge up visuals.],,57899,0,0,0,70,0,0,0,0,0,0,0,0,0,0
"Corre, muçum! Como tipo que nem tu no lanchinho da manhã!",,58170,0,0,0,70,0,0,0,0,0,0,0,0,0,0
"Eu sou Anduin Wrynn, Príncipe de Ventobravo. Eu não morrerei aqui. Não desse jeito!",,58171,0,0,0,70,0,0,27577,0,0,0,0,0,0,0
Por Pandária!,,59411,0,15760,4,70,0,0,31905,0,0,0,0,0,0,0
,Está dando certo! A ferida está fechando!,60365,0,0,1,69,0,0,0,27417,0,0,0,0,0,0
,"Arriscamos tudo, mas conseguimos. Shen-zi Su ficará bem.",60627,0,0,1,69,0,0,0,27418,0,0,0,0,0,0
"Nossa história começa há muito tempo, nos dias do monstruoso Imperador Tian.",,61462,0,0,0,68,0,0,0,0,1,0,0,0,0,0
O Imperador estava precisando de mensageiros e entregadores de confiança.,,61463,0,0,0,68,0,0,0,0,1,0,0,0,0,0
Então ele pegou uma pequena criatura estranha que ele encontrou e a transformou com os poderes do Vale.,,61464,0,0,0,68,0,0,0,0,1,0,0,0,0,0
"O que ele criou foi um ""grômulo"".",,61465,0,0,0,68,0,0,0,0,1,0,0,0,0,0
Vamos falar da natureza do poder. Em minhas mãos eu seguro uma espada. Eu pergunto a você: Quem detém o poder?,,61470,0,0,0,68,0,0,30130,0,1,0,0,0,0,0
"Eu, pois eu tenho a espada!",,61471,0,0,0,68,0,0,30131,0,1,0,0,0,0,0
Um grômulo pode carregar até 5 vezes o seu próprio peso. Eles nunca suam. Eles têm um olfato impressionante.,,61495,0,0,0,68,0,0,0,0,1,0,0,0,0,0
"E seus crânios são mais duros que granito. Curiosamente, todos eles parecem ser parentes.",,61496,0,0,0,68,0,0,0,0,1,0,0,0,0,0
Antigos heróis pandarens livertaram os grômulos da escravidão.,,61497,0,0,0,68,0,0,0,0,1,0,0,0,0,0
"O chefe yaungol mostrou a cara! Venha, vamos acabar com isso!",,61567,0,0,0,70,0,0,29776,0,0,0,0,0,0,0
"Hoje em dia eles ainda são comerciantes, mensageiros, guias e carregadores para expedições que sobem o monte Kun-Lai.",,61643,0,0,0,68,0,0,0,0,1,0,0,0,0,0
"Eles são um povo bem supersticioso, que gosta de usar os nomes de seus amuletos preferidos, os ""sorte-sims"".",,61647,0,0,0,68,0,0,0,0,1,0,0,0,0,0
"Os grômulos suspeitam de qualquer sorte que não possam cheirar, por isso, ao encontrar um grômulo pela primeira vez, é bom ter o bolso cheio de estrume.",,61649,0,0,0,68,0,0,0,0,1,0,0,0,0,0
"Uma raça bem estranha, de fato.",,61650,0,0,0,68,0,0,0,0,1,0,0,0,0,0
"Há muitos milhares de anos, os mogus detinham todo o poder. Eles governavam esta terra com punhos de ferro. Mas, à medida que o império crescia, eles precisavam de uma maneira de policiá-lo e controlá-lo.",,61798,0,0,0,68,0,0,30132,0,1,0,0,0,0,0
Usaram os poderes do Vale e suas próprias magias de moldar a carne para transformar uma raça de lagartos ferozes em uma arma viva. Eles criaram um exército. Um exército de Sauroks. Selvagens sedentos de sangue criados para impor a vontade do imperador.,,61799,0,0,0,68,0,0,30133,0,1,0,0,0,0,0
"Ah, mas existe um problema ao se criar armas vivas. Você percebe?",,61800,0,0,0,68,0,0,30134,0,1,0,0,0,0,0
"Quem, agora, detém o poder?",,61801,0,0,0,68,0,0,30135,0,1,0,0,0,0,0
"Os cruéis sauroks, mesmo com seus pequenos cérebros de lagarto, logo compreenderam a verdade da situação. Eles mataram os inimigos dos mogus.",,61802,0,0,0,68,0,0,30136,0,1,0,0,0,0,0
Depois eles mataram os súditos dos mogus.,,61803,0,0,0,68,0,0,30137,0,1,0,0,0,0,0
E logo eles começaram a matar os próprios mogus.,,61804,0,0,0,68,0,0,30138,0,1,0,0,0,0,0
"O imperador mogu então ordenou que todos os saruoks fossem eliminados. Ele tentou exterminar a raça saurok inteira, mas não conseguiu. Ainda hoje eles assolam Pandária.",,61805,0,0,0,68,0,0,30139,0,1,0,0,0,0,0
"Portanto, perceba: o poder é facilmente tomado, mas não deve ser dado levianamente.",,61806,0,0,0,68,0,0,30140,0,1,0,0,0,0,0
,"Quando quiser, $p.",61828,0,0,396,69,0,0,0,31373,0,0,0,0,0,0
,"Venha, vou lhe mostrar.",61979,0,0,66,70,0,0,0,31359,0,0,0,0,0,0
,Olhe pela luneta.,61980,0,0,396,71,0,0,0,31360,0,0,0,0,0,0
,O Sha do Ódio está dentro daquela construção mantídea... Acho que ele foi atraído para um poderoso hospedeiro.,61981,0,0,396,70,0,0,0,31361,0,0,0,0,0,0
,"Para entrar, vamos precisar dos cristais sintonizados de alguns chefes dos mantídeos da área.",61982,0,0,396,70,0,0,0,31362,0,0,0,0,0,0
,Encontrei esses líderes aqui...,61983,0,0,396,70,0,0,0,31363,0,0,0,0,0,0
,aqui...,61984,0,0,396,70,0,0,0,31364,0,0,0,0,0,0
,e aqui.,61985,0,0,396,70,0,0,0,31365,0,0,0,0,0,0
,Mate todos. Pegue os cristais. Simples assim.,61986,0,0,396,70,0,0,0,31366,0,0,0,0,0,0
"Olá, viajante! Pelo jeito você provou a minha Cerveja dos Sonhos. As visões são meio verdade, meio ilusão. Quem poderia dizer qual é qual?",,62624,0,0,1,70,0,0,31784,0,0,0,0,0,0,0
Aahhn o quê...?,,62776,0,0,0,70,0,0,32476,0,0,0,0,0,0,0
Que barulho foi esse?,,62777,0,0,0,70,0,0,32477,0,0,0,0,0,0,0
"Veio da muralha, senhor.",,62778,0,0,0,70,0,0,32475,0,0,0,0,0,0,0
"Eu sei de ONDE veio, mas o que foi isso?",,62779,0,0,0,70,0,0,32478,0,0,0,0,0,0,0
Não... não...,,62781,0,0,0,70,0,0,32479,0,0,0,0,0,0,0
Homens! Às armas!,,62782,0,0,0,70,0,0,0,0,0,0,0,0,0,0
Vocês três! $n! Ajudem o capitão Escudo de Carvalho no fronte!,,62783,0,0,0,70,0,0,32480,0,0,0,0,0,0,0
Campo Verde! Solo Negro! Cubram nosso flanco esquerdo! Não quero nenhuma surpresa!,,62784,0,0,0,70,0,0,32481,0,0,0,0,0,0,0
"Leven, cuide do lado direito! Você está por conta própria!",,62785,0,0,0,70,0,0,32482,0,0,0,0,0,0,0
"Todo resto! Quem puder empunhar uma arma, proteja a vila! Não deixem eles passarem dessa linha! Vocês...",,62786,0,0,0,70,0,0,32483,0,0,0,0,0,0,0
Nós não temos a mínima chance...,,62789,0,0,0,70,0,0,32485,0,0,0,0,0,0,0
Recuar! RECU-,,62790,0,0,0,70,0,0,32486,0,0,0,0,0,0,0
Rrraaaaa!!!,,62791,0,0,0,70,0,0,29747,0,0,0,0,0,0,0
Quem são vocês?,,62792,0,0,0,70,0,0,32487,0,0,0,0,0,0,0
Importa quem nós somos? Estamos aqui para ajudar.,,62794,0,0,0,70,0,0,29748,0,0,0,0,0,0,0
Ei! Me dá um desses forcados!,,62795,0,0,0,70,0,0,32504,0,0,0,0,0,0,0
Você está se rendendo? Por quê? Por que esses invasores conseguem derrubar uma muralha?,,62796,0,0,0,70,0,0,29749,0,0,0,0,0,0,0
Você tem outra muralha... feita das pessoas que chamam este lugar de lar.,,62797,0,0,0,70,0,0,0,0,0,0,0,0,0,0
Qualquer um de nós daria a vida para proteger esta terra.,,62798,0,0,0,70,0,0,29750,0,0,0,0,0,0,0
Ela pertence a nós...,,62799,0,0,0,70,0,0,0,0,0,0,0,0,0,0
Pertence aos nossos ancestrais...,,62800,0,0,0,70,0,0,0,0,0,0,0,0,0,0
Ela pertence aos nossos filhos.,,62801,0,0,0,70,0,0,0,0,0,0,0,0,0,0
E não vamos deixar que isso mude.,,62802,0,0,0,70,0,0,0,0,0,0,0,0,0,0
Você chegou tarde demais! O Rei Trovão vai se erguer e tomar essa terra de vocês!,,63378,0,0,0,70,0,0,0,0,0,0,0,0,0,0
Como nos encontraram? Preparem as armas. Temos que sair deste desfiladeiro!,,63387,0,0,0,70,0,0,25871,0,6,0,0,0,0,0
Oh... Acho que perdi minha espada.,,63691,0,0,0,68,0,0,30141,0,0,0,0,0,0,0
"Quando a Cisão rasgou os continentes de Azeroth, nós pandarens pensamos que o resto do mundo havia sido completamente destruído.",,63692,0,0,0,68,0,0,30114,0,0,0,0,0,0,0
"Mas à medida que passavam os séculos, um jovem explorador decidiu ver o que havia lá fora. Seu nome era Liu Lang. E ele saiu para descobrir o mundo... nas costas de uma tartaruga!",,63693,0,0,0,68,0,0,30115,0,0,0,0,0,0,0
"Nós celebramos sua coragem com estátua e canções, mas se você estivesse na praia no dia em que ele partiu... bem, tenho certeza de que ele parecia bem ridículo, de fato.",,63694,0,0,0,68,0,0,30116,0,0,0,0,0,0,0
"Oh, como os pandarens riram dele. Mas Liu Lang era mais esperto do que eles pensavam. Tartarugas marinhas sempre retornam à praia onde nasceram. E assim, apesar das brumas que envolviam nossa terra, ele sempre conseguia voltar pra casa.",,63695,0,0,0,68,0,0,30117,0,0,0,0,0,0,0
"A cada intervalo de alguns anos ele voltava - com histórias de cidades misteriosas na areia, nômades vivendo em planícies verdejantes sem fim, um grande império sob o gelo e um reino mágico recoberto em ouro.",,63696,0,0,0,68,0,0,30118,0,0,0,0,0,0,0
"A cada vez que ele voltava, mais e mais pandarens respondiam ao chamado de Liu Lang e se juntavam a ele em sua tartaruga, cada vez maior. Eles eram os mais bravos entre nós: Os exploradores. Os aventureiros.",,63697,0,0,0,68,0,0,30119,0,0,0,0,0,0,0
"E essa é a lição de Liu Lang, meu amigo. Todos riem do explorador. Eles sempre riem... até que ele retorna.",,63698,0,0,0,68,0,0,30120,0,0,0,0,0,0,0
Grandes eventos frequentemente têm origens humildes. Perceba: um lago plácido. Parado. A água como uma lâmina de vidro.,,63699,0,0,396,68,0,0,30150,0,0,0,0,0,0,0
Até eu atirar uma pedra. Um gesto tão pequeno... Mas logo as ondas ocupam o lago inteiro!,,63700,0,0,396,68,0,0,30151,0,0,0,0,0,0,0
"Os jinyus também tem origens humildes. Outrora criaturas primitivas, eles tiveram a felicidade de viver perto de fontes mágicas no Vale.",,63701,0,0,0,68,0,0,30152,0,0,0,0,0,0,0
"A magia das fontes expandiu suas mentes e corpos, até que eles se tornaram uma das grandes culturas ancestrais de Pandária.",,63702,0,0,0,68,0,0,30153,0,0,0,0,0,0,0
"Os mais sábios entre os jinyus podem falar com os rios, assim como você ou eu consultaríamos nossos anciãos.",,63703,0,0,0,68,0,0,30154,0,0,0,0,0,0,0
Nas águas murmurantes eles ouvem o futuro.,,63704,0,0,0,68,0,0,30155,0,0,0,0,0,0,0
Os jinyus e seus parláguas se postam no centro dos principais eventos da história de Pandária.,,63705,0,0,0,68,0,0,30156,0,0,0,0,0,0,0
"Sua visão construiu impérios, libertou escravos e avisou ao nosso Último Imperador da Cisão que estraçalhou Azeroth há dez mil anos.",,63706,0,0,0,68,0,0,30157,0,0,0,0,0,0,0
"Pense a respeito: a menor voz pode mudar o mundo. Pense nisso, camarada, da próxima vez que você decidir atirar pedras!",,63707,0,0,0,68,0,0,30158,0,0,0,0,0,0,0
"Ah, meu pupilo. Você deseja estudar os mantídeos? Esteja avisado: a fronteira pandarênica está cheia de túmulos de pupilos.",,63708,0,0,0,68,0,0,30166,0,1,1,0,0,500,0
Os mantídeos são professores severos.,,63709,0,0,0,68,0,0,30167,0,0,0,0,0,0,0
"A cada geração, os mantídeos enxameiam a muralha do Espinhaço da Serpente em grandes números. Eles matam muitos pandarens, e nós matamos outro tanto deles. E no entanto, a cada geração eles renovam o ataque. Por que eles fazem isso?",,63710,0,0,0,68,0,0,30168,0,0,0,0,0,0,0
Nós pandarens não sabemos.,,63711,0,0,0,68,0,0,30169,0,0,0,0,0,0,0
Nossos antigos textos indicam que os mantídeos sempre existiram. Eles são mais velhos que os mogus. De onde eles vieram?,,63712,0,0,0,68,0,0,30170,0,1,6,0,0,500,0
Nós pandarens não sabemos.,,63713,0,0,0,68,0,0,30171,0,6,0,0,0,0,0
"Talvez, se você conseguir fazer amigos entre os mantídeos e conquistar uma reputação entre eles, eles lhe ensinem seus segredos. Mas eu estou avisando:",,63714,0,0,0,68,0,0,30172,0,0,0,0,0,0,0
Ninguém jamais fez amizade com os mantídeos.,,63715,0,0,0,68,0,0,30173,0,0,0,0,0,0,0
"Eis aqui o que sabemos: Ao massacrar nosso povo, matando milhares de pandarens, geração após geração, eles nos ensinaram o valor da vida. Uma dádiva preciosa mas fugaz. Apagada facilmente em um único instante.",,63716,0,0,0,68,0,0,30174,0,0,0,0,0,0,0
Foi isso que os mantídeos nos ensinaram.,,63717,0,0,0,68,0,0,30175,0,0,0,0,0,0,0
O que você mais teme no mundo? Você conquistou seu medo... ou seu medo conquistou você?,,63718,0,0,0,68,0,0,30159,0,0,0,0,0,0,0
"Nos dias antigos, antes da Cisão do mundo, os imperadores mogus governavam Pandária. Meu povo foi feito de escravo, e eles tinham medo.",,63719,0,0,0,68,0,0,30160,0,0,0,0,0,0,0
"Os mogus eram mestres da dor e da tortura, da magia negra e das armas brutais. Nenhum pandaren, hozen ou jinyu podia resistir ao poder que eles comandavam. E meu povo teve medo.",,63720,0,0,0,68,0,0,30161,0,0,0,0,0,0,0
Foram os mogus que construíram o Espinhaço da Serpente. Os pobres escravos infelizes foram enviados para ajudar na construção e defesa da muralha e para servir de comida aos mantídeos. E meu povo teve medo.,,63721,0,0,0,68,0,0,30162,0,0,0,0,0,0,0
"À medida que o império crescia, os mogus começaram a fazer experimentos com os segredos do Vale. Eles criaram terríveis armas de carne viva e pedra. E meu povo teve medo.",,63722,0,0,0,68,0,0,30163,0,0,0,0,0,0,0
"Em sua audácia, os mogus nunca imaginaram a queda que os esperava, nem que ela seria causada não por seus inimigos, e sim pelos oprimidos. O dia em que um escravo se revoltou...",,63723,0,0,0,68,0,0,30164,0,0,0,0,0,0,0
... e parou de ter medo.,,63724,0,0,0,68,0,0,30165,0,0,0,0,0,0,0
"Fogo! O mais mágico dos elementos. Ele nos aquece, cozinha nossa comida. É a lareira que cria um verdadeiro lar. Nas mãos certas, o fogo pode moldar o ferro em espadas e arados. Se não for controlado, o fogo pode destruir cidades.",,63725,0,0,0,68,0,0,30099,0,0,0,0,0,0,0
O fogo é o instrumento da mudança.,,63726,0,0,0,68,0,0,30100,0,0,0,0,0,0,0
"Há muito tempo, um grupo de robustos caçadores nômades vagava pelo mundo. Por um lance do destino, eles estavam em Pandária quando a cisão separou os continentes de Azeroth. Os andarilhos se viram presos nas Estepes de Taolong, uma terra árida e perigosa.",,63727,0,0,0,68,0,0,30101,0,0,0,0,0,0,0
"Aqueles nobres caçadores encontraram uma maneira de sobreviver sozinhos. O fogo foi a chave. Eles extraíram petróleo do chão e o usaram para aquecer suas casas, cozinhar a comida e queimar os inimigos. Eles ficaram FORTES.",,63728,0,0,0,68,0,0,30102,0,0,0,0,0,0,0
"Das chamas do destino, os yaungóis nasceram. Eles sobreviveram além da muralha, pois recusaram-se a se submeter a uma lei que não fosse a deles.",,63729,0,0,0,68,0,0,30103,0,0,0,0,0,0,0
O destino foi cruel com os yaungóis? É como perguntar se o fogo é bom ou ruim.,,63730,0,0,0,68,0,0,30104,0,0,0,0,0,0,0
O destino é como o fogo. Ele pode nos moldar ou destruir.,,63731,0,0,0,68,0,0,30105,0,0,0,0,0,0,0
Só o que importa é o que você faz com ele.,,63732,0,0,0,68,0,0,30106,0,0,0,0,0,0,0
"Ah! Você quer aprender sobre Shaohao, nosso último e maior imperador? Camarada, eu não tenho tempo para contar todas as aventuras dele, mas o que ele fez há dez mil anos ainda ressoa até hoje.",,63733,0,0,0,68,0,0,30107,0,0,0,0,0,0,0
"Nós sabemos que ele purgou as próprias dúvidas na Floresta de Jade. Que ele se purificou do desespero na Selva de Krasarang. Que ele superou o medo nas Estepes de Taolong. E que ele derrotou a ira, o ódio e a violência no alto das montanhas Kun-Lai.",,63734,0,0,0,68,0,0,30108,0,0,0,0,0,0,0
Isto é sabido. E há templos marcando cada um destes locais sagrados.,,63735,0,0,0,68,0,0,30109,0,0,0,0,0,0,0
"Mas eu quero que você se imagine neste mesmo vale no dia em que ele voltou de sua jornada. Imagine estar aqui quando os portões se abriram para ele. Na época nosso imperador já era uma criatura de pura luz desprovida de dúvida, de medo ou de ódio...",,63736,0,0,0,68,0,0,30110,0,0,0,0,0,0,0
"Dizem que todas as árvores do vale floresceram quando ele entrou, e continuam a florescer até hoje.",,63737,0,0,0,68,0,0,30111,0,0,0,0,0,0,0
"Quem dera pudéssemos todos viver como nosso tão santo imperador. Que pudéssemos nos livrar de todos os fardos e existir em harmonia com o cosmos. ESSA, eu creio, foi a mensagem dele para nós... antes de ele se unir à terra, e esconder Pandária do terror da Cisão.",,63738,0,0,0,68,0,0,30112,0,0,0,0,0,0,0
"Obrigado, querido imperador.",,63739,0,0,0,70,0,0,30113,0,0,0,0,0,0,0
"Um dia, um pai se fartou do comportamento do filhote. ""Você age como um hozen!"", o pai ralhou. Mas seu filho ainda se comportava mal.",,63740,0,0,0,68,0,0,30142,0,0,0,0,0,0,0
"Para ensinar uma lição a ele, o pai arrastou o filhote para a floresta, para que ele visse como viviam os hozens. ""Você viu como são os hozens?"", ele perguntou. ""Você quer viver daquele jeito?""",,63741,0,0,0,68,0,0,30143,0,0,0,0,0,0,0
"Os hozens são bem vivazes, porém sua vida é curta - poucos hozens passam do vigésimo aniversário. Seus líderes têm 14 ou 15 anos. O quão maduro você era aos 15 anos? Medite nisso!",,63742,0,0,0,68,0,0,30144,0,0,0,0,0,0,0
Depois disso o pai perguntou ao filhote o que ele aprendera.,,63743,0,0,0,68,0,0,30145,0,0,0,0,0,0,0
"""Eu aprendi que nós trabalhamos e labutamos na nossa fazendinha, mas que os hozens vivem como se o mundo inteiro fosse o seu jardim"", respondeu o filhote. ""Eu aprendi que nós vivemos à luz de uma só vela, mas que os hozens aproveitam a luz das estrelas. Eu aprendi que eu tenho que ir pra escola todos os dias, mas que os hozens aprendem fazendo"".",,63744,0,0,0,68,0,0,30146,0,0,0,0,0,0,0
"E o filhote concluiu: ""Eu gostaria muito de viver feito um hozen!""",,63745,0,0,0,68,0,0,30147,0,0,0,0,0,0,0
Então quem foi mais sábio? O pai ou o filhote?,,63746,0,0,0,68,0,0,30148,0,0,0,0,0,0,0
"Isso, camarada, é você quem decide.",,63747,0,0,0,68,0,0,30149,0,0,0,0,0,0,0
"Acha que consegue me encarar? A maioria das garotas odeia cobras, mas eu acho que elas são fofas!","Acha que consegue me encarar? A maioria das garotas odeia cobras, mas eu acho que elas são fofas!",64260,0,0,0,68,0,0,0,0,6,0,0,0,0,0
"Ah, eis o meu mestre assassino favorito! Tinha esperança de encontrar você aqui em Pandária.",,65087,0,0,1,68,0,0,29135,0,0,0,0,0,0,0
"Excelente, vamos conversar.",,65088,0,0,0,68,0,0,29136,0,0,0,0,0,0,0
"Tong! Bebidas, por favor.",,65089,0,0,0,68,0,0,29137,0,0,0,0,0,0,0
"Meu pai, Asa da Morte, tentou destruir Azeroth inteira.",,65090,0,0,0,68,0,0,29138,0,0,0,0,0,0,0
"Ele estava desencaminhado, é claro, mas numa coisa ele tinha razão. Nosso mundo é... tão frágil.",,65091,0,0,0,68,0,0,29139,0,0,0,0,0,0,0
Somos um ponto de luz num universo de trevas. Uma vela na tempestade.,,65092,0,0,0,68,0,0,29140,0,0,0,0,0,0,0
Às vezes penso que foi a própria precariedade do nosso mundo que enlouqueceu meu pai.,,65093,0,0,0,68,0,0,29141,0,0,0,0,0,0,0
"Ah, obrigado, Tong.",,65094,0,0,0,68,0,0,29142,0,0,0,0,0,0,0
"Bom, vamos direto ao assunto: acredito que estamos rumando a um confronto final. E não, não me refiro ao conflito atual entre Aliança e Horda.",,65095,0,0,0,68,0,0,29143,0,0,0,0,0,0,0
"Pode acreditar, o que Garrosh Grito Infernal fez em Theramore não é nada comparado aos horrores que neste exato momento se dirigem ao nosso frágil lar.",,65096,0,0,0,68,0,0,29144,0,0,0,0,0,0,0
Mas esta guerra me preocupa profundamente. Você compreende minha inquietação?,,65097,0,0,0,68,0,0,29145,0,0,0,0,0,0,0
Uma Azeroth DIVIDIDA não poderá de forma alguma resistir às trevas.,,65098,0,0,0,68,0,0,29146,0,0,0,0,0,0,0
Esta guerra tem que acabar. E logo. Antes que consuma nossa força!,,65099,0,0,0,68,0,0,29147,0,0,0,0,0,0,0
Quero que você saiba que a sua Aliança tem meu apoio total e inquestionável nesta campanha.,,65100,0,0,0,68,0,0,29148,0,0,0,0,0,0,0
Pode ter certeza de que minha lealdade está com a Horda.,,65101,0,0,0,68,0,0,29149,0,0,0,0,0,0,0
Como encerrar o conflito rápida e decisivamente? A resposta está em heróis e heroínas como você.,,65102,0,0,0,68,0,0,29150,0,0,0,0,0,0,0
Vamos garantir que você seja forte o bastante... E então conseguir o equipamento adequado.,,65103,0,0,0,68,0,0,29151,0,0,0,0,0,0,0
"Duzentos navios à minha disposição, e aquele que leva meu FILHO desaparece!",,65150,0,0,1,70,0,0,31808,0,1,0,0,0,0,0
"Sinto muito, mas não posso voltar agora.",,65151,0,0,1,70,0,0,31805,0,1,0,0,0,0,0
Eu decidi procurar o Vale... Vale... Vale...,,65152,0,0,1,70,0,0,31806,0,1,0,0,0,0,0
INVADA a costa e PINTE O CONTINENTE DE VERMELHO!,,65153,0,0,1,70,0,0,31807,0,5,0,0,0,0,0
"Ah, chegou mais alguém de além das brumas.",,65214,0,0,396,68,0,0,29030,0,0,0,0,0,0,0
"Há dez mil anos, o último imperador pandaren me procurou em busca de conselho. Ele também estava em conflito. Vamos ver se você está certo, Taran. Vamos ver como alguém de fora lida com os conflitos da alma.",,65215,0,0,396,68,0,0,29031,0,0,0,0,0,0,0
Concordamos que é nobre lutar por uma causa justa: defender o lar ou a família. Mas e vingança? E raiva? Sinto que essas emoções são profundas nesta alma.,,65273,0,0,396,68,0,0,29033,0,0,0,0,0,0,0
"Muito bem, Zhi. Não falta paixão aos estrangeiros de além das névoas, mas vamos ver se eles conseguem mesmo controlá-las. Além da raiva está o ódio, a fonte de toda desgraça. O que é isso? Seu ódio tem face!",,65326,0,0,396,68,0,0,29035,0,0,0,0,0,0,0
"Eis alguém que de fato mostrou domínio sobre a raiva. Entre as palavras do filhote e tais atos de heroísmo, acho que compreendo. Os que vêm de além das névoas estão calejados pela guerra. Eles têm cicatrizes, mas aprenderam muito. Confio neles.",,65350,0,0,396,68,0,0,29037,0,0,0,0,0,0,0
Está decidido! O Vale das Flores Eternas permanecerá aberto! As transgressões dos estrangeiros foram muitas... mas vejo neles a capacidade de consertar o mal que foi feito.,,65352,0,0,377,68,0,0,38210,0,0,0,0,0,0,0
Vou consultar os outros. Encontre-me nos portões.,,65354,0,0,396,68,0,0,29040,0,0,0,0,0,0,0
Você está atrasado.,,65404,0,0,0,70,0,0,31492,0,0,0,0,0,0,0
Os restos do Rei Trovão foram levados pra Ilha da Desforra.,,65405,0,0,0,70,0,0,31493,0,0,0,0,0,0,0
Nós realizamos os ritos antigos...,,65406,0,0,0,70,0,0,31494,0,0,0,0,0,0,0
"Agora, o VERDADEIRO imperador de Pandária vive e respira uma vez mais.",,65407,0,0,0,70,0,0,31495,0,0,0,0,0,0,0
Ai dos usurpadores pandarens! Os mogus vão mandar nessa terra de novo e nós Zandalari vamos ter uma casa nova...,,65409,0,0,0,70,0,0,31496,0,0,0,0,0,0,0
"Protegê os resto, rapeize!",,65410,0,0,0,70,0,0,31481,0,0,0,0,0,0,0
