Text_lang,Text1_lang,ID,LanguageID,ConditionID,EmotesID,Flags,ChatBubbleDurationMs,VoiceOverPriorityID,SoundKitID[0],SoundKitID[1],EmoteID[0],EmoteID[1],EmoteID[2],EmoteDelay[0],EmoteDelay[1],EmoteDelay[2]
You have no idea how long I've been waiting to do this.,You have no idea how long I've been waiting to do this.,81569,0,0,5,68,0,0,0,0,0,0,0,0,0,0
"Die, pig!","Die, pig!",81570,0,0,5,68,0,0,0,0,0,0,0,0,0,0
"I will avenge you, Tannosh.","I will avenge you, Tannosh.",81571,0,0,5,68,0,0,0,0,0,0,0,0,0,0
"Go with the Light, sister.","Go with the Light, sister.",81572,0,0,5,68,0,0,0,0,0,0,0,0,0,0
May your spirit find rest with those of your people's ancestors.,May your spirit find rest with those of your people's ancestors.,81573,0,0,5,68,0,0,0,0,0,0,0,0,0,0
Kill them. Kill them all.,Kill them. Kill them all.,81574,0,0,5,68,0,0,0,0,0,0,0,0,0,0
"Make them suffer, like I suffered.","Make them suffer, like I suffered.",81575,0,0,5,68,0,0,0,0,0,0,0,0,0,0
Thanks.,Thanks.,81576,0,0,5,68,0,0,0,0,0,0,0,0,0,0
I've never held a weapon before.,I've never held a weapon before.,81577,0,0,5,68,0,0,0,0,0,0,0,0,0,0
It feels good.,It feels good.,81578,0,0,5,68,0,0,0,0,0,0,0,0,0,0
Ooh!,Ooh!,81579,0,0,5,68,0,0,0,0,0,0,0,0,0,0
"You give my people hope, stranger.","You give my people hope, stranger.",81580,0,0,5,68,0,0,0,0,0,0,0,0,0,0
Obrigado! <Dagg solta uma risada gutural.>,,81585,0,0,0,68,0,0,0,0,0,0,0,0,0,0
Não sei como os orcs sempre me pegam. <Dagg resmunga desanimado.>,,81593,0,0,0,68,0,0,0,0,0,0,0,0,0,0
Oi de novo.,,81594,0,0,0,68,0,0,0,0,0,0,0,0,0,0
"Vão ter que ficar na dúvida: Dagg foi pego ou pegou eles?

Você acabou com o disfarce do Dagg! Mas o Dagg acha que você é especial. Dagg é o mestre de disfarce e quer ir contigo.

Tá todo mundo com o Dagg nessa.",,81595,0,0,0,68,0,0,0,0,0,0,0,0,0,0
Todos concordam com Dagg? (Seguidor da Guarnição),Todos concordam com Dagg? (Seguidor da Guarnição),81596,0,0,0,68,0,0,0,0,0,0,0,0,0,0
Não estraga o disfarce de Dagg!$b$bEles nunca interroga uma árvere.$b$bDagg tem certeza disso.,,81607,0,0,0,68,0,0,0,0,0,0,0,0,0,0
"Não deixa eles ver a gente falando!

Eles nunca interroga um duas-cabeça.

Dagg é unânime nessa.",,81608,0,0,0,68,0,0,0,0,0,0,0,0,0,0
Shh! Aja naturalmente.,,81609,0,0,0,68,0,0,0,0,0,0,0,0,0,0
Shh! Cê vai estragar meu disfarce!,,81610,0,0,0,68,0,0,0,0,0,0,0,0,0,0
"Sinto muito, mas tenho que partir e voltar ao bando em Wor'gol. Aka'Magosh.",,81674,0,0,396,68,0,0,0,0,0,0,0,0,0,0
"Sai da frente, peão!","Sai da frente, peão!",81675,0,0,0,68,0,0,0,0,0,0,0,0,0,0
Esta acólita e eu vamos reunir o resto do grupo. Faze tudo ao teu alcance para impedir aquele orc de abrir o portal!,,81787,0,0,0,68,0,0,44597,0,0,0,0,0,0,0
,Voltaremos com reforços.,81788,0,0,0,68,0,0,0,45556,0,0,0,0,0,0
NÃO! Esse não pode ser o destino do meu povo!,,81808,0,0,274,68,0,0,45360,0,0,0,0,0,0,0
"Ner'zhul nos conduz a esse destino. Para salvar Karabor, precisamos detê-lo.",,81809,0,0,1,68,0,0,45361,0,0,0,0,0,0,0
"Encontra-me na Clareira do Crepúsculo, camarada. Temos muito o que fazer.",,81810,0,0,1,68,0,0,45362,0,0,0,0,0,0,0
"Povo do Forte Wrynn, nosso comandante terminou de construir um prédio novo!",,81821,0,0,0,68,0,0,43534,0,0,0,0,0,0,0
Vamos ter que trabalhar juntos se quisermos entrar em produção total. Não deixe o comandante esperando!,,81822,0,0,0,68,0,0,43535,0,0,0,0,0,0,0
"Atenção, galera. Seguinte: graças à nossa liderança, temos um novo prédio!",,81824,0,0,0,68,0,0,44485,0,0,0,0,0,0,0
"Temos que botar essa estrutura para rodar agora mesmo, entenderam? É pra ontem!",,81825,0,0,0,68,0,0,44486,0,0,0,0,0,0,0
Sei que você pode dar conta das coisas daqui em diante. Bom trabalho!,,81826,0,0,0,68,0,0,43536,0,0,0,0,0,0,0
"Você não vai precisar de mim. Afinal, é você quem tá no comando.",,81827,0,0,0,68,0,0,44487,0,0,0,0,0,0,0
,Vou levar essa draenaia de volta a Hadggar. Não deixe aquele orc abrir o portal!,81832,0,0,0,68,0,0,0,45714,0,0,0,0,0,0
,Voltaremos com reforços.,81833,0,0,0,68,0,0,0,45556,0,0,0,0,0,0
"Flutuador de energia ativado. Reiniciando sistemas principais. Por favor, aguarde.",,81866,0,0,0,68,0,0,0,0,0,0,0,0,0,0
"Muito bem, Deliciotron 8000. Volte ao trabalho!",,81867,0,0,0,68,0,0,0,0,0,0,0,0,0,0
Comando não reconhecido. Só serão aceitos comandos $gdo proprietário:da proprietária; do Deliciotron 8000: $p.,,81868,0,0,0,68,0,0,0,0,0,0,0,0,0,0
"Que se dane, eu desisto. $p, pode ficar com ele! Para mim, chega!",,81870,0,0,0,68,0,0,0,0,0,0,0,0,0,0
"Muito bem, Deliciotron 8000. Execute o comando X47G5!",,81875,0,0,0,68,0,0,0,0,0,0,0,0,0,0
"Chega, já basta. $p, pode ficar com ele! Eu vou voltar a fabricar tanques daqui para a frente!",,81876,0,0,0,68,0,0,0,0,0,0,0,0,0,0
"Ah, doce liberdade! Você não vai se arrepender disso, comandante. Vou fazer os melhores armamentos de Draenor!",,81957,0,0,0,68,0,0,45831,0,0,0,0,0,0,0
Vejamos o que temos aqui.,,81959,0,0,0,68,0,0,45832,0,0,0,0,0,0,0
"A forja é a alma da fundição. Essa aqui é pequena, mas, com o equipamento certo, eu posso melhorá-la.",,81960,0,0,0,68,0,0,45833,0,0,0,0,0,0,0
"Essas parecem boas. Com algumas modificações, eu poderei carregá-las nos canhões para fazer disparos de fragmentação.",,81961,0,0,0,68,0,0,0,0,0,0,0,0,0,0
Shhh! Não deixa eles verem a gente conversando ou você vai estragar meu disfarce!,,81971,0,0,0,68,0,0,0,0,0,0,0,0,0,0
"Vou ver se faço esse troço pegar. Hadggar, se vira aí!",,81980,0,0,0,68,0,0,45748,0,0,0,0,0,0,0
"Faremos o que pudermos, Thaelin.",,81981,0,0,0,68,0,0,44866,0,0,0,0,0,0,0
"$n, mantenha esses orcs longe de nós!",,81982,0,0,0,68,0,0,44867,0,0,0,0,0,0,0
,Tanque na subida! Cuidado!,81983,0,0,0,68,0,0,0,45555,0,0,0,0,0,0
Que controles LOUCOS! Nunca mais piloto um tanque construído por orcs.,,81984,0,0,0,68,0,0,45749,0,0,0,0,0,0,0
Lá vêm eles! Aguentem firme.,,81985,0,0,0,68,0,0,46408,0,0,0,0,0,0,0
"Estão trazendo explosivos! $n, destrua as carroças antes que se aproximem!",,81986,0,0,0,68,0,0,45701,0,0,0,0,0,0,0
Eles são tantos...,,81987,0,0,0,68,0,0,44779,0,0,0,0,0,0,0
"Não desista agora, paladino.",,81988,0,0,0,68,0,0,46709,0,0,0,0,0,0,0
É isso aí! Coloquei o bichão para funcionar!,,81989,0,0,0,68,0,0,45750,0,0,0,0,0,0,0
Ahh ha ha haaa! Bela tentativa!,,82005,0,0,0,68,0,0,45700,0,0,0,0,0,0,0
"Very well, but don't take long. I will require both of you later, and you will need to be alive.",,82103,0,0,0,68,0,0,0,0,0,0,0,0,0,0
"Come, Cordana!",,82111,0,0,0,68,0,0,0,0,0,0,0,0,0,0
I am forming a small party to scout the enemy's fortifications.,I am forming a small party to scout the enemy's fortifications.,82117,0,0,0,68,0,0,0,0,0,0,0,0,0,0
"Thrall, take command of the remaining survivors and meet us up ahead.","Thrall, take command of the remaining survivors and meet us up ahead.",82120,0,924,0,68,0,0,0,0,0,0,0,0,0,0
"Maraad, take command of the remaining survivors and meet us up ahead.","Maraad, take command of the remaining survivors and meet us up ahead.",82121,0,923,0,68,0,0,0,0,0,0,0,0,0,0
It will be done.,,82122,0,924,0,68,0,0,0,0,0,0,0,0,0,0
"Yes, Archmage.",,82124,0,923,0,68,0,0,0,0,0,0,0,0,0,0
Up ahead! Look at that!,,82130,0,923,0,68,0,0,0,0,0,0,0,0,0,0
Ancestors help us... look at that!,,82131,0,924,0,68,0,0,0,0,0,0,0,0,0,0
Eu sei o que preciso fazer.,,82149,0,0,0,68,0,0,46164,0,0,0,0,0,0,0
SANGUE E HONRA!,,82150,0,0,0,68,0,0,46165,0,0,0,0,0,0,0
KILROGG OLHO MORTO,KILROGG OLHO MORTO,82151,0,0,0,71,0,0,0,0,0,0,0,0,0,0
SENHOR DA GUERRA DOS OLHOS SANGRENTOS,SENHOR DA GUERRA DOS OLHOS SANGRENTOS,82152,0,0,0,71,0,0,0,0,0,0,0,0,0,0
Olha o que apareceu na minha floresta. Carne fresca!,,82153,0,0,0,70,0,0,0,0,0,0,0,0,0,0
"We won't go without a fight, Deadeye.",,82154,0,0,0,68,0,0,0,0,0,0,0,0,0,0
Parece que você está precisando de uma mãozinha.,,82155,0,0,0,68,0,0,0,0,0,0,0,0,0,0
No! Fight me instead!,,82156,0,0,0,68,0,0,0,0,0,0,0,0,0,0
VÁAAA... ENCONTRAR... HADGGARRRR...,,82157,0,0,0,68,0,0,46166,0,0,0,0,0,0,0
,"Oba! Muito, muito, muito, muito obrigada mesmo!",82178,0,0,1,68,0,0,0,0,0,0,0,0,0,0
"Achei que todo mundo tinha me esquecido. Obrigado, gentil $Gsenhor:senhora;!",,82179,0,0,1,68,0,0,0,0,0,0,0,0,0,0
"Uau, tu enfrentaste todos os orcs? Tu és forte mesmo!",,82180,0,0,1,68,0,0,0,0,0,0,0,0,0,0
,"<A menina chora, inconsolável.>",82182,0,0,1,68,0,0,0,0,0,0,0,0,0,0
"Se tudo der certo, os menores vão fugir e nós poderemos dar início à construção.",,82199,0,0,0,68,0,0,0,0,0,0,0,0,0,0
"We won't go without a fight, Deadeye.",,82215,0,0,0,68,0,0,0,0,0,0,0,0,0,0
Mm.,,82258,0,0,0,70,0,0,46707,0,0,0,0,0,0,0
Esse escravizador não sabe nada sobre honra.,,82259,0,0,0,68,0,0,44590,0,0,0,0,0,0,0
Não podemos nos esconder para sempre.,,82260,0,0,0,68,0,0,44851,0,0,0,0,0,0,0
Step into my arena and die with honor.,,82261,0,0,0,70,0,0,0,0,0,0,0,0,0,0
"Vocês entraram em minha arena, estranhos. Vocês só sairão daqui como vencedores ou como cadáveres.",,82262,0,0,0,70,0,0,0,0,0,0,0,0,0,0
Such is the way of the SHATTERED HAND.,,82263,0,0,0,68,0,0,0,0,0,0,0,0,0,0
"Uma arena de combate. Pode ser uma armadilha, mas pelo menos morreremos com honra.",,82264,0,0,0,68,0,0,46407,0,0,0,0,0,0,0
,"Depressa, Yrel. A força do teu martelo será de grande ajuda.",82361,0,0,1,68,0,0,0,0,0,0,0,0,0,0
Vou seguir em frente e explorar os portões enquanto você dá conta das catapultas. Lok'tar ogar!,,82486,0,0,0,68,0,0,45840,0,0,0,0,0,0,0
"Comandante, aqui!",,82494,0,0,0,68,0,0,45841,0,0,0,0,0,0,0
Malditos ogros e sua magia! Eu não consigo achar um jeito de derrubar a barreira deles. Vamos ter que entrar escondidos.,,82496,0,0,0,68,0,0,45827,0,0,0,0,0,0,0
"Eu vou primeiro e limpo o caminho, me encontre do outro lado.",,82497,0,0,0,68,0,0,0,0,0,0,0,0,0,0
"Sangue e trovão, que batalha!",,82525,0,0,0,68,0,0,45838,0,0,0,0,0,0,0
Vamos matar uns ogros!,,82530,0,0,1,68,0,0,45839,0,0,0,0,0,0,0
"Voa comigo, comandante. Vamos ajudá-los do alto!",,82568,0,0,1,70,0,0,44799,0,0,0,0,0,0,0
A luz purificadora do Naaru é tanto nosso martelo quanto nosso escudo.,,82569,0,0,1,70,0,0,44800,0,0,0,0,0,0,0
Eles estão nos portões do templo. Voa mais perto! Apressa-te!,,82570,0,0,1,70,0,0,44801,0,0,0,0,0,0,0
Dá meia-volta. Precisamos limpar os degraus.,,82571,0,0,1,70,0,0,44802,0,0,0,0,0,0,0
Exarca Akama! Atenção aos flancos!,,82572,0,0,1,70,0,0,0,0,0,0,0,0,0,0
"Obrigado, velho amigo!",,82573,0,0,1,70,0,0,0,0,0,0,0,0,0,0
Nunca mais tuas hordas órquicas turvarão a luz de Karabor!,,82574,0,0,1,70,0,0,44803,0,0,0,0,0,0,0
Avançar! Pela luz dos Naarus!,,82575,0,0,1,70,0,0,44804,0,0,0,0,0,0,0
"Avante com a luz, irmãos!",,82576,0,0,1,70,0,0,44805,0,0,0,0,0,0,0
Fizemos tudo o que podíamos daqui de cima...,,82577,0,0,1,70,0,0,44806,0,0,0,0,0,0,0
Nós conseguimos! Nós rompemos o bloqueio!,,82578,0,0,1,70,0,0,0,0,0,0,0,0,0,0
Rompemos o cerco principal. Vamos nos encontrar com as forças terrestres.,,82579,0,0,1,70,0,0,44822,0,0,0,0,0,0,0
Essas são as nossas últimas tropas. Ficaremos aqui para proteger os portões do templo.,,82580,0,0,1,70,0,0,46723,0,0,0,0,0,0,0
"Camarada, preciso que tu abras caminho até o porto.",,82581,0,0,1,70,0,0,46724,0,0,0,0,0,0,0
,Vou abordar o inimigo pelo sul. Que a luz dos naarus te guie.,82582,0,0,1,70,0,0,0,45626,0,0,0,0,0,0
,"Comandante, o Naaru veio nos ajudar. Temos que defendê-lo enquanto ele reúne sua força!",82583,0,0,1,70,0,0,0,45628,0,0,0,0,0,0
,Conseguimos! Agora vamos encerrar esse ataque...,82584,0,0,1,70,0,0,0,45629,0,0,0,0,0,0
Testemunhem o VERDADEIRO poder da Horda de Ferro!,,82585,0,0,1,70,0,0,0,0,0,0,0,0,0,0
BASTA. Chega de brincadeira. Cuidarei de você pessoalmente.,,82586,0,0,1,70,0,0,0,0,0,0,0,0,0,0
,Lá no alto! O comandante da frota se revela.,82587,0,0,1,70,0,0,0,45630,0,0,0,0,0,0
,O que o Naaru está fazendo?,82588,0,0,6,70,0,0,0,45631,0,0,0,0,0,0
Está feito. Nós vencemos!,,82589,0,0,1,70,0,0,44823,0,0,0,0,0,0,0
,"Camarada, tu lutaste sem temor. Por isso, aceita minha gratidão.",82590,0,0,1,70,0,0,0,45632,0,0,0,0,0,0
"Saudações, redenção do meu povo!",,82592,0,0,1,70,0,0,45364,0,0,0,0,0,0,0
"Se tu estás escutando esta mensagem, é porque eu me fui — mas Karabor está a salvo.",,82593,0,0,1,70,0,0,45365,0,0,0,0,0,0,0
Devo-te uma explicação.,,82594,0,0,1,70,0,0,45366,0,0,0,0,0,0,0
"Os Naarus que nós, draeneis, reverenciamos são criaturas de pura luz.",,82595,0,0,1,70,0,0,45367,0,0,0,0,0,0,0
"Mas, quando a morte deles se aproxima, eles perdem sua essência, revertendo-se em criaturas de sombras.",,82596,0,0,1,70,0,0,45368,0,0,0,0,0,0,0
"Quando nós, draeneis, chegamos neste mundo, os Naarus nos acompanharam. Mas eles não conseguiram impedir que nossa nave caísse.",,82597,0,0,1,70,0,0,45369,0,0,0,0,0,0,0
"A ""Estrela Negra"" que apareceu nos céus sobre Draenor naquela noite terrível não era nenhum corpo celeste...",,82598,0,0,1,70,0,0,45370,0,0,0,0,0,0,0
"Era uma naaru caída, ejetada de nossa nave em momentos de pânico e terror. Seu nome era K'ara.",,82599,0,0,1,70,0,0,45371,0,0,0,0,0,0,0
"O que um dia fora uma criatura de fé e beleza se tornou um deusa de trevas e fome, uma fonte viva de escuridão.",,82600,0,0,1,70,0,0,45372,0,0,0,0,0,0,0
"Devemos muito a K'ara. Sem sua ajuda, meu povo jamais teria escapado de Argus, nosso mundo natal.",,82601,0,0,1,70,0,0,45373,0,0,0,0,0,0,0
Ver K'ara se transformar em sombra foi um fardo muito pesado. Quando os naarus retornaram... Eu fiz o que precisava fazer.,,82602,0,0,1,70,0,0,45374,0,0,0,0,0,0,0
"Lembra-te. A vida é a luz, e a luz é a vida. Elas podem ser trocadas, mas nada jamais é perdido.",,82603,0,0,1,70,0,0,45375,0,0,0,0,0,0,0
As trevas... estão vindo...,,82676,0,0,1,70,0,0,0,0,0,0,0,0,0,0
As sombras se aproximam!,,82677,0,0,1,70,0,0,0,0,0,0,0,0,0,0
A Estrela Negra se aproxima...,,82678,0,0,1,70,0,0,0,0,0,0,0,0,0,0
O caos vai consumir tudo...,,82679,0,0,1,70,0,0,0,0,0,0,0,0,0,0
"Valeu, cara. Esses Brado Guerreiro são maroto e pegaram o velho J'wan na maciota.",,82684,1,0,0,68,0,0,0,0,0,0,0,0,0,0
Tô ralando pro reino do Samedi. A gente se vê.,,82685,1,0,0,68,0,0,0,0,0,0,0,0,0,0
SENHOR DA GUERRA MÃO NEGRA,SENHOR DA GUERRA MÃO NEGRA,82687,0,0,0,71,0,0,0,0,0,0,0,0,0,0
LÍDER DOS ORCS DA ROCHA NEGRA,LÍDER DOS ORCS DA ROCHA NEGRA,82688,0,0,0,71,0,0,0,0,0,0,0,0,0,0
"'Gradecido pelas bênção, cara. O Senhor da Tumba sorri pra ti.",,82711,1,0,0,68,0,0,0,0,0,0,0,0,0,0
Tem alguma parada em Oshu'gun puxando minha alma. Vô dar uma sacada.,,82712,1,0,0,68,0,0,0,0,0,0,0,0,0,0
Que que é isso? Eu tô defunto!,,82714,1,0,0,68,0,0,0,0,0,0,0,0,0,0
Vô assombrá esses Brado Guerreiro pra sempre. Vodu pra esses jacu.,,82715,1,0,0,68,0,0,0,0,0,0,0,0,0,0
AHHHHHHHHHHHHHHHHHHHHHHHH!,AHHHHHHHHHHHHHHHHHHHHHHHH!,82716,0,0,0,68,0,0,0,0,0,0,0,0,0,0
"Fúrias do Trono dos Elementos, nós respondemos ao seu chamado. Como podemos servir?",,82847,0,0,1,68,0,0,46704,0,0,0,0,0,0,0
"Comandante! Quando eu ouvi o grito de agonia do ogro, vim correndo. Deu tudo certo?",,82858,0,0,0,68,0,0,45826,0,0,0,0,0,0,0
Alguém pediu uma carona?,,82860,0,0,0,68,0,0,0,0,0,0,0,0,0,0
Vocês três! Acompanhem-no ao campo de batalha e fiquem atentos ao meu chamado.,,82963,0,0,0,68,0,0,44885,0,0,0,0,0,0,0
Eu tenho um plano.,,82964,0,0,0,68,0,0,44886,0,0,0,0,0,0,0
"E a Mãe Corvo falou comigo: Krikka, você é meu filho querido. Você deve procurar meus outros filhos desencaminhados e trazê-los de volta ao ninho.",,82969,0,0,0,68,0,0,0,0,0,0,0,0,0,0
"Quando todos do bando estiverem reunidos o fim chegará. O mundo será despedaçado em uma grande catástrofe! Não tema, pois a Mãe Corvo nos salvará!",,82970,0,0,0,68,0,0,0,0,0,0,0,0,0,0
A Mãe Corvo virá dos céus buscar seus filhos. Nós nos ergueremos sobre suas grandes asas de ébano para assumir nosso lugar de direito em seu reino sombrio!,,82971,0,0,0,68,0,0,0,0,0,0,0,0,0,0
"Até que este momento chegue, dediquem seu louvor à Mãe Corvo! Busquem em sua grande prole orientação e força. Que ela lance sua sombra sobre vocês.",,82972,0,0,0,68,0,0,0,0,0,0,0,0,0,0
Escriba! Anotou tudo isso?,,82973,0,0,0,68,0,0,0,0,0,0,0,0,0,0
"Sim, Alto Parlacorvo.",,82974,0,0,0,68,0,0,0,0,0,0,0,0,0,0
Salve a Mãe Corvo!,,82975,0,0,0,68,0,0,0,0,0,0,0,0,0,0
"Com a pedra-chave, somente você poderá atravessar. Quando entrar lá, desative os escudos e nós iremos até você.",,82993,0,0,1,70,0,0,45396,0,0,0,0,0,0,0
,"Ared não gostaria de me ver parada aqui, chorando desse jeito. Vamos dar uma olhada nessa sua armaria.",83044,0,0,0,68,0,0,0,44682,0,0,0,0,0,0
,"Nossa, isso é fantástico! Se Ared estivesse vivo para ver, ele ficaria tão orgulhoso!",83045,0,0,0,68,0,0,0,44683,0,0,0,0,0,0
As docas. Corram para as docas. Corram. CORRAM!,,83047,0,0,0,68,0,0,44874,0,0,0,0,0,0,0
"Pode vir, Grito Infernal!",,83048,0,0,0,68,0,0,45043,0,0,0,0,0,0,0
"Não seja tolo, Ga'nar – Corra! Lutaremos em outra ocasião.",,83049,0,0,0,68,0,0,46712,0,0,0,0,0,0,0
,Cuidado!,83050,0,0,0,68,0,0,0,45557,0,0,0,0,0,0
,Segui em frente. Vejo navios adiante.,83051,0,0,0,68,0,0,0,45558,0,0,0,0,0,0
O exército deles inteiro está atrás de nós.,,83052,0,0,0,68,0,0,0,0,0,0,0,0,0,0
,O exército deles inteiro está atrás de nós.,83053,0,0,0,68,0,0,0,0,0,0,0,0,0,0
Para onde?,,83054,0,0,0,68,0,0,44598,0,0,0,0,0,0,0
"Ide para os navios, no final do caminho.",,83056,0,0,0,68,0,0,44780,0,0,0,0,0,0,0
"Por aqui. Vão, vão, vão!",,83057,0,0,0,68,0,0,44875,0,0,0,0,0,0,0
"Não há para onde fugir, forasteiros. Este é o MEU mundo. Nós vamos encontrar vocês!",,83058,0,0,0,68,0,0,46503,0,0,0,0,0,0,0
"Nós, Lobos do Gelo, estaremos esperando por você, Grito Infernal! Você, seus ogros e toda a sua Horda de Ferro... Considere-se um orc morto!",,83060,0,0,0,68,0,0,45044,0,0,0,0,0,0,0
"Ignorai as ameaças dele. Iremos até Lua Negra em busca de reforços. Desta vez, os draeneis triunfarão.",,83061,0,0,0,68,0,0,44781,0,0,0,0,0,0,0
Vamos partir então. Precisaremos construir uma fortaleza para termos chance de acabar com a Horda de Ferro. E precisaremos do auxílio dos nativos.,,83062,0,0,0,70,0,0,44876,0,0,0,0,0,0,0
Para Lua Negra!,,83063,0,0,0,70,0,0,44877,0,0,0,0,0,0,0
Para o lar dos Lobo do Gelo!,,83064,0,0,0,70,0,0,44878,0,0,0,0,0,0,0
,Vou seguir em frente e explorar os portões enquanto você dá conta das catapultas. Dioniss aca.,83102,0,0,0,68,0,0,0,44677,0,0,0,0,0,0
,"Comandante, aqui!",83105,0,0,0,68,0,0,0,44678,0,0,0,0,0,0
,"A barreira mágica é forte demais para os nossos explosivos. Eu não consigo encontrar uma maneira de derrubá-la, então vamos ter que dar um jeito de contornar.",83106,0,0,0,68,0,0,0,44679,0,0,0,0,0,0
,"Eu vou primeiro e limpo o caminho, me encontre do outro lado.",83107,0,0,0,68,0,0,0,0,0,0,0,0,0,0
Eles já vão chegar. Vamos embora!,,83127,0,0,0,68,0,0,45751,0,0,0,0,0,0,0
Sistema de evacuação pessoal ligado.,,83132,0,0,0,68,0,0,0,0,0,0,0,0,0,0
,"Pela luz, que batalha!",83145,0,0,4,68,0,0,0,44672,0,0,0,0,0,0
,Vamos lá!,83154,0,0,1,68,0,0,0,44681,0,0,0,0,0,0
Essa passou perto.,,83203,0,0,0,68,0,0,44891,0,0,0,0,0,0,0
Não há como voltar. Nós avançamos pela boca da fera adentro.,,83204,0,0,0,68,0,0,44892,0,0,0,0,0,0,0
Quem diria que os draeneis guardavam tesouros tão... deliciosos no templo deles?,,83255,0,0,0,70,0,0,44423,0,0,0,0,0,0,0
"Vocês ousam me desafiar, defensores de Auchindoun!?",,83256,0,0,0,70,0,0,44424,0,0,0,0,0,0,0
Corte minhas amarras... e o portal cairá...,,83257,0,0,0,70,0,0,45331,0,0,0,0,0,0,0
Que decadência… tudo vai queimar.,,83258,0,0,0,70,0,0,44425,0,0,0,0,0,0,0
Sim... Sim!,,83259,0,0,0,68,0,0,45332,0,0,0,0,0,0,0
Grommash pagará pela sua arrogância.,,83260,0,0,0,68,0,0,45334,0,0,0,0,0,0,0
A legião virá atrás de vocês... Vamos nos banquetear nessas almas.,,83261,0,0,0,70,0,0,44426,0,0,0,0,0,0,0
"Não atrase, mortal. Sinto a essência vital dos seus exércitos se esvaindo. Haverá tempo para lamentar mais tarde...",,83262,0,0,0,70,0,0,45335,0,0,0,0,0,0,0
Nós nos encontraremos de novo... $n.,,83263,0,0,0,70,0,0,45336,0,0,0,0,0,0,0
"Gul'dan, que tolice. Esta dádiva... muito mais do que você jamais saberá...",,83264,0,0,0,70,0,0,44427,0,0,0,0,0,0,0
Eu esperei por tanto tempo...,,83265,0,0,0,70,0,0,44428,0,0,0,0,0,0,0
...ansiei... ser mais...,,83266,0,0,0,70,0,0,44429,0,0,0,0,0,0,0
"Agora, todos deverão curvar-se diante de mim!",,83268,0,0,0,70,0,0,44430,0,0,0,0,0,0,0
As amarras enfraquecem. A liberdade será minha!,,83282,0,0,0,68,0,0,45333,0,0,0,0,0,0,0
Everyone - find cover!,,83285,0,0,0,68,0,0,0,0,0,0,0,0,0,0
,Revelando nossa localização. Esse tolo trouxe um genessauro para o nosso lado.,83312,0,0,0,68,0,0,0,46542,0,0,0,0,0,0
"O que temos aqui? Um herói? Gorgrond não é lugar para heróis, camarada.",,83324,0,0,0,68,0,0,46251,0,0,0,0,0,0,0
Eles atiraram no Véu Akraz!,,83338,0,0,0,68,0,0,0,0,0,0,0,0,0,0
Ele... simplesmente... desapareceu...,,83339,0,0,0,68,0,0,0,0,0,0,0,0,0,0
Vamos! Precisamos continuar!,,83340,0,0,0,68,0,0,0,0,0,0,0,0,0,0
"Livre, até que enfim.",,83386,0,0,0,68,0,0,45040,0,0,0,0,0,0,0
Eu juro pelo espírito do meu pai... ELES VÃO PAGAR POR ISSO!,,83387,0,0,0,68,0,0,45041,0,0,0,0,0,0,0
Gah!,,83388,0,0,0,68,0,0,44888,0,0,0,0,0,0,0
Ui... ah!,,83389,0,0,0,68,0,0,0,0,0,0,0,0,0,0
Pois bem.,,83390,0,0,0,68,0,0,0,0,0,0,0,0,0,0
Acho que causamos impacto.,,83391,0,0,0,68,0,0,0,0,0,0,0,0,0,0
Parece que chegamos bem a tempo.,,83406,0,0,0,68,0,0,44889,0,0,0,0,0,0,0
Enfim livre! Encontre-me no morro dos ogros quando terminar e nós podemos matar o chefe ogro juntos.,,83431,0,0,0,68,0,0,0,0,0,0,0,0,0,0
"Traga eles vivos pra mim, Roltall. Eles valem muito dinheiro.",,83635,0,0,0,70,0,0,42066,0,0,0,0,0,0,0
A Horda de Ferro aportou no litoral. É nosso dever fazer com que se arrependa.,,83688,0,0,396,68,0,0,0,0,0,0,0,0,0,0
Aqui!,,83711,0,0,0,68,0,0,44882,0,0,0,0,0,0,0
Não podemos ficar aqui muito tempo. Logo toda a Horda de Ferro virá atrás de nós.,,83718,0,0,0,68,0,0,44864,0,0,0,0,0,0,0
"$n, nosso campeão, vai ficar aqui para perturbar o acampamento inimigo. O resto de nós vai tentar passar pela selva em segurança.",,83719,0,0,0,68,0,0,44865,0,0,0,0,0,0,0
"Boa sorte, $n.",,83720,0,0,0,68,0,0,46406,0,0,0,0,0,0,0
"Lute bem, $n.",,83721,0,0,0,68,0,0,44778,0,0,0,0,0,0,0
AAAAAAHHHHHHHHHH!,,83762,0,0,0,68,0,0,0,0,0,0,0,0,0,0
,"Exarca, manda teus atalmas me encontrarem no campo. Pretendo deter Teron'gor antes que ele solte mais demônios.",83774,0,0,1,68,0,0,0,45718,0,0,0,0,0,0
Temos que deter Teron'gor antes que esse mundo acabe... como tantos outros.,,83775,0,0,1,68,0,0,44601,0,0,0,0,0,0,0
"Não te preocupa, $n. A gente te protege!",,83778,0,0,0,68,0,0,45747,0,0,0,0,0,0,0
,Vamos lá! Precisamos ir imediatamente!,83834,0,0,0,68,0,0,0,0,1,0,0,0,0,0
"Aí está você, senhorita Beliscapito!",,83847,0,0,0,68,0,0,0,0,0,0,0,0,0,0
,"Já estava na hora! Vamos, Katranko.",83848,0,0,0,68,0,0,0,0,0,0,0,0,0,0
,"Claro, madame.",83849,0,0,0,68,0,0,0,0,0,0,0,0,0,0
,"Supervisionando, é claro. Agora vai andando!",83850,0,0,0,68,0,0,0,0,0,0,0,0,0,0
"Muito bem, $n.",,83959,0,0,0,69,0,0,0,0,0,0,0,0,0,0
Esta caverna vai servir bem.,,83960,0,0,0,69,0,0,0,0,0,0,0,0,0,0
Siga-me e fique por perto.,,84009,0,0,0,68,0,0,44852,0,0,0,0,0,0,0
Agora... matem cem ou vocês morrem!,,84020,0,0,0,70,0,0,44509,0,0,0,0,0,0,0
"Lamento, mas não temos tanto tempo livre.",,84021,0,0,0,70,0,0,44853,0,0,0,0,0,0,0
"Hunf. Só contei noventa e nove mortes, feiticeiro.",,84022,0,0,0,68,0,0,44511,0,0,0,0,0,0,0
Então acho que vamos ficar lhe devendo uma.,,84023,0,0,0,68,0,0,44854,0,0,0,0,0,0,0
Todos comigo!,,84024,0,0,0,68,0,0,44855,0,0,0,0,0,0,0
Rápido! Entre na caverna antes que eles descongelem.,,84025,0,0,0,68,0,0,44856,0,0,0,0,0,0,0
Fizemos tudo o que podíamos daqui de cima...,,84062,0,0,0,68,0,0,44806,0,0,0,0,0,0,0
Atrás deles! Não deixem que eles escapem!,,84086,0,0,0,68,0,0,44512,0,0,0,0,0,0,0
"Estou satisfeito. Eu ficaria horas vendo vocês lutarem, seus ratos.",,84108,0,0,0,70,0,0,44510,0,0,0,0,0,0,0
"Exarca Maladaar, investigue a caverna junto com Qiana.",,84122,0,924,0,68,0,0,44857,0,0,0,0,0,0,0
Como quiseres.,,84123,0,0,0,68,0,0,44592,0,0,0,0,0,0,0
$n - I have a special job for you.,,84124,0,0,0,68,0,0,0,0,0,0,0,0,0,0
"Lady Liadrin, investigue a caverna junto com Olin.",,84125,0,923,0,68,0,0,44858,0,0,0,0,0,0,0
,Às suas ordens.,84126,0,0,0,68,0,0,0,45711,0,0,0,0,0,0
"Suas vidas estão perto do fim, seus ratos.",,84248,0,0,0,70,0,0,43708,0,0,0,0,0,0,0
"Não tão rápido, Ner'zhul.",,84249,0,0,0,70,0,0,44890,0,0,0,0,0,0,0
Isso... chegue mais perto! Eu vou enterrar você vivo pela glória da Horda de Ferro!,,84250,0,0,0,70,0,0,43709,0,0,0,0,0,0,0
Inútil...,,84268,0,0,0,70,0,0,43707,0,0,0,0,0,0,0
Eu vi nos meus sonhos... esses forasteiros de outro mundo vão destruir tudo aquilo pelo que lutamos.,,84374,0,0,0,70,0,0,46078,0,0,0,0,0,0,0
Mas é sangue órquico que corre nas veias de Draenor!,,84375,0,0,0,70,0,0,46079,0,0,0,0,0,0,0
"Avante, Horda de Ferro! Matem os nossos inimigos.",,84376,0,0,0,70,0,0,46080,0,0,0,0,0,0,0
Pela glória de Grommash!,,84377,0,0,0,70,0,0,46081,0,0,0,0,0,0,0
"Cadê o meu poder, ogro?",,84445,0,0,0,70,0,0,45314,0,0,0,0,0,0,0
Seu poder? (É o MEU poder!),,84446,0,0,0,70,0,0,46620,0,0,0,0,0,0,0
"Você me obedecerá, discípulo. Entregue as rédeas.",,84447,0,0,0,70,0,0,45315,0,0,0,0,0,0,0
Eu acho que não. (Não vamos mais receber ordens de você!),,84448,0,0,0,70,0,0,46621,0,0,0,0,0,0,0
Nós aprendemos muito com K'ure. (Estamos escrevendo um livro.),,84463,0,0,0,70,0,0,46622,0,0,0,0,0,0,0
Você está louco.,,84464,0,0,0,70,0,0,45316,0,0,0,0,0,0,0
"Fuja, velho. (Logo o Malho Imponente vai queimar. E depois o mundo!)",,84465,0,0,0,70,0,0,46623,0,0,0,0,0,0,0
Na morte... Eu estou livre...,,84566,0,0,0,68,0,0,46294,0,0,0,0,0,0,0
Esses covardes de Ferro nos usaram para alimentar o portal. Eles se arrependerão disso.,,84576,0,0,1,68,0,0,44445,0,0,0,0,0,0,0
Você tem a gratidão do Concílio das Sombras.,,84577,0,0,273,68,0,0,44446,0,0,0,0,0,0,0
Procure Gul'dan se você realmente deseja deter a Horda de Ferro. (Gul'dan! Gul'dan alimenta o portal!),,84580,0,0,0,68,0,0,46626,0,0,0,0,0,0,0
