Text_lang,Text1_lang,ID,LanguageID,ConditionID,EmotesID,Flags,ChatBubbleDurationMs,VoiceOverPriorityID,SoundKitID[0],SoundKitID[1],EmoteID[0],EmoteID[1],EmoteID[2],EmoteDelay[0],EmoteDelay[1],EmoteDelay[2]
A gente discute isso depois.,,225237,0,0,0,68,0,6,204409,0,0,0,0,0,0,0
,"Diga... o que você aprendeu, filho da minha revoada? Qual é o seu juramento?",225610,0,0,0,102,0,6,0,201776,0,0,0,0,0,0
Há muito tempo que estamos espalhados... isolados.,,225611,0,0,0,102,0,6,201773,0,0,0,0,0,0,0
Mas uma revoada vai além do juramento: nós somos uma família.,,225612,0,0,0,102,0,6,201774,0,0,0,0,0,0,0
E é hora de levar minha família pra casa.,,225613,0,0,0,102,0,6,201775,0,0,0,0,0,0,0
,"Acredito que você esteja pronto, Kalecgos.",225614,0,0,0,102,0,6,0,201777,0,0,0,0,0,0
,Nozdormu? Você está bem?,225615,0,0,0,102,0,6,0,201780,0,0,0,0,0,0
Eternus quase venceu.,,225669,0,0,0,102,0,6,204612,0,0,0,0,0,0,0
Eu achei que teria mais tempo...,,225670,0,0,0,102,0,6,204613,0,0,0,0,0,0,0
,"Ah, não! Sinto muito!",225671,0,0,0,102,0,6,0,201781,0,0,0,0,0,0
,Achei que eu era forte o bastante pra derrotá-la.,225672,0,0,0,102,0,6,0,201782,0,0,0,0,0,0
,Eu... eu...,225673,0,0,0,102,0,6,0,201783,0,0,0,0,0,0
"Ah, Chronormu, você não fez nada de errado.",,225674,0,0,0,102,0,6,204614,0,0,0,0,0,0,0
Você lutou com bravura e lutou muito bem.,,225675,0,0,0,102,0,6,204615,0,0,0,0,0,0,0
Mas Eternus tem razão.,,225676,0,0,0,102,0,6,204616,0,0,0,0,0,0,0
Meu destino é inevitável.,,225677,0,0,0,102,0,6,204617,0,0,0,0,0,0,0
,Como assim?,225678,0,0,0,102,0,6,0,201784,0,0,0,0,0,0
"A cada dia que se passa, o futuro vem de encontro ao presente, que se confunde com o passado.",,225679,0,0,0,102,0,6,204618,0,0,0,0,0,0,0
"Logo, tudo vai virar uma coisa só, e então eu chegarei ao ponto mais sombrio: Murozond.",,225680,0,0,0,102,0,6,204619,0,0,0,0,0,0,0
"Quando esse dia chegar, espero que você...",,225682,0,0,0,102,0,6,204620,0,0,0,0,0,0,0
Faça o que for preciso.,,225683,0,0,0,102,0,6,204621,0,0,0,0,0,0,0
,"Sim, ó, Atemporal.",225684,0,0,0,102,0,6,0,201785,0,0,0,0,0,0
,Eu farei qualquer coisa que você precisar.,225685,0,0,0,102,0,6,0,201786,0,0,0,0,0,0
,Eu encontrarei uma solução.,225686,0,0,0,102,0,6,0,201787,0,0,0,0,0,0
Não há solução.,,225687,0,0,0,102,0,6,204622,0,0,0,0,0,0,0
,O tempo abarca todas as possibilidades.,225688,0,0,0,102,0,6,0,201788,0,0,0,0,0,0
,Você me ensinou isso.,225689,0,0,0,102,0,6,0,201789,0,0,0,0,0,0
,"Eu vasculharei cada linha do tempo, cada instante...",225690,0,0,0,102,0,6,0,201790,0,0,0,0,0,0
,até encontrar um jeito de salvar você.,225691,0,0,0,102,0,6,0,201791,0,0,0,0,0,0
"Ah, Chronormu...",,225692,0,0,0,102,0,6,204623,0,0,0,0,0,0,0
"Saiba que, em todas as linhas do tempo...",,225693,0,0,0,102,0,6,204624,0,0,0,0,0,0,0
Eu tenho e sempre terei orgulho de você.,,225694,0,0,0,102,0,6,204625,0,0,0,0,0,0,0
,Eu lhe devo minha gratidão.,225743,0,0,0,102,0,6,0,203318,0,0,0,0,0,0
,Você ajudou as revoadas dragônicas a se recordarem do seu dever.,225744,0,0,0,102,0,6,0,203319,0,0,0,0,0,0
,"Renovadas as Pedras do Juramento, nós finalmente poderemos recuperar nosso poder espectral.",225745,0,0,0,102,0,6,0,203320,0,0,0,0,0,0
,Isso tem que funcionar.,225746,0,0,0,102,0,6,0,203321,0,0,0,0,0,0
,Nada...,225747,0,0,0,102,0,6,0,203322,0,0,0,0,0,0
,Mas as pedras do juramento foram renovadas...,225748,0,0,0,102,0,6,0,203323,0,0,0,0,0,0
,<Gargalhada.>,225752,0,0,0,102,0,6,0,203324,0,0,0,0,0,0
,Parece que os seus titãs abandonaram você.,225755,0,0,0,102,0,6,0,203325,0,0,0,0,0,0
,Raszageth! O que foi que você fez?!,225756,0,0,0,102,0,6,0,203326,0,0,0,0,0,0
,[DNT] Me?,225757,0,0,0,38,0,6,0,0,0,0,0,0,0,0
,[DNT] Oh no.,225758,0,0,0,38,0,6,0,0,0,0,0,0,0,0
,Vocês é que provaram não serem dignos...,225759,0,0,0,102,0,6,0,203329,0,0,0,0,0,0
,"""Rainha dos Dragões.""",225760,0,0,0,102,0,6,0,203330,0,0,0,0,0,0
,Agora é a nossa vez.,225763,0,0,0,102,0,6,0,203331,0,0,0,0,0,0
,A era dos Encarnados... chegou.,225764,0,0,0,102,0,6,0,203332,0,0,0,0,0,0
,Ela vai libertá-los...,225767,0,0,0,102,0,6,0,203333,0,0,0,0,0,0
,Não!,225768,0,0,0,102,0,6,0,203334,0,0,0,0,0,0
,Meus amigos.,225782,0,0,0,102,0,6,0,206216,0,0,0,0,0,0
,Sentimos uma grande agitação sob a terra...,225783,0,0,0,102,0,6,0,206217,0,0,0,0,0,0
,e tememos o pior.,225784,0,0,0,102,0,6,0,206218,0,0,0,0,0,0
Sobrevivemos por pouco.,,225785,0,0,0,102,0,6,206229,0,0,0,0,0,0,0
"Raszageth está morta, mas...",,225786,0,0,0,102,0,6,206230,0,0,0,0,0,0,0
,O povo dela foi libertado.,225787,0,0,0,102,0,6,0,206219,0,0,0,0,0,0
Nozdormu?,,225788,0,0,0,102,0,6,206231,0,0,0,0,0,0,0
,O que foi?,225789,0,0,0,102,0,6,0,206220,0,0,0,0,0,0
Caminhos temporais.,,225790,0,0,0,102,0,6,206240,0,0,0,0,0,0,0
"Eles estão... caóticos, mas ainda ocultados.",,225793,0,0,0,102,0,6,206241,0,0,0,0,0,0,0
Há trevas vindo nos buscar.,,225794,0,0,0,102,0,6,206242,0,0,0,0,0,0,0
Não temos muito tempo para nos preparar para o massacre.,,225795,0,0,0,102,0,6,201849,0,0,0,0,0,0,0
,"A imprudência de Raszageth custou sua vida, e eles não cometerão esse erro novamente.",225796,0,0,0,102,0,6,0,206221,0,0,0,0,0,0
,Eles vão recuperar a força e escolher o próximo momento com cuidado.,225798,0,0,0,102,0,6,0,206222,0,0,0,0,0,0
"Depois, devem levar a luta até eles.",,225799,0,0,0,102,0,6,206232,0,0,0,0,0,0,0
Ataque antes que se recuperem.,,225800,0,0,0,102,0,6,206233,0,0,0,0,0,0,0
,Isso será difícil.,225801,0,0,0,102,0,6,0,206223,0,0,0,0,0,0
,O domínio que Iridikron exerce sobre a terra os manterá fora do nosso alcance.,225803,0,0,0,102,0,6,0,206224,0,0,0,0,0,0
"O que tem nesse ""Iridikron"" que tanto a preocupa?",,225804,0,0,0,102,0,6,201850,0,0,0,0,0,0,0
"Dos três que restam, Vyranoth e Fyrakk sempre foram leais aos ideais dos Encarnados.",,225805,0,0,0,102,0,6,206243,0,0,0,0,0,0,0
Mas foi Iridkron quem realmente abraçou a guerra.,,225806,0,0,0,102,0,6,206244,0,0,0,0,0,0,0
O último capturado e o mais difícil de conter.,,225807,0,0,0,102,0,6,206245,0,0,0,0,0,0,0
,"No fim, acabou fazendo acordos horríveis para manter a causa viva.",225808,0,0,0,102,0,6,0,206225,0,0,0,0,0,0
,Seu desespero violento o torna perigoso.,225809,0,0,0,102,0,6,0,206226,0,0,0,0,0,0
,Acho que os outros Encarnados nunca souberam a real profundidade de sua depravação.,225810,0,0,0,102,0,6,0,206227,0,0,0,0,0,0
Não vamos nos desesperar.,,225811,0,0,0,102,0,6,206234,0,0,0,0,0,0,0
A guerra deles vem aí.,,225812,0,0,0,102,0,6,206235,0,0,0,0,0,0,0
"Apesar de ainda não termos poderes espectrais, podemos reconstruir nossa unidade.",,225813,0,0,0,102,0,6,206236,0,0,0,0,0,0,0
Cure as revoadas feridas.,,225817,0,0,0,102,0,6,206237,0,0,0,0,0,0,0
Abrace nossos aliados.,,225818,0,0,0,102,0,6,206238,0,0,0,0,0,0,0
Apenas juntos teremos alguma chance de vitória.,,225819,0,0,0,102,0,6,206239,0,0,0,0,0,0,0
Juntos.,,225820,0,0,0,102,0,6,201851,0,0,0,0,0,0,0
,Juntos.,225821,0,0,0,102,0,6,0,206228,0,0,0,0,0,0
"Sou bem conhecido entre os heróis da Aliança, meu caro Lazulathel.",,226110,0,0,0,102,0,4,202538,0,0,0,0,0,0,0
"Com meu apoio, eu tenho certeza que vão aceitar vocês no exército deles.",,226111,0,0,0,102,0,4,202539,0,0,0,0,0,0,0
"Os Guardiões Obsidianos treinaram implacavelmente para proteger nosso povo, Wrathion.",,226112,0,0,0,102,0,4,202540,0,0,0,0,0,0,0
Vejamos se a Aliança é digna de tamanha lealdade.,,226113,0,0,0,102,0,4,202541,0,0,0,0,0,0,0
Filhos de Neltharion.,,226114,0,0,0,102,0,4,202546,0,0,0,0,0,0,0
Você despertaram diante de um passado destroçado... e de um futuro incerto.,,226115,0,0,0,102,0,4,202547,0,0,0,0,0,0,0
"No entanto, os fios do destino tecem um novo caminho até praias distantes.",,226116,0,0,0,102,0,4,202548,0,0,0,0,0,0,0
As Areias do Tempo vão acelerar suas asas ao longo do caminho.,,226117,0,0,0,102,0,4,202549,0,0,0,0,0,0,0
Digam ao mundo o que vocês viram aqui.,,226118,0,0,0,102,0,4,202550,0,0,0,0,0,0,0
E alerte-os da tempestade que está por vir.,,226119,0,0,0,102,0,4,202551,0,0,0,0,0,0,0
"A Horda está cheia de almas nobres e corajosas, Cinzamalho.",,226120,0,0,0,102,0,4,202542,0,0,0,0,0,0,0
É certo que os dracthyrs encontraram um lugar entre eles.,,226121,0,0,0,102,0,4,202543,0,0,0,0,0,0,0
,"Os Garras Sombrias são os melhores lutadores já treinados, Ebyssian.",226122,0,0,0,102,0,4,0,202544,0,0,0,0,0,0
,Talvez seja a Horda que precise provar o próprio valor para nós.,226123,0,0,0,102,0,4,0,202545,0,0,0,0,0,0
,Quem atender ao chamado enfrentará os desafios que estão por vir.,226124,0,0,0,102,0,6,0,203312,0,0,0,0,0,0
Vamos então. As Ilhas do Dragão nos aguardam!,,226127,0,0,0,102,5000,6,203307,0,0,0,0,0,0,0
As Ilhas do Dragão aguardam!,,226268,0,0,0,102,5000,6,204547,0,0,0,0,0,0,0
,"Obrigada, $p. As anotações estão detalhadíssimas. Foi gentil da parte deles terem esse cuidado. Agora, vamos às modificações...",226566,0,0,1,68,0,4,0,0,0,0,0,0,0,0
,Fico feliz por ter contribuído com a Expedição! Eu prometo empregar minhas habilidades em prol da exploração das Ilhas do Dragão... e além!,226567,0,0,1,68,0,4,0,0,0,0,0,0,0,0
,Eita! Você conseguiu ativar o orbe titânico! E tinha uma gravação nele?!,226571,0,0,603,68,0,4,0,0,0,0,0,0,0,0
"Nós temos muito o que aprender com você, Eraleshk. Que sorte você estar aqui para participar dos estudos.",,226575,0,0,1,68,0,4,0,0,0,0,0,0,0,0
,É bem provável! Não encontramos um registro assim já faz um tempo. Isso vai mudar totalmente os rumos da pesquisa!,226578,0,0,1,68,0,4,0,0,0,0,0,0,0,0
Ninguém ganha os céus como um Martelo Feroz. LÁ VEM TROVOADA!,,226747,0,0,0,68,0,4,0,0,0,0,0,0,0,0
Pelo Ninho da Águia!,,226748,0,0,0,68,0,4,0,0,0,0,0,0,0,0
Que corrida! Acho que gostei dessa tal dragonaria.,,226749,0,0,0,68,0,4,0,0,0,0,0,0,0,0
"Eu teria te dado uma surra se estivesse com o meu Bicoafiado. Nada pessoal, Coçadinha.",,226750,0,0,0,68,0,4,0,0,0,0,0,0,0,0
,"Finalmente, nossos jovens desaparecidos estão entre nós mais uma vez para que possam ser criados juntos com todas as revoadas.",227050,0,0,0,102,0,6,0,206191,0,0,0,0,0,0
,"Se no passado esses Poços da Vida estavam cheios de ovos, agora eles têm o nosso futuro.",227052,0,0,0,102,0,6,0,206192,0,0,0,0,0,0
,"A chamada da minha revoada foi, enfim, cumprida.",227053,0,0,0,102,0,6,0,206193,0,0,0,0,0,0
,Eu mesma vou cuidar para que esses ovos sejam protegidos e amados.,227055,0,0,0,102,10000,6,0,206194,0,0,0,0,0,0
,"Assim, quem sabe, eles não se tornam dragões fortes e inteligentes?",227056,0,0,0,102,10000,6,0,206195,0,0,0,0,0,0
Os centauros Maruuk incluem muitos clãs espalhados pelas planícies.,,227080,0,0,1,68,0,1,205859,0,0,0,0,0,0,0
"O poder está concentrado nas mãos de quatro deles: os clãs Teerai, Shikaar, Nokhid e Ohn'ir.",,227081,0,0,0,68,0,1,205907,0,0,0,0,0,0,0
"No clã Teerai estão os guardiões das nossas tradições. A Khanam Matra, líder deles, é a khan cultural de todos os Maruuk. A linhagem de todas as khanam matras têm sua origem na nossa primeira matriarca: Teera.",,227082,0,0,0,68,0,1,205908,0,0,0,0,0,0,0
"Nós, do clã Shikaar somos os mais fortes na caça. Nossos acampamentos se espalharam pelas planícies, acompanhando a movimentação dos animais.",,227083,0,0,0,68,0,1,205906,0,0,0,0,0,0,0
,"O clã Nokhid só veio ganhar poder faz pouco. Na última geração, Jhakan Khan conduziu seu povo à vitória contra o clã Toghus, tomando o lugar deles nas planícies.",227084,0,0,0,68,0,1,0,205910,0,0,0,0,0,0
,"O filho dele, Balakar Khan, é quem lidera o clã hoje. O pai era um centauro honrado, mas Balakar Khan não herdou a paciência nem a sabedoria do pai.",227085,0,0,0,68,0,1,0,205913,0,0,0,0,0,0
,"Meu clã, o clã Ohn'ir, é formado por centauros que possuem uma conexão direta com nossa deusa, Ohn'ahra. Ela trouxe os fundadores, Maruuk e Teera, para as Ilhas do Dragão, e vem zelando pelo nosso povo desde então.",227086,0,0,0,68,0,1,0,205914,0,0,0,0,0,0
,"Os místicos do clã Ohn'ir são iniciados a partir de vários clãs, mas todos atendemos ao chamado de Ohn'ahra para servir a ela e ao nosso povo.",227087,0,0,0,68,0,1,0,205915,0,0,0,0,0,0
"Os clãs têm suas diferenças, mas compartilham a mesma cultura. Independente de nossas forças e fraquezas, somos todos Maruuk.",,227088,0,0,0,68,0,1,205916,0,0,0,0,0,0,0
Sabellian? O que ele está fazendo?,,227396,0,0,0,102,0,6,204476,0,0,0,0,0,0,0
,"Ok, pessoal!",227459,0,0,0,102,0,6,0,206153,0,0,0,0,0,0
,Preparem-se!,227460,0,0,0,102,0,6,0,206154,0,0,0,0,0,0
,<Ruge de dor.>,227461,0,0,0,102,0,6,0,0,0,0,0,0,0,0
,"Ah, essa não!",227462,0,0,0,102,0,6,0,206155,0,0,0,0,0,0
Minha visão chegou tarde.,,227463,0,0,0,102,0,6,206754,0,0,0,0,0,0,0
Eles cavaram um túnel no tempo e estão despencando pelas infinitas possibilidades.,,227464,0,0,0,102,0,6,206755,0,0,0,0,0,0,0
"Você precisa encontrá-los para corrigir seu curso, antes que o tecido da realidade se esfarrape inteiro.",,227465,0,0,0,102,0,6,206756,0,0,0,0,0,0,0
"Nós protegemos o Arquivo Lazúli, mas a tempestade de Raszageth ainda cerca a Torre de Vakthros.",,227467,0,0,0,102,0,6,207008,0,0,0,0,0,0,0
,"Ela quer libertar seu povo, mas a prisão deles não fica em Vasta Lazúli.",227468,0,0,0,102,0,6,0,207009,0,0,0,0,0,0
,O que mais ela estaria procurando?,227469,0,0,0,102,0,6,0,207010,0,0,0,0,0,0
Minha visão... continua encoberta.,,227470,0,0,0,102,0,6,207011,0,0,0,0,0,0,0
"Os Primevistas já podem estar se movendo entre nós, e temo não conseguir ver.",,227471,0,0,0,102,0,6,207012,0,0,0,0,0,0,0
A cidade deve ser protegida.,,227472,0,0,0,102,0,6,207013,0,0,0,0,0,0,0
Valdrakken é a casa do nosso povo.,,227473,0,0,0,102,0,6,207014,0,0,0,0,0,0,0
,"Se os Primevistas estão aqui, devemos encontrá-los e expulsá-los.",227474,0,0,0,102,0,6,0,207015,0,0,0,0,0,0
,Eles não podem se infiltrar na sede do nosso poder.,227475,0,0,0,102,0,6,0,207016,0,0,0,0,0,0
"Seus guardas não ingressaram em nossas fileiras como se esperava, Eranog.",,227477,0,0,0,102,0,6,206174,0,0,0,0,0,0,0
Não estou preocupado. Soldados mortos não podem atrapalhar.,,227478,0,0,0,102,0,6,206175,0,0,0,0,0,0,0
Vejo que você desenterrou a pedra da chama.,,227482,0,0,0,102,0,6,206176,0,0,0,0,0,0,0
Eu sinto a força dela.,,227485,0,0,0,102,0,6,206177,0,0,0,0,0,0,0
Chegou a hora de fazer sua parte nesse negócio.,,227494,0,0,0,102,0,6,206178,0,0,0,0,0,0,0
<grito alto de dor>,,227497,0,0,0,102,0,6,206179,0,0,0,0,0,0,0
Ergam-se!,,227501,0,0,0,102,0,6,206180,0,0,0,0,0,0,0
Primevista Eranog.,,227503,0,0,0,102,0,6,206181,0,0,0,0,0,0,0
"Com este poder, eu libertarei meu povo da coleira dos Aspectos.",,227504,0,0,0,102,0,6,206182,0,0,0,0,0,0,0
"Então vá, enquanto eu transformo esse lugar abominável em cinzas.",,227505,0,0,0,102,0,6,206183,0,0,0,0,0,0,0
,Está quase terminado!,227639,0,0,0,102,0,6,0,206147,0,0,0,0,0,0
,Voltaremos em breve!,227640,0,0,0,102,0,6,0,206148,0,0,0,0,0,0
,Se preparem.,227641,0,0,0,102,0,6,0,207030,0,0,0,0,0,0
,Ufa! Nossa Pedra do Juramento... foi restaurada!,227642,0,0,0,102,0,6,0,206149,0,0,0,0,0,0
,Nunca mais quero voltar tanto no passado assim!,227643,0,0,0,102,0,6,0,206151,0,0,0,0,0,0
,Mas estou feliz por terem me ajudado a voltar.,227644,0,0,0,102,0,6,0,206152,0,0,0,0,0,0
Você ajudou Chronormu.,,227645,0,0,0,102,0,6,207031,0,0,0,0,0,0,0
Por isso eu sou grato e pouparei você da minha ira.,,227646,0,0,0,102,0,6,207032,0,0,0,0,0,0,0
Mas vá.,,227647,0,0,0,102,0,6,207033,0,0,0,0,0,0,0
Depressa.,,227648,0,0,0,102,0,6,207034,0,0,0,0,0,0,0
,Nós levaremos você ao seu destino final.,227649,0,0,0,102,0,6,0,207035,0,0,0,0,0,0
,Não se pode negar o porvir.,227650,0,0,0,102,0,6,0,207036,0,0,0,0,0,0
,"Quando nos reencontrarmos, não espere que eu tenha clemência pelo que aconteceu.",227651,0,0,0,102,0,6,0,207037,0,0,0,0,0,0
,Hmmm... Onde estamos?,227653,0,0,0,102,0,6,0,206196,0,0,0,0,0,0
,Isso aqui é Azeroth mesmo?,227654,0,0,0,102,0,6,0,206197,0,0,0,0,0,0
É Azeroth.,,227655,0,0,0,102,0,6,206200,0,0,0,0,0,0,0
"Mas de um tempo muito, muito distante.",,227656,0,0,0,102,0,6,206201,0,0,0,0,0,0,0
,Temos que encontrar Crona e dar o fora daqui.,227657,0,0,0,102,0,6,0,206198,0,0,0,0,0,0
,Este lugar é assustador.,227658,0,0,0,102,0,6,0,206199,0,0,0,0,0,0
Primevistas!,,227858,0,0,0,102,0,4,203994,0,0,0,0,0,0,0
Noriko! Chame Kalecgos.,,227859,0,0,0,102,0,4,203995,0,0,0,0,0,0,0
"Que a tempestade te cubra, sábio dos ventos.",,227880,0,0,1,68,0,1,206956,0,0,0,0,0,0,0
Mãe!,,227973,0,0,0,102,0,4,204133,0,0,0,0,0,0,0
,"Renovadas as pedras do juramento de cada revoada,",228402,0,0,0,102,0,6,0,207079,0,0,0,0,0,0
,Esse artefato sagrado e símbolo da união entre os dragões jaz no Baluarte de Tyr.,228403,0,0,0,102,0,6,0,207080,0,0,0,0,0,0
,"Koranos, o que tem a nos dizer sobre o lugar?",228404,0,0,0,102,0,6,0,207082,0,0,0,0,0,0
,Há muitos séculos não pisamos nos salões do Baluarte de Tyr.,228405,0,0,0,102,0,6,0,207081,0,0,0,0,0,0
"Quando as Ilhas despertaram, despertaram também os guardiões do Baluarte de Tyr.",,228406,0,0,0,102,0,6,207083,0,0,0,0,0,0,0
"Enquanto alguns retomaram seus deveres, outros ficaram... desnorteados.",,228407,0,0,0,102,0,6,207084,0,0,0,0,0,0,0
"Se vocês forem lá, não posso garantir que serão bem recebidos.",,228408,0,0,0,102,0,6,207085,0,0,0,0,0,0,0
,Eu entendo.,228409,0,0,0,102,0,6,0,207086,0,0,0,0,0,0
,"Mas eu tenho fé que, com a ajuda de nosso campeão, nós superaremos qualquer perigo.",228410,0,0,0,102,0,6,0,207087,0,0,0,0,0,0
,O que aconteceu com este ovo?,228411,0,0,0,102,0,6,0,206762,0,0,0,0,0,0
,As energias que o envolvem são...,228412,0,0,0,102,0,6,0,206763,0,0,0,0,0,0
,Que horrível.,228413,0,0,0,102,0,6,0,206764,0,0,0,0,0,0
,"Se houver salvação para o ovo, ela estará aqui, nas águas sagradas dos Poços da Vida.",228414,0,0,0,102,0,6,0,206765,0,0,0,0,0,0
,"Outrora, aqui foi um lugar vibrante, repleto de jovens dragões.",228415,0,0,0,102,0,6,0,206766,0,0,0,0,0,0
,"E a Pedra do Juramento Rubi, que simboliza nosso chamado, projetava sua luz bem alto para que todos a vissem.",228416,0,0,0,102,0,6,0,206767,0,0,0,0,0,0
,"Agora ela hiberna, como todas as pedras do juramento.",228417,0,0,0,102,0,6,0,206768,0,0,0,0,0,0
,Suspeito que tenham adormecido quando abdicamos do poder dos Aspectos.,228418,0,0,0,102,0,6,0,206769,0,0,0,0,0,0
,Foram tantas as coisas que deixamos para trás.,228419,0,0,0,102,0,6,0,206770,0,0,0,0,0,0
,"Mas agora que voltamos para casa, podemos atender ao chamado das nossas revoadas e renovar as cinco pedras do juramento.",228420,0,0,0,102,0,6,0,206771,0,0,0,0,0,0
,"E pela união delas, nosso poder será restaurado.",228422,0,0,0,102,0,6,0,206772,0,0,0,0,0,0
,"Eu, a Khanam Matra Sarest, aceito este presente pra honrar o antigo juramento feito pela mais sagrada das nossas ancestrais.",228426,0,0,0,102,0,4,0,206921,0,0,0,0,0,0
,Todos os centauros sob as asas de Ohn'ahra apoiarão os dragões verdes em tempos de necessidade.,228427,0,0,0,102,0,4,0,206922,0,0,0,0,0,0
,"E eu, Merithra, filha de Ysera, aceito este presente para honrar o juramento que fiz à sua ancestral, Teera.",228428,0,0,0,102,0,4,0,205427,0,0,0,0,0,0
,"Juntos, dragões e centauros protegerão a Chapada Ohn'ahrana.",228429,0,0,0,102,0,4,0,205428,0,0,0,0,0,0
,O vínculo que nos uniu eras atrás foi renovado.,228430,0,0,0,102,0,4,0,205429,0,0,0,0,0,0
,"Se o Sonho tornar a correr perigo, saiba que os Maruuk lutarão ao seu lado.",228431,0,0,0,102,0,4,0,206923,0,0,0,0,0,0
,"Eu, Merithra, também honro o juramento de Ysera.",228432,0,0,0,102,0,4,0,205430,0,0,0,0,0,0
,Eu juro proteger o Sonho Esmeralda e a revoada dragônica verde com a minha vida.,228433,0,0,0,102,10000,4,0,205431,0,0,0,0,0,0
Contemple Ventobravo!,,228436,0,0,0,102,0,4,205046,0,0,0,0,0,0,0
Capital do reino humano e joia da coroa da Aliança.,,228437,0,0,0,102,0,4,205047,0,0,0,0,0,0,0
Governada por um amigo muito querido que...,,228438,0,0,0,102,0,4,205048,0,0,0,0,0,0,0
Infelizmente está ausente...,,228439,0,0,0,102,0,4,205049,0,0,0,0,0,0,0
As muralhas são impressionantes.,,228440,0,0,0,102,0,4,205050,0,0,0,0,0,0,0
Esta cidade resistiria aos ataques de um adversário formidável.,,228441,0,0,0,102,0,4,205051,0,0,0,0,0,0,0
Talvez até de um dragão.,,228442,0,0,0,102,0,4,205052,0,0,0,0,0,0,0
Você não faz ideia.,,228443,0,0,0,102,0,4,205053,0,0,0,0,0,0,0
Queira me dar licença para fazer uma entrada mais adequada: vou assumir uma forma familiar.,,228444,0,0,0,102,0,4,205054,0,0,0,0,0,0,0
"Ah, sim. O Guardião da Terra também tinha uma forma paisana.",,228445,0,0,0,102,0,4,205055,0,0,0,0,0,0,0
Então esses... humanos conhecem você?,,228446,0,0,0,102,0,4,205056,0,0,0,0,0,0,0
E como! Não tenho dúvidas de que vão me receber de braços...,,228447,0,0,0,102,0,4,205057,0,0,0,0,0,0,0
... abertos.,,228448,0,0,0,102,0,4,205058,0,0,0,0,0,0,0
Orgrimmar.,,228464,0,0,0,102,0,4,205103,0,0,0,0,0,0,0
Entre essas muralhas se reúnem as nobres raças da Horda.,,228465,0,0,0,102,0,4,205104,0,0,0,0,0,0,0
Uma cidade construída sobre uma fundação de força e honra.,,228466,0,0,0,102,0,4,205105,0,0,0,0,0,0,0
,Virtudes que meu povo representa bem.,228467,0,0,0,102,0,4,0,205106,0,0,0,0,0,0
,A estrutura é impressionante.,228468,0,0,0,102,0,4,0,205107,0,0,0,0,0,0
,Mas nada que resistisse ao poder dos Garras Sombrias.,228469,0,0,0,102,0,4,0,205108,0,0,0,0,0,0
Não tenho dúvidas de que seus soldados terão muitas chances de provar seu valor.,,228470,0,0,0,102,0,4,205109,0,0,0,0,0,0,0
"Antes de entrarmos, eu assumirei outra forma.",,228471,0,0,0,102,0,4,205110,0,0,0,0,0,0,0
Uma forma mais familiar para a Horda.,,228472,0,0,0,102,0,4,205111,0,0,0,0,0,0,0
,"Uma forma paisana. Sei, o Guardião da Terra tinha uma também.",228474,0,0,0,102,0,4,0,205112,0,0,0,0,0,0
,"Nós chegamos, então. Onde estão seus aliados, Ebyssian?",228475,0,0,0,102,0,4,0,205113,0,0,0,0,0,0
"Paciência, Cinzamalho.",,228476,0,0,0,102,0,4,205114,0,0,0,0,0,0,0
Tenho certeza de que vamos receber uma recepção...,,228477,0,0,0,102,0,4,205115,0,0,0,0,0,0,0
... adequada.,,228478,0,0,0,102,0,4,205116,0,0,0,0,0,0,0
,"Venha conosco, $n. Temos muitas histórias pra compartilhar.",228562,0,0,1,68,0,1,0,205862,0,0,0,0,0,0
,"Duas-patas, você deve ter enfrentado muitos adversários pela vida... Tem que compartilhar essas histórias.",228563,0,0,1,68,0,1,0,205863,0,0,0,0,0,0
,"Eu já compartilhei a história de Belika, minha primeira presa? Um passochifre altivo, com chifres e pernas gigantescos! Os chifres, eu fiz de troféu.",228571,0,0,0,68,0,1,0,205886,0,0,0,0,0,0
"Foi uma bela caçada, Tomul. A minha primeira foi um urso poderoso do gelo e da neve, já bem embrenhado na tundra de Vasta Lazúli. Não havia páreo para mim e meu bakar. No Khural, só se falava na gente!",,228572,0,0,0,68,0,1,205887,0,0,0,0,0,0,0
,"Ah, chegamos à primeira parada. Formem um círculo com as carroças. É hora de caçar.",228573,0,0,0,68,0,1,0,205888,0,0,0,0,0,0
"O Chifre de Drusahl despontará assim que cruzarmos a ponte. Você tem que vê-lo, Duas-patas!",,228575,0,0,4,68,0,1,205889,0,0,0,0,0,0,0
"Ah, sim. O Chifre representa o pacto ancestral firmado entre Teera e uma dragonesa verde chamada Merithra. A amizade delas acabou com uma longa inimizade entre os dragões e os Maruuk.",,228576,0,0,0,68,0,1,205890,0,0,0,0,0,0,0
"Depois, os centauros ficaram caçando nas planícies, e os dragões cuidando dos jardins. Mas eles concordaram em ajudar uns aos outros nos momentos difíceis. O Chifre de Drusahl é uma manifestação física desse juramento.",,228577,0,0,0,68,0,1,205896,0,0,0,0,0,0,0
,"Mas um dia os dragões partiram. E agora, passados dez mil anos, eles voltam a estas terras! Quero ver o que a Khanam Matra tem a dizer sobre isso.",228578,0,0,0,68,0,1,0,205897,0,0,0,0,0,0
,"Nós somos guiados por Ohn'ahra, Tomul. Foi ela que nos concedeu estas terras e que intermediou o pacto com os dragões. Ela conhece o caminho.",228579,0,0,0,68,0,1,0,205899,0,0,0,0,0,0
,"Ohn'ahra, a Mãe do Vento, é a ancestral das ohunas. Ela trouxe nossos fundadores, Maruuk e Teera, para a chapada. No meu clã, interpretamos as canções dela para aconselhar nosso povo.",228580,0,0,0,68,0,1,0,205898,0,0,0,0,0,0
,Alto! Eu ouço o chamado dela. Ohn'ahra cantará para mim aqui mesmo.,228581,0,0,0,68,0,1,0,205901,0,0,0,0,0,0
Maruukai fica logo adiante. É um ponto de encontro sagrado e grandioso. Centauros de toda a planície se reúnem lá.,,228582,0,0,0,68,0,1,205902,0,0,0,0,0,0,0
"A cada estação nos encontramos no Khural, uma época de trégua e comunhão. Clãs grandes e pequenos se juntam para compartilhar recursos e histórias.",,228583,0,0,0,68,0,1,205903,0,0,0,0,0,0,0
,Estou ansiosa para me reconectar com meus companheiros. Talvez Tigari Khan possa me ajudar a decifrar esse presságio do rio.,228584,0,0,0,68,0,1,0,205904,0,0,0,0,0,0
,Eu vou evitar os Nokhid. Eles antagonizam todo mundo nessas situações.,228585,0,0,0,68,0,1,0,205905,0,0,0,0,0,0
O resto dos Shikaar já deve ter chegado dos outros acampamentos. Nossa ascensão já se terá feito notar quando chegarmos.,,228586,0,0,0,68,0,1,205711,0,0,0,0,0,0,0
"Os outros clãs chegaram primeiro. Considerando a presença do forasteiro e da emissária dos dragões verdes, vai ser um Khural memorável.",,228587,0,0,0,68,0,1,205710,0,0,0,0,0,0,0
,"Garras Sombrias, aos seus postos!",228712,0,0,0,102,0,4,0,205330,0,0,0,0,0,0
,"Mostre o caminho, Ebyssian.",228713,0,0,0,102,0,4,0,205332,0,0,0,0,0,0
,Os Guardadores vão com Wrathion.,228715,0,0,0,102,0,4,0,205333,0,0,0,0,0,0
,Graças aos céus.,228725,0,0,0,102,0,6,0,206150,0,0,0,0,0,0
,Mãe...,228726,0,0,0,102,0,6,0,205327,0,0,0,0,0,0
,[DNT] <Mirthful sigh.>,228728,0,0,0,102,0,6,0,211014,0,0,0,0,0,0
,Temos que partir do Recôndito.,228736,0,0,0,102,0,4,0,205331,0,0,0,0,0,0
,Agora!,228758,0,0,0,102,0,4,0,206919,0,0,0,0,0,0
,Que os ventos nos levem adiante! Os Jardins Esmeraldinos hão de tombar!,228759,0,0,0,102,0,4,0,206920,0,0,0,0,0,0
"Ah, jovem Wrathion. Eu lhe devo minha gratidão...",,228936,0,0,0,102,0,6,206247,0,0,0,0,0,0,0
Sua ajuda foi inestimável para garantir meu lugar no Trono Obsidiano.,,228937,0,0,0,102,0,6,206248,0,0,0,0,0,0,0
