Name_lang,Description_lang,ID,UiTextureAtlasElementID,TraitTreeID
Yellow [DNT],[DNT] This is a UI Engineering test SubTree.,9,18688,898
Pink [DNT],[DNT] This is a UI Engineering test SubTree.,10,4076,898
Blue [DNT],[DNT] This is a UI Engineering test SubTree.,11,4073,898
Red [DNT],[DNT] This is a UI Engineering test SubTree.,12,11358,898
UI Test Subtree 1,Descrição,16,11409,878
UI Test Subtree 2,Outra Descrição,17,0,880
Tececaos,"Tececaos dedicam-se ao estudo das origens da magia do Caos e estabelecem uma tênue conexão com ele. É um poder extremamente perigoso e volátil, que consome tudo no caminho.",18,26682,795
Arconte,"Arcontes são muito pios e têm uma ligação forte com a Luz e a Sombra. Com bênçãos de seres superiores, entram em um estado ascendido, o que os transforma na sua melhor versão.",19,27430,795
Oráculo,Oráculos vislumbram o futuro e usam isso para proteger e fortalecer aliados. A visão do futuro dá aos Oráculos a habilidade de conceder bênçãos e benefícios únicos aos aliados antes mesmo de precisarem.,20,26934,795
Druida da Garra,"Druidas da Garra dominam poderosas formas animais. Quando se transformam em gatos ou ursos, tornam-se ferozes combatentes e protetores da natureza.",21,26675,793
Espreitador Selvagem,"Espreitadores Selvagens vivem nas regiões remotas, caçando para perpetuar o ciclo de vida e morte e para destruir aqueles que despojam a natureza. Eles usam os poderes curativos para restaurar a vida a áreas inférteis.",22,26677,793
Guardião do Bosque,Os Guardiões do Bosque se inspiram nos poderosos filhos de Cenarius para proteger o equilíbrio da natureza e salvaguardar o Sonho. Canalizam o poder do Sonho para fortalecer os feitiços e evocar arvorosos fortalecidos para proteger os aliados e esmagar os inimigos.,23,26686,793
Escolhido de Eluna,"Os Escolhidos de Eluna se dedicam à Deusa de Lua e partilham de sua conexão com a lua e as estrelas. Evocam magias lunares potentes, e suas habilidades são imbuídas de poder astral.",24,26685,793
Causador de Dano,Brann abate inimigos de longe usando o Véio de Guerra.,29,24179,874
Curador,Brann usa os suprimentos médicos e relíquias coletadas para curar jogadores feridos.,30,24186,874
San'layn,Os San'layn são mestres no uso da magia sombria e sangrenta para enfraquecer os inimigos e fortalecer as próprias capacidades.,31,26673,750
Cavalgante do Apocalipse,"Cavalgantes do Apocalipse evocam o poder dos lendários Quatro Cavaleiros. Eles podem pedir ajuda aos Cavaleiros e usar os poderes da morte, da fome e da doença.",32,27222,750
Mortífero,"Torne-se um emissário da morte. Invista contra a alma dos inimigos com ataques alimentados pelas Terras Sombrias, e relembre-os do fim inevitável.",33,26672,750
Marcado por Vileza,Os Marcados pela Vileza aceitam o demônio interior e amplificam o poder explosivo do Fogo Vil que usam.,34,27066,854
Aniquilador Aldrachi,"Os guerreiros Aldrachi eram os supremos mestre das glaives e brandiam as lâminas com graça mortal, consumindo almas e imbuindo as armas em grande poder.",35,27132,854
Comandante-de-escama,"Comandantes-de-escama são líderes natos, capazes de inspirar todos a se aprimorar. São os generais escolhidos dos dracthyr e usam feitiços potencializados para comandar a batalha e evocar tropas.",36,27067,872
Moldachamas,"Moldachamas estão fortemente sintonizados com Alexstrasza e se especializam em proteger aliados, recuperação e renovação. Também têm a habilidade única de espalhar, intensificar e manipular chama de dragão.",37,27223,872
Cronoguarda,"Os Cronoguardas podem manipular o tempo, recebendo visões do futuro para acelerar seus ataques ou resgatando ecos do passado para revisitar ações. A especialização em magia bronze pode provocar instabilidades, devido aos muitos possíveis futuros que eles enxergam.",38,26678,872
Solfúria,"Ao abraçar chamas arcanas, magos Solfúria melhoram seus sortilégios mais devastadores, evocando uma fênix de fogo místico.",39,27133,658
Lançafeitiços,"Dominar a natureza da magia, inerentemente instável, permite que os Lançafeitiços estilhacem sua magia, criando novos efeitos potentes e voláteis.",40,27429,658
Fogofrio,"Magos de Fogofrio controlam forças elementais aparentemente incompatíveis. Com o domínio de forças opostas, melhoram seus ataques elementais, podendo aumentar seu poder ao combiná-los.",41,27017,658
Sentinela,"Sentinelas retiram poder das forças da natureza, causando mais dano Arcano com suas habilidades e evocando o poder da lua para semear destruição entre os inimigos.",42,27529,774
Líder da Alcateia,"Líderes da Alcateia formam um vínculo profundo com os companheiros animais e com a própria natureza, permitindo ao Caçador e à matilha caçar com coordenação brutal no campo de batalha e pedir ajuda a feras poderosas.",43,27068,774
Patrulheira Sombria,"Aceite o ódio ataque das sombras, atacando os inimigos com habilidades necróticas energizadas pela sombra. Inimigos que tombarem por suas habilidades fortalecerão ainda mais suas energias sombrias.",44,26679,774
Templário,Nada é capaz de tirar os Templários do caminho da justiça. Eles evocam martelos da Luz e desferem combinações devastadoras de ataques físicos e sagrados para derrotar os inimigos.,48,26681,790
Luminífice,"Luminífices têm um controle tão absoluto da Luz que são capazes de tangê-la, empregando constructos que aumentam o poder das suas armas e defesas e protegem aliados.",49,26680,790
Arauto do Sol,"Arautos do Sol têm uma profunda ligação com o astro e sua energia, que usam para queimar inimigos e cauterizar feridas de aliados. São capazes de produzir poderosos raios solares em comunhão total com a Luz.",50,26702,790
Trapaceiro,"Trapaceiros fazem uso de lâminas dardejantes e truques sujos em batalhas. Distraem os oponentes com fintas e floreios da espada, para executá-los com uma lâmina imprevista.",51,27018,852
Destinado,"Os Destinados se ufanam de ser a Mão do Destino, semeando o caos em planos elaborados. Guiados pelos caprichos de uma Moeda Destinada, levam a morte que o destino reservou aos seus inimigos.",52,27433,852
Sicário,"Sicários, os emissários da morte, atacam das sombras para eliminar seus alvos rapidamente.",53,27432,852
Totêmico,"Xamãs totêmicos são capazes de utilizar todo o poder de seus totens, fortalecendo-os e obtendo acesso a outros. A perícia em imbuição também ajuda a manter as ameaças ao alcance.",54,26703,786
Traztormenta,"Traztormentas usam o poder da tempestade para aumentar seu controle sobre os raios, moldando-os à própria vontade. Evoque uma tormenta feroz para lançar o caos nos inimigos, despertando a tempestade e causando destruição pelo caminho.",55,26683,786
Clarividente,"Domine sua magia espiritual para aprimorar o lançamento de feitiços e evocar os espíritos dos seus antepassados, ajudando você e seus aliados em combate.",56,27019,786
Ceifalmas,"Poucos compreendem o poder oculto nas almas, mas muitos conhecem a fome dos demônios pelas almas dos que sucumbem. Os Ceifalmas firmam pactos com demônios da Espiral Etérea, servindo como seus hospedeiros e alimentando-os com as almas de inimigos em troca de um incrível poder.",57,27530,720
Infernante,"Entre as seitas de sátiros de Azeroth, os Infernantes são a mais temida. Esses bruxos aceitaram corromper suas próprias almas para aprender a tecer as mais hediondas magias sombrias com a imprevisibilidade do fogo vil.",58,27746,720
Diabolista,A derrota da Legião libertou muitos demônios poderosos. Diabolistas comandam demônios superiores antes tidos como incontroláveis e empunham poderes abissais da Espiral Etérea no campo de batalha.,59,26935,720
Matador,Um guerreiro cruel que persegue os alvos de maneira implacável e se utiliza da brutalidade e do poder do aço para subjugar os inimigos.,60,26704,850
Thane da Montanha,"Thanes da Montanha são guerreiros destemidos que se dedicam a buscar desafiantes à altura. Usando a força da terra e o poder da tempestade, atropelam os inimigos com golpes poderosos e rápidos como o trovão.",61,26684,850
Colosso,"Tendo lutado em incontáveis batalhas, Colossos são capazes de resistir a ataques letais, usando sua experiência para desferir os golpes mais poderosos e destruir os inimigos.",62,26765,850
Conduto dos Celestiais,Condutos dos Celestiais se devotam aos ensinamentos dos Celestiais Majestosos para encarnar a sabedoria e brandir a força deles. Mestres Condutos canalizam brevemente o poder de todos os Celestiais de uma vez.,64,27069,1000
Shado-Pan,"Os Shado-Pans aprendem com seus ancestrais e enfrentam os inimigos com orgulho, em defesa dos amigos e da família. Reúnem seu poder pacientemente para desferir sequências de golpes que esmagam os oponentes.",65,27070,1000
Mestre da Harmonia,"Mestres da Harmonia buscam a perfeição física e o refinamento do corpo em pura força, permitindo manipular o fluxo de chi e os ciclos naturais do poder.",66,27745,1000
Traztormenta,"Traztormentas usam o poder da tempestade para aumentar seu controle sobre os raios, moldando-os à própria vontade. Evoque uma tormenta feroz para lançar o caos nos inimigos, despertando a tempestade e causando destruição pelo caminho.",70,26683,1033
Totêmico,"Xamãs totêmicos são capazes de utilizar todo o poder de seus totens, fortalecendo-os e obtendo acesso a outros. A perícia em imbuição também ajuda a manter as ameaças ao alcance.",71,26703,1033
Clarividente,"Domine sua magia espiritual para aprimorar o lançamento de feitiços e evocar os espíritos dos seus antepassados, ajudando você e seus aliados em combate.",72,27019,1033
Traztormenta,"Traztormentas usam o poder da tempestade para aumentar seu controle sobre os raios, moldando-os à própria vontade. Evoque uma tormenta feroz para lançar o caos nos inimigos, despertando a tempestade e causando destruição pelo caminho.",73,26683,1034
Totêmico,"Xamãs totêmicos são capazes de utilizar todo o poder de seus totens, fortalecendo-os e obtendo acesso a outros. A perícia em imbuição também ajuda a manter as ameaças ao alcance.",74,26703,1034
Clarividente,"Domine sua magia espiritual para aprimorar o lançamento de feitiços e evocar os espíritos dos seus antepassados, ajudando você e seus aliados em combate.",75,27019,1034
PH,Dano!,79,24179,1054
PH,Defensiva!,80,24199,1054
Tanque,"Brann recorre aos aliados, a tecnologia avançada recuperada e à sua escopeta de confiança para avançar contra as linhas de frente.",81,24199,874
Tanque,"Brann recorre aos aliados, a tecnologia avançada recuperada e à sua escopeta de confiança para avançar contra as linhas de frente.",82,24199,1060
Curador,Brann usa os suprimentos médicos e relíquias coletadas para curar jogadores feridos.,83,24186,1060
Causador de Dano,"Brann abate inimigos de longe, usando o Véio de Guerra.",84,24179,1060
Curador,Brann usa suprimentos médicos e relíquias coletadas para curar jogadores feridos.,98,24186,1151
Tanque,"Brann recorre aos aliados, à tecnologia avançada recuperada e à sua escopeta de confiança para avançar contra as linhas de frente.",99,24199,1151
Causador de Dano,Brann abate inimigos de longe usando o Véio de Guerra.,100,24179,1151
Malha de Placa,"Desajeitada, mas quase inquebrável.",104,0,775
Vestes,"Oferece pouca proteção, mas ajuda a concentrar a mente.",105,0,775
Malha de Anéis,"Armadura resistente, porém flexível.",106,0,775
