ID,Description_lang,Name_lang,ManagedWorldStateInputID,OrderIndex,ContributionStyleContainer,UiTextureAtlasMemberID[0],UiTextureAtlasMemberID[1],UiTextureAtlasMemberID[2],UiTextureAtlasMemberID[3]
1,Emplea energías arcanas para mover fuerzas de Legión caída rápidamente por las Islas Quebradas y descubrir agentes amenazantes de la Legión.,Torre de los magos,1,1,1,6325,6322,6324,6323
2,,,0,0,0,0,0,0,0
3,Una base de operaciones fortificadas donde los líderes del Salón de la orden pueden reunirse y planear sus ataques en toda la Costa Quebrada.,Centro de mando,2,2,1,6321,6318,6320,6319
4,Una antigua poza de la luna élfica con el poder para repeler la energía abisal que emana de la tumba y revelar secretos antes ocultos.,Disruptor abisal,3,3,1,6329,6326,6328,6327
11,Se acerca la batalla inevitable en las Tierras Altas de Arathi. Aporta suministros para los esfuerzos de guerra.,Batalla por Stromgarde,10,1,2,6321,6318,6320,6319
116,Se acerca la batalla inevitable en las Tierras Altas de Arathi. Aporta suministros para los esfuerzos de guerra.,Batalla por Stromgarde,115,1,2,6321,6318,6320,6319
117,Se acerca la batalla inevitable en Costa Oscura. Aporta suministros para los esfuerzos de guerra.,La batalla por Costa Oscura,116,1,2,6321,6318,6320,6319
118,Se acerca la batalla inevitable en Costa Oscura. Aporta suministros para los esfuerzos de guerra.,La batalla por Costa Oscura,117,1,2,6321,6318,6320,6319
119,¡Aporta cera a la colección de Mita para desbloquear nuevas recompensas!,Colección de cera,118,2,1,6321,6318,6320,6319
