FeatureName_lang,FeatureDescription_lang,ID,CovenantID,UiMapID,Crest,TransmogSetID0,TextureKit,MountID,PlayerChoiceResponseID,Field_9_0_1_33978_008,Field_9_0_1_34902_009,TransmogSetID1,TransmogSetID2,TransmogSetID3,FeatureTextureID
Senda de Ascensión,Un antiguo ritual de combate en el que debes guiar las tácticas de los campeones de Bastión para que pongan a prueba sus habilidades contra diversos enemigos poderosos.,2,1,1533,12342,2029,5283,1400,2708,11671,0,2015,2019,2023,3675496
El Vivero de la Reina,Un jardín sagrado donde puedes nutrir a las semillas silvestres de poderosas almas perdidas y prepararlas para su renacimiento.,5,3,1565,15898,2059,5305,1303,2707,11671,0,2047,2051,2055,3675494
Fábrica de Abominaciones,Este nexo del arte de forjacarne maldraxxi te permite construir nuevos compañeros para tus aventuras en las Tierras de las Sombras.,6,4,1536,15903,2043,5287,1368,2706,11671,0,2032,2035,2041,3675492
La Corte de Brasas,Ayuda a reconstruir la influencia del príncipe Renathal con la más venerada de las tradiciones venthyrianas: ¡ofrecer las fiestas más grandiosas! Ocúpate de los preparativos adecuados y recluta al personal indicado para impresionar a los invitados VIP de cada semana.,7,2,1525,12347,2075,5285,1299,2686,11671,0,2066,2070,2071,3675493
Cacerías,El Clan Shikaar se enorgullece de sus magníficas habilidades de caza y perfecciona sus habilidades continuamente para derribar a las grandes bestias de las Islas Dragón.,10,12,1533,12342,2029,5283,1400,3341,11671,0,2015,2019,2023,3675496
Búsqueda de tesoros,La Expedición Dragontina busca obtener los conocimientos y los tesoros de las Islas Dragón.,12,13,1533,12342,2029,5283,1400,3355,11671,0,2015,2019,2023,3854019
