ID,TutorialText_lang,TitleText_lang,Description_lang,ButtonText_lang,Field_9_1_5_40196_004_lang,ConfirmationQuestion_lang,Field_10_0_2_46479_006_lang,UiTextureKitID,OpenSoundKitID,CloseSoundKitID,Cost,ItemInteractionFrameType,InteractionSpellID,CurrencyTypeID,Field_8_3_0_32414_012,DropInSlotSoundKitID,TakeOutSlotSoundKitID,Field_10_0_2_46259_016
1,[PH] This is some text telling the player how to use this UI!,Limpiar reforjador,Elimina el beneficio y el efecto secundario de un objeto corrupto,Limpiar,,,,5272,115219,115220,32,0,13262,0,1,0,0,0
2,[PH] This is some text telling the player how to use this UI!,Limpiar reforjador,Elimina el beneficio y el efecto secundario de un objeto corrupto,Limpiar,,,,5272,115219,115220,32,0,0,0,2,8560,8560,0
3,"Coloca un objeto corrupto aquí y haz clic en ""Purificar"" para eliminar el efecto al equiparlo y la corrupción del objeto.",Purificación titánica,Elimina el efecto al equiparlo y la corrupción de un objeto corrupto,Purificar,,,,5272,115219,115220,5,0,0,1719,2,146817,146814,0
4,Destruye un objeto legendario para recuperar su esencia de alma,Tallarrunas,Recibirás:,Destruir,Destruye un objeto legendario para recuperar su esencia de alma,¿Deseas destruir para siempre este objeto legendario para recuperar su esencia de alma?,,5412,0,0,0,3,0,0,3,0,188155,0
5,Transforma un objeto normal en un objeto de conjunto,Catalizador de la creación,"Transforma un objeto en un objeto de conjunto. Solo los objetos para la cabeza, los hombros, el pecho, las manos y las piernas otorgan bonificaciones.",Transformar,Transforma un objeto normal en un objeto con bonificación de conjunto,¿Quieres gastar %s %s para mejorar este objeto? Mejorar este objeto provocará que se ligue.,Inserta un objeto de la temporada 4 de Shadowlands que cumpla con los requisitos,5429,0,0,1,47,0,2000,4,193474,193476,2
6,Transforma un objeto normal en un objeto de conjunto,Catalizador de reanimación,"Transforma un objeto en un objeto de conjunto. Solo los objetos para la cabeza, los hombros, el pecho, las manos y las piernas otorgan bonificaciones.",Transformar,Transforma un objeto normal en un objeto con bonificación de conjunto,¿Quieres gastar %s %s para mejorar este objeto? Mejorar este objeto provocará que se ligue.,Inserta un objeto de la temporada 1 de Dragonflight que cumpla con los requisitos,5429,0,0,1,31,0,2167,4,213971,213970,3
